
EDID (hex):
00ffffffffffff000e8f151100000000
1a1e0104b52213780edf50a35435b526
0f505400000001010101010101010101
01010101010150d000a0f0703e803020
350058c210000018a4a600a0f0703e80
3020350058c210000018000000fe0035
37383556804c4e2e56394a3000000000
000241033c001200000b010a202001c0
02030f00e3058000e606050176762000
00000000000000000000000000000000
00000000000000000000000000000000
00000000000000000000000000000000
00000000000000000000000000000000
00000000000000000000000000000000
00000000000000000000000000000000
00000000000000000000000000000086

edid-decode (hex):

00 ff ff ff ff ff ff 00 0e 8f 15 11 00 00 00 00
1a 1e 01 04 b5 22 13 78 0e df 50 a3 54 35 b5 26
0f 50 54 00 00 00 01 01 01 01 01 01 01 01 01 01
01 01 01 01 01 01 50 d0 00 a0 f0 70 3e 80 30 20
35 00 58 c2 10 00 00 18 a4 a6 00 a0 f0 70 3e 80
30 20 35 00 58 c2 10 00 00 18 00 00 00 fe 00 35
37 38 35 56 80 4c 4e 2e 56 39 4a 30 00 00 00 00
00 02 41 03 3c 00 12 00 00 0b 01 0a 20 20 01 c0

02 03 0f 00 e3 05 80 00 e6 06 05 01 76 76 20 00
00 00 00 00 00 00 00 00 00 00 00 00 00 00 00 00
00 00 00 00 00 00 00 00 00 00 00 00 00 00 00 00
00 00 00 00 00 00 00 00 00 00 00 00 00 00 00 00
00 00 00 00 00 00 00 00 00 00 00 00 00 00 00 00
00 00 00 00 00 00 00 00 00 00 00 00 00 00 00 00
00 00 00 00 00 00 00 00 00 00 00 00 00 00 00 00
00 00 00 00 00 00 00 00 00 00 00 00 00 00 00 86

----------------

Block 0, Base EDID:
  EDID Structure Version & Revision: 1.4
  Vendor & Product Identification:
    Manufacturer: CTO
    Model: 4373
    Made in: week 26 of 2020
  Basic Display Parameters & Features:
    Digital display
    Bits per primary color channel: 10
    DisplayPort interface
    Maximum image size: 34 cm x 19 cm
    Gamma: 2.20
    Supported color formats: RGB 4:4:4, YCrCb 4:4:4
    Default (sRGB) color space is primary color space
    First detailed timing includes the native pixel format and preferred refresh rate
  Color Characteristics:
    Red  : 0.6396, 0.3291
    Green: 0.2099, 0.7099
    Blue : 0.1494, 0.0595
    White: 0.3125, 0.3281
  Established Timings I & II: none
  Standard Timings: none
  Detailed Timing Descriptors:
    DTD 1:  3840x2160   60.000000 Hz  16:9    133.320 kHz    533.280000 MHz (344 mm x 194 mm)
                 Hfront   48 Hsync  32 Hback   80 Hpol N
                 Vfront    3 Vsync   5 Vback   54 Vpol N
    DTD 2:  3840x2160   47.997300 Hz  16:9    106.650 kHz    426.600000 MHz (344 mm x 194 mm)
                 Hfront   48 Hsync  32 Hback   80 Hpol N
                 Vfront    3 Vsync   5 Vback   54 Vpol N
    Alphanumeric Data String: '5785V'
    Manufacturer-Specified Display Descriptor (0x00): 00 00 00 02 41 03 3c 00 12 00 00 0b 01 0a 20 20 '....A.<.......  '
  Extension blocks: 1
Checksum: 0xc0

----------------

Block 1, CTA-861 Extension Block:
  Revision: 3
  Native detailed modes: 0
  Colorimetry Data Block:
    BT2020RGB
  HDR Static Metadata Data Block:
    Electro optical transfer functions:
      Traditional gamma - SDR luminance range
      SMPTE ST2084
    Supported static metadata descriptors:
      Static metadata type 1
    Desired content max luminance: 118 (644.196 cd/m^2)
    Desired content max frame-average luminance: 118 (644.196 cd/m^2)
    Desired content min luminance: 32 (0.101 cd/m^2)
Checksum: 0x86  Unused space in Extension Block: 112 bytes
