
EDID (hex):
00ffffffffffff001e6dd95664d60000
0513010380351e78eaaec5a2574a9c25
125054a76b80b30081808140714f0101
0101010101011a3680a070381f403020
3500132b2100001a023a801871382d40
582c4500132b2100001e000000fd0038
4b1e530f000a202020202020000000fc
0057323434320a20202020202020004d

Extracted contents:
header:          00 ff ff ff ff ff ff 00
serial number:   1e 6d d9 56 64 d6 00 00 05 13
version:         01 03
basic params:    80 35 1e 78 ea
chroma info:     ae c5 a2 57 4a 9c 25 12 50 54
established:     a7 6b 80
standard:        b3 00 81 80 81 40 71 4f 01 01 01 01 01 01 01 01
descriptor 1:    1a 36 80 a0 70 38 1f 40 30 20 35 00 13 2b 21 00 00 1a
descriptor 2:    02 3a 80 18 71 38 2d 40 58 2c 45 00 13 2b 21 00 00 1e
descriptor 3:    00 00 00 fd 00 38 4b 1e 53 0f 00 0a 20 20 20 20 20 20
descriptor 4:    00 00 00 fc 00 57 32 34 34 32 0a 20 20 20 20 20 20 20
extensions:      00
checksum:        4d

Manufacturer: GSM Model 56d9 Serial Number --
Made week 5 of 2009
EDID version: 1.3
Digital display
Maximum image size: 53 cm x 30 cm
Gamma: 2.20
DPMS levels: Standby Suspend Off
Supported color formats: RGB 4:4:4, YCrCb 4:2:2
First detailed timing is preferred timing
Established timings supported:
  720x400@70Hz
  640x480@60Hz
  640x480@75Hz
  800x600@56Hz
  800x600@60Hz
  800x600@75Hz
  832x624@75Hz
  1024x768@60Hz
  1024x768@75Hz
  1280x1024@75Hz
  1152x870@75Hz
Standard timings supported:
  1680x1050@60Hz
  1280x1024@60Hz
  1280x960@60Hz
  1152x864@75Hz
Detailed mode: Clock 138.500 MHz, 531 mm x 299 mm
               1920 1968 2000 2080 hborder 0
               1080 1083 1088 1111 vborder 0
               +hsync -vsync 
Detailed mode: Clock 148.500 MHz, 531 mm x 299 mm
               1920 2008 2052 2200 hborder 0
               1080 1084 1089 1125 vborder 0
               +hsync +vsync 
Monitor ranges (GTF): 56-75Hz V, 30-83kHz H, max dotclock 150MHz
Monitor name: W2442
Checksum: 0x4d (valid)
