
EDID (hex):
00ffffffffffff004ca3453300000000
000e0103802115780a87f594574f8c27
27505400000001010101010101010101
010101010101ee1a0080502010301030
13004bcf100000190000000f00000000
00000000002387026401000000fe0053
414d53554e470a2020202020000000fe
004c544e31353458332d4c30310a0068

Extracted contents:
header:          00 ff ff ff ff ff ff 00
serial number:   4c a3 45 33 00 00 00 00 00 0e
version:         01 03
basic params:    80 21 15 78 0a
chroma info:     87 f5 94 57 4f 8c 27 27 50 54
established:     00 00 00
standard:        01 01 01 01 01 01 01 01 01 01 01 01 01 01 01 01
descriptor 1:    ee 1a 00 80 50 20 10 30 10 30 13 00 4b cf 10 00 00 19
descriptor 2:    00 00 00 0f 00 00 00 00 00 00 00 00 00 23 87 02 64 01
descriptor 3:    00 00 00 fe 00 53 41 4d 53 55 4e 47 0a 20 20 20 20 20
descriptor 4:    00 00 00 fe 00 4c 54 4e 31 35 34 58 33 2d 4c 30 31 0a
extensions:      00
checksum:        68

Manufacturer: SEC Model 3345 Serial Number --
EDID version: 1.3
Digital display
Maximum image size: 33 cm x 21 cm
Gamma: 2.20
Supported color formats: RGB 4:4:4, YCrCb 4:2:2
First detailed timing is preferred timing
Established timings supported:
Standard timings supported:
Detailed mode: Clock 68.940 MHz, 331 mm x 207 mm
               1280 1296 1344 1408 hborder 0
                800  801  804  816 vborder 0
               -hsync -vsync 
Manufacturer-specified data, tag 15
ASCII string: SAMSUNG
ASCII string: LTN154X3
Checksum: 0x68 (valid)
EDID block does NOT conform to EDID 1.3!
	Missing name descriptor
	Missing monitor ranges
	Detailed block string not properly terminated
EDID block does not conform at all!
	Bad year of manufacture
