
EDID (hex):
00ffffffffffff0025e4061701010101
2e15010380331d782e01f5a257529f27
0a505430000001010101010101010101
010101010101023a801871382d40582c
4500fe1f1100001e000000fd0037431f
530f000a202020202020000000ff0047
354d303030333732375a520a000000fc
004c43442d4d46323334580a202001bd
020322724f0102030405060790111213
1415169f230907078301000065030c00
1000011d8018711c1620582c2500fe1f
1100009e011d007251d01e206e285500
fe1f1100001e8c0ad08a20e02d10103e
9600fe1f110000180000000000000000
00000000000000000000000000000000
000000000000000000000000000000ab

Extracted contents:
header:          00 ff ff ff ff ff ff 00
serial number:   25 e4 06 17 01 01 01 01 2e 15
version:         01 03
basic params:    80 33 1d 78 2e
chroma info:     01 f5 a2 57 52 9f 27 0a 50 54
established:     30 00 00
standard:        01 01 01 01 01 01 01 01 01 01 01 01 01 01 01 01
descriptor 1:    02 3a 80 18 71 38 2d 40 58 2c 45 00 fe 1f 11 00 00 1e
descriptor 2:    00 00 00 fd 00 37 43 1f 53 0f 00 0a 20 20 20 20 20 20
descriptor 3:    00 00 00 ff 00 47 35 4d 30 30 30 33 37 32 37 5a 52 0a
descriptor 4:    00 00 00 fc 00 4c 43 44 2d 4d 46 32 33 34 58 0a 20 20
extensions:      01
checksum:        bd

Manufacturer: IOD Model 1706 Serial Number --
Made week 46 of 2011
EDID version: 1.3
Digital display
Maximum image size: 51 cm x 29 cm
Gamma: 2.20
DPMS levels: Off
Supported color formats: RGB 4:4:4, YCrCb 4:2:2
Default (sRGB) color space is primary color space
First detailed timing is preferred timing
Established timings supported:
  640x480@60Hz
  640x480@67Hz
Standard timings supported:
Detailed mode: Clock 148.500 MHz, 510 mm x 287 mm
               1920 2008 2052 2200 hborder 0
               1080 1084 1089 1125 vborder 0
               +hsync +vsync 
Monitor ranges (GTF): 55-67Hz V, 31-83kHz H, max dotclock 150MHz
Serial number: --
Monitor name: LCD
Has 1 extension blocks
Checksum: 0xbd (valid)

CEA extension block
Extension version: 3
30 bytes of CEA data
  Video data block
    VIC 01 640x480@60Hz 
    VIC 02 720x480@60Hz 
    VIC 03 720x480@60Hz 
    VIC 04 1280x720@60Hz 
    VIC 05 1920x1080i@60Hz 
    VIC 06 1440x480i@60Hz 
    VIC 07 1440x480i@60Hz 
    VIC 16 1920x1080@60Hz (native)
    VIC 17 720x576@50Hz 
    VIC 18 720x576@50Hz 
    VIC 19 1280x720@50Hz 
    VIC 20 1920x1080i@50Hz 
    VIC 21 1440x576i@50Hz 
    VIC 22 1440x576i@50Hz 
    VIC 31 1920x1080@50Hz (native)
  Audio data block
    Linear PCM, max channels 1
    Supported sample rates (kHz): 48 44.1 32
    Supported sample sizes (bits): 24 20 16
  Speaker allocation data block
  Vendor-specific data block, OUI 000c03 (HDMI)
    Source physical address 1.0.0.0
Basic audio support
Supports YCbCr 4:4:4
Supports YCbCr 4:2:2
2 native detailed modes
Detailed mode: Clock 74.250 MHz, 510 mm x 287 mm
               1920 2008 2052 2200 hborder 0
                540  542  547  562 vborder 0
               +hsync +vsync interlaced 
Detailed mode: Clock 74.250 MHz, 510 mm x 287 mm
               1280 1390 1430 1650 hborder 0
                720  725  730  750 vborder 0
               +hsync +vsync 
Detailed mode: Clock 27.000 MHz, 510 mm x 287 mm
                720  736  798  858 hborder 0
                480  489  495  525 vborder 0
               -hsync -vsync 
Checksum: 0xab (valid)

EDID block does NOT conform to EDID 1.3!
	Detailed block string not properly terminated


