
EDID (hex):
00ffffffffffff001e5200240a1a0000
241a010380341f78ead6a5a2594a9524
145054a1080081008140a90061408180
81c09500b300023a801871382d40582c
450070cf1000001e312e400062842230
58a83500c4fe1000001c662150b05100
1b3040703400c4fe1000001e000000fc
004752430a20202020202020202000d4

Extracted contents:
header:          00 ff ff ff ff ff ff 00
serial number:   1e 52 00 24 0a 1a 00 00 24 1a
version:         01 03
basic params:    80 34 1f 78 ea
chroma info:     d6 a5 a2 59 4a 95 24 14 50 54
established:     a1 08 00
standard:        81 00 81 40 a9 00 61 40 81 80 81 c0 95 00 b3 00
descriptor 1:    02 3a 80 18 71 38 2d 40 58 2c 45 00 70 cf 10 00 00 1e
descriptor 2:    31 2e 40 00 62 84 22 30 58 a8 35 00 c4 fe 10 00 00 1c
descriptor 3:    66 21 50 b0 51 00 1b 30 40 70 34 00 c4 fe 10 00 00 1e
descriptor 4:    00 00 00 fc 00 47 52 43 0a 20 20 20 20 20 20 20 20 20
extensions:      00
checksum:        d4

EDID version: 1.3
Manufacturer: GRR Model 2400 Serial Number --
Made in week 36 of 2016
Digital display
Maximum image size: 52 cm x 31 cm
Gamma: 2.20
DPMS levels: Standby Suspend Off
RGB color display
First detailed timing is preferred timing
Display x,y Chromaticity:
  Red:   0.6357, 0.3486
  Green: 0.2900, 0.5839
  Blue:  0.1425, 0.0800
  White: 0.3134, 0.3291
Established timings supported:
  720x400@70Hz 9:5 HorFreq: 31469 Hz Clock: 28.320 MHz
  640x480@60Hz 4:3 HorFreq: 31469 Hz Clock: 25.175 MHz
  800x600@60Hz 4:3 HorFreq: 37900 Hz Clock: 40.000 MHz
  1024x768@60Hz 4:3 HorFreq: 48400 Hz Clock: 65.000 MHz
Standard timings supported:
  1280x800@60Hz 16:10
  1280x960@60Hz 4:3 HorFreq: 60000 Hz Clock: 108.000 MHz
  1600x1000@60Hz 16:10
  1024x768@60Hz 4:3 HorFreq: 48400 Hz Clock: 65.000 MHz
  1280x1024@60Hz 5:4 HorFreq: 64000 Hz Clock: 108.000 MHz
  1280x720@60Hz 16:9
  1440x900@60Hz 16:10 HorFreq: 55500 Hz Clock: 88.750 MHz
  1680x1050@60Hz 16:10 HorFreq: 64700 Hz Clock: 119.000 MHz
Detailed mode: Clock 148.500 MHz, 368 mm x 207 mm
               1920 2008 2052 2200 hborder 0
               1080 1084 1089 1125 vborder 0
               +hsync +vsync 
               VertFreq: 60 Hz, HorFreq: 67500 Hz
Detailed mode: Clock 118.250 MHz, 452 mm x 254 mm
               1600 1688 1856 2112 hborder 0
                900  903  908  934 vborder 0
               -hsync +vsync 
               VertFreq: 59 Hz, HorFreq: 55989 Hz
Detailed mode: Clock 85.500 MHz, 452 mm x 254 mm
               1360 1424 1536 1792 hborder 0
                768  771  775  795 vborder 0
               +hsync +vsync 
               VertFreq: 60 Hz, HorFreq: 47712 Hz
Monitor name: GRC
Checksum: 0xd4 (valid)
EDID block does NOT conform to EDID 1.3!
	Missing monitor ranges
