
EDID (hex):
00ffffffffffff000daec91400000000
081a0104951f11780228659759548e27
1e505400000001010101010101010101
010101010101b43b804a71383440503c
680035ad10000018000000fe004e3134
304843412d4541420a20000000fe0043
4d4e0a202020202020202020000000fe
004e3134304843412d4541420a20003e

Extracted contents:
header:          00 ff ff ff ff ff ff 00
serial number:   0d ae c9 14 00 00 00 00 08 1a
version:         01 04
basic params:    95 1f 11 78 02
chroma info:     28 65 97 59 54 8e 27 1e 50 54
established:     00 00 00
standard:        01 01 01 01 01 01 01 01 01 01 01 01 01 01 01 01
descriptor 1:    b4 3b 80 4a 71 38 34 40 50 3c 68 00 35 ad 10 00 00 18
descriptor 2:    00 00 00 fe 00 4e 31 34 30 48 43 41 2d 45 41 42 0a 20
descriptor 3:    00 00 00 fe 00 43 4d 4e 0a 20 20 20 20 20 20 20 20 20
descriptor 4:    00 00 00 fe 00 4e 31 34 30 48 43 41 2d 45 41 42 0a 20
extensions:      00
checksum:        3e

Manufacturer: CMN Model 14c9 Serial Number --
Made week 8 of 2016
EDID version: 1.4
Digital display
6 bits per primary color channel
DisplayPort interface
Maximum image size: 31 cm x 17 cm
Gamma: 2.20
Supported color formats: RGB 4:4:4
First detailed timing is preferred timing
Established timings supported:
Standard timings supported:
Detailed mode: Clock 152.840 MHz, 309 mm x 173 mm
               1920 2000 2060 2250 hborder 0
               1080 1086 1094 1132 vborder 0
               -hsync -vsync 
ASCII string: N140HCA
ASCII string: CMN
ASCII string: N140HCA
Checksum: 0x3e (valid)
EDID block does NOT conform to EDID 1.3!
	Missing name descriptor
	Missing monitor ranges
	Detailed block string not properly terminated
