
EDID (hex):
00ffffffffffff0038704d0000000000
331d0104a5221378036850985c588e28
1b505400000001010101010101010101
010101010101918a8004713832403020
350058c21000001abd39800471383240
3020350058c21000001a000000fd0030
909a9a23010a202020202020000000fe
004c4d3135364c462d324630310a0049

edid-decode (hex):

00 ff ff ff ff ff ff 00 38 70 4d 00 00 00 00 00
33 1d 01 04 a5 22 13 78 03 68 50 98 5c 58 8e 28
1b 50 54 00 00 00 01 01 01 01 01 01 01 01 01 01
01 01 01 01 01 01 91 8a 80 04 71 38 32 40 30 20
35 00 58 c2 10 00 00 1a bd 39 80 04 71 38 32 40
30 20 35 00 58 c2 10 00 00 1a 00 00 00 fd 00 30
90 9a 9a 23 01 0a 20 20 20 20 20 20 00 00 00 fe
00 4c 4d 31 35 36 4c 46 2d 32 46 30 31 0a 00 49

----------------

Block 0, Base EDID:
  EDID Structure Version & Revision: 1.4
  Vendor & Product Identification:
    Manufacturer: NCP
    Model: 77
    Made in: week 51 of 2019
  Basic Display Parameters & Features:
    Digital display
    Bits per primary color channel: 8
    DisplayPort interface
    Maximum image size: 34 cm x 19 cm
    Gamma: 2.20
    Supported color formats: RGB 4:4:4
    First detailed timing includes the native pixel format and preferred refresh rate
    Display is continuous frequency
  Color Characteristics:
    Red  : 0.5947, 0.3613
    Green: 0.3457, 0.5546
    Blue : 0.1572, 0.1064
    White: 0.3125, 0.3281
  Established Timings I & II: none
  Standard Timings: none
  Detailed Timing Descriptors:
    DTD 1:  1920x1080  144.000162 Hz  16:9    162.720 kHz    354.730000 MHz (344 mm x 194 mm)
                 Hfront   48 Hsync  32 Hback  180 Hpol P
                 Vfront    3 Vsync   5 Vback   42 Vpol N
    DTD 2:  1920x1080   60.002436 Hz  16:9     67.803 kHz    147.810000 MHz (344 mm x 194 mm)
                 Hfront   48 Hsync  32 Hback  180 Hpol P
                 Vfront    3 Vsync   5 Vback   42 Vpol N
    Display Range Limits:
      Monitor ranges (Bare Limits): 48-144 Hz V, 154-154 kHz H, max dotclock 350 MHz
    Alphanumeric Data String: 'LM156LF-2F01'
Checksum: 0x49
