
EDID (hex):
00ffffffffffff0009e5f50500000000
01170104951c10780ab0909758549226
1d505400000001010101010101010101
010101010101641b5677500013303020
4400159c1000001a8417568051005c30
64644405159c1000001a000000000000
00000000000000000000000000000002
000c47f90b3c700f1516720000000079

Extracted contents:
header:          00 ff ff ff ff ff ff 00
serial number:   09 e5 f5 05 00 00 00 00 01 17
version:         01 04
basic params:    95 1c 10 78 0a
chroma info:     b0 90 97 58 54 92 26 1d 50 54
established:     00 00 00
standard:        01 01 01 01 01 01 01 01 01 01 01 01 01 01 01 01
descriptor 1:    64 1b 56 77 50 00 13 30 30 20 44 00 15 9c 10 00 00 1a
descriptor 2:    84 17 56 80 51 00 5c 30 64 64 44 05 15 9c 10 00 00 1a
descriptor 3:    00 00 00 00 00 00 00 00 00 00 00 00 00 00 00 00 00 00
descriptor 4:    00 00 00 02 00 0c 47 f9 0b 3c 70 0f 15 16 72 00 00 00
extensions:      00
checksum:        79

Manufacturer: BOE Model 5f5 Serial Number --
Made week 1 of 2013
EDID version: 1.4
Digital display
6 bits per primary color channel
DisplayPort interface
Maximum image size: 28 cm x 16 cm
Gamma: 2.20
Supported color formats: RGB 4:4:4, YCrCb 4:2:2
First detailed timing is preferred timing
Established timings supported:
Standard timings supported:
Detailed mode: Clock 70.120 MHz, 277 mm x 156 mm
               1366 1414 1446 1485 hborder 0
                768  772  776  787 vborder 0
               +hsync -vsync 
Detailed mode: Clock 60.200 MHz, 277 mm x 156 mm
               1366 1466 1566 1750 hborder 0
                768  788  808  860 vborder 0
               +hsync -vsync 
Manufacturer-specified data, tag 0
Manufacturer-specified data, tag 2
Checksum: 0x79 (valid)
EDID block does NOT conform to EDID 1.3!
	Missing name descriptor
	Missing monitor ranges
