
EDID (hex):
00ffffffffffff000db4042700000000
30200104b53c22783ffcb9ae4e34be26
0c5055adcf00d1c08180714fa9c0b300
b33cd1fc95004dd000a0f0703e803020
8a0055502100001a000000fd0c30a0ff
ff95010a202020202020000000fc0047
5032372d4655530a20202020000000ff
00303030303030303030303030310267
020334f123097f07830100004b900403
0112131f3f617600e2007fe305c000e6
0607019383216d1a0000020b30a00004
920c920c98e200a0a0a0295030203500
00000000001e2c39a0205384bd3068b0
360055502100001e98ad00a0f0703e80
30208a00584a2100001e000000000000
0000000000000000000000000000003c
7012790300030128580a0204ff0e6701
2f801f006f083200020004008f3d0284
ff0e67012f801f006f08180002000400
00000000000000000000000000000000
00000000000000000000000000000000
00000000000000000000000000000000
00000000000000000000000000000000
0000000000000000000000000000c290

edid-decode (hex):

00 ff ff ff ff ff ff 00 0d b4 04 27 00 00 00 00
30 20 01 04 b5 3c 22 78 3f fc b9 ae 4e 34 be 26
0c 50 55 ad cf 00 d1 c0 81 80 71 4f a9 c0 b3 00
b3 3c d1 fc 95 00 4d d0 00 a0 f0 70 3e 80 30 20
8a 00 55 50 21 00 00 1a 00 00 00 fd 0c 30 a0 ff
ff 95 01 0a 20 20 20 20 20 20 00 00 00 fc 00 47
50 32 37 2d 46 55 53 0a 20 20 20 20 00 00 00 ff
00 30 30 30 30 30 30 30 30 30 30 30 30 31 02 67

02 03 34 f1 23 09 7f 07 83 01 00 00 4b 90 04 03
01 12 13 1f 3f 61 76 00 e2 00 7f e3 05 c0 00 e6
06 07 01 93 83 21 6d 1a 00 00 02 0b 30 a0 00 04
92 0c 92 0c 98 e2 00 a0 a0 a0 29 50 30 20 35 00
00 00 00 00 00 1e 2c 39 a0 20 53 84 bd 30 68 b0
36 00 55 50 21 00 00 1e 98 ad 00 a0 f0 70 3e 80
30 20 8a 00 58 4a 21 00 00 1e 00 00 00 00 00 00
00 00 00 00 00 00 00 00 00 00 00 00 00 00 00 3c

70 12 79 03 00 03 01 28 58 0a 02 04 ff 0e 67 01
2f 80 1f 00 6f 08 32 00 02 00 04 00 8f 3d 02 84
ff 0e 67 01 2f 80 1f 00 6f 08 18 00 02 00 04 00
00 00 00 00 00 00 00 00 00 00 00 00 00 00 00 00
00 00 00 00 00 00 00 00 00 00 00 00 00 00 00 00
00 00 00 00 00 00 00 00 00 00 00 00 00 00 00 00
00 00 00 00 00 00 00 00 00 00 00 00 00 00 00 00
00 00 00 00 00 00 00 00 00 00 00 00 00 00 c2 90

----------------

Block 0, Base EDID:
  EDID Structure Version & Revision: 1.4
  Vendor & Product Identification:
    Manufacturer: CMT
    Model: 9988
    Made in: week 48 of 2022
  Basic Display Parameters & Features:
    Digital display
    Bits per primary color channel: 10
    DisplayPort interface
    Maximum image size: 60 cm x 34 cm
    Gamma: 2.20
    DPMS levels: Off
    Supported color formats: RGB 4:4:4, YCrCb 4:4:4, YCrCb 4:2:2
    Default (sRGB) color space is primary color space
    First detailed timing includes the native pixel format and preferred refresh rate
    Display is continuous frequency
  Color Characteristics:
    Red  : 0.6826, 0.3076
    Green: 0.2060, 0.7421
    Blue : 0.1503, 0.0498
    White: 0.3144, 0.3330
  Established Timings I & II:
    IBM     :   720x400    70.081663 Hz   9:5     31.467 kHz     28.320000 MHz
    DMT 0x04:   640x480    59.940476 Hz   4:3     31.469 kHz     25.175000 MHz
    DMT 0x05:   640x480    72.808802 Hz   4:3     37.861 kHz     31.500000 MHz
    DMT 0x06:   640x480    75.000000 Hz   4:3     37.500 kHz     31.500000 MHz
    DMT 0x09:   800x600    60.316541 Hz   4:3     37.879 kHz     40.000000 MHz
    DMT 0x0a:   800x600    72.187572 Hz   4:3     48.077 kHz     50.000000 MHz
    DMT 0x0b:   800x600    75.000000 Hz   4:3     46.875 kHz     49.500000 MHz
    DMT 0x10:  1024x768    60.003840 Hz   4:3     48.363 kHz     65.000000 MHz
    DMT 0x11:  1024x768    70.069359 Hz   4:3     56.476 kHz     75.000000 MHz
    DMT 0x12:  1024x768    75.028582 Hz   4:3     60.023 kHz     78.750000 MHz
    DMT 0x24:  1280x1024   75.024675 Hz   5:4     79.976 kHz    135.000000 MHz
  Standard Timings:
    DMT 0x52:  1920x1080   60.000000 Hz  16:9     67.500 kHz    148.500000 MHz
    DMT 0x23:  1280x1024   60.019740 Hz   5:4     63.981 kHz    108.000000 MHz
    DMT 0x15:  1152x864    75.000000 Hz   4:3     67.500 kHz    108.000000 MHz
    DMT 0x53:  1600x900    60.000000 Hz  16:9     60.000 kHz    108.000000 MHz (RB)
    DMT 0x3a:  1680x1050   59.954250 Hz  16:10    65.290 kHz    146.250000 MHz
    GTF     :  1680x1050  120.000000 Hz  16:10   135.000 kHz    313.200000 MHz
    GTF     :  1920x1080  119.999987 Hz  16:9    138.840 kHz    368.759000 MHz
    DMT 0x2f:  1440x900    59.887445 Hz  16:10    55.935 kHz    106.500000 MHz
  Detailed Timing Descriptors:
    DTD 1:  3840x2160   59.996625 Hz  16:9    133.312 kHz    533.250000 MHz (597 mm x 336 mm)
                 Hfront   48 Hsync  32 Hback   80 Hpol P
                 Vfront    8 Vsync  10 Vback   44 Vpol N
    Display Range Limits:
      Monitor ranges (Bare Limits): 48-160 Hz V, 510-510 kHz H, max dotclock 1490 MHz
    Display Product Name: 'GP27-FUS'
    Display Product Serial Number: '0000000000001'
  Extension blocks: 2
Checksum: 0x67

----------------

Block 1, CTA-861 Extension Block:
  Revision: 3
  Underscans IT Video Formats by default
  Basic audio support
  Supports YCbCr 4:4:4
  Supports YCbCr 4:2:2
  Native detailed modes: 1
  Audio Data Block:
    Linear PCM:
      Max channels: 2
      Supported sample rates (kHz): 192 176.4 96 88.2 48 44.1 32
      Supported sample sizes (bits): 24 20 16
  Speaker Allocation Data Block:
    FL/FR - Front Left/Right
  Video Data Block:
    VIC  16:  1920x1080   60.000000 Hz  16:9     67.500 kHz    148.500000 MHz (native)
    VIC   4:  1280x720    60.000000 Hz  16:9     45.000 kHz     74.250000 MHz
    VIC   3:   720x480    59.940060 Hz  16:9     31.469 kHz     27.000000 MHz
    VIC   1:   640x480    59.940476 Hz   4:3     31.469 kHz     25.175000 MHz
    VIC  18:   720x576    50.000000 Hz  16:9     31.250 kHz     27.000000 MHz
    VIC  19:  1280x720    50.000000 Hz  16:9     37.500 kHz     74.250000 MHz
    VIC  31:  1920x1080   50.000000 Hz  16:9     56.250 kHz    148.500000 MHz
    VIC  63:  1920x1080  120.000000 Hz  16:9    135.000 kHz    297.000000 MHz
    VIC  97:  3840x2160   60.000000 Hz  16:9    135.000 kHz    594.000000 MHz
    VIC 118:  3840x2160  120.000000 Hz  16:9    270.000 kHz   1188.000000 MHz
  Video Capability Data Block:
    YCbCr quantization: No Data
    RGB quantization: Selectable (via AVI Q)
    PT scan behavior: Supports both over- and underscan
    IT scan behavior: Supports both over- and underscan
    CE scan behavior: Supports both over- and underscan
  Colorimetry Data Block:
    BT2020YCC
    BT2020RGB
  HDR Static Metadata Data Block:
    Electro optical transfer functions:
      Traditional gamma - SDR luminance range
      Traditional gamma - HDR luminance range
      SMPTE ST2084
    Supported static metadata descriptors:
      Static metadata type 1
    Desired content max luminance: 147 (1207.332 cd/m^2)
    Desired content max frame-average luminance: 131 (853.712 cd/m^2)
    Desired content min luminance: 33 (0.202 cd/m^2)
  Vendor-Specific Data Block (AMD), OUI 00-00-1A:
    Version: 2.11
    Minimum Refresh Rate: 48 Hz
    Maximum Refresh Rate: 160 Hz
    Flags 1.x: 0x00
    Flags 2.x: 0x04
    Maximum luminance: 146 (1181.461 cd/m^2)
    Minimum luminance: 12 (0.026 cd/m^2)
    Maximum luminance (without local dimming): 146 (1181.461 cd/m^2)
    Minimum luminance (without local dimming): 12 (0.026 cd/m^2)
  Detailed Timing Descriptors:
    DTD 2:  2560x1440  144.000477 Hz  16:9    213.265 kHz    580.080000 MHz
                 Hfront   48 Hsync  32 Hback   80 Hpol P
                 Vfront    3 Vsync   5 Vback   33 Vpol P
    DTD 3:  1440x900    59.999344 Hz  16:10    65.339 kHz    146.360000 MHz (597 mm x 336 mm)
                 Hfront  104 Hsync 176 Hback  520 Hpol P
                 Vfront    3 Vsync   6 Vback  180 Vpol P
    DTD 4:  3840x2160   50.000000 Hz  16:9    111.100 kHz    444.400000 MHz (600 mm x 330 mm)
                 Hfront   48 Hsync  32 Hback   80 Hpol P
                 Vfront    8 Vsync  10 Vback   44 Vpol P
Checksum: 0x3c  Unused space in Extension Block: 21 bytes

----------------

Block 2, DisplayID Extension Block:
  Version: 1.2
  Extension Count: 0
  Display Product Type: Standalone display device
  Video Timing Modes Type 1 - Detailed Timings Data Block:
    DTD:  3840x2160  143.999698 Hz  16:9    318.383 kHz   1337.210000 MHz (aspect 16:9, no 3D stereo)
               Hfront   48 Hsync  32 Hback  280 Hpol P
               Vfront    3 Vsync   5 Vback   43 Vpol N
    DTD:  3840x2160  160.000000 Hz  16:9    349.600 kHz   1468.320000 MHz (aspect 16:9, no 3D stereo, preferred)
               Hfront   48 Hsync  32 Hback  280 Hpol P
               Vfront    3 Vsync   5 Vback   17 Vpol N
  Checksum: 0xc2
Checksum: 0x90
