edid-decode (hex):

00 ff ff ff ff ff ff 00 15 c3 71 30 44 a2 bd 01
18 1e 01 03 80 3c 22 78 ea 5c b5 af 4f 35 b5 26
0c 50 54 a1 08 00 a9 40 81 80 81 40 d1 c0 01 01
01 01 01 01 01 01 56 5e 00 a0 a0 a0 29 50 30 20
35 00 55 50 21 00 00 1a 28 3c 80 a0 70 b0 23 40
30 20 36 00 55 50 21 00 00 1a 00 00 00 fd 00 17
3d 0f 59 19 00 0a 20 20 20 20 20 20 00 00 00 fc
00 43 53 32 37 33 31 0a 20 20 20 20 20 20 01 0e

02 03 26 80 52 10 1f 20 21 22 05 14 04 13 03 12
02 11 07 16 06 15 01 67 03 0c 00 10 00 30 32 e3
05 10 00 e2 00 6a 01 1d 00 be 82 38 2d 40 fe 2c
45 40 ba 70 21 00 00 1a 02 3a 00 be 82 38 2d 40
fe 2c 45 40 ba 70 21 00 00 1a 21 39 00 00 a3 a0
1c 50 78 08 35 10 55 50 21 00 00 1c 00 00 00 00
00 00 00 00 00 00 00 00 00 00 00 00 00 00 00 00
00 00 00 00 00 00 00 00 00 00 00 00 00 00 00 b8

----------------

Block 0, Base EDID:
  EDID Structure Version & Revision: 1.3
  Vendor & Product Identification:
    Manufacturer: ENC
    Model: 12401
    Serial Number: ...
    Made in: week 24 of 2020
  Basic Display Parameters & Features:
    Digital display
    Maximum image size: 60 cm x 34 cm
    Gamma: 2.20
    DPMS levels: Standby Suspend Off
    RGB color display
    First detailed timing is the preferred timing
  Color Characteristics:
    Red  : 0.6845, 0.3095
    Green: 0.2099, 0.7070
    Blue : 0.1503, 0.0498
    White: 0.3134, 0.3291
  Established Timings I & II:
    IBM     :   720x400    70.082 Hz   9:5    31.467 kHz  28.320 MHz
    DMT 0x04:   640x480    59.940 Hz   4:3    31.469 kHz  25.175 MHz
    DMT 0x09:   800x600    60.317 Hz   4:3    37.879 kHz  40.000 MHz
    DMT 0x10:  1024x768    60.004 Hz   4:3    48.363 kHz  65.000 MHz
  Standard Timings:
    DMT 0x33:  1600x1200   60.000 Hz   4:3    75.000 kHz 162.000 MHz
    DMT 0x23:  1280x1024   60.020 Hz   5:4    63.981 kHz 108.000 MHz
    DMT 0x20:  1280x960    60.000 Hz   4:3    60.000 kHz 108.000 MHz
    DMT 0x52:  1920x1080   60.000 Hz  16:9    67.500 kHz 148.500 MHz
  Detailed Timing Descriptors:
    DTD 1:  2560x1440   59.951 Hz  16:9    88.787 kHz 241.500 MHz (597 mm x 336 mm)
                 Hfront   48 Hsync  32 Hback  80 Hpol P
                 Vfront    3 Vsync   5 Vback  33 Vpol N
    DTD 2:  1920x1200   59.950 Hz   8:5    74.038 kHz 154.000 MHz (597 mm x 336 mm)
                 Hfront   48 Hsync  32 Hback  80 Hpol P
                 Vfront    3 Vsync   6 Vback  26 Vpol N
  Display Range Limits:
    Monitor ranges (GTF): 23-61 Hz V, 15-89 kHz H, max dotclock 250 MHz
    Display Product Name: 'CS2731'
  Extension blocks: 1
Checksum: 0x0e

----------------

Block 1, CTA-861 Extension Block:
  Revision: 3
  Underscans IT Video Formats by default
  Native detailed modes: 0
  Video Data Block:
    VIC  16:  1920x1080   60.000 Hz  16:9    67.500 kHz 148.500 MHz
    VIC  31:  1920x1080   50.000 Hz  16:9    56.250 kHz 148.500 MHz
    VIC  32:  1920x1080   24.000 Hz  16:9    27.000 kHz  74.250 MHz
    VIC  33:  1920x1080   25.000 Hz  16:9    28.125 kHz  74.250 MHz
    VIC  34:  1920x1080   30.000 Hz  16:9    33.750 kHz  74.250 MHz
    VIC   5:  1920x1080i  60.000 Hz  16:9    33.750 kHz  74.250 MHz
    VIC  20:  1920x1080i  50.000 Hz  16:9    28.125 kHz  74.250 MHz
    VIC   4:  1280x720    60.000 Hz  16:9    45.000 kHz  74.250 MHz
    VIC  19:  1280x720    50.000 Hz  16:9    37.500 kHz  74.250 MHz
    VIC   3:   720x480    59.940 Hz  16:9    31.469 kHz  27.000 MHz
    VIC  18:   720x576    50.000 Hz  16:9    31.250 kHz  27.000 MHz
    VIC   2:   720x480    59.940 Hz   4:3    31.469 kHz  27.000 MHz
    VIC  17:   720x576    50.000 Hz   4:3    31.250 kHz  27.000 MHz
    VIC   7:  1440x480i   59.940 Hz  16:9    15.734 kHz  27.000 MHz
    VIC  22:  1440x576i   50.000 Hz  16:9    15.625 kHz  27.000 MHz
    VIC   6:  1440x480i   59.940 Hz   4:3    15.734 kHz  27.000 MHz
    VIC  21:  1440x576i   50.000 Hz   4:3    15.625 kHz  27.000 MHz
    VIC   1:   640x480    59.940 Hz   4:3    31.469 kHz  25.175 MHz
  Vendor-Specific Data Block (HDMI), OUI 00-0C-03:
    Source physical address: 1.0.0.0
    DC_36bit
    DC_30bit
    Maximum TMDS clock: 250 MHz
  Colorimetry Data Block:
    opRGB
  Video Capability Data Block:
    YCbCr quantization: No Data
    RGB quantization: Selectable (via AVI Q)
    PT scan behavior: Always Underscanned
    IT scan behavior: Always Underscanned
    CE scan behavior: Always Underscanned
  Detailed Timing Descriptors:
    DTD 3:  2048x1080   24.000 Hz 256:135  27.000 kHz  74.250 MHz (698 mm x 368 mm)
                 Hfront  510 Hsync  44 Hback 148 Hpol P
                 Vfront    4 Vsync   5 Vback  36 Vpol N
    DTD 4:  2048x1080   48.000 Hz 256:135  54.000 kHz 148.500 MHz (698 mm x 368 mm)
                 Hfront  510 Hsync  44 Hback 148 Hpol P
                 Vfront    4 Vsync   5 Vback  36 Vpol N
    DTD 5:  2560x1440   29.935 Hz  16:9    43.945 kHz 146.250 MHz (597 mm x 336 mm)
                 Hfront  120 Hsync 264 Hback 384 Hpol N
                 Vfront    3 Vsync   5 Vback  20 Vpol P
Checksum: 0xb8

----------------

Warnings:

Block 1, CTA-861 Extension Block:
  Video Data Block: VIC 16 is the preferred timing, overriding the first detailed timings. Is this intended?

Failures:

Block 1, CTA-861 Extension Block:
  Detailed Timing Descriptor #3: Mismatch of image size 698x368 mm vs display size 600x340 mm.
  Detailed Timing Descriptor #4: Mismatch of image size 698x368 mm vs display size 600x340 mm.
EDID:
  Base EDID: Some timings are out of range of the Monitor Ranges:
    Vertical Freq: 24.000 - 70.082 Hz (Monitor: 23.000 - 61.000 Hz)

EDID conformity: FAIL
