
EDID (hex):
00ffffffffffff0006afec3100000000
01130103802213780a6b2a9d4c42841c
0d484c00000001010101010101010101
010101010101581b566750001a303020
360058c1100000180000000f00000000
00000000000000000020000000fe0041
554f0a202020202020202020000000fe
004231353658573033205631200a0048

Extracted contents:
header:          00 ff ff ff ff ff ff 00
serial number:   06 af ec 31 00 00 00 00 01 13
version:         01 03
basic params:    80 22 13 78 0a
chroma info:     6b 2a 9d 4c 42 84 1c 0d 48 4c
established:     00 00 00
standard:        01 01 01 01 01 01 01 01 01 01 01 01 01 01 01 01
descriptor 1:    58 1b 56 67 50 00 1a 30 30 20 36 00 58 c1 10 00 00 18
descriptor 2:    00 00 00 0f 00 00 00 00 00 00 00 00 00 00 00 00 00 20
descriptor 3:    00 00 00 fe 00 41 55 4f 0a 20 20 20 20 20 20 20 20 20
descriptor 4:    00 00 00 fe 00 42 31 35 36 58 57 30 33 20 56 31 20 0a
extensions:      00
checksum:        48

Manufacturer: AUO Model 31ec Serial Number --
Made week 1 of 2009
EDID version: 1.3
Digital display
Maximum image size: 34 cm x 19 cm
Gamma: 2.20
Supported color formats: RGB 4:4:4, YCrCb 4:2:2
First detailed timing is preferred timing
Established timings supported:
Standard timings supported:
Detailed mode: Clock 70.000 MHz, 344 mm x 193 mm
               1366 1414 1446 1469 hborder 0
                768  771  777  794 vborder 0
               -hsync -vsync 
Manufacturer-specified data, tag 15
ASCII string: AUO
ASCII string: B156XW03
Checksum: 0x48 (valid)
EDID block does NOT conform to EDID 1.3!
	Missing name descriptor
	Missing monitor ranges
	Detailed block string not properly terminated
