
EDID (hex):
00ffffffffffff003870200000000000
001b0104a51d1178067b50a256519c27
0c4e5300000001010101010101010101
0101010101011a3680a070381f403020
350026a510000018542b80a070381f40
3020350026a510000018000000100000
000000000000000000000000000000fc
004c4d3133334c46354c30310a200052

Extracted contents:
header:          00 ff ff ff ff ff ff 00
serial number:   38 70 20 00 00 00 00 00 00 1b
version:         01 04
basic params:    a5 1d 11 78 06
chroma info:     7b 50 a2 56 51 9c 27 0c 4e 53
established:     00 00 00
standard:        01 01 01 01 01 01 01 01 01 01 01 01 01 01 01 01
descriptor 1:    1a 36 80 a0 70 38 1f 40 30 20 35 00 26 a5 10 00 00 18
descriptor 2:    54 2b 80 a0 70 38 1f 40 30 20 35 00 26 a5 10 00 00 18
descriptor 3:    00 00 00 10 00 00 00 00 00 00 00 00 00 00 00 00 00 00
descriptor 4:    00 00 00 fc 00 4c 4d 31 33 33 4c 46 35 4c 30 31 0a 20
extensions:      00
checksum:        52

Manufacturer: NCP Model 20 Serial Number --
Made week 0 of 2017
EDID version: 1.4
Digital display
8 bits per primary color channel
DisplayPort interface
Maximum image size: 29 cm x 17 cm
Gamma: 2.20
Supported color formats: RGB 4:4:4
Default (sRGB) color space is primary color space
First detailed timing is preferred timing
Established timings supported:
Standard timings supported:
Detailed mode: Clock 138.500 MHz, 294 mm x 165 mm
               1920 1968 2000 2080 hborder 0
               1080 1083 1088 1111 vborder 0
               -hsync -vsync 
Detailed mode: Clock 110.920 MHz, 294 mm x 165 mm
               1920 1968 2000 2080 hborder 0
               1080 1083 1088 1111 vborder 0
               -hsync -vsync 
Dummy block
Monitor name: LM133LF5L01
Checksum: 0x52 (valid)
EDID block does NOT conform to EDID 1.3!
	Missing monitor ranges
