
EDID (hex):
00ffffffffffff0009d1a176293b0000
2a0f01036c221b78eac4f6a3574a9c23
114f54bdef80714f81908180818c0101
010101010101302a009851002a403070
1300782d1100001ed50980a0205e6310
10605208782d1100001a000000fd0038
4c1f530e000a202020202020000000fc
0042656e512046503731562b0a200032

Extracted contents:
header:          00 ff ff ff ff ff ff 00
serial number:   09 d1 a1 76 29 3b 00 00 2a 0f
version:         01 03
basic params:    6c 22 1b 78 ea
chroma info:     c4 f6 a3 57 4a 9c 23 11 4f 54
established:     bd ef 80
standard:        71 4f 81 90 81 80 81 8c 01 01 01 01 01 01 01 01
descriptor 1:    30 2a 00 98 51 00 2a 40 30 70 13 00 78 2d 11 00 00 1e
descriptor 2:    d5 09 80 a0 20 5e 63 10 10 60 52 08 78 2d 11 00 00 1a
descriptor 3:    00 00 00 fd 00 38 4c 1f 53 0e 00 0a 20 20 20 20 20 20
descriptor 4:    00 00 00 fc 00 42 65 6e 51 20 46 50 37 31 56 2b 0a 20
extensions:      00
checksum:        32

Manufacturer: BNQ Model 76a1 Serial Number --
EDID version: 1.3
Analog display, Input voltage level: 0.7/0.7 V
Sync: Separate Composite 
Maximum image size: 34 cm x 27 cm
Gamma: 2.20
DPMS levels: Standby Suspend Off
RGB color display
First detailed timing is preferred timing
Established timings supported:
  720x400@70Hz
  640x480@60Hz
  640x480@67Hz
  640x480@72Hz
  640x480@75Hz
  800x600@60Hz
  800x600@72Hz
  800x600@75Hz
  832x624@75Hz
  1024x768@60Hz
  1024x768@70Hz
  1024x768@75Hz
  1280x1024@75Hz
  1152x870@75Hz
Standard timings supported:
  1152x864@75Hz
  1280x1024@76Hz
  1280x1024@60Hz
  1280x1024@72Hz
Detailed mode: Clock 108.000 MHz, 376 mm x 301 mm
               1280 1328 1440 1688 hborder 0
               1024 1025 1028 1066 vborder 0
               +hsync +vsync 
Detailed mode: Clock 25.170 MHz, 376 mm x 301 mm
                640  656  752  800 hborder 0
                350  387  389  449 vborder 0
               +hsync -vsync 
Monitor ranges (GTF): 56-76Hz V, 31-83kHz H, max dotclock 140MHz
Monitor name: BenQ
Checksum: 0x32 (valid)
EDID block does NOT conform to EDID 1.3!
	Detailed block string not properly terminated
EDID block does not conform at all!
	Bad year of manufacture
