edid-decode (hex):

00 ff ff ff ff ff ff 00 10 ac b6 40 53 37 32 38
1f 19 01 04 b5 3c 22 78 3a 72 25 ac 50 33 b7 26
0b 50 54 21 08 00 81 00 b3 00 d1 00 a9 40 81 80
d1 c0 01 01 01 01 56 5e 00 a0 a0 a0 29 50 30 20
35 00 55 50 21 00 00 1a 00 00 00 ff 00 46 31 4a
43 4d 35 37 55 38 32 37 53 0a 00 00 00 fc 00 44
45 4c 4c 20 55 50 32 37 31 35 4b 0a 00 00 00 fd
00 1d 4b 1f b4 36 01 0a 20 20 20 20 20 20 02 9d

02 03 0c f1 23 09 07 07 83 01 00 00 4d d0 00 a0
f0 70 3e 80 50 20 65 0c 55 50 21 00 00 18 56 5e
00 a0 a0 a0 29 50 30 20 35 00 55 50 21 00 00 1a
00 00 00 00 00 00 00 00 00 00 00 00 00 00 00 00
00 00 00 00 00 00 00 00 00 00 00 00 00 00 00 00
00 00 00 00 00 00 00 00 00 00 00 00 00 00 00 00
00 00 00 00 00 00 00 00 00 00 00 00 00 00 00 00
00 00 00 00 00 00 00 00 00 00 00 00 00 00 00 34

70 12 79 00 00 12 00 16 82 10 10 00 ff 09 3f 0b
00 00 00 00 00 44 45 4c b6 40 53 37 32 38 03 00
3c 4c d0 00 84 ff 0e 9f 00 2f 80 1f 00 6f 08 3d
00 02 00 04 00 10 5d 00 04 ff 09 9f 00 2f 80 1f
00 3f 0b 28 00 02 00 09 00 c4 bc 00 04 ff 09 9f
00 2f 80 1f 00 3f 0b 51 00 02 00 09 00 07 00 0a
08 81 00 08 04 00 04 02 10 00 00 00 00 00 00 00
00 00 00 00 00 00 00 00 00 00 00 00 00 00 c9 90

----------------

Block 0, Base EDID:
  EDID Structure Version & Revision: 1.4
  Vendor & Product Identification:
    Manufacturer: DEL
    Model: 16566
    Serial Number: ...
    Made in: week 31 of 2015
  Basic Display Parameters & Features:
    Digital display
    Bits per primary color channel: 10
    DisplayPort interface
    Maximum image size: 60 cm x 34 cm
    Gamma: 2.20
    DPMS levels: Off
    Supported color formats: RGB 4:4:4, YCrCb 4:4:4, YCrCb 4:2:2
    First detailed timing includes the native pixel format and preferred refresh rate
  Color Characteristics:
    Red  : 0.6728, 0.3154
    Green: 0.1992, 0.7167
    Blue : 0.1484, 0.0449
    White: 0.3134, 0.3291
  Established Timings I & II:
    DMT 0x04:   640x480    59.940 Hz   4:3    31.469 kHz  25.175 MHz
    DMT 0x09:   800x600    60.317 Hz   4:3    37.879 kHz  40.000 MHz
    DMT 0x10:  1024x768    60.004 Hz   4:3    48.363 kHz  65.000 MHz
  Standard Timings:
    DMT 0x1c:  1280x800    59.810 Hz  16:10   49.702 kHz  83.500 MHz
    DMT 0x3a:  1680x1050   59.954 Hz  16:10   65.290 kHz 146.250 MHz
    DMT 0x45:  1920x1200   59.885 Hz  16:10   74.556 kHz 193.250 MHz
    DMT 0x33:  1600x1200   60.000 Hz   4:3    75.000 kHz 162.000 MHz
    DMT 0x23:  1280x1024   60.020 Hz   5:4    63.981 kHz 108.000 MHz
    DMT 0x52:  1920x1080   60.000 Hz  16:9    67.500 kHz 148.500 MHz
  Detailed Timing Descriptors:
    DTD 1:  2560x1440   59.951 Hz  16:9    88.787 kHz 241.500 MHz (597 mm x 336 mm)
                 Hfront   48 Hsync  32 Hback  80 Hpol P
                 Vfront    3 Vsync   5 Vback  33 Vpol N
    Display Product Serial Number: ...
    Display Product Name: 'DELL UP2715K'
  Display Range Limits:
    Monitor ranges (Bare Limits): 29-75 Hz V, 31-180 kHz H, max dotclock 540 MHz
  Extension blocks: 2
Checksum: 0x9d

----------------

Block 1, CTA-861 Extension Block:
  Revision: 3
  Underscans IT Video Formats by default
  Basic audio support
  Supports YCbCr 4:4:4
  Supports YCbCr 4:2:2
  Native detailed modes: 1
  Audio Data Block:
    Linear PCM:
      Max channels: 2
      Supported sample rates (kHz): 48 44.1 32
      Supported sample sizes (bits): 24 20 16
  Speaker Allocation Data Block:
    FL/FR - Front Left/Right
  Detailed Timing Descriptors:
    DTD 2:  3840x2160   59.997 Hz  16:9   133.312 kHz 533.250 MHz (597 mm x 336 mm)
                 Hfront   80 Hsync  32 Hback  48 Hpol N
                 Vfront   54 Vsync   5 Vback   3 Vpol N
    DTD 3:  2560x1440   59.951 Hz  16:9    88.787 kHz 241.500 MHz (597 mm x 336 mm)
                 Hfront   48 Hsync  32 Hback  80 Hpol P
                 Vfront    3 Vsync   5 Vback  33 Vpol N
Checksum: 0x34

----------------

Block 2, DisplayID Extension Block:
  Version: 1.2
  Extension Count: 0
  Display Product Type: Extension Section
  Tiled Display Topology Data Block (0x12):
    Capabilities:
      Behavior if it is the only tile: Image is scaled to fit the entire tiled display
      Behavior if more than one tile and fewer than total number of tiles: Undefined
    Tiled display consists of a single physical display enclosure
    Num horizontal tiles: 2 Num vertical tiles: 1
    Tile location: 1, 0
    Tile resolution: 2560x2880
    Tiled Display Manufacturer/Vendor ID: DEL
    Tiled Display Product ID Code: 16566
    Tiled Display Serial Number: 942815059
  Video Timing Modes Type 1 - Detailed Timings Data Block:
    DTD:  3840x2160   59.997 Hz  16:9   133.312 kHz 533.250 MHz (aspect 16:9, no 3D stereo, preferred)
               Hfront   48 Hsync  32 Hback  80 Hpol P
               Vfront    3 Vsync   5 Vback  54 Vpol N
    DTD:  2560x2880   29.987 Hz  16:9    87.592 kHz 238.250 MHz (aspect 16:9, no 3D stereo)
               Hfront   48 Hsync  32 Hback  80 Hpol P
               Vfront    3 Vsync  10 Vback  28 Vpol N
    DTD:  2560x2880   59.982 Hz  16:9   177.665 kHz 483.250 MHz (aspect 16:9, no 3D stereo)
               Hfront   48 Hsync  32 Hback  80 Hpol P
               Vfront    3 Vsync  10 Vback  69 Vpol N
  Supported Timing Modes Type 1 - VESA DMT Timings Data Block:
    DMT 0x04:   640x480    59.940 Hz   4:3    31.469 kHz  25.175 MHz
    DMT 0x09:   800x600    60.317 Hz   4:3    37.879 kHz  40.000 MHz
    DMT 0x10:  1024x768    60.004 Hz   4:3    48.363 kHz  65.000 MHz
    DMT 0x1c:  1280x800    59.810 Hz  16:10   49.702 kHz  83.500 MHz
    DMT 0x23:  1280x1024   60.020 Hz   5:4    63.981 kHz 108.000 MHz
    DMT 0x33:  1600x1200   60.000 Hz   4:3    75.000 kHz 162.000 MHz
    DMT 0x3a:  1680x1050   59.954 Hz  16:10   65.290 kHz 146.250 MHz
    DMT 0x45:  1920x1200   59.885 Hz  16:10   74.556 kHz 193.250 MHz
  Checksum: 0xc9
Checksum: 0x90

----------------

Warnings:

Block 1, CTA-861 Extension Block:
  Display Product Serial Number is set, so the Serial Number in the Base EDID should be 0.
  Missing VCDB, needed for Set Selectable RGB Quantization to avoid interop issues.

Failures:

Block 2, DisplayID Extension Block:
  DisplayID Base Block has no product type.
EDID:
  DisplayID: Missing DisplayID Product Identification Data Block.

EDID conformity: FAIL
