
EDID (hex):
00ffffffffffff004c2def0332324454
181201030e2f1e782aee91a3544c9926
0f5054bfef80b30081808140714f0101
01010101010121399030621a274068b0
3600b10f1100001c000000fd00384b1e
510f000a202020202020000000fc0053
796e634d61737465720a2020000000ff
00485647513630353936300a202000cd

Extracted contents:
header:          00 ff ff ff ff ff ff 00
serial number:   4c 2d ef 03 32 32 44 54 18 12
version:         01 03
basic params:    0e 2f 1e 78 2a
chroma info:     ee 91 a3 54 4c 99 26 0f 50 54
established:     bf ef 80
standard:        b3 00 81 80 81 40 71 4f 01 01 01 01 01 01 01 01
descriptor 1:    21 39 90 30 62 1a 27 40 68 b0 36 00 b1 0f 11 00 00 1c
descriptor 2:    00 00 00 fd 00 38 4b 1e 51 0f 00 0a 20 20 20 20 20 20
descriptor 3:    00 00 00 fc 00 53 79 6e 63 4d 61 73 74 65 72 0a 20 20
descriptor 4:    00 00 00 ff 00 48 56 47 51 36 30 35 39 36 30 0a 20 20
extensions:      00
checksum:        cd

Manufacturer: SAM Model 3ef Serial Number --
Made week 24 of 2008
EDID version: 1.3
Analog display, Input voltage level: 0.7/0.3 V
Sync: Separate Composite SyncOnGreen 
Maximum image size: 47 cm x 30 cm
Gamma: 2.20
DPMS levels: Off
RGB color display
First detailed timing is preferred timing
Established timings supported:
  720x400@70Hz
  640x480@60Hz
  640x480@67Hz
  640x480@72Hz
  640x480@75Hz
  800x600@56Hz
  800x600@60Hz
  800x600@72Hz
  800x600@75Hz
  832x624@75Hz
  1024x768@60Hz
  1024x768@70Hz
  1024x768@75Hz
  1280x1024@75Hz
  1152x870@75Hz
Standard timings supported:
  1680x1050@60Hz
  1280x1024@60Hz
  1280x960@60Hz
  1152x864@75Hz
Detailed mode: Clock 146.250 MHz, 433 mm x 271 mm
               1680 1784 1960 2240 hborder 0
               1050 1053 1059 1089 vborder 0
               -hsync +vsync 
Monitor ranges (GTF): 56-75Hz V, 30-81kHz H, max dotclock 150MHz
Monitor name: SyncMaster
Serial number: --
Checksum: 0xcd (valid)
