edid-decode (hex):

00 ff ff ff ff ff ff 00 32 8d 37 39 5f 02 00 00
16 1c 01 03 80 0d 08 78 0a 0d c9 a0 57 47 98 27
12 48 4c 00 00 00 01 01 01 01 01 01 01 01 01 01
01 01 01 01 01 01 ac 19 d0 78 20 00 18 50 32 14
84 00 a0 5a 00 00 00 1e 00 00 00 00 00 00 00 00
00 00 00 00 00 00 00 00 00 00 00 00 00 00 00 00
00 00 00 00 00 00 00 00 00 00 00 00 00 00 00 00
00 00 00 00 00 00 00 00 00 00 00 00 00 00 00 29

----------------

Block 0, Base EDID:
  EDID Structure Version & Revision: 1.3
  Vendor & Product Identification:
    Manufacturer: LTM
    Model: 14647
    Serial Number: ...
    Made in: week 22 of 2018
  Basic Display Parameters & Features:
    Digital display
    Maximum image size: 13 cm x 8 cm
    Gamma: 2.20
    RGB color display
    First detailed timing is the preferred timing
  Color Characteristics:
    Red  : 0.6250, 0.3398
    Green: 0.2802, 0.5947
    Blue : 0.1552, 0.0703
    White: 0.2832, 0.2978
  Established Timings I & II: none
  Standard Timings: none
  Detailed Timing Descriptors:
    DTD 1:   720x1280   59.998539 Hz   9:16    78.238 kHz     65.720000 MHz (160 mm x 90 mm)
                 Hfront   50 Hsync  20 Hback   50 Hpol P
                 Vfront    8 Vsync   4 Vback   12 Vpol P
    Empty Descriptor
    Empty Descriptor
    Empty Descriptor
Checksum: 0x29

----------------

Warnings:

Block 0, Base EDID:
  Basic Display Parameters & Features: Dubious maximum image size (13x8 is smaller than 10x10 cm).

Failures:

Block 0, Base EDID:
  Detailed Timing Descriptor #1: Mismatch of image size 160x90 mm vs display size 130x80 mm.
  Empty Descriptor: Use Dummy Descriptor instead of all zeroes.
  Empty Descriptor: Use Dummy Descriptor instead of all zeroes.
  Empty Descriptor: Use Dummy Descriptor instead of all zeroes.
  Missing Display Product Name.
  Missing Display Range Limits Descriptor.
EDID:
  Base EDID: The DTD max image size is 160x90mm, which is larger than the display size 130.0x80.0mm.

EDID conformity: FAIL
