edid-decode (hex):

00 ff ff ff ff ff ff 00 4c 2d c3 0d 4b 58 50 30
1d 1b 01 03 80 50 21 78 2a 8d 4c a9 54 46 97 22
22 4e 5f bf ef 80 71 4f 81 00 81 c0 81 80 95 00
a9 c0 b3 00 01 01 9d 67 70 a0 d0 a0 22 50 30 20
3a 00 1d 4d 31 00 00 1a 00 00 00 fd 00 32 64 1e
98 37 00 0a 20 20 20 20 20 20 00 00 00 fc 00 43
46 37 39 31 0a 20 20 20 20 20 20 20 00 00 00 ff
00 48 54 52 4a 37 30 32 33 36 35 0a 20 20 01 7b

02 03 25 f1 48 90 1f 04 13 03 12 05 5a 23 09 07
07 83 01 00 00 67 03 0c 00 10 00 80 3c 67 d8 5d
c4 01 6e 80 00 e7 7c 70 a0 d0 a0 29 50 30 20 3a
00 1d 4d 31 00 00 1a 4e d4 70 a0 d0 a0 46 50 30
20 3a 00 1d 4d 31 00 00 1a 56 5e 00 a0 a0 a0 29
50 30 20 35 00 1d 4d 31 00 00 1a 02 3a 80 18 71
38 2d 40 58 2c 45 00 00 00 00 00 00 1e 58 4d 00
b8 a1 38 14 40 f8 2c 45 00 1d 4d 31 00 00 1e 3e

----------------

Block 0, Base EDID:
  EDID Structure Version & Revision: 1.3
  Vendor & Product Identification:
    Manufacturer: SAM
    Model: 3523
    Serial Number: ...
    Made in: week 29 of 2017
  Basic Display Parameters & Features:
    Digital display
    Maximum image size: 80 cm x 33 cm
    Gamma: 2.20
    DPMS levels: Off
    RGB color display
    First detailed timing is the preferred timing
  Color Characteristics:
    Red  : 0.6621, 0.3281
    Green: 0.2763, 0.5908
    Blue : 0.1337, 0.1328
    White: 0.3076, 0.3710
  Established Timings I & II:
    IBM     :   720x400    70.082 Hz   9:5    31.467 kHz  28.320 MHz
    DMT 0x04:   640x480    59.940 Hz   4:3    31.469 kHz  25.175 MHz
    Apple   :   640x480    66.667 Hz   4:3    35.000 kHz  30.240 MHz
    DMT 0x05:   640x480    72.809 Hz   4:3    37.861 kHz  31.500 MHz
    DMT 0x06:   640x480    75.000 Hz   4:3    37.500 kHz  31.500 MHz
    DMT 0x08:   800x600    56.250 Hz   4:3    35.156 kHz  36.000 MHz
    DMT 0x09:   800x600    60.317 Hz   4:3    37.879 kHz  40.000 MHz
    DMT 0x0a:   800x600    72.188 Hz   4:3    48.077 kHz  50.000 MHz
    DMT 0x0b:   800x600    75.000 Hz   4:3    46.875 kHz  49.500 MHz
    Apple   :   832x624    74.551 Hz   4:3    49.726 kHz  57.284 MHz
    DMT 0x10:  1024x768    60.004 Hz   4:3    48.363 kHz  65.000 MHz
    DMT 0x11:  1024x768    70.069 Hz   4:3    56.476 kHz  75.000 MHz
    DMT 0x12:  1024x768    75.029 Hz   4:3    60.023 kHz  78.750 MHz
    DMT 0x24:  1280x1024   75.025 Hz   5:4    79.976 kHz 135.000 MHz
    Apple   :  1152x870    75.062 Hz 192:145  68.681 kHz 100.000 MHz
  Standard Timings:
    DMT 0x15:  1152x864    75.000 Hz   4:3    67.500 kHz 108.000 MHz
    DMT 0x1c:  1280x800    59.810 Hz  16:10   49.702 kHz  83.500 MHz
    DMT 0x55:  1280x720    60.000 Hz  16:9    45.000 kHz  74.250 MHz
    DMT 0x23:  1280x1024   60.020 Hz   5:4    63.981 kHz 108.000 MHz
    DMT 0x2f:  1440x900    59.887 Hz  16:10   55.935 kHz 106.500 MHz
    DMT 0x53:  1600x900    60.000 Hz  16:9    60.000 kHz 108.000 MHz (RB)
    DMT 0x3a:  1680x1050   59.954 Hz  16:10   65.290 kHz 146.250 MHz
  Detailed Timing Descriptors:
    DTD 1:  3440x1440   49.987 Hz  43:18   73.681 kHz 265.250 MHz (797 mm x 333 mm)
                 Hfront   48 Hsync  32 Hback  80 Hpol P
                 Vfront    3 Vsync  10 Vback  21 Vpol N
  Display Range Limits:
    Monitor ranges (GTF): 50-100 Hz V, 30-152 kHz H, max dotclock 550 MHz
    Display Product Name: 'CF791'
    Display Product Serial Number: ...
  Extension blocks: 1
Checksum: 0x7b

----------------

Block 1, CTA-861 Extension Block:
  Revision: 3
  Underscans IT Video Formats by default
  Basic audio support
  Supports YCbCr 4:4:4
  Supports YCbCr 4:2:2
  Native detailed modes: 1
  Video Data Block:
    VIC  16:  1920x1080   60.000 Hz  16:9    67.500 kHz 148.500 MHz (native)
    VIC  31:  1920x1080   50.000 Hz  16:9    56.250 kHz 148.500 MHz
    VIC   4:  1280x720    60.000 Hz  16:9    45.000 kHz  74.250 MHz
    VIC  19:  1280x720    50.000 Hz  16:9    37.500 kHz  74.250 MHz
    VIC   3:   720x480    59.940 Hz  16:9    31.469 kHz  27.000 MHz
    VIC  18:   720x576    50.000 Hz  16:9    31.250 kHz  27.000 MHz
    VIC   5:  1920x1080i  60.000 Hz  16:9    33.750 kHz  74.250 MHz
    VIC  90:  2560x1080   60.000 Hz  64:27   66.000 kHz 198.000 MHz
  Audio Data Block:
    Linear PCM:
      Max channels: 2
      Supported sample rates (kHz): 48 44.1 32
      Supported sample sizes (bits): 24 20 16
  Speaker Allocation Data Block:
    FL/FR - Front Left/Right
  Vendor-Specific Data Block (HDMI), OUI 00-0C-03:
    Source physical address: 1.0.0.0
    Supports_AI
    Maximum TMDS clock: 300 MHz
  Vendor-Specific Data Block (HDMI Forum), OUI C4-5D-D8:
    Version: 1
    Maximum TMDS Character Rate: 550 MHz
    SCDC Present
  Detailed Timing Descriptors:
    DTD 2:  3440x1440   59.973 Hz  43:18   88.819 kHz 319.750 MHz (797 mm x 333 mm)
                 Hfront   48 Hsync  32 Hback  80 Hpol P
                 Vfront    3 Vsync  10 Vback  28 Vpol N
    DTD 3:  3440x1440   99.982 Hz  43:18  150.972 kHz 543.500 MHz (797 mm x 333 mm)
                 Hfront   48 Hsync  32 Hback  80 Hpol P
                 Vfront    3 Vsync  10 Vback  57 Vpol N
    DTD 4:  2560x1440   59.951 Hz  16:9    88.787 kHz 241.500 MHz (797 mm x 333 mm)
                 Hfront   48 Hsync  32 Hback  80 Hpol P
                 Vfront    3 Vsync   5 Vback  33 Vpol N
    DTD 5:  1920x1080   60.000 Hz  16:9    67.500 kHz 148.500 MHz
                 Hfront   88 Hsync  44 Hback 148 Hpol P
                 Vfront    4 Vsync   5 Vback  36 Vpol P
    DTD 6:  2560x1080   60.000 Hz  64:27   66.000 kHz 198.000 MHz (797 mm x 333 mm)
                 Hfront  248 Hsync  44 Hback 148 Hpol P
                 Vfront    4 Vsync   5 Vback  11 Vpol P
Checksum: 0x3e

----------------

Warnings:

Block 1, CTA-861 Extension Block:
  Display Product Serial Number is set, so the Serial Number in the Base EDID should be 0.
  Missing VCDB, needed for Set Selectable RGB Quantization to avoid interop issues.

Failures:

Block 1, CTA-861 Extension Block:
  Detailed Timing Descriptor #5: Mismatch of image size vs display size: image size is not set, but display size is.
EDID:
  CTA-861: Native progressive timings are a mix of several resolutions.

EDID conformity: FAIL
