
EDID (hex):
00ffffffffffff004dd9002301010101
250f010380221b78ea2ee5a4574a9c25
115054a1080081808140010101010101
010101010101302a009851002a403070
1300520e1100001e000000fd00393f1c
410b000a202020202020000000fc0053
444d2d48533735500a202020000000ff
00363331313030330a202020202000b2

Extracted contents:
header:          00 ff ff ff ff ff ff 00
serial number:   4d d9 00 23 01 01 01 01 25 0f
version:         01 03
basic params:    80 22 1b 78 ea
chroma info:     2e e5 a4 57 4a 9c 25 11 50 54
established:     a1 08 00
standard:        81 80 81 40 01 01 01 01 01 01 01 01 01 01 01 01
descriptor 1:    30 2a 00 98 51 00 2a 40 30 70 13 00 52 0e 11 00 00 1e
descriptor 2:    00 00 00 fd 00 39 3f 1c 41 0b 00 0a 20 20 20 20 20 20
descriptor 3:    00 00 00 fc 00 53 44 4d 2d 48 53 37 35 50 0a 20 20 20
descriptor 4:    00 00 00 ff 00 36 33 31 31 30 30 33 0a 20 20 20 20 20
extensions:      00
checksum:        b2

Manufacturer: SNY Model 2300 Serial Number --
EDID version: 1.3
Digital display
Maximum image size: 34 cm x 27 cm
Gamma: 2.20
DPMS levels: Standby Suspend Off
Supported color formats: RGB 4:4:4, YCrCb 4:2:2
First detailed timing is preferred timing
Established timings supported:
  720x400@70Hz
  640x480@60Hz
  800x600@60Hz
  1024x768@60Hz
Standard timings supported:
  1280x1024@60Hz
  1280x960@60Hz
Detailed mode: Clock 108.000 MHz, 338 mm x 270 mm
               1280 1328 1440 1688 hborder 0
               1024 1025 1028 1066 vborder 0
               +hsync +vsync 
Monitor ranges (GTF): 57-63Hz V, 28-65kHz H, max dotclock 110MHz
Monitor name: SDM
Serial number: --
Checksum: 0xb2 (valid)
EDID block does NOT conform to EDID 1.3!
	Detailed block string not properly terminated
EDID block does not conform at all!
	Bad year of manufacture
