
EDID (hex):
00ffffffffffff000dae151400000000
101e0104a51f117802ee95a3544c9926
0f505400000001010101010101010101
010101010101363680a0703820403020
350035ad10000018000000fe004e3134
304843412d4541330a20000000fe0043
4d4e0a202020202020202020000000fe
004e3134304843412d4541330a2000b5

edid-decode (hex):

00 ff ff ff ff ff ff 00 0d ae 15 14 00 00 00 00
10 1e 01 04 a5 1f 11 78 02 ee 95 a3 54 4c 99 26
0f 50 54 00 00 00 01 01 01 01 01 01 01 01 01 01
01 01 01 01 01 01 36 36 80 a0 70 38 20 40 30 20
35 00 35 ad 10 00 00 18 00 00 00 fe 00 4e 31 34
30 48 43 41 2d 45 41 33 0a 20 00 00 00 fe 00 43
4d 4e 0a 20 20 20 20 20 20 20 20 20 00 00 00 fe
00 4e 31 34 30 48 43 41 2d 45 41 33 0a 20 00 b5

----------------

Block 0, Base EDID:
  EDID Structure Version & Revision: 1.4
  Vendor & Product Identification:
    Manufacturer: CMN
    Model: 5141
    Made in: week 16 of 2020
  Basic Display Parameters & Features:
    Digital display
    Bits per primary color channel: 8
    DisplayPort interface
    Maximum image size: 31 cm x 17 cm
    Gamma: 2.20
    Supported color formats: RGB 4:4:4
    First detailed timing includes the native pixel format and preferred refresh rate
  Color Characteristics:
    Red  : 0.6396, 0.3300
    Green: 0.2998, 0.5996
    Blue : 0.1503, 0.0595
    White: 0.3134, 0.3291
  Established Timings I & II: none
  Standard Timings: none
  Detailed Timing Descriptors:
    DTD 1:  1920x1080   60.001038 Hz  16:9     66.721 kHz    138.780000 MHz (309 mm x 173 mm)
                 Hfront   48 Hsync  32 Hback   80 Hpol N
                 Vfront    3 Vsync   5 Vback   24 Vpol N
    Alphanumeric Data String: 'N140HCA-EA3'
    Alphanumeric Data String: 'CMN'
    Alphanumeric Data String: 'N140HCA-EA3'
Checksum: 0xb5


