edid-decode (hex):

00 ff ff ff ff ff ff 00 06 10 4e 9c 00 00 00 00
0e 0f 01 03 80 20 16 78 0a 87 f5 94 57 4f 8c 27
27 50 54 00 00 00 01 01 01 01 01 01 01 01 01 01
01 01 01 01 01 01 38 28 a0 40 51 c0 10 30 40 20
44 00 41 d6 10 00 00 19 00 00 00 01 00 06 10 30
00 00 00 00 00 00 00 00 0a 20 00 00 00 fe 00 4c
54 4e 31 35 32 57 36 00 00 00 0a 20 00 00 00 fc
00 43 6f 6c 6f 72 20 4c 43 44 0a 20 20 20 00 f0

----------------

Block 0, Base EDID:
  EDID Structure Version & Revision: 1.3
  Vendor & Product Identification:
    Manufacturer: APP
    Model: 40014
    Made in: week 14 of 2005
  Basic Display Parameters & Features:
    Digital display
    Maximum image size: 32 cm x 22 cm
    Gamma: 2.20
    RGB color display
    First detailed timing is the preferred timing
  Color Characteristics:
    Red  : 0.5800, 0.3398
    Green: 0.3095, 0.5498
    Blue : 0.1552, 0.1552
    White: 0.3134, 0.3291
  Established Timings I & II: none
  Standard Timings: none
  Detailed Timing Descriptors:
    DTD 1:  1440x960    59.939 Hz   3:2    58.500 kHz 102.960 MHz (321 mm x 214 mm)
                 Hfront   64 Hsync  32 Hback 224 Hpol N
                 Vfront    4 Vsync   4 Vback   8 Vpol N
    Manufacturer-Specified Display Descriptor (0x01): 00 01 00 06 10 30 00 00 00 00 00 00 00 00 0a 20 '.....0......... '
    Alphanumeric Data String: 'LTN152W6'
    Display Product Name: 'Color LCD'
Checksum: 0xf0

----------------

Failures:

Block 0, Base EDID:
  Alphanumeric Data String: Non-printable character.
  Missing Display Range Limits Descriptor.

EDID conformity: FAIL
