
EDID (hex):
00ffffffffffff0030e4950300000000
00160103802213780a01a59c595a9b26
18505400000001010101010101010101
010101010101581b567e50000e302430
350058c2100000190000000000000000
00000000000000000000000000fe004c
4720446973706c61790a2020000000fe
004c503135365748342d544c503200bd

edid-decode (hex):

00 ff ff ff ff ff ff 00 30 e4 95 03 00 00 00 00
00 16 01 03 80 22 13 78 0a 01 a5 9c 59 5a 9b 26
18 50 54 00 00 00 01 01 01 01 01 01 01 01 01 01
01 01 01 01 01 01 58 1b 56 7e 50 00 0e 30 24 30
35 00 58 c2 10 00 00 19 00 00 00 00 00 00 00 00
00 00 00 00 00 00 00 00 00 00 00 00 00 fe 00 4c
47 20 44 69 73 70 6c 61 79 0a 20 20 00 00 00 fe
00 4c 50 31 35 36 57 48 34 2d 54 4c 50 32 00 bd

----------------

Block 0, Base EDID:
  EDID Structure Version & Revision: 1.3
  Vendor & Product Identification:
    Manufacturer: LGD
    Model: 917
    Made in: 2012
  Basic Display Parameters & Features:
    Digital display
    Maximum image size: 34 cm x 19 cm
    Gamma: 2.20
    RGB color display
    First detailed timing is the preferred timing
  Color Characteristics:
    Red  : 0.6093, 0.3476
    Green: 0.3515, 0.6064
    Blue : 0.1503, 0.0957
    White: 0.3134, 0.3291
  Established Timings I & II: none
  Standard Timings: none
  Detailed Timing Descriptors:
    DTD 1:  1366x768    59.996023 Hz 683:384   46.917 kHz     70.000000 MHz (344 mm x 194 mm)
                 Hfront   36 Hsync  48 Hback   42 Hpol N
                 Vfront    3 Vsync   5 Vback    6 Vpol N
    Empty Descriptor
    Alphanumeric Data String: 'LG Display'
    Alphanumeric Data String: 'LP156WH4-TLP2'
Checksum: 0xbd
