
EDID (hex):
00ffffffffffff000dae061600000000
2d1d010495241478039065945c578927
14505400000001010101010101010101
010101010101a43880e670382c403020
a60063c71000001ac32580e670382c40
3020a60063c71000001a000000000000
00000000000000000000000000000002
000c3dff0d3c7d0e162e7d00000000b9

edid-decode (hex):

00 ff ff ff ff ff ff 00 0d ae 06 16 00 00 00 00
2d 1d 01 04 95 24 14 78 03 90 65 94 5c 57 89 27
14 50 54 00 00 00 01 01 01 01 01 01 01 01 01 01
01 01 01 01 01 01 a4 38 80 e6 70 38 2c 40 30 20
a6 00 63 c7 10 00 00 1a c3 25 80 e6 70 38 2c 40
30 20 a6 00 63 c7 10 00 00 1a 00 00 00 00 00 00
00 00 00 00 00 00 00 00 00 00 00 00 00 00 00 02
00 0c 3d ff 0d 3c 7d 0e 16 2e 7d 00 00 00 00 b9

----------------

Block 0, Base EDID:
  EDID Structure Version & Revision: 1.4
  Vendor & Product Identification:
    Manufacturer: CMN
    Model: 5638
    Made in: week 45 of 2019
  Basic Display Parameters & Features:
    Digital display
    Bits per primary color channel: 6
    DisplayPort interface
    Maximum image size: 36 cm x 20 cm
    Gamma: 2.20
    Supported color formats: RGB 4:4:4
    First detailed timing includes the native pixel format and preferred refresh rate
    Display is continuous frequency
  Color Characteristics:
    Red  : 0.5800, 0.3603
    Green: 0.3398, 0.5351
    Blue : 0.1533, 0.0800
    White: 0.3134, 0.3291
  Established Timings I & II: none
  Standard Timings: none
  Detailed Timing Descriptors:
    DTD 1:  1920x1080   60.001655 Hz  16:9     67.442 kHz    145.000000 MHz (355 mm x 199 mm)
                 Hfront   48 Hsync  32 Hback  150 Hpol P
                 Vfront   10 Vsync   6 Vback   28 Vpol N
    DTD 2:  1920x1080   40.002483 Hz  16:9     44.963 kHz     96.670000 MHz (355 mm x 199 mm)
                 Hfront   48 Hsync  32 Hback  150 Hpol P
                 Vfront   10 Vsync   6 Vback   28 Vpol N
    Empty Descriptor
    Manufacturer-Specified Display Descriptor (0x02): 00 02 00 0c 3d ff 0d 3c 7d 0e 16 2e 7d 00 00 00 '....=..<}...}...'
Checksum: 0xb9
