
EDID (hex):
00ffffffffffff004dd900b201010101
141001040e221b78ea0c75a559479b24
115054adcf0081808140010101010101
010101010101302a009851002a403070
1300520e1100001e000000fd00384b1c
510e000a202020202020000000fc0053
444d2d453736440a20202020000000ff
00313732343331390a2020202020007b

Extracted contents:
header:          00 ff ff ff ff ff ff 00
serial number:   4d d9 00 b2 01 01 01 01 14 10
version:         01 04
basic params:    0e 22 1b 78 ea
chroma info:     0c 75 a5 59 47 9b 24 11 50 54
established:     ad cf 00
standard:        81 80 81 40 01 01 01 01 01 01 01 01 01 01 01 01
descriptor 1:    30 2a 00 98 51 00 2a 40 30 70 13 00 52 0e 11 00 00 1e
descriptor 2:    00 00 00 fd 00 38 4b 1c 51 0e 00 0a 20 20 20 20 20 20
descriptor 3:    00 00 00 fc 00 53 44 4d 2d 45 37 36 44 0a 20 20 20 20
descriptor 4:    00 00 00 ff 00 31 37 32 34 33 31 39 0a 20 20 20 20 20
extensions:      00
checksum:        7b

EDID version: 1.4
Manufacturer: SNY Model b200 Serial Number --
Made in week 20 of 2006
Analog display, Input voltage level: 0.7/0.3 V
Blank level equals black level
Sync: Separate Composite SyncOnGreen 
Maximum image size: 34 cm x 27 cm
Gamma: 2.20
DPMS levels: Standby Suspend Off
RGB color display
First detailed timing includes the native pixel format and preferred refresh rate
Display x,y Chromaticity:
  Red:   0.6445, 0.3476
  Green: 0.2802, 0.6054
  Blue:  0.1416, 0.0693
  White: 0.3134, 0.3291
Established timings supported:
  720x400@70Hz 9:5 HorFreq: 31469 Hz Clock: 28.320 MHz
  640x480@60Hz 4:3 HorFreq: 31469 Hz Clock: 25.175 MHz
  640x480@72Hz 4:3 HorFreq: 37900 Hz Clock: 31.500 MHz
  640x480@75Hz 4:3 HorFreq: 37500 Hz Clock: 31.500 MHz
  800x600@60Hz 4:3 HorFreq: 37900 Hz Clock: 40.000 MHz
  800x600@72Hz 4:3 HorFreq: 48100 Hz Clock: 50.000 MHz
  800x600@75Hz 4:3 HorFreq: 46900 Hz Clock: 49.500 MHz
  1024x768@60Hz 4:3 HorFreq: 48400 Hz Clock: 65.000 MHz
  1024x768@70Hz 4:3 HorFreq: 56500 Hz Clock: 75.000 MHz
  1024x768@75Hz 4:3 HorFreq: 60000 Hz Clock: 78.750 MHz
  1280x1024@75Hz 5:4 HorFreq: 80000 Hz Clock: 135.000 MHz
Standard timings supported:
  1280x1024@60Hz 5:4 HorFreq: 64000 Hz Clock: 108.000 MHz
  1280x960@60Hz 4:3 HorFreq: 60000 Hz Clock: 108.000 MHz
Detailed mode: Clock 108.000 MHz, 338 mm x 270 mm
               1280 1328 1440 1688 hborder 0
               1024 1025 1028 1066 vborder 0
               +hsync +vsync 
               VertFreq: 60 Hz, HorFreq: 63981 Hz
Monitor ranges (GTF): 56-75Hz V, 28-81kHz H, max dotclock 140MHz
Monitor name: SDM-E76D
Serial number: --
Checksum: 0x7b (valid)
