
EDID (hex):
00ffffffffffff000dae751300000000
061c0104951d11780228659759548e27
1e505400000001010101010101010101
010101010101b43b804a713834402e1e
240025a510000018000000fe004e3133
334843452d4541410a20000000fe0043
4d4e0a202020202020202020000000fe
004e3133334843452d4541410a200027

edid-decode (hex):

00 ff ff ff ff ff ff 00 0d ae 75 13 00 00 00 00
06 1c 01 04 95 1d 11 78 02 28 65 97 59 54 8e 27
1e 50 54 00 00 00 01 01 01 01 01 01 01 01 01 01
01 01 01 01 01 01 b4 3b 80 4a 71 38 34 40 2e 1e
24 00 25 a5 10 00 00 18 00 00 00 fe 00 4e 31 33
33 48 43 45 2d 45 41 41 0a 20 00 00 00 fe 00 43
4d 4e 0a 20 20 20 20 20 20 20 20 20 00 00 00 fe
00 4e 31 33 33 48 43 45 2d 45 41 41 0a 20 00 27

----------------

Block 0, Base EDID:
  EDID Structure Version & Revision: 1.4
  Vendor & Product Identification:
    Manufacturer: CMN
    Model: 4981
    Made in: week 6 of 2018
  Basic Display Parameters & Features:
    Digital display
    Bits per primary color channel: 6
    DisplayPort interface
    Maximum image size: 29 cm x 17 cm
    Gamma: 2.20
    Supported color formats: RGB 4:4:4
    First detailed timing includes the native pixel format and preferred refresh rate
  Color Characteristics:
    Red  : 0.5898, 0.3496
    Green: 0.3300, 0.5546
    Blue : 0.1533, 0.1191
    White: 0.3134, 0.3291
  Established Timings I & II: none
  Standard Timings: none
  Detailed Timing Descriptors:
    DTD 1:  1920x1080   60.007852 Hz  16:9     67.929 kHz    152.840000 MHz (293 mm x 165 mm)
                 Hfront   46 Hsync  30 Hback  254 Hpol N
                 Vfront    2 Vsync   4 Vback   46 Vpol N
    Alphanumeric Data String: 'N133HCE-EAA'
    Alphanumeric Data String: 'CMN'
    Alphanumeric Data String: 'N133HCE-EAA'
Checksum: 0x27
