
EDID (hex):
00ffffffffffff0006af994a00000000
011f0104a5221378036e859358589228
1e505400000001010101010101010101
010101010101d94080c87038e0406c30
aa0058c2100000180000000f00000000
00000000000000000020000000fd0030
3c44440e010a202020202020000000fe
004231353648414e30322e310a2000ea

Extracted contents:
header:          00 ff ff ff ff ff ff 00
serial number:   06 af 99 4a 00 00 00 00 01 1f
version:         01 04
basic params:    a5 22 13 78 03
chroma info:     6e 85 93 58 58 92 28 1e 50 54
established:     00 00 00
standard:        01 01 01 01 01 01 01 01 01 01 01 01 01 01 01 01
descriptor 1:    d9 40 80 c8 70 38 e0 40 6c 30 aa 00 58 c2 10 00 00 18
descriptor 2:    00 00 00 0f 00 00 00 00 00 00 00 00 00 00 00 00 00 20
descriptor 3:    00 00 00 fd 00 30 3c 44 44 0e 01 0a 20 20 20 20 20 20
descriptor 4:    00 00 00 fe 00 42 31 35 36 48 41 4e 30 32 2e 31 0a 20
extensions:      00
checksum:        ea

EDID version: 1.4
Manufacturer: AUO Model 4a99 Serial Number --
Made in week 1 of 2021
Digital display
8 bits per primary color channel
DisplayPort interface
Maximum image size: 34 cm x 19 cm
Gamma: 2.20
Supported color formats: RGB 4:4:4
First detailed timing includes the native pixel format and preferred refresh rate
Display is continuous frequency
Display x,y Chromaticity:
  Red:   0.5751, 0.3457
  Green: 0.3466, 0.5722
  Blue:  0.1582, 0.1171
  White: 0.3134, 0.3291
Established timings supported:
Standard timings supported:
Detailed mode: Clock 166.010 MHz, 344 mm x 194 mm
               1920 2028 2076 2120 hborder 0
               1080 1090 1100 1304 vborder 0
               -hsync -vsync 
               VertFreq: 60 Hz, HorFreq: 78306 Hz
Manufacturer-specified data, tag 15
Monitor ranges (bare limits): 48-60Hz V, 68-68kHz H, max dotclock 140MHz
ASCII string: B156HAN02.1
Checksum: 0xea (valid)
EDID block does NOT conform to EDID 1.4!
	Missing name descriptor
Warning: One or more of the timings is out of range of the Monitor Ranges:
  Vertical Freq: 60 - 60 Hz
  Horizontal Freq: 78306 - 78306 Hz
  Maximum Clock: 166.010 MHz
