
EDID (hex):
00ffffffffffff0015c34931f6211403
17200103803c2278eab095ab524ea026
0f5054a10800a9408180d100b300a9c0
810081c00101565e00a0a0a029503020
350055502100001a000000ff00353136
35313036320a20202020000000fd001d
3d1f5919000a202020202020000000fc
004556323739350a202020202020013e
020321f149101f041312031102012309
7f078301000067030c0010008032e200
6a283c80a070b0234030203600555021
00001a8c0ad08a20e02d10103e960055
50210000188c0ad090204031200c4055
00555021000018011d00bc52d01e20b8
28554055502100001e011d007251d01e
206e28550055502100001e00000000a4

edid-decode (hex):

00 ff ff ff ff ff ff 00 15 c3 49 31 f6 21 14 03
17 20 01 03 80 3c 22 78 ea b0 95 ab 52 4e a0 26
0f 50 54 a1 08 00 a9 40 81 80 d1 00 b3 00 a9 c0
81 00 81 c0 01 01 56 5e 00 a0 a0 a0 29 50 30 20
35 00 55 50 21 00 00 1a 00 00 00 ff 00 35 31 36
35 31 30 36 32 0a 20 20 20 20 00 00 00 fd 00 1d
3d 1f 59 19 00 0a 20 20 20 20 20 20 00 00 00 fc
00 45 56 32 37 39 35 0a 20 20 20 20 20 20 01 3e

02 03 21 f1 49 10 1f 04 13 12 03 11 02 01 23 09
7f 07 83 01 00 00 67 03 0c 00 10 00 80 32 e2 00
6a 28 3c 80 a0 70 b0 23 40 30 20 36 00 55 50 21
00 00 1a 8c 0a d0 8a 20 e0 2d 10 10 3e 96 00 55
50 21 00 00 18 8c 0a d0 90 20 40 31 20 0c 40 55
00 55 50 21 00 00 18 01 1d 00 bc 52 d0 1e 20 b8
28 55 40 55 50 21 00 00 1e 01 1d 00 72 51 d0 1e
20 6e 28 55 00 55 50 21 00 00 1e 00 00 00 00 a4

----------------

Block 0, Base EDID:
  EDID Structure Version & Revision: 1.3
  Vendor & Product Identification:
    Manufacturer: ENC
    Model: 12617
    Serial Number: 51651062
    Made in: week 23 of 2022
  Basic Display Parameters & Features:
    Digital display
    Maximum image size: 60 cm x 34 cm
    Gamma: 2.20
    DPMS levels: Standby Suspend Off
    RGB color display
    First detailed timing is the preferred timing
  Color Characteristics:
    Red  : 0.6699, 0.3232
    Green: 0.3046, 0.6250
    Blue : 0.1503, 0.0595
    White: 0.3134, 0.3291
  Established Timings I & II:
    IBM     :   720x400    70.081663 Hz   9:5     31.467 kHz     28.320000 MHz
    DMT 0x04:   640x480    59.940476 Hz   4:3     31.469 kHz     25.175000 MHz
    DMT 0x09:   800x600    60.316541 Hz   4:3     37.879 kHz     40.000000 MHz
    DMT 0x10:  1024x768    60.003840 Hz   4:3     48.363 kHz     65.000000 MHz
  Standard Timings:
    DMT 0x33:  1600x1200   60.000000 Hz   4:3     75.000 kHz    162.000000 MHz
    DMT 0x23:  1280x1024   60.019740 Hz   5:4     63.981 kHz    108.000000 MHz
    DMT 0x45:  1920x1200   59.884600 Hz  16:10    74.556 kHz    193.250000 MHz
    DMT 0x3a:  1680x1050   59.954250 Hz  16:10    65.290 kHz    146.250000 MHz
    DMT 0x53:  1600x900    60.000000 Hz  16:9     60.000 kHz    108.000000 MHz (RB)
    DMT 0x1c:  1280x800    59.810326 Hz  16:10    49.702 kHz     83.500000 MHz
    DMT 0x55:  1280x720    60.000000 Hz  16:9     45.000 kHz     74.250000 MHz
  Detailed Timing Descriptors:
    DTD 1:  2560x1440   59.950550 Hz  16:9     88.787 kHz    241.500000 MHz (597 mm x 336 mm)
                 Hfront   48 Hsync  32 Hback   80 Hpol P
                 Vfront    3 Vsync   5 Vback   33 Vpol N
    Display Product Serial Number: '51651062'
    Display Range Limits:
      Monitor ranges (GTF): 29-61 Hz V, 31-89 kHz H, max dotclock 250 MHz
    Display Product Name: 'EV2795'
  Extension blocks: 1
Checksum: 0x3e

----------------

Block 1, CTA-861 Extension Block:
  Revision: 3
  Underscans IT Video Formats by default
  Basic audio support
  Supports YCbCr 4:4:4
  Supports YCbCr 4:2:2
  Native detailed modes: 1
  Video Data Block:
    VIC  16:  1920x1080   60.000000 Hz  16:9     67.500 kHz    148.500000 MHz
    VIC  31:  1920x1080   50.000000 Hz  16:9     56.250 kHz    148.500000 MHz
    VIC   4:  1280x720    60.000000 Hz  16:9     45.000 kHz     74.250000 MHz
    VIC  19:  1280x720    50.000000 Hz  16:9     37.500 kHz     74.250000 MHz
    VIC  18:   720x576    50.000000 Hz  16:9     31.250 kHz     27.000000 MHz
    VIC   3:   720x480    59.940060 Hz  16:9     31.469 kHz     27.000000 MHz
    VIC  17:   720x576    50.000000 Hz   4:3     31.250 kHz     27.000000 MHz
    VIC   2:   720x480    59.940060 Hz   4:3     31.469 kHz     27.000000 MHz
    VIC   1:   640x480    59.940476 Hz   4:3     31.469 kHz     25.175000 MHz
  Audio Data Block:
    Linear PCM:
      Max channels: 2
      Supported sample rates (kHz): 192 176.4 96 88.2 48 44.1 32
      Supported sample sizes (bits): 24 20 16
  Speaker Allocation Data Block:
    FL/FR - Front Left/Right
  Vendor-Specific Data Block (HDMI), OUI 00-0C-03:
    Source physical address: 1.0.0.0
    Supports_AI
    Maximum TMDS clock: 250 MHz
  Video Capability Data Block:
    YCbCr quantization: No Data
    RGB quantization: Selectable (via AVI Q)
    PT scan behavior: Always Underscanned
    IT scan behavior: Always Underscanned
    CE scan behavior: Always Underscanned
  Detailed Timing Descriptors:
    DTD 2:  1920x1200   59.950171 Hz  16:10    74.038 kHz    154.000000 MHz (597 mm x 336 mm)
                 Hfront   48 Hsync  32 Hback   80 Hpol P
                 Vfront    3 Vsync   6 Vback   26 Vpol N
    DTD 3:   720x480    59.940060 Hz   3:2     31.469 kHz     27.000000 MHz (597 mm x 336 mm)
                 Hfront   16 Hsync  62 Hback   60 Hpol N
                 Vfront    9 Vsync   6 Vback   30 Vpol N
    DTD 4:   720x576    50.000000 Hz   5:4     31.250 kHz     27.000000 MHz (597 mm x 336 mm)
                 Hfront   12 Hsync  64 Hback   68 Hpol N
                 Vfront    5 Vsync   5 Vback   39 Vpol N
    DTD 5:  1280x720    50.000000 Hz  16:9     37.500 kHz     74.250000 MHz (597 mm x 336 mm)
                 Hfront  440 Hsync  40 Hback  220 Hpol P
                 Vfront    5 Vsync   5 Vback   20 Vpol P
    DTD 6:  1280x720    60.000000 Hz  16:9     45.000 kHz     74.250000 MHz (597 mm x 336 mm)
                 Hfront  110 Hsync  40 Hback  220 Hpol P
                 Vfront    5 Vsync   5 Vback   20 Vpol P
Checksum: 0xa4  Unused space in Extension Block: 4 bytes
