
EDID (hex):
00ffffffffffff0032963c0ac2000000
2a0f010368502d78eaa69ca15a4b9824
164c57bdee0061404540314001010101
01010101010164190040410026301888
3600902c1100001e000000fc004c5456
313238304d31410a2020000000fd0031
4c1e4107000a202020202020000000fe
000a202020202020202020202020005c

Extracted contents:
header:          00 ff ff ff ff ff ff 00
serial number:   32 96 3c 0a c2 00 00 00 2a 0f
version:         01 03
basic params:    68 50 2d 78 ea
chroma info:     a6 9c a1 5a 4b 98 24 16 4c 57
established:     bd ee 00
standard:        61 40 45 40 31 40 01 01 01 01 01 01 01 01 01 01
descriptor 1:    64 19 00 40 41 00 26 30 18 88 36 00 90 2c 11 00 00 1e
descriptor 2:    00 00 00 fc 00 4c 54 56 31 32 38 30 4d 31 41 0a 20 20
descriptor 3:    00 00 00 fd 00 31 4c 1e 41 07 00 0a 20 20 20 20 20 20
descriptor 4:    00 00 00 fe 00 0a 20 20 20 20 20 20 20 20 20 20 20 20
extensions:      00
checksum:        5c

EDID version: 1.3
Manufacturer: LTV Model a3c Serial Number --
Analog display, Input voltage level: 0.7/0.7 V
Sync: Separate 
Maximum image size: 80 cm x 45 cm
Gamma: 2.20
DPMS levels: Standby Suspend Off
RGB color display
First detailed timing is preferred timing
Display x,y Chromaticity:
  Red:   0.6308, 0.3535
  Green: 0.2939, 0.5957
  Blue:  0.1425, 0.0869
  White: 0.2998, 0.3398
Established timings supported:
  720x400@70Hz 9:5 HorFreq: 31469 Hz Clock: 28.320 MHz
  640x480@60Hz 4:3 HorFreq: 31469 Hz Clock: 25.175 MHz
  640x480@67Hz 4:3 HorFreq: 35000 Hz Clock: 30.240 MHz
  640x480@72Hz 4:3 HorFreq: 37900 Hz Clock: 31.500 MHz
  640x480@75Hz 4:3 HorFreq: 37500 Hz Clock: 31.500 MHz
  800x600@60Hz 4:3 HorFreq: 37900 Hz Clock: 40.000 MHz
  800x600@72Hz 4:3 HorFreq: 48100 Hz Clock: 50.000 MHz
  800x600@75Hz 4:3 HorFreq: 46900 Hz Clock: 49.500 MHz
  832x624@75Hz 4:3 HorFreq: 49726 Hz Clock: 57.284 MHz
  1024x768@60Hz 4:3 HorFreq: 48400 Hz Clock: 65.000 MHz
  1024x768@70Hz 4:3 HorFreq: 56500 Hz Clock: 75.000 MHz
  1024x768@75Hz 4:3 HorFreq: 60000 Hz Clock: 78.750 MHz
Standard timings supported:
  1024x768@60Hz 4:3 HorFreq: 48400 Hz Clock: 65.000 MHz
  800x600@60Hz 4:3 HorFreq: 37900 Hz Clock: 40.000 MHz
  640x480@60Hz 4:3 HorFreq: 31469 Hz Clock: 25.175 MHz
Detailed mode: Clock 65.000 MHz, 400 mm x 300 mm
               1024 1048 1184 1344 hborder 0
                768  771  777  806 vborder 0
               +hsync +vsync 
               VertFreq: 60 Hz, HorFreq: 48363 Hz
Monitor name: LTV1280M1A
Monitor ranges (GTF): 49-76Hz V, 30-65kHz H, max dotclock 70MHz
ASCII string: 
Checksum: 0x5c (valid)
One or more of the timings is out of range of the Monitor Ranges:
  Vertical Freq: 60 - 75 Hz
  Horizontal Freq: 31469 - 60000 Hz
  Maximum Clock: 78.750 MHz
EDID block does not conform at all!
	Bad year of manufacture
