
EDID (hex):
00ffffffffffff000aa6022201010101
0c130103802f1e78ea78f1a655489b26
125054230800818081409500b300a940
010101010101283c80a070b023403020
3600da281100001e000000fd00383c1f
5311000a202020202020000000fe0042
554646414c4f0a2020202020000000fc
004654442d48443232333248530a0071

Extracted contents:
header:          00 ff ff ff ff ff ff 00
serial number:   0a a6 02 22 01 01 01 01 0c 13
version:         01 03
basic params:    80 2f 1e 78 ea
chroma info:     78 f1 a6 55 48 9b 26 12 50 54
established:     23 08 00
standard:        81 80 81 40 95 00 b3 00 a9 40 01 01 01 01 01 01
descriptor 1:    28 3c 80 a0 70 b0 23 40 30 20 36 00 da 28 11 00 00 1e
descriptor 2:    00 00 00 fd 00 38 3c 1f 53 11 00 0a 20 20 20 20 20 20
descriptor 3:    00 00 00 fe 00 42 55 46 46 41 4c 4f 0a 20 20 20 20 20
descriptor 4:    00 00 00 fc 00 46 54 44 2d 48 44 32 32 33 32 48 53 0a
extensions:      00
checksum:        71

Manufacturer: BUF Model 2202 Serial Number --
Made week 12 of 2009
EDID version: 1.3
Digital display
Maximum image size: 47 cm x 30 cm
Gamma: 2.20
DPMS levels: Standby Suspend Off
Supported color formats: RGB 4:4:4, YCrCb 4:2:2
First detailed timing is preferred timing
Established timings supported:
  640x480@60Hz
  800x600@56Hz
  800x600@60Hz
  1024x768@60Hz
Standard timings supported:
  1280x1024@60Hz
  1280x960@60Hz
  1440x900@60Hz
  1680x1050@60Hz
  1600x1200@60Hz
Detailed mode: Clock 154.000 MHz, 474 mm x 296 mm
               1920 1968 2000 2080 hborder 0
               1200 1203 1209 1235 vborder 0
               +hsync +vsync 
Monitor ranges (GTF): 56-60Hz V, 31-83kHz H, max dotclock 170MHz
ASCII string: BUFFALO
Monitor name: FTD
Checksum: 0x71 (valid)
EDID block does NOT conform to EDID 1.3!
	Detailed block string not properly terminated
