
EDID (hex):
00ffffffffffff0030e46f0400000000
0018010495221378eadc95a35855a026
0d505400000001010101010101010101
0101010101012e3680a070381f403020
350058c21000001a522b80a070381f40
3020350058c21000001a000000fe0033
38373459803135365746360a00000000
000041319e001000000a010a20200092

Extracted contents:
header:          00 ff ff ff ff ff ff 00
serial number:   30 e4 6f 04 00 00 00 00 00 18
version:         01 04
basic params:    95 22 13 78 ea
chroma info:     dc 95 a3 58 55 a0 26 0d 50 54
established:     00 00 00
standard:        01 01 01 01 01 01 01 01 01 01 01 01 01 01 01 01
descriptor 1:    2e 36 80 a0 70 38 1f 40 30 20 35 00 58 c2 10 00 00 1a
descriptor 2:    52 2b 80 a0 70 38 1f 40 30 20 35 00 58 c2 10 00 00 1a
descriptor 3:    00 00 00 fe 00 33 38 37 34 59 80 31 35 36 57 46 36 0a
descriptor 4:    00 00 00 00 00 00 41 31 9e 00 10 00 00 0a 01 0a 20 20
extensions:      00
checksum:        92

Manufacturer: LGD Model 46f Serial Number --
Made week 0 of 2014
EDID version: 1.4
Digital display
6 bits per primary color channel
DisplayPort interface
Maximum image size: 34 cm x 19 cm
Gamma: 2.20
DPMS levels: Standby Suspend Off
Supported color formats: RGB 4:4:4, YCrCb 4:2:2
First detailed timing is preferred timing
Established timings supported:
Standard timings supported:
Detailed mode: Clock 138.700 MHz, 344 mm x 194 mm
               1920 1968 2000 2080 hborder 0
               1080 1083 1088 1111 vborder 0
               +hsync -vsync 
Detailed mode: Clock 110.900 MHz, 344 mm x 194 mm
               1920 1968 2000 2080 hborder 0
               1080 1083 1088 1111 vborder 0
               +hsync -vsync 
ASCII string: 3874Y
Manufacturer-specified data, tag 0
Checksum: 0x92 (valid)
EDID block does NOT conform to EDID 1.3!
	Missing name descriptor
	Missing monitor ranges
	Detailed block string not properly terminated
