
EDID (hex):
00ffffffffffff0009e5040800000000
011d0104a5221378024c30a454519b27
0c505400000001010101010101010101
0101010101019d8580a070383e406c30
aa0058c11000001a9d8580a070387d46
6c30aa0058c110000000000000fe0042
4f452048460a202020202020000000fe
004e5631353646484d2d4e344b0a00d8

Extracted contents:
header:          00 ff ff ff ff ff ff 00
serial number:   09 e5 04 08 00 00 00 00 01 1d
version:         01 04
basic params:    a5 22 13 78 02
chroma info:     4c 30 a4 54 51 9b 27 0c 50 54
established:     00 00 00
standard:        01 01 01 01 01 01 01 01 01 01 01 01 01 01 01 01
descriptor 1:    9d 85 80 a0 70 38 3e 40 6c 30 aa 00 58 c1 10 00 00 1a
descriptor 2:    9d 85 80 a0 70 38 7d 46 6c 30 aa 00 58 c1 10 00 00 00
descriptor 3:    00 00 00 fe 00 42 4f 45 20 48 46 0a 20 20 20 20 20 20
descriptor 4:    00 00 00 fe 00 4e 56 31 35 36 46 48 4d 2d 4e 34 4b 0a
extensions:      00
checksum:        d8

EDID version: 1.4
Manufacturer: BOE Model 804 Serial Number --
Made in week 1 of 2019
Digital display
8 bits per primary color channel
DisplayPort interface
Maximum image size: 34 cm x 19 cm
Gamma: 2.20
Supported color formats: RGB 4:4:4
First detailed timing includes the native pixel format and preferred refresh rate
Display x,y Chromaticity:
  Red:   0.6416, 0.3281
  Green: 0.3193, 0.6054
  Blue:  0.1523, 0.0498
  White: 0.3125, 0.3281
Established timings supported:
Standard timings supported:
Detailed mode: Clock 342.050 MHz, 344 mm x 193 mm
               1920 2028 2076 2080 hborder 0
               1080 1090 1100 1142 vborder 0
               +hsync -vsync 
               VertFreq: 143 Hz, HorFreq: 164447 Hz
Detailed mode: Clock 342.050 MHz, 344 mm x 193 mm
               1920 2028 2076 2080 hborder 0
               1080 1090 1100 2741 vborder 0
               -hsync -vsync analog composite 
               VertFreq: 59 Hz, HorFreq: 164447 Hz
ASCII string: BOE HF
ASCII string: NV156FHM-N4K
Checksum: 0xd8 (valid)
EDID block does NOT conform to EDID 1.4!
	Missing name descriptor
	Missing monitor ranges
