
EDID (hex):
00ffffffffffff0009e59c0800000000
00110103801a10780a6f8c905a548a25
1e4c5200000001010101010101010101
010101010101121b00a0502017303020
360005a310000019000000fe000a2020
20202020202020202020000000fe0042
4f452048594449530a202020000000fe
0048563132315758362d3130300a0060

edid-decode (hex):

00 ff ff ff ff ff ff 00 09 e5 9c 08 00 00 00 00
00 11 01 03 80 1a 10 78 0a 6f 8c 90 5a 54 8a 25
1e 4c 52 00 00 00 01 01 01 01 01 01 01 01 01 01
01 01 01 01 01 01 12 1b 00 a0 50 20 17 30 30 20
36 00 05 a3 10 00 00 19 00 00 00 fe 00 0a 20 20
20 20 20 20 20 20 20 20 20 20 00 00 00 fe 00 42
4f 45 20 48 59 44 49 53 0a 20 20 20 00 00 00 fe
00 48 56 31 32 31 57 58 36 2d 31 30 30 0a 00 60

----------------

Block 0, Base EDID:
  EDID Structure Version & Revision: 1.3
  Vendor & Product Identification:
    Manufacturer: BOE
    Model: 2204
    Made in: 2007
  Basic Display Parameters & Features:
    Digital display
    Maximum image size: 26 cm x 16 cm
    Gamma: 2.20
    RGB color display
    First detailed timing is the preferred timing
  Color Characteristics:
    Red  : 0.5634, 0.3535
    Green: 0.3310, 0.5419
    Blue : 0.1464, 0.1171
    White: 0.2998, 0.3203
  Established Timings I & II: none
  Standard Timings: none
  Detailed Timing Descriptors:
    DTD 1:  1280x800    58.475091 Hz  16:10    48.125 kHz     69.300000 MHz (261 mm x 163 mm)
                 Hfront   48 Hsync  32 Hback   80 Hpol N
                 Vfront    3 Vsync   6 Vback   14 Vpol N
    Alphanumeric Data String: ''
    Alphanumeric Data String: 'BOE HYDIS'
    Alphanumeric Data String: 'HV121WX6-100'
Checksum: 0x60
