
EDID (hex):
00ffffffffffff001358821501000000
1c200103802313783a64feaa52439922
16515c210800d1c07140818001010101
0101814081c0023a801871382d40582c
250054be1000001e000000fc004b332d
320a2020202020202020000000ff0030
30303030303030303030300a000000fd
002f4b185413000a2020202020200108
020338f24f0102030405060710111213
1415161fe305e30123097f0783010000
67030c001000383ce606070162623068
1a000001013c30e6023a801871382d40
582c250054be1000001e011d8018711c
1620582c250054be1000009e00000000
00000000000000000000000000000000
00000000000000000000000000000053

edid-decode (hex):

00 ff ff ff ff ff ff 00 13 58 82 15 01 00 00 00
1c 20 01 03 80 23 13 78 3a 64 fe aa 52 43 99 22
16 51 5c 21 08 00 d1 c0 71 40 81 80 01 01 01 01
01 01 81 40 81 c0 02 3a 80 18 71 38 2d 40 58 2c
25 00 54 be 10 00 00 1e 00 00 00 fc 00 4b 33 2d
32 0a 20 20 20 20 20 20 20 20 00 00 00 ff 00 30
30 30 30 30 30 30 30 30 30 30 30 0a 00 00 00 fd
00 2f 4b 18 54 13 00 0a 20 20 20 20 20 20 01 08

02 03 38 f2 4f 01 02 03 04 05 06 07 10 11 12 13
14 15 16 1f e3 05 e3 01 23 09 7f 07 83 01 00 00
67 03 0c 00 10 00 38 3c e6 06 07 01 62 62 30 68
1a 00 00 01 01 3c 30 e6 02 3a 80 18 71 38 2d 40
58 2c 25 00 54 be 10 00 00 1e 01 1d 80 18 71 1c
16 20 58 2c 25 00 54 be 10 00 00 9e 00 00 00 00
00 00 00 00 00 00 00 00 00 00 00 00 00 00 00 00
00 00 00 00 00 00 00 00 00 00 00 00 00 00 00 53

----------------

Block 0, Base EDID:
  EDID Structure Version & Revision: 1.3
  Vendor & Product Identification:
    Manufacturer: DZX
    Model: 5506
    Serial Number: 1
    Made in: week 28 of 2022
  Basic Display Parameters & Features:
    Digital display
    Maximum image size: 35 cm x 19 cm
    Gamma: 2.20
    DPMS levels: Off
    Undefined display color type
    First detailed timing is the preferred timing
  Color Characteristics:
    Red  : 0.6650, 0.3222
    Green: 0.2626, 0.5976
    Blue : 0.1357, 0.0888
    White: 0.3193, 0.3613
  Established Timings I & II:
    DMT 0x04:   640x480    59.940476 Hz   4:3     31.469 kHz     25.175000 MHz
    DMT 0x09:   800x600    60.316541 Hz   4:3     37.879 kHz     40.000000 MHz
    DMT 0x10:  1024x768    60.003840 Hz   4:3     48.363 kHz     65.000000 MHz
  Standard Timings:
    DMT 0x52:  1920x1080   60.000000 Hz  16:9     67.500 kHz    148.500000 MHz
    GTF     :  1152x864    60.000000 Hz   4:3     53.700 kHz     81.624000 MHz
    DMT 0x23:  1280x1024   60.019740 Hz   5:4     63.981 kHz    108.000000 MHz
    DMT 0x20:  1280x960    60.000000 Hz   4:3     60.000 kHz    108.000000 MHz
    DMT 0x55:  1280x720    60.000000 Hz  16:9     45.000 kHz     74.250000 MHz
  Detailed Timing Descriptors:
    DTD 1:  1920x1080   60.000000 Hz  16:9     67.500 kHz    148.500000 MHz (340 mm x 190 mm)
                 Hfront   88 Hsync  44 Hback  148 Hpol P
                 Vfront    2 Vsync   5 Vback   38 Vpol P
    Display Product Name: 'K3-2'
    Display Product Serial Number: '000000000000'
    Display Range Limits:
      Monitor ranges (GTF): 47-75 Hz V, 24-84 kHz H, max dotclock 190 MHz
  Extension blocks: 1
Checksum: 0x08

----------------

Block 1, CTA-861 Extension Block:
  Revision: 3
  Underscans IT Video Formats by default
  Basic audio support
  Supports YCbCr 4:4:4
  Supports YCbCr 4:2:2
  Native detailed modes: 2
  Video Data Block:
    VIC   1:   640x480    59.940476 Hz   4:3     31.469 kHz     25.175000 MHz
    VIC   2:   720x480    59.940060 Hz   4:3     31.469 kHz     27.000000 MHz
    VIC   3:   720x480    59.940060 Hz  16:9     31.469 kHz     27.000000 MHz
    VIC   4:  1280x720    60.000000 Hz  16:9     45.000 kHz     74.250000 MHz
    VIC   5:  1920x1080i  60.000000 Hz  16:9     33.750 kHz     74.250000 MHz
    VIC   6:  1440x480i   59.940060 Hz   4:3     15.734 kHz     27.000000 MHz
    VIC   7:  1440x480i   59.940060 Hz  16:9     15.734 kHz     27.000000 MHz
    VIC  16:  1920x1080   60.000000 Hz  16:9     67.500 kHz    148.500000 MHz
    VIC  17:   720x576    50.000000 Hz   4:3     31.250 kHz     27.000000 MHz
    VIC  18:   720x576    50.000000 Hz  16:9     31.250 kHz     27.000000 MHz
    VIC  19:  1280x720    50.000000 Hz  16:9     37.500 kHz     74.250000 MHz
    VIC  20:  1920x1080i  50.000000 Hz  16:9     28.125 kHz     74.250000 MHz
    VIC  21:  1440x576i   50.000000 Hz   4:3     15.625 kHz     27.000000 MHz
    VIC  22:  1440x576i   50.000000 Hz  16:9     15.625 kHz     27.000000 MHz
    VIC  31:  1920x1080   50.000000 Hz  16:9     56.250 kHz    148.500000 MHz
  Colorimetry Data Block:
    xvYCC601
    xvYCC709
    BT2020cYCC
    BT2020YCC
    BT2020RGB
    Gamut Boundary Description Metadata Profile P0
  Audio Data Block:
    Linear PCM:
      Max channels: 2
      Supported sample rates (kHz): 192 176.4 96 88.2 48 44.1 32
      Supported sample sizes (bits): 24 20 16
  Speaker Allocation Data Block:
    FL/FR - Front Left/Right
  Vendor-Specific Data Block (HDMI), OUI 00-0C-03:
    Source physical address: 1.0.0.0
    DC_36bit
    DC_30bit
    DC_Y444
    Maximum TMDS clock: 300 MHz
  HDR Static Metadata Data Block:
    Electro optical transfer functions:
      Traditional gamma - SDR luminance range
      Traditional gamma - HDR luminance range
      SMPTE ST2084
    Supported static metadata descriptors:
      Static metadata type 1
    Desired content max luminance: 98 (417.710 cd/m^2)
    Desired content max frame-average luminance: 98 (417.710 cd/m^2)
    Desired content min luminance: 48 (0.148 cd/m^2)
  Vendor-Specific Data Block (AMD), OUI 00-00-1A:
    Version: 1.1
    Minimum Refresh Rate: 60 Hz
    Maximum Refresh Rate: 48 Hz
    Flags 1.x: 0xe6 (MCCS)
  Detailed Timing Descriptors:
    DTD 2:  1920x1080   60.000000 Hz  16:9     67.500 kHz    148.500000 MHz (340 mm x 190 mm)
                 Hfront   88 Hsync  44 Hback  148 Hpol P
                 Vfront    2 Vsync   5 Vback   38 Vpol P
    DTD 3:  1920x1080i  60.000000 Hz  16:9     33.750 kHz     74.250000 MHz (340 mm x 190 mm)
                 Hfront   88 Hsync  44 Hback  148 Hpol P
                 Vfront    2 Vsync   5 Vback   15 Vpol P Vfront +0.5 Odd Field
                 Vfront    2 Vsync   5 Vback   15 Vpol P Vback  +0.5 Even Field
Checksum: 0x53  Unused space in Extension Block: 35 bytes
