
EDID (hex):
00ffffffffffff00410c70c1fea70000
2e1c0103804627782ab075a6574fa226
105054bfef00d1c0b300950081808140
81c001010101565e00a0a0a029503020
3500bb892100001e000000ff00554b30
31383436303433303036000000fc0050
484c203332364538460a2020000000fd
00324c1e631e000a202020202020011a
02010400023a801871382d40582c4500
bb892100001e011d007251d01e206e28
5500bb892100001e8c0ad08a20e02d10
103e9600bb89210000188c0ad0902040
31200c405500bb8921000018f03c00d0
51a0355060883a00bb892100001c0000
00000000000000000000000000000000
000000000000000000000000000000fe

Extracted contents:
header:          00 ff ff ff ff ff ff 00
serial number:   41 0c 70 c1 fe a7 00 00 2e 1c
version:         01 03
basic params:    80 46 27 78 2a
chroma info:     b0 75 a6 57 4f a2 26 10 50 54
established:     bf ef 00
standard:        d1 c0 b3 00 95 00 81 80 81 40 81 c0 01 01 01 01
descriptor 1:    56 5e 00 a0 a0 a0 29 50 30 20 35 00 bb 89 21 00 00 1e
descriptor 2:    00 00 00 ff 00 55 4b 30 31 38 34 36 30 34 33 30 30 36
descriptor 3:    00 00 00 fc 00 50 48 4c 20 33 32 36 45 38 46 0a 20 20
descriptor 4:    00 00 00 fd 00 32 4c 1e 63 1e 00 0a 20 20 20 20 20 20
extensions:      01
checksum:        1a

EDID version: 1.3
Manufacturer: PHL Model c170 Serial Number --
Made in week 46 of 2018
Digital display
Maximum image size: 70 cm x 39 cm
Gamma: 2.20
DPMS levels: Off
RGB color display
First detailed timing is preferred timing
Display x,y Chromaticity:
  Red:   0.6503, 0.3427
  Green: 0.3085, 0.6328
  Blue:  0.1494, 0.0654
  White: 0.3134, 0.3291
Established timings supported:
  720x400@70Hz 9:5 HorFreq: 31469 Hz Clock: 28.320 MHz
  640x480@60Hz 4:3 HorFreq: 31469 Hz Clock: 25.175 MHz
  640x480@67Hz 4:3 HorFreq: 35000 Hz Clock: 30.240 MHz
  640x480@72Hz 4:3 HorFreq: 37900 Hz Clock: 31.500 MHz
  640x480@75Hz 4:3 HorFreq: 37500 Hz Clock: 31.500 MHz
  800x600@56Hz 4:3 HorFreq: 35200 Hz Clock: 36.000 MHz
  800x600@60Hz 4:3 HorFreq: 37900 Hz Clock: 40.000 MHz
  800x600@72Hz 4:3 HorFreq: 48100 Hz Clock: 50.000 MHz
  800x600@75Hz 4:3 HorFreq: 46900 Hz Clock: 49.500 MHz
  832x624@75Hz 4:3 HorFreq: 49726 Hz Clock: 57.284 MHz
  1024x768@60Hz 4:3 HorFreq: 48400 Hz Clock: 65.000 MHz
  1024x768@70Hz 4:3 HorFreq: 56500 Hz Clock: 75.000 MHz
  1024x768@75Hz 4:3 HorFreq: 60000 Hz Clock: 78.750 MHz
  1280x1024@75Hz 5:4 HorFreq: 80000 Hz Clock: 135.000 MHz
Standard timings supported:
  1920x1080@60Hz 16:9
  1680x1050@60Hz 16:10 HorFreq: 64700 Hz Clock: 119.000 MHz
  1440x900@60Hz 16:10 HorFreq: 55500 Hz Clock: 88.750 MHz
  1280x1024@60Hz 5:4 HorFreq: 64000 Hz Clock: 108.000 MHz
  1280x960@60Hz 4:3 HorFreq: 60000 Hz Clock: 108.000 MHz
  1280x720@60Hz 16:9
Detailed mode: Clock 241.500 MHz, 699 mm x 393 mm
               2560 2608 2640 2720 hborder 0
               1440 1443 1448 1481 vborder 0
               +hsync +vsync 
               VertFreq: 59 Hz, HorFreq: 88786 Hz
Serial number: --
Monitor name: PHL 326E8F
Monitor ranges (GTF): 50-76Hz V, 30-99kHz H, max dotclock 300MHz
Has 1 extension blocks
Checksum: 0x1a (valid)

CTA extension block
Extension version: 1
0 8-byte timing descriptors
Detailed mode: Clock 148.500 MHz, 699 mm x 393 mm
               1920 2008 2052 2200 hborder 0
               1080 1084 1089 1125 vborder 0
               +hsync +vsync 
               VertFreq: 60 Hz, HorFreq: 67500 Hz
Detailed mode: Clock 74.250 MHz, 699 mm x 393 mm
               1280 1390 1430 1650 hborder 0
                720  725  730  750 vborder 0
               +hsync +vsync 
               VertFreq: 60 Hz, HorFreq: 45000 Hz
Detailed mode: Clock 27.000 MHz, 699 mm x 393 mm
                720  736  798  858 hborder 0
                480  489  495  525 vborder 0
               -hsync -vsync 
               VertFreq: 59 Hz, HorFreq: 31468 Hz
Detailed mode: Clock 27.000 MHz, 699 mm x 393 mm
                720  732  796  864 hborder 0
                576  581  586  625 vborder 0
               -hsync -vsync 
               VertFreq: 50 Hz, HorFreq: 31250 Hz
Detailed mode: Clock 156.000 MHz, 699 mm x 393 mm
               1280 1376 1512 1744 hborder 0
               1440 1443 1453 1493 vborder 0
               -hsync +vsync 
               VertFreq: 59 Hz, HorFreq: 89449 Hz
Checksum: 0xfe (valid)

EDID block does not conform at all!
	Both the serial number and the serial string are set
