
EDID (hex):
00ffffffffffff0022f01a2801010101
1713010380291778ee6f75a4554d9b25
125054a12b8081c00101010101010101
010101010101662156aa51001e30468f
33009dea1000001e000000fd00324c18
530e000a202020202020000000fc0048
502077313835380a20202020000000ff
00434e43393233313237430a2020005b

edid-decode (hex):

00 ff ff ff ff ff ff 00 22 f0 1a 28 01 01 01 01
17 13 01 03 80 29 17 78 ee 6f 75 a4 55 4d 9b 25
12 50 54 a1 2b 80 81 c0 01 01 01 01 01 01 01 01
01 01 01 01 01 01 66 21 56 aa 51 00 1e 30 46 8f
33 00 9d ea 10 00 00 1e 00 00 00 fd 00 32 4c 18
53 0e 00 0a 20 20 20 20 20 20 00 00 00 fc 00 48
50 20 77 31 38 35 38 0a 20 20 20 20 00 00 00 ff
00 43 4e 43 39 32 33 31 32 37 43 0a 20 20 00 5b

----------------

Block 0, Base EDID:
  EDID Structure Version & Revision: 1.3
  Vendor & Product Identification:
    Manufacturer: HWP
    Model: 10266
    Serial Number: 16843009
    Made in: week 23 of 2009
  Basic Display Parameters & Features:
    Digital display
    Maximum image size: 41 cm x 23 cm
    Gamma: 2.20
    DPMS levels: Standby Suspend Off
    RGB color display
    Default (sRGB) color space is primary color space
    First detailed timing is the preferred timing
  Color Characteristics:
    Red  : 0.6416, 0.3339
    Green: 0.3037, 0.6083
    Blue : 0.1455, 0.0732
    White: 0.3134, 0.3291
  Established Timings I & II:
    IBM     :   720x400    70.081663 Hz   9:5     31.467 kHz     28.320000 MHz
    DMT 0x04:   640x480    59.940476 Hz   4:3     31.469 kHz     25.175000 MHz
    DMT 0x09:   800x600    60.316541 Hz   4:3     37.879 kHz     40.000000 MHz
    Apple   :   832x624    74.551266 Hz   4:3     49.726 kHz     57.284000 MHz
    DMT 0x10:  1024x768    60.003840 Hz   4:3     48.363 kHz     65.000000 MHz
    DMT 0x12:  1024x768    75.028582 Hz   4:3     60.023 kHz     78.750000 MHz
    DMT 0x24:  1280x1024   75.024675 Hz   5:4     79.976 kHz    135.000000 MHz
    Apple   :  1152x870    75.061550 Hz 192:145   68.681 kHz    100.000000 MHz
  Standard Timings:
    DMT 0x55:  1280x720    60.000000 Hz  16:9     45.000 kHz     74.250000 MHz
  Detailed Timing Descriptors:
    DTD 1:  1366x768    59.789541 Hz 683:384   47.712 kHz     85.500000 MHz (413 mm x 234 mm)
                 Hfront   70 Hsync 143 Hback  213 Hpol P
                 Vfront    3 Vsync   3 Vback   24 Vpol P
    Display Range Limits:
      Monitor ranges (GTF): 50-76 Hz V, 24-83 kHz H, max dotclock 140 MHz
    Display Product Name: 'HP w1858'
    Display Product Serial Number: 'CNC923127C'
Checksum: 0x5b
