
EDID (hex):
00ffffffffffff001e6d1858477b0200
0a1501036c301b78ea9535a159579f27
0e5054a54b00714f8180818fb3000101
010101010101023a801871382d40582c
4500dd0c1100001e000000fd00384b1e
530f000a202020202020000000fc0045
323234310a20202020202020000000ff
003131304e44565734533633310a0078

Extracted contents:
header:          00 ff ff ff ff ff ff 00
serial number:   1e 6d 18 58 47 7b 02 00 0a 15
version:         01 03
basic params:    6c 30 1b 78 ea
chroma info:     95 35 a1 59 57 9f 27 0e 50 54
established:     a5 4b 00
standard:        71 4f 81 80 81 8f b3 00 01 01 01 01 01 01 01 01
descriptor 1:    02 3a 80 18 71 38 2d 40 58 2c 45 00 dd 0c 11 00 00 1e
descriptor 2:    00 00 00 fd 00 38 4b 1e 53 0f 00 0a 20 20 20 20 20 20
descriptor 3:    00 00 00 fc 00 45 32 32 34 31 0a 20 20 20 20 20 20 20
descriptor 4:    00 00 00 ff 00 31 31 30 4e 44 56 57 34 53 36 33 31 0a
extensions:      00
checksum:        78

Manufacturer: GSM Model 5818 Serial Number --
Made week 10 of 2011
EDID version: 1.3
Analog display, Input voltage level: 0.7/0.7 V
Sync: Separate Composite 
Maximum image size: 48 cm x 27 cm
Gamma: 2.20
DPMS levels: Standby Suspend Off
RGB color display
First detailed timing is preferred timing
Established timings supported:
  720x400@70Hz
  640x480@60Hz
  640x480@75Hz
  800x600@60Hz
  800x600@75Hz
  1024x768@60Hz
  1024x768@75Hz
  1280x1024@75Hz
Standard timings supported:
  1152x864@75Hz
  1280x1024@60Hz
  1280x1024@75Hz
  1680x1050@60Hz
Detailed mode: Clock 148.500 MHz, 477 mm x 268 mm
               1920 2008 2052 2200 hborder 0
               1080 1084 1089 1125 vborder 0
               +hsync +vsync 
Monitor ranges (GTF): 56-75Hz V, 30-83kHz H, max dotclock 150MHz
Monitor name: E2241
Serial number: --
Checksum: 0x78 (valid)
