
EDID (hex):
00ffffffffffff001e6d7f5bb2cc0100
041e0104b53c22789f8cb5af4f43ab26
0e5054254b007140818081c0a9c0b300
d1c08100d1cf28de0050a0a038500830
080455502100001a000000fd003090e6
e63c010a202020202020000000fc0032
37474c3835300a2020202020000000ff
003030344e54585233463933380a0183
02030f712309060746100403011f13b8
bc0050a0a055500838f80c5550210000
1a565e00a0a0a0295030203500555021
00001a909b0050a0a046500820880c55
50210000000000000000000000000000
00000000000000000000000000000000
00000000000000000000000000000000
000000000000000000000000000000a0

Extracted contents:
header:          00 ff ff ff ff ff ff 00
serial number:   1e 6d 7f 5b b2 cc 01 00 04 1e
version:         01 04
basic params:    b5 3c 22 78 9f
chroma info:     8c b5 af 4f 43 ab 26 0e 50 54
established:     25 4b 00
standard:        71 40 81 80 81 c0 a9 c0 b3 00 d1 c0 81 00 d1 cf
descriptor 1:    28 de 00 50 a0 a0 38 50 08 30 08 04 55 50 21 00 00 1a
descriptor 2:    00 00 00 fd 00 30 90 e6 e6 3c 01 0a 20 20 20 20 20 20
descriptor 3:    00 00 00 fc 00 32 37 47 4c 38 35 30 0a 20 20 20 20 20
descriptor 4:    00 00 00 ff 00 30 30 34 4e 54 58 52 33 46 39 33 38 0a
extensions:      01
checksum:        83

EDID version: 1.4
Manufacturer: GSM Model 5b7f Serial Number --
Made in week 4 of 2020
Digital display
10 bits per primary color channel
DisplayPort interface
Maximum image size: 60 cm x 34 cm
Gamma: 2.20
DPMS levels: Standby
Supported color formats: RGB 4:4:4, YCrCb 4:4:4, YCrCb 4:2:2
Default (sRGB) color space is primary color space
First detailed timing includes the native pixel format and preferred refresh rate
Display is continuous frequency
Display x,y Chromaticity:
  Red:   0.6855, 0.3085
  Green: 0.2646, 0.6679
  Blue:  0.1503, 0.0576
  White: 0.3134, 0.3291
Established timings supported:
  640x480@60Hz 4:3 HorFreq: 31469 Hz Clock: 25.175 MHz
  640x480@75Hz 4:3 HorFreq: 37500 Hz Clock: 31.500 MHz
  800x600@60Hz 4:3 HorFreq: 37900 Hz Clock: 40.000 MHz
  800x600@75Hz 4:3 HorFreq: 46900 Hz Clock: 49.500 MHz
  1024x768@60Hz 4:3 HorFreq: 48400 Hz Clock: 65.000 MHz
  1024x768@75Hz 4:3 HorFreq: 60000 Hz Clock: 78.750 MHz
  1280x1024@75Hz 5:4 HorFreq: 80000 Hz Clock: 135.000 MHz
Standard timings supported:
  1152x864@60Hz 4:3
  1280x1024@60Hz 5:4 HorFreq: 64000 Hz Clock: 108.000 MHz
  1280x720@60Hz 16:9
  1600x900@60Hz 16:9
  1680x1050@60Hz 16:10 HorFreq: 64700 Hz Clock: 119.000 MHz
  1920x1080@60Hz 16:9
  1280x800@60Hz 16:10
  1920x1080@75Hz 16:9
Detailed mode: Clock 568.720 MHz, 597 mm x 336 mm
               2560 2568 2616 2640 hborder 0
               1440 1456 1464 1496 vborder 0
               +hsync -vsync 
               VertFreq: 144 Hz, HorFreq: 215424 Hz
Monitor ranges (bare limits): 48-144Hz V, 230-230kHz H, max dotclock 600MHz
Monitor name: 27GL850
Serial number: --
Has 1 extension blocks
Checksum: 0x83 (valid)

CTA extension block
Extension version: 3
11 bytes of CTA data
  Audio data block
    Linear PCM, max channels 2
      Supported sample rates (kHz): 48 44.1
      Supported sample sizes (bits): 24 20 16
  Video data block
    VIC  16 1920x1080@60Hz 16:9  HorFreq: 67500 Hz Clock: 148.500 MHz
    VIC   4 1280x720@60Hz 16:9  HorFreq: 45000 Hz Clock: 74.250 MHz
    VIC   3 720x480@60Hz 16:9  HorFreq: 31469 Hz Clock: 27.000 MHz
    VIC   1 640x480@60Hz 4:3  HorFreq: 31469 Hz Clock: 25.175 MHz
    VIC  31 1920x1080@50Hz 16:9  HorFreq: 56250 Hz Clock: 148.500 MHz
    VIC  19 1280x720@50Hz 16:9  HorFreq: 37500 Hz Clock: 74.250 MHz
Basic audio support
Supports YCbCr 4:4:4
Supports YCbCr 4:2:2
1 native detailed modes
Detailed mode: Clock 483.120 MHz, 597 mm x 336 mm
               2560 2568 2624 2640 hborder 0
               1440 1503 1511 1525 vborder 0
               +hsync -vsync 
               VertFreq: 120 Hz, HorFreq: 183000 Hz
Detailed mode: Clock 241.500 MHz, 597 mm x 336 mm
               2560 2608 2640 2720 hborder 0
               1440 1443 1448 1481 vborder 0
               +hsync -vsync 
               VertFreq: 59 Hz, HorFreq: 88786 Hz
Detailed mode: Clock 398.240 MHz, 597 mm x 336 mm
               2560 2568 2600 2640 hborder 0
               1440 1496 1504 1510 vborder 0
               -hsync -vsync analog composite 
               VertFreq: 99 Hz, HorFreq: 150848 Hz
Checksum: 0xa0 (valid)

EDID block does NOT conform to EDID 1.4!
	sRGB is signaled, but the chromaticities do not match
Warning: One or more of the timings is out of range of the Monitor Ranges:
  Vertical Freq: 50 - 144 Hz
  Horizontal Freq: 31469 - 215424 Hz
  Maximum Clock: 568.720 MHz
EDID block does not conform at all!
	Both the serial number and the serial string are set
