
EDID (hex):
00ffffffffffff0026cd04661a090000
34150103a03c2278ba7e95a455539f26
0d5054230800d1c081809500a940b300
814001010101023a801871382d40582c
450056502100001e000000fd00374c1e
5111000a202020202020000000ff0031
313131314131433032333330000000fc
00504c3237373548440a2020202001fa

edid-decode (hex):

00 ff ff ff ff ff ff 00 26 cd 04 66 1a 09 00 00
34 15 01 03 a0 3c 22 78 ba 7e 95 a4 55 53 9f 26
0d 50 54 23 08 00 d1 c0 81 80 95 00 a9 40 b3 00
81 40 01 01 01 01 02 3a 80 18 71 38 2d 40 58 2c
45 00 56 50 21 00 00 1e 00 00 00 fd 00 37 4c 1e
51 11 00 0a 20 20 20 20 20 20 00 00 00 ff 00 31
31 31 31 31 41 31 43 30 32 33 33 30 00 00 00 fc
00 50 4c 32 37 37 35 48 44 0a 20 20 20 20 01 fa

----------------

Block 0, Base EDID:
  EDID Structure Version & Revision: 1.3
  Vendor & Product Identification:
    Manufacturer: IVM
    Model: 26116
    Serial Number: 2330
    Made in: week 52 of 2011
  Basic Display Parameters & Features:
    Digital display
    Maximum image size: 60 cm x 34 cm
    Gamma: 2.20
    DPMS levels: Standby Off
    Undefined display color type
    First detailed timing is the preferred timing
  Color Characteristics:
    Red  : 0.6416, 0.3349
    Green: 0.3271, 0.6230
    Blue : 0.1503, 0.0517
    White: 0.3134, 0.3291
  Established Timings I & II:
    DMT 0x04:   640x480    59.940476 Hz   4:3     31.469 kHz     25.175000 MHz
    DMT 0x08:   800x600    56.250000 Hz   4:3     35.156 kHz     36.000000 MHz
    DMT 0x09:   800x600    60.316541 Hz   4:3     37.879 kHz     40.000000 MHz
    DMT 0x10:  1024x768    60.003840 Hz   4:3     48.363 kHz     65.000000 MHz
  Standard Timings:
    DMT 0x52:  1920x1080   60.000000 Hz  16:9     67.500 kHz    148.500000 MHz
    DMT 0x23:  1280x1024   60.019740 Hz   5:4     63.981 kHz    108.000000 MHz
    DMT 0x2f:  1440x900    59.887445 Hz  16:10    55.935 kHz    106.500000 MHz
    DMT 0x33:  1600x1200   60.000000 Hz   4:3     75.000 kHz    162.000000 MHz
    DMT 0x3a:  1680x1050   59.954250 Hz  16:10    65.290 kHz    146.250000 MHz
    DMT 0x20:  1280x960    60.000000 Hz   4:3     60.000 kHz    108.000000 MHz
  Detailed Timing Descriptors:
    DTD 1:  1920x1080   60.000000 Hz  16:9     67.500 kHz    148.500000 MHz (598 mm x 336 mm)
                 Hfront   88 Hsync  44 Hback  148 Hpol P
                 Vfront    4 Vsync   5 Vback   36 Vpol P
    Display Range Limits:
      Monitor ranges (GTF): 55-76 Hz V, 30-81 kHz H, max dotclock 170 MHz
    Display Product Serial Number: '11111A1C02330'
    Display Product Name: 'PL2775HD'
  Extension blocks: 1
Checksum: 0xfa
