
EDID (hex):
00ffffffffffff000daed41400000000
0a1b0104951f11780228659759548e27
1e505400000001010101010101010101
010101010101b43b804a71383440503c
680035ad1000001acd27804a71383440
503c680035ad1000001a000000000000
00000000000000000000000000000002
000c44ff0b3c6e100f1b6e0000000043

Extracted contents:
header:          00 ff ff ff ff ff ff 00
serial number:   0d ae d4 14 00 00 00 00 0a 1b
version:         01 04
basic params:    95 1f 11 78 02
chroma info:     28 65 97 59 54 8e 27 1e 50 54
established:     00 00 00
standard:        01 01 01 01 01 01 01 01 01 01 01 01 01 01 01 01
descriptor 1:    b4 3b 80 4a 71 38 34 40 50 3c 68 00 35 ad 10 00 00 1a
descriptor 2:    cd 27 80 4a 71 38 34 40 50 3c 68 00 35 ad 10 00 00 1a
descriptor 3:    00 00 00 00 00 00 00 00 00 00 00 00 00 00 00 00 00 00
descriptor 4:    00 00 00 02 00 0c 44 ff 0b 3c 6e 10 0f 1b 6e 00 00 00
extensions:      00
checksum:        43

Manufacturer: CMN Model 14d4 Serial Number --
Made week 10 of 2017
EDID version: 1.4
Digital display
6 bits per primary color channel
DisplayPort interface
Maximum image size: 31 cm x 17 cm
Gamma: 2.20
Supported color formats: RGB 4:4:4
First detailed timing is preferred timing
Established timings supported:
Standard timings supported:
Detailed mode: Clock 152.840 MHz, 309 mm x 173 mm
               1920 2000 2060 2250 hborder 0
               1080 1086 1094 1132 vborder 0
               +hsync -vsync 
Detailed mode: Clock 101.890 MHz, 309 mm x 173 mm
               1920 2000 2060 2250 hborder 0
               1080 1086 1094 1132 vborder 0
               +hsync -vsync 
Manufacturer-specified data, tag 0
Manufacturer-specified data, tag 2
Checksum: 0x43 (valid)
EDID block does NOT conform to EDID 1.3!
	Missing name descriptor
	Missing monitor ranges


