
EDID (hex):
00ffffffffffff0009e5a60800000000
011d0104951d11780328659759548e27
1e505400000001010101010101010101
010101010101193780c2703820403020
360026a51000001abc2480c270382040
3020360026a51000001a000000000000
00000000000000000000000000000002
000d40ff0a3c7d160f1f7d0000000025

Extracted contents:
header:          00 ff ff ff ff ff ff 00
serial number:   09 e5 a6 08 00 00 00 00 01 1d
version:         01 04
basic params:    95 1d 11 78 03
chroma info:     28 65 97 59 54 8e 27 1e 50 54
established:     00 00 00
standard:        01 01 01 01 01 01 01 01 01 01 01 01 01 01 01 01
descriptor 1:    19 37 80 c2 70 38 20 40 30 20 36 00 26 a5 10 00 00 1a
descriptor 2:    bc 24 80 c2 70 38 20 40 30 20 36 00 26 a5 10 00 00 1a
descriptor 3:    00 00 00 00 00 00 00 00 00 00 00 00 00 00 00 00 00 00
descriptor 4:    00 00 00 02 00 0d 40 ff 0a 3c 7d 16 0f 1f 7d 00 00 00
extensions:      00
checksum:        25

EDID version: 1.4
Manufacturer: BOE Model 8a6 Serial Number --
Made in week 1 of 2019
Digital display
6 bits per primary color channel
DisplayPort interface
Maximum image size: 29 cm x 17 cm
Gamma: 2.20
Supported color formats: RGB 4:4:4
First detailed timing includes the native pixel format and preferred refresh rate
Display is continuous frequency
Display x,y Chromaticity:
  Red:   0.5898, 0.3496
  Green: 0.3300, 0.5546
  Blue:  0.1533, 0.1191
  White: 0.3134, 0.3291
Established timings supported:
Standard timings supported:
Detailed mode: Clock 141.050 MHz, 294 mm x 165 mm
               1920 1968 2000 2114 hborder 0
               1080 1083 1089 1112 vborder 0
               +hsync -vsync 
               VertFreq: 60 Hz, HorFreq: 66721 Hz
Detailed mode: Clock 94.040 MHz, 294 mm x 165 mm
               1920 1968 2000 2114 hborder 0
               1080 1083 1089 1112 vborder 0
               +hsync -vsync 
               VertFreq: 40 Hz, HorFreq: 44484 Hz
Manufacturer-specified data, tag 0
Manufacturer-specified data, tag 2
Checksum: 0x25 (valid)
EDID block does NOT conform to EDID 1.4!
	Missing name descriptor
	Missing monitor ranges
