
EDID (hex):
00ffffffffffff0030e46d0400000000
00180104951f1178eadc95a35855a026
0d505400000001010101010101010101
0101010101012e3680a070381f403020
350035ae1000001a0000000000000000
00000000000000000000000000fe004c
4720446973706c61790a2020000000fe
004c503134305746332d5350443100c3

edid-decode (hex):

00 ff ff ff ff ff ff 00 30 e4 6d 04 00 00 00 00
00 18 01 04 95 1f 11 78 ea dc 95 a3 58 55 a0 26
0d 50 54 00 00 00 01 01 01 01 01 01 01 01 01 01
01 01 01 01 01 01 2e 36 80 a0 70 38 1f 40 30 20
35 00 35 ae 10 00 00 1a 00 00 00 00 00 00 00 00
00 00 00 00 00 00 00 00 00 00 00 00 00 fe 00 4c
47 20 44 69 73 70 6c 61 79 0a 20 20 00 00 00 fe
00 4c 50 31 34 30 57 46 33 2d 53 50 44 31 00 c3

----------------

Block 0, Base EDID:
  EDID Structure Version & Revision: 1.4
  Vendor & Product Identification:
    Manufacturer: LGD
    Model: 1133
    Made in: 2014
  Basic Display Parameters & Features:
    Digital display
    Bits per primary color channel: 6
    DisplayPort interface
    Maximum image size: 31 cm x 17 cm
    Gamma: 2.20
    DPMS levels: Standby Suspend Off
    Supported color formats: RGB 4:4:4, YCrCb 4:4:4
    First detailed timing includes the native pixel format and preferred refresh rate
  Color Characteristics:
    Red  : 0.6396, 0.3447
    Green: 0.3349, 0.6250
    Blue : 0.1503, 0.0517
    White: 0.3134, 0.3291
  Established Timings I & II: none
  Standard Timings: none
  Detailed Timing Descriptors:
    DTD 1:  1920x1080   60.020425 Hz  16:9     66.683 kHz    138.700000 MHz (309 mm x 174 mm)
                 Hfront   48 Hsync  32 Hback   80 Hpol P
                 Vfront    3 Vsync   5 Vback   23 Vpol N
    Empty Descriptor
    Alphanumeric Data String: 'LG Display'
    Alphanumeric Data String: 'LP140WF3-SPD1'
Checksum: 0xc3
