
EDID (hex):
00ffffffffffff002163000000000000
0b1f0104a54627783b8e05ad4f33b026
0d5054afcf0095008180953cb300d1c0
457c81bcb33c565e00a0a0a029503020
3500ba892100001a000000ff00333256
31323031313032383531000000fd0030
92dfdf3c010a202020202020000000fc
004d55333256310a2020202020200197
020318754b909f859404130312010211
2309070783010000fb7e807270381e40
18203500ba8921000018023a80187138
2d40582c9600ba8921000018866f80a0
7038404030203500ba892100001e84bc
0050a0a0555008207800ba892100001a
9ce00078a0a0325030403500ba892100
001e000000000000000000000000004f

Extracted contents:
header:          00 ff ff ff ff ff ff 00
serial number:   21 63 00 00 00 00 00 00 0b 1f
version:         01 04
basic params:    a5 46 27 78 3b
chroma info:     8e 05 ad 4f 33 b0 26 0d 50 54
established:     af cf 00
standard:        95 00 81 80 95 3c b3 00 d1 c0 45 7c 81 bc b3 3c
descriptor 1:    56 5e 00 a0 a0 a0 29 50 30 20 35 00 ba 89 21 00 00 1a
descriptor 2:    00 00 00 ff 00 33 32 56 31 32 30 31 31 30 32 38 35 31
descriptor 3:    00 00 00 fd 00 30 92 df df 3c 01 0a 20 20 20 20 20 20
descriptor 4:    00 00 00 fc 00 4d 55 33 32 56 31 0a 20 20 20 20 20 20
extensions:      01
checksum:        97

EDID version: 1.4
Manufacturer: HKC Model 0 Serial Number --
Made in week 11 of 2021
Digital display
8 bits per primary color channel
DisplayPort interface
Maximum image size: 70 cm x 39 cm
Gamma: 2.20
DPMS levels: Off
Supported color formats: RGB 4:4:4, YCrCb 4:4:4, YCrCb 4:2:2
First detailed timing includes the native pixel format and preferred refresh rate
Display is continuous frequency
Display x,y Chromaticity:
  Red:   0.6777, 0.3085
  Green: 0.2021, 0.6894
  Blue:  0.1484, 0.0507
  White: 0.3134, 0.3291
Established timings supported:
  720x400@70Hz 9:5 HorFreq: 31469 Hz Clock: 28.320 MHz
  640x480@60Hz 4:3 HorFreq: 31469 Hz Clock: 25.175 MHz
  640x480@72Hz 4:3 HorFreq: 37900 Hz Clock: 31.500 MHz
  640x480@75Hz 4:3 HorFreq: 37500 Hz Clock: 31.500 MHz
  800x600@56Hz 4:3 HorFreq: 35200 Hz Clock: 36.000 MHz
  800x600@60Hz 4:3 HorFreq: 37900 Hz Clock: 40.000 MHz
  800x600@72Hz 4:3 HorFreq: 48100 Hz Clock: 50.000 MHz
  800x600@75Hz 4:3 HorFreq: 46900 Hz Clock: 49.500 MHz
  1024x768@60Hz 4:3 HorFreq: 48400 Hz Clock: 65.000 MHz
  1024x768@70Hz 4:3 HorFreq: 56500 Hz Clock: 75.000 MHz
  1024x768@75Hz 4:3 HorFreq: 60000 Hz Clock: 78.750 MHz
  1280x1024@75Hz 5:4 HorFreq: 80000 Hz Clock: 135.000 MHz
Standard timings supported:
  1440x900@60Hz 16:10 HorFreq: 55500 Hz Clock: 88.750 MHz
  1280x1024@60Hz 5:4 HorFreq: 64000 Hz Clock: 108.000 MHz
  1440x900@120Hz 16:10
  1680x1050@60Hz 16:10 HorFreq: 64700 Hz Clock: 119.000 MHz
  1920x1080@60Hz 16:9
  800x600@120Hz 4:3
  1280x1024@120Hz 5:4
  1680x1050@120Hz 16:10
Detailed mode: Clock 241.500 MHz, 698 mm x 393 mm
               2560 2608 2640 2720 hborder 0
               1440 1443 1448 1481 vborder 0
               +hsync -vsync 
               VertFreq: 59 Hz, HorFreq: 88786 Hz
Serial number: --
Monitor ranges (bare limits): 48-146Hz V, 223-223kHz H, max dotclock 600MHz
Monitor name: MU32V1
Has 1 extension blocks
Checksum: 0x97 (valid)

CTA extension block
Extension version: 3
20 bytes of CTA data
  Video data block
    VIC  16 1920x1080@60Hz 16:9 (native) HorFreq: 67500 Hz Clock: 148.500 MHz
    VIC  31 1920x1080@50Hz 16:9 (native) HorFreq: 56250 Hz Clock: 148.500 MHz
    VIC   5 1920x1080i@60Hz 16:9 (native) HorFreq: 33750 Hz Clock: 74.250 MHz
    VIC  20 1920x1080i@50Hz 16:9 (native) HorFreq: 28125 Hz Clock: 74.250 MHz
    VIC   4 1280x720@60Hz 16:9  HorFreq: 45000 Hz Clock: 74.250 MHz
    VIC  19 1280x720@50Hz 16:9  HorFreq: 37500 Hz Clock: 74.250 MHz
    VIC   3 720x480@60Hz 16:9  HorFreq: 31469 Hz Clock: 27.000 MHz
    VIC  18 720x576@50Hz 16:9  HorFreq: 31250 Hz Clock: 27.000 MHz
    VIC   1 640x480@60Hz 4:3  HorFreq: 31469 Hz Clock: 25.175 MHz
    VIC   2 720x480@60Hz 4:3  HorFreq: 31469 Hz Clock: 27.000 MHz
    VIC  17 720x576@50Hz 4:3  HorFreq: 31250 Hz Clock: 27.000 MHz
  Audio data block
    Linear PCM, max channels 2
      Supported sample rates (kHz): 48 44.1 32
      Supported sample sizes (bits): 24 20 16
  Speaker allocation data block
    Speaker map:
      FL/FR - Front Left/Right
Basic audio support
Supports YCbCr 4:4:4
Supports YCbCr 4:2:2
5 native detailed modes
Detailed mode: Clock 325.070 MHz, 698 mm x 393 mm
               1920 1944 1976 2034 hborder 0
               1080 1083 1088 1110 vborder 0
               -hsync -vsync 
               VertFreq: 143 Hz, HorFreq: 159818 Hz
Detailed mode: Clock 148.500 MHz, 698 mm x 393 mm
               1920 2008 2052 2200 hborder 0
               1080 1089 1095 1125 vborder 0
               -hsync -vsync 
               VertFreq: 60 Hz, HorFreq: 67500 Hz
Detailed mode: Clock 285.500 MHz, 698 mm x 393 mm
               1920 1968 2000 2080 hborder 0
               1080 1083 1088 1144 vborder 0
               +hsync +vsync 
               VertFreq: 119 Hz, HorFreq: 137259 Hz
Detailed mode: Clock 482.600 MHz, 698 mm x 393 mm
               2560 2568 2600 2640 hborder 0
               1440 1447 1455 1525 vborder 0
               +hsync -vsync 
               VertFreq: 119 Hz, HorFreq: 182803 Hz
Detailed mode: Clock 575.000 MHz, 698 mm x 393 mm
               2560 2608 2672 2680 hborder 0
               1440 1443 1448 1490 vborder 0
               +hsync +vsync 
               VertFreq: 143 Hz, HorFreq: 214552 Hz
Checksum: 0x4f (valid)

Warning: One or more of the timings is out of range of the Monitor Ranges:
  Vertical Freq: 50 - 143 Hz
  Horizontal Freq: 28125 - 214552 Hz
  Maximum Clock: 575.000 MHz
