
EDID (hex):
00ffffffffffff000523904175070000
0910010380251e78eac554a4544a9d24
144f57bfef007140714a714f8140814a
814f81800101302a009851002a403070
1300772d1100001e000000fd00314b18
500e000a202020202020000000fc0046
2d343139204456490a202020000000ff
00313930390a202020202020202000fe

edid-decode (hex):

00 ff ff ff ff ff ff 00 05 23 90 41 75 07 00 00
09 10 01 03 80 25 1e 78 ea c5 54 a4 54 4a 9d 24
14 4f 57 bf ef 00 71 40 71 4a 71 4f 81 40 81 4a
81 4f 81 80 01 01 30 2a 00 98 51 00 2a 40 30 70
13 00 77 2d 11 00 00 1e 00 00 00 fd 00 31 4b 18
50 0e 00 0a 20 20 20 20 20 20 00 00 00 fc 00 46
2d 34 31 39 20 44 56 49 0a 20 20 20 00 00 00 ff
00 31 39 30 39 0a 20 20 20 20 20 20 20 20 00 fe

----------------

Block 0, Base EDID:
  EDID Structure Version & Revision: 1.3
  Vendor & Product Identification:
    Manufacturer: AIC
    Model: 16784
    Serial Number: 1909
    Made in: week 9 of 2006
  Basic Display Parameters & Features:
    Digital display
    Maximum image size: 37 cm x 30 cm
    Gamma: 2.20
    DPMS levels: Standby Suspend Off
    RGB color display
    First detailed timing is the preferred timing
  Color Characteristics:
    Red  : 0.6435, 0.3281
    Green: 0.2900, 0.6142
    Blue : 0.1416, 0.0791
    White: 0.3095, 0.3398
  Established Timings I & II:
    IBM     :   720x400    70.081663 Hz   9:5     31.467 kHz     28.320000 MHz
    DMT 0x04:   640x480    59.940476 Hz   4:3     31.469 kHz     25.175000 MHz
    Apple   :   640x480    66.666667 Hz   4:3     35.000 kHz     30.240000 MHz
    DMT 0x05:   640x480    72.808802 Hz   4:3     37.861 kHz     31.500000 MHz
    DMT 0x06:   640x480    75.000000 Hz   4:3     37.500 kHz     31.500000 MHz
    DMT 0x08:   800x600    56.250000 Hz   4:3     35.156 kHz     36.000000 MHz
    DMT 0x09:   800x600    60.316541 Hz   4:3     37.879 kHz     40.000000 MHz
    DMT 0x0a:   800x600    72.187572 Hz   4:3     48.077 kHz     50.000000 MHz
    DMT 0x0b:   800x600    75.000000 Hz   4:3     46.875 kHz     49.500000 MHz
    Apple   :   832x624    74.551266 Hz   4:3     49.726 kHz     57.284000 MHz
    DMT 0x10:  1024x768    60.003840 Hz   4:3     48.363 kHz     65.000000 MHz
    DMT 0x11:  1024x768    70.069359 Hz   4:3     56.476 kHz     75.000000 MHz
    DMT 0x12:  1024x768    75.028582 Hz   4:3     60.023 kHz     78.750000 MHz
    DMT 0x24:  1280x1024   75.024675 Hz   5:4     79.976 kHz    135.000000 MHz
  Standard Timings:
    GTF     :  1152x864    60.000000 Hz   4:3     53.700 kHz     81.624000 MHz
    GTF     :  1152x864    70.000000 Hz   4:3     63.000 kHz     96.768000 MHz
    DMT 0x15:  1152x864    75.000000 Hz   4:3     67.500 kHz    108.000000 MHz
    DMT 0x20:  1280x960    60.000000 Hz   4:3     60.000 kHz    108.000000 MHz
    GTF     :  1280x960    69.999977 Hz   4:3     69.930 kHz    120.839000 MHz
    GTF     :  1280x960    74.999884 Hz   4:3     75.150 kHz    129.859000 MHz
    DMT 0x23:  1280x1024   60.019740 Hz   5:4     63.981 kHz    108.000000 MHz
  Detailed Timing Descriptors:
    DTD 1:  1280x1024   60.019740 Hz   5:4     63.981 kHz    108.000000 MHz (375 mm x 301 mm)
                 Hfront   48 Hsync 112 Hback  248 Hpol P
                 Vfront    1 Vsync   3 Vback   38 Vpol P
    Display Range Limits:
      Monitor ranges (GTF): 49-75 Hz V, 24-80 kHz H, max dotclock 140 MHz
    Display Product Name: 'F-419 DVI'
    Display Product Serial Number: '1909'
Checksum: 0xfe
