
EDID (hex):
00ffffffffffff0038a3906801010101
06190103802f1e78ea3cf5a4554c9b25
0e5054bfef8081c0814081808bc09500
9040b300714f21399030621a274068b0
3600da281100001c000000fd00384b1f
5311000a202020202020000000fc0045
41323233574d0a2020202020000000ff
00353233343732323654420a20200174
02010400011d007251d01e206e285500
da281100001e8c0ad08a20e02d10103e
9600da28110000188c0ad09020403120
0c405500da2811000018011d00bc52d0
1e20b8285540da281100001e00000000
00000000000000000000000000000000
00000000000000000000000000000000
0000000000000000000000000000005f

Extracted contents:
header:          00 ff ff ff ff ff ff 00
serial number:   38 a3 90 68 01 01 01 01 06 19
version:         01 03
basic params:    80 2f 1e 78 ea
chroma info:     3c f5 a4 55 4c 9b 25 0e 50 54
established:     bf ef 80
standard:        81 c0 81 40 81 80 8b c0 95 00 90 40 b3 00 71 4f
descriptor 1:    21 39 90 30 62 1a 27 40 68 b0 36 00 da 28 11 00 00 1c
descriptor 2:    00 00 00 fd 00 38 4b 1f 53 11 00 0a 20 20 20 20 20 20
descriptor 3:    00 00 00 fc 00 45 41 32 32 33 57 4d 0a 20 20 20 20 20
descriptor 4:    00 00 00 ff 00 35 32 33 34 37 32 32 36 54 42 0a 20 20
extensions:      01
checksum:        74

Manufacturer: NEC Model 6890 Serial Number --
Made week 6 of 2015
EDID version: 1.3
Digital display
Maximum image size: 47 cm x 30 cm
Gamma: 2.20
DPMS levels: Standby Suspend Off
Supported color formats: RGB 4:4:4, YCrCb 4:2:2
First detailed timing is preferred timing
Established timings supported:
  720x400@70Hz
  640x480@60Hz
  640x480@67Hz
  640x480@72Hz
  640x480@75Hz
  800x600@56Hz
  800x600@60Hz
  800x600@72Hz
  800x600@75Hz
  832x624@75Hz
  1024x768@60Hz
  1024x768@70Hz
  1024x768@75Hz
  1280x1024@75Hz
  1152x870@75Hz
Standard timings supported:
  1280x720@60Hz
  1280x960@60Hz
  1280x1024@60Hz
  1360x765@60Hz
  1440x900@60Hz
  1400x1050@60Hz
  1680x1050@60Hz
  1152x864@75Hz
Detailed mode: Clock 146.250 MHz, 474 mm x 296 mm
               1680 1784 1960 2240 hborder 0
               1050 1053 1059 1089 vborder 0
               -hsync +vsync 
Monitor ranges (GTF): 56-75Hz V, 31-83kHz H, max dotclock 170MHz
Monitor name: EA223WM
Serial number: --
Has 1 extension blocks
Checksum: 0x74 (valid)

CEA extension block
Extension version: 1
0 8-byte timing descriptors
Detailed mode: Clock 74.250 MHz, 474 mm x 296 mm
               1280 1390 1430 1650 hborder 0
                720  725  730  750 vborder 0
               +hsync +vsync 
Detailed mode: Clock 27.000 MHz, 474 mm x 296 mm
                720  736  798  858 hborder 0
                480  489  495  525 vborder 0
               -hsync -vsync 
Detailed mode: Clock 27.000 MHz, 474 mm x 296 mm
                720  732  796  864 hborder 0
                576  581  586  625 vborder 0
               -hsync -vsync 
Detailed mode: Clock 74.250 MHz, 474 mm x 296 mm
               1280 1720 1760 1980 hborder 0
                720  725  730  750 vborder 0
               +hsync +vsync 
Checksum: 0x5f (valid)
