
EDID (hex):
00ffffffffffff0006afed2000000000
001c01049522137803b0e594585a9228
21505400000001010101010101010101
010101010101143780b4703826406c30
aa0058c210000018b82480b470382640
6c30aa0058c210000018000000000000
00000000000000000000000000000002
001036ff0f3c9616122d962020200046

edid-decode (hex):

00 ff ff ff ff ff ff 00 06 af ed 20 00 00 00 00
00 1c 01 04 95 22 13 78 03 b0 e5 94 58 5a 92 28
21 50 54 00 00 00 01 01 01 01 01 01 01 01 01 01
01 01 01 01 01 01 14 37 80 b4 70 38 26 40 6c 30
aa 00 58 c2 10 00 00 18 b8 24 80 b4 70 38 26 40
6c 30 aa 00 58 c2 10 00 00 18 00 00 00 00 00 00
00 00 00 00 00 00 00 00 00 00 00 00 00 00 00 02
00 10 36 ff 0f 3c 96 16 12 2d 96 20 20 20 00 46

----------------

Block 0, Base EDID:
  EDID Structure Version & Revision: 1.4
  Vendor & Product Identification:
    Manufacturer: AUO
    Model: 8429
    Made in: 2018
  Basic Display Parameters & Features:
    Digital display
    Bits per primary color channel: 6
    DisplayPort interface
    Maximum image size: 34 cm x 19 cm
    Gamma: 2.20
    Supported color formats: RGB 4:4:4
    First detailed timing includes the native pixel format and preferred refresh rate
    Display is continuous frequency
  Color Characteristics:
    Red  : 0.5800, 0.3466
    Green: 0.3515, 0.5703
    Blue : 0.1591, 0.1308
    White: 0.3134, 0.3291
  Established Timings I & II: none
  Standard Timings: none
  Detailed Timing Descriptors:
    DTD 1:  1920x1080   60.056223 Hz  16:9     67.143 kHz    141.000000 MHz (344 mm x 194 mm)
                 Hfront  108 Hsync  48 Hback   24 Hpol N
                 Vfront   10 Vsync  10 Vback   18 Vpol N
    DTD 2:  1920x1080   40.037482 Hz  16:9     44.762 kHz     94.000000 MHz (344 mm x 194 mm)
                 Hfront  108 Hsync  48 Hback   24 Hpol N
                 Vfront   10 Vsync  10 Vback   18 Vpol N
    Empty Descriptor
    Manufacturer-Specified Display Descriptor (0x02): 00 02 00 10 36 ff 0f 3c 96 16 12 2d 96 20 20 20 '....6..<...-.   '
Checksum: 0x46
