
EDID (hex):
00ffffffffffff0030aeb14000000000
0112010380221378eac9959e57549226
0f505400000001010101010101010101
0101010101016829404a61840c30402a
330058c110000018682940d462840c30
402a330058c1100000180000000f00a9
0932a9092816090006af5631000000fe
004231353652573031205631200a0049

Extracted contents:
header:          00 ff ff ff ff ff ff 00
serial number:   30 ae b1 40 00 00 00 00 01 12
version:         01 03
basic params:    80 22 13 78 ea
chroma info:     c9 95 9e 57 54 92 26 0f 50 54
established:     00 00 00
standard:        01 01 01 01 01 01 01 01 01 01 01 01 01 01 01 01
descriptor 1:    68 29 40 4a 61 84 0c 30 40 2a 33 00 58 c1 10 00 00 18
descriptor 2:    68 29 40 d4 62 84 0c 30 40 2a 33 00 58 c1 10 00 00 18
descriptor 3:    00 00 00 0f 00 a9 09 32 a9 09 28 16 09 00 06 af 56 31
descriptor 4:    00 00 00 fe 00 42 31 35 36 52 57 30 31 20 56 31 20 0a
extensions:      00
checksum:        49

Manufacturer: LEN Model 40b1 Serial Number --
Made week 1 of 2008
EDID version: 1.3
Digital display
Maximum image size: 34 cm x 19 cm
Gamma: 2.20
DPMS levels: Standby Suspend Off
Supported color formats: RGB 4:4:4, YCrCb 4:2:2
First detailed timing is preferred timing
Established timings supported:
Standard timings supported:
Detailed mode: Clock 106.000 MHz, 344 mm x 193 mm
               1600 1664 1706 1930 hborder 0
                900  903  906  912 vborder 0
               -hsync -vsync 
Detailed mode: Clock 106.000 MHz, 344 mm x 193 mm
               1600 1664 1706 2324 hborder 0
                900  903  906  912 vborder 0
               -hsync -vsync 
Manufacturer-specified data, tag 15
ASCII string: B156RW01
Checksum: 0x49 (valid)
EDID block does NOT conform to EDID 1.3!
	Missing name descriptor
	Missing monitor ranges
	Detailed block string not properly terminated
