
EDID (hex):
00ffffffffffff0030e4000000000000
0012010380160d780abfb59658548b27
20505400000001010101010101010101
0101010101012c10008c404011203020
3500e07e0000001b2c10008c40401120
30203500e07e0000001b000000fe004b
3834344b803130315753310a00000000
00000000000000000001010a20200016

Extracted contents:
header:          00 ff ff ff ff ff ff 00
serial number:   30 e4 00 00 00 00 00 00 00 12
version:         01 03
basic params:    80 16 0d 78 0a
chroma info:     bf b5 96 58 54 8b 27 20 50 54
established:     00 00 00
standard:        01 01 01 01 01 01 01 01 01 01 01 01 01 01 01 01
descriptor 1:    2c 10 00 8c 40 40 11 20 30 20 35 00 e0 7e 00 00 00 1b
descriptor 2:    2c 10 00 8c 40 40 11 20 30 20 35 00 e0 7e 00 00 00 1b
descriptor 3:    00 00 00 fe 00 4b 38 34 34 4b 80 31 30 31 57 53 31 0a
descriptor 4:    00 00 00 00 00 00 00 00 00 00 00 00 00 01 01 0a 20 20
extensions:      00
checksum:        16

Manufacturer: LGD Model 0 Serial Number --
Made week 0 of 2008
EDID version: 1.3
Digital display
Maximum image size: 22 cm x 13 cm
Gamma: 2.20
Supported color formats: RGB 4:4:4, YCrCb 4:2:2
First detailed timing is preferred timing
Established timings supported:
Standard timings supported:
Detailed mode: Clock 41.400 MHz, 224 mm x 126 mm
               1024 1072 1104 1164 hborder 0
                576  579  584  593 vborder 0
               +hsync -vsync 
Detailed mode: Clock 41.400 MHz, 224 mm x 126 mm
               1024 1072 1104 1164 hborder 0
                576  579  584  593 vborder 0
               +hsync -vsync 
ASCII string: K844K
Manufacturer-specified data, tag 0
Checksum: 0x16 (valid)
EDID block does NOT conform to EDID 1.3!
	Missing name descriptor
	Missing monitor ranges
	Detailed block string not properly terminated
