
EDID (hex):
00ffffffffffff0009e5280900000000
0b1e01049522137802c9a0955d599129
1f505400000001010101010101010101
010101010101af3680cd703812403020
360058c21000001afd2d800e71382840
3020360058c21000001a000000fe0032
474d4636804e5631354e345600000000
0000412196001000000a010a202000ac

Extracted contents:
header:          00 ff ff ff ff ff ff 00
serial number:   09 e5 28 09 00 00 00 00 0b 1e
version:         01 04
basic params:    95 22 13 78 02
chroma info:     c9 a0 95 5d 59 91 29 1f 50 54
established:     00 00 00
standard:        01 01 01 01 01 01 01 01 01 01 01 01 01 01 01 01
descriptor 1:    af 36 80 cd 70 38 12 40 30 20 36 00 58 c2 10 00 00 1a
descriptor 2:    fd 2d 80 0e 71 38 28 40 30 20 36 00 58 c2 10 00 00 1a
descriptor 3:    00 00 00 fe 00 32 47 4d 46 36 80 4e 56 31 35 4e 34 56
descriptor 4:    00 00 00 00 00 00 41 21 96 00 10 00 00 0a 01 0a 20 20
extensions:      00
checksum:        ac

EDID version: 1.4
Manufacturer: BOE Model 928 Serial Number --
Made in week 11 of 2020
Digital display
6 bits per primary color channel
DisplayPort interface
Maximum image size: 34 cm x 19 cm
Gamma: 2.20
Supported color formats: RGB 4:4:4
First detailed timing includes the native pixel format and preferred refresh rate
Display x,y Chromaticity:
  Red:   0.5849, 0.3632
  Green: 0.3496, 0.5673
  Blue:  0.1621, 0.1230
  White: 0.3125, 0.3281
Established timings supported:
Standard timings supported:
Detailed mode: Clock 139.990 MHz, 344 mm x 194 mm
               1920 1968 2000 2125 hborder 0
               1080 1083 1089 1098 vborder 0
               +hsync -vsync 
               VertFreq: 59 Hz, HorFreq: 65877 Hz
Detailed mode: Clock 117.730 MHz, 344 mm x 194 mm
               1920 1968 2000 2190 hborder 0
               1080 1083 1089 1120 vborder 0
               +hsync -vsync 
               VertFreq: 47 Hz, HorFreq: 53757 Hz
ASCII string: 2GMF6
Manufacturer-specified data, tag 0
Checksum: 0xac (valid)
EDID block does NOT conform to EDID 1.4!
	Missing name descriptor
	Missing monitor ranges
	Detailed block string not properly terminated
