
EDID (hex):
00ffffffffffff0004722d04e70c1151
0b190103803c2278ca7b45a4554aa227
0b5054bfef80714f8140818081c08100
9500b300d1c0023a801871382d40582c
450056502100001e000000fd00384c1f
5311000a202020202020000000fc0047
323737484c0a202020202020000000ff
0054324e4141303031383532300a0195
020324f14f9002030405060701111213
1415161f230907078301000067030c00
1000382d023a801871382d40582c4500
56502100001f011d8018711c1620582c
250056502100009f011d007251d01e20
6e28550056502100001e8c0ad08a20e0
2d10103e960056502100001800000000
000000000000000000000000000000de

Extracted contents:
header:          00 ff ff ff ff ff ff 00
serial number:   04 72 2d 04 e7 0c 11 51 0b 19
version:         01 03
basic params:    80 3c 22 78 ca
chroma info:     7b 45 a4 55 4a a2 27 0b 50 54
established:     bf ef 80
standard:        71 4f 81 40 81 80 81 c0 81 00 95 00 b3 00 d1 c0
descriptor 1:    02 3a 80 18 71 38 2d 40 58 2c 45 00 56 50 21 00 00 1e
descriptor 2:    00 00 00 fd 00 38 4c 1f 53 11 00 0a 20 20 20 20 20 20
descriptor 3:    00 00 00 fc 00 47 32 37 37 48 4c 0a 20 20 20 20 20 20
descriptor 4:    00 00 00 ff 00 54 32 4e 41 41 30 30 31 38 35 32 30 0a
extensions:      01
checksum:        95

Manufacturer: ACR Model 42d Serial Number --
Made week 11 of 2015
EDID version: 1.3
Digital display
Maximum image size: 60 cm x 34 cm
Gamma: 2.20
DPMS levels: Standby Suspend
Supported color formats: RGB 4:4:4, YCrCb 4:2:2
First detailed timing is preferred timing
Established timings supported:
  720x400@70Hz
  640x480@60Hz
  640x480@67Hz
  640x480@72Hz
  640x480@75Hz
  800x600@56Hz
  800x600@60Hz
  800x600@72Hz
  800x600@75Hz
  832x624@75Hz
  1024x768@60Hz
  1024x768@70Hz
  1024x768@75Hz
  1280x1024@75Hz
  1152x870@75Hz
Standard timings supported:
  1152x864@75Hz
  1280x960@60Hz
  1280x1024@60Hz
  1280x720@60Hz
  1280x800@60Hz
  1440x900@60Hz
  1680x1050@60Hz
  1920x1080@60Hz
Detailed mode: Clock 148.500 MHz, 598 mm x 336 mm
               1920 2008 2052 2200 hborder 0
               1080 1084 1089 1125 vborder 0
               +hsync +vsync 
Monitor ranges (GTF): 56-76Hz V, 31-83kHz H, max dotclock 170MHz
Monitor name: G277HL
Serial number: --
Has 1 extension blocks
Checksum: 0x95 (valid)

CEA extension block
Extension version: 3
32 bytes of CEA data
  Video data block
    VIC 16 1920x1080@60Hz (native)
    VIC 02 720x480@60Hz 
    VIC 03 720x480@60Hz 
    VIC 04 1280x720@60Hz 
    VIC 05 1920x1080i@60Hz 
    VIC 06 1440x480i@60Hz 
    VIC 07 1440x480i@60Hz 
    VIC 01 640x480@60Hz 
    VIC 17 720x576@50Hz 
    VIC 18 720x576@50Hz 
    VIC 19 1280x720@50Hz 
    VIC 20 1920x1080i@50Hz 
    VIC 21 1440x576i@50Hz 
    VIC 22 1440x576i@50Hz 
    VIC 31 1920x1080@50Hz 
  Audio data block
    Linear PCM, max channels 1
    Supported sample rates (kHz): 48 44.1 32
    Supported sample sizes (bits): 24 20 16
  Speaker allocation data block
  Vendor-specific data block, OUI 000c03 (HDMI)
    Source physical address 1.0.0.0
    DC_36bit
    DC_30bit
    DC_Y444
    Maximum TMDS clock: 225MHz
Underscans PC formats by default
Basic audio support
Supports YCbCr 4:4:4
Supports YCbCr 4:2:2
1 native detailed modes
Detailed mode: Clock 148.500 MHz, 598 mm x 336 mm
               1920 2008 2052 2200 hborder 0
               1080 1084 1089 1125 vborder 0
               +hsync +vsync 
Detailed mode: Clock 74.250 MHz, 598 mm x 336 mm
               1920 2008 2052 2200 hborder 0
                540  542  547  562 vborder 0
               +hsync +vsync interlaced 
Detailed mode: Clock 74.250 MHz, 598 mm x 336 mm
               1280 1390 1430 1650 hborder 0
                720  725  730  750 vborder 0
               +hsync +vsync 
Detailed mode: Clock 27.000 MHz, 598 mm x 336 mm
                720  736  798  858 hborder 0
                480  489  495  525 vborder 0
               -hsync -vsync 
Checksum: 0xde (valid)
