
EDID (hex):
00ffffffffffff0009e5910900000000
211e0104952213780329a5945d59942a
23505400000001010101010101010101
010101010101c0398018713828403020
360058c21000001a8026801871382840
3020360058c21000001a000000000000
00000000000000000000000000000002
000d40ff0a3c7d1014297d00000000e8

edid-decode (hex):

00 ff ff ff ff ff ff 00 09 e5 91 09 00 00 00 00
21 1e 01 04 95 22 13 78 03 29 a5 94 5d 59 94 2a
23 50 54 00 00 00 01 01 01 01 01 01 01 01 01 01
01 01 01 01 01 01 c0 39 80 18 71 38 28 40 30 20
36 00 58 c2 10 00 00 1a 80 26 80 18 71 38 28 40
30 20 36 00 58 c2 10 00 00 1a 00 00 00 00 00 00
00 00 00 00 00 00 00 00 00 00 00 00 00 00 00 02
00 0d 40 ff 0a 3c 7d 10 14 29 7d 00 00 00 00 e8

----------------

Block 0, Base EDID:
  EDID Structure Version & Revision: 1.4
  Vendor & Product Identification:
    Manufacturer: BOE
    Model: 2449
    Made in: week 33 of 2020
  Basic Display Parameters & Features:
    Digital display
    Bits per primary color channel: 6
    DisplayPort interface
    Maximum image size: 34 cm x 19 cm
    Gamma: 2.20
    Supported color formats: RGB 4:4:4
    First detailed timing includes the native pixel format and preferred refresh rate
    Display is continuous frequency
  Color Characteristics:
    Red  : 0.5781, 0.3652
    Green: 0.3496, 0.5791
    Blue : 0.1660, 0.1386
    White: 0.3134, 0.3291
  Established Timings I & II: none
  Standard Timings: none
  Detailed Timing Descriptors:
    DTD 1:  1920x1080   60.000000 Hz  16:9     67.200 kHz    147.840000 MHz (344 mm x 194 mm)
                 Hfront   48 Hsync  32 Hback  200 Hpol P
                 Vfront    3 Vsync   6 Vback   31 Vpol N
    DTD 2:  1920x1080   40.000000 Hz  16:9     44.800 kHz     98.560000 MHz (344 mm x 194 mm)
                 Hfront   48 Hsync  32 Hback  200 Hpol P
                 Vfront    3 Vsync   6 Vback   31 Vpol N
    Empty Descriptor
    Manufacturer-Specified Display Descriptor (0x02): 00 02 00 0d 40 ff 0a 3c 7d 10 14 29 7d 00 00 00 '....@..<}..)}...'
Checksum: 0xe8
