
EDID (hex):
00ffffffffffff0030e40c0200000000
00130103902313780a1be59e59509826
0e505400000001010101010101010101
0101010101012f2640a060841a303020
350059c21000001b2f2640a060841a30
3020350059c21000001b000000fe004d
54364b47803135365744310a00000000
00000000000000000002010a202000bc

edid-decode (hex):

00 ff ff ff ff ff ff 00 30 e4 0c 02 00 00 00 00
00 13 01 03 90 23 13 78 0a 1b e5 9e 59 50 98 26
0e 50 54 00 00 00 01 01 01 01 01 01 01 01 01 01
01 01 01 01 01 01 2f 26 40 a0 60 84 1a 30 30 20
35 00 59 c2 10 00 00 1b 2f 26 40 a0 60 84 1a 30
30 20 35 00 59 c2 10 00 00 1b 00 00 00 fe 00 4d
54 36 4b 47 80 31 35 36 57 44 31 0a 00 00 00 00
00 00 00 00 00 00 00 00 00 02 01 0a 20 20 00 bc

----------------

Block 0, Base EDID:
  EDID Structure Version & Revision: 1.3
  Vendor & Product Identification:
    Manufacturer: LGD
    Model: 524
    Made in: 2009
  Basic Display Parameters & Features:
    Digital display
    Maximum image size: 35 cm x 19 cm
    Gamma: 2.20
    RGB color display
    First detailed timing is the preferred timing
  Color Characteristics:
    Red  : 0.6171, 0.3486
    Green: 0.3144, 0.5966
    Blue : 0.1513, 0.0566
    White: 0.3134, 0.3291
  Established Timings I & II: none
  Standard Timings: none
  Detailed Timing Descriptors:
    DTD 1:  1600x900    59.978156 Hz  16:9     55.540 kHz     97.750000 MHz (345 mm x 194 mm)
                 Hfront   48 Hsync  32 Hback   80 Hpol P
                 Vfront    3 Vsync   5 Vback   18 Vpol N
    DTD 2:  1600x900    59.978156 Hz  16:9     55.540 kHz     97.750000 MHz (345 mm x 194 mm)
                 Hfront   48 Hsync  32 Hback   80 Hpol P
                 Vfront    3 Vsync   5 Vback   18 Vpol N
    Alphanumeric Data String: 'MT6KG'
    Manufacturer-Specified Display Descriptor (0x00): 00 00 00 00 00 00 00 00 00 00 00 02 01 0a 20 20 '..............  '
Checksum: 0xbc
