
EDID (hex):
00ffffffffffff000d0f300001000000
20220103807341780acf74a3574cb023
09484c000000010101ff01ffff010101
01010101012008e80030f2705a80b058
8a00c48e2100001e023a801871382d40
582c4500c48e2100001e000000fc0053
6d6172742054560a20202020000000fd
003b461f8c3c000a2020202020200151
020366f25b058403011213141607901f
20225d5f6061626465665e6302061115
2c097f07150750570401670403830100
006e030c001000784420008001020304
68d85dc40178800f02e200ffe305ff01
e50f00801900e3060f01eb0146d0004d
4e3a963c27b500000000000000000000
000000000000000000000000000000d0

edid-decode (hex):

00 ff ff ff ff ff ff 00 0d 0f 30 00 01 00 00 00
20 22 01 03 80 73 41 78 0a cf 74 a3 57 4c b0 23
09 48 4c 00 00 00 01 01 01 ff 01 ff ff 01 01 01
01 01 01 01 01 20 08 e8 00 30 f2 70 5a 80 b0 58
8a 00 c4 8e 21 00 00 1e 02 3a 80 18 71 38 2d 40
58 2c 45 00 c4 8e 21 00 00 1e 00 00 00 fc 00 53
6d 61 72 74 20 54 56 0a 20 20 20 20 00 00 00 fd
00 3b 46 1f 8c 3c 00 0a 20 20 20 20 20 20 01 51

02 03 66 f2 5b 05 84 03 01 12 13 14 16 07 90 1f
20 22 5d 5f 60 61 62 64 65 66 5e 63 02 06 11 15
2c 09 7f 07 15 07 50 57 04 01 67 04 03 83 01 00
00 6e 03 0c 00 10 00 78 44 20 00 80 01 02 03 04
68 d8 5d c4 01 78 80 0f 02 e2 00 ff e3 05 ff 01
e5 0f 00 80 19 00 e3 06 0f 01 eb 01 46 d0 00 4d
4e 3a 96 3c 27 b5 00 00 00 00 00 00 00 00 00 00
00 00 00 00 00 00 00 00 00 00 00 00 00 00 00 d0

----------------

Block 0, Base EDID:
  EDID Structure Version & Revision: 1.3
  Vendor & Product Identification:
    Manufacturer: CHO
    Model: 48
    Serial Number: 1
    Made in: week 32 of 2024
  Basic Display Parameters & Features:
    Digital display
    Maximum image size: 115 cm x 65 cm
    Gamma: 2.20
    RGB color display
    First detailed timing is the preferred timing
  Color Characteristics:
    Red  : 0.6396, 0.3398
    Green: 0.2998, 0.6904
    Blue : 0.1376, 0.0380
    White: 0.2822, 0.2968
  Established Timings I & II: none
  Standard Timings:
    GTF     :  2288x1430   61.000017 Hz  16:10    90.341 kHz    281.864000 MHz
  Detailed Timing Descriptors:
    DTD 1:  3840x2160   60.000000 Hz  16:9    135.000 kHz    594.000000 MHz (708 mm x 398 mm)
                 Hfront  176 Hsync  88 Hback  296 Hpol P
                 Vfront    8 Vsync  10 Vback   72 Vpol P
    DTD 2:  1920x1080   60.000000 Hz  16:9     67.500 kHz    148.500000 MHz (708 mm x 398 mm)
                 Hfront   88 Hsync  44 Hback  148 Hpol P
                 Vfront    4 Vsync   5 Vback   36 Vpol P
    Display Product Name: 'Smart TV'
    Display Range Limits:
      Monitor ranges (GTF): 59-70 Hz V, 31-140 kHz H, max dotclock 600 MHz
  Extension blocks: 1
Checksum: 0x51

----------------

Block 1, CTA-861 Extension Block:
  Revision: 3
  Underscans IT Video Formats by default
  Basic audio support
  Supports YCbCr 4:4:4
  Supports YCbCr 4:2:2
  Native detailed modes: 2
  Video Data Block:
    VIC   5:  1920x1080i  60.000000 Hz  16:9     33.750 kHz     74.250000 MHz
    VIC   4:  1280x720    60.000000 Hz  16:9     45.000 kHz     74.250000 MHz (native)
    VIC   3:   720x480    59.940060 Hz  16:9     31.469 kHz     27.000000 MHz
    VIC   1:   640x480    59.940476 Hz   4:3     31.469 kHz     25.175000 MHz
    VIC  18:   720x576    50.000000 Hz  16:9     31.250 kHz     27.000000 MHz
    VIC  19:  1280x720    50.000000 Hz  16:9     37.500 kHz     74.250000 MHz
    VIC  20:  1920x1080i  50.000000 Hz  16:9     28.125 kHz     74.250000 MHz
    VIC  22:  1440x576i   50.000000 Hz  16:9     15.625 kHz     27.000000 MHz
    VIC   7:  1440x480i   59.940060 Hz  16:9     15.734 kHz     27.000000 MHz
    VIC  16:  1920x1080   60.000000 Hz  16:9     67.500 kHz    148.500000 MHz (native)
    VIC  31:  1920x1080   50.000000 Hz  16:9     56.250 kHz    148.500000 MHz
    VIC  32:  1920x1080   24.000000 Hz  16:9     27.000 kHz     74.250000 MHz
    VIC  34:  1920x1080   30.000000 Hz  16:9     33.750 kHz     74.250000 MHz
    VIC  93:  3840x2160   24.000000 Hz  16:9     54.000 kHz    297.000000 MHz
    VIC  95:  3840x2160   30.000000 Hz  16:9     67.500 kHz    297.000000 MHz
    VIC  96:  3840x2160   50.000000 Hz  16:9    112.500 kHz    594.000000 MHz
    VIC  97:  3840x2160   60.000000 Hz  16:9    135.000 kHz    594.000000 MHz
    VIC  98:  4096x2160   24.000000 Hz 256:135   54.000 kHz    297.000000 MHz
    VIC 100:  4096x2160   30.000000 Hz 256:135   67.500 kHz    297.000000 MHz
    VIC 101:  4096x2160   50.000000 Hz 256:135  112.500 kHz    594.000000 MHz
    VIC 102:  4096x2160   60.000000 Hz 256:135  135.000 kHz    594.000000 MHz
    VIC  94:  3840x2160   25.000000 Hz  16:9     56.250 kHz    297.000000 MHz
    VIC  99:  4096x2160   25.000000 Hz 256:135   56.250 kHz    297.000000 MHz
    VIC   2:   720x480    59.940060 Hz   4:3     31.469 kHz     27.000000 MHz
    VIC   6:  1440x480i   59.940060 Hz   4:3     15.734 kHz     27.000000 MHz
    VIC  17:   720x576    50.000000 Hz   4:3     31.250 kHz     27.000000 MHz
    VIC  21:  1440x576i   50.000000 Hz   4:3     15.625 kHz     27.000000 MHz
  Audio Data Block:
    Linear PCM:
      Max channels: 2
      Supported sample rates (kHz): 192 176.4 96 88.2 48 44.1 32
      Supported sample sizes (bits): 24 20 16
    AC-3:
      Max channels: 6
      Supported sample rates (kHz): 48 44.1 32
      Maximum bit rate: 640 kb/s
    Enhanced AC-3 (DD+):
      Max channels: 8
      Supported sample rates (kHz): 48
      Supports Joint Object Coding
    MAT (MLP):
      Max channels: 8
      Supported sample rates (kHz): 48
      Supports Dolby TrueHD, object audio PCM and channel-based PCM
      Hash calculation not required for object audio PCM or channel-based PCM
  Speaker Allocation Data Block:
    FL/FR - Front Left/Right
  Vendor-Specific Data Block (HDMI), OUI 00-0C-03:
    Source physical address: 1.0.0.0
    DC_48bit
    DC_36bit
    DC_30bit
    DC_Y444
    Maximum TMDS clock: 340 MHz
    Extended HDMI video details:
      HDMI VICs:
        HDMI VIC 1:  3840x2160   30.000000 Hz  16:9     67.500 kHz    297.000000 MHz
        HDMI VIC 2:  3840x2160   25.000000 Hz  16:9     56.250 kHz    297.000000 MHz
        HDMI VIC 3:  3840x2160   24.000000 Hz  16:9     54.000 kHz    297.000000 MHz
        HDMI VIC 4:  4096x2160   24.000000 Hz 256:135   54.000 kHz    297.000000 MHz
  Vendor-Specific Data Block (HDMI Forum), OUI C4-5D-D8:
    Version: 1
    Maximum TMDS Character Rate: 600 MHz
    SCDC Present
    Supports UHD VIC
    Supports 16-bits/component Deep Color 4:2:0 Pixel Encoding
    Supports 12-bits/component Deep Color 4:2:0 Pixel Encoding
    Supports 10-bits/component Deep Color 4:2:0 Pixel Encoding
    Supports Auto Low-Latency Mode
  Video Capability Data Block:
    YCbCr quantization: Selectable (via AVI YQ)
    RGB quantization: Selectable (via AVI Q)
    PT scan behavior: Supports both over- and underscan
    IT scan behavior: Supports both over- and underscan
    CE scan behavior: Supports both over- and underscan
  Colorimetry Data Block:
    xvYCC601
    xvYCC709
    sYCC601
    opYCC601
    opRGB
    BT2020cYCC
    BT2020YCC
    BT2020RGB
    Gamut Boundary Description Metadata Profile P0
  YCbCr 4:2:0 Capability Map Data Block:
    VIC  96:  3840x2160   50.000000 Hz  16:9    112.500 kHz    594.000000 MHz
    VIC  97:  3840x2160   60.000000 Hz  16:9    135.000 kHz    594.000000 MHz
    VIC 101:  4096x2160   50.000000 Hz 256:135  112.500 kHz    594.000000 MHz
    VIC 102:  4096x2160   60.000000 Hz 256:135  135.000 kHz    594.000000 MHz
  HDR Static Metadata Data Block:
    Electro optical transfer functions:
      Traditional gamma - SDR luminance range
      Traditional gamma - HDR luminance range
      SMPTE ST2084
      Hybrid Log-Gamma
    Supported static metadata descriptors:
      Static metadata type 1
  Vendor-Specific Video Data Block (Dolby), OUI 00-D0-46:
    Version: 2 (12 bytes)
    Supports YUV422 12 bit
    Supports global dimming
    DM Version: 5.x
    Backlt Min Luma: 75 cd/m^2
    Interface: Standard + Low-Latency
    Supports 10b 12b 444: Not supported
    Target Min PQ v2: 180 (0.04555910 cd/m^2)
    Target Max PQ v2: 2510 (285 cd/m^2)
    Unique Rx, Ry: 0.64062500, 0.33593750
    Unique Gx, Gy: 0.29296875, 0.61718750
    Unique Bx, By: 0.15234375, 0.05078125
Checksum: 0xd0  Unused space in Extension Block: 25 bytes
