
EDID (hex):
00ffffffffffff0061a903d001010101
14220103803c22782aee91a3544c9926
0f5054a5cb0081809500a9c0d1c00101
0101010101016a5e00a0a0a029503020
350055502100001a000000fc00503237
5142422d52410a202020000000ff0034
373930383130303239353535000000fd
00304b1e711f000a202020202020015e
020330f249010312130414051f902309
7f078301000067030c00100038786dd8
5dc401788000000000000000e305c000
f27600a0a0a034503020350055502100
001a0000000000000000000000000000
00000000000000000000000000000000
00000000000000000000000000000000
000000000000000000000000000000f7

edid-decode (hex):

00 ff ff ff ff ff ff 00 61 a9 03 d0 01 01 01 01
14 22 01 03 80 3c 22 78 2a ee 91 a3 54 4c 99 26
0f 50 54 a5 cb 00 81 80 95 00 a9 c0 d1 c0 01 01
01 01 01 01 01 01 6a 5e 00 a0 a0 a0 29 50 30 20
35 00 55 50 21 00 00 1a 00 00 00 fc 00 50 32 37
51 42 42 2d 52 41 0a 20 20 20 00 00 00 ff 00 34
37 39 30 38 31 30 30 32 39 35 35 35 00 00 00 fd
00 30 4b 1e 71 1f 00 0a 20 20 20 20 20 20 01 5e

02 03 30 f2 49 01 03 12 13 04 14 05 1f 90 23 09
7f 07 83 01 00 00 67 03 0c 00 10 00 38 78 6d d8
5d c4 01 78 80 00 00 00 00 00 00 00 e3 05 c0 00
f2 76 00 a0 a0 a0 34 50 30 20 35 00 55 50 21 00
00 1a 00 00 00 00 00 00 00 00 00 00 00 00 00 00
00 00 00 00 00 00 00 00 00 00 00 00 00 00 00 00
00 00 00 00 00 00 00 00 00 00 00 00 00 00 00 00
00 00 00 00 00 00 00 00 00 00 00 00 00 00 00 f7

----------------

Block 0, Base EDID:
  EDID Structure Version & Revision: 1.3
  Vendor & Product Identification:
    Manufacturer: XMI
    Model: 53251
    Serial Number: 16843009
    Made in: week 20 of 2024
  Basic Display Parameters & Features:
    Digital display
    Maximum image size: 60 cm x 34 cm
    Gamma: 2.20
    DPMS levels: Off
    RGB color display
    First detailed timing is the preferred timing
  Color Characteristics:
    Red  : 0.6396, 0.3300
    Green: 0.2998, 0.5996
    Blue : 0.1503, 0.0595
    White: 0.3125, 0.3291
  Established Timings I & II:
    IBM     :   720x400    70.081663 Hz   9:5     31.467 kHz     28.320000 MHz
    DMT 0x04:   640x480    59.940476 Hz   4:3     31.469 kHz     25.175000 MHz
    DMT 0x06:   640x480    75.000000 Hz   4:3     37.500 kHz     31.500000 MHz
    DMT 0x09:   800x600    60.316541 Hz   4:3     37.879 kHz     40.000000 MHz
    DMT 0x0a:   800x600    72.187572 Hz   4:3     48.077 kHz     50.000000 MHz
    DMT 0x0b:   800x600    75.000000 Hz   4:3     46.875 kHz     49.500000 MHz
    DMT 0x10:  1024x768    60.003840 Hz   4:3     48.363 kHz     65.000000 MHz
    DMT 0x12:  1024x768    75.028582 Hz   4:3     60.023 kHz     78.750000 MHz
    DMT 0x24:  1280x1024   75.024675 Hz   5:4     79.976 kHz    135.000000 MHz
  Standard Timings:
    DMT 0x23:  1280x1024   60.019740 Hz   5:4     63.981 kHz    108.000000 MHz
    DMT 0x2f:  1440x900    59.887445 Hz  16:10    55.935 kHz    106.500000 MHz
    DMT 0x53:  1600x900    60.000000 Hz  16:9     60.000 kHz    108.000000 MHz (RB)
    DMT 0x52:  1920x1080   60.000000 Hz  16:9     67.500 kHz    148.500000 MHz
  Detailed Timing Descriptors:
    DTD 1:  2560x1440   60.000199 Hz  16:9     88.860 kHz    241.700000 MHz (597 mm x 336 mm)
                 Hfront   48 Hsync  32 Hback   80 Hpol P
                 Vfront    3 Vsync   5 Vback   33 Vpol N
    Display Product Name: 'P27QBB-RA'
    Display Product Serial Number: '4790810029555'
    Display Range Limits:
      Monitor ranges (GTF): 48-75 Hz V, 30-113 kHz H, max dotclock 310 MHz
  Extension blocks: 1
Checksum: 0x5e

----------------

Block 1, CTA-861 Extension Block:
  Revision: 3
  Underscans IT Video Formats by default
  Basic audio support
  Supports YCbCr 4:4:4
  Supports YCbCr 4:2:2
  Native detailed modes: 2
  Video Data Block:
    VIC   1:   640x480    59.940476 Hz   4:3     31.469 kHz     25.175000 MHz
    VIC   3:   720x480    59.940060 Hz  16:9     31.469 kHz     27.000000 MHz
    VIC  18:   720x576    50.000000 Hz  16:9     31.250 kHz     27.000000 MHz
    VIC  19:  1280x720    50.000000 Hz  16:9     37.500 kHz     74.250000 MHz
    VIC   4:  1280x720    60.000000 Hz  16:9     45.000 kHz     74.250000 MHz
    VIC  20:  1920x1080i  50.000000 Hz  16:9     28.125 kHz     74.250000 MHz
    VIC   5:  1920x1080i  60.000000 Hz  16:9     33.750 kHz     74.250000 MHz
    VIC  31:  1920x1080   50.000000 Hz  16:9     56.250 kHz    148.500000 MHz
    VIC  16:  1920x1080   60.000000 Hz  16:9     67.500 kHz    148.500000 MHz (native)
  Audio Data Block:
    Linear PCM:
      Max channels: 2
      Supported sample rates (kHz): 192 176.4 96 88.2 48 44.1 32
      Supported sample sizes (bits): 24 20 16
  Speaker Allocation Data Block:
    FL/FR - Front Left/Right
  Vendor-Specific Data Block (HDMI), OUI 00-0C-03:
    Source physical address: 1.0.0.0
    DC_36bit
    DC_30bit
    DC_Y444
    Maximum TMDS clock: 600 MHz
  Vendor-Specific Data Block (HDMI Forum), OUI C4-5D-D8:
    Version: 1
    Maximum TMDS Character Rate: 600 MHz
    SCDC Present
  Colorimetry Data Block:
    BT2020YCC
    BT2020RGB
  Detailed Timing Descriptors:
    DTD 2:  2560x1440   75.032526 Hz  16:9    111.949 kHz    304.500000 MHz (597 mm x 336 mm)
                 Hfront   48 Hsync  32 Hback   80 Hpol P
                 Vfront    3 Vsync   5 Vback   44 Vpol N
Checksum: 0xf7  Unused space in Extension Block: 61 bytes
