
EDID (hex):
00ffffffffffff0010ac6ed04c315030
111a0104a5371f783e4455a9554d9d26
0f5054a54b00b300d100714fa9408180
778001010101565e00a0a0a029503020
350029372100001a000000ff00464a59
43373634533050314c0a000000fc0044
454c4c205532353135480a20000000fd
0038561e711e010a2020202020200193
02031cf14f1005040302071601141f12
132021222309070783010000023a8018
71382d40582c450029372100001e011d
8018711c1620582c250029372100009e
011d007251d01e206e28550029372100
001e8c0ad08a20e02d10103e96002937
21000018483f00ca808030401a501300
29372100001e00000000000000000057

Extracted contents:
header:          00 ff ff ff ff ff ff 00
serial number:   10 ac 6e d0 4c 31 50 30 11 1a
version:         01 04
basic params:    a5 37 1f 78 3e
chroma info:     44 55 a9 55 4d 9d 26 0f 50 54
established:     a5 4b 00
standard:        b3 00 d1 00 71 4f a9 40 81 80 77 80 01 01 01 01
descriptor 1:    56 5e 00 a0 a0 a0 29 50 30 20 35 00 29 37 21 00 00 1a
descriptor 2:    00 00 00 ff 00 46 4a 59 43 37 36 34 53 30 50 31 4c 0a
descriptor 3:    00 00 00 fc 00 44 45 4c 4c 20 55 32 35 31 35 48 0a 20
descriptor 4:    00 00 00 fd 00 38 56 1e 71 1e 01 0a 20 20 20 20 20 20
extensions:      01
checksum:        93

Manufacturer: DEL Model d06e Serial Number --
Made week 17 of 2016
EDID version: 1.4
Digital display
8 bits per primary color channel
DisplayPort interface
Maximum image size: 55 cm x 31 cm
Gamma: 2.20
DPMS levels: Off
Supported color formats: RGB 4:4:4, YCrCb 4:4:4, YCrCb 4:2:2
Default (sRGB) color space is primary color space
First detailed timing is preferred timing
Established timings supported:
  720x400@70Hz
  640x480@60Hz
  640x480@75Hz
  800x600@60Hz
  800x600@75Hz
  1024x768@60Hz
  1024x768@75Hz
  1280x1024@75Hz
Standard timings supported:
  1680x1050@60Hz
  1920x1200@60Hz
  1152x864@75Hz
  1600x1200@60Hz
  1280x1024@60Hz
  1200x960@60Hz
Detailed mode: Clock 241.500 MHz, 553 mm x 311 mm
               2560 2608 2640 2720 hborder 0
               1440 1443 1448 1481 vborder 0
               +hsync -vsync 
Serial number: --
Monitor name: DELL
Monitor ranges (bare limits): 56-86Hz V, 30-113kHz H, max dotclock 300MHz
Has 1 extension blocks
Checksum: 0x93 (valid)

CEA extension block
Extension version: 3
24 bytes of CEA data
  Video data block
    VIC 16 1920x1080@60Hz 
    VIC 05 1920x1080i@60Hz 
    VIC 04 1280x720@60Hz 
    VIC 03 720x480@60Hz 
    VIC 02 720x480@60Hz 
    VIC 07 1440x480i@60Hz 
    VIC 22 1440x576i@50Hz 
    VIC 01 640x480@60Hz 
    VIC 20 1920x1080i@50Hz 
    VIC 31 1920x1080@50Hz 
    VIC 18 720x576@50Hz 
    VIC 19 1280x720@50Hz 
    VIC 32 1920x1080@24Hz 
    VIC 33 1920x1080@25Hz 
    VIC 34 1920x1080@30Hz 
  Audio data block
    Linear PCM, max channels 1
    Supported sample rates (kHz): 48 44.1 32
    Supported sample sizes (bits): 24 20 16
  Speaker allocation data block
Underscans PC formats by default
Basic audio support
Supports YCbCr 4:4:4
Supports YCbCr 4:2:2
1 native detailed modes
Detailed mode: Clock 148.500 MHz, 553 mm x 311 mm
               1920 2008 2052 2200 hborder 0
               1080 1084 1089 1125 vborder 0
               +hsync +vsync 
Detailed mode: Clock 74.250 MHz, 553 mm x 311 mm
               1920 2008 2052 2200 hborder 0
                540  542  547  562 vborder 0
               +hsync +vsync interlaced 
Detailed mode: Clock 74.250 MHz, 553 mm x 311 mm
               1280 1390 1430 1650 hborder 0
                720  725  730  750 vborder 0
               +hsync +vsync 
Detailed mode: Clock 27.000 MHz, 553 mm x 311 mm
                720  736  798  858 hborder 0
                480  489  495  525 vborder 0
               -hsync -vsync 
Detailed mode: Clock 162.000 MHz, 553 mm x 311 mm
               2048 2074 2154 2250 hborder 0
               1152 1153 1156 1200 vborder 0
               +hsync +vsync 
Checksum: 0x57 (valid)

EDID block does NOT conform to EDID 1.3!
	Detailed block string not properly terminated
