
EDID (hex):
00ffffffffffff0022f0122901010101
1214010368331d78eec665a059589d27
0e5054a1080081c0814081809500a940
b30001010101023a801871382d40582c
4500fd1e1100001e000000fd00324b18
5311000a202020202020000000ff0043
4e43303138504a54460a2020000000fc
004850207832334c45440a2020200023

Extracted contents:
header:          00 ff ff ff ff ff ff 00
serial number:   22 f0 12 29 01 01 01 01 12 14
version:         01 03
basic params:    68 33 1d 78 ee
chroma info:     c6 65 a0 59 58 9d 27 0e 50 54
established:     a1 08 00
standard:        81 c0 81 40 81 80 95 00 a9 40 b3 00 01 01 01 01
descriptor 1:    02 3a 80 18 71 38 2d 40 58 2c 45 00 fd 1e 11 00 00 1e
descriptor 2:    00 00 00 fd 00 32 4b 18 53 11 00 0a 20 20 20 20 20 20
descriptor 3:    00 00 00 ff 00 43 4e 43 30 31 38 50 4a 54 46 0a 20 20
descriptor 4:    00 00 00 fc 00 48 50 20 78 32 33 4c 45 44 0a 20 20 20
extensions:      00
checksum:        23

EDID version: 1.3
Manufacturer: HWP Model 2912 Serial Number --
Made in week 18 of 2010
Analog display, Input voltage level: 0.7/0.7 V
Sync: Separate 
Maximum image size: 51 cm x 29 cm
Gamma: 2.20
DPMS levels: Standby Suspend Off
RGB color display
Default (sRGB) color space is primary color space
First detailed timing is preferred timing
Display x,y Chromaticity:
  Red:   0.6279, 0.3476
  Green: 0.3447, 0.6152
  Blue:  0.1533, 0.0566
  White: 0.3134, 0.3291
Established timings supported:
  720x400@70Hz 9:5 HorFreq: 31469 Hz Clock: 28.320 MHz
  640x480@60Hz 4:3 HorFreq: 31469 Hz Clock: 25.175 MHz
  800x600@60Hz 4:3 HorFreq: 37900 Hz Clock: 40.000 MHz
  1024x768@60Hz 4:3 HorFreq: 48400 Hz Clock: 65.000 MHz
Standard timings supported:
  1280x720@60Hz 16:9
  1280x960@60Hz 4:3 HorFreq: 60000 Hz Clock: 108.000 MHz
  1280x1024@60Hz 5:4 HorFreq: 64000 Hz Clock: 108.000 MHz
  1440x900@60Hz 16:10 HorFreq: 55500 Hz Clock: 88.750 MHz
  1600x1200@60Hz 4:3 HorFreq: 75000 Hz Clock: 162.000 MHz
  1680x1050@60Hz 16:10 HorFreq: 64700 Hz Clock: 119.000 MHz
Detailed mode: Clock 148.500 MHz, 509 mm x 286 mm
               1920 2008 2052 2200 hborder 0
               1080 1084 1089 1125 vborder 0
               +hsync +vsync 
               VertFreq: 60 Hz, HorFreq: 67500 Hz
Monitor ranges (GTF): 50-75Hz V, 24-83kHz H, max dotclock 170MHz
Serial number: --
Monitor name: HP x23LED
Checksum: 0x23 (valid)
EDID block does NOT conform to EDID 1.3!
	sRGB is signaled, but the chromaticities do not match
