
EDID (hex):
00ffffffffffff0006af9d4400000000
001c0104a5261678028915a4554ea028
0d505400000001010101010101010101
010101010101ce8f80b6703888403020
a5007ed7100000180000000f00000000
00000000000000000020000000fe0041
554f0a202020202020202020000000fe
004231373348414e30342e34200a0033

Extracted contents:
header:          00 ff ff ff ff ff ff 00
serial number:   06 af 9d 44 00 00 00 00 00 1c
version:         01 04
basic params:    a5 26 16 78 02
chroma info:     89 15 a4 55 4e a0 28 0d 50 54
established:     00 00 00
standard:        01 01 01 01 01 01 01 01 01 01 01 01 01 01 01 01
descriptor 1:    ce 8f 80 b6 70 38 88 40 30 20 a5 00 7e d7 10 00 00 18
descriptor 2:    00 00 00 0f 00 00 00 00 00 00 00 00 00 00 00 00 00 20
descriptor 3:    00 00 00 fe 00 41 55 4f 0a 20 20 20 20 20 20 20 20 20
descriptor 4:    00 00 00 fe 00 42 31 37 33 48 41 4e 30 34 2e 34 20 0a
extensions:      00
checksum:        33

EDID version: 1.4
Manufacturer: AUO Model 449d Serial Number --
Made in year 2018
Digital display
8 bits per primary color channel
DisplayPort interface
Maximum image size: 38 cm x 22 cm
Gamma: 2.20
Supported color formats: RGB 4:4:4
First detailed timing includes the native pixel format and preferred refresh rate
Display x,y Chromaticity:
  Red:   0.6425, 0.3320
  Green: 0.3066, 0.6259
  Blue:  0.1562, 0.0517
  White: 0.3134, 0.3291
Established timings supported:
Standard timings supported:
Detailed mode: Clock 368.140 MHz, 382 mm x 215 mm
               1920 1968 2000 2102 hborder 0
               1080 1090 1095 1216 vborder 0
               -hsync -vsync 
               VertFreq: 144 Hz, HorFreq: 175137 Hz
Manufacturer-specified data, tag 15
ASCII string: AUO
ASCII string: B173HAN04.4 
Checksum: 0x33 (valid)
EDID block does NOT conform to EDID 1.4!
	Missing name descriptor
	Missing monitor ranges
