
EDID (hex):
00ffffffffffff004c83424d00000000
00180104901f11780a87f594574f8c27
27505400000001010101010101010101
010101010101ce1d56f0500018304030
250035ae10000019d81356f050001830
4030250035ae10000019000000000000
00000000000000000000000000000002
000c42f20c4c641318296e0000000071

Extracted contents:
header:          00 ff ff ff ff ff ff 00
serial number:   4c 83 42 4d 00 00 00 00 00 18
version:         01 04
basic params:    90 1f 11 78 0a
chroma info:     87 f5 94 57 4f 8c 27 27 50 54
established:     00 00 00
standard:        01 01 01 01 01 01 01 01 01 01 01 01 01 01 01 01
descriptor 1:    ce 1d 56 f0 50 00 18 30 40 30 25 00 35 ae 10 00 00 19
descriptor 2:    d8 13 56 f0 50 00 18 30 40 30 25 00 35 ae 10 00 00 19
descriptor 3:    00 00 00 00 00 00 00 00 00 00 00 00 00 00 00 00 00 00
descriptor 4:    00 00 00 02 00 0c 42 f2 0c 4c 64 13 18 29 6e 00 00 00
extensions:      00
checksum:        71

Manufacturer: SDC Model 4d42 Serial Number --
Made week 0 of 2014
EDID version: 1.4
Digital display
6 bits per primary color channel
Digital interface is not defined
Maximum image size: 31 cm x 17 cm
Gamma: 2.20
Supported color formats: RGB 4:4:4, YCrCb 4:2:2
First detailed timing is preferred timing
Established timings supported:
Standard timings supported:
Detailed mode: Clock 76.300 MHz, 309 mm x 174 mm
               1366 1430 1478 1606 hborder 0
                768  770  775  792 vborder 0
               -hsync -vsync 
Detailed mode: Clock 50.800 MHz, 309 mm x 174 mm
               1366 1430 1478 1606 hborder 0
                768  770  775  792 vborder 0
               -hsync -vsync 
Manufacturer-specified data, tag 0
Manufacturer-specified data, tag 2
Checksum: 0x71 (valid)
EDID block does NOT conform to EDID 1.3!
	Missing name descriptor
	Missing monitor ranges
