
EDID (hex):
00ffffffffffff000469fa234dd50000
2d160104a5331d7822d945a2554da027
125054b7ef00714f814081809500b300
d1c081c08100023a801871382d40582c
4500fd1e1100001e000000ff0043424c
4d54463035343630350a000000fd0032
4b185311000a202020202020000000fc
00415355532056533233380a20200047

edid-decode (hex):

00 ff ff ff ff ff ff 00 04 69 fa 23 4d d5 00 00
2d 16 01 04 a5 33 1d 78 22 d9 45 a2 55 4d a0 27
12 50 54 b7 ef 00 71 4f 81 40 81 80 95 00 b3 00
d1 c0 81 c0 81 00 02 3a 80 18 71 38 2d 40 58 2c
45 00 fd 1e 11 00 00 1e 00 00 00 ff 00 43 42 4c
4d 54 46 30 35 34 36 30 35 0a 00 00 00 fd 00 32
4b 18 53 11 00 0a 20 20 20 20 20 20 00 00 00 fc
00 41 53 55 53 20 56 53 32 33 38 0a 20 20 00 47

----------------

Block 0, Base EDID:
  EDID Structure Version & Revision: 1.4
  Vendor & Product Identification:
    Manufacturer: ACI
    Model: 9210
    Serial Number: 54605
    Made in: week 45 of 2012
  Basic Display Parameters & Features:
    Digital display
    Bits per primary color channel: 8
    DisplayPort interface
    Maximum image size: 51 cm x 29 cm
    Gamma: 2.20
    DPMS levels: Off
    Supported color formats: RGB 4:4:4
    First detailed timing includes the native pixel format and preferred refresh rate
  Color Characteristics:
    Red  : 0.6357, 0.3330
    Green: 0.3027, 0.6259
    Blue : 0.1533, 0.0703
    White: 0.3134, 0.3291
  Established Timings I & II:
    IBM     :   720x400    70.081663 Hz   9:5     31.467 kHz     28.320000 MHz
    DMT 0x04:   640x480    59.940476 Hz   4:3     31.469 kHz     25.175000 MHz
    Apple   :   640x480    66.666667 Hz   4:3     35.000 kHz     30.240000 MHz
    DMT 0x06:   640x480    75.000000 Hz   4:3     37.500 kHz     31.500000 MHz
    DMT 0x08:   800x600    56.250000 Hz   4:3     35.156 kHz     36.000000 MHz
    DMT 0x09:   800x600    60.316541 Hz   4:3     37.879 kHz     40.000000 MHz
    DMT 0x0a:   800x600    72.187572 Hz   4:3     48.077 kHz     50.000000 MHz
    DMT 0x0b:   800x600    75.000000 Hz   4:3     46.875 kHz     49.500000 MHz
    Apple   :   832x624    74.551266 Hz   4:3     49.726 kHz     57.284000 MHz
    DMT 0x10:  1024x768    60.003840 Hz   4:3     48.363 kHz     65.000000 MHz
    DMT 0x11:  1024x768    70.069359 Hz   4:3     56.476 kHz     75.000000 MHz
    DMT 0x12:  1024x768    75.028582 Hz   4:3     60.023 kHz     78.750000 MHz
    DMT 0x24:  1280x1024   75.024675 Hz   5:4     79.976 kHz    135.000000 MHz
  Standard Timings:
    DMT 0x15:  1152x864    75.000000 Hz   4:3     67.500 kHz    108.000000 MHz
    DMT 0x20:  1280x960    60.000000 Hz   4:3     60.000 kHz    108.000000 MHz
    DMT 0x23:  1280x1024   60.019740 Hz   5:4     63.981 kHz    108.000000 MHz
    DMT 0x2f:  1440x900    59.887445 Hz  16:10    55.935 kHz    106.500000 MHz
    DMT 0x3a:  1680x1050   59.954250 Hz  16:10    65.290 kHz    146.250000 MHz
    DMT 0x52:  1920x1080   60.000000 Hz  16:9     67.500 kHz    148.500000 MHz
    DMT 0x55:  1280x720    60.000000 Hz  16:9     45.000 kHz     74.250000 MHz
    DMT 0x1c:  1280x800    59.810326 Hz  16:10    49.702 kHz     83.500000 MHz
  Detailed Timing Descriptors:
    DTD 1:  1920x1080   60.000000 Hz  16:9     67.500 kHz    148.500000 MHz (509 mm x 286 mm)
                 Hfront   88 Hsync  44 Hback  148 Hpol P
                 Vfront    4 Vsync   5 Vback   36 Vpol P
    Display Product Serial Number: 'CBLMTF054605'
    Display Range Limits:
      Monitor ranges (GTF): 50-75 Hz V, 24-83 kHz H, max dotclock 170 MHz
    Display Product Name: 'ASUS VS238'
Checksum: 0x47
