
EDID (hex):
00ffffffffffff000e14c01b00000000
0a14010380160c780af88d90575a9227
20505400000001010101010101010101
0101010101014c1d00d0435819203020
3600df7d000000190000000f00202020
20202020203cd2050f00000000fe0043
50540a202020202020202020000000fe
00434c41413130314e423033410a0049

edid-decode (hex):

00 ff ff ff ff ff ff 00 0e 14 c0 1b 00 00 00 00
0a 14 01 03 80 16 0c 78 0a f8 8d 90 57 5a 92 27
20 50 54 00 00 00 01 01 01 01 01 01 01 01 01 01
01 01 01 01 01 01 4c 1d 00 d0 43 58 19 20 30 20
36 00 df 7d 00 00 00 19 00 00 00 0f 00 20 20 20
20 20 20 20 20 3c d2 05 0f 00 00 00 00 fe 00 43
50 54 0a 20 20 20 20 20 20 20 20 20 00 00 00 fe
00 43 4c 41 41 31 30 31 4e 42 30 33 41 0a 00 49

----------------

Block 0, Base EDID:
  EDID Structure Version & Revision: 1.3
  Vendor & Product Identification:
    Manufacturer: CPT
    Model: 7104
    Made in: week 10 of 2010
  Basic Display Parameters & Features:
    Digital display
    Maximum image size: 22 cm x 12 cm
    Gamma: 2.20
    RGB color display
    First detailed timing is the preferred timing
  Color Characteristics:
    Red  : 0.5654, 0.3427
    Green: 0.3535, 0.5703
    Blue : 0.1542, 0.1250
    White: 0.3154, 0.3291
  Established Timings I & II: none
  Standard Timings: none
  Detailed Timing Descriptors:
    DTD 1:  1024x600    60.000000 Hz 128:75    37.500 kHz     75.000000 MHz (223 mm x 125 mm)
                 Hfront   48 Hsync  32 Hback  896 Hpol N
                 Vfront    3 Vsync   6 Vback   16 Vpol N
    Manufacturer-Specified Display Descriptor (0x0f): 00 0f 00 20 20 20 20 20 20 20 20 3c d2 05 0f 00 '...        <....'
    Alphanumeric Data String: 'CPT'
    Alphanumeric Data String: 'CLAA101NB03A'
Checksum: 0x49
