
EDID (hex):
00ffffffffffff0010ac7aa04c353939
0218010380342078eaee95a3544c9926
0f5054a1080081408180a940b300d1c0
010101010101283c80a070b023403020
360006442100001a000000ff00304646
58443431423939354c0a000000fc0044
454c4c2055323431324d0a20000000fd
00323d1e5311000a202020202020007c

Extracted contents:
header:          00 ff ff ff ff ff ff 00
serial number:   10 ac 7a a0 4c 35 39 39 02 18
version:         01 03
basic params:    80 34 20 78 ea
chroma info:     ee 95 a3 54 4c 99 26 0f 50 54
established:     a1 08 00
standard:        81 40 81 80 a9 40 b3 00 d1 c0 01 01 01 01 01 01
descriptor 1:    28 3c 80 a0 70 b0 23 40 30 20 36 00 06 44 21 00 00 1a
descriptor 2:    00 00 00 ff 00 30 46 46 58 44 34 31 42 39 39 35 4c 0a
descriptor 3:    00 00 00 fc 00 44 45 4c 4c 20 55 32 34 31 32 4d 0a 20
descriptor 4:    00 00 00 fd 00 32 3d 1e 53 11 00 0a 20 20 20 20 20 20
extensions:      00
checksum:        7c

Manufacturer: DEL Model a07a Serial Number --
Made week 2 of 2014
EDID version: 1.3
Digital display
Maximum image size: 52 cm x 32 cm
Gamma: 2.20
DPMS levels: Standby Suspend Off
Supported color formats: RGB 4:4:4, YCrCb 4:2:2
First detailed timing is preferred timing
Established timings supported:
  720x400@70Hz
  640x480@60Hz
  800x600@60Hz
  1024x768@60Hz
Standard timings supported:
  1280x960@60Hz
  1280x1024@60Hz
  1600x1200@60Hz
  1680x1050@60Hz
  1920x1080@60Hz
Detailed mode: Clock 154.000 MHz, 518 mm x 324 mm
               1920 1968 2000 2080 hborder 0
               1200 1203 1209 1235 vborder 0
               +hsync -vsync 
Serial number: --
Monitor name: DELL
Monitor ranges (GTF): 50-61Hz V, 30-83kHz H, max dotclock 170MHz
Checksum: 0x7c (valid)
EDID block does NOT conform to EDID 1.3!
	Detailed block string not properly terminated
