
EDID (hex):
00ffffffffffff0030ae521187090000
2814010380291a782ae160a355499927
135054bfcf008180818a818c9500950f
010101010101ab22a0a050841a303020
36009a011100001a000000ff00343334
48453156464f32343339000000fd0032
4c1e510e000a202020202020000000fc
004c31393720576964650a2020200067

edid-decode (hex):

00 ff ff ff ff ff ff 00 30 ae 52 11 87 09 00 00
28 14 01 03 80 29 1a 78 2a e1 60 a3 55 49 99 27
13 50 54 bf cf 00 81 80 81 8a 81 8c 95 00 95 0f
01 01 01 01 01 01 ab 22 a0 a0 50 84 1a 30 30 20
36 00 9a 01 11 00 00 1a 00 00 00 ff 00 34 33 34
48 45 31 56 46 4f 32 34 33 39 00 00 00 fd 00 32
4c 1e 51 0e 00 0a 20 20 20 20 20 20 00 00 00 fc
00 4c 31 39 37 20 57 69 64 65 0a 20 20 20 00 67

----------------

Block 0, Base EDID:
  EDID Structure Version & Revision: 1.3
  Vendor & Product Identification:
    Manufacturer: LEN
    Model: 4434
    Serial Number: 2439
    Made in: week 40 of 2010
  Basic Display Parameters & Features:
    Digital display
    Maximum image size: 41 cm x 26 cm
    Gamma: 2.20
    DPMS levels: Off
    RGB color display
    First detailed timing is the preferred timing
  Color Characteristics:
    Red  : 0.6396, 0.3339
    Green: 0.2851, 0.5986
    Blue : 0.1533, 0.0761
    White: 0.3125, 0.3281
  Established Timings I & II:
    IBM     :   720x400    70.081663 Hz   9:5     31.467 kHz     28.320000 MHz
    DMT 0x04:   640x480    59.940476 Hz   4:3     31.469 kHz     25.175000 MHz
    Apple   :   640x480    66.666667 Hz   4:3     35.000 kHz     30.240000 MHz
    DMT 0x05:   640x480    72.808802 Hz   4:3     37.861 kHz     31.500000 MHz
    DMT 0x06:   640x480    75.000000 Hz   4:3     37.500 kHz     31.500000 MHz
    DMT 0x08:   800x600    56.250000 Hz   4:3     35.156 kHz     36.000000 MHz
    DMT 0x09:   800x600    60.316541 Hz   4:3     37.879 kHz     40.000000 MHz
    DMT 0x0a:   800x600    72.187572 Hz   4:3     48.077 kHz     50.000000 MHz
    DMT 0x0b:   800x600    75.000000 Hz   4:3     46.875 kHz     49.500000 MHz
    DMT 0x10:  1024x768    60.003840 Hz   4:3     48.363 kHz     65.000000 MHz
    DMT 0x11:  1024x768    70.069359 Hz   4:3     56.476 kHz     75.000000 MHz
    DMT 0x12:  1024x768    75.028582 Hz   4:3     60.023 kHz     78.750000 MHz
    DMT 0x24:  1280x1024   75.024675 Hz   5:4     79.976 kHz    135.000000 MHz
  Standard Timings:
    DMT 0x23:  1280x1024   60.019740 Hz   5:4     63.981 kHz    108.000000 MHz
    GTF     :  1280x1024   69.999805 Hz   5:4     74.620 kHz    128.943000 MHz
    GTF     :  1280x1024   72.000069 Hz   5:4     76.824 kHz    132.752000 MHz
    DMT 0x2f:  1440x900    59.887445 Hz  16:10    55.935 kHz    106.500000 MHz
    DMT 0x30:  1440x900    74.984427 Hz  16:10    70.635 kHz    136.750000 MHz
  Detailed Timing Descriptors:
    DTD 1:  1440x900    59.901458 Hz  16:10    55.469 kHz     88.750000 MHz (410 mm x 257 mm)
                 Hfront   48 Hsync  32 Hback   80 Hpol P
                 Vfront    3 Vsync   6 Vback   17 Vpol N
    Display Product Serial Number: '434HE1VFO2439'
    Display Range Limits:
      Monitor ranges (GTF): 50-76 Hz V, 30-81 kHz H, max dotclock 140 MHz
    Display Product Name: 'L197 Wide'
Checksum: 0x67


