
EDID (hex):
00ffffffffffff0004722f0555294081
0e1c0104a53c227806ee91a3544c9926
0f505421080001010101010101010101
010101010101565e00a0a0a029503020
350056502100001a000000ff00234153
50427347494f73637264000000fd001e
a522f040010a202020202020000000fc
005842323731485520410a20202001d1
020312412309070183010000654b0400
01015a8700a0a0a03b50302035005650
2100001a5aa000a0a0a0465030203500
56502100001a6fc200a0a0a055503020
350056502100001a22e50050a0a06750
08203a0056502100001e1c2500a0a0a0
11503020350056502100001a42f80050
a0a0135008203a0056502100001e00a5

edid-decode (hex):

00 ff ff ff ff ff ff 00 04 72 2f 05 55 29 40 81
0e 1c 01 04 a5 3c 22 78 06 ee 91 a3 54 4c 99 26
0f 50 54 21 08 00 01 01 01 01 01 01 01 01 01 01
01 01 01 01 01 01 56 5e 00 a0 a0 a0 29 50 30 20
35 00 56 50 21 00 00 1a 00 00 00 ff 00 23 41 53
50 42 73 47 49 4f 73 63 72 64 00 00 00 fd 00 1e
a5 22 f0 40 01 0a 20 20 20 20 20 20 00 00 00 fc
00 58 42 32 37 31 48 55 20 41 0a 20 20 20 01 d1

02 03 12 41 23 09 07 01 83 01 00 00 65 4b 04 00
01 01 5a 87 00 a0 a0 a0 3b 50 30 20 35 00 56 50
21 00 00 1a 5a a0 00 a0 a0 a0 46 50 30 20 35 00
56 50 21 00 00 1a 6f c2 00 a0 a0 a0 55 50 30 20
35 00 56 50 21 00 00 1a 22 e5 00 50 a0 a0 67 50
08 20 3a 00 56 50 21 00 00 1e 1c 25 00 a0 a0 a0
11 50 30 20 35 00 56 50 21 00 00 1a 42 f8 00 50
a0 a0 13 50 08 20 3a 00 56 50 21 00 00 1e 00 a5

----------------

Block 0, Base EDID:
  EDID Structure Version & Revision: 1.4
  Vendor & Product Identification:
    Manufacturer: ACR
    Model: 1327
    Serial Number: 2168465749
    Made in: week 14 of 2018
  Basic Display Parameters & Features:
    Digital display
    Bits per primary color channel: 8
    DisplayPort interface
    Maximum image size: 60 cm x 34 cm
    Gamma: 2.20
    Supported color formats: RGB 4:4:4
    Default (sRGB) color space is primary color space
    First detailed timing includes the native pixel format and preferred refresh rate
  Color Characteristics:
    Red  : 0.6396, 0.3300
    Green: 0.2998, 0.5996
    Blue : 0.1503, 0.0595
    White: 0.3125, 0.3291
  Established Timings I & II:
    DMT 0x04:   640x480    59.940476 Hz   4:3     31.469 kHz     25.175000 MHz
    DMT 0x09:   800x600    60.316541 Hz   4:3     37.879 kHz     40.000000 MHz
    DMT 0x10:  1024x768    60.003840 Hz   4:3     48.363 kHz     65.000000 MHz
  Standard Timings: none
  Detailed Timing Descriptors:
    DTD 1:  2560x1440   59.950550 Hz  16:9     88.787 kHz    241.500000 MHz (598 mm x 336 mm)
                 Hfront   48 Hsync  32 Hback   80 Hpol P
                 Vfront    3 Vsync   5 Vback   33 Vpol N
    Display Product Serial Number: '#ASPBsGIOscrd'
    Display Range Limits:
      Monitor ranges (Bare Limits): 30-165 Hz V, 34-240 kHz H, max dotclock 640 MHz
    Display Product Name: 'XB271HU A'
  Extension blocks: 1
Checksum: 0xd1

----------------

Block 1, CTA-861 Extension Block:
  Revision: 3
  Basic audio support
  Native detailed modes: 1
  Audio Data Block:
    Linear PCM:
      Max channels: 2
      Supported sample rates (kHz): 48 44.1 32
      Supported sample sizes (bits): 16
  Speaker Allocation Data Block:
    FL/FR - Front Left/Right
  Vendor-Specific Data Block (NVIDIA), OUI 00-04-4B:
    01 01                                           '..'
  Detailed Timing Descriptors:
    DTD 2:  2560x1440   84.983126 Hz  16:9    127.390 kHz    346.500000 MHz (598 mm x 336 mm)
                 Hfront   48 Hsync  32 Hback   80 Hpol P
                 Vfront    3 Vsync   5 Vback   51 Vpol N
    DTD 3:  2560x1440   99.946436 Hz  16:9    150.919 kHz    410.500000 MHz (598 mm x 336 mm)
                 Hfront   48 Hsync  32 Hback   80 Hpol P
                 Vfront    3 Vsync   5 Vback   62 Vpol N
    DTD 4:  2560x1440  119.997589 Hz  16:9    182.996 kHz    497.750000 MHz (598 mm x 336 mm)
                 Hfront   48 Hsync  32 Hback   80 Hpol P
                 Vfront    3 Vsync   5 Vback   77 Vpol N
    DTD 5:  2560x1440  143.998311 Hz  16:9    222.189 kHz    586.580000 MHz (598 mm x 336 mm)
                 Hfront    8 Hsync  32 Hback   40 Hpol P
                 Vfront    3 Vsync  10 Vback   90 Vpol P
    DTD 6:  2560x1440   23.971497 Hz  16:9     34.926 kHz     95.000000 MHz (598 mm x 336 mm)
                 Hfront   48 Hsync  32 Hback   80 Hpol P
                 Vfront    3 Vsync   5 Vback    9 Vpol N
    DTD 7:  2560x1440  164.999896 Hz  16:9    240.735 kHz    635.540000 MHz (598 mm x 336 mm)
                 Hfront    8 Hsync  32 Hback   40 Hpol P
                 Vfront    3 Vsync  10 Vback    6 Vpol P
Checksum: 0xa5  Unused space in Extension Block: 1 byte
