
EDID (hex):
00ffffffffffff000e8f060600000000
1a1d0104a51d11780343b5a3534d9c27
0e505400000001010101010101010101
010101010101143780b8703824403020
3e0035ae100000180000000f00000000
00000000000000000020000000fe0043
544f0a202020202020202020000000fe
004c454231333139324e0a2020200025

Extracted contents:
header:          00 ff ff ff ff ff ff 00
serial number:   0e 8f 06 06 00 00 00 00 1a 1d
version:         01 04
basic params:    a5 1d 11 78 03
chroma info:     43 b5 a3 53 4d 9c 27 0e 50 54
established:     00 00 00
standard:        01 01 01 01 01 01 01 01 01 01 01 01 01 01 01 01
descriptor 1:    14 37 80 b8 70 38 24 40 30 20 3e 00 35 ae 10 00 00 18
descriptor 2:    00 00 00 0f 00 00 00 00 00 00 00 00 00 00 00 00 00 20
descriptor 3:    00 00 00 fe 00 43 54 4f 0a 20 20 20 20 20 20 20 20 20
descriptor 4:    00 00 00 fe 00 4c 45 42 31 33 31 39 32 4e 0a 20 20 20
extensions:      00
checksum:        25

EDID version: 1.4
Manufacturer: CTO Model 606 Serial Number --
Made in week 26 of 2019
Digital display
8 bits per primary color channel
DisplayPort interface
Maximum image size: 29 cm x 17 cm
Gamma: 2.20
Supported color formats: RGB 4:4:4
First detailed timing includes the native pixel format and preferred refresh rate
Display is continuous frequency
Display x,y Chromaticity:
  Red:   0.6376, 0.3242
  Green: 0.3007, 0.6123
  Blue:  0.1542, 0.0576
  White: 0.3134, 0.3291
Established timings supported:
Standard timings supported:
Detailed mode: Clock 141.000 MHz, 309 mm x 174 mm
               1920 1968 2000 2104 hborder 0
               1080 1083 1097 1116 vborder 0
               -hsync -vsync 
               VertFreq: 60 Hz, HorFreq: 67015 Hz
Manufacturer-specified data, tag 15
ASCII string: CTO
ASCII string: LEB13192N
Checksum: 0x25 (valid)
EDID block does NOT conform to EDID 1.4!
	Missing name descriptor
	Missing monitor ranges
