edid-decode (hex):

00 ff ff ff ff ff ff 00 09 e5 91 06 00 00 00 00
01 1b 01 04 a5 1c 10 78 02 8d 90 9a 5a 57 91 28
1e 50 54 00 00 00 01 01 01 01 01 01 01 01 01 01
01 01 01 01 01 01 c9 36 80 cd 70 38 14 40 30 20
36 00 14 9c 10 00 00 1a 00 00 00 00 00 00 00 00
00 00 00 00 00 00 00 00 00 00 00 00 00 fc 00 42
4f 45 20 48 46 0a 20 20 20 20 20 20 00 00 00 fc
00 4e 56 31 32 35 46 48 4d 2d 41 34 31 0a 00 40

----------------

Block 0, Base EDID:
  EDID Structure Version & Revision: 1.4
  Vendor & Product Identification:
    Manufacturer: BOE
    Model: 1681
    Made in: week 1 of 2017
  Basic Display Parameters & Features:
    Digital display
    Bits per primary color channel: 8
    DisplayPort interface
    Maximum image size: 28 cm x 16 cm
    Gamma: 2.20
    Supported color formats: RGB 4:4:4
    First detailed timing includes the native pixel format and preferred refresh rate
  Color Characteristics:
    Red  : 0.6035, 0.3515
    Green: 0.3427, 0.5673
    Blue : 0.1582, 0.1181
    White: 0.3125, 0.3281
  Established Timings I & II: none
  Standard Timings: none
  Detailed Timing Descriptors:
    DTD 1:  1920x1080   60.000000 Hz  16:9     66.000 kHz    140.250000 MHz (276 mm x 156 mm)
                 Hfront   48 Hsync  32 Hback  125 Hpol P
                 Vfront    3 Vsync   6 Vback   11 Vpol N
    Empty Descriptor
    Display Product Name: 'BOE HF'
    Display Product Name: 'NV125FHM-A41'
Checksum: 0x40

----------------

Failures:

Block 0, Base EDID:
  Empty Descriptor: Use Dummy Descriptor instead of all zeroes.

EDID conformity: FAIL
