
EDID (hex):
00ffffffffffff0030e4580200000000
00130103802313780a1be59e59509826
0e505400000001010101010101010101
0101010101011c2a4040618424303020
350059c2100000190000000000000000
00000000000000000000000000fe004c
4720446973706c61790a2020000000fe
004c503135365744312d544c443300a3

edid-decode (hex):

00 ff ff ff ff ff ff 00 30 e4 58 02 00 00 00 00
00 13 01 03 80 23 13 78 0a 1b e5 9e 59 50 98 26
0e 50 54 00 00 00 01 01 01 01 01 01 01 01 01 01
01 01 01 01 01 01 1c 2a 40 40 61 84 24 30 30 20
35 00 59 c2 10 00 00 19 00 00 00 00 00 00 00 00
00 00 00 00 00 00 00 00 00 00 00 00 00 fe 00 4c
47 20 44 69 73 70 6c 61 79 0a 20 20 00 00 00 fe
00 4c 50 31 35 36 57 44 31 2d 54 4c 44 33 00 a3

----------------

Block 0, Base EDID:
  EDID Structure Version & Revision: 1.3
  Vendor & Product Identification:
    Manufacturer: LGD
    Model: 600
    Made in: 2009
  Basic Display Parameters & Features:
    Digital display
    Maximum image size: 35 cm x 19 cm
    Gamma: 2.20
    RGB color display
    First detailed timing is the preferred timing
  Color Characteristics:
    Red  : 0.6171, 0.3486
    Green: 0.3144, 0.5966
    Blue : 0.1513, 0.0566
    White: 0.3134, 0.3291
  Established Timings I & II: none
  Standard Timings: none
  Detailed Timing Descriptors:
    DTD 1:  1600x900    59.984865 Hz  16:9     56.146 kHz    107.800000 MHz (345 mm x 194 mm)
                 Hfront   48 Hsync  32 Hback  240 Hpol N
                 Vfront    3 Vsync   5 Vback   28 Vpol N
    Empty Descriptor
    Alphanumeric Data String: 'LG Display'
    Alphanumeric Data String: 'LP156WD1-TLD3'
Checksum: 0xa3
