
EDID (hex):
00ffffffffffff0015c3871601010101
0b0e010280261e78eaee95a3544c9926
0f5054a1080081800101010101010101
010101010101302a009851002a403070
1300782d1100001e000000ff00433535
39303033340a20202020000000fd003b
3d1f400b000a202020202020000000fc
004c3736370a20202020202020200052

Extracted contents:
header:          00 ff ff ff ff ff ff 00
serial number:   15 c3 87 16 01 01 01 01 0b 0e
version:         01 02
basic params:    80 26 1e 78 ea
chroma info:     ee 95 a3 54 4c 99 26 0f 50 54
established:     a1 08 00
standard:        81 80 01 01 01 01 01 01 01 01 01 01 01 01 01 01
descriptor 1:    30 2a 00 98 51 00 2a 40 30 70 13 00 78 2d 11 00 00 1e
descriptor 2:    00 00 00 ff 00 43 35 35 39 30 30 33 34 0a 20 20 20 20
descriptor 3:    00 00 00 fd 00 3b 3d 1f 40 0b 00 0a 20 20 20 20 20 20
descriptor 4:    00 00 00 fc 00 4c 37 36 37 0a 20 20 20 20 20 20 20 20
extensions:      00
checksum:        52

Manufacturer: ENC Model 1687 Serial Number --
EDID version: 1.2
Digital display
Maximum image size: 38 cm x 30 cm
Gamma: 2.20
DPMS levels: Standby Suspend Off
Supported color formats: RGB 4:4:4, YCrCb 4:2:2
First detailed timing is preferred timing
Established timings supported:
  720x400@70Hz
  640x480@60Hz
  800x600@60Hz
  1024x768@60Hz
Standard timings supported:
  1280x1024@60Hz
Detailed mode: Clock 108.000 MHz, 376 mm x 301 mm
               1280 1328 1440 1688 hborder 0
               1024 1025 1028 1066 vborder 0
               +hsync +vsync 
Serial number: --
Monitor ranges (GTF): 59-61Hz V, 31-64kHz H, max dotclock 110MHz
Monitor name: L767
Checksum: 0x52 (valid)
EDID block does not conform at all!
	Bad year of manufacture
