edid-decode (hex):

00 ff ff ff ff ff ff 00 4c 2d 36 02 30 33 55 48
0e 12 01 03 80 40 28 78 28 fe 87 a3 57 4a 9c 25
13 50 54 00 00 00 01 01 01 01 01 01 01 01 01 01
01 01 01 01 01 01 bc 1b 00 a0 50 20 17 30 30 20
36 00 86 96 21 00 00 1a b0 68 00 a0 a0 40 2e 60
30 20 36 00 86 96 21 00 00 1a 00 00 00 fc 00 53
79 6e 63 4d 61 73 74 65 72 0a 20 20 00 00 00 ff
00 48 56 55 51 34 30 30 31 39 35 0a 20 20 00 3b

----------------

Block 0, Base EDID:
  EDID Structure Version & Revision: 1.3
  Vendor & Product Identification:
    Manufacturer: SAM
    Model: 566
    Serial Number: ...
    Made in: week 14 of 2008
  Basic Display Parameters & Features:
    Digital display
    Maximum image size: 64 cm x 40 cm
    Gamma: 2.20
    DPMS levels: Off
    RGB color display
  Color Characteristics:
    Red  : 0.6396, 0.3427
    Green: 0.2919, 0.6113
    Blue : 0.1464, 0.0742
    White: 0.3134, 0.3310
  Established Timings I & II: none
  Standard Timings: none
  Detailed Timing Descriptors:
    DTD 1:  1280x800    59.909545 Hz   8:5     49.306 kHz     71.000000 MHz (646 mm x 406 mm)
                 Hfront   48 Hsync  32 Hback   80 Hpol P
                 Vfront    3 Vsync   6 Vback   14 Vpol N
    DTD 2:  2560x1600   59.859910 Hz   8:5     98.529 kHz    268.000000 MHz (646 mm x 406 mm)
                 Hfront   48 Hsync  32 Hback   80 Hpol P
                 Vfront    3 Vsync   6 Vback   37 Vpol N
    Display Product Name: 'SyncMaster'
    Display Product Serial Number: ...
Checksum: 0x3b

----------------

Failures:

Block 0, Base EDID:
  Basic Display Parameters & Features: EDID 1.3 requires that the first detailed timing is the preferred timing.
  Missing Display Range Limits Descriptor.

EDID conformity: FAIL
