
EDID (hex):
00ffffffffffff005a632bd201010101
0c1e010380341d782e8995a556529f27
0d5054bfef80b300a940a9c095009040
818081408100023a801871382d40582c
450009252100001e000000ff00564257
3230313234303931370a000000fd0032
4b0f5216000a202020202020000000fc
00564732343339205365726965730152
020329f1549005040302070608090f1f
1413121115161d1e0123090707830100
0067030c001000002d023a801871382d
40582c450009252100001e011d801871
1c1620582c250009252100009e011d00
7251d01e206e28550009252100001e8c
0ad08a20e02d10103e96000925210000
18000000000000000000000000000093

Extracted contents:
header:          00 ff ff ff ff ff ff 00
serial number:   5a 63 2b d2 01 01 01 01 0c 1e
version:         01 03
basic params:    80 34 1d 78 2e
chroma info:     89 95 a5 56 52 9f 27 0d 50 54
established:     bf ef 80
standard:        b3 00 a9 40 a9 c0 95 00 90 40 81 80 81 40 81 00
descriptor 1:    02 3a 80 18 71 38 2d 40 58 2c 45 00 09 25 21 00 00 1e
descriptor 2:    00 00 00 ff 00 56 42 57 32 30 31 32 34 30 39 31 37 0a
descriptor 3:    00 00 00 fd 00 32 4b 0f 52 16 00 0a 20 20 20 20 20 20
descriptor 4:    00 00 00 fc 00 56 47 32 34 33 39 20 53 65 72 69 65 73
extensions:      01
checksum:        52

Manufacturer: VSC Model d22b Serial Number --
Made week 12 of 2020
EDID version: 1.3
Digital display
Maximum image size: 52 cm x 29 cm
Gamma: 2.20
DPMS levels: Off
Supported color formats: RGB 4:4:4, YCrCb 4:2:2
Default (sRGB) color space is primary color space
First detailed timing is preferred timing
Established timings supported:
  720x400@70Hz
  640x480@60Hz
  640x480@67Hz
  640x480@72Hz
  640x480@75Hz
  800x600@56Hz
  800x600@60Hz
  800x600@72Hz
  800x600@75Hz
  832x624@75Hz
  1024x768@60Hz
  1024x768@70Hz
  1024x768@75Hz
  1280x1024@75Hz
  1152x870@75Hz
Standard timings supported:
  1680x1050@60Hz
  1600x1200@60Hz
  1600x900@60Hz
  1440x900@60Hz
  1400x1050@60Hz
  1280x1024@60Hz
  1280x960@60Hz
  1280x800@60Hz
Detailed mode: Clock 148.500 MHz, 521 mm x 293 mm
               1920 2008 2052 2200 hborder 0
               1080 1084 1089 1125 vborder 0
               +hsync +vsync 
Serial number: --
Monitor ranges (GTF): 50-75Hz V, 15-82kHz H, max dotclock 220MHz
Has 1 extension blocks
Checksum: 0x52 (valid)

CEA extension block
Extension version: 3
37 bytes of CEA data
  Video data block
    VIC 16 1920x1080@60Hz (native)
    VIC 05 1920x1080i@60Hz 
    VIC 04 1280x720@60Hz 
    VIC 03 720x480@60Hz 
    VIC 02 720x480@60Hz 
    VIC 07 1440x480i@60Hz 
    VIC 06 1440x480i@60Hz 
    VIC 08 1440x240@60Hz 
    VIC 09 1440x240@60Hz 
    VIC 15 1440x480@60Hz 
    VIC 31 1920x1080@50Hz 
    VIC 20 1920x1080i@50Hz 
    VIC 19 1280x720@50Hz 
    VIC 18 720x576@50Hz 
    VIC 17 720x576@50Hz 
    VIC 21 1440x576i@50Hz 
    VIC 22 1440x576i@50Hz 
    VIC 29 1440x576@50Hz 
    VIC 30 1440x576@50Hz 
    VIC 01 640x480@60Hz 
  Audio data block
    Linear PCM, max channels 1
    Supported sample rates (kHz): 48 44.1 32
    Supported sample sizes (bits): 24 20 16
  Speaker allocation data block
  Vendor-specific data block, OUI 000c03 (HDMI)
    Source physical address 1.0.0.0
    Maximum TMDS clock: 225MHz
Underscans PC formats by default
Basic audio support
Supports YCbCr 4:4:4
Supports YCbCr 4:2:2
1 native detailed modes
Detailed mode: Clock 148.500 MHz, 521 mm x 293 mm
               1920 2008 2052 2200 hborder 0
               1080 1084 1089 1125 vborder 0
               +hsync +vsync 
Detailed mode: Clock 74.250 MHz, 521 mm x 293 mm
               1920 2008 2052 2200 hborder 0
                540  542  547  562 vborder 0
               +hsync +vsync interlaced 
Detailed mode: Clock 74.250 MHz, 521 mm x 293 mm
               1280 1390 1430 1650 hborder 0
                720  725  730  750 vborder 0
               +hsync +vsync 
Detailed mode: Clock 27.000 MHz, 521 mm x 293 mm
                720  736  798  858 hborder 0
                480  489  495  525 vborder 0
               -hsync -vsync 
Checksum: 0x93 (valid)

EDID block does NOT conform to EDID 1.3!
	Name descriptor not terminated with a newline
