
EDID (hex):
00ffffffffffff003ac4000500000000
2d0c010380201200eaa8e099574b9225
1c505400000001010101010101010101
0101010101012a3680a070381f403020
350042b510000018000000fc004e7669
6469612044656661756c000000fc0074
20466c61742050616e656c00000000fd
00003d1d430e0000202020202000007e

edid-decode (hex):

00 ff ff ff ff ff ff 00 3a c4 00 05 00 00 00 00
2d 0c 01 03 80 20 12 00 ea a8 e0 99 57 4b 92 25
1c 50 54 00 00 00 01 01 01 01 01 01 01 01 01 01
01 01 01 01 01 01 2a 36 80 a0 70 38 1f 40 30 20
35 00 42 b5 10 00 00 18 00 00 00 fc 00 4e 76 69
64 69 61 20 44 65 66 61 75 6c 00 00 00 fc 00 74
20 46 6c 61 74 20 50 61 6e 65 6c 00 00 00 00 fd
00 00 3d 1d 43 0e 00 00 20 20 20 20 20 00 00 7e

----------------

Block 0, Base EDID:
  EDID Structure Version & Revision: 1.3
  Vendor & Product Identification:
    Manufacturer: NVD
    Model: 1280
    Made in: week 45 of 2002
  Basic Display Parameters & Features:
    Digital display
    Maximum image size: 32 cm x 18 cm
    Gamma: 1.00
    DPMS levels: Standby Suspend Off
    RGB color display
    First detailed timing is the preferred timing
  Color Characteristics:
    Red  : 0.5996, 0.3417
    Green: 0.2949, 0.5703
    Blue : 0.1474, 0.1113
    White: 0.3125, 0.3281
  Established Timings I & II: none
  Standard Timings: none
  Detailed Timing Descriptors:
    DTD 1:  1920x1080   60.003116 Hz  16:9     66.663 kHz    138.660000 MHz (322 mm x 181 mm)
                 Hfront   48 Hsync  32 Hback   80 Hpol N
                 Vfront    3 Vsync   5 Vback   23 Vpol N
    Display Product Name: 'Nvidia Defaul'
    Display Product Name: 't Flat Panel'
    Display Range Limits:
      Monitor ranges (GTF): 0-61 Hz V, 29-67 kHz H, max dotclock 140 MHz
Checksum: 0x7e
