
EDID (hex):
00ffffffffffff000469e12401010101
0c17010380351e78ea9de5a654549f26
0d5054b7ef00714f8180814081c08100
9500b3000101023a801871382d40582c
4500132b2100001e000000fd0032961e
a021000a202020202020000000fc0056
473234380a20202020202020000000ff
0044334c4d51533038363638320a01ff
020104008a4d80a070382c4030203500
132b2100001afe5b80a0703835403020
3500132b2100001a866f80a070384040
30203500132b2100001a057c80587038
124018203500132b2100001e00000000
00000000000000000000000000000000
00000000000000000000000000000000
000000000000000000000000000000e4

Extracted contents:
header:          00 ff ff ff ff ff ff 00
serial number:   04 69 e1 24 01 01 01 01 0c 17
version:         01 03
basic params:    80 35 1e 78 ea
chroma info:     9d e5 a6 54 54 9f 26 0d 50 54
established:     b7 ef 00
standard:        71 4f 81 80 81 40 81 c0 81 00 95 00 b3 00 01 01
descriptor 1:    02 3a 80 18 71 38 2d 40 58 2c 45 00 13 2b 21 00 00 1e
descriptor 2:    00 00 00 fd 00 32 96 1e a0 21 00 0a 20 20 20 20 20 20
descriptor 3:    00 00 00 fc 00 56 47 32 34 38 0a 20 20 20 20 20 20 20
descriptor 4:    00 00 00 ff 00 44 33 4c 4d 51 53 30 38 36 36 38 32 0a
extensions:      01
checksum:        ff

EDID version: 1.3
Manufacturer: ACI Model 24e1 Serial Number --
Made in week 12 of 2013
Digital display
Maximum image size: 53 cm x 30 cm
Gamma: 2.20
DPMS levels: Standby Suspend Off
RGB color display
First detailed timing is preferred timing
Display x,y Chromaticity:
  Red:   0.6503, 0.3291
  Green: 0.3310, 0.6220
  Blue:  0.1513, 0.0527
  White: 0.3134, 0.3291
Established timings supported:
  720x400@70Hz 9:5 HorFreq: 31469 Hz Clock: 28.320 MHz
  640x480@60Hz 4:3 HorFreq: 31469 Hz Clock: 25.175 MHz
  640x480@67Hz 4:3 HorFreq: 35000 Hz Clock: 30.240 MHz
  640x480@75Hz 4:3 HorFreq: 37500 Hz Clock: 31.500 MHz
  800x600@56Hz 4:3 HorFreq: 35200 Hz Clock: 36.000 MHz
  800x600@60Hz 4:3 HorFreq: 37900 Hz Clock: 40.000 MHz
  800x600@72Hz 4:3 HorFreq: 48100 Hz Clock: 50.000 MHz
  800x600@75Hz 4:3 HorFreq: 46900 Hz Clock: 49.500 MHz
  832x624@75Hz 4:3 HorFreq: 49726 Hz Clock: 57.284 MHz
  1024x768@60Hz 4:3 HorFreq: 48400 Hz Clock: 65.000 MHz
  1024x768@70Hz 4:3 HorFreq: 56500 Hz Clock: 75.000 MHz
  1024x768@75Hz 4:3 HorFreq: 60000 Hz Clock: 78.750 MHz
  1280x1024@75Hz 5:4 HorFreq: 80000 Hz Clock: 135.000 MHz
Standard timings supported:
  1152x864@75Hz 4:3 HorFreq: 67500 Hz Clock: 108.000 MHz
  1280x1024@60Hz 5:4 HorFreq: 64000 Hz Clock: 108.000 MHz
  1280x960@60Hz 4:3 HorFreq: 60000 Hz Clock: 108.000 MHz
  1280x720@60Hz 16:9
  1280x800@60Hz 16:10
  1440x900@60Hz 16:10 HorFreq: 55500 Hz Clock: 88.750 MHz
  1680x1050@60Hz 16:10 HorFreq: 64700 Hz Clock: 119.000 MHz
Detailed mode: Clock 148.500 MHz, 531 mm x 299 mm
               1920 2008 2052 2200 hborder 0
               1080 1084 1089 1125 vborder 0
               +hsync +vsync 
               VertFreq: 60 Hz, HorFreq: 67500 Hz
Monitor ranges (GTF): 50-150Hz V, 30-160kHz H, max dotclock 330MHz
Monitor name: VG248
Serial number: --
Has 1 extension blocks
Checksum: 0xff (valid)

CTA extension block
Extension version: 1
0 8-byte timing descriptors
Detailed mode: Clock 198.500 MHz, 531 mm x 299 mm
               1920 1968 2000 2080 hborder 0
               1080 1083 1088 1124 vborder 0
               +hsync -vsync 
               VertFreq: 84 Hz, HorFreq: 95432 Hz
Detailed mode: Clock 235.500 MHz, 531 mm x 299 mm
               1920 1968 2000 2080 hborder 0
               1080 1083 1088 1133 vborder 0
               +hsync -vsync 
               VertFreq: 99 Hz, HorFreq: 113221 Hz
Detailed mode: Clock 285.500 MHz, 531 mm x 299 mm
               1920 1968 2000 2080 hborder 0
               1080 1083 1088 1144 vborder 0
               +hsync -vsync 
               VertFreq: 119 Hz, HorFreq: 137259 Hz
Detailed mode: Clock 317.490 MHz, 531 mm x 299 mm
               1920 1944 1976 2008 hborder 0
               1080 1083 1088 1098 vborder 0
               +hsync +vsync 
               VertFreq: 144 Hz, HorFreq: 158112 Hz
Checksum: 0xe4 (valid)

EDID block does not conform at all!
	Both the serial number and the serial string are set


