
EDID (hex):
00ffffffffffff0006af8b8100000000
211d0104951f1178039b859256599029
20505400000001010101010101010101
010101010101143780b8703824401010
3e0035ae10000018b82480b870382440
10103e0035ae10000018000000000000
00000000000000000000000000000002
001048ff0f3c7d490d1b7d20202000e4

edid-decode (hex):

00 ff ff ff ff ff ff 00 06 af 8b 81 00 00 00 00
21 1d 01 04 95 1f 11 78 03 9b 85 92 56 59 90 29
20 50 54 00 00 00 01 01 01 01 01 01 01 01 01 01
01 01 01 01 01 01 14 37 80 b8 70 38 24 40 10 10
3e 00 35 ae 10 00 00 18 b8 24 80 b8 70 38 24 40
10 10 3e 00 35 ae 10 00 00 18 00 00 00 00 00 00
00 00 00 00 00 00 00 00 00 00 00 00 00 00 00 02
00 10 48 ff 0f 3c 7d 49 0d 1b 7d 20 20 20 00 e4

----------------

Block 0, Base EDID:
  EDID Structure Version & Revision: 1.4
  Vendor & Product Identification:
    Manufacturer: AUO
    Model: 33163
    Made in: week 33 of 2019
  Basic Display Parameters & Features:
    Digital display
    Bits per primary color channel: 6
    DisplayPort interface
    Maximum image size: 31 cm x 17 cm
    Gamma: 2.20
    Supported color formats: RGB 4:4:4
    First detailed timing includes the native pixel format and preferred refresh rate
    Display is continuous frequency
  Color Characteristics:
    Red  : 0.5722, 0.3369
    Green: 0.3496, 0.5654
    Blue : 0.1621, 0.1250
    White: 0.3134, 0.3291
  Established Timings I & II: none
  Standard Timings: none
  Detailed Timing Descriptors:
    DTD 1:  1920x1080   60.049471 Hz  16:9     67.015 kHz    141.000000 MHz (309 mm x 174 mm)
                 Hfront   16 Hsync  16 Hback  152 Hpol N
                 Vfront    3 Vsync  14 Vback   19 Vpol N
    DTD 2:  1920x1080   40.032980 Hz  16:9     44.677 kHz     94.000000 MHz (309 mm x 174 mm)
                 Hfront   16 Hsync  16 Hback  152 Hpol N
                 Vfront    3 Vsync  14 Vback   19 Vpol N
    Empty Descriptor
    Manufacturer-Specified Display Descriptor (0x02): 00 02 00 10 48 ff 0f 3c 7d 49 0d 1b 7d 20 20 20 '....H..<}I..}   '
Checksum: 0xe4
