
EDID (hex):
00ffffffffffff0010ac23b100000000
0014010380331d780a87f594574f8c27
27505400000001010101010101010101
0101010101019434806470381f403020
2600fe1f110000190000000f00000000
00000000001e500c1300000000fc0049
4e535049524f4e204f4e450000000000
0000000000000000000000000000004c

edid-decode (hex):

00 ff ff ff ff ff ff 00 10 ac 23 b1 00 00 00 00
00 14 01 03 80 33 1d 78 0a 87 f5 94 57 4f 8c 27
27 50 54 00 00 00 01 01 01 01 01 01 01 01 01 01
01 01 01 01 01 01 94 34 80 64 70 38 1f 40 30 20
26 00 fe 1f 11 00 00 19 00 00 00 0f 00 00 00 00
00 00 00 00 00 1e 50 0c 13 00 00 00 00 fc 00 49
4e 53 50 49 52 4f 4e 20 4f 4e 45 00 00 00 00 00
00 00 00 00 00 00 00 00 00 00 00 00 00 00 00 4c

----------------

Block 0, Base EDID:
  EDID Structure Version & Revision: 1.3
  Vendor & Product Identification:
    Manufacturer: DEL
    Model: 45347
    Made in: 2010
  Basic Display Parameters & Features:
    Digital display
    Maximum image size: 51 cm x 29 cm
    Gamma: 2.20
    RGB color display
    First detailed timing is the preferred timing
  Color Characteristics:
    Red  : 0.5800, 0.3398
    Green: 0.3095, 0.5498
    Blue : 0.1552, 0.1552
    White: 0.3134, 0.3291
  Established Timings I & II: none
  Standard Timings: none
  Detailed Timing Descriptors:
    DTD 1:  1920x1080   59.976295 Hz  16:9     66.634 kHz    134.600000 MHz (510 mm x 287 mm)
                 Hfront   48 Hsync  32 Hback   20 Hpol N
                 Vfront    2 Vsync   6 Vback   23 Vpol N
    Manufacturer-Specified Display Descriptor (0x0f): 00 0f 00 00 00 00 00 00 00 00 00 1e 50 0c 13 00 '............P...'
    Display Product Name: 'INSPIRON ONE'
    Empty Descriptor
Checksum: 0x4c
