edid-decode (hex):

00 ff ff ff ff ff ff 00 04 72 b0 40 01 00 00 00
28 19 01 03 81 2b 17 78 ea 64 b5 ab 52 38 ab 25
13 50 54 00 00 00 01 01 01 01 01 01 01 01 01 01
01 01 01 01 01 01 48 2f 40 30 62 84 22 30 58 58
3b 00 b1 ec 10 00 00 1e 00 00 00 fc 00 41 49 4f
20 4c 43 44 0a 20 20 20 20 20 00 00 00 fc 00 41
49 4f 20 4c 43 44 0a 20 20 20 20 20 00 00 00 fc
00 41 49 4f 20 4c 43 44 0a 20 20 20 20 20 00 25

----------------

Block 0, Base EDID:
  EDID Structure Version & Revision: 1.3
  Vendor & Product Identification:
    Manufacturer: ACR
    Model: 16560
    Serial Number: ...
    Made in: week 40 of 2015
  Basic Display Parameters & Features:
    Digital display
    DFP 1.x compatible TMDS
    Maximum image size: 43 cm x 23 cm
    Gamma: 2.20
    DPMS levels: Standby Suspend Off
    RGB color display
    First detailed timing is the preferred timing
  Color Characteristics:
    Red  : 0.6689, 0.3222
    Green: 0.2197, 0.6679
    Blue : 0.1464, 0.0771
    White: 0.3134, 0.3291
  Established Timings I & II: none
  Standard Timings: none
  Detailed Timing Descriptors:
    DTD 1:  1600x900    59.996828 Hz  16:9     56.037 kHz    121.040000 MHz (433 mm x 236 mm)
                 Hfront   88 Hsync  88 Hback  384 Hpol P
                 Vfront    3 Vsync  11 Vback   20 Vpol P
    Display Product Name: 'AIO LCD'
    Display Product Name: 'AIO LCD'
    Display Product Name: 'AIO LCD'
Checksum: 0x25

----------------

Failures:

Block 0, Base EDID:
  Missing Display Range Limits Descriptor.

EDID conformity: FAIL
