
EDID (hex):
00ffffffffffff004c83523400000000
00160103802213780a09259257548f29
22505400000001010101010101010101
010101010101411c56a0500016303020
250058c2100000190000000f00000000
00000000001eb4027400000000fe0053
414d53554e470a204c834154000000fe
004c544e3135364154333234303100ae

edid-decode (hex):

00 ff ff ff ff ff ff 00 4c 83 52 34 00 00 00 00
00 16 01 03 80 22 13 78 0a 09 25 92 57 54 8f 29
22 50 54 00 00 00 01 01 01 01 01 01 01 01 01 01
01 01 01 01 01 01 41 1c 56 a0 50 00 16 30 30 20
25 00 58 c2 10 00 00 19 00 00 00 0f 00 00 00 00
00 00 00 00 00 1e b4 02 74 00 00 00 00 fe 00 53
41 4d 53 55 4e 47 0a 20 4c 83 41 54 00 00 00 fe
00 4c 54 4e 31 35 36 41 54 33 32 34 30 31 00 ae

----------------

Block 0, Base EDID:
  EDID Structure Version & Revision: 1.3
  Vendor & Product Identification:
    Manufacturer: SDC
    Model: 13394
    Made in: 2012
  Basic Display Parameters & Features:
    Digital display
    Maximum image size: 34 cm x 19 cm
    Gamma: 2.20
    RGB color display
    First detailed timing is the preferred timing
  Color Characteristics:
    Red  : 0.5703, 0.3398
    Green: 0.3300, 0.5595
    Blue : 0.1601, 0.1347
    White: 0.3134, 0.3291
  Established Timings I & II: none
  Standard Timings: none
  Detailed Timing Descriptors:
    DTD 1:  1366x768    59.998009 Hz 683:384   47.398 kHz     72.330000 MHz (344 mm x 194 mm)
                 Hfront   48 Hsync  32 Hback   80 Hpol N
                 Vfront    2 Vsync   5 Vback   15 Vpol N
    Manufacturer-Specified Display Descriptor (0x0f): 00 0f 00 00 00 00 00 00 00 00 00 1e b4 02 74 00 '..............t.'
    Alphanumeric Data String: 'SAMSUNG'
    Alphanumeric Data String: 'LTN156AT32401'
Checksum: 0xae
