
EDID (hex):
00ffffffffffff0019c9000000000000
00170103080000780a2fcda354459724
11464721080001010101010101010101
010101010101662150b051001b304070
360010090000001ea91a00a050001630
3020370005030000001a000000fd0017
3f0f450f000a202020202020000000fc
004c43442054560a20202020202000f0

Extracted contents:
header:          00 ff ff ff ff ff ff 00
serial number:   19 c9 00 00 00 00 00 00 00 17
version:         01 03
basic params:    08 00 00 78 0a
chroma info:     2f cd a3 54 45 97 24 11 46 47
established:     21 08 00
standard:        01 01 01 01 01 01 01 01 01 01 01 01 01 01 01 01
descriptor 1:    66 21 50 b0 51 00 1b 30 40 70 36 00 10 09 00 00 00 1e
descriptor 2:    a9 1a 00 a0 50 00 16 30 30 20 37 00 05 03 00 00 00 1a
descriptor 3:    00 00 00 fd 00 17 3f 0f 45 0f 00 0a 20 20 20 20 20 20
descriptor 4:    00 00 00 fc 00 4c 43 44 20 54 56 0a 20 20 20 20 20 20
extensions:      00
checksum:        f0

Manufacturer: FNI Model 0 Serial Number --
Made week 0 of 2013
EDID version: 1.3
Analog display, Input voltage level: 0.7/0.3 V
Sync: Separate 
Image size is variable
Gamma: 2.20
RGB color display
First detailed timing is preferred timing
Established timings supported:
  640x480@60Hz
  800x600@60Hz
  1024x768@60Hz
Standard timings supported:
Detailed mode: Clock 85.500 MHz, 16 mm x 9 mm
               1360 1424 1536 1792 hborder 0
                768  771  777  795 vborder 0
               +hsync +vsync 
Detailed mode: Clock 68.250 MHz, 5 mm x 3 mm
               1280 1328 1360 1440 hborder 0
                768  771  778  790 vborder 0
               +hsync -vsync 
Monitor ranges (GTF): 23-63Hz V, 15-69kHz H, max dotclock 150MHz
Monitor name: LCD
Checksum: 0xf0 (valid)
EDID block does NOT conform to EDID 1.3!
	Detailed block string not properly terminated
