
EDID (hex):
00ffffffffffff0030ae521101010101
321601036c291a78eee5b5a355499927
135054afcf003146714f81c08180818a
81909500950f9a29a0d0518422305098
36009a011100001c000000fc004c3139
3720576964650a202020000000fd0032
4c1e510e000a202020202020000000ff
0043353034393238320a20202020008a

Extracted contents:
header:          00 ff ff ff ff ff ff 00
serial number:   30 ae 52 11 01 01 01 01 32 16
version:         01 03
basic params:    6c 29 1a 78 ee
chroma info:     e5 b5 a3 55 49 99 27 13 50 54
established:     af cf 00
standard:        31 46 71 4f 81 c0 81 80 81 8a 81 90 95 00 95 0f
descriptor 1:    9a 29 a0 d0 51 84 22 30 50 98 36 00 9a 01 11 00 00 1c
descriptor 2:    00 00 00 fc 00 4c 31 39 37 20 57 69 64 65 0a 20 20 20
descriptor 3:    00 00 00 fd 00 32 4c 1e 51 0e 00 0a 20 20 20 20 20 20
descriptor 4:    00 00 00 ff 00 43 35 30 34 39 32 38 32 0a 20 20 20 20
extensions:      00
checksum:        8a

EDID version: 1.3
Manufacturer: LEN Model 1152 Serial Number --
Made in week 50 of 2012
Analog display, Input voltage level: 0.7/0.7 V
Sync: Separate Composite 
Maximum image size: 41 cm x 26 cm
Gamma: 2.20
DPMS levels: Standby Suspend Off
RGB color display
Default (sRGB) color space is primary color space
First detailed timing is preferred timing
Display x,y Chromaticity:
  Red:   0.6396, 0.3339
  Green: 0.2861, 0.5986
  Blue:  0.1542, 0.0771
  White: 0.3134, 0.3291
Established timings supported:
  720x400@70Hz 9:5 HorFreq: 31469 Hz Clock: 28.320 MHz
  640x480@60Hz 4:3 HorFreq: 31469 Hz Clock: 25.175 MHz
  640x480@72Hz 4:3 HorFreq: 37900 Hz Clock: 31.500 MHz
  640x480@75Hz 4:3 HorFreq: 37500 Hz Clock: 31.500 MHz
  800x600@56Hz 4:3 HorFreq: 35200 Hz Clock: 36.000 MHz
  800x600@60Hz 4:3 HorFreq: 37900 Hz Clock: 40.000 MHz
  800x600@72Hz 4:3 HorFreq: 48100 Hz Clock: 50.000 MHz
  800x600@75Hz 4:3 HorFreq: 46900 Hz Clock: 49.500 MHz
  1024x768@60Hz 4:3 HorFreq: 48400 Hz Clock: 65.000 MHz
  1024x768@70Hz 4:3 HorFreq: 56500 Hz Clock: 75.000 MHz
  1024x768@75Hz 4:3 HorFreq: 60000 Hz Clock: 78.750 MHz
  1280x1024@75Hz 5:4 HorFreq: 80000 Hz Clock: 135.000 MHz
Standard timings supported:
  640x480@66Hz 4:3
  1152x864@75Hz 4:3 HorFreq: 67500 Hz Clock: 108.000 MHz
  1280x720@60Hz 16:9
  1280x1024@60Hz 5:4 HorFreq: 64000 Hz Clock: 108.000 MHz
  1280x1024@70Hz 5:4
  1280x1024@76Hz 5:4
  1440x900@60Hz 16:10 HorFreq: 55500 Hz Clock: 88.750 MHz
  1440x900@75Hz 16:10 HorFreq: 82300 Hz Clock: 156.000 MHz
Detailed mode: Clock 106.500 MHz, 410 mm x 257 mm
               1440 1520 1672 1904 hborder 0
                900  903  909  934 vborder 0
               -hsync +vsync 
               VertFreq: 59 Hz, HorFreq: 55934 Hz
Monitor name: L197 Wide
Monitor ranges (GTF): 50-76Hz V, 30-81kHz H, max dotclock 140MHz
Serial number: --
Checksum: 0x8a (valid)
EDID block does NOT conform to EDID 1.3!
	sRGB is signaled, but the chromaticities do not match
One or more of the timings is out of range of the Monitor Ranges:
  Vertical Freq: 56 - 76 Hz
  Horizontal Freq: 31469 - 82300 Hz
  Maximum Clock: 156.000 MHz
