
EDID (hex):
00ffffffffffff0006afed6300000000
001b0104952213780259259358599329
26505400000001010101010101010101
010101010101783780b470382e406c30
aa0058c11000001a602c80b470382e40
6c30aa0058c11000001a000000fe0043
56353646804231353648414e00000000
0000410296001000000a010a202000a9

edid-decode (hex):

00 ff ff ff ff ff ff 00 06 af ed 63 00 00 00 00
00 1b 01 04 95 22 13 78 02 59 25 93 58 59 93 29
26 50 54 00 00 00 01 01 01 01 01 01 01 01 01 01
01 01 01 01 01 01 78 37 80 b4 70 38 2e 40 6c 30
aa 00 58 c1 10 00 00 1a 60 2c 80 b4 70 38 2e 40
6c 30 aa 00 58 c1 10 00 00 1a 00 00 00 fe 00 43
56 35 36 46 80 42 31 35 36 48 41 4e 00 00 00 00
00 00 41 02 96 00 10 00 00 0a 01 0a 20 20 00 a9

----------------

Block 0, Base EDID:
  EDID Structure Version & Revision: 1.4
  Vendor & Product Identification:
    Manufacturer: AUO
    Model: 25581
    Made in: 2017
  Basic Display Parameters & Features:
    Digital display
    Bits per primary color channel: 6
    DisplayPort interface
    Maximum image size: 34 cm x 19 cm
    Gamma: 2.20
    Supported color formats: RGB 4:4:4
    First detailed timing includes the native pixel format and preferred refresh rate
  Color Characteristics:
    Red  : 0.5751, 0.3447
    Green: 0.3496, 0.5751
    Blue : 0.1601, 0.1503
    White: 0.3134, 0.3291
  Established Timings I & II: none
  Standard Timings: none
  Detailed Timing Descriptors:
    DTD 1:  1920x1080   60.052440 Hz  16:9     67.619 kHz    142.000000 MHz (344 mm x 193 mm)
                 Hfront  108 Hsync  48 Hback   24 Hpol P
                 Vfront   10 Vsync  10 Vback   26 Vpol N
    DTD 2:  1920x1080   48.041952 Hz  16:9     54.095 kHz    113.600000 MHz (344 mm x 193 mm)
                 Hfront  108 Hsync  48 Hback   24 Hpol P
                 Vfront   10 Vsync  10 Vback   26 Vpol N
    Alphanumeric Data String: 'CV56F'
    Manufacturer-Specified Display Descriptor (0x00): 00 00 00 00 41 02 96 00 10 00 00 0a 01 0a 20 20 '....A.........  '
Checksum: 0xa9
