edid-decode (hex):

00 ff ff ff ff ff ff 00 30 e4 5f 05 00 00 00 00
00 1a 01 04 a5 1f 11 78 02 17 15 a5 56 51 9c 27
0c 50 54 00 00 00 01 01 01 01 01 01 01 01 01 01
01 01 01 01 01 01 e4 5c 00 a0 a0 a0 11 50 30 20
23 00 36 ae 10 00 00 1a 50 4a 00 a0 a0 a0 11 50
30 20 23 00 36 ae 10 00 00 1a 00 00 00 fe 00 4c
47 20 44 69 73 70 6c 61 79 0a 20 20 00 00 00 fe
00 4c 50 31 34 30 51 48 31 2d 53 50 4b 31 00 b1

----------------

Block 0, Base EDID:
  EDID Structure Version & Revision: 1.4
  Vendor & Product Identification:
    Manufacturer: LGD
    Model: 1375
    Made in: 2016
  Basic Display Parameters & Features:
    Digital display
    Bits per primary color channel: 8
    DisplayPort interface
    Maximum image size: 31 cm x 17 cm
    Gamma: 2.20
    Supported color formats: RGB 4:4:4
    First detailed timing includes the native pixel format and preferred refresh rate
  Color Characteristics:
    Red  : 0.6445, 0.3369
    Green: 0.3173, 0.6123
    Blue : 0.1523, 0.0478
    White: 0.3134, 0.3291
  Established Timings I & II: none
  Standard Timings: none
  Detailed Timing Descriptors:
    DTD 1:  2560x1440   60.004 Hz  16:9    87.426 kHz 237.800 MHz (310 mm x 174 mm)
                 Hfront   48 Hsync  32 Hback  80 Hpol P
                 Vfront    2 Vsync   3 Vback  12 Vpol N
    DTD 2:  2560x1440   48.004 Hz  16:9    69.941 kHz 190.240 MHz (310 mm x 174 mm)
                 Hfront   48 Hsync  32 Hback  80 Hpol P
                 Vfront    2 Vsync   3 Vback  12 Vpol N
    Alphanumeric Data String: 'LG Display'
    Alphanumeric Data String: 'LP140QH1-SPK1'
Checksum: 0xb1

----------------

Failures:

Block 0, Base EDID:
  Missing Display Product Name.

EDID conformity: FAIL
