
EDID (hex):
00ffffffffffff000e8f121400000000
001e0104a51e137803ee95a3544c9926
0f505400000001010101010101010101
010101010101743c80a070b028403020
36002dbc1000001a000000fd00303c4a
4a0f010a202020202020000000fe0043
544f0a202020202020202020000000fe
004c454231343230314e0a2020200030

edid-decode (hex):

00 ff ff ff ff ff ff 00 0e 8f 12 14 00 00 00 00
00 1e 01 04 a5 1e 13 78 03 ee 95 a3 54 4c 99 26
0f 50 54 00 00 00 01 01 01 01 01 01 01 01 01 01
01 01 01 01 01 01 74 3c 80 a0 70 b0 28 40 30 20
36 00 2d bc 10 00 00 1a 00 00 00 fd 00 30 3c 4a
4a 0f 01 0a 20 20 20 20 20 20 00 00 00 fe 00 43
54 4f 0a 20 20 20 20 20 20 20 20 20 00 00 00 fe
00 4c 45 42 31 34 32 30 31 4e 0a 20 20 20 00 30

----------------

Block 0, Base EDID:
  EDID Structure Version & Revision: 1.4
  Vendor & Product Identification:
    Manufacturer: CTO
    Model: 5138
    Made in: 2020
  Basic Display Parameters & Features:
    Digital display
    Bits per primary color channel: 8
    DisplayPort interface
    Maximum image size: 30 cm x 19 cm
    Gamma: 2.20
    Supported color formats: RGB 4:4:4
    First detailed timing includes the native pixel format and preferred refresh rate
    Display is continuous frequency
  Color Characteristics:
    Red  : 0.6396, 0.3300
    Green: 0.2998, 0.5996
    Blue : 0.1503, 0.0595
    White: 0.3134, 0.3291
  Established Timings I & II: none
  Standard Timings: none
  Detailed Timing Descriptors:
    DTD 1:  1920x1200   60.003102 Hz  16:10    74.404 kHz    154.760000 MHz (301 mm x 188 mm)
                 Hfront   48 Hsync  32 Hback   80 Hpol P
                 Vfront    3 Vsync   6 Vback   31 Vpol N
    Display Range Limits:
      Monitor ranges (Bare Limits): 48-60 Hz V, 74-74 kHz H, max dotclock 150 MHz
    Alphanumeric Data String: 'CTO'
    Alphanumeric Data String: 'LEB14201N'
Checksum: 0x30
