
EDID (hex):
00ffffffffffff0009e5310900000000
141e0104a51e137806a7e5a3544a9e25
0e505400000001010101010101010101
0101010101010753c0dc807828503020
36002ebd1000001a0000000000000000
00000000000000000000000000fe0042
4f452043510a202020202020000000fe
004e5631343044524d2d4e36310a00a8

Extracted contents:
header:          00 ff ff ff ff ff ff 00
serial number:   09 e5 31 09 00 00 00 00 14 1e
version:         01 04
basic params:    a5 1e 13 78 06
chroma info:     a7 e5 a3 54 4a 9e 25 0e 50 54
established:     00 00 00
standard:        01 01 01 01 01 01 01 01 01 01 01 01 01 01 01 01
descriptor 1:    07 53 c0 dc 80 78 28 50 30 20 36 00 2e bd 10 00 00 1a
descriptor 2:    00 00 00 00 00 00 00 00 00 00 00 00 00 00 00 00 00 00
descriptor 3:    00 00 00 fe 00 42 4f 45 20 43 51 0a 20 20 20 20 20 20
descriptor 4:    00 00 00 fe 00 4e 56 31 34 30 44 52 4d 2d 4e 36 31 0a
extensions:      00
checksum:        a8

EDID version: 1.4
Manufacturer: BOE Model 931 Serial Number --
Made in week 20 of 2020
Digital display
8 bits per primary color channel
DisplayPort interface
Maximum image size: 30 cm x 19 cm
Gamma: 2.20
Supported color formats: RGB 4:4:4
Default (sRGB) color space is primary color space
First detailed timing includes the native pixel format and preferred refresh rate
Display x,y Chromaticity:
  Red:   0.6386, 0.3300
  Green: 0.2900, 0.6201
  Blue:  0.1474, 0.0566
  White: 0.3134, 0.3291
Established timings supported:
Standard timings supported:
Detailed mode: Clock 212.550 MHz, 302 mm x 189 mm
               2240 2288 2320 2460 hborder 0
               1400 1403 1409 1440 vborder 0
               +hsync -vsync 
               VertFreq: 60 Hz, HorFreq: 86402 Hz
Manufacturer-specified data, tag 0
ASCII string: BOE CQ
ASCII string: NV140DRM-N61
Checksum: 0xa8 (valid)
EDID block does NOT conform to EDID 1.4!
	sRGB is signaled, but the chromaticities do not match
	Missing name descriptor
	Missing monitor ranges
