
EDID (hex):
00ffffffffffff0009e5770800000000
191d0104a51f117802fb90955d599429
23505400000001010101010101010101
0101010101013c3780de703814403020
360035ad1000001a0000000000000000
0000000000000000001a000000fe0042
4f452043510a202020202020000000fe
00545631343046484d2d4e48310a00c4

Extracted contents:
header:          00 ff ff ff ff ff ff 00
serial number:   09 e5 77 08 00 00 00 00 19 1d
version:         01 04
basic params:    a5 1f 11 78 02
chroma info:     fb 90 95 5d 59 94 29 23 50 54
established:     00 00 00
standard:        01 01 01 01 01 01 01 01 01 01 01 01 01 01 01 01
descriptor 1:    3c 37 80 de 70 38 14 40 30 20 36 00 35 ad 10 00 00 1a
descriptor 2:    00 00 00 00 00 00 00 00 00 00 00 00 00 00 00 00 00 1a
descriptor 3:    00 00 00 fe 00 42 4f 45 20 43 51 0a 20 20 20 20 20 20
descriptor 4:    00 00 00 fe 00 54 56 31 34 30 46 48 4d 2d 4e 48 31 0a
extensions:      00
checksum:        c4

EDID version: 1.4
Manufacturer: BOE Model 877 Serial Number --
Made in week 25 of 2019
Digital display
8 bits per primary color channel
DisplayPort interface
Maximum image size: 31 cm x 17 cm
Gamma: 2.20
Supported color formats: RGB 4:4:4
First detailed timing includes the native pixel format and preferred refresh rate
Display x,y Chromaticity:
  Red:   0.5849, 0.3662
  Green: 0.3496, 0.5810
  Blue:  0.1621, 0.1376
  White: 0.3125, 0.3281
Established timings supported:
Standard timings supported:
Detailed mode: Clock 141.400 MHz, 309 mm x 173 mm
               1920 1968 2000 2142 hborder 0
               1080 1083 1089 1100 vborder 0
               +hsync -vsync 
               VertFreq: 60 Hz, HorFreq: 66013 Hz
Manufacturer-specified data, tag 0
ASCII string: BOE CQ
ASCII string: TV140FHM-NH1
Checksum: 0xc4 (valid)
EDID block does NOT conform to EDID 1.4!
	Missing name descriptor
	Missing monitor ranges
