
EDID (hex):
00ffffffffffff003669b63d00000000
2a1e0103804f2178aaee95a3544c9926
0f5054a5cb0081809500b300d1c081a8
9528b328d1e8f57c70a0d0a029503020
35001d4d3100001a000000ff00444236
48303730413030373735000000fd0030
641ea022000a202020202020000000fc
004d4147333432435152560a2020016c
020325f349010203049012131f4d2309
07078301000065030c001000681a0000
01013064ed226870a0d0a02950302035
001d4d3100001e4241b8a060a0295030
2035001d4d3100001e565e00a0a0a029
50302035001d4d3100001a0000000000
00000000000000000000000000000000
0000000000000000000000000000008e

Extracted contents:
header:          00 ff ff ff ff ff ff 00
serial number:   36 69 b6 3d 00 00 00 00 2a 1e
version:         01 03
basic params:    80 4f 21 78 aa
chroma info:     ee 95 a3 54 4c 99 26 0f 50 54
established:     a5 cb 00
standard:        81 80 95 00 b3 00 d1 c0 81 a8 95 28 b3 28 d1 e8
descriptor 1:    f5 7c 70 a0 d0 a0 29 50 30 20 35 00 1d 4d 31 00 00 1a
descriptor 2:    00 00 00 ff 00 44 42 36 48 30 37 30 41 30 30 37 37 35
descriptor 3:    00 00 00 fd 00 30 64 1e a0 22 00 0a 20 20 20 20 20 20
descriptor 4:    00 00 00 fc 00 4d 41 47 33 34 32 43 51 52 56 0a 20 20
extensions:      01
checksum:        6c

EDID version: 1.3
Manufacturer: MSI Model 3db6 Serial Number --
Made in week 42 of 2020
Digital display
Maximum image size: 79 cm x 33 cm
Gamma: 2.20
DPMS levels: Standby Off
RGB color display
First detailed timing is preferred timing
Display x,y Chromaticity:
  Red:   0.6396, 0.3300
  Green: 0.2998, 0.5996
  Blue:  0.1503, 0.0595
  White: 0.3134, 0.3291
Established timings supported:
  720x400@70Hz 9:5 HorFreq: 31469 Hz Clock: 28.320 MHz
  640x480@60Hz 4:3 HorFreq: 31469 Hz Clock: 25.175 MHz
  640x480@75Hz 4:3 HorFreq: 37500 Hz Clock: 31.500 MHz
  800x600@60Hz 4:3 HorFreq: 37900 Hz Clock: 40.000 MHz
  800x600@72Hz 4:3 HorFreq: 48100 Hz Clock: 50.000 MHz
  800x600@75Hz 4:3 HorFreq: 46900 Hz Clock: 49.500 MHz
  1024x768@60Hz 4:3 HorFreq: 48400 Hz Clock: 65.000 MHz
  1024x768@75Hz 4:3 HorFreq: 60000 Hz Clock: 78.750 MHz
  1280x1024@75Hz 5:4 HorFreq: 80000 Hz Clock: 135.000 MHz
Standard timings supported:
  1280x1024@60Hz 5:4 HorFreq: 64000 Hz Clock: 108.000 MHz
  1440x900@60Hz 16:10 HorFreq: 55500 Hz Clock: 88.750 MHz
  1680x1050@60Hz 16:10 HorFreq: 64700 Hz Clock: 119.000 MHz
  1920x1080@60Hz 16:9
  1280x1024@100Hz 5:4
  1440x900@100Hz 16:10
  1680x1050@100Hz 16:10
  1920x1080@100Hz 16:9
Detailed mode: Clock 319.890 MHz, 797 mm x 333 mm
               3440 3488 3520 3600 hborder 0
               1440 1443 1448 1481 vborder 0
               +hsync -vsync 
               VertFreq: 59 Hz, HorFreq: 88858 Hz
Serial number: --
Monitor ranges (GTF): 48-100Hz V, 30-160kHz H, max dotclock 340MHz
Monitor name: MAG342CQRV
Has 1 extension blocks
Checksum: 0x6c (valid)

CTA extension block
Extension version: 3
33 bytes of CTA data
  Video data block
    VIC   1 640x480@60Hz 4:3  HorFreq: 31469 Hz Clock: 25.175 MHz
    VIC   2 720x480@60Hz 4:3  HorFreq: 31469 Hz Clock: 27.000 MHz
    VIC   3 720x480@60Hz 16:9  HorFreq: 31469 Hz Clock: 27.000 MHz
    VIC   4 1280x720@60Hz 16:9  HorFreq: 45000 Hz Clock: 74.250 MHz
    VIC  16 1920x1080@60Hz 16:9 (native) HorFreq: 67500 Hz Clock: 148.500 MHz
    VIC  18 720x576@50Hz 16:9  HorFreq: 31250 Hz Clock: 27.000 MHz
    VIC  19 1280x720@50Hz 16:9  HorFreq: 37500 Hz Clock: 74.250 MHz
    VIC  31 1920x1080@50Hz 16:9  HorFreq: 56250 Hz Clock: 148.500 MHz
    VIC  77 1920x1080@100Hz 64:27  HorFreq: 112500 Hz Clock: 297.000 MHz
  Audio data block
    Linear PCM, max channels 2
      Supported sample rates (kHz): 48 44.1 32
      Supported sample sizes (bits): 24 20 16
  Speaker allocation data block
    Speaker map:
      FL/FR - Front Left/Right
  Vendor-specific data block, OUI 000c03 (HDMI)
    Source physical address 1.0.0.0
  Vendor-specific data block, OUI 00001a
Underscans PC formats by default
Basic audio support
Supports YCbCr 4:4:4
Supports YCbCr 4:2:2
3 native detailed modes
Detailed mode: Clock 266.580 MHz, 797 mm x 333 mm
               3440 3488 3520 3600 hborder 0
               1440 1443 1448 1481 vborder 0
               +hsync +vsync 
               VertFreq: 50 Hz, HorFreq: 74050 Hz
Detailed mode: Clock 167.060 MHz, 797 mm x 333 mm
               1720 1768 1800 1880 hborder 0
               1440 1443 1448 1481 vborder 0
               +hsync +vsync 
               VertFreq: 60 Hz, HorFreq: 88861 Hz
Detailed mode: Clock 241.500 MHz, 797 mm x 333 mm
               2560 2608 2640 2720 hborder 0
               1440 1443 1448 1481 vborder 0
               +hsync -vsync 
               VertFreq: 59 Hz, HorFreq: 88786 Hz
Checksum: 0x8e (valid)
