
EDID (hex):
00ffffffffffff0022648305909f0000
19130103801f11780af76f9f56579c26
11505300000001010101010101010101
0101010101014c1d56ba500026303042
680035ae10000019000000fe00000000
00000000000000000000000000fc0048
5344313430504857310a202000000010
000a20202020202020202020202000b8

edid-decode (hex):

00 ff ff ff ff ff ff 00 22 64 83 05 90 9f 00 00
19 13 01 03 80 1f 11 78 0a f7 6f 9f 56 57 9c 26
11 50 53 00 00 00 01 01 01 01 01 01 01 01 01 01
01 01 01 01 01 01 4c 1d 56 ba 50 00 26 30 30 42
68 00 35 ae 10 00 00 19 00 00 00 fe 00 00 00 00
00 00 00 00 00 00 00 00 00 00 00 00 00 fc 00 48
53 44 31 34 30 50 48 57 31 0a 20 20 00 00 00 10
00 0a 20 20 20 20 20 20 20 20 20 20 20 20 00 b8

----------------

Block 0, Base EDID:
  EDID Structure Version & Revision: 1.3
  Vendor & Product Identification:
    Manufacturer: HSD
    Model: 1411
    Serial Number: 40848
    Made in: week 25 of 2009
  Basic Display Parameters & Features:
    Digital display
    Maximum image size: 31 cm x 17 cm
    Gamma: 2.20
    RGB color display
    First detailed timing is the preferred timing
  Color Characteristics:
    Red  : 0.6240, 0.3388
    Green: 0.3408, 0.6123
    Blue : 0.1494, 0.0683
    White: 0.3154, 0.3271
  Established Timings I & II: none
  Standard Timings: none
  Detailed Timing Descriptors:
    DTD 1:  1366x768    59.956256 Hz 683:384   48.325 kHz     75.000000 MHz (309 mm x 174 mm)
                 Hfront   48 Hsync  66 Hback   72 Hpol N
                 Vfront    6 Vsync   8 Vback   24 Vpol N
    Alphanumeric Data String: ''
    Display Product Name: 'HSD140PHW1'
    Dummy Descriptor:
Checksum: 0xb8
