edid-decode (hex):

00 ff ff ff ff ff ff 00 30 ae b0 40 00 00 00 00
01 14 01 03 80 22 13 78 ea 94 a1 9e 57 51 98 29
16 50 54 00 00 00 01 01 01 01 01 01 01 01 01 01
01 01 01 01 01 01 41 1c 56 a0 50 00 16 30 30 20
36 00 58 c1 10 00 00 19 8c 17 56 a0 50 00 16 30
30 20 36 00 58 c1 10 00 00 19 00 00 00 0f 00 8c
09 32 8c 09 28 16 09 00 09 e5 96 05 00 00 00 fe
00 48 54 31 35 36 57 58 42 2d 31 30 30 0a 00 30

----------------

Block 0, Base EDID:
  EDID Structure Version & Revision: 1.3
  Vendor & Product Identification:
    Manufacturer: LEN
    Model: 16560
    Made in: week 1 of 2010
  Basic Display Parameters & Features:
    Digital display
    Maximum image size: 34 cm x 19 cm
    Gamma: 2.20
    DPMS levels: Standby Suspend Off
    RGB color display
    First detailed timing is the preferred timing
  Color Characteristics:
    Red  : 0.6191, 0.3408
    Green: 0.3173, 0.5937
    Blue : 0.1621, 0.0878
    White: 0.3125, 0.3291
  Established Timings I & II: none
  Standard Timings: none
  Detailed Timing Descriptors:
    DTD 1:  1366x768    59.998009 Hz 683:384   47.398 kHz     72.330000 MHz (344 mm x 193 mm)
                 Hfront   48 Hsync  32 Hback   80 Hpol N
                 Vfront    3 Vsync   6 Vback   13 Vpol N
    DTD 2:  1366x768    50.002489 Hz 683:384   39.502 kHz     60.280000 MHz (344 mm x 193 mm)
                 Hfront   48 Hsync  32 Hback   80 Hpol N
                 Vfront    3 Vsync   6 Vback   13 Vpol N
    Manufacturer-Specified Display Descriptor (0x0f): 00 0f 00 8c 09 32 8c 09 28 16 09 00 09 e5 96 05 '.....2..(.......'
    Alphanumeric Data String: 'HT156WXB-100'
Checksum: 0x30

----------------

Failures:

Block 0, Base EDID:
  Missing Display Product Name.
  Missing Display Range Limits Descriptor.

EDID conformity: FAIL
