
EDID (hex):
00ffffffffffff0004723106ab205091
0f1d0103804627782a5995af4f42af26
0f5054bfef80714f8140818081c08100
9500b300d1c04dd000a0f0703e803030
3500ba892100001a565e00a0a0a02950
30203500ba892100001e000000fd0028
3c1ea03c000a202020202020000000fc
0041636572204554333232514b0a0158
02034df151010304121305141f100706
025d5e5f606123090707830100006d03
0c002000383c20006001020367d85dc4
01788003681a00000101283cede305e3
01e40f008001e6060701606045023a80
1871382d40582c4500ba892100001e8c
0ad08a20e02d10103e9600ba89210000
1800000000000000000000000000008d

Extracted contents:
header:          00 ff ff ff ff ff ff 00
serial number:   04 72 31 06 ab 20 50 91 0f 1d
version:         01 03
basic params:    80 46 27 78 2a
chroma info:     59 95 af 4f 42 af 26 0f 50 54
established:     bf ef 80
standard:        71 4f 81 40 81 80 81 c0 81 00 95 00 b3 00 d1 c0
descriptor 1:    4d d0 00 a0 f0 70 3e 80 30 30 35 00 ba 89 21 00 00 1a
descriptor 2:    56 5e 00 a0 a0 a0 29 50 30 20 35 00 ba 89 21 00 00 1e
descriptor 3:    00 00 00 fd 00 28 3c 1e a0 3c 00 0a 20 20 20 20 20 20
descriptor 4:    00 00 00 fc 00 41 63 65 72 20 45 54 33 32 32 51 4b 0a
extensions:      01
checksum:        58

Manufacturer: ACR Model 631 Serial Number --
Made week 15 of 2019
EDID version: 1.3
Digital display
Maximum image size: 70 cm x 39 cm
Gamma: 2.20
DPMS levels: Off
Supported color formats: RGB 4:4:4, YCrCb 4:2:2
First detailed timing is preferred timing
Established timings supported:
  720x400@70Hz
  640x480@60Hz
  640x480@67Hz
  640x480@72Hz
  640x480@75Hz
  800x600@56Hz
  800x600@60Hz
  800x600@72Hz
  800x600@75Hz
  832x624@75Hz
  1024x768@60Hz
  1024x768@70Hz
  1024x768@75Hz
  1280x1024@75Hz
  1152x870@75Hz
Standard timings supported:
  1152x864@75Hz
  1280x960@60Hz
  1280x1024@60Hz
  1280x720@60Hz
  1280x800@60Hz
  1440x900@60Hz
  1680x1050@60Hz
  1920x1080@60Hz
Detailed mode: Clock 533.250 MHz, 698 mm x 393 mm
               3840 3888 3936 4000 hborder 0
               2160 2163 2168 2222 vborder 0
               +hsync -vsync 
Detailed mode: Clock 241.500 MHz, 698 mm x 393 mm
               2560 2608 2640 2720 hborder 0
               1440 1443 1448 1481 vborder 0
               +hsync +vsync 
Monitor ranges (GTF): 40-60Hz V, 30-160kHz H, max dotclock 600MHz
Monitor name: Acer
Has 1 extension blocks
Checksum: 0x58 (valid)

CEA extension block
Extension version: 3
73 bytes of CEA data
  Video data block
    VIC 01 640x480@60Hz 
    VIC 03 720x480@60Hz 
    VIC 04 1280x720@60Hz 
    VIC 18 720x576@50Hz 
    VIC 19 1280x720@50Hz 
    VIC 05 1920x1080i@60Hz 
    VIC 20 1920x1080i@50Hz 
    VIC 31 1920x1080@50Hz 
    VIC 16 1920x1080@60Hz 
    VIC 07 1440x480i@60Hz 
    VIC 06 1440x480i@60Hz 
    VIC 02 720x480@60Hz 
    VIC 93 Unknown mode 
    VIC 94 Unknown mode 
    VIC 95 Unknown mode 
    VIC 96 Unknown mode 
    VIC 97 Unknown mode 
  Audio data block
    Linear PCM, max channels 1
    Supported sample rates (kHz): 48 44.1 32
    Supported sample sizes (bits): 24 20 16
  Speaker allocation data block
  Vendor-specific data block, OUI 000c03 (HDMI)
    Source physical address 2.0.0.0
    DC_36bit
    DC_30bit
    DC_Y444
    Maximum TMDS clock: 300MHz
    Extended HDMI video details:
      HDMI VIC 0 3840x2160@30Hz
      HDMI VIC 1 3840x2160@25Hz
      HDMI VIC 2 3840x2160@24Hz
  Vendor-specific data block, OUI c45dd8
  Vendor-specific data block, OUI 00001a
  Extended tag: Colorimetry data block
  Extended tag: Reserved video block (0f)
  Extended tag: Reserved video block (06)
Underscans PC formats by default
Basic audio support
Supports YCbCr 4:4:4
Supports YCbCr 4:2:2
1 native detailed modes
Detailed mode: Clock 148.500 MHz, 698 mm x 393 mm
               1920 2008 2052 2200 hborder 0
               1080 1084 1089 1125 vborder 0
               +hsync +vsync 
Detailed mode: Clock 27.000 MHz, 698 mm x 393 mm
                720  736  798  858 hborder 0
                480  489  495  525 vborder 0
               -hsync -vsync 
Checksum: 0x8d (valid)

EDID block does NOT conform to EDID 1.3!
	Detailed block string not properly terminated
