
EDID (hex):
00ffffffffffff000dae871300000000
161c0104a51d117802ee95a3544c9926
0f505400000001010101010101010101
010101010101b43b804a713834403020
360025a510000018000000fe004e3133
334843452d4550320a20000000fe0043
4d4e0a202020202020202020000000fe
004e3133334843452d4550320a2000ef

edid-decode (hex):

00 ff ff ff ff ff ff 00 0d ae 87 13 00 00 00 00
16 1c 01 04 a5 1d 11 78 02 ee 95 a3 54 4c 99 26
0f 50 54 00 00 00 01 01 01 01 01 01 01 01 01 01
01 01 01 01 01 01 b4 3b 80 4a 71 38 34 40 30 20
36 00 25 a5 10 00 00 18 00 00 00 fe 00 4e 31 33
33 48 43 45 2d 45 50 32 0a 20 00 00 00 fe 00 43
4d 4e 0a 20 20 20 20 20 20 20 20 20 00 00 00 fe
00 4e 31 33 33 48 43 45 2d 45 50 32 0a 20 00 ef

----------------

Block 0, Base EDID:
  EDID Structure Version & Revision: 1.4
  Vendor & Product Identification:
    Manufacturer: CMN
    Model: 4999
    Made in: week 22 of 2018
  Basic Display Parameters & Features:
    Digital display
    Bits per primary color channel: 8
    DisplayPort interface
    Maximum image size: 29 cm x 17 cm
    Gamma: 2.20
    Supported color formats: RGB 4:4:4
    First detailed timing includes the native pixel format and preferred refresh rate
  Color Characteristics:
    Red  : 0.6396, 0.3300
    Green: 0.2998, 0.5996
    Blue : 0.1503, 0.0595
    White: 0.3134, 0.3291
  Established Timings I & II: none
  Standard Timings: none
  Detailed Timing Descriptors:
    DTD 1:  1920x1080   60.007852 Hz  16:9     67.929 kHz    152.840000 MHz (293 mm x 165 mm)
                 Hfront   48 Hsync  32 Hback  250 Hpol N
                 Vfront    3 Vsync   6 Vback   43 Vpol N
    Alphanumeric Data String: 'N133HCE-EP2'
    Alphanumeric Data String: 'CMN'
    Alphanumeric Data String: 'N133HCE-EP2'
Checksum: 0xef
