
EDID (hex):
00ffffffffffff000daee51400000000
041c0104a51f1178020865975b548e27
1e505400000001010101010101010101
010101010101363680a0703820403020
350035ad10000018000000fe004e3134
304847412d4541310a20000000fe0043
4d4e0a202020202020202020000000fe
004e3134304847412d4541310a2000fd

edid-decode (hex):

00 ff ff ff ff ff ff 00 0d ae e5 14 00 00 00 00
04 1c 01 04 a5 1f 11 78 02 08 65 97 5b 54 8e 27
1e 50 54 00 00 00 01 01 01 01 01 01 01 01 01 01
01 01 01 01 01 01 36 36 80 a0 70 38 20 40 30 20
35 00 35 ad 10 00 00 18 00 00 00 fe 00 4e 31 34
30 48 47 41 2d 45 41 31 0a 20 00 00 00 fe 00 43
4d 4e 0a 20 20 20 20 20 20 20 20 20 00 00 00 fe
00 4e 31 34 30 48 47 41 2d 45 41 31 0a 20 00 fd

----------------

Block 0, Base EDID:
  EDID Structure Version & Revision: 1.4
  Vendor & Product Identification:
    Manufacturer: CMN
    Model: 5349
    Made in: week 4 of 2018
  Basic Display Parameters & Features:
    Digital display
    Bits per primary color channel: 8
    DisplayPort interface
    Maximum image size: 31 cm x 17 cm
    Gamma: 2.20
    Supported color formats: RGB 4:4:4
    First detailed timing includes the native pixel format and preferred refresh rate
  Color Characteristics:
    Red  : 0.5898, 0.3554
    Green: 0.3300, 0.5546
    Blue : 0.1533, 0.1191
    White: 0.3134, 0.3291
  Established Timings I & II: none
  Standard Timings: none
  Detailed Timing Descriptors:
    DTD 1:  1920x1080   60.001038 Hz  16:9     66.721 kHz    138.780000 MHz (309 mm x 173 mm)
                 Hfront   48 Hsync  32 Hback   80 Hpol N
                 Vfront    3 Vsync   5 Vback   24 Vpol N
    Alphanumeric Data String: 'N140HGA-EA1'
    Alphanumeric Data String: 'CMN'
    Alphanumeric Data String: 'N140HGA-EA1'
Checksum: 0xfd
