
EDID (hex):
00ffffffffffff0006b3872401010101
2e1f0104a5342078e26db5a7564ea025
0d5054bf6f00714f8180814081c0a940
9500b300d1c0283c80a070b023403020
360006442100001a000000fd00314b1e
5f11000a202020202020000000fc0050
4132343851560a2020202020000000ff
004d424c4d51533034393237320a00f7

Extracted contents:
header:          00 ff ff ff ff ff ff 00
serial number:   06 b3 87 24 01 01 01 01 2e 1f
version:         01 04
basic params:    a5 34 20 78 e2
chroma info:     6d b5 a7 56 4e a0 25 0d 50 54
established:     bf 6f 00
standard:        71 4f 81 80 81 40 81 c0 a9 40 95 00 b3 00 d1 c0
descriptor 1:    28 3c 80 a0 70 b0 23 40 30 20 36 00 06 44 21 00 00 1a
descriptor 2:    00 00 00 fd 00 31 4b 1e 5f 11 00 0a 20 20 20 20 20 20
descriptor 3:    00 00 00 fc 00 50 41 32 34 38 51 56 0a 20 20 20 20 20
descriptor 4:    00 00 00 ff 00 4d 42 4c 4d 51 53 30 34 39 32 37 32 0a
extensions:      00
checksum:        f7

EDID version: 1.4
Manufacturer: AUS Model 2487 Serial Number --
Made in week 46 of 2021
Digital display
8 bits per primary color channel
DisplayPort interface
Maximum image size: 52 cm x 32 cm
Gamma: 2.20
DPMS levels: Standby Suspend Off
Supported color formats: RGB 4:4:4
First detailed timing includes the native pixel format and preferred refresh rate
Display x,y Chromaticity:
  Red:   0.6533, 0.3378
  Green: 0.3076, 0.6259
  Blue:  0.1464, 0.0537
  White: 0.3134, 0.3291
Established timings supported:
  720x400@70Hz 9:5 HorFreq: 31469 Hz Clock: 28.320 MHz
  640x480@60Hz 4:3 HorFreq: 31469 Hz Clock: 25.175 MHz
  640x480@67Hz 4:3 HorFreq: 35000 Hz Clock: 30.240 MHz
  640x480@72Hz 4:3 HorFreq: 37900 Hz Clock: 31.500 MHz
  640x480@75Hz 4:3 HorFreq: 37500 Hz Clock: 31.500 MHz
  800x600@56Hz 4:3 HorFreq: 35200 Hz Clock: 36.000 MHz
  800x600@60Hz 4:3 HorFreq: 37900 Hz Clock: 40.000 MHz
  800x600@75Hz 4:3 HorFreq: 46900 Hz Clock: 49.500 MHz
  832x624@75Hz 4:3 HorFreq: 49726 Hz Clock: 57.284 MHz
  1024x768@60Hz 4:3 HorFreq: 48400 Hz Clock: 65.000 MHz
  1024x768@70Hz 4:3 HorFreq: 56500 Hz Clock: 75.000 MHz
  1024x768@75Hz 4:3 HorFreq: 60000 Hz Clock: 78.750 MHz
  1280x1024@75Hz 5:4 HorFreq: 80000 Hz Clock: 135.000 MHz
Standard timings supported:
  1152x864@75Hz 4:3 HorFreq: 67500 Hz Clock: 108.000 MHz
  1280x1024@60Hz 5:4 HorFreq: 64000 Hz Clock: 108.000 MHz
  1280x960@60Hz 4:3 HorFreq: 60000 Hz Clock: 108.000 MHz
  1280x720@60Hz 16:9
  1600x1200@60Hz 4:3 HorFreq: 75000 Hz Clock: 162.000 MHz
  1440x900@60Hz 16:10 HorFreq: 55500 Hz Clock: 88.750 MHz
  1680x1050@60Hz 16:10 HorFreq: 64700 Hz Clock: 119.000 MHz
  1920x1080@60Hz 16:9
Detailed mode: Clock 154.000 MHz, 518 mm x 324 mm
               1920 1968 2000 2080 hborder 0
               1200 1203 1209 1235 vborder 0
               +hsync -vsync 
               VertFreq: 59 Hz, HorFreq: 74038 Hz
Monitor ranges (GTF): 49-75Hz V, 30-95kHz H, max dotclock 170MHz
Monitor name: PA248QV
Serial number: --
Checksum: 0xf7 (valid)
