
EDID (hex):
00ffffffffffff004d104a1400000000
17190104a51d11780ede50a3544c9926
0f505400000001010101010101010101
010101010101cd9180a0c00834703020
350026a510000018a47480a0c0083470
3020350026a510000018000000fe0052
584e3439144c513133335a3100000000
0002410328001200000b010a20200040

edid-decode (hex):

00 ff ff ff ff ff ff 00 4d 10 4a 14 00 00 00 00
17 19 01 04 a5 1d 11 78 0e de 50 a3 54 4c 99 26
0f 50 54 00 00 00 01 01 01 01 01 01 01 01 01 01
01 01 01 01 01 01 cd 91 80 a0 c0 08 34 70 30 20
35 00 26 a5 10 00 00 18 a4 74 80 a0 c0 08 34 70
30 20 35 00 26 a5 10 00 00 18 00 00 00 fe 00 52
58 4e 34 39 14 4c 51 31 33 33 5a 31 00 00 00 00
00 02 41 03 28 00 12 00 00 0b 01 0a 20 20 00 40

----------------

Block 0, Base EDID:
  EDID Structure Version & Revision: 1.4
  Vendor & Product Identification:
    Manufacturer: SHP
    Model: 5194
    Made in: week 23 of 2015
  Basic Display Parameters & Features:
    Digital display
    Bits per primary color channel: 8
    DisplayPort interface
    Maximum image size: 29 cm x 17 cm
    Gamma: 2.20
    Supported color formats: RGB 4:4:4, YCrCb 4:4:4
    Default (sRGB) color space is primary color space
    First detailed timing includes the native pixel format and preferred refresh rate
  Color Characteristics:
    Red  : 0.6396, 0.3291
    Green: 0.2998, 0.5996
    Blue : 0.1494, 0.0595
    White: 0.3125, 0.3281
  Established Timings I & II: none
  Standard Timings: none
  Detailed Timing Descriptors:
    DTD 1:  3200x1800   59.981809 Hz  16:9    111.086 kHz    373.250000 MHz (294 mm x 165 mm)
                 Hfront   48 Hsync  32 Hback   80 Hpol N
                 Vfront    3 Vsync   5 Vback   44 Vpol N
    DTD 2:  3200x1800   47.985447 Hz  16:9     88.869 kHz    298.600000 MHz (294 mm x 165 mm)
                 Hfront   48 Hsync  32 Hback   80 Hpol N
                 Vfront    3 Vsync   5 Vback   44 Vpol N
    Alphanumeric Data String: 'RXN49'
    Manufacturer-Specified Display Descriptor (0x00): 00 00 00 02 41 03 28 00 12 00 00 0b 01 0a 20 20 '....A.(.......  '
Checksum: 0x40
