
EDID (hex):
00ffffffffffff004d10531400000000
28190104a52313780ede50a3544c9926
0f505400000001010101010101010101
0101010101011a3680a070381f403020
35005ac2100000180000000000000000
00000000000000000000000000fe0031
3230334d824c513135364d3100000000
0002410328001200000a010a20200049

edid-decode (hex):

00 ff ff ff ff ff ff 00 4d 10 53 14 00 00 00 00
28 19 01 04 a5 23 13 78 0e de 50 a3 54 4c 99 26
0f 50 54 00 00 00 01 01 01 01 01 01 01 01 01 01
01 01 01 01 01 01 1a 36 80 a0 70 38 1f 40 30 20
35 00 5a c2 10 00 00 18 00 00 00 00 00 00 00 00
00 00 00 00 00 00 00 00 00 00 00 00 00 fe 00 31
32 30 33 4d 82 4c 51 31 35 36 4d 31 00 00 00 00
00 02 41 03 28 00 12 00 00 0a 01 0a 20 20 00 49

----------------

Block 0, Base EDID:
  EDID Structure Version & Revision: 1.4
  Vendor & Product Identification:
    Manufacturer: SHP
    Model: 5203
    Made in: week 40 of 2015
  Basic Display Parameters & Features:
    Digital display
    Bits per primary color channel: 8
    DisplayPort interface
    Maximum image size: 35 cm x 19 cm
    Gamma: 2.20
    Supported color formats: RGB 4:4:4, YCrCb 4:4:4
    Default (sRGB) color space is primary color space
    First detailed timing includes the native pixel format and preferred refresh rate
  Color Characteristics:
    Red  : 0.6396, 0.3291
    Green: 0.2998, 0.5996
    Blue : 0.1494, 0.0595
    White: 0.3125, 0.3281
  Established Timings I & II: none
  Standard Timings: none
  Detailed Timing Descriptors:
    DTD 1:  1920x1080   59.933878 Hz  16:9     66.587 kHz    138.500000 MHz (346 mm x 194 mm)
                 Hfront   48 Hsync  32 Hback   80 Hpol N
                 Vfront    3 Vsync   5 Vback   23 Vpol N
    Empty Descriptor
    Alphanumeric Data String: '1203M'
    Manufacturer-Specified Display Descriptor (0x00): 00 00 00 02 41 03 28 00 12 00 00 0a 01 0a 20 20 '....A.(.......  '
Checksum: 0x49
