
EDID (hex):
00ffffffffffff0009e5510700000000
011d0104951a0e7802ae95945b579429
1c505400000001010101010101010101
010101010101c61d56e250001e303020
360000901000001ad11756e250001e30
3020360000901000001a000000fe0048
59574834804e54313141313100000000
00004121960010000009010a20200064

edid-decode (hex):

00 ff ff ff ff ff ff 00 09 e5 51 07 00 00 00 00
01 1d 01 04 95 1a 0e 78 02 ae 95 94 5b 57 94 29
1c 50 54 00 00 00 01 01 01 01 01 01 01 01 01 01
01 01 01 01 01 01 c6 1d 56 e2 50 00 1e 30 30 20
36 00 00 90 10 00 00 1a d1 17 56 e2 50 00 1e 30
30 20 36 00 00 90 10 00 00 1a 00 00 00 fe 00 48
59 57 48 34 80 4e 54 31 31 41 31 31 00 00 00 00
00 00 41 21 96 00 10 00 00 09 01 0a 20 20 00 64

----------------

Block 0, Base EDID:
  EDID Structure Version & Revision: 1.4
  Vendor & Product Identification:
    Manufacturer: BOE
    Model: 1873
    Made in: week 1 of 2019
  Basic Display Parameters & Features:
    Digital display
    Bits per primary color channel: 6
    DisplayPort interface
    Maximum image size: 26 cm x 14 cm
    Gamma: 2.20
    Supported color formats: RGB 4:4:4
    First detailed timing includes the native pixel format and preferred refresh rate
  Color Characteristics:
    Red  : 0.5800, 0.3574
    Green: 0.3427, 0.5800
    Blue : 0.1621, 0.1103
    White: 0.3134, 0.3291
  Established Timings I & II: none
  Standard Timings: none
  Detailed Timing Descriptors:
    DTD 1:  1366x768    59.996096 Hz 683:384   47.877 kHz     76.220000 MHz (256 mm x 144 mm)
                 Hfront   48 Hsync  32 Hback  146 Hpol P
                 Vfront    3 Vsync   6 Vback   21 Vpol N
    DTD 2:  1366x768    47.992154 Hz 683:384   38.298 kHz     60.970000 MHz (256 mm x 144 mm)
                 Hfront   48 Hsync  32 Hback  146 Hpol P
                 Vfront    3 Vsync   6 Vback   21 Vpol N
    Alphanumeric Data String: 'HYWH4'
    Manufacturer-Specified Display Descriptor (0x00): 00 00 00 00 41 21 96 00 10 00 00 09 01 0a 20 20 '....A!........  '
Checksum: 0x64
