edid-decode (hex):

00 ff ff ff ff ff ff 00 10 ac 08 94 96 21 21 04
23 1b 01 04 a5 34 1d 78 0a c5 a5 a7 56 52 9e 26
10 50 54 21 08 00 d1 c0 81 c0 81 80 95 00 b3 00
01 01 01 01 01 01 02 3a 80 18 71 38 2d 40 70 38
29 04 0f 28 21 00 00 1e 66 21 50 b0 51 00 1b 30
40 70 36 00 0f 28 21 00 00 1e 00 00 00 fc 00 4f
70 74 69 50 6c 65 78 20 35 34 39 30 00 00 00 fd
00 30 4b 3e 54 12 00 0a 20 20 21 20 20 20 00 de

----------------

Block 0, Base EDID:
  EDID Structure Version & Revision: 1.4
  Vendor & Product Identification:
    Manufacturer: DEL
    Model: 37896
    Serial Number: ...
    Made in: week 35 of 2017
  Basic Display Parameters & Features:
    Digital display
    Bits per primary color channel: 8
    DisplayPort interface
    Maximum image size: 52 cm x 29 cm
    Gamma: 2.20
    Supported color formats: RGB 4:4:4, YCrCb 4:4:4
    First detailed timing includes the native pixel format and preferred refresh rate
  Color Characteristics:
    Red  : 0.6552, 0.3359
    Green: 0.3212, 0.6181
    Blue : 0.1503, 0.0644
    White: 0.3134, 0.3291
  Established Timings I & II:
    DMT 0x04:   640x480    59.940476 Hz   4:3     31.469 kHz     25.175000 MHz
    DMT 0x09:   800x600    60.316541 Hz   4:3     37.879 kHz     40.000000 MHz
    DMT 0x10:  1024x768    60.003840 Hz   4:3     48.363 kHz     65.000000 MHz
  Standard Timings:
    DMT 0x52:  1920x1080   60.000000 Hz  16:9     67.500 kHz    148.500000 MHz
    DMT 0x55:  1280x720    60.000000 Hz  16:9     45.000 kHz     74.250000 MHz
    DMT 0x23:  1280x1024   60.019740 Hz   5:4     63.981 kHz    108.000000 MHz
    DMT 0x2f:  1440x900    59.887445 Hz  16:10    55.935 kHz    106.500000 MHz
    DMT 0x3a:  1680x1050   59.954250 Hz  16:10    65.290 kHz    146.250000 MHz
  Detailed Timing Descriptors:
    DTD 1:  1920x1080   60.000000 Hz  16:9     67.500 kHz    148.500000 MHz (527 mm x 296 mm)
                 Hfront  112 Hsync  56 Hback  112 Hpol P
                 Vfront   18 Vsync   9 Vback   18 Vpol P
    DTD 2:  1360x768    60.015162 Hz  85:48    47.712 kHz     85.500000 MHz (527 mm x 296 mm)
                 Hfront   64 Hsync 112 Hback  256 Hpol P
                 Vfront    3 Vsync   6 Vback   18 Vpol P
    Display Product Name: 'OptiPlex 5490'
    Display Range Limits:
      Monitor ranges (GTF): 48-75 Hz V, 62-84 kHz H, max dotclock 180 MHz
Checksum: 0xde

----------------

Warnings:

Block 0, Base EDID:
  Detailed Timing Descriptor #1: DTD is similar but not identical to VIC 16.
  Display Range Limits: GTF support is deprecated in EDID 1.4.
EDID:
  Base EDID: Some timings are out of range of the Monitor Ranges:
    Horizontal Freq: 31.468 - 67.500 kHz (Monitor: 62.000 - 84.000 kHz)

Failures:

Block 0, Base EDID:
  Display Range Limits: GTF can't be combined with non-continuous frequencies.
  Display Range Limits: Bytes 12-17 must be 0x20.

EDID conformity: FAIL
