
EDID (hex):
00ffffffffffff0025e4450f01010101
170f0102181e17782af5e59f59539224
195054bfee0001010101010101010101
010101010101dc1e0020410020301060
130030e41000001e000000fd00374b1e
3c08000a202020202020000000fe000a
202020202020202020202020000000fc
004c43442d41313533562020200a00ff

edid-decode (hex):

00 ff ff ff ff ff ff 00 25 e4 45 0f 01 01 01 01
17 0f 01 02 18 1e 17 78 2a f5 e5 9f 59 53 92 24
19 50 54 bf ee 00 01 01 01 01 01 01 01 01 01 01
01 01 01 01 01 01 dc 1e 00 20 41 00 20 30 10 60
13 00 30 e4 10 00 00 1e 00 00 00 fd 00 37 4b 1e
3c 08 00 0a 20 20 20 20 20 20 00 00 00 fe 00 0a
20 20 20 20 20 20 20 20 20 20 20 20 00 00 00 fc
00 4c 43 44 2d 41 31 35 33 56 20 20 20 0a 00 ff

----------------

Block 0, Base EDID:
  EDID Structure Version & Revision: 1.2
  Vendor & Product Identification:
    Manufacturer: IOD
    Model: 3909
    Serial Number: 16843009
    Made in: week 23 of 2005
  Basic Display Parameters & Features:
    Analog display
    Signal Level Standard: 0.700 : 0.300 : 1.000 V p-p
    Blank-to-black setup/pedestal
    Sync: Separate
    Maximum image size: 30 cm x 23 cm
    Gamma: 2.20
    DPMS levels: Off
    RGB color display
    First detailed timing is the preferred timing
  Color Characteristics:
    Red  : 0.6240, 0.3505
    Green: 0.3251, 0.5712
    Blue : 0.1435, 0.0996
    White: 0.3134, 0.3291
  Established Timings I & II:
    IBM     :   720x400    70.081663 Hz   9:5     31.467 kHz     28.320000 MHz
    DMT 0x04:   640x480    59.940476 Hz   4:3     31.469 kHz     25.175000 MHz
    Apple   :   640x480    66.666667 Hz   4:3     35.000 kHz     30.240000 MHz
    DMT 0x05:   640x480    72.808802 Hz   4:3     37.861 kHz     31.500000 MHz
    DMT 0x06:   640x480    75.000000 Hz   4:3     37.500 kHz     31.500000 MHz
    DMT 0x08:   800x600    56.250000 Hz   4:3     35.156 kHz     36.000000 MHz
    DMT 0x09:   800x600    60.316541 Hz   4:3     37.879 kHz     40.000000 MHz
    DMT 0x0a:   800x600    72.187572 Hz   4:3     48.077 kHz     50.000000 MHz
    DMT 0x0b:   800x600    75.000000 Hz   4:3     46.875 kHz     49.500000 MHz
    Apple   :   832x624    74.551266 Hz   4:3     49.726 kHz     57.284000 MHz
    DMT 0x10:  1024x768    60.003840 Hz   4:3     48.363 kHz     65.000000 MHz
    DMT 0x11:  1024x768    70.069359 Hz   4:3     56.476 kHz     75.000000 MHz
    DMT 0x12:  1024x768    75.028582 Hz   4:3     60.023 kHz     78.750000 MHz
  Standard Timings: none
  Detailed Timing Descriptors:
    DTD 1:  1024x768    75.266768 Hz   4:3     60.213 kHz     79.000000 MHz (304 mm x 228 mm)
                 Hfront   16 Hsync  96 Hback  176 Hpol P
                 Vfront    1 Vsync   3 Vback   28 Vpol P
    Display Range Limits:
      Monitor ranges (GTF): 55-75 Hz V, 30-60 kHz H, max dotclock 80 MHz
    Alphanumeric Data String: ''
    Display Product Name: 'LCD-A153V   '
Checksum: 0xff
