edid-decode (hex):

00 ff ff ff ff ff ff 00 30 ae 31 40 00 00 00 00
00 11 01 03 80 1e 13 78 ea cd 75 91 55 4f 8b 26
21 50 54 00 00 00 01 01 01 01 01 01 01 01 01 01
01 01 01 01 01 01 fd 1d 00 20 51 20 10 30 34 40
33 00 2f be 10 00 00 19 fe 18 00 20 51 20 10 30
34 40 33 00 2f be 10 00 00 19 00 00 00 0f 00 81
0a 32 81 0a 28 12 01 00 4c a3 57 31 00 00 00 fe
00 4c 54 4e 31 34 31 57 31 2d 4c 30 35 0a 00 4b

----------------

Block 0, Base EDID:
  EDID Structure Version & Revision: 1.3
  Vendor & Product Identification:
    Manufacturer: LEN
    Model: 16433
    Made in: 2007
  Basic Display Parameters & Features:
    Digital display
    Maximum image size: 30 cm x 19 cm
    Gamma: 2.20
    DPMS levels: Standby Suspend Off
    RGB color display
    First detailed timing is the preferred timing
  Color Characteristics:
    Red  : 0.5693, 0.3320
    Green: 0.3115, 0.5439
    Blue : 0.1494, 0.1318
    White: 0.3134, 0.3291
  Established Timings I & II: none
  Standard Timings: none
  Detailed Timing Descriptors:
    DTD 1:  1280x800    60.000563 Hz  16:10    48.960 kHz     76.770000 MHz (303 mm x 190 mm)
                 Hfront   52 Hsync  64 Hback  172 Hpol N
                 Vfront    3 Vsync   3 Vback   10 Vpol N
    DTD 2:  1280x800    50.004377 Hz  16:10    40.804 kHz     63.980000 MHz (303 mm x 190 mm)
                 Hfront   52 Hsync  64 Hback  172 Hpol N
                 Vfront    3 Vsync   3 Vback   10 Vpol N
    Manufacturer-Specified Display Descriptor (0x0f): 00 0f 00 81 0a 32 81 0a 28 12 01 00 4c a3 57 31 '.....2..(...L.W1'
    Alphanumeric Data String: 'LTN141W1-L05'
Checksum: 0x4b

----------------

Failures:

Block 0, Base EDID:
  Missing Display Product Name.
  Missing Display Range Limits Descriptor.

EDID conformity: FAIL
