
EDID (hex):
00ffffffffffff0030ae314000000000
00110103801d12780a2f309758538b29
25505400000001010101010101010101
010101010101bc1b00a0502017303020
36001eb3100000180000000000000000
000000000000000000000000000f0081
0a32810a28190100320c00f5000000fe
004c503133335758312d544c43310078

Extracted contents:
header:          00 ff ff ff ff ff ff 00
serial number:   30 ae 31 40 00 00 00 00 00 11
version:         01 03
basic params:    80 1d 12 78 0a
chroma info:     2f 30 97 58 53 8b 29 25 50 54
established:     00 00 00
standard:        01 01 01 01 01 01 01 01 01 01 01 01 01 01 01 01
descriptor 1:    bc 1b 00 a0 50 20 17 30 30 20 36 00 1e b3 10 00 00 18
descriptor 2:    00 00 00 00 00 00 00 00 00 00 00 00 00 00 00 00 00 00
descriptor 3:    00 00 00 0f 00 81 0a 32 81 0a 28 19 01 00 32 0c 00 f5
descriptor 4:    00 00 00 fe 00 4c 50 31 33 33 57 58 31 2d 54 4c 43 31
extensions:      00
checksum:        78

EDID version: 1.3
Manufacturer: LEN Model 4031 Serial Number --
Made in year 2007
Digital display
Maximum image size: 29 cm x 18 cm
Gamma: 2.20
RGB color display
First detailed timing is preferred timing
Display x,y Chromaticity:
  Red:   0.5898, 0.3457
  Green: 0.3271, 0.5458
  Blue:  0.1601, 0.1474
  White: 0.3125, 0.3281
Established timings supported:
Standard timings supported:
Detailed mode: Clock 71.000 MHz, 286 mm x 179 mm
               1280 1328 1360 1440 hborder 0
                800  803  809  823 vborder 0
               -hsync -vsync 
               VertFreq: 59 Hz, HorFreq: 49305 Hz
Manufacturer-specified data, tag 0
Manufacturer-specified data, tag 15
ASCII string: LP133WX1-TLC1
Checksum: 0x78 (valid)
EDID block does NOT conform to EDID 1.3!
	Missing name descriptor
	Missing monitor ranges
