edid-decode (hex):

00 ff ff ff ff ff ff 00 4e 14 cc 0b 00 00 00 00
18 1d 01 03 80 45 1d 78 2a ee d5 a3 54 4c 99 23
0f 50 54 a5 4b 00 71 4f 81 c0 81 40 81 80 95 00
a9 c0 b3 00 d1 c0 0a 48 00 a0 a0 38 32 40 30 20
35 00 b2 23 21 00 00 1e 00 00 00 fd 00 30 a5 42
f5 3c 00 0a 20 20 20 20 20 20 00 00 00 fc 00 53
63 65 70 74 72 65 20 50 33 30 0a 20 00 00 00 ff
00 30 30 30 30 30 30 30 30 30 30 30 30 30 01 83

02 03 35 f1 4c 01 02 03 04 05 90 11 12 13 14 1f
3f 23 09 07 07 83 01 00 00 6a 03 0c 00 12 00 38
3c 20 00 00 67 d8 5d c4 01 78 80 00 68 1a 00 00
01 01 30 a5 ed 3a c5 00 a0 a0 38 2d 40 30 40 36
00 b2 23 21 00 00 1e 70 8f 00 a0 a0 38 2d 40 30
40 35 00 b2 23 21 00 00 1e 20 ac 00 a0 a0 38 2d
40 30 40 35 00 b2 23 21 00 00 1e 66 21 56 aa 51
00 1e 30 46 8f 33 00 b2 23 21 00 00 1e 00 00 df

----------------

Block 0, Base EDID:
  EDID Structure Version & Revision: 1.3
  Vendor & Product Identification:
    Manufacturer: SPT
    Model: 3020
    Made in: week 24 of 2019
  Basic Display Parameters & Features:
    Digital display
    Maximum image size: 69 cm x 29 cm
    Gamma: 2.20
    DPMS levels: Off
    RGB color display
    First detailed timing is the preferred timing
  Color Characteristics:
    Red  : 0.6396, 0.3300
    Green: 0.2998, 0.5996
    Blue : 0.1396, 0.0595
    White: 0.3134, 0.3291
  Established Timings I & II:
    IBM     :   720x400    70.081663 Hz   9:5     31.467 kHz     28.320000 MHz
    DMT 0x04:   640x480    59.940476 Hz   4:3     31.469 kHz     25.175000 MHz
    DMT 0x06:   640x480    75.000000 Hz   4:3     37.500 kHz     31.500000 MHz
    DMT 0x09:   800x600    60.316541 Hz   4:3     37.879 kHz     40.000000 MHz
    DMT 0x0b:   800x600    75.000000 Hz   4:3     46.875 kHz     49.500000 MHz
    DMT 0x10:  1024x768    60.003840 Hz   4:3     48.363 kHz     65.000000 MHz
    DMT 0x12:  1024x768    75.028582 Hz   4:3     60.023 kHz     78.750000 MHz
    DMT 0x24:  1280x1024   75.024675 Hz   5:4     79.976 kHz    135.000000 MHz
  Standard Timings:
    DMT 0x15:  1152x864    75.000000 Hz   4:3     67.500 kHz    108.000000 MHz
    DMT 0x55:  1280x720    60.000000 Hz  16:9     45.000 kHz     74.250000 MHz
    DMT 0x20:  1280x960    60.000000 Hz   4:3     60.000 kHz    108.000000 MHz
    DMT 0x23:  1280x1024   60.019740 Hz   5:4     63.981 kHz    108.000000 MHz
    DMT 0x2f:  1440x900    59.887445 Hz  16:10    55.935 kHz    106.500000 MHz
    DMT 0x53:  1600x900    60.000000 Hz  16:9     60.000 kHz    108.000000 MHz (RB)
    DMT 0x3a:  1680x1050   59.954250 Hz  16:10    65.290 kHz    146.250000 MHz
    DMT 0x52:  1920x1080   60.000000 Hz  16:9     67.500 kHz    148.500000 MHz
  Detailed Timing Descriptors:
    DTD 1:  2560x1080   60.001301 Hz  64:27    67.801 kHz    184.420000 MHz (690 mm x 291 mm)
                 Hfront   48 Hsync  32 Hback   80 Hpol P
                 Vfront    3 Vsync   5 Vback   42 Vpol P
    Display Range Limits:
      Monitor ranges (GTF): 48-165 Hz V, 66-245 kHz H, max dotclock 600 MHz
    Display Product Name: 'Sceptre P30'
    Display Product Serial Number: ...
  Extension blocks: 1
Checksum: 0x83

----------------

Block 1, CTA-861 Extension Block:
  Revision: 3
  Underscans IT Video Formats by default
  Basic audio support
  Supports YCbCr 4:4:4
  Supports YCbCr 4:2:2
  Native detailed modes: 1
  Video Data Block:
    VIC   1:   640x480    59.940476 Hz   4:3     31.469 kHz     25.175000 MHz
    VIC   2:   720x480    59.940060 Hz   4:3     31.469 kHz     27.000000 MHz
    VIC   3:   720x480    59.940060 Hz  16:9     31.469 kHz     27.000000 MHz
    VIC   4:  1280x720    60.000000 Hz  16:9     45.000 kHz     74.250000 MHz
    VIC   5:  1920x1080i  60.000000 Hz  16:9     33.750 kHz     74.250000 MHz
    VIC  16:  1920x1080   60.000000 Hz  16:9     67.500 kHz    148.500000 MHz (native)
    VIC  17:   720x576    50.000000 Hz   4:3     31.250 kHz     27.000000 MHz
    VIC  18:   720x576    50.000000 Hz  16:9     31.250 kHz     27.000000 MHz
    VIC  19:  1280x720    50.000000 Hz  16:9     37.500 kHz     74.250000 MHz
    VIC  20:  1920x1080i  50.000000 Hz  16:9     28.125 kHz     74.250000 MHz
    VIC  31:  1920x1080   50.000000 Hz  16:9     56.250 kHz    148.500000 MHz
    VIC  63:  1920x1080  120.000000 Hz  16:9    135.000 kHz    297.000000 MHz
  Audio Data Block:
    Linear PCM:
      Max channels: 2
      Supported sample rates (kHz): 48 44.1 32
      Supported sample sizes (bits): 24 20 16
  Speaker Allocation Data Block:
    FL/FR - Front Left/Right
  Vendor-Specific Data Block (HDMI), OUI 00-0C-03:
    Source physical address: 1.2.0.0
    DC_36bit
    DC_30bit
    DC_Y444
    Maximum TMDS clock: 300 MHz
    Extended HDMI video details:
  Vendor-Specific Data Block (HDMI Forum), OUI C4-5D-D8:
    Version: 1
    Maximum TMDS Character Rate: 600 MHz
    SCDC Present
  Vendor-Specific Data Block (AMD), OUI 00-00-1A:
    Version: 1.1
    Minimum Refresh Rate: 48 Hz
    Maximum Refresh Rate: 165 Hz
    Flags 1.x: 0xed (MCCS)
  Detailed Timing Descriptors:
    DTD 2:  2560x1080  165.000000 Hz  64:27   185.625 kHz    504.900000 MHz (690 mm x 291 mm)
                 Hfront   48 Hsync  64 Hback   48 Hpol P
                 Vfront    3 Vsync   6 Vback   36 Vpol P
    DTD 3:  2560x1080  120.000000 Hz  64:27   135.000 kHz    367.200000 MHz (690 mm x 291 mm)
                 Hfront   48 Hsync  64 Hback   48 Hpol P
                 Vfront    3 Vsync   5 Vback   37 Vpol P
    DTD 4:  2560x1080  144.000000 Hz  64:27   162.000 kHz    440.640000 MHz (690 mm x 291 mm)
                 Hfront   48 Hsync  64 Hback   48 Hpol P
                 Vfront    3 Vsync   5 Vback   37 Vpol P
    DTD 5:  1366x768    59.789541 Hz 683:384   47.712 kHz     85.500000 MHz (690 mm x 291 mm)
                 Hfront   70 Hsync 143 Hback  213 Hpol P
                 Vfront    3 Vsync   3 Vback   24 Vpol P
Checksum: 0xdf

----------------

Failures:

Block 1, CTA-861 Extension Block:
  Missing VCDB, needed for Set Selectable RGB Quantization to avoid interop issues.
EDID:
  Base EDID: Some timings are out of range of the Monitor Ranges:
    Horizontal Freq: 28.125 - 185.625 kHz (Monitor: 66.000 - 245.000 kHz)
  CTA-861: Native progressive timings are a mix of several resolutions.

EDID conformity: FAIL
