
EDID (hex):
00ffffffffffff0010ac0f4153513030
251a0104b53d23783a4e65a9554d9c26
105054a54b00714f8180a940d1c00101
010101010101565e00a0a0a029503020
3500615c2100001a000000ff00385233
333932364f303051530a000000fc0044
454c4c205332373138440a20000000fd
00304b1e5819010a202020202020012a
020327f149101f041312110302012309
7f0783010000e200c0e305c000e60605
01626200e200c0023a801871382d4058
2c4500615c2100001e7e3900a080381f
4030203a00615c2100001a011d007251
d01e206e285500615c2100001ebf1600
a08038134030203a00615c2100001a00
000000000000000000000000000000dc

edid-decode (hex):

00 ff ff ff ff ff ff 00 10 ac 0f 41 53 51 30 30
25 1a 01 04 b5 3d 23 78 3a 4e 65 a9 55 4d 9c 26
10 50 54 a5 4b 00 71 4f 81 80 a9 40 d1 c0 01 01
01 01 01 01 01 01 56 5e 00 a0 a0 a0 29 50 30 20
35 00 61 5c 21 00 00 1a 00 00 00 ff 00 38 52 33
33 39 32 36 4f 30 30 51 53 0a 00 00 00 fc 00 44
45 4c 4c 20 53 32 37 31 38 44 0a 20 00 00 00 fd
00 30 4b 1e 58 19 01 0a 20 20 20 20 20 20 01 2a

02 03 27 f1 49 10 1f 04 13 12 11 03 02 01 23 09
7f 07 83 01 00 00 e2 00 c0 e3 05 c0 00 e6 06 05
01 62 62 00 e2 00 c0 02 3a 80 18 71 38 2d 40 58
2c 45 00 61 5c 21 00 00 1e 7e 39 00 a0 80 38 1f
40 30 20 3a 00 61 5c 21 00 00 1a 01 1d 00 72 51
d0 1e 20 6e 28 55 00 61 5c 21 00 00 1e bf 16 00
a0 80 38 13 40 30 20 3a 00 61 5c 21 00 00 1a 00
00 00 00 00 00 00 00 00 00 00 00 00 00 00 00 dc

----------------

Block 0, Base EDID:
  EDID Structure Version & Revision: 1.4
  Vendor & Product Identification:
    Manufacturer: DEL
    Model: 16655
    Serial Number: 808472915
    Made in: week 37 of 2016
  Basic Display Parameters & Features:
    Digital display
    Bits per primary color channel: 10
    DisplayPort interface
    Maximum image size: 61 cm x 35 cm
    Gamma: 2.20
    DPMS levels: Off
    Supported color formats: RGB 4:4:4, YCrCb 4:4:4, YCrCb 4:2:2
    First detailed timing includes the native pixel format and preferred refresh rate
  Color Characteristics:
    Red  : 0.6611, 0.3320
    Green: 0.3037, 0.6113
    Blue : 0.1494, 0.0644
    White: 0.3134, 0.3291
  Established Timings I & II:
    IBM     :   720x400    70.081663 Hz   9:5     31.467 kHz     28.320000 MHz
    DMT 0x04:   640x480    59.940476 Hz   4:3     31.469 kHz     25.175000 MHz
    DMT 0x06:   640x480    75.000000 Hz   4:3     37.500 kHz     31.500000 MHz
    DMT 0x09:   800x600    60.316541 Hz   4:3     37.879 kHz     40.000000 MHz
    DMT 0x0b:   800x600    75.000000 Hz   4:3     46.875 kHz     49.500000 MHz
    DMT 0x10:  1024x768    60.003840 Hz   4:3     48.363 kHz     65.000000 MHz
    DMT 0x12:  1024x768    75.028582 Hz   4:3     60.023 kHz     78.750000 MHz
    DMT 0x24:  1280x1024   75.024675 Hz   5:4     79.976 kHz    135.000000 MHz
  Standard Timings:
    DMT 0x15:  1152x864    75.000000 Hz   4:3     67.500 kHz    108.000000 MHz
    DMT 0x23:  1280x1024   60.019740 Hz   5:4     63.981 kHz    108.000000 MHz
    DMT 0x33:  1600x1200   60.000000 Hz   4:3     75.000 kHz    162.000000 MHz
    DMT 0x52:  1920x1080   60.000000 Hz  16:9     67.500 kHz    148.500000 MHz
  Detailed Timing Descriptors:
    DTD 1:  2560x1440   59.950550 Hz  16:9     88.787 kHz    241.500000 MHz (609 mm x 348 mm)
                 Hfront   48 Hsync  32 Hback   80 Hpol P
                 Vfront    3 Vsync   5 Vback   33 Vpol N
    Display Product Serial Number: '8R33926O00QS'
    Display Product Name: 'DELL S2718D'
    Display Range Limits:
      Monitor ranges (Bare Limits): 48-75 Hz V, 30-88 kHz H, max dotclock 250 MHz
  Extension blocks: 1
Checksum: 0x2a

----------------

Block 1, CTA-861 Extension Block:
  Revision: 3
  Underscans IT Video Formats by default
  Basic audio support
  Supports YCbCr 4:4:4
  Supports YCbCr 4:2:2
  Native detailed modes: 1
  Video Data Block:
    VIC  16:  1920x1080   60.000000 Hz  16:9     67.500 kHz    148.500000 MHz
    VIC  31:  1920x1080   50.000000 Hz  16:9     56.250 kHz    148.500000 MHz
    VIC   4:  1280x720    60.000000 Hz  16:9     45.000 kHz     74.250000 MHz
    VIC  19:  1280x720    50.000000 Hz  16:9     37.500 kHz     74.250000 MHz
    VIC  18:   720x576    50.000000 Hz  16:9     31.250 kHz     27.000000 MHz
    VIC  17:   720x576    50.000000 Hz   4:3     31.250 kHz     27.000000 MHz
    VIC   3:   720x480    59.940060 Hz  16:9     31.469 kHz     27.000000 MHz
    VIC   2:   720x480    59.940060 Hz   4:3     31.469 kHz     27.000000 MHz
    VIC   1:   640x480    59.940476 Hz   4:3     31.469 kHz     25.175000 MHz
  Audio Data Block:
    Linear PCM:
      Max channels: 2
      Supported sample rates (kHz): 192 176.4 96 88.2 48 44.1 32
      Supported sample sizes (bits): 24 20 16
  Speaker Allocation Data Block:
    FL/FR - Front Left/Right
  Video Capability Data Block:
    YCbCr quantization: Selectable (via AVI YQ)
    RGB quantization: Selectable (via AVI Q)
    PT scan behavior: No Data
    IT scan behavior: IT video formats not supported
    CE scan behavior: CE video formats not supported
  Colorimetry Data Block:
    BT2020YCC
    BT2020RGB
  HDR Static Metadata Data Block:
    Electro optical transfer functions:
      Traditional gamma - SDR luminance range
      SMPTE ST2084
    Supported static metadata descriptors:
      Static metadata type 1
    Desired content max luminance: 98 (417.710 cd/m^2)
    Desired content max frame-average luminance: 98 (417.710 cd/m^2)
    Desired content min luminance: 0 (0.000 cd/m^2)
  Video Capability Data Block:
    YCbCr quantization: Selectable (via AVI YQ)
    RGB quantization: Selectable (via AVI Q)
    PT scan behavior: No Data
    IT scan behavior: IT video formats not supported
    CE scan behavior: CE video formats not supported
  Detailed Timing Descriptors:
    DTD 2:  1920x1080   60.000000 Hz  16:9     67.500 kHz    148.500000 MHz (609 mm x 348 mm)
                 Hfront   88 Hsync  44 Hback  148 Hpol P
                 Vfront    4 Vsync   5 Vback   36 Vpol P
    DTD 3:  2048x1080   59.997848 Hz 256:135   66.658 kHz    147.180000 MHz (609 mm x 348 mm)
                 Hfront   48 Hsync  32 Hback   80 Hpol P
                 Vfront    3 Vsync  10 Vback   18 Vpol N
    DTD 4:  1280x720    60.000000 Hz  16:9     45.000 kHz     74.250000 MHz (609 mm x 348 mm)
                 Hfront  110 Hsync  40 Hback  220 Hpol P
                 Vfront    5 Vsync   5 Vback   20 Vpol P
    DTD 5:  2048x1080   23.996617 Hz 256:135   26.372 kHz     58.230000 MHz (609 mm x 348 mm)
                 Hfront   48 Hsync  32 Hback   80 Hpol P
                 Vfront    3 Vsync  10 Vback    6 Vpol N
Checksum: 0xdc  Unused space in Extension Block: 16 bytes


