
EDID (hex):
00ffffffffffff001e6d6e77b5980000
0a1f010380462778ea8cb5af4f43ab26
0e5054210800d1c06140010101010101
010101010101e9e800a0a0a053503020
3500b9882100001a000000fd003c901e
e63c000a202020202020000000fc004c
4720554c545241474541520a000000ff
003131304d584b4431353039330a0107
020349f1230907074d100403011f1312
3f5d5e5f60616d030c001000b83c2000
6001020367d85dc401788003e30f0018
6d1a000002053c9000045a445a44e305
c000e60605015a5a446fc200a0a0a055
5030203500b9882100001a5aa000a0a0
a0465030203a00b9882100001a565e00
a0a0a0295030203500b9882100001af1

Extracted contents:
header:          00 ff ff ff ff ff ff 00
serial number:   1e 6d 6e 77 b5 98 00 00 0a 1f
version:         01 03
basic params:    80 46 27 78 ea
chroma info:     8c b5 af 4f 43 ab 26 0e 50 54
established:     21 08 00
standard:        d1 c0 61 40 01 01 01 01 01 01 01 01 01 01 01 01
descriptor 1:    e9 e8 00 a0 a0 a0 53 50 30 20 35 00 b9 88 21 00 00 1a
descriptor 2:    00 00 00 fd 00 3c 90 1e e6 3c 00 0a 20 20 20 20 20 20
descriptor 3:    00 00 00 fc 00 4c 47 20 55 4c 54 52 41 47 45 41 52 0a
descriptor 4:    00 00 00 ff 00 31 31 30 4d 58 4b 44 31 35 30 39 33 0a
extensions:      01
checksum:        07

EDID version: 1.3
Manufacturer: GSM Model 776e Serial Number --
Made in week 10 of 2021
Digital display
Maximum image size: 70 cm x 39 cm
Gamma: 2.20
DPMS levels: Standby Suspend Off
RGB color display
First detailed timing is preferred timing
Display x,y Chromaticity:
  Red:   0.6855, 0.3085
  Green: 0.2646, 0.6679
  Blue:  0.1503, 0.0576
  White: 0.3134, 0.3291
Established timings supported:
  640x480@60Hz 4:3 HorFreq: 31469 Hz Clock: 25.175 MHz
  800x600@60Hz 4:3 HorFreq: 37900 Hz Clock: 40.000 MHz
  1024x768@60Hz 4:3 HorFreq: 48400 Hz Clock: 65.000 MHz
Standard timings supported:
  1920x1080@60Hz 16:9
  1024x768@60Hz 4:3 HorFreq: 48400 Hz Clock: 65.000 MHz
Detailed mode: Clock 596.250 MHz, 697 mm x 392 mm
               2560 2608 2640 2720 hborder 0
               1440 1443 1448 1523 vborder 0
               +hsync -vsync 
               VertFreq: 143 Hz, HorFreq: 219209 Hz
Monitor ranges (GTF): 60-144Hz V, 30-230kHz H, max dotclock 600MHz
Monitor name: LG ULTRAGEAR
Serial number: --
Has 1 extension blocks
Checksum: 0x7 (valid)

CTA extension block
Extension version: 3
69 bytes of CTA data
  Audio data block
    Linear PCM, max channels 2
      Supported sample rates (kHz): 48 44.1 32
      Supported sample sizes (bits): 24 20 16
  Video data block
    VIC  16 1920x1080@60Hz 16:9  HorFreq: 67500 Hz Clock: 148.500 MHz
    VIC   4 1280x720@60Hz 16:9  HorFreq: 45000 Hz Clock: 74.250 MHz
    VIC   3 720x480@60Hz 16:9  HorFreq: 31469 Hz Clock: 27.000 MHz
    VIC   1 640x480@60Hz 4:3  HorFreq: 31469 Hz Clock: 25.175 MHz
    VIC  31 1920x1080@50Hz 16:9  HorFreq: 56250 Hz Clock: 148.500 MHz
    VIC  19 1280x720@50Hz 16:9  HorFreq: 37500 Hz Clock: 74.250 MHz
    VIC  18 720x576@50Hz 16:9  HorFreq: 31250 Hz Clock: 27.000 MHz
    VIC  63 1920x1080@120Hz 16:9  HorFreq: 135000 Hz Clock: 297.000 MHz
    VIC  93 3840x2160@24Hz 16:9  HorFreq: 54000 Hz Clock: 297.000 MHz
    VIC  94 3840x2160@25Hz 16:9  HorFreq: 56250 Hz Clock: 297.000 MHz
    VIC  95 3840x2160@30Hz 16:9  HorFreq: 67500 Hz Clock: 297.000 MHz
    VIC  96 3840x2160@50Hz 16:9  HorFreq: 112500 Hz Clock: 594.000 MHz
    VIC  97 3840x2160@60Hz 16:9  HorFreq: 135000 Hz Clock: 594.000 MHz
  Vendor-specific data block, OUI 000c03 (HDMI)
    Source physical address 1.0.0.0
    Supports_AI
    DC_36bit
    DC_30bit
    DC_Y444
    Maximum TMDS clock: 300MHz
    Extended HDMI video details:
      HDMI VIC 1 3840x2160@30Hz 16:9 HorFreq: 67500 Hz Clock: 297.000 MHz
      HDMI VIC 2 3840x2160@25Hz 16:9 HorFreq: 56250 Hz Clock: 297.000 MHz
      HDMI VIC 3 3840x2160@24Hz 16:9 HorFreq: 54000 Hz Clock: 297.000 MHz
  Vendor-specific data block, OUI c45dd8 (HDMI Forum)
    Version: 1
    Maximum TMDS Character Rate: 600MHz
    SCDC Present
    Supports 12-bits/component Deep Color 4:2:0 Pixel Encoding
    Supports 10-bits/component Deep Color 4:2:0 Pixel Encoding
  Extended tag: YCbCr 4:2:0 capability map data block
    VSD Index 11
    VSD Index 12
  Vendor-specific data block, OUI 00001a
  Extended tag: Colorimetry data block
    BT2020YCC
    BT2020RGB
  Extended tag: HDR static metadata data block
    Electro optical transfer functions:
      Traditional gamma - SDR luminance range
      SMPTE ST2084
    Supported static metadata descriptors:
      Static metadata type 1
    Desired content max luminance: 90 (351.250 cd/m^2)
    Desired content max frame-average luminance: 90 (351.250 cd/m^2)
    Desired content min luminance: 68 (0.250 cd/m^2)
Underscans PC formats by default
Basic audio support
Supports YCbCr 4:4:4
Supports YCbCr 4:2:2
1 native detailed modes
Detailed mode: Clock 497.750 MHz, 697 mm x 392 mm
               2560 2608 2640 2720 hborder 0
               1440 1443 1448 1525 vborder 0
               +hsync -vsync 
               VertFreq: 119 Hz, HorFreq: 182996 Hz
Detailed mode: Clock 410.500 MHz, 697 mm x 392 mm
               2560 2608 2640 2720 hborder 0
               1440 1443 1453 1510 vborder 0
               +hsync -vsync 
               VertFreq: 99 Hz, HorFreq: 150919 Hz
Checksum: 0xf1 (valid)

One or more of the timings is out of range of the Monitor Ranges:
  Vertical Freq: 24 - 143 Hz
  Horizontal Freq: 31250 - 219209 Hz
  Maximum Clock: 596.250 MHz
EDID block does not conform at all!
	Both the serial number and the serial string are set
