
EDID (hex):
00ffffffffffff0015c35126edb57601
0a1b0104a5303078e2f915a354509e27
125054a10800d100d1c0a940a9c08180
814081c00101316080a0708037703020
3a00dcdc1100001a5d2f80a070801b70
30203a00dcdc1100001a000000fd001d
3d1f7c1c000a202020202020000000fc
00455632373330510a20202020200163
020312c045100403020123091f078301
00001f6a00a0800017803008a300dcdc
1100001e000000000000000000000000
00000000000000000000000000000000
00000000000000000000000000000000
00000000000000000000000000000000
00000000000000000000000000000000
000000000000000000000000000000f2

Extracted contents:
header:          00 ff ff ff ff ff ff 00
serial number:   15 c3 51 26 ed b5 76 01 0a 1b
version:         01 04
basic params:    a5 30 30 78 e2
chroma info:     f9 15 a3 54 50 9e 27 12 50 54
established:     a1 08 00
standard:        d1 00 d1 c0 a9 40 a9 c0 81 80 81 40 81 c0 01 01
descriptor 1:    31 60 80 a0 70 80 37 70 30 20 3a 00 dc dc 11 00 00 1a
descriptor 2:    5d 2f 80 a0 70 80 1b 70 30 20 3a 00 dc dc 11 00 00 1a
descriptor 3:    00 00 00 fd 00 1d 3d 1f 7c 1c 00 0a 20 20 20 20 20 20
descriptor 4:    00 00 00 fc 00 45 56 32 37 33 30 51 0a 20 20 20 20 20
extensions:      01
checksum:        63

EDID version: 1.4
Manufacturer: ENC Model 2651 Serial Number --
Made in week 10 of 2017
Digital display
8 bits per primary color channel
DisplayPort interface
Maximum image size: 48 cm x 48 cm
Gamma: 2.20
DPMS levels: Standby Suspend Off
Supported color formats: RGB 4:4:4
First detailed timing includes the native pixel format and preferred refresh rate
Display x,y Chromaticity:
  Red:   0.6396, 0.3310
  Green: 0.3144, 0.6181
  Blue:  0.1523, 0.0712
  White: 0.3134, 0.3291
Established timings supported:
  720x400@70Hz 9:5 HorFreq: 31469 Hz Clock: 28.320 MHz
  640x480@60Hz 4:3 HorFreq: 31469 Hz Clock: 25.175 MHz
  800x600@60Hz 4:3 HorFreq: 37900 Hz Clock: 40.000 MHz
  1024x768@60Hz 4:3 HorFreq: 48400 Hz Clock: 65.000 MHz
Standard timings supported:
  1920x1200@60Hz 16:10 HorFreq: 74000 Hz Clock: 154.000 MHz
  1920x1080@60Hz 16:9
  1600x1200@60Hz 4:3 HorFreq: 75000 Hz Clock: 162.000 MHz
  1600x900@60Hz 16:9
  1280x1024@60Hz 5:4 HorFreq: 64000 Hz Clock: 108.000 MHz
  1280x960@60Hz 4:3 HorFreq: 60000 Hz Clock: 108.000 MHz
  1280x720@60Hz 16:9
Detailed mode: Clock 246.250 MHz, 476 mm x 476 mm
               1920 1968 2000 2080 hborder 0
               1920 1923 1933 1975 vborder 0
               +hsync -vsync 
               VertFreq: 59 Hz, HorFreq: 118389 Hz
Detailed mode: Clock 121.250 MHz, 476 mm x 476 mm
               1920 1968 2000 2080 hborder 0
               1920 1923 1933 1947 vborder 0
               +hsync -vsync 
               VertFreq: 29 Hz, HorFreq: 58293 Hz
Monitor ranges (GTF): 29-61Hz V, 31-124kHz H, max dotclock 280MHz
Monitor name: EV2730Q
Has 1 extension blocks
Checksum: 0x63 (valid)

CTA extension block
Extension version: 3
14 bytes of CTA data
  Video data block
    VIC  16 1920x1080@60Hz 16:9  HorFreq: 67500 Hz Clock: 148.500 MHz
    VIC   4 1280x720@60Hz 16:9  HorFreq: 45000 Hz Clock: 74.250 MHz
    VIC   3 720x480@60Hz 16:9  HorFreq: 31469 Hz Clock: 27.000 MHz
    VIC   2 720x480@60Hz 4:3  HorFreq: 31469 Hz Clock: 27.000 MHz
    VIC   1 640x480@60Hz 4:3  HorFreq: 31469 Hz Clock: 25.175 MHz
  Audio data block
    Linear PCM, max channels 2
      Supported sample rates (kHz): 96 88.2 48 44.1 32
      Supported sample sizes (bits): 24 20 16
  Speaker allocation data block
    Speaker map:
      FL/FR - Front Left/Right
Underscans PC formats by default
Basic audio support
0 native detailed modes
Detailed mode: Clock 271.670 MHz, 476 mm x 476 mm
               2048 2096 2104 2208 hborder 0
               2048 2058 2061 2071 vborder 0
               +hsync +vsync 
               VertFreq: 59 Hz, HorFreq: 123038 Hz
Checksum: 0xf2 (valid)

Warning: One or more of the timings is out of range of the Monitor Ranges:
  Vertical Freq: 29 - 70 Hz
  Horizontal Freq: 31469 - 123038 Hz
  Maximum Clock: 271.670 MHz


