
EDID (hex):
00ffffffffffff000dae321100000000
0e180104951a0e780214359255539529
24505400000001010101010101010101
010101010101da1d56e250002030881e
8c0000901000001ae21756e250002030
881e8c0000901000001a000000fe0054
43503447803131364247450a00000000
00004131960010000009010a20200059

edid-decode (hex):

00 ff ff ff ff ff ff 00 0d ae 32 11 00 00 00 00
0e 18 01 04 95 1a 0e 78 02 14 35 92 55 53 95 29
24 50 54 00 00 00 01 01 01 01 01 01 01 01 01 01
01 01 01 01 01 01 da 1d 56 e2 50 00 20 30 88 1e
8c 00 00 90 10 00 00 1a e2 17 56 e2 50 00 20 30
88 1e 8c 00 00 90 10 00 00 1a 00 00 00 fe 00 54
43 50 34 47 80 31 31 36 42 47 45 0a 00 00 00 00
00 00 41 31 96 00 10 00 00 09 01 0a 20 20 00 59

----------------

Block 0, Base EDID:
  EDID Structure Version & Revision: 1.4
  Vendor & Product Identification:
    Manufacturer: CMN
    Model: 4402
    Made in: week 14 of 2014
  Basic Display Parameters & Features:
    Digital display
    Bits per primary color channel: 6
    DisplayPort interface
    Maximum image size: 26 cm x 14 cm
    Gamma: 2.20
    Supported color formats: RGB 4:4:4
    First detailed timing includes the native pixel format and preferred refresh rate
  Color Characteristics:
    Red  : 0.5703, 0.3330
    Green: 0.3251, 0.5820
    Blue : 0.1601, 0.1435
    White: 0.3134, 0.3291
  Established Timings I & II: none
  Standard Timings: none
  Detailed Timing Descriptors:
    DTD 1:  1366x768    60.003141 Hz 683:384   48.003 kHz     76.420000 MHz (256 mm x 144 mm)
                 Hfront  136 Hsync  30 Hback   60 Hpol P
                 Vfront    8 Vsync  12 Vback   12 Vpol N
    DTD 2:  1366x768    48.005653 Hz 683:384   38.405 kHz     61.140000 MHz (256 mm x 144 mm)
                 Hfront  136 Hsync  30 Hback   60 Hpol P
                 Vfront    8 Vsync  12 Vback   12 Vpol N
    Alphanumeric Data String: 'TCP4G'
    Manufacturer-Specified Display Descriptor (0x00): 00 00 00 00 41 31 96 00 10 00 00 09 01 0a 20 20 '....A1........  '
Checksum: 0x59
