
EDID (hex):
00ffffffffffff0009e5d90600000000
011a0104951c107802d4e09759569129
1f505400000001010101010101010101
010101010101641b5677500013303020
4400159c1000001a0000000000000000
00000000000000000000000000fe0042
4f452048460a202020202020000000fe
004e5431323557484d2d4e34330a00ad

edid-decode (hex):

00 ff ff ff ff ff ff 00 09 e5 d9 06 00 00 00 00
01 1a 01 04 95 1c 10 78 02 d4 e0 97 59 56 91 29
1f 50 54 00 00 00 01 01 01 01 01 01 01 01 01 01
01 01 01 01 01 01 64 1b 56 77 50 00 13 30 30 20
44 00 15 9c 10 00 00 1a 00 00 00 00 00 00 00 00
00 00 00 00 00 00 00 00 00 00 00 00 00 fe 00 42
4f 45 20 48 46 0a 20 20 20 20 20 20 00 00 00 fe
00 4e 54 31 32 35 57 48 4d 2d 4e 34 33 0a 00 ad

----------------

Block 0, Base EDID:
  EDID Structure Version & Revision: 1.4
  Vendor & Product Identification:
    Manufacturer: BOE
    Model: 1753
    Made in: week 1 of 2016
  Basic Display Parameters & Features:
    Digital display
    Bits per primary color channel: 6
    DisplayPort interface
    Maximum image size: 28 cm x 16 cm
    Gamma: 2.20
    Supported color formats: RGB 4:4:4
    First detailed timing includes the native pixel format and preferred refresh rate
  Color Characteristics:
    Red  : 0.5927, 0.3486
    Green: 0.3369, 0.5664
    Blue : 0.1630, 0.1230
    White: 0.3125, 0.3281
  Established Timings I & II: none
  Standard Timings: none
  Detailed Timing Descriptors:
    DTD 1:  1366x768    59.998545 Hz 683:384   47.219 kHz     70.120000 MHz (277 mm x 156 mm)
                 Hfront   48 Hsync  32 Hback   39 Hpol P
                 Vfront    4 Vsync   4 Vback   11 Vpol N
    Empty Descriptor
    Alphanumeric Data String: 'BOE HF'
    Alphanumeric Data String: 'NT125WHM-N43'
Checksum: 0xad
