
EDID (hex):
00ffffffffffff0006101f92750afe02
1f0e010380311f782ecfb5a355499925
105054000000d1000101010101010101
010101010101253c80a070b023403020
3600ef361100001a000000fc0043696e
656d6120484420446973000000fc0070
6c61790a000000000000000000000000
00000000000000000000000000000137

edid-decode (hex):

00 ff ff ff ff ff ff 00 06 10 1f 92 75 0a fe 02
1f 0e 01 03 80 31 1f 78 2e cf b5 a3 55 49 99 25
10 50 54 00 00 00 d1 00 01 01 01 01 01 01 01 01
01 01 01 01 01 01 25 3c 80 a0 70 b0 23 40 30 20
36 00 ef 36 11 00 00 1a 00 00 00 fc 00 43 69 6e
65 6d 61 20 48 44 20 44 69 73 00 00 00 fc 00 70
6c 61 79 0a 00 00 00 00 00 00 00 00 00 00 00 00
00 00 00 00 00 00 00 00 00 00 00 00 00 00 01 37

----------------

Block 0, Base EDID:
  EDID Structure Version & Revision: 1.3
  Vendor & Product Identification:
    Manufacturer: APP
    Model: 37407
    Serial Number: 50203253
    Made in: week 31 of 2004
  Basic Display Parameters & Features:
    Digital display
    Maximum image size: 49 cm x 31 cm
    Gamma: 2.20
    DPMS levels: Off
    RGB color display
    Default (sRGB) color space is primary color space
    First detailed timing is the preferred timing
  Color Characteristics:
    Red  : 0.6396, 0.3320
    Green: 0.2880, 0.6005
    Blue : 0.1464, 0.0654
    White: 0.3134, 0.3291
  Established Timings I & II: none
  Standard Timings:
    DMT 0x45:  1920x1200   59.884600 Hz  16:10    74.556 kHz    193.250000 MHz
  Detailed Timing Descriptors:
    DTD 1:  1920x1200   59.938493 Hz  16:10    74.024 kHz    153.970000 MHz (495 mm x 310 mm)
                 Hfront   48 Hsync  32 Hback   80 Hpol P
                 Vfront    3 Vsync   6 Vback   26 Vpol N
    Display Product Name: 'Cinema HD Dis'
    Display Product Name: 'play'
    Empty Descriptor
  Extension blocks: 1
Checksum: 0x37
