
EDID (hex):
00ffffffffffff0022f08b1001000000
1517010380301b780aa6a0a656519c26
10505400000001010101010101010101
01010101010119388000713814406040
8400dd0c11000018000000fe00563037
0a202020202020202020000000fc0048
5051203630302041494f0a20000000fe
004c4d3231355746332d534c4b3100d4

edid-decode (hex):

00 ff ff ff ff ff ff 00 22 f0 8b 10 01 00 00 00
15 17 01 03 80 30 1b 78 0a a6 a0 a6 56 51 9c 26
10 50 54 00 00 00 01 01 01 01 01 01 01 01 01 01
01 01 01 01 01 01 19 38 80 00 71 38 14 40 60 40
84 00 dd 0c 11 00 00 18 00 00 00 fe 00 56 30 37
0a 20 20 20 20 20 20 20 20 20 00 00 00 fc 00 48
50 51 20 36 30 30 20 41 49 4f 0a 20 00 00 00 fe
00 4c 4d 32 31 35 57 46 33 2d 53 4c 4b 31 00 d4

----------------

Block 0, Base EDID:
  EDID Structure Version & Revision: 1.3
  Vendor & Product Identification:
    Manufacturer: HWP
    Model: 4235
    Serial Number: 1
    Made in: week 21 of 2013
  Basic Display Parameters & Features:
    Digital display
    Maximum image size: 48 cm x 27 cm
    Gamma: 2.20
    RGB color display
    First detailed timing is the preferred timing
  Color Characteristics:
    Red  : 0.6503, 0.3378
    Green: 0.3173, 0.6113
    Blue : 0.1503, 0.0644
    White: 0.3125, 0.3281
  Established Timings I & II: none
  Standard Timings: none
  Detailed Timing Descriptors:
    DTD 1:  1920x1080   59.997493 Hz  16:9     65.997 kHz    143.610000 MHz (477 mm x 268 mm)
                 Hfront   96 Hsync  64 Hback   96 Hpol N
                 Vfront    8 Vsync   4 Vback    8 Vpol N
    Alphanumeric Data String: 'V07'
    Display Product Name: 'HPQ 600 AIO'
    Alphanumeric Data String: 'LM215WF3-SLK1'
Checksum: 0xd4
