
EDID (hex):
00ffffffffffff000daea31400000000
1f160104951f117802b5359455539329
23505400000001010101010101010101
0101010101011c2a405461841a303020
350035ae1000001a131c405461841a30
3020350035ae1000001a000000000000
00000000000000000000000000000002
000c3dff0c3c7d1511237d000000006e

edid-decode (hex):

00 ff ff ff ff ff ff 00 0d ae a3 14 00 00 00 00
1f 16 01 04 95 1f 11 78 02 b5 35 94 55 53 93 29
23 50 54 00 00 00 01 01 01 01 01 01 01 01 01 01
01 01 01 01 01 01 1c 2a 40 54 61 84 1a 30 30 20
35 00 35 ae 10 00 00 1a 13 1c 40 54 61 84 1a 30
30 20 35 00 35 ae 10 00 00 1a 00 00 00 00 00 00
00 00 00 00 00 00 00 00 00 00 00 00 00 00 00 02
00 0c 3d ff 0c 3c 7d 15 11 23 7d 00 00 00 00 6e

----------------

Block 0, Base EDID:
  EDID Structure Version & Revision: 1.4
  Vendor & Product Identification:
    Manufacturer: CMN
    Model: 5283
    Made in: week 31 of 2012
  Basic Display Parameters & Features:
    Digital display
    Bits per primary color channel: 6
    DisplayPort interface
    Maximum image size: 31 cm x 17 cm
    Gamma: 2.20
    Supported color formats: RGB 4:4:4
    First detailed timing includes the native pixel format and preferred refresh rate
  Color Characteristics:
    Red  : 0.5800, 0.3349
    Green: 0.3251, 0.5751
    Blue : 0.1601, 0.1396
    White: 0.3134, 0.3291
  Established Timings I & II: none
  Standard Timings: none
  Detailed Timing Descriptors:
    DTD 1:  1600x900    60.007571 Hz  16:9     55.567 kHz    107.800000 MHz (309 mm x 174 mm)
                 Hfront   48 Hsync  32 Hback  260 Hpol P
                 Vfront    3 Vsync   5 Vback   18 Vpol N
    DTD 2:  1600x900    40.006903 Hz  16:9     37.046 kHz     71.870000 MHz (309 mm x 174 mm)
                 Hfront   48 Hsync  32 Hback  260 Hpol P
                 Vfront    3 Vsync   5 Vback   18 Vpol N
    Empty Descriptor
    Manufacturer-Specified Display Descriptor (0x02): 00 02 00 0c 3d ff 0c 3c 7d 15 11 23 7d 00 00 00 '....=..<}..#}...'
Checksum: 0x6e
