
EDID (hex):
00ffffffffffff0022f05a2801010101
2a14010368261e8ceef6b0a3554c9b25
115054a1080081400101010101010101
010101010101302a009851002a403070
13007c2c1100001e000000fd00324c18
530e000a202020202020000000fc004c
41313935310a202020202020000000ff
00434e43303432503834420a20200066

edid-decode (hex):

00 ff ff ff ff ff ff 00 22 f0 5a 28 01 01 01 01
2a 14 01 03 68 26 1e 8c ee f6 b0 a3 55 4c 9b 25
11 50 54 a1 08 00 81 40 01 01 01 01 01 01 01 01
01 01 01 01 01 01 30 2a 00 98 51 00 2a 40 30 70
13 00 7c 2c 11 00 00 1e 00 00 00 fd 00 32 4c 18
53 0e 00 0a 20 20 20 20 20 20 00 00 00 fc 00 4c
41 31 39 35 31 0a 20 20 20 20 20 20 00 00 00 ff
00 43 4e 43 30 34 32 50 38 34 42 0a 20 20 00 66

----------------

Block 0, Base EDID:
  EDID Structure Version & Revision: 1.3
  Vendor & Product Identification:
    Manufacturer: HWP
    Model: 10330
    Serial Number: 16843009
    Made in: week 42 of 2010
  Basic Display Parameters & Features:
    Analog display
    Signal Level Standard: 0.700 : 0.000 : 0.700 V p-p
    Blank level equals black level
    Sync: Separate
    Maximum image size: 38 cm x 30 cm
    Gamma: 2.40
    DPMS levels: Standby Suspend Off
    RGB color display
    Default (sRGB) color space is primary color space
    First detailed timing is the preferred timing
  Color Characteristics:
    Red  : 0.6396, 0.3349
    Green: 0.2978, 0.6074
    Blue : 0.1464, 0.0693
    White: 0.3125, 0.3281
  Established Timings I & II:
    IBM     :   720x400    70.081663 Hz   9:5     31.467 kHz     28.320000 MHz
    DMT 0x04:   640x480    59.940476 Hz   4:3     31.469 kHz     25.175000 MHz
    DMT 0x09:   800x600    60.316541 Hz   4:3     37.879 kHz     40.000000 MHz
    DMT 0x10:  1024x768    60.003840 Hz   4:3     48.363 kHz     65.000000 MHz
  Standard Timings:
    DMT 0x20:  1280x960    60.000000 Hz   4:3     60.000 kHz    108.000000 MHz
  Detailed Timing Descriptors:
    DTD 1:  1280x1024   60.019740 Hz   5:4     63.981 kHz    108.000000 MHz (380 mm x 300 mm)
                 Hfront   48 Hsync 112 Hback  248 Hpol P
                 Vfront    1 Vsync   3 Vback   38 Vpol P
    Display Range Limits:
      Monitor ranges (GTF): 50-76 Hz V, 24-83 kHz H, max dotclock 140 MHz
    Display Product Name: 'LA1951'
    Display Product Serial Number: 'CNC042P84B'
Checksum: 0x66
