
EDID (hex):
00ffffffffffff000e6f151430324c41
001f0104b51e1478030f95ae5243b026
0f505400000001010101010101010101
0101010101013bfa30a0c0205a803020
3a002cc810000018000000fd00305ac3
c340010a202020202020000000fe0043
534f542054330a5533363820000000fe
004d4e453230385a41322d310a200221
02030f00e3058000e60605016f6f2200
00000000000000000000000000000000
00000000000000000000000000000000
00000000000000000000000000000000
00000000000000000000000000000000
00000000000000000000000000000000
00000000000000000000000000000000
00000000000000000000000000000092
70137900000301283bfa00042f0c9f00
2f001f001f089604020009003bfa0004
2f0c9f002f001f001f08c40702000900
00000000000000000000000000000000
00000000000000000000000000000000
00000000000000000000000000000000
00000000000000000000000000000000
0000000000000000000000000000bd90

edid-decode (hex):

00 ff ff ff ff ff ff 00 0e 6f 15 14 30 32 4c 41
00 1f 01 04 b5 1e 14 78 03 0f 95 ae 52 43 b0 26
0f 50 54 00 00 00 01 01 01 01 01 01 01 01 01 01
01 01 01 01 01 01 3b fa 30 a0 c0 20 5a 80 30 20
3a 00 2c c8 10 00 00 18 00 00 00 fd 00 30 5a c3
c3 40 01 0a 20 20 20 20 20 20 00 00 00 fe 00 43
53 4f 54 20 54 33 0a 55 33 36 38 20 00 00 00 fe
00 4d 4e 45 32 30 38 5a 41 32 2d 31 0a 20 02 21

02 03 0f 00 e3 05 80 00 e6 06 05 01 6f 6f 22 00
00 00 00 00 00 00 00 00 00 00 00 00 00 00 00 00
00 00 00 00 00 00 00 00 00 00 00 00 00 00 00 00
00 00 00 00 00 00 00 00 00 00 00 00 00 00 00 00
00 00 00 00 00 00 00 00 00 00 00 00 00 00 00 00
00 00 00 00 00 00 00 00 00 00 00 00 00 00 00 00
00 00 00 00 00 00 00 00 00 00 00 00 00 00 00 00
00 00 00 00 00 00 00 00 00 00 00 00 00 00 00 92

70 13 79 00 00 03 01 28 3b fa 00 04 2f 0c 9f 00
2f 00 1f 00 1f 08 96 04 02 00 09 00 3b fa 00 04
2f 0c 9f 00 2f 00 1f 00 1f 08 c4 07 02 00 09 00
00 00 00 00 00 00 00 00 00 00 00 00 00 00 00 00
00 00 00 00 00 00 00 00 00 00 00 00 00 00 00 00
00 00 00 00 00 00 00 00 00 00 00 00 00 00 00 00
00 00 00 00 00 00 00 00 00 00 00 00 00 00 00 00
00 00 00 00 00 00 00 00 00 00 00 00 00 00 bd 90

----------------

Block 0, Base EDID:
  EDID Structure Version & Revision: 1.4
  Vendor & Product Identification:
    Manufacturer: CSO
    Model: 5141
    Serial Number: 1095512624
    Made in: 2021
  Basic Display Parameters & Features:
    Digital display
    Bits per primary color channel: 10
    DisplayPort interface
    Maximum image size: 30 cm x 20 cm
    Gamma: 2.20
    Supported color formats: RGB 4:4:4
    First detailed timing includes the native pixel format and preferred refresh rate
    Display is continuous frequency
  Color Characteristics:
    Red  : 0.6796, 0.3203
    Green: 0.2646, 0.6904
    Blue : 0.1503, 0.0595
    White: 0.3134, 0.3291
  Established Timings I & II: none
  Standard Timings: none
  Detailed Timing Descriptors:
    DTD 1:  3120x2080   90.000843 Hz   3:2    195.302 kHz    640.590000 MHz (300 mm x 200 mm)
                 Hfront   48 Hsync  32 Hback   80 Hpol N
                 Vfront    3 Vsync  10 Vback   77 Vpol N
    Display Range Limits:
      Monitor ranges (Bare Limits): 48-90 Hz V, 195-195 kHz H, max dotclock 640 MHz
    Alphanumeric Data String: 'CSOT T3'
    Alphanumeric Data String: 'MNE208ZA2-1'
  Extension blocks: 2
Checksum: 0x21

----------------

Block 1, CTA-861 Extension Block:
  Revision: 3
  Native detailed modes: 0
  Colorimetry Data Block:
    BT2020RGB
  HDR Static Metadata Data Block:
    Electro optical transfer functions:
      Traditional gamma - SDR luminance range
      SMPTE ST2084
    Supported static metadata descriptors:
      Static metadata type 1
    Desired content max luminance: 111 (553.564 cd/m^2)
    Desired content max frame-average luminance: 111 (553.564 cd/m^2)
    Desired content min luminance: 34 (0.098 cd/m^2)
Checksum: 0x92  Unused space in Extension Block: 112 bytes

----------------

Block 2, DisplayID Extension Block:
  Version: 1.3
  Extension Count: 0
  Display Product Type: Extension Section
  Video Timing Modes Type 1 - Detailed Timings Data Block:
    DTD:  3120x2080   60.001499 Hz  16:9    195.305 kHz    640.600000 MHz (aspect 16:9, no 3D stereo)
               Hfront   48 Hsync  32 Hback   80 Hpol N
               Vfront    3 Vsync  10 Vback 1162 Vpol N
    DTD:  3120x2080   47.998250 Hz  16:9    195.305 kHz    640.600000 MHz (aspect 16:9, no 3D stereo)
               Hfront   48 Hsync  32 Hback   80 Hpol N
               Vfront    3 Vsync  10 Vback 1976 Vpol N
  Checksum: 0xbd
Checksum: 0x90
