
EDID (hex):
00ffffffffffff0006af876200000000
01110103802517780a1cf59758508e27
27505400000001010101010101010101
0101010101019e25a04051840c30d020
36006fe5100000180000000f00000000
00000000000000000020000000fe0041
554f0a200020202020202020000000fe
004231373050573036205632200a000b

edid-decode (hex):

00 ff ff ff ff ff ff 00 06 af 87 62 00 00 00 00
01 11 01 03 80 25 17 78 0a 1c f5 97 58 50 8e 27
27 50 54 00 00 00 01 01 01 01 01 01 01 01 01 01
01 01 01 01 01 01 9e 25 a0 40 51 84 0c 30 d0 20
36 00 6f e5 10 00 00 18 00 00 00 0f 00 00 00 00
00 00 00 00 00 00 00 00 00 20 00 00 00 fe 00 41
55 4f 0a 20 00 20 20 20 20 20 20 20 00 00 00 fe
00 42 31 37 30 50 57 30 36 20 56 32 20 0a 00 0b

----------------

Block 0, Base EDID:
  EDID Structure Version & Revision: 1.3
  Vendor & Product Identification:
    Manufacturer: AUO
    Model: 25223
    Made in: week 1 of 2007
  Basic Display Parameters & Features:
    Digital display
    Maximum image size: 37 cm x 23 cm
    Gamma: 2.20
    RGB color display
    First detailed timing is the preferred timing
  Color Characteristics:
    Red  : 0.5898, 0.3447
    Green: 0.3154, 0.5546
    Blue : 0.1552, 0.1552
    White: 0.3134, 0.3291
  Established Timings I & II: none
  Standard Timings: none
  Detailed Timing Descriptors:
    DTD 1:  1440x900    59.995514 Hz  16:10    54.716 kHz     96.300000 MHz (367 mm x 229 mm)
                 Hfront  208 Hsync  32 Hback   80 Hpol N
                 Vfront    3 Vsync   6 Vback    3 Vpol N
    Manufacturer-Specified Display Descriptor (0x0f): 00 0f 00 00 00 00 00 00 00 00 00 00 00 00 00 20 '............... '
    Alphanumeric Data String: 'AUO'
    Alphanumeric Data String: 'B170PW06 V2 '
Checksum: 0x0b
