
EDID (hex):
00ffffffffffff004c232d9501010101
251d0103802f1c78ea3135a5554ea126
0c5054a54b00714f81809500b300a9c0
810081c09040023a801871382d40582c
4500e00e1100001e000000fd00304b1e
5512000a202020202020000000fc004c
4544204d4f4e49544f520a20000000ff
003030303030303031303030300a0120
020326f44a900403011412051f101323
0907078301000065030c001000681a00
000101304be62a4480a0703827403020
3500e00e1100001a011d8018711c1620
582c2500e00e1100009e011d007251d0
1e206e285500e00e1100001e023a8018
71382d40582c4500e00e110000180000
000000000000000000000000000000b0

Extracted contents:
header:          00 ff ff ff ff ff ff 00
serial number:   4c 23 2d 95 01 01 01 01 25 1d
version:         01 03
basic params:    80 2f 1c 78 ea
chroma info:     31 35 a5 55 4e a1 26 0c 50 54
established:     a5 4b 00
standard:        71 4f 81 80 95 00 b3 00 a9 c0 81 00 81 c0 90 40
descriptor 1:    02 3a 80 18 71 38 2d 40 58 2c 45 00 e0 0e 11 00 00 1e
descriptor 2:    00 00 00 fd 00 30 4b 1e 55 12 00 0a 20 20 20 20 20 20
descriptor 3:    00 00 00 fc 00 4c 45 44 20 4d 4f 4e 49 54 4f 52 0a 20
descriptor 4:    00 00 00 ff 00 30 30 30 30 30 30 30 31 30 30 30 30 0a
extensions:      01
checksum:        20

Manufacturer: SAC Model 952d Serial Number --
Made week 37 of 2019
EDID version: 1.3
Digital display
Maximum image size: 47 cm x 28 cm
Gamma: 2.20
DPMS levels: Standby Suspend Off
Supported color formats: RGB 4:4:4, YCrCb 4:2:2
First detailed timing is preferred timing
Established timings supported:
  720x400@70Hz
  640x480@60Hz
  640x480@75Hz
  800x600@60Hz
  800x600@75Hz
  1024x768@60Hz
  1024x768@75Hz
  1280x1024@75Hz
Standard timings supported:
  1152x864@75Hz
  1280x1024@60Hz
  1440x900@60Hz
  1680x1050@60Hz
  1600x900@60Hz
  1280x800@60Hz
  1280x720@60Hz
  1400x1050@60Hz
Detailed mode: Clock 148.500 MHz, 480 mm x 270 mm
               1920 2008 2052 2200 hborder 0
               1080 1084 1089 1125 vborder 0
               +hsync +vsync 
Monitor ranges (GTF): 48-75Hz V, 30-85kHz H, max dotclock 180MHz
Monitor name: LED
Serial number: --
Has 1 extension blocks
Checksum: 0x20 (valid)

CEA extension block
Extension version: 3
34 bytes of CEA data
  Video data block
    VIC 16 1920x1080@60Hz (native)
    VIC 04 1280x720@60Hz 
    VIC 03 720x480@60Hz 
    VIC 01 640x480@60Hz 
    VIC 20 1920x1080i@50Hz 
    VIC 18 720x576@50Hz 
    VIC 05 1920x1080i@60Hz 
    VIC 31 1920x1080@50Hz 
    VIC 16 1920x1080@60Hz 
    VIC 19 1280x720@50Hz 
  Audio data block
    Linear PCM, max channels 1
    Supported sample rates (kHz): 48 44.1 32
    Supported sample sizes (bits): 24 20 16
  Speaker allocation data block
  Vendor-specific data block, OUI 000c03 (HDMI)
    Source physical address 1.0.0.0
  Vendor-specific data block, OUI 00001a
Underscans PC formats by default
Basic audio support
Supports YCbCr 4:4:4
Supports YCbCr 4:2:2
4 native detailed modes
Detailed mode: Clock 174.500 MHz, 480 mm x 270 mm
               1920 1968 2000 2080 hborder 0
               1080 1083 1088 1119 vborder 0
               +hsync -vsync 
Detailed mode: Clock 74.250 MHz, 480 mm x 270 mm
               1920 2008 2052 2200 hborder 0
                540  542  547  562 vborder 0
               +hsync +vsync interlaced 
Detailed mode: Clock 74.250 MHz, 480 mm x 270 mm
               1280 1390 1430 1650 hborder 0
                720  725  730  750 vborder 0
               +hsync +vsync 
Detailed mode: Clock 148.500 MHz, 480 mm x 270 mm
               1920 2008 2052 2200 hborder 0
               1080 1084 1089 1125 vborder 0
               -hsync -vsync 
Checksum: 0xb0 (valid)

EDID block does NOT conform to EDID 1.3!
	Detailed block string not properly terminated
