
EDID (hex):
00ffffffffffff0006af2d2100000000
00170104951d11780292279858529526
1f4d5400000001010101010101010101
0101010101011d3680a070381e403020
8e0025a5100000180000000f00000000
00000000000000000020000000fe0041
554f0a202020202020202020000000fe
004231333348414e30322e31200a0006

edid-decode (hex):

00 ff ff ff ff ff ff 00 06 af 2d 21 00 00 00 00
00 17 01 04 95 1d 11 78 02 92 27 98 58 52 95 26
1f 4d 54 00 00 00 01 01 01 01 01 01 01 01 01 01
01 01 01 01 01 01 1d 36 80 a0 70 38 1e 40 30 20
8e 00 25 a5 10 00 00 18 00 00 00 0f 00 00 00 00
00 00 00 00 00 00 00 00 00 20 00 00 00 fe 00 41
55 4f 0a 20 20 20 20 20 20 20 20 20 00 00 00 fe
00 42 31 33 33 48 41 4e 30 32 2e 31 20 0a 00 06

----------------

Block 0, Base EDID:
  EDID Structure Version & Revision: 1.4
  Vendor & Product Identification:
    Manufacturer: AUO
    Model: 8493
    Made in: 2013
  Basic Display Parameters & Features:
    Digital display
    Bits per primary color channel: 6
    DisplayPort interface
    Maximum image size: 29 cm x 17 cm
    Gamma: 2.20
    Supported color formats: RGB 4:4:4
    First detailed timing includes the native pixel format and preferred refresh rate
  Color Characteristics:
    Red  : 0.5957, 0.3447
    Green: 0.3203, 0.5839
    Blue : 0.1484, 0.1230
    White: 0.3017, 0.3310
  Established Timings I & II: none
  Standard Timings: none
  Detailed Timing Descriptors:
    DTD 1:  1920x1080   60.000866 Hz  16:9     66.601 kHz    138.530000 MHz (293 mm x 165 mm)
                 Hfront   48 Hsync  32 Hback   80 Hpol N
                 Vfront    8 Vsync  14 Vback    8 Vpol N
    Manufacturer-Specified Display Descriptor (0x0f): 00 0f 00 00 00 00 00 00 00 00 00 00 00 00 00 20 '............... '
    Alphanumeric Data String: 'AUO'
    Alphanumeric Data String: 'B133HAN02.1 '
Checksum: 0x06
