
EDID (hex):
00ffffffffffff0030aeb86600000000
2f1f0103803c22782aadb5a3554e9e26
0e5054a1080081809500a9c0b300d1cf
818c81000101023a801871382d40582c
450055502100001e000000fc00443237
2d33300a202020202020000000fd0030
4b1e5516000a202020202020000000ff
0055524848324230360a20202020018f
020325f149901f041312110302012309
0f078301000065030c001000681a0000
0101304be6662156aa51001e30468f33
0055502100001e3b5680b07238324088
d0350055502100001a7c2e90a0601a1e
403020360055502100001a0000000000
00000000000000000000000000000000
0000000000000000000000000000000a

Extracted contents:
header:          00 ff ff ff ff ff ff 00
serial number:   30 ae b8 66 00 00 00 00 2f 1f
version:         01 03
basic params:    80 3c 22 78 2a
chroma info:     ad b5 a3 55 4e 9e 26 0e 50 54
established:     a1 08 00
standard:        81 80 95 00 a9 c0 b3 00 d1 cf 81 8c 81 00 01 01
descriptor 1:    02 3a 80 18 71 38 2d 40 58 2c 45 00 55 50 21 00 00 1e
descriptor 2:    00 00 00 fc 00 44 32 37 2d 33 30 0a 20 20 20 20 20 20
descriptor 3:    00 00 00 fd 00 30 4b 1e 55 16 00 0a 20 20 20 20 20 20
descriptor 4:    00 00 00 ff 00 55 52 48 48 32 42 30 36 0a 20 20 20 20
extensions:      01
checksum:        8f

EDID version: 1.3
Manufacturer: LEN Model 66b8 Serial Number --
Made in week 47 of 2021
Digital display
Maximum image size: 60 cm x 34 cm
Gamma: 2.20
DPMS levels: Off
RGB color display
First detailed timing is preferred timing
Display x,y Chromaticity:
  Red:   0.6386, 0.3339
  Green: 0.3076, 0.6181
  Blue:  0.1503, 0.0576
  White: 0.3134, 0.3291
Established timings supported:
  720x400@70Hz 9:5 HorFreq: 31469 Hz Clock: 28.320 MHz
  640x480@60Hz 4:3 HorFreq: 31469 Hz Clock: 25.175 MHz
  800x600@60Hz 4:3 HorFreq: 37900 Hz Clock: 40.000 MHz
  1024x768@60Hz 4:3 HorFreq: 48400 Hz Clock: 65.000 MHz
Standard timings supported:
  1280x1024@60Hz 5:4 HorFreq: 64000 Hz Clock: 108.000 MHz
  1440x900@60Hz 16:10 HorFreq: 55500 Hz Clock: 88.750 MHz
  1600x900@60Hz 16:9
  1680x1050@60Hz 16:10 HorFreq: 64700 Hz Clock: 119.000 MHz
  1920x1080@75Hz 16:9
  1280x1024@72Hz 5:4
  1280x800@60Hz 16:10
Detailed mode: Clock 148.500 MHz, 597 mm x 336 mm
               1920 2008 2052 2200 hborder 0
               1080 1084 1089 1125 vborder 0
               +hsync +vsync 
               VertFreq: 60 Hz, HorFreq: 67500 Hz
Monitor name: D27-30
Monitor ranges (GTF): 48-75Hz V, 30-85kHz H, max dotclock 220MHz
Serial number: --
Has 1 extension blocks
Checksum: 0x8f (valid)

CTA extension block
Extension version: 3
33 bytes of CTA data
  Video data block
    VIC  16 1920x1080@60Hz 16:9 (native) HorFreq: 67500 Hz Clock: 148.500 MHz
    VIC  31 1920x1080@50Hz 16:9  HorFreq: 56250 Hz Clock: 148.500 MHz
    VIC   4 1280x720@60Hz 16:9  HorFreq: 45000 Hz Clock: 74.250 MHz
    VIC  19 1280x720@50Hz 16:9  HorFreq: 37500 Hz Clock: 74.250 MHz
    VIC  18 720x576@50Hz 16:9  HorFreq: 31250 Hz Clock: 27.000 MHz
    VIC  17 720x576@50Hz 4:3  HorFreq: 31250 Hz Clock: 27.000 MHz
    VIC   3 720x480@60Hz 16:9  HorFreq: 31469 Hz Clock: 27.000 MHz
    VIC   2 720x480@60Hz 4:3  HorFreq: 31469 Hz Clock: 27.000 MHz
    VIC   1 640x480@60Hz 4:3  HorFreq: 31469 Hz Clock: 25.175 MHz
  Audio data block
    Linear PCM, max channels 2
      Supported sample rates (kHz): 88.2 48 44.1 32
      Supported sample sizes (bits): 24 20 16
  Speaker allocation data block
    Speaker map:
      FL/FR - Front Left/Right
  Vendor-specific data block, OUI 000c03 (HDMI)
    Source physical address 1.0.0.0
  Vendor-specific data block, OUI 00001a
Underscans PC formats by default
Basic audio support
Supports YCbCr 4:4:4
Supports YCbCr 4:2:2
1 native detailed modes
Detailed mode: Clock 85.500 MHz, 597 mm x 336 mm
               1366 1436 1579 1792 hborder 0
                768  771  774  798 vborder 0
               +hsync +vsync 
               VertFreq: 59 Hz, HorFreq: 47712 Hz
Detailed mode: Clock 220.750 MHz, 597 mm x 336 mm
               1920 2056 2264 2608 hborder 0
               1080 1083 1088 1130 vborder 0
               +hsync -vsync 
               VertFreq: 74 Hz, HorFreq: 84643 Hz
Detailed mode: Clock 119.000 MHz, 597 mm x 336 mm
               1680 1728 1760 1840 hborder 0
               1050 1053 1059 1080 vborder 0
               +hsync -vsync 
               VertFreq: 59 Hz, HorFreq: 64673 Hz
Checksum: 0xa (valid)

One or more of the timings is out of range of the Monitor Ranges:
  Vertical Freq: 50 - 75 Hz
  Horizontal Freq: 31250 - 84643 Hz
  Maximum Clock: 220.750 MHz
