
EDID (hex):
00ffffffffffff00410cacc0b8140000
181801046e301b782af085a2554fa027
115054bd4b00d1c09500950fb3008180
81c001010101023a801871382d40582c
4500dd0c1100001e000000ff00415530
31343234303035333034000000fc0032
323745344c480a2020202020000000fd
00384c1e5311000a202020202020004d

Extracted contents:
header:          00 ff ff ff ff ff ff 00
serial number:   41 0c ac c0 b8 14 00 00 18 18
version:         01 04
basic params:    6e 30 1b 78 2a
chroma info:     f0 85 a2 55 4f a0 27 11 50 54
established:     bd 4b 00
standard:        d1 c0 95 00 95 0f b3 00 81 80 81 c0 01 01 01 01
descriptor 1:    02 3a 80 18 71 38 2d 40 58 2c 45 00 dd 0c 11 00 00 1e
descriptor 2:    00 00 00 ff 00 41 55 30 31 34 32 34 30 30 35 33 30 34
descriptor 3:    00 00 00 fc 00 32 32 37 45 34 4c 48 0a 20 20 20 20 20
descriptor 4:    00 00 00 fd 00 38 4c 1e 53 11 00 0a 20 20 20 20 20 20
extensions:      00
checksum:        4d

EDID version: 1.4
Manufacturer: PHL Model c0ac Serial Number --
Made in week 24 of 2014
Analog display, Input voltage level: 0.7/0.7 V
Blank level equals black level
Sync: Separate Composite SyncOnGreen 
Maximum image size: 48 cm x 27 cm
Gamma: 2.20
DPMS levels: Off
RGB color display
First detailed timing includes the native pixel format and preferred refresh rate
Display x,y Chromaticity:
  Red:   0.6357, 0.3349
  Green: 0.3085, 0.6250
  Blue:  0.1542, 0.0664
  White: 0.3134, 0.3291
Established timings supported:
  720x400@70Hz 9:5 HorFreq: 31469 Hz Clock: 28.320 MHz
  640x480@60Hz 4:3 HorFreq: 31469 Hz Clock: 25.175 MHz
  640x480@67Hz 4:3 HorFreq: 35000 Hz Clock: 30.240 MHz
  640x480@72Hz 4:3 HorFreq: 37900 Hz Clock: 31.500 MHz
  640x480@75Hz 4:3 HorFreq: 37500 Hz Clock: 31.500 MHz
  800x600@60Hz 4:3 HorFreq: 37900 Hz Clock: 40.000 MHz
  800x600@75Hz 4:3 HorFreq: 46900 Hz Clock: 49.500 MHz
  1024x768@60Hz 4:3 HorFreq: 48400 Hz Clock: 65.000 MHz
  1024x768@75Hz 4:3 HorFreq: 60000 Hz Clock: 78.750 MHz
  1280x1024@75Hz 5:4 HorFreq: 80000 Hz Clock: 135.000 MHz
Standard timings supported:
  1920x1080@60Hz 16:9
  1440x900@60Hz 16:10 HorFreq: 55500 Hz Clock: 88.750 MHz
  1440x900@75Hz 16:10 HorFreq: 82300 Hz Clock: 156.000 MHz
  1680x1050@60Hz 16:10 HorFreq: 64700 Hz Clock: 119.000 MHz
  1280x1024@60Hz 5:4 HorFreq: 64000 Hz Clock: 108.000 MHz
  1280x720@60Hz 16:9
Detailed mode: Clock 148.500 MHz, 477 mm x 268 mm
               1920 2008 2052 2200 hborder 0
               1080 1084 1089 1125 vborder 0
               +hsync +vsync 
               VertFreq: 60 Hz, HorFreq: 67500 Hz
Serial number: --
Monitor name: 227E4LH
Monitor ranges (GTF): 56-76Hz V, 30-83kHz H, max dotclock 170MHz
Checksum: 0x4d (valid)
