
EDID (hex):
00ffffffffffff000daec51500000000
301701049522137802c3c59155549428
24505400000001010101010101010101
010101010101da1d56e250002030442d
470058c110000018000000fe004e3135
364247452d4541320a20000000fe0043
4d4e0a202020202020202020000000fe
004e3135364247452d4541320a200033

edid-decode (hex):

00 ff ff ff ff ff ff 00 0d ae c5 15 00 00 00 00
30 17 01 04 95 22 13 78 02 c3 c5 91 55 54 94 28
24 50 54 00 00 00 01 01 01 01 01 01 01 01 01 01
01 01 01 01 01 01 da 1d 56 e2 50 00 20 30 44 2d
47 00 58 c1 10 00 00 18 00 00 00 fe 00 4e 31 35
36 42 47 45 2d 45 41 32 0a 20 00 00 00 fe 00 43
4d 4e 0a 20 20 20 20 20 20 20 20 20 00 00 00 fe
00 4e 31 35 36 42 47 45 2d 45 41 32 0a 20 00 33

----------------

Block 0, Base EDID:
  EDID Structure Version & Revision: 1.4
  Vendor & Product Identification:
    Manufacturer: CMN
    Model: 5573
    Made in: week 48 of 2013
  Basic Display Parameters & Features:
    Digital display
    Bits per primary color channel: 6
    DisplayPort interface
    Maximum image size: 34 cm x 19 cm
    Gamma: 2.20
    Supported color formats: RGB 4:4:4
    First detailed timing includes the native pixel format and preferred refresh rate
  Color Characteristics:
    Red  : 0.5693, 0.3320
    Green: 0.3281, 0.5810
    Blue : 0.1591, 0.1406
    White: 0.3134, 0.3291
  Established Timings I & II: none
  Standard Timings: none
  Detailed Timing Descriptors:
    DTD 1:  1366x768    60.003141 Hz 683:384   48.003 kHz     76.420000 MHz (344 mm x 193 mm)
                 Hfront   68 Hsync  45 Hback  113 Hpol N
                 Vfront    4 Vsync   7 Vback   21 Vpol N
    Alphanumeric Data String: 'N156BGE-EA2'
    Alphanumeric Data String: 'CMN'
    Alphanumeric Data String: 'N156BGE-EA2'
Checksum: 0x33
