
EDID (hex):
00ffffffffffff005a6332e001010101
341b010380351e782ead75a9544d9d26
0f5054bfef80e1c0d140d1c0b300a9c0
9500818081c0565e00a0a0a029503020
35000e282100001a000000ff0055504e
3137353230303130360a000000fd0017
560f5b1e000a202020202020000000fc
00565832343738205365726965730195
02032bf156900504030207060f0e1f20
21221413121116159e1d0123097f0783
01000067030c0010002032023a801871
382d40582c45000e282100001e011d80
18711c1620582c25000e282100009e01
1d007251d01e206e2855000e28210000
1e8c0ad08a20e02d10103e96000e2821
000018000000000000000000000000f2

Extracted contents:
header:          00 ff ff ff ff ff ff 00
serial number:   5a 63 32 e0 01 01 01 01 34 1b
version:         01 03
basic params:    80 35 1e 78 2e
chroma info:     ad 75 a9 54 4d 9d 26 0f 50 54
established:     bf ef 80
standard:        e1 c0 d1 40 d1 c0 b3 00 a9 c0 95 00 81 80 81 c0
descriptor 1:    56 5e 00 a0 a0 a0 29 50 30 20 35 00 0e 28 21 00 00 1a
descriptor 2:    00 00 00 ff 00 55 50 4e 31 37 35 32 30 30 31 30 36 0a
descriptor 3:    00 00 00 fd 00 17 56 0f 5b 1e 00 0a 20 20 20 20 20 20
descriptor 4:    00 00 00 fc 00 56 58 32 34 37 38 20 53 65 72 69 65 73
extensions:      01
checksum:        95

Manufacturer: VSC Model e032 Serial Number --
Made week 52 of 2017
EDID version: 1.3
Digital display
Maximum image size: 53 cm x 30 cm
Gamma: 2.20
DPMS levels: Off
Supported color formats: RGB 4:4:4, YCrCb 4:2:2
Default (sRGB) color space is primary color space
First detailed timing is preferred timing
Established timings supported:
  720x400@70Hz
  640x480@60Hz
  640x480@67Hz
  640x480@72Hz
  640x480@75Hz
  800x600@56Hz
  800x600@60Hz
  800x600@72Hz
  800x600@75Hz
  832x624@75Hz
  1024x768@60Hz
  1024x768@70Hz
  1024x768@75Hz
  1280x1024@75Hz
  1152x870@75Hz
Standard timings supported:
  2048x1152@60Hz
  1920x1440@60Hz
  1920x1080@60Hz
  1680x1050@60Hz
  1600x900@60Hz
  1440x900@60Hz
  1280x1024@60Hz
  1280x720@60Hz
Detailed mode: Clock 241.500 MHz, 526 mm x 296 mm
               2560 2608 2640 2720 hborder 0
               1440 1443 1448 1481 vborder 0
               +hsync -vsync 
Serial number: --
Monitor ranges (GTF): 23-86Hz V, 15-91kHz H, max dotclock 300MHz
Has 1 extension blocks
Checksum: 0x95 (valid)

CEA extension block
Extension version: 3
39 bytes of CEA data
  Video data block
    VIC 16 1920x1080@60Hz (native)
    VIC 05 1920x1080i@60Hz 
    VIC 04 1280x720@60Hz 
    VIC 03 720x480@60Hz 
    VIC 02 720x480@60Hz 
    VIC 07 1440x480i@60Hz 
    VIC 06 1440x480i@60Hz 
    VIC 15 1440x480@60Hz 
    VIC 14 1440x480@60Hz 
    VIC 31 1920x1080@50Hz 
    VIC 32 1920x1080@24Hz 
    VIC 33 1920x1080@25Hz 
    VIC 34 1920x1080@30Hz 
    VIC 20 1920x1080i@50Hz 
    VIC 19 1280x720@50Hz 
    VIC 18 720x576@50Hz 
    VIC 17 720x576@50Hz 
    VIC 22 1440x576i@50Hz 
    VIC 21 1440x576i@50Hz 
    VIC 30 1440x576@50Hz (native)
    VIC 29 1440x576@50Hz 
    VIC 01 640x480@60Hz 
  Audio data block
    Linear PCM, max channels 1
    Supported sample rates (kHz): 192 176.4 96 88.2 48 44.1 32
    Supported sample sizes (bits): 24 20 16
  Speaker allocation data block
  Vendor-specific data block, OUI 000c03 (HDMI)
    Source physical address 1.0.0.0
    DC_36bit
    Maximum TMDS clock: 250MHz
Underscans PC formats by default
Basic audio support
Supports YCbCr 4:4:4
Supports YCbCr 4:2:2
1 native detailed modes
Detailed mode: Clock 148.500 MHz, 526 mm x 296 mm
               1920 2008 2052 2200 hborder 0
               1080 1084 1089 1125 vborder 0
               +hsync +vsync 
Detailed mode: Clock 74.250 MHz, 526 mm x 296 mm
               1920 2008 2052 2200 hborder 0
                540  542  547  562 vborder 0
               +hsync +vsync interlaced 
Detailed mode: Clock 74.250 MHz, 526 mm x 296 mm
               1280 1390 1430 1650 hborder 0
                720  725  730  750 vborder 0
               +hsync +vsync 
Detailed mode: Clock 27.000 MHz, 526 mm x 296 mm
                720  736  798  858 hborder 0
                480  489  495  525 vborder 0
               -hsync -vsync 
Checksum: 0xf2 (valid)

EDID block does NOT conform to EDID 1.3!
	Name descriptor not terminated with a newline
