
EDID (hex):
00ffffffffffff004c2d420e51475230
111d0103813c22782a2ac5ae5046a926
125054bfef8081c0810081809500a9c0
b300714f01010474801871382d40582c
450056512100001e000000fd005a781e
881e000a202020202020000000fc0043
3237464737780a2020202020000000ff
004854484d3430303334350a202001e9
020326f14890041f1303123f40230907
078301000067030c001000803c681a00
0001015a7800047480d072382d40102c
458056512100001e023a801871382d40
582c450056512100001e011d007251d0
1e206e28550056512100001e8c0ad08a
20e02d10103e96005651210000180000
000000000000000000000000000000dc

edid-decode (hex):

00 ff ff ff ff ff ff 00 4c 2d 42 0e 51 47 52 30
11 1d 01 03 81 3c 22 78 2a 2a c5 ae 50 46 a9 26
12 50 54 bf ef 80 81 c0 81 00 81 80 95 00 a9 c0
b3 00 71 4f 01 01 04 74 80 18 71 38 2d 40 58 2c
45 00 56 51 21 00 00 1e 00 00 00 fd 00 5a 78 1e
88 1e 00 0a 20 20 20 20 20 20 00 00 00 fc 00 43
32 37 46 47 37 78 0a 20 20 20 20 20 00 00 00 ff
00 48 54 48 4d 34 30 30 33 34 35 0a 20 20 01 e9

02 03 26 f1 48 90 04 1f 13 03 12 3f 40 23 09 07
07 83 01 00 00 67 03 0c 00 10 00 80 3c 68 1a 00
00 01 01 5a 78 00 04 74 80 d0 72 38 2d 40 10 2c
45 80 56 51 21 00 00 1e 02 3a 80 18 71 38 2d 40
58 2c 45 00 56 51 21 00 00 1e 01 1d 00 72 51 d0
1e 20 6e 28 55 00 56 51 21 00 00 1e 8c 0a d0 8a
20 e0 2d 10 10 3e 96 00 56 51 21 00 00 18 00 00
00 00 00 00 00 00 00 00 00 00 00 00 00 00 00 dc

----------------

Block 0, Base EDID:
  EDID Structure Version & Revision: 1.3
  Vendor & Product Identification:
    Manufacturer: SAM
    Model: 3650
    Serial Number: 810698577
    Made in: week 17 of 2019
  Basic Display Parameters & Features:
    Digital display
    DFP 1.x compatible TMDS
    Maximum image size: 60 cm x 34 cm
    Gamma: 2.20
    DPMS levels: Off
    RGB color display
    First detailed timing is the preferred timing
  Color Characteristics:
    Red  : 0.6796, 0.3144
    Green: 0.2753, 0.6621
    Blue : 0.1513, 0.0703
    White: 0.3134, 0.3291
  Established Timings I & II:
    IBM     :   720x400    70.081663 Hz   9:5     31.467 kHz     28.320000 MHz
    DMT 0x04:   640x480    59.940476 Hz   4:3     31.469 kHz     25.175000 MHz
    Apple   :   640x480    66.666667 Hz   4:3     35.000 kHz     30.240000 MHz
    DMT 0x05:   640x480    72.808802 Hz   4:3     37.861 kHz     31.500000 MHz
    DMT 0x06:   640x480    75.000000 Hz   4:3     37.500 kHz     31.500000 MHz
    DMT 0x08:   800x600    56.250000 Hz   4:3     35.156 kHz     36.000000 MHz
    DMT 0x09:   800x600    60.316541 Hz   4:3     37.879 kHz     40.000000 MHz
    DMT 0x0a:   800x600    72.187572 Hz   4:3     48.077 kHz     50.000000 MHz
    DMT 0x0b:   800x600    75.000000 Hz   4:3     46.875 kHz     49.500000 MHz
    Apple   :   832x624    74.551266 Hz   4:3     49.726 kHz     57.284000 MHz
    DMT 0x10:  1024x768    60.003840 Hz   4:3     48.363 kHz     65.000000 MHz
    DMT 0x11:  1024x768    70.069359 Hz   4:3     56.476 kHz     75.000000 MHz
    DMT 0x12:  1024x768    75.028582 Hz   4:3     60.023 kHz     78.750000 MHz
    DMT 0x24:  1280x1024   75.024675 Hz   5:4     79.976 kHz    135.000000 MHz
    Apple   :  1152x870    75.061550 Hz 192:145   68.681 kHz    100.000000 MHz
  Standard Timings:
    DMT 0x55:  1280x720    60.000000 Hz  16:9     45.000 kHz     74.250000 MHz
    DMT 0x1c:  1280x800    59.810326 Hz  16:10    49.702 kHz     83.500000 MHz
    DMT 0x23:  1280x1024   60.019740 Hz   5:4     63.981 kHz    108.000000 MHz
    DMT 0x2f:  1440x900    59.887445 Hz  16:10    55.935 kHz    106.500000 MHz
    DMT 0x53:  1600x900    60.000000 Hz  16:9     60.000 kHz    108.000000 MHz (RB)
    DMT 0x3a:  1680x1050   59.954250 Hz  16:10    65.290 kHz    146.250000 MHz
    DMT 0x15:  1152x864    75.000000 Hz   4:3     67.500 kHz    108.000000 MHz
  Detailed Timing Descriptors:
    DTD 1:  1920x1080  120.000000 Hz  16:9    135.000 kHz    297.000000 MHz (598 mm x 337 mm)
                 Hfront   88 Hsync  44 Hback  148 Hpol P
                 Vfront    4 Vsync   5 Vback   36 Vpol P
    Display Range Limits:
      Monitor ranges (GTF): 90-120 Hz V, 30-136 kHz H, max dotclock 300 MHz
    Display Product Name: 'C27FG7x'
    Display Product Serial Number: 'HTHM400345'
  Extension blocks: 1
Checksum: 0xe9

----------------

Block 1, CTA-861 Extension Block:
  Revision: 3
  Underscans IT Video Formats by default
  Basic audio support
  Supports YCbCr 4:4:4
  Supports YCbCr 4:2:2
  Native detailed modes: 1
  Video Data Block:
    VIC  16:  1920x1080   60.000000 Hz  16:9     67.500 kHz    148.500000 MHz (native)
    VIC   4:  1280x720    60.000000 Hz  16:9     45.000 kHz     74.250000 MHz
    VIC  31:  1920x1080   50.000000 Hz  16:9     56.250 kHz    148.500000 MHz
    VIC  19:  1280x720    50.000000 Hz  16:9     37.500 kHz     74.250000 MHz
    VIC   3:   720x480    59.940060 Hz  16:9     31.469 kHz     27.000000 MHz
    VIC  18:   720x576    50.000000 Hz  16:9     31.250 kHz     27.000000 MHz
    VIC  63:  1920x1080  120.000000 Hz  16:9    135.000 kHz    297.000000 MHz
    VIC  64:  1920x1080  100.000000 Hz  16:9    112.500 kHz    297.000000 MHz
  Audio Data Block:
    Linear PCM:
      Max channels: 2
      Supported sample rates (kHz): 48 44.1 32
      Supported sample sizes (bits): 24 20 16
  Speaker Allocation Data Block:
    FL/FR - Front Left/Right
  Vendor-Specific Data Block (HDMI), OUI 00-0C-03:
    Source physical address: 1.0.0.0
    Supports_AI
    Maximum TMDS clock: 300 MHz
  Vendor-Specific Data Block (AMD), OUI 00-00-1A:
    Version: 1.1
    Minimum Refresh Rate: 90 Hz
    Maximum Refresh Rate: 120 Hz
    Flags 1.x: 0x00
  Detailed Timing Descriptors:
    DTD 2:  1920x1080  100.000000 Hz  16:9    112.500 kHz    297.000000 MHz (598 mm x 337 mm)
                 Hfront  528 Hsync  44 Hback  148 Hpol P
                 Vfront    4 Vsync   5 Vback   36 Vpol P
    DTD 3:  1920x1080   60.000000 Hz  16:9     67.500 kHz    148.500000 MHz (598 mm x 337 mm)
                 Hfront   88 Hsync  44 Hback  148 Hpol P
                 Vfront    4 Vsync   5 Vback   36 Vpol P
    DTD 4:  1280x720    60.000000 Hz  16:9     45.000 kHz     74.250000 MHz (598 mm x 337 mm)
                 Hfront  110 Hsync  40 Hback  220 Hpol P
                 Vfront    5 Vsync   5 Vback   20 Vpol P
    DTD 5:   720x480    59.940060 Hz   3:2     31.469 kHz     27.000000 MHz (598 mm x 337 mm)
                 Hfront   16 Hsync  62 Hback   60 Hpol N
                 Vfront    9 Vsync   6 Vback   30 Vpol N
Checksum: 0xdc  Unused space in Extension Block: 17 bytes
