
EDID (hex):
00ffffffffffff0005e3022268020000
161d010380301b782ac7b1a756539c27
105054bfef00d1c0b300950081808140
81c001010101023a801871382d40582c
4500dc0c1100001e2a4480a070382740
30203500dc0c1100001a000000fc0032
3256325747350a2020202020000000fd
00304c1e5512000a20202020202001f2
020329f14b101f051404130312021101
230907078301000067030c001000003c
681a00000101304c008c0ad08a20e02d
10103e9600dc0c11000018011d007251
d01e206e285500dc0c1100001e8c0ad0
8a20e02d10103e9600dc0c110000188c
0ad090204031200c405500dc0c110000
18000000000000000000000000000000

Extracted contents:
header:          00 ff ff ff ff ff ff 00
serial number:   05 e3 02 22 68 02 00 00 16 1d
version:         01 03
basic params:    80 30 1b 78 2a
chroma info:     c7 b1 a7 56 53 9c 27 10 50 54
established:     bf ef 00
standard:        d1 c0 b3 00 95 00 81 80 81 40 81 c0 01 01 01 01
descriptor 1:    02 3a 80 18 71 38 2d 40 58 2c 45 00 dc 0c 11 00 00 1e
descriptor 2:    2a 44 80 a0 70 38 27 40 30 20 35 00 dc 0c 11 00 00 1a
descriptor 3:    00 00 00 fc 00 32 32 56 32 57 47 35 0a 20 20 20 20 20
descriptor 4:    00 00 00 fd 00 30 4c 1e 55 12 00 0a 20 20 20 20 20 20
extensions:      01
checksum:        f2

EDID version: 1.3
Manufacturer: AOC Model 2202 Serial Number --
Made in week 22 of 2019
Digital display
Maximum image size: 48 cm x 27 cm
Gamma: 2.20
DPMS levels: Off
RGB color display
First detailed timing is preferred timing
Display x,y Chromaticity:
  Red:   0.6552, 0.3359
  Green: 0.3251, 0.6123
  Blue:  0.1542, 0.0654
  White: 0.3125, 0.3291
Established timings supported:
  720x400@70Hz 9:5 HorFreq: 31469 Hz Clock: 28.320 MHz
  640x480@60Hz 4:3 HorFreq: 31469 Hz Clock: 25.175 MHz
  640x480@67Hz 4:3 HorFreq: 35000 Hz Clock: 30.240 MHz
  640x480@72Hz 4:3 HorFreq: 37900 Hz Clock: 31.500 MHz
  640x480@75Hz 4:3 HorFreq: 37500 Hz Clock: 31.500 MHz
  800x600@56Hz 4:3 HorFreq: 35200 Hz Clock: 36.000 MHz
  800x600@60Hz 4:3 HorFreq: 37900 Hz Clock: 40.000 MHz
  800x600@72Hz 4:3 HorFreq: 48100 Hz Clock: 50.000 MHz
  800x600@75Hz 4:3 HorFreq: 46900 Hz Clock: 49.500 MHz
  832x624@75Hz 4:3 HorFreq: 49726 Hz Clock: 57.284 MHz
  1024x768@60Hz 4:3 HorFreq: 48400 Hz Clock: 65.000 MHz
  1024x768@70Hz 4:3 HorFreq: 56500 Hz Clock: 75.000 MHz
  1024x768@75Hz 4:3 HorFreq: 60000 Hz Clock: 78.750 MHz
  1280x1024@75Hz 5:4 HorFreq: 80000 Hz Clock: 135.000 MHz
Standard timings supported:
  1920x1080@60Hz 16:9
  1680x1050@60Hz 16:10 HorFreq: 64700 Hz Clock: 119.000 MHz
  1440x900@60Hz 16:10 HorFreq: 55500 Hz Clock: 88.750 MHz
  1280x1024@60Hz 5:4 HorFreq: 64000 Hz Clock: 108.000 MHz
  1280x960@60Hz 4:3 HorFreq: 60000 Hz Clock: 108.000 MHz
  1280x720@60Hz 16:9
Detailed mode: Clock 148.500 MHz, 476 mm x 268 mm
               1920 2008 2052 2200 hborder 0
               1080 1084 1089 1125 vborder 0
               +hsync +vsync 
               VertFreq: 60 Hz, HorFreq: 67500 Hz
Detailed mode: Clock 174.500 MHz, 476 mm x 268 mm
               1920 1968 2000 2080 hborder 0
               1080 1083 1088 1119 vborder 0
               +hsync -vsync 
               VertFreq: 74 Hz, HorFreq: 83894 Hz
Monitor name: 22V2WG5
Monitor ranges (GTF): 48-76Hz V, 30-85kHz H, max dotclock 180MHz
Has 1 extension blocks
Checksum: 0xf2 (valid)

CTA extension block
Extension version: 3
37 bytes of CTA data
  Video data block
    VIC  16 1920x1080@60Hz 16:9  HorFreq: 67500 Hz Clock: 148.500 MHz
    VIC  31 1920x1080@50Hz 16:9  HorFreq: 56250 Hz Clock: 148.500 MHz
    VIC   5 1920x1080i@60Hz 16:9  HorFreq: 33750 Hz Clock: 74.250 MHz
    VIC  20 1920x1080i@50Hz 16:9  HorFreq: 28125 Hz Clock: 74.250 MHz
    VIC   4 1280x720@60Hz 16:9  HorFreq: 45000 Hz Clock: 74.250 MHz
    VIC  19 1280x720@50Hz 16:9  HorFreq: 37500 Hz Clock: 74.250 MHz
    VIC   3 720x480@60Hz 16:9  HorFreq: 31469 Hz Clock: 27.000 MHz
    VIC  18 720x576@50Hz 16:9  HorFreq: 31250 Hz Clock: 27.000 MHz
    VIC   2 720x480@60Hz 4:3  HorFreq: 31469 Hz Clock: 27.000 MHz
    VIC  17 720x576@50Hz 4:3  HorFreq: 31250 Hz Clock: 27.000 MHz
    VIC   1 640x480@60Hz 4:3  HorFreq: 31469 Hz Clock: 25.175 MHz
  Audio data block
    Linear PCM, max channels 2
      Supported sample rates (kHz): 48 44.1 32
      Supported sample sizes (bits): 24 20 16
  Speaker allocation data block
    Speaker map:
      FL/FR - Front Left/Right
  Vendor-specific data block, OUI 000c03 (HDMI)
    Source physical address 1.0.0.0
    Maximum TMDS clock: 300MHz
  Vendor-specific data block, OUI 00001a
Underscans PC formats by default
Basic audio support
Supports YCbCr 4:4:4
Supports YCbCr 4:2:2
1 native detailed modes
Detailed mode: Clock 27.000 MHz, 476 mm x 268 mm
                720  736  798  858 hborder 0
                480  489  495  525 vborder 0
               -hsync -vsync 
               VertFreq: 59 Hz, HorFreq: 31468 Hz
Detailed mode: Clock 74.250 MHz, 476 mm x 268 mm
               1280 1390 1430 1650 hborder 0
                720  725  730  750 vborder 0
               +hsync +vsync 
               VertFreq: 60 Hz, HorFreq: 45000 Hz
Detailed mode: Clock 27.000 MHz, 476 mm x 268 mm
                720  736  798  858 hborder 0
                480  489  495  525 vborder 0
               -hsync -vsync 
               VertFreq: 59 Hz, HorFreq: 31468 Hz
Detailed mode: Clock 27.000 MHz, 476 mm x 268 mm
                720  732  796  864 hborder 0
                576  581  586  625 vborder 0
               -hsync -vsync 
               VertFreq: 50 Hz, HorFreq: 31250 Hz
Checksum: 0x0 (valid)

One or more of the timings is out of range of the Monitor Ranges:
  Vertical Freq: 50 - 75 Hz
  Horizontal Freq: 28125 - 83894 Hz
  Maximum Clock: 174.500 MHz
