
EDID (hex):
00ffffffffffff000610219248500202
291301038040287828fe85a3574a9c25
13505400000001010101010101010101
010101010101bc1b00a0502017303020
360081912100001ab06800a0a0402e60
3020360081912100001a000000ff0043
5939343130374d584d500a00000000fc
0043696e656d612048440a00000001a4
40010300000000c84801a500a5000102
031919a8000000000000400000000000
00000000000000000000000000000000
00000000000000000000000000000000
00000000000000000000000000000000
00000000000000000000000000000000
00000000000000000000000000000000
00000000000000000000000000000041

edid-decode (hex):

00 ff ff ff ff ff ff 00 06 10 21 92 48 50 02 02
29 13 01 03 80 40 28 78 28 fe 85 a3 57 4a 9c 25
13 50 54 00 00 00 01 01 01 01 01 01 01 01 01 01
01 01 01 01 01 01 bc 1b 00 a0 50 20 17 30 30 20
36 00 81 91 21 00 00 1a b0 68 00 a0 a0 40 2e 60
30 20 36 00 81 91 21 00 00 1a 00 00 00 ff 00 43
59 39 34 31 30 37 4d 58 4d 50 0a 00 00 00 00 fc
00 43 69 6e 65 6d 61 20 48 44 0a 00 00 00 01 a4

40 01 03 00 00 00 00 c8 48 01 a5 00 a5 00 01 02
03 19 19 a8 00 00 00 00 00 00 40 00 00 00 00 00
00 00 00 00 00 00 00 00 00 00 00 00 00 00 00 00
00 00 00 00 00 00 00 00 00 00 00 00 00 00 00 00
00 00 00 00 00 00 00 00 00 00 00 00 00 00 00 00
00 00 00 00 00 00 00 00 00 00 00 00 00 00 00 00
00 00 00 00 00 00 00 00 00 00 00 00 00 00 00 00
00 00 00 00 00 00 00 00 00 00 00 00 00 00 00 41

----------------

Block 0, Base EDID:
  EDID Structure Version & Revision: 1.3
  Vendor & Product Identification:
    Manufacturer: APP
    Model: 37409
    Serial Number: 33706056
    Made in: week 41 of 2009
  Basic Display Parameters & Features:
    Digital display
    Maximum image size: 64 cm x 40 cm
    Gamma: 2.20
    DPMS levels: Off
    RGB color display
  Color Characteristics:
    Red  : 0.6396, 0.3427
    Green: 0.2919, 0.6113
    Blue : 0.1464, 0.0742
    White: 0.3134, 0.3291
  Established Timings I & II: none
  Standard Timings: none
  Detailed Timing Descriptors:
    DTD 1:  1280x800    59.909545 Hz  16:10    49.306 kHz     71.000000 MHz (641 mm x 401 mm)
                 Hfront   48 Hsync  32 Hback   80 Hpol P
                 Vfront    3 Vsync   6 Vback   14 Vpol N
    DTD 2:  2560x1600   59.859910 Hz  16:10    98.529 kHz    268.000000 MHz (641 mm x 401 mm)
                 Hfront   48 Hsync  32 Hback   80 Hpol P
                 Vfront    3 Vsync   6 Vback   37 Vpol N
    Display Product Serial Number: 'CY94107MXMP'
    Display Product Name: 'Cinema HD'
  Extension blocks: 1
Checksum: 0xa4

----------------

Block 1, Display Information Extension Block:
  Version: 1
  Digital Interface:
    Supported Digital Interface: DVI Dual Link - High Resolution
    Data Enable Signal Usage Available
    Data Enable Signal High
    Edge of Shift Clock: Not specified
    HDCP is supported
    Digital Receivers do not support Double Clocking of Input Data
    Packetized Digital Video is not supported
    Data Formats: 48-Bit MSB-Aligned RGB (Dual Link - High Resolution)
    Minimum Pixel Clock Frequency Per Link: 1 MHz
    Maximum Pixel Clock Frequency Per Link: 165 MHz
    Crossover Frequency: 165 MHz
  Display Device:
    Sub-Pixel Layout: RGB
    Sub-Pixel Configuration: Stripe
    Sub-Pixel Shape: Rectangular
    Horizontal Dot/Pixel Pitch: 0.25 mm
    Vertical Dot/Pixel Pitch: 0.25 mm
    Display Device has a Fixed Pixel Format
    View Direction: Direct
    Display Device uses non-transparent background
    Physical Implementation: Desktop or personal display
    Monitor/display does not support DDC/CI
  Display Capabities & Feature Support Set:
    Legacy Modes: Not all VGA/DOS Legacy Timing Modes are supported
    Stereo Video: No direct stereo
    Scaler On Board: No
    Image Centering: No
    Conditional Update: No
    Interlaced Video: No
    Frame Lock: No
    Frame Rate Conversion: Not supported
    Vertical Frequency: Not available
    Horizontal Frequency: Not available
    Display/Scan Orientation Definition Type: Fixed Orientation
    Screen Orientation: Landscape
    Zero Pixel Location: Upper Left
    Scan Direction: Not defined
    Standalone Projector: No
    Default Color/Luminance Decoding: Not defined
    Preferred Color/Luminance Decoder: Uses Default Decoding
    Color/Luminance Decoding Capabilities: None
    Dithering: No
    Supported Color Bit-Depth of Sub-Channel 0 (Blue): No Information
    Supported Color Bit-Depth of Sub-Channel 1 (Green): No Information
    Supported Color Bit-Depth of Sub-Channel 2 (Red): No Information
    Supported Color Bit-Depth of Sub-Channel 0 (Cb/Pb): No Information
    Supported Color Bit-Depth of Sub-Channel 1 (Y): No Information
    Supported Color Bit-Depth of Sub-Channel 2 (Cr/Pr): No Information
    Aspect Ratio Conversion Modes: None
  Display Transfer Characteristics - Gamma:
    No Display Transfer Characteristics
Checksum: 0x41
