
EDID (hex):
00ffffffffffff0030ae104000000000
2d120103801a1078ea85c594574f8a27
20505400000001010101010101010101
010101010101ee1a0080502010301030
130005a310000019d01700c650201930
3020360005a3100000190000000f0081
0a3c810a321601004ca35731000000fe
004c544e31323141543033303031003d

edid-decode (hex):

00 ff ff ff ff ff ff 00 30 ae 10 40 00 00 00 00
2d 12 01 03 80 1a 10 78 ea 85 c5 94 57 4f 8a 27
20 50 54 00 00 00 01 01 01 01 01 01 01 01 01 01
01 01 01 01 01 01 ee 1a 00 80 50 20 10 30 10 30
13 00 05 a3 10 00 00 19 d0 17 00 c6 50 20 19 30
30 20 36 00 05 a3 10 00 00 19 00 00 00 0f 00 81
0a 3c 81 0a 32 16 01 00 4c a3 57 31 00 00 00 fe
00 4c 54 4e 31 32 31 41 54 30 33 30 30 31 00 3d

----------------

Block 0, Base EDID:
  EDID Structure Version & Revision: 1.3
  Vendor & Product Identification:
    Manufacturer: LEN
    Model: 16400
    Made in: week 45 of 2008
  Basic Display Parameters & Features:
    Digital display
    Maximum image size: 26 cm x 16 cm
    Gamma: 2.20
    DPMS levels: Standby Suspend Off
    RGB color display
    First detailed timing is the preferred timing
  Color Characteristics:
    Red  : 0.5800, 0.3398
    Green: 0.3095, 0.5400
    Blue : 0.1552, 0.1250
    White: 0.3134, 0.3291
  Established Timings I & II: none
  Standard Timings: none
  Detailed Timing Descriptors:
    DTD 1:  1280x800    60.003760 Hz  16:10    48.963 kHz     68.940000 MHz (261 mm x 163 mm)
                 Hfront   16 Hsync  48 Hback   64 Hpol N
                 Vfront    1 Vsync   3 Vback   12 Vpol N
    DTD 2:  1280x800    49.993849 Hz  16:10    41.245 kHz     60.960000 MHz (261 mm x 163 mm)
                 Hfront   48 Hsync  32 Hback  118 Hpol N
                 Vfront    3 Vsync   6 Vback   16 Vpol N
    Manufacturer-Specified Display Descriptor (0x0f): 00 0f 00 81 0a 3c 81 0a 32 16 01 00 4c a3 57 31 '.....<..2...L.W1'
    Alphanumeric Data String: 'LTN121AT03001'
Checksum: 0x3d
