
EDID (hex):
00ffffffffffff000e6f031400000000
001e0104b51e137803ed52ae5043b025
0d4f5400000001010101010101010101
01010101010180e800a0f06050903020
36002ebd10000018000000fd00303c95
953c010a202020202020000000fe0043
534f542054330a2020202020000000fe
004d4e453030375a41312d320a20011b
02030f00e3058000e60605016a6a2400
00000000000000000000000000000000
00000000000000000000000000000000
00000000000000000000000000000000
00000000000000000000000000000000
00000000000000000000000000000000
00000000000000000000000000000000
0000000000000000000000000000009a

edid-decode (hex):

00 ff ff ff ff ff ff 00 0e 6f 03 14 00 00 00 00
00 1e 01 04 b5 1e 13 78 03 ed 52 ae 50 43 b0 25
0d 4f 54 00 00 00 01 01 01 01 01 01 01 01 01 01
01 01 01 01 01 01 80 e8 00 a0 f0 60 50 90 30 20
36 00 2e bd 10 00 00 18 00 00 00 fd 00 30 3c 95
95 3c 01 0a 20 20 20 20 20 20 00 00 00 fe 00 43
53 4f 54 20 54 33 0a 20 20 20 20 20 00 00 00 fe
00 4d 4e 45 30 30 37 5a 41 31 2d 32 0a 20 01 1b

02 03 0f 00 e3 05 80 00 e6 06 05 01 6a 6a 24 00
00 00 00 00 00 00 00 00 00 00 00 00 00 00 00 00
00 00 00 00 00 00 00 00 00 00 00 00 00 00 00 00
00 00 00 00 00 00 00 00 00 00 00 00 00 00 00 00
00 00 00 00 00 00 00 00 00 00 00 00 00 00 00 00
00 00 00 00 00 00 00 00 00 00 00 00 00 00 00 00
00 00 00 00 00 00 00 00 00 00 00 00 00 00 00 00
00 00 00 00 00 00 00 00 00 00 00 00 00 00 00 9a

----------------

Block 0, Base EDID:
  EDID Structure Version & Revision: 1.4
  Vendor & Product Identification:
    Manufacturer: CSO
    Model: 5123
    Made in: 2020
  Basic Display Parameters & Features:
    Digital display
    Bits per primary color channel: 10
    DisplayPort interface
    Maximum image size: 30 cm x 19 cm
    Gamma: 2.20
    Supported color formats: RGB 4:4:4
    First detailed timing includes the native pixel format and preferred refresh rate
    Display is continuous frequency
  Color Characteristics:
    Red  : 0.6826, 0.3144
    Green: 0.2646, 0.6884
    Blue : 0.1455, 0.0517
    White: 0.3085, 0.3300
  Established Timings I & II: none
  Standard Timings: none
  Detailed Timing Descriptors:
    DTD 1:  3840x2400   60.000000 Hz  16:10   148.800 kHz    595.200000 MHz (302 mm x 189 mm)
                 Hfront   48 Hsync  32 Hback   80 Hpol N
                 Vfront    3 Vsync   6 Vback   71 Vpol N
    Display Range Limits:
      Monitor ranges (Bare Limits): 48-60 Hz V, 149-149 kHz H, max dotclock 600 MHz
    Alphanumeric Data String: 'CSOT T3'
    Alphanumeric Data String: 'MNE007ZA1-2'
  Extension blocks: 1
Checksum: 0x1b

----------------

Block 1, CTA-861 Extension Block:
  Revision: 3
  Native detailed modes: 0
  Colorimetry Data Block:
    BT2020RGB
  HDR Static Metadata Data Block:
    Electro optical transfer functions:
      Traditional gamma - SDR luminance range
      SMPTE ST2084
    Supported static metadata descriptors:
      Static metadata type 1
    Desired content max luminance: 106 (496.743 cd/m^2)
    Desired content max frame-average luminance: 106 (496.743 cd/m^2)
    Desired content min luminance: 36 (0.099 cd/m^2)
Checksum: 0x9a  Unused space in Extension Block: 112 bytes
