
EDID (hex):
00ffffffffffff002034601501010101
1920010380221478eade50a3544c9926
0f50542108008180a940d1c08b000101
010101010101023a801871382d40582c
450059c31000001e000000ff00000a20
20202020202020202020000000fc0047
53313536320a202020202020000000fd
0031411e5111000a202020202020017c
020300b1402067030c001000382d80e3
050301023a801871382d40582c450006
442100001e011d007251d01e206e2855
0006442100001e8c0ad08a20e02d1010
3e960006442100001800000000000000
00000000000000000000000000000000
00000000000000000000000000000000
00000000000000000000000000000060

edid-decode (hex):

00 ff ff ff ff ff ff 00 20 34 60 15 01 01 01 01
19 20 01 03 80 22 14 78 ea de 50 a3 54 4c 99 26
0f 50 54 21 08 00 81 80 a9 40 d1 c0 8b 00 01 01
01 01 01 01 01 01 02 3a 80 18 71 38 2d 40 58 2c
45 00 59 c3 10 00 00 1e 00 00 00 ff 00 00 0a 20
20 20 20 20 20 20 20 20 20 20 00 00 00 fc 00 47
53 31 35 36 32 0a 20 20 20 20 20 20 00 00 00 fd
00 31 41 1e 51 11 00 0a 20 20 20 20 20 20 01 7c

02 03 00 b1 40 20 67 03 0c 00 10 00 38 2d 80 e3
05 03 01 02 3a 80 18 71 38 2d 40 58 2c 45 00 06
44 21 00 00 1e 01 1d 00 72 51 d0 1e 20 6e 28 55
00 06 44 21 00 00 1e 8c 0a d0 8a 20 e0 2d 10 10
3e 96 00 06 44 21 00 00 18 00 00 00 00 00 00 00
00 00 00 00 00 00 00 00 00 00 00 00 00 00 00 00
00 00 00 00 00 00 00 00 00 00 00 00 00 00 00 00
00 00 00 00 00 00 00 00 00 00 00 00 00 00 00 60

----------------

Block 0, Base EDID:
  EDID Structure Version & Revision: 1.3
  Vendor & Product Identification:
    Manufacturer: HAT
    Model: 5472
    Serial Number: 16843009
    Made in: week 25 of 2022
  Basic Display Parameters & Features:
    Digital display
    Maximum image size: 34 cm x 20 cm
    Gamma: 2.20
    DPMS levels: Standby Suspend Off
    RGB color display
    First detailed timing is the preferred timing
  Color Characteristics:
    Red  : 0.6396, 0.3291
    Green: 0.2998, 0.5996
    Blue : 0.1494, 0.0595
    White: 0.3125, 0.3281
  Established Timings I & II:
    DMT 0x04:   640x480    59.940476 Hz   4:3     31.469 kHz     25.175000 MHz
    DMT 0x09:   800x600    60.316541 Hz   4:3     37.879 kHz     40.000000 MHz
    DMT 0x10:  1024x768    60.003840 Hz   4:3     48.363 kHz     65.000000 MHz
  Standard Timings:
    DMT 0x23:  1280x1024   60.019740 Hz   5:4     63.981 kHz    108.000000 MHz
    DMT 0x33:  1600x1200   60.000000 Hz   4:3     75.000 kHz    162.000000 MHz
    DMT 0x52:  1920x1080   60.000000 Hz  16:9     67.500 kHz    148.500000 MHz
    GTF     :  1360x850    60.000254 Hz  16:10    52.800 kHz     94.618000 MHz
  Detailed Timing Descriptors:
    DTD 1:  1920x1080   60.000000 Hz  16:9     67.500 kHz    148.500000 MHz (345 mm x 195 mm)
                 Hfront   88 Hsync  44 Hback  148 Hpol P
                 Vfront    4 Vsync   5 Vback   36 Vpol P
    Display Product Serial Number: ''
    Display Product Name: 'GS1562'
    Display Range Limits:
      Monitor ranges (GTF): 49-65 Hz V, 30-81 kHz H, max dotclock 170 MHz
  Extension blocks: 1
Checksum: 0x7c

----------------

Block 1, CTA-861 Extension Block:
  Revision: 3
Checksum: 0x60


