
EDID (hex):
00ffffffffffff0006af471100000000
010f0103801e13780a87c594574f8c27
25505400000001010101010101010101
0101010101013822a0a050840c303020
360030be100000180000000f00000000
00000000000000000020000000fe0041
554f0a202020202020202020000000fe
004231343150573031205631200a006f

edid-decode (hex):

00 ff ff ff ff ff ff 00 06 af 47 11 00 00 00 00
01 0f 01 03 80 1e 13 78 0a 87 c5 94 57 4f 8c 27
25 50 54 00 00 00 01 01 01 01 01 01 01 01 01 01
01 01 01 01 01 01 38 22 a0 a0 50 84 0c 30 30 20
36 00 30 be 10 00 00 18 00 00 00 0f 00 00 00 00
00 00 00 00 00 00 00 00 00 20 00 00 00 fe 00 41
55 4f 0a 20 20 20 20 20 20 20 20 20 00 00 00 fe
00 42 31 34 31 50 57 30 31 20 56 31 20 0a 00 6f

----------------

Block 0, Base EDID:
  EDID Structure Version & Revision: 1.3
  Vendor & Product Identification:
    Manufacturer: AUO
    Model: 4423
    Made in: week 1 of 2005
  Basic Display Parameters & Features:
    Digital display
    Maximum image size: 30 cm x 19 cm
    Gamma: 2.20
    RGB color display
    First detailed timing is the preferred timing
  Color Characteristics:
    Red  : 0.5800, 0.3398
    Green: 0.3095, 0.5498
    Blue : 0.1552, 0.1445
    White: 0.3134, 0.3291
  Established Timings I & II: none
  Standard Timings: none
  Detailed Timing Descriptors:
    DTD 1:  1440x900    60.032895 Hz  16:10    54.750 kHz     87.600000 MHz (304 mm x 190 mm)
                 Hfront   48 Hsync  32 Hback   80 Hpol N
                 Vfront    3 Vsync   6 Vback    3 Vpol N
    Manufacturer-Specified Display Descriptor (0x0f): 00 0f 00 00 00 00 00 00 00 00 00 00 00 00 00 20 '............... '
    Alphanumeric Data String: 'AUO'
    Alphanumeric Data String: 'B141PW01 V1 '
Checksum: 0x6f
