
EDID (hex):
00ffffffffffff000dae651300000000
34180104a51d117802ce85a3574e9d26
12505400000001010101010101010101
010101010101363680a0703820402e1e
240025a51000001a242480a070382040
2e1e240025a51000001a000000000000
00000000000000000000000000000002
000c2bff123caf161132af0000000008

edid-decode (hex):

00 ff ff ff ff ff ff 00 0d ae 65 13 00 00 00 00
34 18 01 04 a5 1d 11 78 02 ce 85 a3 57 4e 9d 26
12 50 54 00 00 00 01 01 01 01 01 01 01 01 01 01
01 01 01 01 01 01 36 36 80 a0 70 38 20 40 2e 1e
24 00 25 a5 10 00 00 1a 24 24 80 a0 70 38 20 40
2e 1e 24 00 25 a5 10 00 00 1a 00 00 00 00 00 00
00 00 00 00 00 00 00 00 00 00 00 00 00 00 00 02
00 0c 2b ff 12 3c af 16 11 32 af 00 00 00 00 08

----------------

Block 0, Base EDID:
  EDID Structure Version & Revision: 1.4
  Vendor & Product Identification:
    Manufacturer: CMN
    Model: 4965
    Made in: week 52 of 2014
  Basic Display Parameters & Features:
    Digital display
    Bits per primary color channel: 8
    DisplayPort interface
    Maximum image size: 29 cm x 17 cm
    Gamma: 2.20
    Supported color formats: RGB 4:4:4
    First detailed timing includes the native pixel format and preferred refresh rate
  Color Characteristics:
    Red  : 0.6396, 0.3398
    Green: 0.3076, 0.6152
    Blue : 0.1503, 0.0703
    White: 0.3134, 0.3291
  Established Timings I & II: none
  Standard Timings: none
  Detailed Timing Descriptors:
    DTD 1:  1920x1080   60.001038 Hz  16:9     66.721 kHz    138.780000 MHz (293 mm x 165 mm)
                 Hfront   46 Hsync  30 Hback   84 Hpol P
                 Vfront    2 Vsync   4 Vback   26 Vpol N
    DTD 2:  1920x1080   40.000692 Hz  16:9     44.481 kHz     92.520000 MHz (293 mm x 165 mm)
                 Hfront   46 Hsync  30 Hback   84 Hpol P
                 Vfront    2 Vsync   4 Vback   26 Vpol N
    Empty Descriptor
    Manufacturer-Specified Display Descriptor (0x02): 00 02 00 0c 2b ff 12 3c af 16 11 32 af 00 00 00 '....+..<...2....'
Checksum: 0x08
