
EDID (hex):
00ffffffffffff0030aea86600000000
2c1e010380351e782a3135a9544c9f25
0e5054afef00d100d1c0b30095008180
010101010101565e00a0a0a029503020
35000e282100001a000000fc00513234
682d31300a2020202020000000fd0030
4b1e701e000a202020202020000000ff
0055354844353843350a20202020011a
020325f049101f041312110302012309
07078301000065030c001000681a0000
0101304be6662156aa51001e30468f33
000e282100001e2a4480a07038274030
2035000e282100001a7c2e90a0601a1e
40302036000e282100001ae973006aa0
a03450422068000e282100001a000000
00000000000000000000000000000063

Extracted contents:
header:          00 ff ff ff ff ff ff 00
serial number:   30 ae a8 66 00 00 00 00 2c 1e
version:         01 03
basic params:    80 35 1e 78 2a
chroma info:     31 35 a9 54 4c 9f 25 0e 50 54
established:     af ef 00
standard:        d1 00 d1 c0 b3 00 95 00 81 80 01 01 01 01 01 01
descriptor 1:    56 5e 00 a0 a0 a0 29 50 30 20 35 00 0e 28 21 00 00 1a
descriptor 2:    00 00 00 fc 00 51 32 34 68 2d 31 30 0a 20 20 20 20 20
descriptor 3:    00 00 00 fd 00 30 4b 1e 70 1e 00 0a 20 20 20 20 20 20
descriptor 4:    00 00 00 ff 00 55 35 48 44 35 38 43 35 0a 20 20 20 20
extensions:      01
checksum:        1a

EDID version: 1.3
Manufacturer: LEN Model 66a8 Serial Number --
Made in week 44 of 2020
Digital display
Maximum image size: 53 cm x 30 cm
Gamma: 2.20
DPMS levels: Off
RGB color display
First detailed timing is preferred timing
Display x,y Chromaticity:
  Red:   0.6601, 0.3310
  Green: 0.2968, 0.6220
  Blue:  0.1445, 0.0576
  White: 0.3134, 0.3291
Established timings supported:
  720x400@70Hz 9:5 HorFreq: 31469 Hz Clock: 28.320 MHz
  640x480@60Hz 4:3 HorFreq: 31469 Hz Clock: 25.175 MHz
  640x480@72Hz 4:3 HorFreq: 37900 Hz Clock: 31.500 MHz
  640x480@75Hz 4:3 HorFreq: 37500 Hz Clock: 31.500 MHz
  800x600@56Hz 4:3 HorFreq: 35200 Hz Clock: 36.000 MHz
  800x600@60Hz 4:3 HorFreq: 37900 Hz Clock: 40.000 MHz
  800x600@72Hz 4:3 HorFreq: 48100 Hz Clock: 50.000 MHz
  800x600@75Hz 4:3 HorFreq: 46900 Hz Clock: 49.500 MHz
  832x624@75Hz 4:3 HorFreq: 49726 Hz Clock: 57.284 MHz
  1024x768@60Hz 4:3 HorFreq: 48400 Hz Clock: 65.000 MHz
  1024x768@70Hz 4:3 HorFreq: 56500 Hz Clock: 75.000 MHz
  1024x768@75Hz 4:3 HorFreq: 60000 Hz Clock: 78.750 MHz
  1280x1024@75Hz 5:4 HorFreq: 80000 Hz Clock: 135.000 MHz
Standard timings supported:
  1920x1200@60Hz 16:10 HorFreq: 74000 Hz Clock: 154.000 MHz
  1920x1080@60Hz 16:9
  1680x1050@60Hz 16:10 HorFreq: 64700 Hz Clock: 119.000 MHz
  1440x900@60Hz 16:10 HorFreq: 55500 Hz Clock: 88.750 MHz
  1280x1024@60Hz 5:4 HorFreq: 64000 Hz Clock: 108.000 MHz
Detailed mode: Clock 241.500 MHz, 526 mm x 296 mm
               2560 2608 2640 2720 hborder 0
               1440 1443 1448 1481 vborder 0
               +hsync -vsync 
               VertFreq: 59 Hz, HorFreq: 88786 Hz
Monitor name: Q24h-10
Monitor ranges (GTF): 48-75Hz V, 30-112kHz H, max dotclock 300MHz
Serial number: --
Has 1 extension blocks
Checksum: 0x1a (valid)

CTA extension block
Extension version: 3
33 bytes of CTA data
  Video data block
    VIC  16 1920x1080@60Hz 16:9  HorFreq: 67500 Hz Clock: 148.500 MHz
    VIC  31 1920x1080@50Hz 16:9  HorFreq: 56250 Hz Clock: 148.500 MHz
    VIC   4 1280x720@60Hz 16:9  HorFreq: 45000 Hz Clock: 74.250 MHz
    VIC  19 1280x720@50Hz 16:9  HorFreq: 37500 Hz Clock: 74.250 MHz
    VIC  18 720x576@50Hz 16:9  HorFreq: 31250 Hz Clock: 27.000 MHz
    VIC  17 720x576@50Hz 4:3  HorFreq: 31250 Hz Clock: 27.000 MHz
    VIC   3 720x480@60Hz 16:9  HorFreq: 31469 Hz Clock: 27.000 MHz
    VIC   2 720x480@60Hz 4:3  HorFreq: 31469 Hz Clock: 27.000 MHz
    VIC   1 640x480@60Hz 4:3  HorFreq: 31469 Hz Clock: 25.175 MHz
  Audio data block
    Linear PCM, max channels 2
      Supported sample rates (kHz): 48 44.1 32
      Supported sample sizes (bits): 24 20 16
  Speaker allocation data block
    Speaker map:
      FL/FR - Front Left/Right
  Vendor-specific data block, OUI 000c03 (HDMI)
    Source physical address 1.0.0.0
  Vendor-specific data block, OUI 00001a
Underscans PC formats by default
Basic audio support
Supports YCbCr 4:4:4
Supports YCbCr 4:2:2
0 native detailed modes
Detailed mode: Clock 85.500 MHz, 526 mm x 296 mm
               1366 1436 1579 1792 hborder 0
                768  771  774  798 vborder 0
               +hsync +vsync 
               VertFreq: 59 Hz, HorFreq: 47712 Hz
Detailed mode: Clock 174.500 MHz, 526 mm x 296 mm
               1920 1968 2000 2080 hborder 0
               1080 1083 1088 1119 vborder 0
               +hsync -vsync 
               VertFreq: 74 Hz, HorFreq: 83894 Hz
Detailed mode: Clock 119.000 MHz, 526 mm x 296 mm
               1680 1728 1760 1840 hborder 0
               1050 1053 1059 1080 vborder 0
               +hsync -vsync 
               VertFreq: 59 Hz, HorFreq: 64673 Hz
Detailed mode: Clock 296.730 MHz, 526 mm x 296 mm
               2560 2626 2658 2666 hborder 0
               1440 1446 1454 1492 vborder 0
               +hsync -vsync 
               VertFreq: 74 Hz, HorFreq: 111301 Hz
Checksum: 0x63 (valid)



