
EDID (hex):
00ffffffffffff0009e5490600000000
01190104952213780a4950a458519c26
0b505400000001010101010101010101
010101010101993680a0703828403020
360058c21000001aae2b80a070382840
3020360058c21000001a000000fe0033
4d524d39804e56313541323000000000
0000411196000000000a010a2020009b

edid-decode (hex):

00 ff ff ff ff ff ff 00 09 e5 49 06 00 00 00 00
01 19 01 04 95 22 13 78 0a 49 50 a4 58 51 9c 26
0b 50 54 00 00 00 01 01 01 01 01 01 01 01 01 01
01 01 01 01 01 01 99 36 80 a0 70 38 28 40 30 20
36 00 58 c2 10 00 00 1a ae 2b 80 a0 70 38 28 40
30 20 36 00 58 c2 10 00 00 1a 00 00 00 fe 00 33
4d 52 4d 39 80 4e 56 31 35 41 32 30 00 00 00 00
00 00 41 11 96 00 00 00 00 0a 01 0a 20 20 00 9b

----------------

Block 0, Base EDID:
  EDID Structure Version & Revision: 1.4
  Vendor & Product Identification:
    Manufacturer: BOE
    Model: 1609
    Made in: week 1 of 2015
  Basic Display Parameters & Features:
    Digital display
    Bits per primary color channel: 6
    DisplayPort interface
    Maximum image size: 34 cm x 19 cm
    Gamma: 2.20
    Supported color formats: RGB 4:4:4, YCrCb 4:4:4
    First detailed timing includes the native pixel format and preferred refresh rate
  Color Characteristics:
    Red  : 0.6416, 0.3437
    Green: 0.3183, 0.6103
    Blue : 0.1494, 0.0439
    White: 0.3125, 0.3281
  Established Timings I & II: none
  Standard Timings: none
  Detailed Timing Descriptors:
    DTD 1:  1920x1080   59.997424 Hz  16:9     67.197 kHz    139.770000 MHz (344 mm x 194 mm)
                 Hfront   48 Hsync  32 Hback   80 Hpol P
                 Vfront    3 Vsync   6 Vback   31 Vpol N
    DTD 2:  1920x1080   47.999657 Hz  16:9     53.760 kHz    111.820000 MHz (344 mm x 194 mm)
                 Hfront   48 Hsync  32 Hback   80 Hpol P
                 Vfront    3 Vsync   6 Vback   31 Vpol N
    Alphanumeric Data String: '3MRM9'
    Manufacturer-Specified Display Descriptor (0x00): 00 00 00 00 41 11 96 00 00 00 00 0a 01 0a 20 20 '....A.........  '
Checksum: 0x9b
