
EDID (hex):
00ffffffffffff0015a1e90189c59003
2714010368291778ea3d85a6564a9a24
125054bfee0081c08100010101010101
010101010101662156aa51001e30468f
33009ae61000001e000000fc00453139
324851560a2020202020000000fd0038
4c1f5312000a202020202020000000ff
005133323043303037343031390a008d

edid-decode (hex):

00 ff ff ff ff ff ff 00 15 a1 e9 01 89 c5 90 03
27 14 01 03 68 29 17 78 ea 3d 85 a6 56 4a 9a 24
12 50 54 bf ee 00 81 c0 81 00 01 01 01 01 01 01
01 01 01 01 01 01 66 21 56 aa 51 00 1e 30 46 8f
33 00 9a e6 10 00 00 1e 00 00 00 fc 00 45 31 39
32 48 51 56 0a 20 20 20 20 20 00 00 00 fd 00 38
4c 1f 53 12 00 0a 20 20 20 20 20 20 00 00 00 ff
00 51 33 32 30 43 30 30 37 34 30 31 39 0a 00 8d

----------------

Block 0, Base EDID:
  EDID Structure Version & Revision: 1.3
  Vendor & Product Identification:
    Manufacturer: EMA
    Model: 489
    Serial Number: 59819401
    Made in: week 39 of 2010
  Basic Display Parameters & Features:
    Analog display
    Signal Level Standard: 0.700 : 0.000 : 0.700 V p-p
    Blank level equals black level
    Sync: Separate
    Maximum image size: 41 cm x 23 cm
    Gamma: 2.20
    DPMS levels: Standby Suspend Off
    RGB color display
    First detailed timing is the preferred timing
  Color Characteristics:
    Red  : 0.6484, 0.3388
    Green: 0.2919, 0.6025
    Blue : 0.1425, 0.0703
    White: 0.3134, 0.3291
  Established Timings I & II:
    IBM     :   720x400    70.081663 Hz   9:5     31.467 kHz     28.320000 MHz
    DMT 0x04:   640x480    59.940476 Hz   4:3     31.469 kHz     25.175000 MHz
    Apple   :   640x480    66.666667 Hz   4:3     35.000 kHz     30.240000 MHz
    DMT 0x05:   640x480    72.808802 Hz   4:3     37.861 kHz     31.500000 MHz
    DMT 0x06:   640x480    75.000000 Hz   4:3     37.500 kHz     31.500000 MHz
    DMT 0x08:   800x600    56.250000 Hz   4:3     35.156 kHz     36.000000 MHz
    DMT 0x09:   800x600    60.316541 Hz   4:3     37.879 kHz     40.000000 MHz
    DMT 0x0a:   800x600    72.187572 Hz   4:3     48.077 kHz     50.000000 MHz
    DMT 0x0b:   800x600    75.000000 Hz   4:3     46.875 kHz     49.500000 MHz
    Apple   :   832x624    74.551266 Hz   4:3     49.726 kHz     57.284000 MHz
    DMT 0x10:  1024x768    60.003840 Hz   4:3     48.363 kHz     65.000000 MHz
    DMT 0x11:  1024x768    70.069359 Hz   4:3     56.476 kHz     75.000000 MHz
    DMT 0x12:  1024x768    75.028582 Hz   4:3     60.023 kHz     78.750000 MHz
  Standard Timings:
    DMT 0x55:  1280x720    60.000000 Hz  16:9     45.000 kHz     74.250000 MHz
    DMT 0x1c:  1280x800    59.810326 Hz  16:10    49.702 kHz     83.500000 MHz
  Detailed Timing Descriptors:
    DTD 1:  1366x768    59.789541 Hz 683:384   47.712 kHz     85.500000 MHz (410 mm x 230 mm)
                 Hfront   70 Hsync 143 Hback  213 Hpol P
                 Vfront    3 Vsync   3 Vback   24 Vpol P
    Display Product Name: 'E192HQV'
    Display Range Limits:
      Monitor ranges (GTF): 56-76 Hz V, 31-83 kHz H, max dotclock 180 MHz
    Display Product Serial Number: 'Q320C0074019'
Checksum: 0x8d
