
EDID (hex):
00ffffffffffff004d10ba1400000000
161d0104a52213780ede50a3544c9926
0f505400000001010101010101010101
010101010101ac3780a070383e403020
350058c2100000180000000000000000
00000000000000000000000000fe004d
57503154814c513135364d3100000000
0002410332001200000a010a202000d2

Extracted contents:
header:          00 ff ff ff ff ff ff 00
serial number:   4d 10 ba 14 00 00 00 00 16 1d
version:         01 04
basic params:    a5 22 13 78 0e
chroma info:     de 50 a3 54 4c 99 26 0f 50 54
established:     00 00 00
standard:        01 01 01 01 01 01 01 01 01 01 01 01 01 01 01 01
descriptor 1:    ac 37 80 a0 70 38 3e 40 30 20 35 00 58 c2 10 00 00 18
descriptor 2:    00 00 00 00 00 00 00 00 00 00 00 00 00 00 00 00 00 00
descriptor 3:    00 00 00 fe 00 4d 57 50 31 54 81 4c 51 31 35 36 4d 31
descriptor 4:    00 00 00 00 00 02 41 03 32 00 12 00 00 0a 01 0a 20 20
extensions:      00
checksum:        d2

EDID version: 1.4
Manufacturer: SHP Model 14ba Serial Number --
Made in week 22 of 2019
Digital display
8 bits per primary color channel
DisplayPort interface
Maximum image size: 34 cm x 19 cm
Gamma: 2.20
Supported color formats: RGB 4:4:4, YCrCb 4:4:4
Default (sRGB) color space is primary color space
First detailed timing includes the native pixel format and preferred refresh rate
Display x,y Chromaticity:
  Red:   0.6396, 0.3291
  Green: 0.2998, 0.5996
  Blue:  0.1494, 0.0595
  White: 0.3125, 0.3281
Established timings supported:
Standard timings supported:
Detailed mode: Clock 142.520 MHz, 344 mm x 194 mm
               1920 1968 2000 2080 hborder 0
               1080 1083 1088 1142 vborder 0
               -hsync -vsync 
               VertFreq: 59 Hz, HorFreq: 68519 Hz
Manufacturer-specified data, tag 0
ASCII string: MWP1T
Manufacturer-specified data, tag 0
Checksum: 0xd2 (valid)
EDID block does NOT conform to EDID 1.4!
	sRGB is signaled, but the chromaticities do not match
	Missing name descriptor
	Missing monitor ranges
	Detailed block string not properly terminated
