
EDID (hex):
00ffffffffffff000610a89c01010101
05120103801d12780a50859858528e26
25505400000001010101010101010101
010101010101521c008f50202e303020
36001eb3100000180000000100061020
00000000000000000a20000000fe0042
313333455730342056330a20000000fe
00436f6c6f72204c43440a2020200009

Extracted contents:
header:          00 ff ff ff ff ff ff 00
serial number:   06 10 a8 9c 01 01 01 01 05 12
version:         01 03
basic params:    80 1d 12 78 0a
chroma info:     50 85 98 58 52 8e 26 25 50 54
established:     00 00 00
standard:        01 01 01 01 01 01 01 01 01 01 01 01 01 01 01 01
descriptor 1:    52 1c 00 8f 50 20 2e 30 30 20 36 00 1e b3 10 00 00 18
descriptor 2:    00 00 00 01 00 06 10 20 00 00 00 00 00 00 00 00 0a 20
descriptor 3:    00 00 00 fe 00 42 31 33 33 45 57 30 34 20 56 33 0a 20
descriptor 4:    00 00 00 fe 00 43 6f 6c 6f 72 20 4c 43 44 0a 20 20 20
extensions:      00
checksum:        09

EDID version: 1.3
Manufacturer: APP Model 9ca8 Serial Number --
Made in week 5 of 2008
Digital display
Maximum image size: 29 cm x 18 cm
Gamma: 2.20
RGB color display
First detailed timing is preferred timing
Display x,y Chromaticity:
  Red:   0.5947, 0.3447
  Green: 0.3203, 0.5546
  Blue:  0.1503, 0.1445
  White: 0.3134, 0.3291
Established timings supported:
Standard timings supported:
Detailed mode: Clock 72.500 MHz, 286 mm x 179 mm
               1280 1328 1360 1423 hborder 0
                800  803  809  846 vborder 0
               -hsync -vsync 
               VertFreq: 60 Hz, HorFreq: 50948 Hz
Manufacturer-specified data, tag 1
ASCII string: B133EW04 V3
ASCII string: Color LCD
Checksum: 0x9 (valid)
EDID block does NOT conform to EDID 1.3!
	Missing name descriptor
	Missing monitor ranges
