
EDID (hex):
00ffffffffffff004c83414100000000
00180103952213780a71059355578f29
20505400000001010101010101010101
010101010101411c56a0500016303020
250058c2100000190000000f00000000
00000000002052031500000000fe0053
414d53554e470a2020202020000000fe
00313536415433372d5430310a200067

Extracted contents:
header:          00 ff ff ff ff ff ff 00
serial number:   4c 83 41 41 00 00 00 00 00 18
version:         01 03
basic params:    95 22 13 78 0a
chroma info:     71 05 93 55 57 8f 29 20 50 54
established:     00 00 00
standard:        01 01 01 01 01 01 01 01 01 01 01 01 01 01 01 01
descriptor 1:    41 1c 56 a0 50 00 16 30 30 20 25 00 58 c2 10 00 00 19
descriptor 2:    00 00 00 0f 00 00 00 00 00 00 00 00 00 20 52 03 15 00
descriptor 3:    00 00 00 fe 00 53 41 4d 53 55 4e 47 0a 20 20 20 20 20
descriptor 4:    00 00 00 fe 00 31 35 36 41 54 33 37 2d 54 30 31 0a 20
extensions:      00
checksum:        67

Manufacturer: SDC Model 4141 Serial Number --
Made week 0 of 2014
EDID version: 1.3
Digital display
DFP 1.x compatible TMDS
Maximum image size: 34 cm x 19 cm
Gamma: 2.20
Supported color formats: RGB 4:4:4, YCrCb 4:2:2
First detailed timing is preferred timing
Established timings supported:
Standard timings supported:
Detailed mode: Clock 72.330 MHz, 344 mm x 194 mm
               1366 1414 1446 1526 hborder 0
                768  770  775  790 vborder 0
               -hsync -vsync 
Manufacturer-specified data, tag 15
ASCII string: SAMSUNG
ASCII string: 156AT37
Checksum: 0x67 (valid)
EDID block does NOT conform to EDID 1.3!
	Digital display field contains garbage: 14
	Missing name descriptor
	Missing monitor ranges
	Detailed block string not properly terminated
