
EDID (hex):
00ffffffffffff0006102392fbb98002
0710010380311f782efd45a3574a9e25
135054000000d1000101010101010101
010101010101283c80a070b023403020
3600ef361100001a000000ff00324136
30373054575547300a20000000fc0043
696e656d612048440a20202000000000
00000000000000000000000000000178
40010200000000762401a500ffff031a
1aa80100000000004000000000000000
00000000000000000000000000000000
00000000000000000000000000000000
00000000000000000000000000000000
00000000000000000000000000000000
00000000000000000000000000000000
0000000000000000000000000000005f

Extracted contents:
header:          00 ff ff ff ff ff ff 00
serial number:   06 10 23 92 fb b9 80 02 07 10
version:         01 03
basic params:    80 31 1f 78 2e
chroma info:     fd 45 a3 57 4a 9e 25 13 50 54
established:     00 00 00
standard:        d1 00 01 01 01 01 01 01 01 01 01 01 01 01 01 01
descriptor 1:    28 3c 80 a0 70 b0 23 40 30 20 36 00 ef 36 11 00 00 1a
descriptor 2:    00 00 00 ff 00 32 41 36 30 37 30 54 57 55 47 30 0a 20
descriptor 3:    00 00 00 fc 00 43 69 6e 65 6d 61 20 48 44 0a 20 20 20
descriptor 4:    00 00 00 00 00 00 00 00 00 00 00 00 00 00 00 00 00 00
extensions:      01
checksum:        78

EDID version: 1.3
Manufacturer: APP Model 9223 Serial Number --
Made in week 7 of 2006
Digital display
Maximum image size: 49 cm x 31 cm
Gamma: 2.20
DPMS levels: Off
RGB color display
Default (sRGB) color space is primary color space
First detailed timing is preferred timing
Display x,y Chromaticity:
  Red:   0.6396, 0.3427
  Green: 0.2919, 0.6181
  Blue:  0.1455, 0.0742
  White: 0.3134, 0.3291
Established timings supported:
Standard timings supported:
  1920x1200@60Hz 16:10 HorFreq: 74000 Hz Clock: 154.000 MHz
Detailed mode: Clock 154.000 MHz, 495 mm x 310 mm
               1920 1968 2000 2080 hborder 0
               1200 1203 1209 1235 vborder 0
               +hsync -vsync 
               VertFreq: 59 Hz, HorFreq: 74038 Hz
Serial number: --
Monitor name: Cinema HD
Manufacturer-specified data, tag 0
Has 1 extension blocks
Checksum: 0x78 (valid)

DI extension block

EDID block does NOT conform to EDID 1.3!
	sRGB is signaled, but the chromaticities do not match
	Missing monitor ranges
EDID block does not conform at all!
	Has -2013265920 nonconformant extension block(s)
