
EDID (hex):
00ffffffffffff0010ac14a04c385130
1010010368221b78eecaf6a357479e23
114f54a54b00714f8180010101010101
010101010101302a009851002a403070
1300520e1100001e000000ff00363431
383036344b3051384c0a000000fc0044
454c4c204531373646500a20000000fd
00384b1f500e000a20202020202000d3

Extracted contents:
header:          00 ff ff ff ff ff ff 00
serial number:   10 ac 14 a0 4c 38 51 30 10 10
version:         01 03
basic params:    68 22 1b 78 ee
chroma info:     ca f6 a3 57 47 9e 23 11 4f 54
established:     a5 4b 00
standard:        71 4f 81 80 01 01 01 01 01 01 01 01 01 01 01 01
descriptor 1:    30 2a 00 98 51 00 2a 40 30 70 13 00 52 0e 11 00 00 1e
descriptor 2:    00 00 00 ff 00 36 34 31 38 30 36 34 4b 30 51 38 4c 0a
descriptor 3:    00 00 00 fc 00 44 45 4c 4c 20 45 31 37 36 46 50 0a 20
descriptor 4:    00 00 00 fd 00 38 4b 1f 50 0e 00 0a 20 20 20 20 20 20
extensions:      00
checksum:        d3

Manufacturer: DEL Model a014 Serial Number --
Made week 16 of 2006
EDID version: 1.3
Analog display, Input voltage level: 0.7/0.7 V
Sync: Separate 
Maximum image size: 34 cm x 27 cm
Gamma: 2.20
DPMS levels: Standby Suspend Off
RGB color display
Default (sRGB) color space is primary color space
First detailed timing is preferred timing
Established timings supported:
  720x400@70Hz
  640x480@60Hz
  640x480@75Hz
  800x600@60Hz
  800x600@75Hz
  1024x768@60Hz
  1024x768@75Hz
  1280x1024@75Hz
Standard timings supported:
  1152x864@75Hz
  1280x1024@60Hz
Detailed mode: Clock 108.000 MHz, 338 mm x 270 mm
               1280 1328 1440 1688 hborder 0
               1024 1025 1028 1066 vborder 0
               +hsync +vsync 
Serial number: --
Monitor name: DELL
Monitor ranges (GTF): 56-75Hz V, 31-80kHz H, max dotclock 140MHz
Checksum: 0xd3 (valid)
EDID block does NOT conform to EDID 1.3!
	Detailed block string not properly terminated
