
EDID (hex):
00ffffffffffff001e6d993ba7a90200
090f0103ee1e1778eab145a1584f9526
1d5054bfee00314f454f614f01010101
01010101010164190040410026301888
360030e410000018000000fd00384b1e
3f08000a202020202020000000fc004c
31353330500a202020202020000000fc
000a20202020202020202020202000b9

Extracted contents:
header:          00 ff ff ff ff ff ff 00
serial number:   1e 6d 99 3b a7 a9 02 00 09 0f
version:         01 03
basic params:    ee 1e 17 78 ea
chroma info:     b1 45 a1 58 4f 95 26 1d 50 54
established:     bf ee 00
standard:        31 4f 45 4f 61 4f 01 01 01 01 01 01 01 01 01 01
descriptor 1:    64 19 00 40 41 00 26 30 18 88 36 00 30 e4 10 00 00 18
descriptor 2:    00 00 00 fd 00 38 4b 1e 3f 08 00 0a 20 20 20 20 20 20
descriptor 3:    00 00 00 fc 00 4c 31 35 33 30 50 0a 20 20 20 20 20 20
descriptor 4:    00 00 00 fc 00 0a 20 20 20 20 20 20 20 20 20 20 20 20
extensions:      00
checksum:        b9

EDID version: 1.3
Manufacturer: GSM Model 3b99 Serial Number --
Digital display
Maximum image size: 30 cm x 23 cm
Gamma: 2.20
DPMS levels: Standby Suspend Off
RGB color display
First detailed timing is preferred timing
Display x,y Chromaticity:
  Red:   0.6308, 0.3466
  Green: 0.3085, 0.5830
  Blue:  0.1494, 0.1132
  White: 0.3134, 0.3291
Established timings supported:
  720x400@70Hz 9:5 HorFreq: 31469 Hz Clock: 28.320 MHz
  640x480@60Hz 4:3 HorFreq: 31469 Hz Clock: 25.175 MHz
  640x480@67Hz 4:3 HorFreq: 35000 Hz Clock: 30.240 MHz
  640x480@72Hz 4:3 HorFreq: 37900 Hz Clock: 31.500 MHz
  640x480@75Hz 4:3 HorFreq: 37500 Hz Clock: 31.500 MHz
  800x600@56Hz 4:3 HorFreq: 35200 Hz Clock: 36.000 MHz
  800x600@60Hz 4:3 HorFreq: 37900 Hz Clock: 40.000 MHz
  800x600@72Hz 4:3 HorFreq: 48100 Hz Clock: 50.000 MHz
  800x600@75Hz 4:3 HorFreq: 46900 Hz Clock: 49.500 MHz
  832x624@75Hz 4:3 HorFreq: 49726 Hz Clock: 57.284 MHz
  1024x768@60Hz 4:3 HorFreq: 48400 Hz Clock: 65.000 MHz
  1024x768@70Hz 4:3 HorFreq: 56500 Hz Clock: 75.000 MHz
  1024x768@75Hz 4:3 HorFreq: 60000 Hz Clock: 78.750 MHz
Standard timings supported:
  640x480@75Hz 4:3 HorFreq: 37500 Hz Clock: 31.500 MHz
  800x600@75Hz 4:3 HorFreq: 46900 Hz Clock: 49.500 MHz
  1024x768@75Hz 4:3 HorFreq: 60000 Hz Clock: 78.750 MHz
Detailed mode: Clock 65.000 MHz, 304 mm x 228 mm
               1024 1048 1184 1344 hborder 0
                768  771  777  806 vborder 0
               -hsync -vsync 
               VertFreq: 60 Hz, HorFreq: 48363 Hz
Monitor ranges (GTF): 56-75Hz V, 30-63kHz H, max dotclock 80MHz
Monitor name: L1530P
Checksum: 0xb9 (valid)
EDID block does NOT conform to EDID 1.3!
	Digital display field contains garbage: 6e
EDID block does not conform at all!
	Bad year of manufacture
