
EDID (hex):
00ffffffffffff004d10811400000000
241a0104a51d11780ede50a3544c9926
0f505400000001010101010101010101
0101010101011a3680a070381f403020
350026a5100000180000001000000000
00000000000000000000000000fe004b
434d5050804c513133334d3100000000
0002410328001200000b010a20200005

edid-decode (hex):

00 ff ff ff ff ff ff 00 4d 10 81 14 00 00 00 00
24 1a 01 04 a5 1d 11 78 0e de 50 a3 54 4c 99 26
0f 50 54 00 00 00 01 01 01 01 01 01 01 01 01 01
01 01 01 01 01 01 1a 36 80 a0 70 38 1f 40 30 20
35 00 26 a5 10 00 00 18 00 00 00 10 00 00 00 00
00 00 00 00 00 00 00 00 00 00 00 00 00 fe 00 4b
43 4d 50 50 80 4c 51 31 33 33 4d 31 00 00 00 00
00 02 41 03 28 00 12 00 00 0b 01 0a 20 20 00 05

----------------

Block 0, Base EDID:
  EDID Structure Version & Revision: 1.4
  Vendor & Product Identification:
    Manufacturer: SHP
    Model: 5249
    Made in: week 36 of 2016
  Basic Display Parameters & Features:
    Digital display
    Bits per primary color channel: 8
    DisplayPort interface
    Maximum image size: 29 cm x 17 cm
    Gamma: 2.20
    Supported color formats: RGB 4:4:4, YCrCb 4:4:4
    Default (sRGB) color space is primary color space
    First detailed timing includes the native pixel format and preferred refresh rate
  Color Characteristics:
    Red  : 0.6396, 0.3291
    Green: 0.2998, 0.5996
    Blue : 0.1494, 0.0595
    White: 0.3125, 0.3281
  Established Timings I & II: none
  Standard Timings: none
  Detailed Timing Descriptors:
    DTD 1:  1920x1080   59.933878 Hz  16:9     66.587 kHz    138.500000 MHz (294 mm x 165 mm)
                 Hfront   48 Hsync  32 Hback   80 Hpol N
                 Vfront    3 Vsync   5 Vback   23 Vpol N
    Dummy Descriptor:
    Alphanumeric Data String: 'KCMPP'
    Manufacturer-Specified Display Descriptor (0x00): 00 00 00 02 41 03 28 00 12 00 00 0b 01 0a 20 20 '....A.(.......  '
Checksum: 0x05
