
EDID (hex):
00ffffffffffff0010ac7f404c595141
14170103803c2278ea4bb5a7564ba325
0a5054a54b008100b300714fa9408180
010101010101023a801871382d40582c
250055502100001e000000ff00474b30
4b443335444151594c0a000000fc0044
454c4c205532373133484d0a000000fd
00384c1e5111000a20202020202001d5
020329f1509005040302071601061112
1513141f2023097f0767030c00100038
2d83010000e3050301023a801871382d
40582c250055502100001e011d801871
1c1620582c250055502100009e011d00
7251d01e206e28550055502100001e8c
0ad08a20e02d10103e96005550210000
1800000000000000000000000000007a

Extracted contents:
header:          00 ff ff ff ff ff ff 00
serial number:   10 ac 7f 40 4c 59 51 41 14 17
version:         01 03
basic params:    80 3c 22 78 ea
chroma info:     4b b5 a7 56 4b a3 25 0a 50 54
established:     a5 4b 00
standard:        81 00 b3 00 71 4f a9 40 81 80 01 01 01 01 01 01
descriptor 1:    02 3a 80 18 71 38 2d 40 58 2c 25 00 55 50 21 00 00 1e
descriptor 2:    00 00 00 ff 00 47 4b 30 4b 44 33 35 44 41 51 59 4c 0a
descriptor 3:    00 00 00 fc 00 44 45 4c 4c 20 55 32 37 31 33 48 4d 0a
descriptor 4:    00 00 00 fd 00 38 4c 1e 51 11 00 0a 20 20 20 20 20 20
extensions:      01
checksum:        d5

Manufacturer: DEL Model 407f Serial Number --
Made week 20 of 2013
EDID version: 1.3
Digital display
Maximum image size: 60 cm x 34 cm
Gamma: 2.20
DPMS levels: Standby Suspend Off
Supported color formats: RGB 4:4:4, YCrCb 4:2:2
First detailed timing is preferred timing
Established timings supported:
  720x400@70Hz
  640x480@60Hz
  640x480@75Hz
  800x600@60Hz
  800x600@75Hz
  1024x768@60Hz
  1024x768@75Hz
  1280x1024@75Hz
Standard timings supported:
  1280x800@60Hz
  1680x1050@60Hz
  1152x864@75Hz
  1600x1200@60Hz
  1280x1024@60Hz
Detailed mode: Clock 148.500 MHz, 597 mm x 336 mm
               1920 2008 2052 2200 hborder 0
               1080 1082 1087 1125 vborder 0
               +hsync +vsync 
Serial number: --
Monitor name: DELL
Monitor ranges (GTF): 56-76Hz V, 30-81kHz H, max dotclock 170MHz
Has 1 extension blocks
Checksum: 0xd5 (valid)

CEA extension block
Extension version: 3
37 bytes of CEA data
  Video data block
    VIC 16 1920x1080@60Hz (native)
    VIC 05 1920x1080i@60Hz 
    VIC 04 1280x720@60Hz 
    VIC 03 720x480@60Hz 
    VIC 02 720x480@60Hz 
    VIC 07 1440x480i@60Hz 
    VIC 22 1440x576i@50Hz 
    VIC 01 640x480@60Hz 
    VIC 06 1440x480i@60Hz 
    VIC 17 720x576@50Hz 
    VIC 18 720x576@50Hz 
    VIC 21 1440x576i@50Hz 
    VIC 19 1280x720@50Hz 
    VIC 20 1920x1080i@50Hz 
    VIC 31 1920x1080@50Hz 
    VIC 32 1920x1080@24Hz 
  Audio data block
    Linear PCM, max channels 1
    Supported sample rates (kHz): 192 176.4 96 88.2 48 44.1 32
    Supported sample sizes (bits): 24 20 16
  Vendor-specific data block, OUI 000c03 (HDMI)
    Source physical address 1.0.0.0
    DC_36bit
    DC_30bit
    DC_Y444
    Maximum TMDS clock: 225MHz
  Speaker allocation data block
  Extended tag: Colorimetry data block
Underscans PC formats by default
Basic audio support
Supports YCbCr 4:4:4
Supports YCbCr 4:2:2
1 native detailed modes
Detailed mode: Clock 148.500 MHz, 597 mm x 336 mm
               1920 2008 2052 2200 hborder 0
               1080 1082 1087 1125 vborder 0
               +hsync +vsync 
Detailed mode: Clock 74.250 MHz, 597 mm x 336 mm
               1920 2008 2052 2200 hborder 0
                540  542  547  562 vborder 0
               +hsync +vsync interlaced 
Detailed mode: Clock 74.250 MHz, 597 mm x 336 mm
               1280 1390 1430 1650 hborder 0
                720  725  730  750 vborder 0
               +hsync +vsync 
Detailed mode: Clock 27.000 MHz, 597 mm x 336 mm
                720  736  798  858 hborder 0
                480  489  495  525 vborder 0
               -hsync -vsync 
Checksum: 0x7a (valid)

EDID block does NOT conform to EDID 1.3!
	Detailed block string not properly terminated
