
EDID (hex):
00ffffffffffff00244de31901010101
090c0104a520187ee01669a552489924
0e484ca04300315945596159a9450101
0101010101019014c02c31111c200c6c
1a0032e61000001a000000fc0049424d
204737380a2020202020000000fd0032
a01e5512000a202020202020000000ff
0035352d434e5a38300a2020202000a1

edid-decode (hex):

00 ff ff ff ff ff ff 00 24 4d e3 19 01 01 01 01
09 0c 01 04 a5 20 18 7e e0 16 69 a5 52 48 99 24
0e 48 4c a0 43 00 31 59 45 59 61 59 a9 45 01 01
01 01 01 01 01 01 90 14 c0 2c 31 11 1c 20 0c 6c
1a 00 32 e6 10 00 00 1a 00 00 00 fc 00 49 42 4d
20 47 37 38 0a 20 20 20 20 20 00 00 00 fd 00 32
a0 1e 55 12 00 0a 20 20 20 20 20 20 00 00 00 ff
00 35 35 2d 43 4e 5a 38 30 0a 20 20 20 20 00 a1

----------------

Block 0, Base EDID:
  EDID Structure Version & Revision: 1.4
  Vendor & Product Identification:
    Manufacturer: IBM
    Model: 6627
    Serial Number: 16843009
    Made in: week 9 of 2002
  Basic Display Parameters & Features:
    Digital display
    Bits per primary color channel: 8
    DisplayPort interface
    Maximum image size: 32 cm x 24 cm
    Gamma: 2.26
    DPMS levels: Standby Suspend Off
    Supported color formats: RGB 4:4:4
    First detailed timing does not include the native pixel format and preferred refresh rate
  Color Characteristics:
    Red  : 0.6445, 0.3212
    Green: 0.2822, 0.5996
    Blue : 0.1416, 0.0566
    White: 0.2832, 0.2978
  Established Timings I & II:
    IBM     :   720x400    70.081663 Hz   9:5     31.467 kHz     28.320000 MHz
    DMT 0x04:   640x480    59.940476 Hz   4:3     31.469 kHz     25.175000 MHz
    DMT 0x0b:   800x600    75.000000 Hz   4:3     46.875 kHz     49.500000 MHz
    DMT 0x12:  1024x768    75.028582 Hz   4:3     60.023 kHz     78.750000 MHz
    DMT 0x24:  1280x1024   75.024675 Hz   5:4     79.976 kHz    135.000000 MHz
  Standard Timings:
    DMT 0x07:   640x480    85.008312 Hz   4:3     43.269 kHz     36.000000 MHz
    DMT 0x0c:   800x600    85.061274 Hz   4:3     53.674 kHz     56.250000 MHz
    DMT 0x13:  1024x768    84.996690 Hz   4:3     68.677 kHz     94.500000 MHz
    DMT 0x34:  1600x1200   65.000000 Hz   4:3     81.250 kHz    175.500000 MHz
  Detailed Timing Descriptors:
    DTD 1:   960x529    75.004987 Hz 960:529   41.778 kHz     52.640000 MHz (306 mm x 230 mm)
                 Hfront   12 Hsync 108 Hback  180 Hpol P
                 Vfront    1 Vsync  10 Vback   17 Vpol N
    Display Product Name: 'IBM G78'
    Display Range Limits:
      Monitor ranges (GTF): 50-160 Hz V, 30-85 kHz H, max dotclock 180 MHz
    Display Product Serial Number: '55-CNZ80'
Checksum: 0xa1
