
EDID (hex):
00ffffffffffff000dae211500000000
011e0104a52213780328659759548e27
1e505400000001010101010101010101
0101010101019e8580a070383e403020
a50058c110000018ad3780a070383e40
3020a50058c110000018000000fd0030
90a5a522010a202020202020000000fe
004e3135364852412d4541310a200080

edid-decode (hex):

00 ff ff ff ff ff ff 00 0d ae 21 15 00 00 00 00
01 1e 01 04 a5 22 13 78 03 28 65 97 59 54 8e 27
1e 50 54 00 00 00 01 01 01 01 01 01 01 01 01 01
01 01 01 01 01 01 9e 85 80 a0 70 38 3e 40 30 20
a5 00 58 c1 10 00 00 18 ad 37 80 a0 70 38 3e 40
30 20 a5 00 58 c1 10 00 00 18 00 00 00 fd 00 30
90 a5 a5 22 01 0a 20 20 20 20 20 20 00 00 00 fe
00 4e 31 35 36 48 52 41 2d 45 41 31 0a 20 00 80

----------------

Block 0, Base EDID:
  EDID Structure Version & Revision: 1.4
  Vendor & Product Identification:
    Manufacturer: CMN
    Model: 5409
    Made in: week 1 of 2020
  Basic Display Parameters & Features:
    Digital display
    Bits per primary color channel: 8
    DisplayPort interface
    Maximum image size: 34 cm x 19 cm
    Gamma: 2.20
    Supported color formats: RGB 4:4:4
    First detailed timing includes the native pixel format and preferred refresh rate
    Display is continuous frequency
  Color Characteristics:
    Red  : 0.5898, 0.3496
    Green: 0.3300, 0.5546
    Blue : 0.1533, 0.1191
    White: 0.3134, 0.3291
  Established Timings I & II: none
  Standard Timings: none
  Detailed Timing Descriptors:
    DTD 1:  1920x1080  144.003435 Hz  16:9    164.452 kHz    342.060000 MHz (344 mm x 193 mm)
                 Hfront   48 Hsync  32 Hback   80 Hpol N
                 Vfront   10 Vsync   5 Vback   47 Vpol N
    DTD 2:  1920x1080   60.003536 Hz  16:9     68.524 kHz    142.530000 MHz (344 mm x 193 mm)
                 Hfront   48 Hsync  32 Hback   80 Hpol N
                 Vfront   10 Vsync   5 Vback   47 Vpol N
    Display Range Limits:
      Monitor ranges (Bare Limits): 48-144 Hz V, 165-165 kHz H, max dotclock 340 MHz
    Alphanumeric Data String: 'N156HRA-EA1'
Checksum: 0x80
