
EDID (hex):
00ffffffffffff0030e44c0600000000
001d01049522137803b385995e5b8c26
1b505400000001010101010101010101
010101010101243680a070381f403020
350058c210000019182480a070381f40
3020350058c210000019000000000000
00000000000000000000000000000002
000c3aff0a3c7d1214247d00000000e9

Extracted contents:
header:          00 ff ff ff ff ff ff 00
serial number:   30 e4 4c 06 00 00 00 00 00 1d
version:         01 04
basic params:    95 22 13 78 03
chroma info:     b3 85 99 5e 5b 8c 26 1b 50 54
established:     00 00 00
standard:        01 01 01 01 01 01 01 01 01 01 01 01 01 01 01 01
descriptor 1:    24 36 80 a0 70 38 1f 40 30 20 35 00 58 c2 10 00 00 19
descriptor 2:    18 24 80 a0 70 38 1f 40 30 20 35 00 58 c2 10 00 00 19
descriptor 3:    00 00 00 00 00 00 00 00 00 00 00 00 00 00 00 00 00 00
descriptor 4:    00 00 00 02 00 0c 3a ff 0a 3c 7d 12 14 24 7d 00 00 00
extensions:      00
checksum:        e9

EDID version: 1.4
Manufacturer: LGD Model 64c Serial Number --
Made in year 2019
Digital display
6 bits per primary color channel
DisplayPort interface
Maximum image size: 34 cm x 19 cm
Gamma: 2.20
Supported color formats: RGB 4:4:4
First detailed timing includes the native pixel format and preferred refresh rate
Display is continuous frequency
Display x,y Chromaticity:
  Red:   0.5996, 0.3701
  Green: 0.3554, 0.5498
  Blue:  0.1503, 0.1054
  White: 0.3134, 0.3291
Established timings supported:
Standard timings supported:
Detailed mode: Clock 138.600 MHz, 344 mm x 194 mm
               1920 1968 2000 2080 hborder 0
               1080 1083 1088 1111 vborder 0
               -hsync -vsync 
               VertFreq: 59 Hz, HorFreq: 66634 Hz
Detailed mode: Clock 92.400 MHz, 344 mm x 194 mm
               1920 1968 2000 2080 hborder 0
               1080 1083 1088 1111 vborder 0
               -hsync -vsync 
               VertFreq: 39 Hz, HorFreq: 44423 Hz
Manufacturer-specified data, tag 0
Manufacturer-specified data, tag 2
Checksum: 0xe9 (valid)
EDID block does NOT conform to EDID 1.4!
	Missing name descriptor
	Missing monitor ranges
