
EDID (hex):
00ffffffffffff0009e5c10a00000000
271f0104b522157803efeaa3544c9926
0f505400000001010101010101010101
0101010101011f6c00a0a04060603020
360058d710000018000000fd003078cc
cc37010a202020202020000000fe0042
4f452043510a202020202020000000fe
004e4531363051444d2d4e59320a01a9
70137900000301143dd80085ff099f00
2f001f003f065f000200050000000000
00000000000000000000000000000000
00000000000000000000000000000000
00000000000000000000000000000000
00000000000000000000000000000000
00000000000000000000000000000000
00000000000000000000000000002290

edid-decode (hex):

00 ff ff ff ff ff ff 00 09 e5 c1 0a 00 00 00 00
27 1f 01 04 b5 22 15 78 03 ef ea a3 54 4c 99 26
0f 50 54 00 00 00 01 01 01 01 01 01 01 01 01 01
01 01 01 01 01 01 1f 6c 00 a0 a0 40 60 60 30 20
36 00 58 d7 10 00 00 18 00 00 00 fd 00 30 78 cc
cc 37 01 0a 20 20 20 20 20 20 00 00 00 fe 00 42
4f 45 20 43 51 0a 20 20 20 20 20 20 00 00 00 fe
00 4e 45 31 36 30 51 44 4d 2d 4e 59 32 0a 01 a9

70 13 79 00 00 03 01 14 3d d8 00 85 ff 09 9f 00
2f 00 1f 00 3f 06 5f 00 02 00 05 00 00 00 00 00
00 00 00 00 00 00 00 00 00 00 00 00 00 00 00 00
00 00 00 00 00 00 00 00 00 00 00 00 00 00 00 00
00 00 00 00 00 00 00 00 00 00 00 00 00 00 00 00
00 00 00 00 00 00 00 00 00 00 00 00 00 00 00 00
00 00 00 00 00 00 00 00 00 00 00 00 00 00 00 00
00 00 00 00 00 00 00 00 00 00 00 00 00 00 22 90

----------------

Block 0, Base EDID:
  EDID Structure Version & Revision: 1.4
  Vendor & Product Identification:
    Manufacturer: BOE
    Model: 2753
    Made in: week 39 of 2021
  Basic Display Parameters & Features:
    Digital display
    Bits per primary color channel: 10
    DisplayPort interface
    Maximum image size: 34 cm x 21 cm
    Gamma: 2.20
    Supported color formats: RGB 4:4:4
    First detailed timing includes the native pixel format and preferred refresh rate
    Display is continuous frequency
  Color Characteristics:
    Red  : 0.6396, 0.3300
    Green: 0.2998, 0.6005
    Blue : 0.1513, 0.0605
    White: 0.3144, 0.3300
  Established Timings I & II: none
  Standard Timings: none
  Detailed Timing Descriptors:
    DTD 1:  2560x1600   60.000607 Hz  16:10   101.761 kHz    276.790000 MHz (344 mm x 215 mm)
                 Hfront   48 Hsync  32 Hback   80 Hpol N
                 Vfront    3 Vsync   6 Vback   87 Vpol N
    Display Range Limits:
      Monitor ranges (Bare Limits): 48-120 Hz V, 204-204 kHz H, max dotclock 550 MHz
    Alphanumeric Data String: 'BOE CQ'
    Alphanumeric Data String: 'NE160QDM-NY2'
  Extension blocks: 1
Checksum: 0xa9

----------------

Block 1, DisplayID Extension Block:
  Version: 1.3
  Extension Count: 0
  Display Product Type: Extension Section
  Video Timing Modes Type 1 - Detailed Timings Data Block:
    DTD:  2560x1600  120.001214 Hz  16:10   203.522 kHz    553.580000 MHz (aspect 16:10, no 3D stereo, preferred)
               Hfront   48 Hsync  32 Hback   80 Hpol N
               Vfront    3 Vsync   6 Vback   87 Vpol N
  Checksum: 0x22
Checksum: 0x90
