
EDID (hex):
00ffffffffffff0006105f9c00000000
08100103801d12780a2f309758538b29
25505400000001010101010101010101
010101010101bc1b00a0502017303020
36001eb3100000180000000100061020
00000000000000000a20000000fe004c
503133335758312d544c4131000000fe
00436f6c6f72204c43440a20202000c2

Extracted contents:
header:          00 ff ff ff ff ff ff 00
serial number:   06 10 5f 9c 00 00 00 00 08 10
version:         01 03
basic params:    80 1d 12 78 0a
chroma info:     2f 30 97 58 53 8b 29 25 50 54
established:     00 00 00
standard:        01 01 01 01 01 01 01 01 01 01 01 01 01 01 01 01
descriptor 1:    bc 1b 00 a0 50 20 17 30 30 20 36 00 1e b3 10 00 00 18
descriptor 2:    00 00 00 01 00 06 10 20 00 00 00 00 00 00 00 00 0a 20
descriptor 3:    00 00 00 fe 00 4c 50 31 33 33 57 58 31 2d 54 4c 41 31
descriptor 4:    00 00 00 fe 00 43 6f 6c 6f 72 20 4c 43 44 0a 20 20 20
extensions:      00
checksum:        c2

Manufacturer: APP Model 9c5f Serial Number --
Made week 8 of 2006
EDID version: 1.3
Digital display
Maximum image size: 29 cm x 18 cm
Gamma: 2.20
Supported color formats: RGB 4:4:4, YCrCb 4:2:2
First detailed timing is preferred timing
Established timings supported:
Standard timings supported:
Detailed mode: Clock 71.000 MHz, 286 mm x 179 mm
               1280 1328 1360 1440 hborder 0
                800  803  809  823 vborder 0
               -hsync -vsync 
Manufacturer-specified data, tag 1
ASCII string: LP133WX1
ASCII string: Color
Checksum: 0xc2 (valid)
EDID block does NOT conform to EDID 1.3!
	Missing name descriptor
	Missing monitor ranges
	Detailed block string not properly terminated
