
EDID (hex):
00ffffffffffff00410cc308722c0000
20170104a53c22783a2cc5a55554a127
0c5054b10800d1c0b3009500818081c0
010101010101023a801871382d40582c
450055502100001e000000ff00415531
31333332303131333738000000fc0050
68696c697073203237315034000000fd
0038471e5311010a2020202020200197
020318f14b010203040590111213141f
2309170783010000023a801871382d40
582c450055502100001e8c0ad08a20e0
2d10103e9600555021000018011d0072
51d01e206e28550055502100001e8c0a
d090204031200c405500555021000018
00000000000000000000000000000000
00000000000000000000000000000067

edid-decode (hex):

00 ff ff ff ff ff ff 00 41 0c c3 08 72 2c 00 00
20 17 01 04 a5 3c 22 78 3a 2c c5 a5 55 54 a1 27
0c 50 54 b1 08 00 d1 c0 b3 00 95 00 81 80 81 c0
01 01 01 01 01 01 02 3a 80 18 71 38 2d 40 58 2c
45 00 55 50 21 00 00 1e 00 00 00 ff 00 41 55 31
31 33 33 32 30 31 31 33 37 38 00 00 00 fc 00 50
68 69 6c 69 70 73 20 32 37 31 50 34 00 00 00 fd
00 38 47 1e 53 11 01 0a 20 20 20 20 20 20 01 97

02 03 18 f1 4b 01 02 03 04 05 90 11 12 13 14 1f
23 09 17 07 83 01 00 00 02 3a 80 18 71 38 2d 40
58 2c 45 00 55 50 21 00 00 1e 8c 0a d0 8a 20 e0
2d 10 10 3e 96 00 55 50 21 00 00 18 01 1d 00 72
51 d0 1e 20 6e 28 55 00 55 50 21 00 00 1e 8c 0a
d0 90 20 40 31 20 0c 40 55 00 55 50 21 00 00 18
00 00 00 00 00 00 00 00 00 00 00 00 00 00 00 00
00 00 00 00 00 00 00 00 00 00 00 00 00 00 00 67

----------------

Block 0, Base EDID:
  EDID Structure Version & Revision: 1.4
  Vendor & Product Identification:
    Manufacturer: PHL
    Model: 2243
    Serial Number: 11378
    Made in: week 32 of 2013
  Basic Display Parameters & Features:
    Digital display
    Bits per primary color channel: 8
    DisplayPort interface
    Maximum image size: 60 cm x 34 cm
    Gamma: 2.20
    DPMS levels: Off
    Supported color formats: RGB 4:4:4, YCrCb 4:4:4, YCrCb 4:2:2
    First detailed timing includes the native pixel format and preferred refresh rate
  Color Characteristics:
    Red  : 0.6445, 0.3339
    Green: 0.3310, 0.6289
    Blue : 0.1552, 0.0468
    White: 0.3134, 0.3291
  Established Timings I & II:
    IBM     :   720x400    70.081663 Hz   9:5     31.467 kHz     28.320000 MHz
    DMT 0x04:   640x480    59.940476 Hz   4:3     31.469 kHz     25.175000 MHz
    Apple   :   640x480    66.666667 Hz   4:3     35.000 kHz     30.240000 MHz
    DMT 0x09:   800x600    60.316541 Hz   4:3     37.879 kHz     40.000000 MHz
    DMT 0x10:  1024x768    60.003840 Hz   4:3     48.363 kHz     65.000000 MHz
  Standard Timings:
    DMT 0x52:  1920x1080   60.000000 Hz  16:9     67.500 kHz    148.500000 MHz
    DMT 0x3a:  1680x1050   59.954250 Hz  16:10    65.290 kHz    146.250000 MHz
    DMT 0x2f:  1440x900    59.887445 Hz  16:10    55.935 kHz    106.500000 MHz
    DMT 0x23:  1280x1024   60.019740 Hz   5:4     63.981 kHz    108.000000 MHz
    DMT 0x55:  1280x720    60.000000 Hz  16:9     45.000 kHz     74.250000 MHz
  Detailed Timing Descriptors:
    DTD 1:  1920x1080   60.000000 Hz  16:9     67.500 kHz    148.500000 MHz (597 mm x 336 mm)
                 Hfront   88 Hsync  44 Hback  148 Hpol P
                 Vfront    4 Vsync   5 Vback   36 Vpol P
    Display Product Serial Number: 'AU11332011378'
    Display Product Name: 'Philips 271P4'
    Display Range Limits:
      Monitor ranges (Bare Limits): 56-71 Hz V, 30-83 kHz H, max dotclock 170 MHz
  Extension blocks: 1
Checksum: 0x97

----------------

Block 1, CTA-861 Extension Block:
  Revision: 3
  Underscans IT Video Formats by default
  Basic audio support
  Supports YCbCr 4:4:4
  Supports YCbCr 4:2:2
  Native detailed modes: 1
  Video Data Block:
    VIC   1:   640x480    59.940476 Hz   4:3     31.469 kHz     25.175000 MHz
    VIC   2:   720x480    59.940060 Hz   4:3     31.469 kHz     27.000000 MHz
    VIC   3:   720x480    59.940060 Hz  16:9     31.469 kHz     27.000000 MHz
    VIC   4:  1280x720    60.000000 Hz  16:9     45.000 kHz     74.250000 MHz
    VIC   5:  1920x1080i  60.000000 Hz  16:9     33.750 kHz     74.250000 MHz
    VIC  16:  1920x1080   60.000000 Hz  16:9     67.500 kHz    148.500000 MHz (native)
    VIC  17:   720x576    50.000000 Hz   4:3     31.250 kHz     27.000000 MHz
    VIC  18:   720x576    50.000000 Hz  16:9     31.250 kHz     27.000000 MHz
    VIC  19:  1280x720    50.000000 Hz  16:9     37.500 kHz     74.250000 MHz
    VIC  20:  1920x1080i  50.000000 Hz  16:9     28.125 kHz     74.250000 MHz
    VIC  31:  1920x1080   50.000000 Hz  16:9     56.250 kHz    148.500000 MHz
  Audio Data Block:
    Linear PCM:
      Max channels: 2
      Supported sample rates (kHz): 96 48 44.1 32
      Supported sample sizes (bits): 24 20 16
  Speaker Allocation Data Block:
    FL/FR - Front Left/Right
  Detailed Timing Descriptors:
    DTD 2:  1920x1080   60.000000 Hz  16:9     67.500 kHz    148.500000 MHz (597 mm x 336 mm)
                 Hfront   88 Hsync  44 Hback  148 Hpol P
                 Vfront    4 Vsync   5 Vback   36 Vpol P
    DTD 3:   720x480    59.940060 Hz   3:2     31.469 kHz     27.000000 MHz (597 mm x 336 mm)
                 Hfront   16 Hsync  62 Hback   60 Hpol N
                 Vfront    9 Vsync   6 Vback   30 Vpol N
    DTD 4:  1280x720    60.000000 Hz  16:9     45.000 kHz     74.250000 MHz (597 mm x 336 mm)
                 Hfront  110 Hsync  40 Hback  220 Hpol P
                 Vfront    5 Vsync   5 Vback   20 Vpol P
    DTD 5:   720x576    50.000000 Hz   5:4     31.250 kHz     27.000000 MHz (597 mm x 336 mm)
                 Hfront   12 Hsync  64 Hback   68 Hpol N
                 Vfront    5 Vsync   5 Vback   39 Vpol N
Checksum: 0x67  Unused space in Extension Block: 31 bytes


