
EDID (hex):
00ffffffffffff004d10571400000000
28190104a51c107806de50a3544c9926
0f505400000001010101010101010101
0101010101016f5e00a0a0a029503020
3500149c100000180000001000000000
00000000000000000000000000100000
000000000000000000000000000000fe
004c5131323554314a5830350a20002a

edid-decode (hex):

00 ff ff ff ff ff ff 00 4d 10 57 14 00 00 00 00
28 19 01 04 a5 1c 10 78 06 de 50 a3 54 4c 99 26
0f 50 54 00 00 00 01 01 01 01 01 01 01 01 01 01
01 01 01 01 01 01 6f 5e 00 a0 a0 a0 29 50 30 20
35 00 14 9c 10 00 00 18 00 00 00 10 00 00 00 00
00 00 00 00 00 00 00 00 00 00 00 00 00 10 00 00
00 00 00 00 00 00 00 00 00 00 00 00 00 00 00 fe
00 4c 51 31 32 35 54 31 4a 58 30 35 0a 20 00 2a

----------------

Block 0, Base EDID:
  EDID Structure Version & Revision: 1.4
  Vendor & Product Identification:
    Manufacturer: SHP
    Model: 5207
    Made in: week 40 of 2015
  Basic Display Parameters & Features:
    Digital display
    Bits per primary color channel: 8
    DisplayPort interface
    Maximum image size: 28 cm x 16 cm
    Gamma: 2.20
    Supported color formats: RGB 4:4:4
    Default (sRGB) color space is primary color space
    First detailed timing includes the native pixel format and preferred refresh rate
  Color Characteristics:
    Red  : 0.6396, 0.3291
    Green: 0.2998, 0.5996
    Blue : 0.1494, 0.0595
    White: 0.3125, 0.3281
  Established Timings I & II: none
  Standard Timings: none
  Detailed Timing Descriptors:
    DTD 1:  2560x1440   60.012611 Hz  16:9     88.879 kHz    241.750000 MHz (276 mm x 156 mm)
                 Hfront   48 Hsync  32 Hback   80 Hpol N
                 Vfront    3 Vsync   5 Vback   33 Vpol N
    Dummy Descriptor:
    Dummy Descriptor:
    Alphanumeric Data String: 'LQ125T1JX05'
Checksum: 0x2a
