
EDID (hex):
00ffffffffffff000469b22401010101
1917010380342078ea1df5ae4f35b325
0d5054bfef00714f818081409500a940
b300d1c00101283c80a070b023403020
360006442100001a000000fd00324c1e
5311000a202020202020000000fc0050
413234390a20202020202020000000ff
0044364c4d51533038343937320a00a7

Extracted contents:
header:          00 ff ff ff ff ff ff 00
serial number:   04 69 b2 24 01 01 01 01 19 17
version:         01 03
basic params:    80 34 20 78 ea
chroma info:     1d f5 ae 4f 35 b3 25 0d 50 54
established:     bf ef 00
standard:        71 4f 81 80 81 40 95 00 a9 40 b3 00 d1 c0 01 01
descriptor 1:    28 3c 80 a0 70 b0 23 40 30 20 36 00 06 44 21 00 00 1a
descriptor 2:    00 00 00 fd 00 32 4c 1e 53 11 00 0a 20 20 20 20 20 20
descriptor 3:    00 00 00 fc 00 50 41 32 34 39 0a 20 20 20 20 20 20 20
descriptor 4:    00 00 00 ff 00 44 36 4c 4d 51 53 30 38 34 39 37 32 0a
extensions:      00
checksum:        a7

Manufacturer: ACI Model 24b2 Serial Number --
Made week 25 of 2013
EDID version: 1.3
Digital display
Maximum image size: 52 cm x 32 cm
Gamma: 2.20
DPMS levels: Standby Suspend Off
Supported color formats: RGB 4:4:4, YCrCb 4:2:2
First detailed timing is preferred timing
Established timings supported:
  720x400@70Hz
  640x480@60Hz
  640x480@67Hz
  640x480@72Hz
  640x480@75Hz
  800x600@56Hz
  800x600@60Hz
  800x600@72Hz
  800x600@75Hz
  832x624@75Hz
  1024x768@60Hz
  1024x768@70Hz
  1024x768@75Hz
  1280x1024@75Hz
Standard timings supported:
  1152x864@75Hz
  1280x1024@60Hz
  1280x960@60Hz
  1440x900@60Hz
  1600x1200@60Hz
  1680x1050@60Hz
  1920x1080@60Hz
Detailed mode: Clock 154.000 MHz, 518 mm x 324 mm
               1920 1968 2000 2080 hborder 0
               1200 1203 1209 1235 vborder 0
               +hsync -vsync 
Monitor ranges (GTF): 50-76Hz V, 30-83kHz H, max dotclock 170MHz
Monitor name: PA249
Serial number: --
Checksum: 0xa7 (valid)
