
EDID (hex):
00ffffffffffff003870290000000000
001b0104a5221378069a85975c578e28
1c505400000001010101010101010101
010101010101993680a0703828403020
360058c210000018ae2b80a070382840
3020360058c210000018000000100000
000000000000000000000000000000fe
004c4d3135364c46314c30360a200054

Extracted contents:
header:          00 ff ff ff ff ff ff 00
serial number:   38 70 29 00 00 00 00 00 00 1b
version:         01 04
basic params:    a5 22 13 78 06
chroma info:     9a 85 97 5c 57 8e 28 1c 50 54
established:     00 00 00
standard:        01 01 01 01 01 01 01 01 01 01 01 01 01 01 01 01
descriptor 1:    99 36 80 a0 70 38 28 40 30 20 36 00 58 c2 10 00 00 18
descriptor 2:    ae 2b 80 a0 70 38 28 40 30 20 36 00 58 c2 10 00 00 18
descriptor 3:    00 00 00 10 00 00 00 00 00 00 00 00 00 00 00 00 00 00
descriptor 4:    00 00 00 fe 00 4c 4d 31 35 36 4c 46 31 4c 30 36 0a 20
extensions:      00
checksum:        54

EDID version: 1.4
Manufacturer: NCP Model 29 Serial Number --
Made in year 2017
Digital display
8 bits per primary color channel
DisplayPort interface
Maximum image size: 34 cm x 19 cm
Gamma: 2.20
Supported color formats: RGB 4:4:4
Default (sRGB) color space is primary color space
First detailed timing includes the native pixel format and preferred refresh rate
Display x,y Chromaticity:
  Red:   0.5917, 0.3603
  Green: 0.3417, 0.5566
  Blue:  0.1582, 0.1093
  White: 0.3134, 0.3291
Established timings supported:
Standard timings supported:
Detailed mode: Clock 139.770 MHz, 344 mm x 194 mm
               1920 1968 2000 2080 hborder 0
               1080 1083 1089 1120 vborder 0
               -hsync -vsync 
               VertFreq: 59 Hz, HorFreq: 67197 Hz
Detailed mode: Clock 111.820 MHz, 344 mm x 194 mm
               1920 1968 2000 2080 hborder 0
               1080 1083 1089 1120 vborder 0
               -hsync -vsync 
               VertFreq: 47 Hz, HorFreq: 53759 Hz
Dummy block
ASCII string: LM156LF1L06
Checksum: 0x54 (valid)
EDID block does NOT conform to EDID 1.4!
	sRGB is signaled, but the chromaticities do not match
	Missing name descriptor
	Missing monitor ranges


