
EDID (hex):
00ffffffffffff005a63318a01010101
321a0104a529177826ebc5a25754a027
0c5054bfef808180814081c001010101
010101010101662156aa51001e30468f
33009ae61000001e000000ff0055454d
3136353032303932370a000000fd0032
4b185211000a202020202020000000fc
00564131393033610a20202020200041

edid-decode (hex):

00 ff ff ff ff ff ff 00 5a 63 31 8a 01 01 01 01
32 1a 01 04 a5 29 17 78 26 eb c5 a2 57 54 a0 27
0c 50 54 bf ef 80 81 80 81 40 81 c0 01 01 01 01
01 01 01 01 01 01 66 21 56 aa 51 00 1e 30 46 8f
33 00 9a e6 10 00 00 1e 00 00 00 ff 00 55 45 4d
31 36 35 30 32 30 39 32 37 0a 00 00 00 fd 00 32
4b 18 52 11 00 0a 20 20 20 20 20 20 00 00 00 fc
00 56 41 31 39 30 33 61 0a 20 20 20 20 20 00 41

----------------

Block 0, Base EDID:
  EDID Structure Version & Revision: 1.4
  Vendor & Product Identification:
    Manufacturer: VSC
    Model: 35377
    Serial Number: 16843009
    Made in: week 50 of 2016
  Basic Display Parameters & Features:
    Digital display
    Bits per primary color channel: 8
    DisplayPort interface
    Maximum image size: 41 cm x 23 cm
    Gamma: 2.20
    DPMS levels: Off
    Supported color formats: RGB 4:4:4
    Default (sRGB) color space is primary color space
    First detailed timing includes the native pixel format and preferred refresh rate
  Color Characteristics:
    Red  : 0.6357, 0.3417
    Green: 0.3300, 0.6279
    Blue : 0.1552, 0.0468
    White: 0.3134, 0.3291
  Established Timings I & II:
    IBM     :   720x400    70.081663 Hz   9:5     31.467 kHz     28.320000 MHz
    DMT 0x04:   640x480    59.940476 Hz   4:3     31.469 kHz     25.175000 MHz
    Apple   :   640x480    66.666667 Hz   4:3     35.000 kHz     30.240000 MHz
    DMT 0x05:   640x480    72.808802 Hz   4:3     37.861 kHz     31.500000 MHz
    DMT 0x06:   640x480    75.000000 Hz   4:3     37.500 kHz     31.500000 MHz
    DMT 0x08:   800x600    56.250000 Hz   4:3     35.156 kHz     36.000000 MHz
    DMT 0x09:   800x600    60.316541 Hz   4:3     37.879 kHz     40.000000 MHz
    DMT 0x0a:   800x600    72.187572 Hz   4:3     48.077 kHz     50.000000 MHz
    DMT 0x0b:   800x600    75.000000 Hz   4:3     46.875 kHz     49.500000 MHz
    Apple   :   832x624    74.551266 Hz   4:3     49.726 kHz     57.284000 MHz
    DMT 0x10:  1024x768    60.003840 Hz   4:3     48.363 kHz     65.000000 MHz
    DMT 0x11:  1024x768    70.069359 Hz   4:3     56.476 kHz     75.000000 MHz
    DMT 0x12:  1024x768    75.028582 Hz   4:3     60.023 kHz     78.750000 MHz
    DMT 0x24:  1280x1024   75.024675 Hz   5:4     79.976 kHz    135.000000 MHz
    Apple   :  1152x870    75.061550 Hz 192:145   68.681 kHz    100.000000 MHz
  Standard Timings:
    DMT 0x23:  1280x1024   60.019740 Hz   5:4     63.981 kHz    108.000000 MHz
    DMT 0x20:  1280x960    60.000000 Hz   4:3     60.000 kHz    108.000000 MHz
    DMT 0x55:  1280x720    60.000000 Hz  16:9     45.000 kHz     74.250000 MHz
  Detailed Timing Descriptors:
    DTD 1:  1366x768    59.789541 Hz 683:384   47.712 kHz     85.500000 MHz (410 mm x 230 mm)
                 Hfront   70 Hsync 143 Hback  213 Hpol P
                 Vfront    3 Vsync   3 Vback   24 Vpol P
    Display Product Serial Number: 'UEM165020927'
    Display Range Limits:
      Monitor ranges (GTF): 50-75 Hz V, 24-82 kHz H, max dotclock 170 MHz
    Display Product Name: 'VA1903a'
Checksum: 0x41
