
EDID (hex):
00ffffffffffff000e6f041400000000
001e0104a51e1378039dd1a5544d9a23
0e515600000001010101010101010101
010101010101353c80a070b023403020
36002ebd10000018000000fd00303c4a
4a0f010a202020202020000000fe0043
534f542054330a2020202020000000fe
004d4e453030374a41312d310a200002

edid-decode (hex):

00 ff ff ff ff ff ff 00 0e 6f 04 14 00 00 00 00
00 1e 01 04 a5 1e 13 78 03 9d d1 a5 54 4d 9a 23
0e 51 56 00 00 00 01 01 01 01 01 01 01 01 01 01
01 01 01 01 01 01 35 3c 80 a0 70 b0 23 40 30 20
36 00 2e bd 10 00 00 18 00 00 00 fd 00 30 3c 4a
4a 0f 01 0a 20 20 20 20 20 20 00 00 00 fe 00 43
53 4f 54 20 54 33 0a 20 20 20 20 20 00 00 00 fe
00 4d 4e 45 30 30 37 4a 41 31 2d 31 0a 20 00 02

----------------

Block 0, Base EDID:
  EDID Structure Version & Revision: 1.4
  Vendor & Product Identification:
    Manufacturer: CSO
    Model: 5124
    Made in: 2020
  Basic Display Parameters & Features:
    Digital display
    Bits per primary color channel: 8
    DisplayPort interface
    Maximum image size: 30 cm x 19 cm
    Gamma: 2.20
    Supported color formats: RGB 4:4:4
    First detailed timing includes the native pixel format and preferred refresh rate
    Display is continuous frequency
  Color Characteristics:
    Red  : 0.6464, 0.3291
    Green: 0.3037, 0.6025
    Blue : 0.1396, 0.0556
    White: 0.3164, 0.3369
  Established Timings I & II: none
  Standard Timings: none
  Detailed Timing Descriptors:
    DTD 1:  1920x1200   60.000779 Hz  16:10    74.101 kHz    154.130000 MHz (302 mm x 189 mm)
                 Hfront   48 Hsync  32 Hback   80 Hpol N
                 Vfront    3 Vsync   6 Vback   26 Vpol N
    Display Range Limits:
      Monitor ranges (Bare Limits): 48-60 Hz V, 74-74 kHz H, max dotclock 150 MHz
    Alphanumeric Data String: 'CSOT T3'
    Alphanumeric Data String: 'MNE007JA1-1'
Checksum: 0x02
