
EDID (hex):
00ffffffffffff000dae931400000000
28170104951f1178027e459355539428
23505400000001010101010101010101
010101010101da1d56e250002030442d
470035ad10000018000000fe004e3134
304247452d4534330a20000000fe0043
4d4e0a202020202020202020000000fe
004e3134304247452d4534330a200095

Extracted contents:
header:          00 ff ff ff ff ff ff 00
serial number:   0d ae 93 14 00 00 00 00 28 17
version:         01 04
basic params:    95 1f 11 78 02
chroma info:     7e 45 93 55 53 94 28 23 50 54
established:     00 00 00
standard:        01 01 01 01 01 01 01 01 01 01 01 01 01 01 01 01
descriptor 1:    da 1d 56 e2 50 00 20 30 44 2d 47 00 35 ad 10 00 00 18
descriptor 2:    00 00 00 fe 00 4e 31 34 30 42 47 45 2d 45 34 33 0a 20
descriptor 3:    00 00 00 fe 00 43 4d 4e 0a 20 20 20 20 20 20 20 20 20
descriptor 4:    00 00 00 fe 00 4e 31 34 30 42 47 45 2d 45 34 33 0a 20
extensions:      00
checksum:        95

Manufacturer: CMN Model 1493 Serial Number --
Made week 40 of 2013
EDID version: 1.4
Digital display
6 bits per primary color channel
DisplayPort interface
Maximum image size: 31 cm x 17 cm
Gamma: 2.20
Supported color formats: RGB 4:4:4
First detailed timing is preferred timing
Established timings supported:
Standard timings supported:
Detailed mode: Clock 76.420 MHz, 309 mm x 173 mm
               1366 1434 1479 1592 hborder 0
                768  772  779  800 vborder 0
               -hsync -vsync 
ASCII string: N140BGE
ASCII string: CMN
ASCII string: N140BGE
Checksum: 0x95 (valid)
EDID block does NOT conform to EDID 1.3!
	Missing name descriptor
	Missing monitor ranges
	Detailed block string not properly terminated
