
EDID (hex):
00ffffffffffff00410c55c15e740000
0d1e010380351e782a0565a756529c27
0f5054bfef00d1c0b300950081808140
81c001010101023a801871382d40582c
45000f282100001e2a4480a070382740
302035000f282100001a000000fc0050
484c2032343356370a202020000000fd
00324c1e5311000a202020202020015b
02031ef14b101f051404130312021101
230907078301000065030c0010008c0a
d08a20e02d10103e96000f2821000018
011d007251d01e206e2855000f282100
001e8c0ad08a20e02d10103e96000f28
210000188c0ad090204031200c405500
0f282100001800000000000000000000
000000000000000000000000000000cd

Extracted contents:
header:          00 ff ff ff ff ff ff 00
serial number:   41 0c 55 c1 5e 74 00 00 0d 1e
version:         01 03
basic params:    80 35 1e 78 2a
chroma info:     05 65 a7 56 52 9c 27 0f 50 54
established:     bf ef 00
standard:        d1 c0 b3 00 95 00 81 80 81 40 81 c0 01 01 01 01
descriptor 1:    02 3a 80 18 71 38 2d 40 58 2c 45 00 0f 28 21 00 00 1e
descriptor 2:    2a 44 80 a0 70 38 27 40 30 20 35 00 0f 28 21 00 00 1a
descriptor 3:    00 00 00 fc 00 50 48 4c 20 32 34 33 56 37 0a 20 20 20
descriptor 4:    00 00 00 fd 00 32 4c 1e 53 11 00 0a 20 20 20 20 20 20
extensions:      01
checksum:        5b

Manufacturer: PHL Model c155 Serial Number --
Made week 13 of 2020
EDID version: 1.3
Digital display
Maximum image size: 53 cm x 30 cm
Gamma: 2.20
DPMS levels: Off
Supported color formats: RGB 4:4:4, YCrCb 4:2:2
First detailed timing is preferred timing
Established timings supported:
  720x400@70Hz
  640x480@60Hz
  640x480@67Hz
  640x480@72Hz
  640x480@75Hz
  800x600@56Hz
  800x600@60Hz
  800x600@72Hz
  800x600@75Hz
  832x624@75Hz
  1024x768@60Hz
  1024x768@70Hz
  1024x768@75Hz
  1280x1024@75Hz
Standard timings supported:
  1920x1080@60Hz
  1680x1050@60Hz
  1440x900@60Hz
  1280x1024@60Hz
  1280x960@60Hz
  1280x720@60Hz
Detailed mode: Clock 148.500 MHz, 527 mm x 296 mm
               1920 2008 2052 2200 hborder 0
               1080 1084 1089 1125 vborder 0
               +hsync +vsync 
Detailed mode: Clock 174.500 MHz, 527 mm x 296 mm
               1920 1968 2000 2080 hborder 0
               1080 1083 1088 1119 vborder 0
               +hsync -vsync 
Monitor name: PHL
Monitor ranges (GTF): 50-76Hz V, 30-83kHz H, max dotclock 170MHz
Has 1 extension blocks
Checksum: 0x5b (valid)

CEA extension block
Extension version: 3
26 bytes of CEA data
  Video data block
    VIC 16 1920x1080@60Hz 
    VIC 31 1920x1080@50Hz 
    VIC 05 1920x1080i@60Hz 
    VIC 20 1920x1080i@50Hz 
    VIC 04 1280x720@60Hz 
    VIC 19 1280x720@50Hz 
    VIC 03 720x480@60Hz 
    VIC 18 720x576@50Hz 
    VIC 02 720x480@60Hz 
    VIC 17 720x576@50Hz 
    VIC 01 640x480@60Hz 
  Audio data block
    Linear PCM, max channels 1
    Supported sample rates (kHz): 48 44.1 32
    Supported sample sizes (bits): 24 20 16
  Speaker allocation data block
  Vendor-specific data block, OUI 000c03 (HDMI)
    Source physical address 1.0.0.0
Underscans PC formats by default
Basic audio support
Supports YCbCr 4:4:4
Supports YCbCr 4:2:2
1 native detailed modes
Detailed mode: Clock 27.000 MHz, 527 mm x 296 mm
                720  736  798  858 hborder 0
                480  489  495  525 vborder 0
               -hsync -vsync 
Detailed mode: Clock 74.250 MHz, 527 mm x 296 mm
               1280 1390 1430 1650 hborder 0
                720  725  730  750 vborder 0
               +hsync +vsync 
Detailed mode: Clock 27.000 MHz, 527 mm x 296 mm
                720  736  798  858 hborder 0
                480  489  495  525 vborder 0
               -hsync -vsync 
Detailed mode: Clock 27.000 MHz, 527 mm x 296 mm
                720  732  796  864 hborder 0
                576  581  586  625 vborder 0
               -hsync -vsync 
Checksum: 0xcd (valid)

EDID block does NOT conform to EDID 1.3!
	Detailed block string not properly terminated
