
EDID (hex):
00ffffffffffff00367f05900a000000
0014010380211578ca00000000000000
00000000000001010101010101010101
010101010101d840804071b026406040
36004bcf100000190000001000000000
00000000000000000a20000000100000
000000000000000000000a2000000010
004c513135344d314c573143200a00a0

edid-decode (hex):

00 ff ff ff ff ff ff 00 36 7f 05 90 0a 00 00 00
00 14 01 03 80 21 15 78 ca 00 00 00 00 00 00 00
00 00 00 00 00 00 01 01 01 01 01 01 01 01 01 01
01 01 01 01 01 01 d8 40 80 40 71 b0 26 40 60 40
36 00 4b cf 10 00 00 19 00 00 00 10 00 00 00 00
00 00 00 00 00 00 00 00 0a 20 00 00 00 10 00 00
00 00 00 00 00 00 00 00 00 00 0a 20 00 00 00 10
00 4c 51 31 35 34 4d 31 4c 57 31 43 20 0a 00 a0

----------------

Block 0, Base EDID:
  EDID Structure Version & Revision: 1.3
  Vendor & Product Identification:
    Manufacturer: MS_
    Model: 36869
    Serial Number: 10
    Made in: 2010
  Basic Display Parameters & Features:
    Digital display
    Maximum image size: 33 cm x 21 cm
    Gamma: 2.20
    DPMS levels: Standby Suspend
    RGB color display
    First detailed timing is the preferred timing
  Color Characteristics:
    Red  : 0.0000, 0.0000
    Green: 0.0000, 0.0000
    Blue : 0.0000, 0.0000
    White: 0.0000, 0.0000
  Established Timings I & II: none
  Standard Timings: none
  Detailed Timing Descriptors:
    DTD 1:  1920x1200   59.860374 Hz  16:10    74.107 kHz    166.000000 MHz (331 mm x 207 mm)
                 Hfront   96 Hsync  64 Hback  160 Hpol N
                 Vfront    3 Vsync   6 Vback   29 Vpol N
    Dummy Descriptor:
    Dummy Descriptor:
    Dummy Descriptor:
Checksum: 0xa0
