
EDID (hex):
00ffffffffffff0025b0c11901010101
1514010380291a78ead2b5a358539c25
0f5054bfef8031476146714f8180904f
9500950f01016b35a0f051842a306098
360098ff1000001c000000fc002a3139
57312a420a2020202020000000fd0038
4c1f530e000a202020202020000000ff
0056493035304e303231343532310067

edid-decode (hex):

00 ff ff ff ff ff ff 00 25 b0 c1 19 01 01 01 01
15 14 01 03 80 29 1a 78 ea d2 b5 a3 58 53 9c 25
0f 50 54 bf ef 80 31 47 61 46 71 4f 81 80 90 4f
95 00 95 0f 01 01 6b 35 a0 f0 51 84 2a 30 60 98
36 00 98 ff 10 00 00 1c 00 00 00 fc 00 2a 31 39
57 31 2a 42 0a 20 20 20 20 20 00 00 00 fd 00 38
4c 1f 53 0e 00 0a 20 20 20 20 20 20 00 00 00 ff
00 56 49 30 35 30 4e 30 32 31 34 35 32 31 00 67

----------------

Block 0, Base EDID:
  EDID Structure Version & Revision: 1.3
  Vendor & Product Identification:
    Manufacturer: IMP
    Model: 6593
    Serial Number: 16843009
    Made in: week 21 of 2010
  Basic Display Parameters & Features:
    Digital display
    Maximum image size: 41 cm x 26 cm
    Gamma: 2.20
    DPMS levels: Standby Suspend Off
    RGB color display
    First detailed timing is the preferred timing
  Color Characteristics:
    Red  : 0.6396, 0.3447
    Green: 0.3242, 0.6113
    Blue : 0.1464, 0.0615
    White: 0.3134, 0.3291
  Established Timings I & II:
    IBM     :   720x400    70.081663 Hz   9:5     31.467 kHz     28.320000 MHz
    DMT 0x04:   640x480    59.940476 Hz   4:3     31.469 kHz     25.175000 MHz
    Apple   :   640x480    66.666667 Hz   4:3     35.000 kHz     30.240000 MHz
    DMT 0x05:   640x480    72.808802 Hz   4:3     37.861 kHz     31.500000 MHz
    DMT 0x06:   640x480    75.000000 Hz   4:3     37.500 kHz     31.500000 MHz
    DMT 0x08:   800x600    56.250000 Hz   4:3     35.156 kHz     36.000000 MHz
    DMT 0x09:   800x600    60.316541 Hz   4:3     37.879 kHz     40.000000 MHz
    DMT 0x0a:   800x600    72.187572 Hz   4:3     48.077 kHz     50.000000 MHz
    DMT 0x0b:   800x600    75.000000 Hz   4:3     46.875 kHz     49.500000 MHz
    Apple   :   832x624    74.551266 Hz   4:3     49.726 kHz     57.284000 MHz
    DMT 0x10:  1024x768    60.003840 Hz   4:3     48.363 kHz     65.000000 MHz
    DMT 0x11:  1024x768    70.069359 Hz   4:3     56.476 kHz     75.000000 MHz
    DMT 0x12:  1024x768    75.028582 Hz   4:3     60.023 kHz     78.750000 MHz
    DMT 0x24:  1280x1024   75.024675 Hz   5:4     79.976 kHz    135.000000 MHz
    Apple   :  1152x870    75.061550 Hz 192:145   68.681 kHz    100.000000 MHz
  Standard Timings:
    GTF     :   640x480    66.999194 Hz   4:3     33.433 kHz     27.281000 MHz
    GTF     :  1024x768    65.999558 Hz   4:3     52.668 kHz     71.628000 MHz
    DMT 0x15:  1152x864    75.000000 Hz   4:3     67.500 kHz    108.000000 MHz
    DMT 0x23:  1280x1024   60.019740 Hz   5:4     63.981 kHz    108.000000 MHz
    DMT 0x2b:  1400x1050   74.866680 Hz   4:3     82.278 kHz    156.000000 MHz
    DMT 0x2f:  1440x900    59.887445 Hz  16:10    55.935 kHz    106.500000 MHz
    DMT 0x30:  1440x900    74.984427 Hz  16:10    70.635 kHz    136.750000 MHz
  Detailed Timing Descriptors:
    DTD 1:  1440x900    74.984427 Hz  16:10    70.635 kHz    136.750000 MHz (408 mm x 255 mm)
                 Hfront   96 Hsync 152 Hback  248 Hpol N
                 Vfront    3 Vsync   6 Vback   33 Vpol P
    Display Product Name: '*19W1*B'
    Display Range Limits:
      Monitor ranges (GTF): 56-76 Hz V, 31-83 kHz H, max dotclock 140 MHz
    Display Product Serial Number: 'VI050N0214521'
Checksum: 0x67
