
EDID (hex):
00ffffffffffff0026cd060001010101
171c0103805831782a0d4dab4f42a626
0e474abfef80e1c0d100d1c0b300a940
a9c08180810004740030f2705a80b058
8a006ee53100001e000000fd00174c0f
8a1e000a202020202020000000ff0031
313433343832333030343738000000fc
00504c3430373155480a20202020014d
02032df0520102030405060710111213
1415161fdddedf23090707830100006d
030c002000b83c200060010203047400
30f2705a80b0588a006ee53100001e04
74801871705a80582c8a006ee5310000
1e023a801871382d40582c45006ee531
00001e011d007251d01e206e2855006e
e53100001e00000000000000000000fa

Extracted contents:
header:          00 ff ff ff ff ff ff 00
serial number:   26 cd 06 00 01 01 01 01 17 1c
version:         01 03
basic params:    80 58 31 78 2a
chroma info:     0d 4d ab 4f 42 a6 26 0e 47 4a
established:     bf ef 80
standard:        e1 c0 d1 00 d1 c0 b3 00 a9 40 a9 c0 81 80 81 00
descriptor 1:    04 74 00 30 f2 70 5a 80 b0 58 8a 00 6e e5 31 00 00 1e
descriptor 2:    00 00 00 fd 00 17 4c 0f 8a 1e 00 0a 20 20 20 20 20 20
descriptor 3:    00 00 00 ff 00 31 31 34 33 34 38 32 33 30 30 34 37 38
descriptor 4:    00 00 00 fc 00 50 4c 34 30 37 31 55 48 0a 20 20 20 20
extensions:      01
checksum:        4d

EDID version: 1.3
Manufacturer: IVM Model 6 Serial Number --
Made in week 23 of 2018
Digital display
Maximum image size: 88 cm x 49 cm
Gamma: 2.20
DPMS levels: Off
RGB color display
First detailed timing is preferred timing
Display x,y Chromaticity:
  Red:   0.6679, 0.3085
  Green: 0.2607, 0.6494
  Blue:  0.1494, 0.0546
  White: 0.2802, 0.2900
Established timings supported:
  720x400@70Hz 9:5 HorFreq: 31469 Hz Clock: 28.320 MHz
  640x480@60Hz 4:3 HorFreq: 31469 Hz Clock: 25.175 MHz
  640x480@67Hz 4:3 HorFreq: 35000 Hz Clock: 30.240 MHz
  640x480@72Hz 4:3 HorFreq: 37900 Hz Clock: 31.500 MHz
  640x480@75Hz 4:3 HorFreq: 37500 Hz Clock: 31.500 MHz
  800x600@56Hz 4:3 HorFreq: 35200 Hz Clock: 36.000 MHz
  800x600@60Hz 4:3 HorFreq: 37900 Hz Clock: 40.000 MHz
  800x600@72Hz 4:3 HorFreq: 48100 Hz Clock: 50.000 MHz
  800x600@75Hz 4:3 HorFreq: 46900 Hz Clock: 49.500 MHz
  832x624@75Hz 4:3 HorFreq: 49726 Hz Clock: 57.284 MHz
  1024x768@60Hz 4:3 HorFreq: 48400 Hz Clock: 65.000 MHz
  1024x768@70Hz 4:3 HorFreq: 56500 Hz Clock: 75.000 MHz
  1024x768@75Hz 4:3 HorFreq: 60000 Hz Clock: 78.750 MHz
  1280x1024@75Hz 5:4 HorFreq: 80000 Hz Clock: 135.000 MHz
  1152x870@75Hz 192:145 HorFreq: 67500 Hz Clock: 108.000 MHz
Standard timings supported:
  2048x1152@60Hz 16:9
  1920x1200@60Hz 16:10 HorFreq: 74000 Hz Clock: 154.000 MHz
  1920x1080@60Hz 16:9
  1680x1050@60Hz 16:10 HorFreq: 64700 Hz Clock: 119.000 MHz
  1600x1200@60Hz 4:3 HorFreq: 75000 Hz Clock: 162.000 MHz
  1600x900@60Hz 16:9
  1280x1024@60Hz 5:4 HorFreq: 64000 Hz Clock: 108.000 MHz
  1280x800@60Hz 16:10
Detailed mode: Clock 297.000 MHz, 878 mm x 485 mm
               3840 4016 4104 4400 hborder 0
               2160 2168 2178 2250 vborder 0
               +hsync +vsync 
               VertFreq: 30 Hz, HorFreq: 67500 Hz
Monitor ranges (GTF): 23-76Hz V, 15-138kHz H, max dotclock 300MHz
Serial number: --
Monitor name: PL4071UH
Has 1 extension blocks
Checksum: 0x4d (valid)

CTA extension block
Extension version: 3
41 bytes of CTA data
  Video data block
    VIC   1 640x480@60Hz 4:3  HorFreq: 31469 Hz Clock: 25.175 MHz
    VIC   2 720x480@60Hz 4:3  HorFreq: 31469 Hz Clock: 27.000 MHz
    VIC   3 720x480@60Hz 16:9  HorFreq: 31469 Hz Clock: 27.000 MHz
    VIC   4 1280x720@60Hz 16:9  HorFreq: 45000 Hz Clock: 74.250 MHz
    VIC   5 1920x1080i@60Hz 16:9  HorFreq: 33750 Hz Clock: 74.250 MHz
    VIC   6 1440x480i@60Hz 4:3  HorFreq: 15734 Hz Clock: 27.000 MHz
    VIC   7 1440x480i@60Hz 16:9  HorFreq: 15734 Hz Clock: 27.000 MHz
    VIC  16 1920x1080@60Hz 16:9  HorFreq: 67500 Hz Clock: 148.500 MHz
    VIC  17 720x576@50Hz 4:3  HorFreq: 31250 Hz Clock: 27.000 MHz
    VIC  18 720x576@50Hz 16:9  HorFreq: 31250 Hz Clock: 27.000 MHz
    VIC  19 1280x720@50Hz 16:9  HorFreq: 37500 Hz Clock: 74.250 MHz
    VIC  20 1920x1080i@50Hz 16:9  HorFreq: 28125 Hz Clock: 74.250 MHz
    VIC  21 1440x576i@50Hz 4:3  HorFreq: 15625 Hz Clock: 27.000 MHz
    VIC  22 1440x576i@50Hz 16:9  HorFreq: 15625 Hz Clock: 27.000 MHz
    VIC  31 1920x1080@50Hz 16:9  HorFreq: 56250 Hz Clock: 148.500 MHz
    VIC 221 Unknown mode  HorFreq: 0 Hz Clock: 0.000 MHz
    VIC 222 Unknown mode  HorFreq: 0 Hz Clock: 0.000 MHz
    VIC 223 Unknown mode  HorFreq: 0 Hz Clock: 0.000 MHz
  Audio data block
    Linear PCM, max channels 2
      Supported sample rates (kHz): 48 44.1 32
      Supported sample sizes (bits): 24 20 16
  Speaker allocation data block
    Speaker map:
      FL/FR - Front Left/Right
  Vendor-specific data block, OUI 000c03 (HDMI)
    Source physical address 2.0.0.0
    Supports_AI
    DC_36bit
    DC_30bit
    DC_Y444
    Maximum TMDS clock: 300MHz
    Extended HDMI video details:
      HDMI VIC 1 3840x2160@30Hz 16:9 HorFreq: 67500 Hz Clock: 297.000 MHz
      HDMI VIC 2 3840x2160@25Hz 16:9 HorFreq: 56250 Hz Clock: 297.000 MHz
      HDMI VIC 3 3840x2160@24Hz 16:9 HorFreq: 54000 Hz Clock: 297.000 MHz
Underscans PC formats by default
Basic audio support
Supports YCbCr 4:4:4
Supports YCbCr 4:2:2
0 native detailed modes
Detailed mode: Clock 297.000 MHz, 878 mm x 485 mm
               3840 4016 4104 4400 hborder 0
               2160 2168 2178 2250 vborder 0
               +hsync +vsync 
               VertFreq: 30 Hz, HorFreq: 67500 Hz
Detailed mode: Clock 297.000 MHz, 878 mm x 485 mm
               1920 2008 2052 2200 hborder 0
               2160 2168 2178 2250 vborder 0
               +hsync +vsync 
               VertFreq: 60 Hz, HorFreq: 135000 Hz
Detailed mode: Clock 148.500 MHz, 878 mm x 485 mm
               1920 2008 2052 2200 hborder 0
               1080 1084 1089 1125 vborder 0
               +hsync +vsync 
               VertFreq: 60 Hz, HorFreq: 67500 Hz
Detailed mode: Clock 74.250 MHz, 878 mm x 485 mm
               1280 1390 1430 1650 hborder 0
                720  725  730  750 vborder 0
               +hsync +vsync 
               VertFreq: 60 Hz, HorFreq: 45000 Hz
Checksum: 0xfa (valid)

EDID block does not conform at all!
	Both the serial number and the serial string are set
Warning: HDMI VIC Codes must have their CTA-861 VIC equivalents in the VSB
