
EDID (hex):
00ffffffffffff0061a904b001000000
161f0103803c21782a1f65a455509f26
0c5054bdcf00714f8180818c81009500
950fa9c0b300023a801871382d40582c
450056502100001e000000fd00324b0f
6413000a202020202020000000ff0033
323135303030303039313337000000fc
004d69203237204e46474c0a20200160
02031ef149010312130414051f106703
0c00100000242309070783010000011d
007251d01e206e28550056502100001e
662156aa51001e30468f330056502100
001ee04580c870382d40302855005650
2100001e0e1f008051001e3030203700
56502100001e00000000000000000000
00000000000000000000000000000028

Extracted contents:
header:          00 ff ff ff ff ff ff 00
serial number:   61 a9 04 b0 01 00 00 00 16 1f
version:         01 03
basic params:    80 3c 21 78 2a
chroma info:     1f 65 a4 55 50 9f 26 0c 50 54
established:     bd cf 00
standard:        71 4f 81 80 81 8c 81 00 95 00 95 0f a9 c0 b3 00
descriptor 1:    02 3a 80 18 71 38 2d 40 58 2c 45 00 56 50 21 00 00 1e
descriptor 2:    00 00 00 fd 00 32 4b 0f 64 13 00 0a 20 20 20 20 20 20
descriptor 3:    00 00 00 ff 00 33 32 31 35 30 30 30 30 30 39 31 33 37
descriptor 4:    00 00 00 fc 00 4d 69 20 32 37 20 4e 46 47 4c 0a 20 20
extensions:      01
checksum:        60

EDID version: 1.3
Manufacturer: XMI Model b004 Serial Number --
Made in week 22 of 2021
Digital display
Maximum image size: 60 cm x 33 cm
Gamma: 2.20
DPMS levels: Off
RGB color display
First detailed timing is preferred timing
Display x,y Chromaticity:
  Red:   0.6406, 0.3330
  Green: 0.3154, 0.6240
  Blue:  0.1494, 0.0488
  White: 0.3134, 0.3291
Established timings supported:
  720x400@70Hz 9:5 HorFreq: 31469 Hz Clock: 28.320 MHz
  640x480@60Hz 4:3 HorFreq: 31469 Hz Clock: 25.175 MHz
  640x480@67Hz 4:3 HorFreq: 35000 Hz Clock: 30.240 MHz
  640x480@72Hz 4:3 HorFreq: 37900 Hz Clock: 31.500 MHz
  640x480@75Hz 4:3 HorFreq: 37500 Hz Clock: 31.500 MHz
  800x600@60Hz 4:3 HorFreq: 37900 Hz Clock: 40.000 MHz
  800x600@72Hz 4:3 HorFreq: 48100 Hz Clock: 50.000 MHz
  800x600@75Hz 4:3 HorFreq: 46900 Hz Clock: 49.500 MHz
  1024x768@60Hz 4:3 HorFreq: 48400 Hz Clock: 65.000 MHz
  1024x768@70Hz 4:3 HorFreq: 56500 Hz Clock: 75.000 MHz
  1024x768@75Hz 4:3 HorFreq: 60000 Hz Clock: 78.750 MHz
  1280x1024@75Hz 5:4 HorFreq: 80000 Hz Clock: 135.000 MHz
Standard timings supported:
  1152x864@75Hz 4:3 HorFreq: 67500 Hz Clock: 108.000 MHz
  1280x1024@60Hz 5:4 HorFreq: 64000 Hz Clock: 108.000 MHz
  1280x1024@72Hz 5:4
  1280x800@60Hz 16:10
  1440x900@60Hz 16:10 HorFreq: 55500 Hz Clock: 88.750 MHz
  1440x900@75Hz 16:10 HorFreq: 82300 Hz Clock: 156.000 MHz
  1600x900@60Hz 16:9
  1680x1050@60Hz 16:10 HorFreq: 64700 Hz Clock: 119.000 MHz
Detailed mode: Clock 148.500 MHz, 598 mm x 336 mm
               1920 2008 2052 2200 hborder 0
               1080 1084 1089 1125 vborder 0
               +hsync +vsync 
               VertFreq: 60 Hz, HorFreq: 67500 Hz
Monitor ranges (GTF): 50-75Hz V, 15-100kHz H, max dotclock 190MHz
Serial number: --
Monitor name: Mi 27 NFGL
Has 1 extension blocks
Checksum: 0x60 (valid)

CTA extension block
Extension version: 3
26 bytes of CTA data
  Video data block
    VIC   1 640x480@60Hz 4:3  HorFreq: 31469 Hz Clock: 25.175 MHz
    VIC   3 720x480@60Hz 16:9  HorFreq: 31469 Hz Clock: 27.000 MHz
    VIC  18 720x576@50Hz 16:9  HorFreq: 31250 Hz Clock: 27.000 MHz
    VIC  19 1280x720@50Hz 16:9  HorFreq: 37500 Hz Clock: 74.250 MHz
    VIC   4 1280x720@60Hz 16:9  HorFreq: 45000 Hz Clock: 74.250 MHz
    VIC  20 1920x1080i@50Hz 16:9  HorFreq: 28125 Hz Clock: 74.250 MHz
    VIC   5 1920x1080i@60Hz 16:9  HorFreq: 33750 Hz Clock: 74.250 MHz
    VIC  31 1920x1080@50Hz 16:9  HorFreq: 56250 Hz Clock: 148.500 MHz
    VIC  16 1920x1080@60Hz 16:9  HorFreq: 67500 Hz Clock: 148.500 MHz
  Vendor-specific data block, OUI 000c03 (HDMI)
    Source physical address 1.0.0.0
    Maximum TMDS clock: 180MHz
  Audio data block
    Linear PCM, max channels 2
      Supported sample rates (kHz): 48 44.1 32
      Supported sample sizes (bits): 24 20 16
  Speaker allocation data block
    Speaker map:
      FL/FR - Front Left/Right
Underscans PC formats by default
Basic audio support
Supports YCbCr 4:4:4
Supports YCbCr 4:2:2
1 native detailed modes
Detailed mode: Clock 74.250 MHz, 598 mm x 336 mm
               1280 1390 1430 1650 hborder 0
                720  725  730  750 vborder 0
               +hsync +vsync 
               VertFreq: 60 Hz, HorFreq: 45000 Hz
Detailed mode: Clock 85.500 MHz, 598 mm x 336 mm
               1366 1436 1579 1792 hborder 0
                768  771  774  798 vborder 0
               +hsync +vsync 
               VertFreq: 59 Hz, HorFreq: 47712 Hz
Detailed mode: Clock 178.880 MHz, 598 mm x 336 mm
               1920 1968 2008 2120 hborder 0
               1080 1085 1090 1125 vborder 0
               +hsync +vsync 
               VertFreq: 75 Hz, HorFreq: 84377 Hz
Detailed mode: Clock 79.500 MHz, 598 mm x 336 mm
               1280 1328 1360 1664 hborder 0
                768  771  778  798 vborder 0
               +hsync +vsync 
               VertFreq: 59 Hz, HorFreq: 47776 Hz
Checksum: 0x28 (valid)

EDID block does not conform at all!
	Both the serial number and the serial string are set
