
EDID (hex):
00ffffffffffff0009e5df0600000000
011a0104a51f1178028631a3544e9b25
0e505400000001010101010101010101
0101010101013c3780de703814403c20
360035ad1000001a302c80de70381440
3020360035ad1000001a000000fe0042
4f452043510a202020202020000000fe
00485631343046484d2d4e36310a0049

edid-decode (hex):

00 ff ff ff ff ff ff 00 09 e5 df 06 00 00 00 00
01 1a 01 04 a5 1f 11 78 02 86 31 a3 54 4e 9b 25
0e 50 54 00 00 00 01 01 01 01 01 01 01 01 01 01
01 01 01 01 01 01 3c 37 80 de 70 38 14 40 3c 20
36 00 35 ad 10 00 00 1a 30 2c 80 de 70 38 14 40
30 20 36 00 35 ad 10 00 00 1a 00 00 00 fe 00 42
4f 45 20 43 51 0a 20 20 20 20 20 20 00 00 00 fe
00 48 56 31 34 30 46 48 4d 2d 4e 36 31 0a 00 49

----------------

Block 0, Base EDID:
  EDID Structure Version & Revision: 1.4
  Vendor & Product Identification:
    Manufacturer: BOE
    Model: 1759
    Made in: week 1 of 2016
  Basic Display Parameters & Features:
    Digital display
    Bits per primary color channel: 8
    DisplayPort interface
    Maximum image size: 31 cm x 17 cm
    Gamma: 2.20
    Supported color formats: RGB 4:4:4
    First detailed timing includes the native pixel format and preferred refresh rate
  Color Characteristics:
    Red  : 0.6386, 0.3281
    Green: 0.3056, 0.6074
    Blue : 0.1445, 0.0576
    White: 0.3125, 0.3291
  Established Timings I & II: none
  Standard Timings: none
  Detailed Timing Descriptors:
    DTD 1:  1920x1080   60.011884 Hz  16:9     66.013 kHz    141.400000 MHz (309 mm x 173 mm)
                 Hfront   60 Hsync  32 Hback  130 Hpol P
                 Vfront    3 Vsync   6 Vback   11 Vpol N
    DTD 2:  1920x1080   48.009507 Hz  16:9     52.810 kHz    113.120000 MHz (309 mm x 173 mm)
                 Hfront   48 Hsync  32 Hback  142 Hpol P
                 Vfront    3 Vsync   6 Vback   11 Vpol N
    Alphanumeric Data String: 'BOE CQ'
    Alphanumeric Data String: 'HV140FHM-N61'
Checksum: 0x49
