
EDID (hex):
00ffffffffffff0005b4802302000000
141e0104b5341f780bcf75a755469824
1050542dcf00818095009040a9c0a940
b30001017140565e00a0a0a029503020
35000f282100001a0000001000000000
00000000000000000000000000fc0041
4e2d3233385730334b2d3154000000fd
00304b868622010a2020202020200144
020331f2441103841023090707830100
006c030c001000984020200201410576
00a0e305c000e60605e3626200e305c0
00057600a0a0a0295030203500bc8621
00001e00000000000000000000000000
00000000000000000000000000000000
00000000000000000000000000000000
0000000000000000000000000000006a

edid-decode (hex):

00 ff ff ff ff ff ff 00 05 b4 80 23 02 00 00 00
14 1e 01 04 b5 34 1f 78 0b cf 75 a7 55 46 98 24
10 50 54 2d cf 00 81 80 95 00 90 40 a9 c0 a9 40
b3 00 01 01 71 40 56 5e 00 a0 a0 a0 29 50 30 20
35 00 0f 28 21 00 00 1a 00 00 00 10 00 00 00 00
00 00 00 00 00 00 00 00 00 00 00 00 00 fc 00 41
4e 2d 32 33 38 57 30 33 4b 2d 31 54 00 00 00 fd
00 30 4b 86 86 22 01 0a 20 20 20 20 20 20 01 44

02 03 31 f2 44 11 03 84 10 23 09 07 07 83 01 00
00 6c 03 0c 00 10 00 98 40 20 20 02 01 41 05 76
00 a0 e3 05 c0 00 e6 06 05 e3 62 62 00 e3 05 c0
00 05 76 00 a0 a0 a0 29 50 30 20 35 00 bc 86 21
00 00 1e 00 00 00 00 00 00 00 00 00 00 00 00 00
00 00 00 00 00 00 00 00 00 00 00 00 00 00 00 00
00 00 00 00 00 00 00 00 00 00 00 00 00 00 00 00
00 00 00 00 00 00 00 00 00 00 00 00 00 00 00 6a

----------------

Block 0, Base EDID:
  EDID Structure Version & Revision: 1.4
  Vendor & Product Identification:
    Manufacturer: AMT
    Model: 9088
    Serial Number: 2
    Made in: week 20 of 2020
  Basic Display Parameters & Features:
    Digital display
    Bits per primary color channel: 10
    DisplayPort interface
    Maximum image size: 52 cm x 31 cm
    Gamma: 2.20
    Supported color formats: RGB 4:4:4, YCrCb 4:4:4
    First detailed timing includes the native pixel format and preferred refresh rate
    Display is continuous frequency
  Color Characteristics:
    Red  : 0.6552, 0.3320
    Green: 0.2763, 0.5966
    Blue : 0.1416, 0.0654
    White: 0.3134, 0.3291
  Established Timings I & II:
    DMT 0x04:   640x480    59.940476 Hz   4:3     31.469 kHz     25.175000 MHz
    DMT 0x05:   640x480    72.808802 Hz   4:3     37.861 kHz     31.500000 MHz
    DMT 0x06:   640x480    75.000000 Hz   4:3     37.500 kHz     31.500000 MHz
    DMT 0x09:   800x600    60.316541 Hz   4:3     37.879 kHz     40.000000 MHz
    DMT 0x0a:   800x600    72.187572 Hz   4:3     48.077 kHz     50.000000 MHz
    DMT 0x0b:   800x600    75.000000 Hz   4:3     46.875 kHz     49.500000 MHz
    DMT 0x10:  1024x768    60.003840 Hz   4:3     48.363 kHz     65.000000 MHz
    DMT 0x11:  1024x768    70.069359 Hz   4:3     56.476 kHz     75.000000 MHz
    DMT 0x12:  1024x768    75.028582 Hz   4:3     60.023 kHz     78.750000 MHz
    DMT 0x24:  1280x1024   75.024675 Hz   5:4     79.976 kHz    135.000000 MHz
  Standard Timings:
    DMT 0x23:  1280x1024   60.019740 Hz   5:4     63.981 kHz    108.000000 MHz
    DMT 0x2f:  1440x900    59.887445 Hz  16:10    55.935 kHz    106.500000 MHz
    DMT 0x2a:  1400x1050   59.978442 Hz   4:3     65.317 kHz    121.750000 MHz
    DMT 0x53:  1600x900    60.000000 Hz  16:9     60.000 kHz    108.000000 MHz (RB)
    DMT 0x33:  1600x1200   60.000000 Hz   4:3     75.000 kHz    162.000000 MHz
    DMT 0x3a:  1680x1050   59.954250 Hz  16:10    65.290 kHz    146.250000 MHz
    GTF     :  1152x864    60.000000 Hz   4:3     53.700 kHz     81.624000 MHz
  Detailed Timing Descriptors:
    DTD 1:  2560x1440   59.950550 Hz  16:9     88.787 kHz    241.500000 MHz (527 mm x 296 mm)
                 Hfront   48 Hsync  32 Hback   80 Hpol P
                 Vfront    3 Vsync   5 Vback   33 Vpol N
    Dummy Descriptor:
    Display Product Name: 'AN-238W03K-1T'
    Display Range Limits:
      Monitor ranges (Bare Limits): 48-75 Hz V, 134-134 kHz H, max dotclock 340 MHz
  Extension blocks: 1
Checksum: 0x44

----------------

Block 1, CTA-861 Extension Block:
  Revision: 3
  Underscans IT Video Formats by default
  Basic audio support
  Supports YCbCr 4:4:4
  Supports YCbCr 4:2:2
  Native detailed modes: 2
  Video Data Block:
    VIC  17:   720x576    50.000000 Hz   4:3     31.250 kHz     27.000000 MHz
    VIC   3:   720x480    59.940060 Hz  16:9     31.469 kHz     27.000000 MHz
    VIC   4:  1280x720    60.000000 Hz  16:9     45.000 kHz     74.250000 MHz (native)
    VIC  16:  1920x1080   60.000000 Hz  16:9     67.500 kHz    148.500000 MHz
  Audio Data Block:
    Linear PCM:
      Max channels: 2
      Supported sample rates (kHz): 48 44.1 32
      Supported sample sizes (bits): 24 20 16
  Speaker Allocation Data Block:
    FL/FR - Front Left/Right
  Vendor-Specific Data Block (HDMI), OUI 00-0C-03:
    Source physical address: 1.0.0.0
    Supports_AI
    DC_30bit
    DC_Y444
    Maximum TMDS clock: 320 MHz
    Extended HDMI video details:
      All advertised VICs are 3D-capable
      3D: Side-by-side (half, horizontal)
      3D: Top-and-bottom
      3D: Frame-packing
  Unknown CTA-861 Data Block (tag 0x00, length 5):
    76 00 a0 e3 05                                  'v....'
  Video Format Data Block:
  Unknown CTA-861 Data Block (tag 0x00, length 0):
  HDR Static Metadata Data Block:
    Electro optical transfer functions:
      Traditional gamma - SDR luminance range
      SMPTE ST2084
    Supported static metadata descriptors:
      Static metadata type 1
      Static metadata type 2
      Static metadata type 6
      Static metadata type 7
      Static metadata type 8
    Desired content max luminance: 98 (417.710 cd/m^2)
    Desired content max frame-average luminance: 98 (417.710 cd/m^2)
    Desired content min luminance: 0 (0.000 cd/m^2)
  Colorimetry Data Block:
    BT2020YCC
    BT2020RGB
  Detailed Timing Descriptors:
    DTD 2:  2560x1440   75.001489 Hz  16:9    111.077 kHz    302.130000 MHz (700 mm x 390 mm)
                 Hfront   48 Hsync  32 Hback   80 Hpol P
                 Vfront    3 Vsync   5 Vback   33 Vpol P
Checksum: 0x6a  Unused space in Extension Block: 60 bytes
