edid-decode (hex):

00 ff ff ff ff ff ff 00 10 ac a6 a0 4c 48 4d 30
0e 1c 01 04 a5 50 21 78 3a fd 25 a2 58 4f 9f 26
0d 50 54 a5 4b 00 71 4f 81 00 81 80 a9 40 d1 c0
01 01 01 01 01 01 e7 7c 70 a0 d0 a0 29 50 50 20
ca 04 1e 4f 31 00 00 1a 00 00 00 ff 00 46 31 54
31 57 38 34 31 30 4d 48 4c 0a 00 00 00 fc 00 44
45 4c 4c 20 55 33 34 31 35 57 0a 20 00 00 00 fd
00 30 55 1e 59 20 00 0a 20 20 20 20 20 20 01 49

----------------

Block 0, Base EDID:
  EDID Structure Version & Revision: 1.4
  Vendor & Product Identification:
    Manufacturer: DEL
    Model: 41126
    Serial Number: ...
    Made in: week 14 of 2018
  Basic Display Parameters & Features:
    Digital display
    Bits per primary color channel: 8
    DisplayPort interface
    Maximum image size: 80 cm x 33 cm
    Gamma: 2.20
    DPMS levels: Off
    Supported color formats: RGB 4:4:4, YCrCb 4:4:4, YCrCb 4:2:2
    First detailed timing includes the native pixel format and preferred refresh rate
  Color Characteristics:
    Red  : 0.6357, 0.3466
    Green: 0.3115, 0.6220
    Blue : 0.1484, 0.0527
    White: 0.3134, 0.3291
  Established Timings I & II:
    IBM     :   720x400    70.081663 Hz   9:5     31.467 kHz     28.320000 MHz
    DMT 0x04:   640x480    59.940476 Hz   4:3     31.469 kHz     25.175000 MHz
    DMT 0x06:   640x480    75.000000 Hz   4:3     37.500 kHz     31.500000 MHz
    DMT 0x09:   800x600    60.316541 Hz   4:3     37.879 kHz     40.000000 MHz
    DMT 0x0b:   800x600    75.000000 Hz   4:3     46.875 kHz     49.500000 MHz
    DMT 0x10:  1024x768    60.003840 Hz   4:3     48.363 kHz     65.000000 MHz
    DMT 0x12:  1024x768    75.028582 Hz   4:3     60.023 kHz     78.750000 MHz
    DMT 0x24:  1280x1024   75.024675 Hz   5:4     79.976 kHz    135.000000 MHz
  Standard Timings:
    DMT 0x15:  1152x864    75.000000 Hz   4:3     67.500 kHz    108.000000 MHz
    DMT 0x1c:  1280x800    59.810326 Hz  16:10    49.702 kHz     83.500000 MHz
    DMT 0x23:  1280x1024   60.019740 Hz   5:4     63.981 kHz    108.000000 MHz
    DMT 0x33:  1600x1200   60.000000 Hz   4:3     75.000 kHz    162.000000 MHz
    DMT 0x52:  1920x1080   60.000000 Hz  16:9     67.500 kHz    148.500000 MHz
  Detailed Timing Descriptors:
    DTD 1:  3440x1440   59.972616 Hz  43:18    88.819 kHz    319.750000 MHz (798 mm x 335 mm)
                 Hfront   80 Hsync  32 Hback   48 Hpol P
                 Vfront   28 Vsync  10 Vback    3 Vpol N
    Display Product Serial Number: ...
    Display Product Name: 'DELL U3415W'
    Display Range Limits:
      Monitor ranges (GTF): 48-85 Hz V, 30-89 kHz H, max dotclock 320 MHz
  Extension blocks: 1
Checksum: 0x49

----------------

Warnings:

Block 0, Base EDID:
  Display Range Limits: GTF support is deprecated in EDID 1.4.

Failures:

Block 0, Base EDID:
  Display Range Limits: GTF can't be combined with non-continuous frequencies.
EDID:
  Base EDID: EDID specified 1 extension block(s), but found 0 extension block(s).

EDID conformity: FAIL
