
EDID (hex):
00ffffffffffff0015c3681701010101
2f0e010380221b78eae495a3544a9b26
0f5054a1080081800101010101010101
010101010101302a009851002a403070
1300520e1100001e000000ff00323134
35353131340a20202020000000fd003b
3d1f400b000a202020202020000000fc
004d3137300a202020202020202000c2
00ffffffffffff0015c3681701010101
2f0e010380221b78eae495a3544a9b26
0f5054a1080081800101010101010101
010101010101302a009851002a403070
1300520e1100001e000000ff00323134
35353131340a20202020000000fd003b
3d1f400b000a202020202020000000fc
004d3137300a202020202020202000c2
00ffffffffffff0015c3681701010101
2f0e010380221b78eae495a3544a9b26
0f5054a1080081800101010101010101
010101010101302a009851002a403070
1300520e1100001e000000ff00323134
35353131340a20202020000000fd003b
3d1f400b000a202020202020000000fc
004d3137300a202020202020202000c2
00ffffffffffff0015c3681701010101
2f0e010380221b78eae495a3544a9b26
0f5054a1080081800101010101010101
010101010101302a009851002a403070
1300520e1100001e000000ff00323134
35353131340a20202020000000fd003b
3d1f400b000a202020202020000000fc
004d3137300a202020202020202000c2

edid-decode (hex):

00 ff ff ff ff ff ff 00 15 c3 68 17 01 01 01 01
2f 0e 01 03 80 22 1b 78 ea e4 95 a3 54 4a 9b 26
0f 50 54 a1 08 00 81 80 01 01 01 01 01 01 01 01
01 01 01 01 01 01 30 2a 00 98 51 00 2a 40 30 70
13 00 52 0e 11 00 00 1e 00 00 00 ff 00 32 31 34
35 35 31 31 34 0a 20 20 20 20 00 00 00 fd 00 3b
3d 1f 40 0b 00 0a 20 20 20 20 20 20 00 00 00 fc
00 4d 31 37 30 0a 20 20 20 20 20 20 20 20 00 c2

00 ff ff ff ff ff ff 00 15 c3 68 17 01 01 01 01
2f 0e 01 03 80 22 1b 78 ea e4 95 a3 54 4a 9b 26
0f 50 54 a1 08 00 81 80 01 01 01 01 01 01 01 01
01 01 01 01 01 01 30 2a 00 98 51 00 2a 40 30 70
13 00 52 0e 11 00 00 1e 00 00 00 ff 00 32 31 34
35 35 31 31 34 0a 20 20 20 20 00 00 00 fd 00 3b
3d 1f 40 0b 00 0a 20 20 20 20 20 20 00 00 00 fc
00 4d 31 37 30 0a 20 20 20 20 20 20 20 20 00 c2

00 ff ff ff ff ff ff 00 15 c3 68 17 01 01 01 01
2f 0e 01 03 80 22 1b 78 ea e4 95 a3 54 4a 9b 26
0f 50 54 a1 08 00 81 80 01 01 01 01 01 01 01 01
01 01 01 01 01 01 30 2a 00 98 51 00 2a 40 30 70
13 00 52 0e 11 00 00 1e 00 00 00 ff 00 32 31 34
35 35 31 31 34 0a 20 20 20 20 00 00 00 fd 00 3b
3d 1f 40 0b 00 0a 20 20 20 20 20 20 00 00 00 fc
00 4d 31 37 30 0a 20 20 20 20 20 20 20 20 00 c2

00 ff ff ff ff ff ff 00 15 c3 68 17 01 01 01 01
2f 0e 01 03 80 22 1b 78 ea e4 95 a3 54 4a 9b 26
0f 50 54 a1 08 00 81 80 01 01 01 01 01 01 01 01
01 01 01 01 01 01 30 2a 00 98 51 00 2a 40 30 70
13 00 52 0e 11 00 00 1e 00 00 00 ff 00 32 31 34
35 35 31 31 34 0a 20 20 20 20 00 00 00 fd 00 3b
3d 1f 40 0b 00 0a 20 20 20 20 20 20 00 00 00 fc
00 4d 31 37 30 0a 20 20 20 20 20 20 20 20 00 c2

----------------

Block 0, Base EDID:
  EDID Structure Version & Revision: 1.3
  Vendor & Product Identification:
    Manufacturer: ENC
    Model: 5992
    Serial Number: 16843009
    Made in: week 47 of 2004
  Basic Display Parameters & Features:
    Digital display
    Maximum image size: 34 cm x 27 cm
    Gamma: 2.20
    DPMS levels: Standby Suspend Off
    RGB color display
    First detailed timing is the preferred timing
  Color Characteristics:
    Red  : 0.6396, 0.3300
    Green: 0.2900, 0.6054
    Blue : 0.1503, 0.0595
    White: 0.3134, 0.3291
  Established Timings I & II:
    IBM     :   720x400    70.081663 Hz   9:5     31.467 kHz     28.320000 MHz
    DMT 0x04:   640x480    59.940476 Hz   4:3     31.469 kHz     25.175000 MHz
    DMT 0x09:   800x600    60.316541 Hz   4:3     37.879 kHz     40.000000 MHz
    DMT 0x10:  1024x768    60.003840 Hz   4:3     48.363 kHz     65.000000 MHz
  Standard Timings:
    DMT 0x23:  1280x1024   60.019740 Hz   5:4     63.981 kHz    108.000000 MHz
  Detailed Timing Descriptors:
    DTD 1:  1280x1024   60.019740 Hz   5:4     63.981 kHz    108.000000 MHz (338 mm x 270 mm)
                 Hfront   48 Hsync 112 Hback  248 Hpol P
                 Vfront    1 Vsync   3 Vback   38 Vpol P
    Display Product Serial Number: '21455114'
    Display Range Limits:
      Monitor ranges (GTF): 59-61 Hz V, 31-64 kHz H, max dotclock 110 MHz
    Display Product Name: 'M170'
Checksum: 0xc2

----------------

Block 1, Unknown EDID Extension Block 0x00:
  00 ff ff ff ff ff ff 00 15 c3 68 17 01 01 01 01 '..........h.....'
  2f 0e 01 03 80 22 1b 78 ea e4 95 a3 54 4a 9b 26 '/....".x....TJ.&'
  0f 50 54 a1 08 00 81 80 01 01 01 01 01 01 01 01 '.PT.............'
  01 01 01 01 01 01 30 2a 00 98 51 00 2a 40 30 70 '......0*..Q.*@0p'
  13 00 52 0e 11 00 00 1e 00 00 00 ff 00 32 31 34 '..R..........214'
  35 35 31 31 34 0a 20 20 20 20 00 00 00 fd 00 3b '55114.    .....;'
  3d 1f 40 0b 00 0a 20 20 20 20 20 20 00 00 00 fc '=.@...      ....'
  00 4d 31 37 30 0a 20 20 20 20 20 20 20 20 00 c2 '.M170.        ..'
Checksum: 0xc2

----------------

Block 2, Unknown EDID Extension Block 0x00:
  00 ff ff ff ff ff ff 00 15 c3 68 17 01 01 01 01 '..........h.....'
  2f 0e 01 03 80 22 1b 78 ea e4 95 a3 54 4a 9b 26 '/....".x....TJ.&'
  0f 50 54 a1 08 00 81 80 01 01 01 01 01 01 01 01 '.PT.............'
  01 01 01 01 01 01 30 2a 00 98 51 00 2a 40 30 70 '......0*..Q.*@0p'
  13 00 52 0e 11 00 00 1e 00 00 00 ff 00 32 31 34 '..R..........214'
  35 35 31 31 34 0a 20 20 20 20 00 00 00 fd 00 3b '55114.    .....;'
  3d 1f 40 0b 00 0a 20 20 20 20 20 20 00 00 00 fc '=.@...      ....'
  00 4d 31 37 30 0a 20 20 20 20 20 20 20 20 00 c2 '.M170.        ..'
Checksum: 0xc2

----------------

Block 3, Unknown EDID Extension Block 0x00:
  00 ff ff ff ff ff ff 00 15 c3 68 17 01 01 01 01 '..........h.....'
  2f 0e 01 03 80 22 1b 78 ea e4 95 a3 54 4a 9b 26 '/....".x....TJ.&'
  0f 50 54 a1 08 00 81 80 01 01 01 01 01 01 01 01 '.PT.............'
  01 01 01 01 01 01 30 2a 00 98 51 00 2a 40 30 70 '......0*..Q.*@0p'
  13 00 52 0e 11 00 00 1e 00 00 00 ff 00 32 31 34 '..R..........214'
  35 35 31 31 34 0a 20 20 20 20 00 00 00 fd 00 3b '55114.    .....;'
  3d 1f 40 0b 00 0a 20 20 20 20 20 20 00 00 00 fc '=.@...      ....'
  00 4d 31 37 30 0a 20 20 20 20 20 20 20 20 00 c2 '.M170.        ..'
Checksum: 0xc2
