
EDID (hex):
00ffffffffffff000dae941300000000
201c0104951d11780228659759548e27
1e505400000001010101010101010101
010101010101da1d56e250002030442d
470025a510000018000000fe004e3133
334247412d4541320a20000000fe0043
4d4e0a202020202020202020000000fe
004e3133334247412d4541320a2000d7

edid-decode (hex):

00 ff ff ff ff ff ff 00 0d ae 94 13 00 00 00 00
20 1c 01 04 95 1d 11 78 02 28 65 97 59 54 8e 27
1e 50 54 00 00 00 01 01 01 01 01 01 01 01 01 01
01 01 01 01 01 01 da 1d 56 e2 50 00 20 30 44 2d
47 00 25 a5 10 00 00 18 00 00 00 fe 00 4e 31 33
33 42 47 41 2d 45 41 32 0a 20 00 00 00 fe 00 43
4d 4e 0a 20 20 20 20 20 20 20 20 20 00 00 00 fe
00 4e 31 33 33 42 47 41 2d 45 41 32 0a 20 00 d7

----------------

Block 0, Base EDID:
  EDID Structure Version & Revision: 1.4
  Vendor & Product Identification:
    Manufacturer: CMN
    Model: 5012
    Made in: week 32 of 2018
  Basic Display Parameters & Features:
    Digital display
    Bits per primary color channel: 6
    DisplayPort interface
    Maximum image size: 29 cm x 17 cm
    Gamma: 2.20
    Supported color formats: RGB 4:4:4
    First detailed timing includes the native pixel format and preferred refresh rate
  Color Characteristics:
    Red  : 0.5898, 0.3496
    Green: 0.3300, 0.5546
    Blue : 0.1533, 0.1191
    White: 0.3134, 0.3291
  Established Timings I & II: none
  Standard Timings: none
  Detailed Timing Descriptors:
    DTD 1:  1366x768    60.003141 Hz 683:384   48.003 kHz     76.420000 MHz (293 mm x 165 mm)
                 Hfront   68 Hsync  45 Hback  113 Hpol N
                 Vfront    4 Vsync   7 Vback   21 Vpol N
    Alphanumeric Data String: 'N133BGA-EA2'
    Alphanumeric Data String: 'CMN'
    Alphanumeric Data String: 'N133BGA-EA2'
Checksum: 0xd7
