
EDID (hex):
00ffffffffffff0006af3d2100000000
001a0104951f117802a2b59157589428
1c505400000001010101010101010101
010101010101843a8034713828403064
310035ad1000001ad02e803471382840
3064310035ad1000001a000000fe0036
4d4e3737804231343048414e00000000
00008102a8001100000a010a2020008e

edid-decode (hex):

00 ff ff ff ff ff ff 00 06 af 3d 21 00 00 00 00
00 1a 01 04 95 1f 11 78 02 a2 b5 91 57 58 94 28
1c 50 54 00 00 00 01 01 01 01 01 01 01 01 01 01
01 01 01 01 01 01 84 3a 80 34 71 38 28 40 30 64
31 00 35 ad 10 00 00 1a d0 2e 80 34 71 38 28 40
30 64 31 00 35 ad 10 00 00 1a 00 00 00 fe 00 36
4d 4e 37 37 80 42 31 34 30 48 41 4e 00 00 00 00
00 00 81 02 a8 00 11 00 00 0a 01 0a 20 20 00 8e

----------------

Block 0, Base EDID:
  EDID Structure Version & Revision: 1.4
  Vendor & Product Identification:
    Manufacturer: AUO
    Model: 8509
    Made in: 2016
  Basic Display Parameters & Features:
    Digital display
    Bits per primary color channel: 6
    DisplayPort interface
    Maximum image size: 31 cm x 17 cm
    Gamma: 2.20
    Supported color formats: RGB 4:4:4
    First detailed timing includes the native pixel format and preferred refresh rate
  Color Characteristics:
    Red  : 0.5683, 0.3417
    Green: 0.3437, 0.5800
    Blue : 0.1582, 0.1123
    White: 0.3134, 0.3291
  Established Timings I & II: none
  Standard Timings: none
  Detailed Timing Descriptors:
    DTD 1:  1920x1080   60.031418 Hz  16:9     67.235 kHz    149.800000 MHz (309 mm x 173 mm)
                 Hfront   48 Hsync 100 Hback  160 Hpol P
                 Vfront    3 Vsync   1 Vback   36 Vpol N
    DTD 2:  1920x1080   48.025135 Hz  16:9     53.788 kHz    119.840000 MHz (309 mm x 173 mm)
                 Hfront   48 Hsync 100 Hback  160 Hpol P
                 Vfront    3 Vsync   1 Vback   36 Vpol N
    Alphanumeric Data String: '6MN77'
    Manufacturer-Specified Display Descriptor (0x00): 00 00 00 00 81 02 a8 00 11 00 00 0a 01 0a 20 20 '..............  '
Checksum: 0x8e
