
EDID (hex):
00ffffffffffff004a8bb04001000000
23170104812c1978ea64b5ab5238ab25
13505400000001010101010101010101
010101010101d22d400062841a301850
1300bbf91000001e0000001000000000
00000000000000000000000000fc0041
494f204c43440a202020202000000010
00000000000000000000000000000096

edid-decode (hex):

00 ff ff ff ff ff ff 00 4a 8b b0 40 01 00 00 00
23 17 01 04 81 2c 19 78 ea 64 b5 ab 52 38 ab 25
13 50 54 00 00 00 01 01 01 01 01 01 01 01 01 01
01 01 01 01 01 01 d2 2d 40 00 62 84 1a 30 18 50
13 00 bb f9 10 00 00 1e 00 00 00 10 00 00 00 00
00 00 00 00 00 00 00 00 00 00 00 00 00 fc 00 41
49 4f 20 4c 43 44 0a 20 20 20 20 20 00 00 00 10
00 00 00 00 00 00 00 00 00 00 00 00 00 00 00 96

----------------

Block 0, Base EDID:
  EDID Structure Version & Revision: 1.4
  Vendor & Product Identification:
    Manufacturer: RTK
    Model: 16560
    Serial Number: 1
    Made in: week 35 of 2013
  Basic Display Parameters & Features:
    Digital display
    Color depth is undefined
    DVI interface
    Maximum image size: 44 cm x 25 cm
    Gamma: 2.20
    DPMS levels: Standby Suspend Off
    Supported color formats: RGB 4:4:4, YCrCb 4:4:4
    First detailed timing includes the native pixel format and preferred refresh rate
  Color Characteristics:
    Red  : 0.6689, 0.3222
    Green: 0.2197, 0.6679
    Blue : 0.1464, 0.0771
    White: 0.3134, 0.3291
  Established Timings I & II: none
  Standard Timings: none
  Detailed Timing Descriptors:
    DTD 1:  1600x900    59.978156 Hz  16:9     55.540 kHz    117.300000 MHz (443 mm x 249 mm)
                 Hfront   24 Hsync  80 Hback  408 Hpol P
                 Vfront    1 Vsync   3 Vback   22 Vpol P
    Dummy Descriptor:
    Display Product Name: 'AIO LCD'
    Dummy Descriptor:
Checksum: 0x96
