edid-decode (hex):

00 ff ff ff ff ff ff 00 22 64 f3 1c 18 03 00 00
13 12 01 03 0a 3b 25 78 ea 9e 71 a6 54 4c 9f 24
10 51 57 bf ef 80 d1 00 b3 00 a9 40 95 00 90 40
81 80 81 40 71 4f 28 3c 80 a0 70 b0 23 40 30 20
36 00 51 73 21 00 00 1a 00 00 00 ff 00 38 31 39
4c 42 33 51 59 30 30 37 39 32 00 00 00 fd 00 38
4b 18 50 0f 00 0a 20 20 20 20 20 20 00 00 00 fc
00 48 61 6e 6e 73 2e 47 20 48 47 32 38 31 00 01

00 ff ff ff ff ff ff 00 22 64 f3 1c 18 03 00 00
13 12 01 03 0a 3b 25 78 ea 9e 71 a6 54 4c 9f 24
10 51 57 bf ef 80 d1 00 b3 00 a9 40 95 00 90 40
81 80 81 40 71 4f 28 3c 80 a0 70 b0 23 40 30 20
36 00 51 73 21 00 00 1a 00 00 00 ff 00 38 31 39
4c 42 33 51 59 30 30 37 39 32 00 00 00 fd 00 38
4b 18 50 0f 00 0a 20 20 20 20 20 20 00 00 00 fc
00 48 61 6e 6e 73 2e 47 20 48 47 32 38 31 00 01

00 ff ff ff ff ff ff 00 22 64 f3 1c 18 03 00 00
13 12 01 03 0a 3b 25 78 ea 9e 71 a6 54 4c 9f 24
10 51 57 bf ef 80 d1 00 b3 00 a9 40 95 00 90 40
81 80 81 40 71 4f 28 3c 80 a0 70 b0 23 40 30 20
36 00 51 73 21 00 00 1a 00 00 00 ff 00 38 31 39
4c 42 33 51 59 30 30 37 39 32 00 00 00 fd 00 38
4b 18 50 0f 00 0a 20 20 20 20 20 20 00 00 00 fc
00 48 61 6e 6e 73 2e 47 20 48 47 32 38 31 00 01

----------------

Block 0, Base EDID:
  EDID Structure Version & Revision: 1.3
  Vendor & Product Identification:
    Manufacturer: HSD
    Model: 7411
    Serial Number: ...
    Made in: week 19 of 2008
  Basic Display Parameters & Features:
    Analog display
    Input voltage level: 0.7/0.3 V
    Blank level equals black level
    Sync: Separate SyncOnGreen
    Maximum image size: 59 cm x 37 cm
    Gamma: 2.20
    DPMS levels: Standby Suspend Off
    RGB color display
    First detailed timing is the preferred timing
  Color Characteristics:
    Red  : 0.6503, 0.3291
    Green: 0.2998, 0.6230
    Blue : 0.1416, 0.0654
    White: 0.3164, 0.3408
  Established Timings I & II:
    IBM     :   720x400    70.082 Hz   9:5    31.467 kHz  28.320 MHz
    DMT 0x04:   640x480    59.940 Hz   4:3    31.469 kHz  25.175 MHz
    Apple   :   640x480    66.667 Hz   4:3    35.000 kHz  30.240 MHz
    DMT 0x05:   640x480    72.809 Hz   4:3    37.861 kHz  31.500 MHz
    DMT 0x06:   640x480    75.000 Hz   4:3    37.500 kHz  31.500 MHz
    DMT 0x08:   800x600    56.250 Hz   4:3    35.156 kHz  36.000 MHz
    DMT 0x09:   800x600    60.317 Hz   4:3    37.879 kHz  40.000 MHz
    DMT 0x0a:   800x600    72.188 Hz   4:3    48.077 kHz  50.000 MHz
    DMT 0x0b:   800x600    75.000 Hz   4:3    46.875 kHz  49.500 MHz
    Apple   :   832x624    74.551 Hz   4:3    49.726 kHz  57.284 MHz
    DMT 0x10:  1024x768    60.004 Hz   4:3    48.363 kHz  65.000 MHz
    DMT 0x11:  1024x768    70.069 Hz   4:3    56.476 kHz  75.000 MHz
    DMT 0x12:  1024x768    75.029 Hz   4:3    60.023 kHz  78.750 MHz
    DMT 0x24:  1280x1024   75.025 Hz   5:4    79.976 kHz 135.000 MHz
    Apple   :  1152x870    75.062 Hz 192:145  68.681 kHz 100.000 MHz
  Standard Timings:
    DMT 0x45:  1920x1200   59.885 Hz  16:10   74.556 kHz 193.250 MHz
    DMT 0x3a:  1680x1050   59.954 Hz  16:10   65.290 kHz 146.250 MHz
    DMT 0x33:  1600x1200   60.000 Hz   4:3    75.000 kHz 162.000 MHz
    DMT 0x2f:  1440x900    59.887 Hz  16:10   55.935 kHz 106.500 MHz
    DMT 0x2a:  1400x1050   59.978 Hz   4:3    65.317 kHz 121.750 MHz
    DMT 0x23:  1280x1024   60.020 Hz   5:4    63.981 kHz 108.000 MHz
    DMT 0x20:  1280x960    60.000 Hz   4:3    60.000 kHz 108.000 MHz
    DMT 0x15:  1152x864    75.000 Hz   4:3    67.500 kHz 108.000 MHz
  Detailed Timing Descriptors:
    DTD 1:  1920x1200   59.950 Hz   8:5    74.038 kHz 154.000 MHz (593 mm x 371 mm)
                 Hfront   48 Hsync  32 Hback  80 Hpol P
                 Vfront    3 Vsync   6 Vback  26 Vpol N
    Display Product Serial Number: ...
  Display Range Limits:
    Monitor ranges (GTF): 56-75 Hz V, 24-80 kHz H, max dotclock 150 MHz
    Display Product Name: 'Hanns.G HG281'
Checksum: 0x01

----------------

Block 1, Unknown EDID Extension Block 0x00:
  00 ff ff ff ff ff ff 00 22 64 f3 1c 18 03 00 00 '........"d......'
  13 12 01 03 0a 3b 25 78 ea 9e 71 a6 54 4c 9f 24 '.....;%x..q.TL.$'
  10 51 57 bf ef 80 d1 00 b3 00 a9 40 95 00 90 40 '.QW........@...@'
  81 80 81 40 71 4f 28 3c 80 a0 70 b0 23 40 30 20 '...@qO(<..p.#@0 '
  36 00 51 73 21 00 00 1a 00 00 00 ff 00 38 31 39 '6.Qs!........819'
  4c 42 33 51 59 30 30 37 39 32 00 00 00 fd 00 38 'LB3QY00792.....8'
  4b 18 50 0f 00 0a 20 20 20 20 20 20 00 00 00 fc 'K.P...      ....'
  00 48 61 6e 6e 73 2e 47 20 48 47 32 38 31 00 01 '.Hanns.G HG281..'
Checksum: 0x01

----------------

Block 2, Unknown EDID Extension Block 0x00:
  00 ff ff ff ff ff ff 00 22 64 f3 1c 18 03 00 00 '........"d......'
  13 12 01 03 0a 3b 25 78 ea 9e 71 a6 54 4c 9f 24 '.....;%x..q.TL.$'
  10 51 57 bf ef 80 d1 00 b3 00 a9 40 95 00 90 40 '.QW........@...@'
  81 80 81 40 71 4f 28 3c 80 a0 70 b0 23 40 30 20 '...@qO(<..p.#@0 '
  36 00 51 73 21 00 00 1a 00 00 00 ff 00 38 31 39 '6.Qs!........819'
  4c 42 33 51 59 30 30 37 39 32 00 00 00 fd 00 38 'LB3QY00792.....8'
  4b 18 50 0f 00 0a 20 20 20 20 20 20 00 00 00 fc 'K.P...      ....'
  00 48 61 6e 6e 73 2e 47 20 48 47 32 38 31 00 01 '.Hanns.G HG281..'
Checksum: 0x01

----------------

Failures:

Block 0, Base EDID:
  Base EDID: EDID specified 0 extension block(s), but found 2 extension block(s).
Block 1, Base EDID:
  Unknown Extension Block.
Block 2, Base EDID:
  Unknown Extension Block.
EDID:
  Base EDID: Some timings are out of range of the Monitor Ranges:
    Maximum Clock: 193.250 MHz (Monitor: 150.000 MHz)
  Base EDID: EDID 1.3 requires a Block Map Extension in Block 1 if there are more than 2 blocks in the EDID.

EDID conformity: FAIL
