
EDID (hex):
00ffffffffffff0030aeec6100000000
231f0104a53c22783ab4a5ad4f449e25
0f5054a54b00d100d1c0b300714f8180
9500a9c0a9cf565e00a0a0a029503020
350055502100001a000000fd00324c1e
5a19010a202020202020000000fc004c
454e20543237682d32300a20000000ff
00564e413652384b560a2020202001a2
020318f14b101f051404131211030201
23097f0783010000f520a05050841a30
0820c80055502100001a073480507038
1f400820180455502100001a6d244050
60841a300820c80055502100001a0000
00000000000000000000000000000000
00000000000000000000000000000000
000000000000000000000000000000a1

edid-decode (hex):

00 ff ff ff ff ff ff 00 30 ae ec 61 00 00 00 00
23 1f 01 04 a5 3c 22 78 3a b4 a5 ad 4f 44 9e 25
0f 50 54 a5 4b 00 d1 00 d1 c0 b3 00 71 4f 81 80
95 00 a9 c0 a9 cf 56 5e 00 a0 a0 a0 29 50 30 20
35 00 55 50 21 00 00 1a 00 00 00 fd 00 32 4c 1e
5a 19 01 0a 20 20 20 20 20 20 00 00 00 fc 00 4c
45 4e 20 54 32 37 68 2d 32 30 0a 20 00 00 00 ff
00 56 4e 41 36 52 38 4b 56 0a 20 20 20 20 01 a2

02 03 18 f1 4b 10 1f 05 14 04 13 12 11 03 02 01
23 09 7f 07 83 01 00 00 f5 20 a0 50 50 84 1a 30
08 20 c8 00 55 50 21 00 00 1a 07 34 80 50 70 38
1f 40 08 20 18 04 55 50 21 00 00 1a 6d 24 40 50
60 84 1a 30 08 20 c8 00 55 50 21 00 00 1a 00 00
00 00 00 00 00 00 00 00 00 00 00 00 00 00 00 00
00 00 00 00 00 00 00 00 00 00 00 00 00 00 00 00
00 00 00 00 00 00 00 00 00 00 00 00 00 00 00 a1

----------------

Block 0, Base EDID:
  EDID Structure Version & Revision: 1.4
  Vendor & Product Identification:
    Manufacturer: LEN
    Model: 25068
    Made in: week 35 of 2021
  Basic Display Parameters & Features:
    Digital display
    Bits per primary color channel: 8
    DisplayPort interface
    Maximum image size: 60 cm x 34 cm
    Gamma: 2.20
    DPMS levels: Off
    Supported color formats: RGB 4:4:4, YCrCb 4:4:4, YCrCb 4:2:2
    First detailed timing includes the native pixel format and preferred refresh rate
  Color Characteristics:
    Red  : 0.6777, 0.3115
    Green: 0.2666, 0.6171
    Blue : 0.1464, 0.0605
    White: 0.3134, 0.3291
  Established Timings I & II:
    IBM     :   720x400    70.081663 Hz   9:5     31.467 kHz     28.320000 MHz
    DMT 0x04:   640x480    59.940476 Hz   4:3     31.469 kHz     25.175000 MHz
    DMT 0x06:   640x480    75.000000 Hz   4:3     37.500 kHz     31.500000 MHz
    DMT 0x09:   800x600    60.316541 Hz   4:3     37.879 kHz     40.000000 MHz
    DMT 0x0b:   800x600    75.000000 Hz   4:3     46.875 kHz     49.500000 MHz
    DMT 0x10:  1024x768    60.003840 Hz   4:3     48.363 kHz     65.000000 MHz
    DMT 0x12:  1024x768    75.028582 Hz   4:3     60.023 kHz     78.750000 MHz
    DMT 0x24:  1280x1024   75.024675 Hz   5:4     79.976 kHz    135.000000 MHz
  Standard Timings:
    DMT 0x45:  1920x1200   59.884600 Hz  16:10    74.556 kHz    193.250000 MHz
    DMT 0x52:  1920x1080   60.000000 Hz  16:9     67.500 kHz    148.500000 MHz
    DMT 0x3a:  1680x1050   59.954250 Hz  16:10    65.290 kHz    146.250000 MHz
    DMT 0x15:  1152x864    75.000000 Hz   4:3     67.500 kHz    108.000000 MHz
    DMT 0x23:  1280x1024   60.019740 Hz   5:4     63.981 kHz    108.000000 MHz
    DMT 0x2f:  1440x900    59.887445 Hz  16:10    55.935 kHz    106.500000 MHz
    DMT 0x53:  1600x900    60.000000 Hz  16:9     60.000 kHz    108.000000 MHz (RB)
    GTF     :  1600x900    75.000000 Hz  16:9     70.500 kHz    152.280000 MHz
  Detailed Timing Descriptors:
    DTD 1:  2560x1440   59.950550 Hz  16:9     88.787 kHz    241.500000 MHz (597 mm x 336 mm)
                 Hfront   48 Hsync  32 Hback   80 Hpol P
                 Vfront    3 Vsync   5 Vback   33 Vpol N
    Display Range Limits:
      Monitor ranges (Bare Limits): 50-76 Hz V, 30-90 kHz H, max dotclock 250 MHz
    Display Product Name: 'LEN T27h-20'
    Display Product Serial Number: 'VNA6R8KV'
  Extension blocks: 1
Checksum: 0xa2

----------------

Block 1, CTA-861 Extension Block:
  Revision: 3
  Underscans IT Video Formats by default
  Basic audio support
  Supports YCbCr 4:4:4
  Supports YCbCr 4:2:2
  Native detailed modes: 1
  Video Data Block:
    VIC  16:  1920x1080   60.000000 Hz  16:9     67.500 kHz    148.500000 MHz
    VIC  31:  1920x1080   50.000000 Hz  16:9     56.250 kHz    148.500000 MHz
    VIC   5:  1920x1080i  60.000000 Hz  16:9     33.750 kHz     74.250000 MHz
    VIC  20:  1920x1080i  50.000000 Hz  16:9     28.125 kHz     74.250000 MHz
    VIC   4:  1280x720    60.000000 Hz  16:9     45.000 kHz     74.250000 MHz
    VIC  19:  1280x720    50.000000 Hz  16:9     37.500 kHz     74.250000 MHz
    VIC  18:   720x576    50.000000 Hz  16:9     31.250 kHz     27.000000 MHz
    VIC  17:   720x576    50.000000 Hz   4:3     31.250 kHz     27.000000 MHz
    VIC   3:   720x480    59.940060 Hz  16:9     31.469 kHz     27.000000 MHz
    VIC   2:   720x480    59.940060 Hz   4:3     31.469 kHz     27.000000 MHz
    VIC   1:   640x480    59.940476 Hz   4:3     31.469 kHz     25.175000 MHz
  Audio Data Block:
    Linear PCM:
      Max channels: 2
      Supported sample rates (kHz): 192 176.4 96 88.2 48 44.1 32
      Supported sample sizes (bits): 24 20 16
  Speaker Allocation Data Block:
    FL/FR - Front Left/Right
  Detailed Timing Descriptors:
    DTD 2:  1440x900    59.942310 Hz  16:10    55.507 kHz     84.370000 MHz (597 mm x 336 mm)
                 Hfront    8 Hsync  32 Hback   40 Hpol P
                 Vfront   12 Vsync   8 Vback    6 Vpol N
    DTD 3:  1920x1080   59.941494 Hz  16:9     66.595 kHz    133.190000 MHz (597 mm x 336 mm)
                 Hfront    8 Hsync  32 Hback   40 Hpol P
                 Vfront   17 Vsync   8 Vback    6 Vpol N
    DTD 4:  1600x900    59.941633 Hz  16:9     55.506 kHz     93.250000 MHz (597 mm x 336 mm)
                 Hfront    8 Hsync  32 Hback   40 Hpol P
                 Vfront   12 Vsync   8 Vback    6 Vpol N
Checksum: 0xa1  Unused space in Extension Block: 49 bytes


