
EDID (hex):
00ffffffffffff0009d1167845540000
081301030e2917782e3d85a6564a9a24
125054a56a8071000101010101010101
010101010101662156aa51001e30468f
33009ae61000001e000000ff00433239
3033333636534c300a0a000000fd0037
4c1f530e000a202020202020000000fc
0042454e51204739303048440a0a006e

Extracted contents:
header:          00 ff ff ff ff ff ff 00
serial number:   09 d1 16 78 45 54 00 00 08 13
version:         01 03
basic params:    0e 29 17 78 2e
chroma info:     3d 85 a6 56 4a 9a 24 12 50 54
established:     a5 6a 80
standard:        71 00 01 01 01 01 01 01 01 01 01 01 01 01 01 01
descriptor 1:    66 21 56 aa 51 00 1e 30 46 8f 33 00 9a e6 10 00 00 1e
descriptor 2:    00 00 00 ff 00 43 32 39 30 33 33 36 36 53 4c 30 0a 0a
descriptor 3:    00 00 00 fd 00 37 4c 1f 53 0e 00 0a 20 20 20 20 20 20
descriptor 4:    00 00 00 fc 00 42 45 4e 51 20 47 39 30 30 48 44 0a 0a
extensions:      00
checksum:        6e

EDID version: 1.3
Manufacturer: BNQ Model 7816 Serial Number --
Made in week 8 of 2009
Analog display, Input voltage level: 0.7/0.3 V
Sync: Separate Composite SyncOnGreen 
Maximum image size: 41 cm x 23 cm
Gamma: 2.20
DPMS levels: Off
RGB color display
Default (sRGB) color space is primary color space
First detailed timing is preferred timing
Display x,y Chromaticity:
  Red:   0.6484, 0.3388
  Green: 0.2919, 0.6025
  Blue:  0.1425, 0.0703
  White: 0.3134, 0.3291
Established timings supported:
  720x400@70Hz 9:5 HorFreq: 31469 Hz Clock: 28.320 MHz
  640x480@60Hz 4:3 HorFreq: 31469 Hz Clock: 25.175 MHz
  640x480@75Hz 4:3 HorFreq: 37500 Hz Clock: 31.500 MHz
  800x600@60Hz 4:3 HorFreq: 37900 Hz Clock: 40.000 MHz
  800x600@75Hz 4:3 HorFreq: 46900 Hz Clock: 49.500 MHz
  832x624@75Hz 4:3 HorFreq: 49726 Hz Clock: 57.284 MHz
  1024x768@60Hz 4:3 HorFreq: 48400 Hz Clock: 65.000 MHz
  1024x768@75Hz 4:3 HorFreq: 60000 Hz Clock: 78.750 MHz
  1152x870@75Hz 192:145 HorFreq: 67500 Hz Clock: 108.000 MHz
Standard timings supported:
  1152x720@60Hz 16:10
Detailed mode: Clock 85.500 MHz, 410 mm x 230 mm
               1366 1436 1579 1792 hborder 0
                768  771  774  798 vborder 0
               +hsync +vsync 
               VertFreq: 59 Hz, HorFreq: 47712 Hz
Serial number: --
Monitor ranges (GTF): 55-76Hz V, 31-83kHz H, max dotclock 140MHz
Monitor name: BENQ G900HD
Checksum: 0x6e (valid)
EDID block does NOT conform to EDID 1.3!
	sRGB is signaled, but the chromaticities do not match
	Detailed block string not properly terminated
