edid-decode (hex):

00 ff ff ff ff ff ff 00 30 a4 45 23 02 00 00 00
12 1e 01 03 80 59 32 78 0a d7 a5 a2 59 4a 96 24
14 50 54 a3 08 00 d1 c0 b3 c0 a9 c0 81 80 8b c0
81 c0 01 01 01 01 64 21 56 b0 51 00 1b 30 40 70
36 00 75 f2 31 00 00 1e 00 00 00 00 00 00 00 00
00 00 00 20 00 00 00 00 00 20 00 00 00 fc 00 0a
20 20 20 20 20 20 20 20 20 20 20 20 00 00 00 fc
00 53 4d 41 52 54 20 54 56 0a 20 20 20 20 01 ca

02 03 34 f1 57 01 02 03 04 05 06 07 90 11 12 13
14 15 16 1f 20 21 22 00 01 02 03 04 29 39 1e 00
57 07 01 15 07 50 69 03 0c 00 30 00 00 3c 20 00
e3 06 05 01 01 1d 00 72 51 d0 1e 20 6e 28 55 00
c4 8e 21 00 00 1e 01 1d 80 18 71 1c 16 20 58 2c
25 00 c4 8e 21 00 00 9e 8c 0a d0 8a 20 e0 2d 10
10 3e 96 00 13 8e 21 00 00 18 8c 0a d0 90 20 40
31 20 0c 40 55 00 13 8e 21 00 00 18 00 00 00 e9

----------------

Block 0, Base EDID:
  EDID Structure Version & Revision: 1.3
  Vendor & Product Identification:
    Manufacturer: LED
    Model: 9029
    Serial Number: ...
    Made in: week 18 of 2020
  Basic Display Parameters & Features:
    Digital display
    Maximum image size: 89 cm x 50 cm
    Gamma: 2.20
    RGB color display
    First detailed timing is the preferred timing
  Color Characteristics:
    Red  : 0.6357, 0.3486
    Green: 0.2900, 0.5888
    Blue : 0.1425, 0.0800
    White: 0.3134, 0.3291
  Established Timings I & II:
    IBM     :   720x400    70.081663 Hz   9:5     31.467 kHz     28.320000 MHz
    DMT 0x04:   640x480    59.940476 Hz   4:3     31.469 kHz     25.175000 MHz
    DMT 0x08:   800x600    56.250000 Hz   4:3     35.156 kHz     36.000000 MHz
    DMT 0x09:   800x600    60.316541 Hz   4:3     37.879 kHz     40.000000 MHz
    DMT 0x10:  1024x768    60.003840 Hz   4:3     48.363 kHz     65.000000 MHz
  Standard Timings:
    DMT 0x52:  1920x1080   60.000000 Hz  16:9     67.500 kHz    148.500000 MHz
    GTF     :  1680x945    59.999909 Hz  16:9     58.680 kHz    131.443000 MHz
    DMT 0x53:  1600x900    60.000000 Hz  16:9     60.000 kHz    108.000000 MHz (RB)
    DMT 0x23:  1280x1024   60.019740 Hz   5:4     63.981 kHz    108.000000 MHz
    GTF     :  1360x765    60.000341 Hz  16:9     47.520 kHz     84.396000 MHz
    DMT 0x55:  1280x720    60.000000 Hz  16:9     45.000 kHz     74.250000 MHz
  Detailed Timing Descriptors:
    DTD 1:  1366x768    59.800897 Hz 683:384   47.542 kHz     85.480000 MHz (885 mm x 498 mm)
                 Hfront   64 Hsync 112 Hback  256 Hpol P
                 Vfront    3 Vsync   6 Vback   18 Vpol P
    Manufacturer-Specified Display Descriptor (0x00): 00 00 00 00 00 00 00 00 00 20 00 00 00 00 00 20 '......... ..... '
    Display Product Name: ''
    Display Product Name: 'SMART TV'
  Extension blocks: 1
Checksum: 0xca

----------------

Block 1, CTA-861 Extension Block:
  Revision: 3
  Underscans IT Video Formats by default
  Basic audio support
  Supports YCbCr 4:4:4
  Supports YCbCr 4:2:2
  Native detailed modes: 1
  Video Data Block:
    VIC   1:   640x480    59.940476 Hz   4:3     31.469 kHz     25.175000 MHz
    VIC   2:   720x480    59.940060 Hz   4:3     31.469 kHz     27.000000 MHz
    VIC   3:   720x480    59.940060 Hz  16:9     31.469 kHz     27.000000 MHz
    VIC   4:  1280x720    60.000000 Hz  16:9     45.000 kHz     74.250000 MHz
    VIC   5:  1920x1080i  60.000000 Hz  16:9     33.750 kHz     74.250000 MHz
    VIC   6:  1440x480i   59.940060 Hz   4:3     15.734 kHz     27.000000 MHz
    VIC   7:  1440x480i   59.940060 Hz  16:9     15.734 kHz     27.000000 MHz
    VIC  16:  1920x1080   60.000000 Hz  16:9     67.500 kHz    148.500000 MHz (native)
    VIC  17:   720x576    50.000000 Hz   4:3     31.250 kHz     27.000000 MHz
    VIC  18:   720x576    50.000000 Hz  16:9     31.250 kHz     27.000000 MHz
    VIC  19:  1280x720    50.000000 Hz  16:9     37.500 kHz     74.250000 MHz
    VIC  20:  1920x1080i  50.000000 Hz  16:9     28.125 kHz     74.250000 MHz
    VIC  21:  1440x576i   50.000000 Hz   4:3     15.625 kHz     27.000000 MHz
    VIC  22:  1440x576i   50.000000 Hz  16:9     15.625 kHz     27.000000 MHz
    VIC  31:  1920x1080   50.000000 Hz  16:9     56.250 kHz    148.500000 MHz
    VIC  32:  1920x1080   24.000000 Hz  16:9     27.000 kHz     74.250000 MHz
    VIC  33:  1920x1080   25.000000 Hz  16:9     28.125 kHz     74.250000 MHz
    VIC  34:  1920x1080   30.000000 Hz  16:9     33.750 kHz     74.250000 MHz
    VIC   1:   640x480    59.940476 Hz   4:3     31.469 kHz     25.175000 MHz
    VIC   2:   720x480    59.940060 Hz   4:3     31.469 kHz     27.000000 MHz
    VIC   3:   720x480    59.940060 Hz  16:9     31.469 kHz     27.000000 MHz
    VIC   4:  1280x720    60.000000 Hz  16:9     45.000 kHz     74.250000 MHz
  Audio Data Block:
    DTS:
      Max channels: 2
      Supported sample rates (kHz): 96 88.2 48 44.1
      Maximum bit rate: 0 kb/s
    Enhanced AC-3 (DD+):
      Max channels: 8
      Supported sample rates (kHz): 48 44.1 32
      Supports Joint Object Coding
    AC-3:
      Max channels: 6
      Supported sample rates (kHz): 48 44.1 32
      Maximum bit rate: 640 kb/s
  Vendor-Specific Data Block (HDMI), OUI 00-0C-03:
    Source physical address: 3.0.0.0
    Maximum TMDS clock: 300 MHz
    Extended HDMI video details:
      HDMI VICs:
         Unknown (HDMI VIC 6)
         Unknown (HDMI VIC 5)
        HDMI VIC 1:  3840x2160   30.000000 Hz  16:9     67.500 kHz    297.000000 MHz
        HDMI VIC 1:  3840x2160   30.000000 Hz  16:9     67.500 kHz    297.000000 MHz
         Unknown (HDMI VIC 29)
         Unknown (HDMI VIC 0)
         Unknown (HDMI VIC 114)
      3D VIC indices with specific capabilities:
        VIC   6:  1440x480i   59.940060 Hz   4:3     15.734 kHz     27.000000 MHz (field alternative)
        VIC  22:  1440x576i   50.000000 Hz  16:9     15.625 kHz     27.000000 MHz (frame packing)
        VIC   2:   720x480    59.940060 Hz   4:3     31.469 kHz     27.000000 MHz (unknown (0x0e))
  HDR Static Metadata Data Block:
    Electro optical transfer functions:
      Traditional gamma - SDR luminance range
      SMPTE ST2084
    Supported static metadata descriptors:
      Static metadata type 1
  Detailed Timing Descriptors:
    DTD 2:  1280x720    60.000000 Hz  16:9     45.000 kHz     74.250000 MHz (708 mm x 398 mm)
                 Hfront  110 Hsync  40 Hback  220 Hpol P
                 Vfront    5 Vsync   5 Vback   20 Vpol P
    DTD 3:  1920x1080i  60.000000 Hz  16:9     33.750 kHz     74.250000 MHz (708 mm x 398 mm)
                 Hfront   88 Hsync  44 Hback  148 Hpol P
                 Vfront    2 Vsync   5 Vback   15 Vpol P Vfront +0.5 Odd Field
                 Vfront    2 Vsync   5 Vback   15 Vpol P Vback  +0.5 Even Field
    DTD 4:   720x480    59.940060 Hz   3:2     31.469 kHz     27.000000 MHz (531 mm x 398 mm)
                 Hfront   16 Hsync  62 Hback   60 Hpol N
                 Vfront    9 Vsync   6 Vback   30 Vpol N
    DTD 5:   720x576    50.000000 Hz   5:4     31.250 kHz     27.000000 MHz (531 mm x 398 mm)
                 Hfront   12 Hsync  64 Hback   68 Hpol N
                 Vfront    5 Vsync   5 Vback   39 Vpol N
Checksum: 0xe9

----------------

Warnings:

Block 0, Base EDID:
  Standard Timings: Standard Timing 1680x945 has a dubious odd vertical resolution.
  Standard Timings: Standard Timing 1360x765 has a dubious odd vertical resolution.

Failures:

Block 0, Base EDID:
  Display Product Name: Empty string.
  Missing Display Range Limits Descriptor.
Block 1, CTA-861 Extension Block:
  Video Data Block: Duplicate VIC 1.
  Video Data Block: Duplicate VIC 2.
  Video Data Block: Duplicate VIC 3.
  Video Data Block: Duplicate VIC 4.
  Vendor-Specific Data Block (HDMI), OUI 00-0C-03: Unknown HDMI VIC 6.
  Vendor-Specific Data Block (HDMI), OUI 00-0C-03: Unknown HDMI VIC 5.
  Vendor-Specific Data Block (HDMI), OUI 00-0C-03: Unknown HDMI VIC 29.
  Vendor-Specific Data Block (HDMI), OUI 00-0C-03: Unknown HDMI VIC 0.
  Vendor-Specific Data Block (HDMI), OUI 00-0C-03: Unknown HDMI VIC 114.
  Vendor-Specific Data Block (HDMI), OUI 00-0C-03: Unknown 3D_Structure_X value 0x0e.
  Detailed Timing Descriptor #2: Mismatch of image size 708x398 mm vs display size 890x500 mm.
  Detailed Timing Descriptor #3: Mismatch of image size 708x398 mm vs display size 890x500 mm.
  Detailed Timing Descriptor #4: Mismatch of image size 531x398 mm vs display size 890x500 mm.
  Detailed Timing Descriptor #5: Mismatch of image size 531x398 mm vs display size 890x500 mm.
  HDMI VIC Codes must have their CTA-861 VIC equivalents in the VSB.
  Missing VCDB, needed for Set Selectable RGB Quantization to avoid interop issues.
EDID:
  CTA-861: Native progressive timings are a mix of several resolutions.

EDID conformity: FAIL
