
EDID (hex):
00ffffffffffff0030e4ff0600000000
001f0104952213780238d5975e598e27
1c505400000001010101010101010101
0101010101012e3680a070381f403020
350058c21000001a502b80a070381f40
3020350058c21000001a000000fe004b
52473358803135365746430a00000000
0000413196001000000a010a20200006

Extracted contents:
header:          00 ff ff ff ff ff ff 00
serial number:   30 e4 ff 06 00 00 00 00 00 1f
version:         01 04
basic params:    95 22 13 78 02
chroma info:     38 d5 97 5e 59 8e 27 1c 50 54
established:     00 00 00
standard:        01 01 01 01 01 01 01 01 01 01 01 01 01 01 01 01
descriptor 1:    2e 36 80 a0 70 38 1f 40 30 20 35 00 58 c2 10 00 00 1a
descriptor 2:    50 2b 80 a0 70 38 1f 40 30 20 35 00 58 c2 10 00 00 1a
descriptor 3:    00 00 00 fe 00 4b 52 47 33 58 80 31 35 36 57 46 43 0a
descriptor 4:    00 00 00 00 00 00 41 31 96 00 10 00 00 0a 01 0a 20 20
extensions:      00
checksum:        06

EDID version: 1.4
Manufacturer: LGD Model 6ff Serial Number --
Made in year 2021
Digital display
6 bits per primary color channel
DisplayPort interface
Maximum image size: 34 cm x 19 cm
Gamma: 2.20
Supported color formats: RGB 4:4:4
First detailed timing includes the native pixel format and preferred refresh rate
Display x,y Chromaticity:
  Red:   0.5898, 0.3701
  Green: 0.3496, 0.5546
  Blue:  0.1552, 0.1103
  White: 0.3134, 0.3291
Established timings supported:
Standard timings supported:
Detailed mode: Clock 138.700 MHz, 344 mm x 194 mm
               1920 1968 2000 2080 hborder 0
               1080 1083 1088 1111 vborder 0
               +hsync -vsync 
               VertFreq: 60 Hz, HorFreq: 66682 Hz
Detailed mode: Clock 110.880 MHz, 344 mm x 194 mm
               1920 1968 2000 2080 hborder 0
               1080 1083 1088 1111 vborder 0
               +hsync -vsync 
               VertFreq: 47 Hz, HorFreq: 53307 Hz
ASCII string: KRG3X
Manufacturer-specified data, tag 0
Checksum: 0x6 (valid)
EDID block does NOT conform to EDID 1.4!
	Missing name descriptor
	Missing monitor ranges
	Detailed block string not properly terminated
