edid-decode (hex):

00 ff ff ff ff ff ff 00 0e d4 01 00 30 1a 32 01
1d 10 01 03 88 00 00 00 8e 00 10 a0 57 49 9b 26
10 48 00 ad cf 00 81 80 01 01 01 01 01 01 01 01
01 01 01 01 01 01 e0 2e 90 a0 60 1a 1e 40 50 20
56 04 9a 00 11 00 00 1c 00 00 00 fc 00 4c 4d 32
30 31 58 44 0a 0a 0a 0a 0a 0a 00 00 00 ff 00 52
6f 77 61 72 64 5f 30 37 32 30 0a 0a 00 00 00 10
00 00 00 00 00 00 00 00 00 00 00 00 00 00 00 0a

----------------

Block 0, Base EDID:
  EDID Structure Version & Revision: 1.3
  Vendor & Product Identification:
    Manufacturer: CVT
    Model: 1
    Serial Number: ...
    Made in: week 29 of 2006
  Basic Display Parameters & Features:
    Digital display
    Image size is variable
    Gamma: 1.00
    DPMS levels: Standby
    RGB color display
    Default (sRGB) color space is primary color space
    First detailed timing is the preferred timing
  Color Characteristics:
    Red  : 0.6250, 0.3398
    Green: 0.2851, 0.6054
    Blue : 0.1484, 0.0634
    White: 0.2812, 0.0000
  Established Timings I & II:
    IBM     :   720x400    70.081663 Hz   9:5     31.467 kHz     28.320000 MHz
    DMT 0x04:   640x480    59.940476 Hz   4:3     31.469 kHz     25.175000 MHz
    DMT 0x05:   640x480    72.808802 Hz   4:3     37.861 kHz     31.500000 MHz
    DMT 0x06:   640x480    75.000000 Hz   4:3     37.500 kHz     31.500000 MHz
    DMT 0x09:   800x600    60.316541 Hz   4:3     37.879 kHz     40.000000 MHz
    DMT 0x0a:   800x600    72.187572 Hz   4:3     48.077 kHz     50.000000 MHz
    DMT 0x0b:   800x600    75.000000 Hz   4:3     46.875 kHz     49.500000 MHz
    DMT 0x10:  1024x768    60.003840 Hz   4:3     48.363 kHz     65.000000 MHz
    DMT 0x11:  1024x768    70.069359 Hz   4:3     56.476 kHz     75.000000 MHz
    DMT 0x12:  1024x768    75.028582 Hz   4:3     60.023 kHz     78.750000 MHz
    DMT 0x24:  1280x1024   75.024675 Hz   5:4     79.976 kHz    135.000000 MHz
  Standard Timings:
    DMT 0x23:  1280x1024   60.019740 Hz   5:4     63.981 kHz    108.000000 MHz
  Detailed Timing Descriptors:
    DTD 1:  1680x1050   60.386473 Hz   8:5     65.217 kHz    120.000000 MHz (410 mm x 256 mm)
                 Hfront   80 Hsync  32 Hback   48 Hpol N
                 Vfront   21 Vsync   6 Vback    3 Vpol P
    Display Product Name: 'LM201XD'
    Display Product Serial Number: ...
    Dummy Descriptor:
Checksum: 0x0a

----------------

Warnings:

Block 0, Base EDID:
  Basic Display Parameters & Features: sRGB is signaled, but the gamma != 2.2.

Failures:

Block 0, Base EDID:
  Basic Display Parameters & Features: Digital Video Interface Standard set to reserved value 0x08.
  Basic Display Parameters & Features: sRGB is signaled, but the chromaticities do not match.
  Display Product Name: Non-space after newline.
  Display Product Serial Number: ...
  Missing Display Range Limits Descriptor.
EDID:
  Base EDID: The DTD image sizes all fit inside 255x255cm, but no display size was set.

EDID conformity: FAIL
