
EDID (hex):
00ffffffffffff0010ac944242433341
0f210104b54627783a2975af4f41a424
0e5054a54b00714f8180a940d1c00101
010101010101565e00a0a0a029503020
3500ba892100001a000000ff00334e33
363350330a2020202020000000fc0044
454c4c20503332323344450a000000fd
00384c1e5a19010a20202020202000c8

edid-decode (hex):

00 ff ff ff ff ff ff 00 10 ac 94 42 42 43 33 41
0f 21 01 04 b5 46 27 78 3a 29 75 af 4f 41 a4 24
0e 50 54 a5 4b 00 71 4f 81 80 a9 40 d1 c0 01 01
01 01 01 01 01 01 56 5e 00 a0 a0 a0 29 50 30 20
35 00 ba 89 21 00 00 1a 00 00 00 ff 00 33 4e 33
36 33 50 33 0a 20 20 20 20 20 00 00 00 fc 00 44
45 4c 4c 20 50 33 32 32 33 44 45 0a 00 00 00 fd
00 38 4c 1e 5a 19 01 0a 20 20 20 20 20 20 00 c8

----------------

Block 0, Base EDID:
  EDID Structure Version & Revision: 1.4
  Vendor & Product Identification:
    Manufacturer: DEL
    Model: 17044
    Serial Number: 1093878594
    Made in: week 15 of 2023
  Basic Display Parameters & Features:
    Digital display
    Bits per primary color channel: 10
    DisplayPort interface
    Maximum image size: 70 cm x 39 cm
    Gamma: 2.20
    DPMS levels: Off
    Supported color formats: RGB 4:4:4, YCrCb 4:4:4, YCrCb 4:2:2
    First detailed timing includes the native pixel format and preferred refresh rate
  Color Characteristics:
    Red  : 0.6835, 0.3105
    Green: 0.2558, 0.6416
    Blue : 0.1416, 0.0576
    White: 0.3134, 0.3291
  Established Timings I & II:
    IBM     :   720x400    70.081663 Hz   9:5     31.467 kHz     28.320000 MHz
    DMT 0x04:   640x480    59.940476 Hz   4:3     31.469 kHz     25.175000 MHz
    DMT 0x06:   640x480    75.000000 Hz   4:3     37.500 kHz     31.500000 MHz
    DMT 0x09:   800x600    60.316541 Hz   4:3     37.879 kHz     40.000000 MHz
    DMT 0x0b:   800x600    75.000000 Hz   4:3     46.875 kHz     49.500000 MHz
    DMT 0x10:  1024x768    60.003840 Hz   4:3     48.363 kHz     65.000000 MHz
    DMT 0x12:  1024x768    75.028582 Hz   4:3     60.023 kHz     78.750000 MHz
    DMT 0x24:  1280x1024   75.024675 Hz   5:4     79.976 kHz    135.000000 MHz
  Standard Timings:
    DMT 0x15:  1152x864    75.000000 Hz   4:3     67.500 kHz    108.000000 MHz
    DMT 0x23:  1280x1024   60.019740 Hz   5:4     63.981 kHz    108.000000 MHz
    DMT 0x33:  1600x1200   60.000000 Hz   4:3     75.000 kHz    162.000000 MHz
    DMT 0x52:  1920x1080   60.000000 Hz  16:9     67.500 kHz    148.500000 MHz
  Detailed Timing Descriptors:
    DTD 1:  2560x1440   59.950550 Hz  16:9     88.787 kHz    241.500000 MHz (698 mm x 393 mm)
                 Hfront   48 Hsync  32 Hback   80 Hpol P
                 Vfront    3 Vsync   5 Vback   33 Vpol N
    Display Product Serial Number: '3N363P3'
    Display Product Name: 'DELL P3223DE'
    Display Range Limits:
      Monitor ranges (Bare Limits): 56-76 Hz V, 30-90 kHz H, max dotclock 250 MHz
Checksum: 0xc8


