
EDID (hex):
00ffffffffffff004ca3503000000000
00120103802013780a09e59757548a27
22505400000001010101010101010101
010101010101411c56a0500016303020
250035ae100000190000000f00000000
00000000001eb4027400000000fe0053
414d53554e470a2020202020000000fe
00313430415430312d4730310a200086

edid-decode (hex):

00 ff ff ff ff ff ff 00 4c a3 50 30 00 00 00 00
00 12 01 03 80 20 13 78 0a 09 e5 97 57 54 8a 27
22 50 54 00 00 00 01 01 01 01 01 01 01 01 01 01
01 01 01 01 01 01 41 1c 56 a0 50 00 16 30 30 20
25 00 35 ae 10 00 00 19 00 00 00 0f 00 00 00 00
00 00 00 00 00 1e b4 02 74 00 00 00 00 fe 00 53
41 4d 53 55 4e 47 0a 20 20 20 20 20 00 00 00 fe
00 31 34 30 41 54 30 31 2d 47 30 31 0a 20 00 86

----------------

Block 0, Base EDID:
  EDID Structure Version & Revision: 1.3
  Vendor & Product Identification:
    Manufacturer: SEC
    Model: 12368
    Made in: 2008
  Basic Display Parameters & Features:
    Digital display
    Maximum image size: 32 cm x 19 cm
    Gamma: 2.20
    RGB color display
    First detailed timing is the preferred timing
  Color Characteristics:
    Red  : 0.5898, 0.3398
    Green: 0.3300, 0.5400
    Blue : 0.1552, 0.1347
    White: 0.3134, 0.3291
  Established Timings I & II: none
  Standard Timings: none
  Detailed Timing Descriptors:
    DTD 1:  1366x768    59.998009 Hz 683:384   47.398 kHz     72.330000 MHz (309 mm x 174 mm)
                 Hfront   48 Hsync  32 Hback   80 Hpol N
                 Vfront    2 Vsync   5 Vback   15 Vpol N
    Manufacturer-Specified Display Descriptor (0x0f): 00 0f 00 00 00 00 00 00 00 00 00 1e b4 02 74 00 '..............t.'
    Alphanumeric Data String: 'SAMSUNG'
    Alphanumeric Data String: '140AT01-G01'
Checksum: 0x86
