
EDID (hex):
00ffffffffffff0030e4ed0600000000
001e0104a51e1378072815a4544a9c26
0e505400000001010101010101010101
010101010101353c80a070b023403020
36002ebc100000190000000000000000
00000000000000000000000000fe004c
4720446973706c61790a2020000000fe
004c503134305755312d5350423200b6

edid-decode (hex):

00 ff ff ff ff ff ff 00 30 e4 ed 06 00 00 00 00
00 1e 01 04 a5 1e 13 78 07 28 15 a4 54 4a 9c 26
0e 50 54 00 00 00 01 01 01 01 01 01 01 01 01 01
01 01 01 01 01 01 35 3c 80 a0 70 b0 23 40 30 20
36 00 2e bc 10 00 00 19 00 00 00 00 00 00 00 00
00 00 00 00 00 00 00 00 00 00 00 00 00 fe 00 4c
47 20 44 69 73 70 6c 61 79 0a 20 20 00 00 00 fe
00 4c 50 31 34 30 57 55 31 2d 53 50 42 32 00 b6

----------------

Block 0, Base EDID:
  EDID Structure Version & Revision: 1.4
  Vendor & Product Identification:
    Manufacturer: LGD
    Model: 1773
    Made in: 2020
  Basic Display Parameters & Features:
    Digital display
    Bits per primary color channel: 8
    DisplayPort interface
    Maximum image size: 30 cm x 19 cm
    Gamma: 2.20
    Supported color formats: RGB 4:4:4
    Default (sRGB) color space is primary color space
    First detailed timing includes the native pixel format and preferred refresh rate
    Display is continuous frequency
  Color Characteristics:
    Red  : 0.6406, 0.3300
    Green: 0.2910, 0.6093
    Blue : 0.1484, 0.0556
    White: 0.3134, 0.3291
  Established Timings I & II: none
  Standard Timings: none
  Detailed Timing Descriptors:
    DTD 1:  1920x1200   60.000779 Hz  16:10    74.101 kHz    154.130000 MHz (302 mm x 188 mm)
                 Hfront   48 Hsync  32 Hback   80 Hpol N
                 Vfront    3 Vsync   6 Vback   26 Vpol N
    Empty Descriptor
    Alphanumeric Data String: 'LG Display'
    Alphanumeric Data String: 'LP140WU1-SPB2'
Checksum: 0xb6
