
EDID (hex):
00ffffffffffff000d1238700a000000
09160104a2a05a78e619049859568526
27505700000001010101010101010101
010101010101023a801871382d40582c
450040846300001e000000ff00323031
32303331330a20202020000000fc0043
48373231380a202020202020000000fd
00173d0d2e0f010a2020202020200193
02031340230916078301000066f0022b
70380100000000000000000000000000
00000000000000000000000000000000
00000000000000000000000000000000
00000000000000000000000000000000
00000000000000000000000000000000
00000000000000000000000000000000
000000000000000000000000000000af

edid-decode (hex):

00 ff ff ff ff ff ff 00 0d 12 38 70 0a 00 00 00
09 16 01 04 a2 a0 5a 78 e6 19 04 98 59 56 85 26
27 50 57 00 00 00 01 01 01 01 01 01 01 01 01 01
01 01 01 01 01 01 02 3a 80 18 71 38 2d 40 58 2c
45 00 40 84 63 00 00 1e 00 00 00 ff 00 32 30 31
32 30 33 31 33 0a 20 20 20 20 00 00 00 fc 00 43
48 37 32 31 38 0a 20 20 20 20 20 20 00 00 00 fd
00 17 3d 0d 2e 0f 01 0a 20 20 20 20 20 20 01 93

02 03 13 40 23 09 16 07 83 01 00 00 66 f0 02 2b
70 38 01 00 00 00 00 00 00 00 00 00 00 00 00 00
00 00 00 00 00 00 00 00 00 00 00 00 00 00 00 00
00 00 00 00 00 00 00 00 00 00 00 00 00 00 00 00
00 00 00 00 00 00 00 00 00 00 00 00 00 00 00 00
00 00 00 00 00 00 00 00 00 00 00 00 00 00 00 00
00 00 00 00 00 00 00 00 00 00 00 00 00 00 00 00
00 00 00 00 00 00 00 00 00 00 00 00 00 00 00 af

----------------

Block 0, Base EDID:
  EDID Structure Version & Revision: 1.4
  Vendor & Product Identification:
    Manufacturer: CHR
    Model: 28728
    Serial Number: 10
    Made in: week 9 of 2012
  Basic Display Parameters & Features:
    Digital display
    Bits per primary color channel: 8
    HDMI-a interface
    Maximum image size: 160 cm x 90 cm
    Gamma: 2.20
    DPMS levels: Standby Suspend Off
    Supported color formats: RGB 4:4:4
    Default (sRGB) color space is primary color space
    First detailed timing includes the native pixel format and preferred refresh rate
  Color Characteristics:
    Red  : 0.5937, 0.3486
    Green: 0.3378, 0.5205
    Blue : 0.1484, 0.1523
    White: 0.3134, 0.3398
  Established Timings I & II: none
  Standard Timings: none
  Detailed Timing Descriptors:
    DTD 1:  1920x1080   60.000000 Hz  16:9     67.500 kHz    148.500000 MHz (1600 mm x 900 mm)
                 Hfront   88 Hsync  44 Hback  148 Hpol P
                 Vfront    4 Vsync   5 Vback   36 Vpol P
    Display Product Serial Number: '20120313'
    Display Product Name: 'CH7218'
    Display Range Limits:
      Monitor ranges (Bare Limits): 23-61 Hz V, 13-46 kHz H, max dotclock 150 MHz
  Extension blocks: 1
Checksum: 0x93

----------------

Block 1, CTA-861 Extension Block:
  Revision: 3
  Basic audio support
  Native detailed modes: 0
  Audio Data Block:
    Linear PCM:
      Max channels: 2
      Supported sample rates (kHz): 96 48 44.1
      Supported sample sizes (bits): 24 20 16
  Speaker Allocation Data Block:
    FL/FR - Front Left/Right
  Vendor-Specific Data Block, OUI 2B-02-F0:
    70 38 01                                        'p8.'
Checksum: 0xaf  Unused space in Extension Block: 108 bytes


