
EDID (hex):
00ffffffffffff004c834c3200000000
00170104952213780ace859e5b4c9426
17505400000001010101010101010101
010101010101dc3780a0703840403020
250058c2100000190000000f00000000
00000000001e82105200000000fe0053
414d53554e470a2020202020000000fe
00313536484c30312d3130320a2000d1

edid-decode (hex):

00 ff ff ff ff ff ff 00 4c 83 4c 32 00 00 00 00
00 17 01 04 95 22 13 78 0a ce 85 9e 5b 4c 94 26
17 50 54 00 00 00 01 01 01 01 01 01 01 01 01 01
01 01 01 01 01 01 dc 37 80 a0 70 38 40 40 30 20
25 00 58 c2 10 00 00 19 00 00 00 0f 00 00 00 00
00 00 00 00 00 1e 82 10 52 00 00 00 00 fe 00 53
41 4d 53 55 4e 47 0a 20 20 20 20 20 00 00 00 fe
00 31 35 36 48 4c 30 31 2d 31 30 32 0a 20 00 d1

----------------

Block 0, Base EDID:
  EDID Structure Version & Revision: 1.4
  Vendor & Product Identification:
    Manufacturer: SDC
    Model: 12876
    Made in: 2013
  Basic Display Parameters & Features:
    Digital display
    Bits per primary color channel: 6
    DisplayPort interface
    Maximum image size: 34 cm x 19 cm
    Gamma: 2.20
    Supported color formats: RGB 4:4:4, YCrCb 4:4:4
    First detailed timing includes the native pixel format and preferred refresh rate
  Color Characteristics:
    Red  : 0.6201, 0.3554
    Green: 0.2998, 0.5800
    Blue : 0.1503, 0.0898
    White: 0.3134, 0.3291
  Established Timings I & II: none
  Standard Timings: none
  Detailed Timing Descriptors:
    DTD 1:  1920x1080   60.096154 Hz  16:9     68.750 kHz    143.000000 MHz (344 mm x 194 mm)
                 Hfront   48 Hsync  32 Hback   80 Hpol N
                 Vfront    2 Vsync   5 Vback   57 Vpol N
    Manufacturer-Specified Display Descriptor (0x0f): 00 0f 00 00 00 00 00 00 00 00 00 1e 82 10 52 00 '..............R.'
    Alphanumeric Data String: 'SAMSUNG'
    Alphanumeric Data String: '156HL01-102'
Checksum: 0xd1
