
EDID (hex):
00ffffffffffff00061010a002010101
19150104951a0e780250c59858528e27
25505400000001010101010101010101
010101010101201c5686500020300e38
13000090100000180000001000000000
00000000000000000000000000fe0042
313136585730352056370a20000000fc
00436f6c6f72204c43440a20202000f8

edid-decode (hex):

00 ff ff ff ff ff ff 00 06 10 10 a0 02 01 01 01
19 15 01 04 95 1a 0e 78 02 50 c5 98 58 52 8e 27
25 50 54 00 00 00 01 01 01 01 01 01 01 01 01 01
01 01 01 01 01 01 20 1c 56 86 50 00 20 30 0e 38
13 00 00 90 10 00 00 18 00 00 00 10 00 00 00 00
00 00 00 00 00 00 00 00 00 00 00 00 00 fe 00 42
31 31 36 58 57 30 35 20 56 37 0a 20 00 00 00 fc
00 43 6f 6c 6f 72 20 4c 43 44 0a 20 20 20 00 f8

----------------

Block 0, Base EDID:
  EDID Structure Version & Revision: 1.4
  Vendor & Product Identification:
    Manufacturer: APP
    Model: 40976
    Serial Number: 16843010
    Made in: week 25 of 2011
  Basic Display Parameters & Features:
    Digital display
    Bits per primary color channel: 6
    DisplayPort interface
    Maximum image size: 26 cm x 14 cm
    Gamma: 2.20
    Supported color formats: RGB 4:4:4
    First detailed timing includes the native pixel format and preferred refresh rate
  Color Characteristics:
    Red  : 0.5947, 0.3447
    Green: 0.3203, 0.5546
    Blue : 0.1552, 0.1445
    White: 0.3134, 0.3291
  Established Timings I & II: none
  Standard Timings: none
  Detailed Timing Descriptors:
    DTD 1:  1366x768    60.000000 Hz 683:384   48.000 kHz     72.000000 MHz (256 mm x 144 mm)
                 Hfront   14 Hsync  56 Hback   64 Hpol N
                 Vfront    1 Vsync   3 Vback   28 Vpol N
    Dummy Descriptor:
    Alphanumeric Data String: 'B116XW05 V7'
    Display Product Name: 'Color LCD'
Checksum: 0xf8
