
EDID (hex):
00ffffffffffff000dae351700000000
271801049526157802d495a355509d27
0f505400000001010101010101010101
010101010101b03680b670381e403020
35007dd610000018000000fe004e3137
334847452d4531310a20000000fe0043
4d4e0a202020202020202020000000fe
004e3137334847452d4531310a20009f

edid-decode (hex):

00 ff ff ff ff ff ff 00 0d ae 35 17 00 00 00 00
27 18 01 04 95 26 15 78 02 d4 95 a3 55 50 9d 27
0f 50 54 00 00 00 01 01 01 01 01 01 01 01 01 01
01 01 01 01 01 01 b0 36 80 b6 70 38 1e 40 30 20
35 00 7d d6 10 00 00 18 00 00 00 fe 00 4e 31 37
33 48 47 45 2d 45 31 31 0a 20 00 00 00 fe 00 43
4d 4e 0a 20 20 20 20 20 20 20 20 20 00 00 00 fe
00 4e 31 37 33 48 47 45 2d 45 31 31 0a 20 00 9f

----------------

Block 0, Base EDID:
  EDID Structure Version & Revision: 1.4
  Vendor & Product Identification:
    Manufacturer: CMN
    Model: 5941
    Made in: week 39 of 2014
  Basic Display Parameters & Features:
    Digital display
    Bits per primary color channel: 6
    DisplayPort interface
    Maximum image size: 38 cm x 21 cm
    Gamma: 2.20
    Supported color formats: RGB 4:4:4
    First detailed timing includes the native pixel format and preferred refresh rate
  Color Characteristics:
    Red  : 0.6396, 0.3330
    Green: 0.3134, 0.6132
    Blue : 0.1542, 0.0595
    White: 0.3134, 0.3291
  Established Timings I & II: none
  Standard Timings: none
  Detailed Timing Descriptors:
    DTD 1:  1920x1080   60.002914 Hz  16:9     66.603 kHz    140.000000 MHz (381 mm x 214 mm)
                 Hfront   48 Hsync  32 Hback  102 Hpol N
                 Vfront    3 Vsync   5 Vback   22 Vpol N
    Alphanumeric Data String: 'N173HGE-E11'
    Alphanumeric Data String: 'CMN'
    Alphanumeric Data String: 'N173HGE-E11'
Checksum: 0x9f
