
EDID (hex):
00ffffffffffff0004728b07c1000000
221e0104b55021783ba7d5b24b3aad24
115054bfef80d1c0b30095008180714f
81c08140a940f57c70a0d0a029503020
35001d4e3100001a000000fd003090d7
d750010a202020202020000000fc0058
5a333432434b0a2020202020000000ff
00544b4e4141303031333930300a02b2
020336f1501f01020304051011121314
21225f60612309070783010000e305c2
006d1a000002013090000000000000e6
0607016a5b24ebf970a0d0a029503020
35001d4e3100001a43d070a0d0a02950
302035001d4e3100001a339c70a0d0a0
2950302035001d4e3100001a226870a0
d0a02950302035001d4e3100001a00ea
7012790000030014e62b01846f0d9f00
2f001f009f0528000280040007000a08
81000804000402100000000000000000
00000000000000000000000000000000
00000000000000000000000000000000
00000000000000000000000000000000
00000000000000000000000000000000
00000000000000000000000000005190

Extracted contents:
header:          00 ff ff ff ff ff ff 00
serial number:   04 72 8b 07 c1 00 00 00 22 1e
version:         01 04
basic params:    b5 50 21 78 3b
chroma info:     a7 d5 b2 4b 3a ad 24 11 50 54
established:     bf ef 80
standard:        d1 c0 b3 00 95 00 81 80 71 4f 81 c0 81 40 a9 40
descriptor 1:    f5 7c 70 a0 d0 a0 29 50 30 20 35 00 1d 4e 31 00 00 1a
descriptor 2:    00 00 00 fd 00 30 90 d7 d7 50 01 0a 20 20 20 20 20 20
descriptor 3:    00 00 00 fc 00 58 5a 33 34 32 43 4b 0a 20 20 20 20 20
descriptor 4:    00 00 00 ff 00 54 4b 4e 41 41 30 30 31 33 39 30 30 0a
extensions:      02
checksum:        b2

EDID version: 1.4
Manufacturer: ACR Model 78b Serial Number --
Made in week 34 of 2020
Digital display
10 bits per primary color channel
DisplayPort interface
Maximum image size: 80 cm x 33 cm
Gamma: 2.20
DPMS levels: Off
Supported color formats: RGB 4:4:4, YCrCb 4:4:4, YCrCb 4:2:2
First detailed timing includes the native pixel format and preferred refresh rate
Display is continuous frequency
Display x,y Chromaticity:
  Red:   0.6972, 0.2949
  Green: 0.2275, 0.6787
  Blue:  0.1435, 0.0673
  White: 0.3134, 0.3291
Established timings supported:
  720x400@70Hz 9:5 HorFreq: 31469 Hz Clock: 28.320 MHz
  640x480@60Hz 4:3 HorFreq: 31469 Hz Clock: 25.175 MHz
  640x480@67Hz 4:3 HorFreq: 35000 Hz Clock: 30.240 MHz
  640x480@72Hz 4:3 HorFreq: 37900 Hz Clock: 31.500 MHz
  640x480@75Hz 4:3 HorFreq: 37500 Hz Clock: 31.500 MHz
  800x600@56Hz 4:3 HorFreq: 35200 Hz Clock: 36.000 MHz
  800x600@60Hz 4:3 HorFreq: 37900 Hz Clock: 40.000 MHz
  800x600@72Hz 4:3 HorFreq: 48100 Hz Clock: 50.000 MHz
  800x600@75Hz 4:3 HorFreq: 46900 Hz Clock: 49.500 MHz
  832x624@75Hz 4:3 HorFreq: 49726 Hz Clock: 57.284 MHz
  1024x768@60Hz 4:3 HorFreq: 48400 Hz Clock: 65.000 MHz
  1024x768@70Hz 4:3 HorFreq: 56500 Hz Clock: 75.000 MHz
  1024x768@75Hz 4:3 HorFreq: 60000 Hz Clock: 78.750 MHz
  1280x1024@75Hz 5:4 HorFreq: 80000 Hz Clock: 135.000 MHz
  1152x870@75Hz 192:145 HorFreq: 67500 Hz Clock: 108.000 MHz
Standard timings supported:
  1920x1080@60Hz 16:9
  1680x1050@60Hz 16:10 HorFreq: 64700 Hz Clock: 119.000 MHz
  1440x900@60Hz 16:10 HorFreq: 55500 Hz Clock: 88.750 MHz
  1280x1024@60Hz 5:4 HorFreq: 64000 Hz Clock: 108.000 MHz
  1152x864@75Hz 4:3 HorFreq: 67500 Hz Clock: 108.000 MHz
  1280x720@60Hz 16:9
  1280x960@60Hz 4:3 HorFreq: 60000 Hz Clock: 108.000 MHz
  1600x1200@60Hz 4:3 HorFreq: 75000 Hz Clock: 162.000 MHz
Detailed mode: Clock 319.890 MHz, 797 mm x 334 mm
               3440 3488 3520 3600 hborder 0
               1440 1443 1448 1481 vborder 0
               +hsync -vsync 
               VertFreq: 59 Hz, HorFreq: 88858 Hz
Monitor ranges (bare limits): 48-144Hz V, 215-215kHz H, max dotclock 800MHz
Monitor name: XZ342CK
Serial number: --
Has 2 extension blocks
Checksum: 0xb2 (valid)

CTA extension block
Extension version: 3
50 bytes of CTA data
  Video data block
    VIC  31 1920x1080@50Hz 16:9  HorFreq: 56250 Hz Clock: 148.500 MHz
    VIC   1 640x480@60Hz 4:3  HorFreq: 31469 Hz Clock: 25.175 MHz
    VIC   2 720x480@60Hz 4:3  HorFreq: 31469 Hz Clock: 27.000 MHz
    VIC   3 720x480@60Hz 16:9  HorFreq: 31469 Hz Clock: 27.000 MHz
    VIC   4 1280x720@60Hz 16:9  HorFreq: 45000 Hz Clock: 74.250 MHz
    VIC   5 1920x1080i@60Hz 16:9  HorFreq: 33750 Hz Clock: 74.250 MHz
    VIC  16 1920x1080@60Hz 16:9  HorFreq: 67500 Hz Clock: 148.500 MHz
    VIC  17 720x576@50Hz 4:3  HorFreq: 31250 Hz Clock: 27.000 MHz
    VIC  18 720x576@50Hz 16:9  HorFreq: 31250 Hz Clock: 27.000 MHz
    VIC  19 1280x720@50Hz 16:9  HorFreq: 37500 Hz Clock: 74.250 MHz
    VIC  20 1920x1080i@50Hz 16:9  HorFreq: 28125 Hz Clock: 74.250 MHz
    VIC  33 1920x1080@25Hz 16:9  HorFreq: 28125 Hz Clock: 74.250 MHz
    VIC  34 1920x1080@30Hz 16:9  HorFreq: 33750 Hz Clock: 74.250 MHz
    VIC  95 3840x2160@30Hz 16:9  HorFreq: 67500 Hz Clock: 297.000 MHz
    VIC  96 3840x2160@50Hz 16:9  HorFreq: 112500 Hz Clock: 594.000 MHz
    VIC  97 3840x2160@60Hz 16:9  HorFreq: 135000 Hz Clock: 594.000 MHz
  Audio data block
    Linear PCM, max channels 2
      Supported sample rates (kHz): 48 44.1 32
      Supported sample sizes (bits): 24 20 16
  Speaker allocation data block
    Speaker map:
      FL/FR - Front Left/Right
  Extended tag: Colorimetry data block
    xvYCC709
    BT2020YCC
    BT2020RGB
  Vendor-specific data block, OUI 00001a
  Extended tag: HDR static metadata data block
    Electro optical transfer functions:
      Traditional gamma - SDR luminance range
      Traditional gamma - HDR luminance range
      SMPTE ST2084
    Supported static metadata descriptors:
      Static metadata type 1
    Desired content max luminance: 106 (496.743 cd/m^2)
    Desired content max frame-average luminance: 91 (358.942 cd/m^2)
    Desired content min luminance: 36 (0.099 cd/m^2)
Underscans PC formats by default
Basic audio support
Supports YCbCr 4:4:4
Supports YCbCr 4:2:2
1 native detailed modes
Detailed mode: Clock 639.790 MHz, 797 mm x 334 mm
               3440 3488 3520 3600 hborder 0
               1440 1443 1448 1481 vborder 0
               +hsync -vsync 
               VertFreq: 119 Hz, HorFreq: 177719 Hz
Detailed mode: Clock 533.150 MHz, 797 mm x 334 mm
               3440 3488 3520 3600 hborder 0
               1440 1443 1448 1481 vborder 0
               +hsync -vsync 
               VertFreq: 99 Hz, HorFreq: 148097 Hz
Detailed mode: Clock 399.870 MHz, 797 mm x 334 mm
               3440 3488 3520 3600 hborder 0
               1440 1443 1448 1481 vborder 0
               +hsync -vsync 
               VertFreq: 75 Hz, HorFreq: 111075 Hz
Detailed mode: Clock 266.580 MHz, 797 mm x 334 mm
               3440 3488 3520 3600 hborder 0
               1440 1443 1448 1481 vborder 0
               +hsync -vsync 
               VertFreq: 50 Hz, HorFreq: 74050 Hz
Checksum: 0xea (valid)


DisplayID extension block
Extension version: 18
Length 121, version 18, extension count 0
Checksum: 0x51 (valid)
Type 1 detailed timing: aspect: 16:9, Preferred  
Detailed mode: Clock 767.740 MHz, 0 mm x 0 mm
               3439 3486 3517 3598
               1439 1441 1445 1479
               -hsync +vsync
VESA DMT timing block

Warning: One or more of the timings is out of range of the Monitor Ranges:
  Vertical Freq: 25 - 119 Hz
  Horizontal Freq: 28125 - 177719 Hz
  Maximum Clock: 639.790 MHz
EDID block does not conform at all!
	Both the serial number and the serial string are set
