
EDID (hex):
00ffffffffffff000dae741700000000
2f1e0104a526157803ee95a3544c9926
0f505400000001010101010101010101
0101010101019e8580a070383e403020
a5007dd61000001aad3780a070383e40
3020a5007dd61000001a000000000000
00000000000000000000000000000002
000c33ff0f3c9633183c960000000016

edid-decode (hex):

00 ff ff ff ff ff ff 00 0d ae 74 17 00 00 00 00
2f 1e 01 04 a5 26 15 78 03 ee 95 a3 54 4c 99 26
0f 50 54 00 00 00 01 01 01 01 01 01 01 01 01 01
01 01 01 01 01 01 9e 85 80 a0 70 38 3e 40 30 20
a5 00 7d d6 10 00 00 1a ad 37 80 a0 70 38 3e 40
30 20 a5 00 7d d6 10 00 00 1a 00 00 00 00 00 00
00 00 00 00 00 00 00 00 00 00 00 00 00 00 00 02
00 0c 33 ff 0f 3c 96 33 18 3c 96 00 00 00 00 16

----------------

Block 0, Base EDID:
  EDID Structure Version & Revision: 1.4
  Vendor & Product Identification:
    Manufacturer: CMN
    Model: 6004
    Made in: week 47 of 2020
  Basic Display Parameters & Features:
    Digital display
    Bits per primary color channel: 8
    DisplayPort interface
    Maximum image size: 38 cm x 21 cm
    Gamma: 2.20
    Supported color formats: RGB 4:4:4
    First detailed timing includes the native pixel format and preferred refresh rate
    Display is continuous frequency
  Color Characteristics:
    Red  : 0.6396, 0.3300
    Green: 0.2998, 0.5996
    Blue : 0.1503, 0.0595
    White: 0.3134, 0.3291
  Established Timings I & II: none
  Standard Timings: none
  Detailed Timing Descriptors:
    DTD 1:  1920x1080  144.003435 Hz  16:9    164.452 kHz    342.060000 MHz (381 mm x 214 mm)
                 Hfront   48 Hsync  32 Hback   80 Hpol P
                 Vfront   10 Vsync   5 Vback   47 Vpol N
    DTD 2:  1920x1080   60.003536 Hz  16:9     68.524 kHz    142.530000 MHz (381 mm x 214 mm)
                 Hfront   48 Hsync  32 Hback   80 Hpol P
                 Vfront   10 Vsync   5 Vback   47 Vpol N
    Empty Descriptor
    Manufacturer-Specified Display Descriptor (0x02): 00 02 00 0c 33 ff 0f 3c 96 33 18 3c 96 00 00 00 '....3..<.3.<....'
Checksum: 0x16
