
EDID (hex):
00ffffffffffff000daee71500000000
2c1e0104a52213780228659759548e27
1e505400000001010101010101010101
010101010101363680a0703820403020
350058c110000018000000fe004e3135
364843412d4541420a20000000fe0043
4d4e0a202020202020202020000000fe
004e3135364843412d4541420a20004e

edid-decode (hex):

00 ff ff ff ff ff ff 00 0d ae e7 15 00 00 00 00
2c 1e 01 04 a5 22 13 78 02 28 65 97 59 54 8e 27
1e 50 54 00 00 00 01 01 01 01 01 01 01 01 01 01
01 01 01 01 01 01 36 36 80 a0 70 38 20 40 30 20
35 00 58 c1 10 00 00 18 00 00 00 fe 00 4e 31 35
36 48 43 41 2d 45 41 42 0a 20 00 00 00 fe 00 43
4d 4e 0a 20 20 20 20 20 20 20 20 20 00 00 00 fe
00 4e 31 35 36 48 43 41 2d 45 41 42 0a 20 00 4e

----------------

Block 0, Base EDID:
  EDID Structure Version & Revision: 1.4
  Vendor & Product Identification:
    Manufacturer: CMN
    Model: 5607
    Made in: week 44 of 2020
  Basic Display Parameters & Features:
    Digital display
    Bits per primary color channel: 8
    DisplayPort interface
    Maximum image size: 34 cm x 19 cm
    Gamma: 2.20
    Supported color formats: RGB 4:4:4
    First detailed timing includes the native pixel format and preferred refresh rate
  Color Characteristics:
    Red  : 0.5898, 0.3496
    Green: 0.3300, 0.5546
    Blue : 0.1533, 0.1191
    White: 0.3134, 0.3291
  Established Timings I & II: none
  Standard Timings: none
  Detailed Timing Descriptors:
    DTD 1:  1920x1080   60.001038 Hz  16:9     66.721 kHz    138.780000 MHz (344 mm x 193 mm)
                 Hfront   48 Hsync  32 Hback   80 Hpol N
                 Vfront    3 Vsync   5 Vback   24 Vpol N
    Alphanumeric Data String: 'N156HCA-EAB'
    Alphanumeric Data String: 'CMN'
    Alphanumeric Data String: 'N156HCA-EAB'
Checksum: 0x4e
