
EDID (hex):
00ffffffffffff000daee71500000000
2a1e0104a52213780228659759548e27
1e505400000001010101010101010101
010101010101b43b804a713834405036
680058c110000018000000fe004e3135
364843412d4541420a20000000fe0043
4d4e0a202020202020202020000000fe
004e3135364843412d4541420a2000a5

edid-decode (hex):

00 ff ff ff ff ff ff 00 0d ae e7 15 00 00 00 00
2a 1e 01 04 a5 22 13 78 02 28 65 97 59 54 8e 27
1e 50 54 00 00 00 01 01 01 01 01 01 01 01 01 01
01 01 01 01 01 01 b4 3b 80 4a 71 38 34 40 50 36
68 00 58 c1 10 00 00 18 00 00 00 fe 00 4e 31 35
36 48 43 41 2d 45 41 42 0a 20 00 00 00 fe 00 43
4d 4e 0a 20 20 20 20 20 20 20 20 20 00 00 00 fe
00 4e 31 35 36 48 43 41 2d 45 41 42 0a 20 00 a5

----------------

Block 0, Base EDID:
  EDID Structure Version & Revision: 1.4
  Vendor & Product Identification:
    Manufacturer: CMN
    Model: 5607
    Made in: week 42 of 2020
  Basic Display Parameters & Features:
    Digital display
    Bits per primary color channel: 8
    DisplayPort interface
    Maximum image size: 34 cm x 19 cm
    Gamma: 2.20
    Supported color formats: RGB 4:4:4
    First detailed timing includes the native pixel format and preferred refresh rate
  Color Characteristics:
    Red  : 0.5898, 0.3496
    Green: 0.3300, 0.5546
    Blue : 0.1533, 0.1191
    White: 0.3134, 0.3291
  Established Timings I & II: none
  Standard Timings: none
  Detailed Timing Descriptors:
    DTD 1:  1920x1080   60.007852 Hz  16:9     67.929 kHz    152.840000 MHz (344 mm x 193 mm)
                 Hfront   80 Hsync  54 Hback  196 Hpol N
                 Vfront    6 Vsync   8 Vback   38 Vpol N
    Alphanumeric Data String: 'N156HCA-EAB'
    Alphanumeric Data String: 'CMN'
    Alphanumeric Data String: 'N156HCA-EAB'
Checksum: 0xa5
