
EDID (hex):
00ffffffffffff000dae381100000000
011a0104951a0e780267759859539027
1c505400000001010101010101010101
010101010101da1d56e250002030881e
8c00009010000018000000fe004e3131
364243412d4541310a20000000fe0043
4d4e0a202020202020202020000000fe
004e3131364243412d4541310a2000d5

Extracted contents:
header:          00 ff ff ff ff ff ff 00
serial number:   0d ae 38 11 00 00 00 00 01 1a
version:         01 04
basic params:    95 1a 0e 78 02
chroma info:     67 75 98 59 53 90 27 1c 50 54
established:     00 00 00
standard:        01 01 01 01 01 01 01 01 01 01 01 01 01 01 01 01
descriptor 1:    da 1d 56 e2 50 00 20 30 88 1e 8c 00 00 90 10 00 00 18
descriptor 2:    00 00 00 fe 00 4e 31 31 36 42 43 41 2d 45 41 31 0a 20
descriptor 3:    00 00 00 fe 00 43 4d 4e 0a 20 20 20 20 20 20 20 20 20
descriptor 4:    00 00 00 fe 00 4e 31 31 36 42 43 41 2d 45 41 31 0a 20
extensions:      00
checksum:        d5

EDID version: 1.4
Manufacturer: CMN Model 1138 Serial Number --
Made in week 1 of 2016
Digital display
6 bits per primary color channel
DisplayPort interface
Maximum image size: 26 cm x 14 cm
Gamma: 2.20
Supported color formats: RGB 4:4:4
First detailed timing includes the native pixel format and preferred refresh rate
Display x,y Chromaticity:
  Red:   0.5947, 0.3496
  Green: 0.3251, 0.5654
  Blue:  0.1533, 0.1123
  White: 0.3134, 0.3291
Established timings supported:
Standard timings supported:
Detailed mode: Clock 76.420 MHz, 256 mm x 144 mm
               1366 1502 1532 1592 hborder 0
                768  776  788  800 vborder 0
               -hsync -vsync 
               VertFreq: 60 Hz, HorFreq: 48002 Hz
ASCII string: N116BCA-EA1
ASCII string: CMN
ASCII string: N116BCA-EA1
Checksum: 0xd5 (valid)
EDID block does NOT conform to EDID 1.4!
	Missing name descriptor
	Missing monitor ranges
