edid-decode (hex):

00 ff ff ff ff ff ff 00 05 e3 6a 24 c7 69 00 00
1c 1c 01 04 a5 35 1e 78 3b 64 35 a5 54 4f 9e 27
12 50 54 bf ef 00 d1 c0 81 80 31 68 31 7c 45 68
45 7c 61 68 61 7c 02 3a 80 18 71 38 2d 40 58 2c
45 00 13 2b 21 00 00 1e fc 7e 80 88 70 38 12 40
18 20 35 00 13 2b 21 00 00 1e 00 00 00 fd 00 23
92 a0 a0 21 01 0a 20 20 20 20 20 20 00 00 00 fc
00 32 34 36 30 47 34 0a 20 20 20 20 20 20 01 00

----------------

Block 0, Base EDID:
  EDID Structure Version & Revision: 1.4
  Vendor & Product Identification:
    Manufacturer: AOC
    Model: 9322
    Serial Number: ...
    Made in: week 28 of 2018
  Basic Display Parameters & Features:
    Digital display
    Bits per primary color channel: 8
    DisplayPort interface
    Maximum image size: 53 cm x 30 cm
    Gamma: 2.20
    DPMS levels: Off
    Supported color formats: RGB 4:4:4, YCrCb 4:4:4, YCrCb 4:2:2
    First detailed timing includes the native pixel format and preferred refresh rate
    Display is continuous frequency
  Color Characteristics:
    Red  : 0.6455, 0.3300
    Green: 0.3095, 0.6171
    Blue : 0.1523, 0.0732
    White: 0.3134, 0.3291
  Established Timings I & II:
    IBM     :   720x400    70.081663 Hz   9:5     31.467 kHz     28.320000 MHz
    DMT 0x04:   640x480    59.940476 Hz   4:3     31.469 kHz     25.175000 MHz
    Apple   :   640x480    66.666667 Hz   4:3     35.000 kHz     30.240000 MHz
    DMT 0x05:   640x480    72.808802 Hz   4:3     37.861 kHz     31.500000 MHz
    DMT 0x06:   640x480    75.000000 Hz   4:3     37.500 kHz     31.500000 MHz
    DMT 0x08:   800x600    56.250000 Hz   4:3     35.156 kHz     36.000000 MHz
    DMT 0x09:   800x600    60.316541 Hz   4:3     37.879 kHz     40.000000 MHz
    DMT 0x0a:   800x600    72.187572 Hz   4:3     48.077 kHz     50.000000 MHz
    DMT 0x0b:   800x600    75.000000 Hz   4:3     46.875 kHz     49.500000 MHz
    Apple   :   832x624    74.551266 Hz   4:3     49.726 kHz     57.284000 MHz
    DMT 0x10:  1024x768    60.003840 Hz   4:3     48.363 kHz     65.000000 MHz
    DMT 0x11:  1024x768    70.069359 Hz   4:3     56.476 kHz     75.000000 MHz
    DMT 0x12:  1024x768    75.028582 Hz   4:3     60.023 kHz     78.750000 MHz
    DMT 0x24:  1280x1024   75.024675 Hz   5:4     79.976 kHz    135.000000 MHz
  Standard Timings:
    DMT 0x52:  1920x1080   60.000000 Hz  16:9     67.500 kHz    148.500000 MHz
    DMT 0x23:  1280x1024   60.019740 Hz   5:4     63.981 kHz    108.000000 MHz
    GTF     :   640x480    99.999537 Hz   4:3     50.900 kHz     43.163000 MHz
    GTF     :   640x480   119.999084 Hz   4:3     61.800 kHz     52.406000 MHz
    GTF     :   800x600    99.999707 Hz   4:3     63.600 kHz     68.179000 MHz
    GTF     :   800x600   119.999886 Hz   4:3     77.160 kHz     83.950000 MHz
    GTF     :  1024x768   100.000177 Hz   4:3     81.400 kHz    113.309000 MHz
    GTF     :  1024x768   119.999931 Hz   4:3     98.760 kHz    139.054000 MHz
  Detailed Timing Descriptors:
    DTD 1:  1920x1080   60.000000 Hz  16:9     67.500 kHz    148.500000 MHz (531 mm x 299 mm)
                 Hfront   88 Hsync  44 Hback  148 Hpol P
                 Vfront    4 Vsync   5 Vback   36 Vpol P
    DTD 2:  1920x1080  144.000765 Hz  16:9    158.113 kHz    325.080000 MHz (531 mm x 299 mm)
                 Hfront   24 Hsync  32 Hback   80 Hpol P
                 Vfront    3 Vsync   5 Vback   10 Vpol P
    Display Range Limits:
      Monitor ranges (Bare Limits): 35-146 Hz V, 160-160 kHz H, max dotclock 330 MHz
    Display Product Name: '2460G4'
  Extension blocks: 1
Checksum: 0x00

----------------

Warnings:

EDID:
  Base EDID: Some timings are out of range of the Monitor Ranges:
    Horizontal Freq: 31.466 - 158.112 kHz (Monitor: 160.000 - 160.000 kHz)

Failures:

Block 0, Base EDID:
  Base EDID: EDID specified 1 extension block(s), but found 0 extension block(s).

EDID conformity: FAIL
