
EDID (hex):
00ffffffffffff00410c5608cd1d0000
2e1101030e221b782aadb0a2574a9c25
115054bfef80714f8140818001010101
010101010101302a009851002a403070
1300520e1100001e000000ff00415532
30373436303037363239000000fc0050
68696c69707320313730530a000000fd
00384c1e530e000a20202020202000fe

Extracted contents:
header:          00 ff ff ff ff ff ff 00
serial number:   41 0c 56 08 cd 1d 00 00 2e 11
version:         01 03
basic params:    0e 22 1b 78 2a
chroma info:     ad b0 a2 57 4a 9c 25 11 50 54
established:     bf ef 80
standard:        71 4f 81 40 81 80 01 01 01 01 01 01 01 01 01 01
descriptor 1:    30 2a 00 98 51 00 2a 40 30 70 13 00 52 0e 11 00 00 1e
descriptor 2:    00 00 00 ff 00 41 55 32 30 37 34 36 30 30 37 36 32 39
descriptor 3:    00 00 00 fc 00 50 68 69 6c 69 70 73 20 31 37 30 53 0a
descriptor 4:    00 00 00 fd 00 38 4c 1e 53 0e 00 0a 20 20 20 20 20 20
extensions:      00
checksum:        fe

Manufacturer: PHL Model 856 Serial Number --
Made week 46 of 2007
EDID version: 1.3
Analog display, Input voltage level: 0.7/0.3 V
Sync: Separate Composite SyncOnGreen 
Maximum image size: 34 cm x 27 cm
Gamma: 2.20
DPMS levels: Off
RGB color display
First detailed timing is preferred timing
Established timings supported:
  720x400@70Hz
  640x480@60Hz
  640x480@67Hz
  640x480@72Hz
  640x480@75Hz
  800x600@56Hz
  800x600@60Hz
  800x600@72Hz
  800x600@75Hz
  832x624@75Hz
  1024x768@60Hz
  1024x768@70Hz
  1024x768@75Hz
  1280x1024@75Hz
  1152x870@75Hz
Standard timings supported:
  1152x864@75Hz
  1280x960@60Hz
  1280x1024@60Hz
Detailed mode: Clock 108.000 MHz, 338 mm x 270 mm
               1280 1328 1440 1688 hborder 0
               1024 1025 1028 1066 vborder 0
               +hsync +vsync 
Serial number: --
Monitor name: Philips
Monitor ranges (GTF): 56-76Hz V, 30-83kHz H, max dotclock 140MHz
Checksum: 0xfe (valid)
EDID block does NOT conform to EDID 1.3!
	Detailed block string not properly terminated
