edid-decode (hex):

00 ff ff ff ff ff ff 00 30 e4 24 03 00 00 00 00
00 15 01 03 80 16 0e 78 0a 97 95 96 5a 55 94 28
21 50 54 00 00 00 01 01 01 01 01 01 01 01 01 01
01 01 01 01 01 01 12 1b 00 80 50 20 16 30 30 20
47 00 d9 88 00 00 00 1b 00 00 00 00 00 00 00 00
00 00 00 00 00 00 00 00 00 00 00 00 00 fe 00 4c
47 20 44 69 73 70 6c 61 79 0a 20 20 00 00 00 fe
00 4c 50 31 30 31 57 58 31 2d 53 4c 4e 32 00 eb

----------------

Block 0, Base EDID:
  EDID Structure Version & Revision: 1.3
  Vendor & Product Identification:
    Manufacturer: LGD
    Model: 804
    Made in: 2011
  Basic Display Parameters & Features:
    Digital display
    Maximum image size: 22 cm x 14 cm
    Gamma: 2.20
    RGB color display
    First detailed timing is the preferred timing
  Color Characteristics:
    Red  : 0.5878, 0.3525
    Green: 0.3330, 0.5810
    Blue : 0.1582, 0.1298
    White: 0.3134, 0.3291
  Established Timings I & II: none
  Standard Timings: none
  Detailed Timing Descriptors:
    DTD 1:  1280x800    59.876825 Hz   8:5     49.219 kHz     69.300000 MHz (217 mm x 136 mm)
                 Hfront   48 Hsync  32 Hback   48 Hpol P
                 Vfront    4 Vsync   7 Vback   11 Vpol N
    Empty Descriptor
    Alphanumeric Data String: 'LG Display'
    Alphanumeric Data String: 'LP101WX1-SLN2'
Checksum: 0xeb

----------------

Failures:

Block 0, Base EDID:
  Empty Descriptor: Use Dummy Descriptor instead of all zeroes.
  Missing Display Product Name.
  Missing Display Range Limits Descriptor.

EDID conformity: FAIL
