
EDID (hex):
00ffffffffffff0030e4210500000000
001a0104951f1178ea9d35945c558f29
1e505400000001010101010101010101
0101010101012e3680a070381f403020
350035ae1000001a542b80a070381f40
3020350035ae1000001a000000fe004c
4720446973706c61790a2020000000fe
004c503134305746362d535042360075

Extracted contents:
header:          00 ff ff ff ff ff ff 00
serial number:   30 e4 21 05 00 00 00 00 00 1a
version:         01 04
basic params:    95 1f 11 78 ea
chroma info:     9d 35 94 5c 55 8f 29 1e 50 54
established:     00 00 00
standard:        01 01 01 01 01 01 01 01 01 01 01 01 01 01 01 01
descriptor 1:    2e 36 80 a0 70 38 1f 40 30 20 35 00 35 ae 10 00 00 1a
descriptor 2:    54 2b 80 a0 70 38 1f 40 30 20 35 00 35 ae 10 00 00 1a
descriptor 3:    00 00 00 fe 00 4c 47 20 44 69 73 70 6c 61 79 0a 20 20
descriptor 4:    00 00 00 fe 00 4c 50 31 34 30 57 46 36 2d 53 50 42 36
extensions:      00
checksum:        75

Manufacturer: LGD Model 521 Serial Number --
Made week 0 of 2016
EDID version: 1.4
Digital display
6 bits per primary color channel
DisplayPort interface
Maximum image size: 31 cm x 17 cm
Gamma: 2.20
DPMS levels: Standby Suspend Off
Supported color formats: RGB 4:4:4, YCrCb 4:2:2
First detailed timing is preferred timing
Established timings supported:
Standard timings supported:
Detailed mode: Clock 138.700 MHz, 309 mm x 174 mm
               1920 1968 2000 2080 hborder 0
               1080 1083 1088 1111 vborder 0
               +hsync -vsync 
Detailed mode: Clock 110.920 MHz, 309 mm x 174 mm
               1920 1968 2000 2080 hborder 0
               1080 1083 1088 1111 vborder 0
               +hsync -vsync 
ASCII string: LG
ASCII string: LP140WF6
Checksum: 0x75 (valid)
EDID block does NOT conform to EDID 1.3!
	Missing name descriptor
	Missing monitor ranges
	Detailed block string not properly terminated
