
EDID (hex):
00ffffffffffff000610c99c00000000
0c140103801d13780af595a3554f9c26
0f505400000001010101010101010101
010101010101521c00a0502017303020
36001eb2100000180000000100061020
00000000000000000a20000000fe004e
3133334947452d4c34310a20000000fc
00436f6c6f72204c43440a2020200023

edid-decode (hex):

00 ff ff ff ff ff ff 00 06 10 c9 9c 00 00 00 00
0c 14 01 03 80 1d 13 78 0a f5 95 a3 55 4f 9c 26
0f 50 54 00 00 00 01 01 01 01 01 01 01 01 01 01
01 01 01 01 01 01 52 1c 00 a0 50 20 17 30 30 20
36 00 1e b2 10 00 00 18 00 00 00 01 00 06 10 20
00 00 00 00 00 00 00 00 0a 20 00 00 00 fe 00 4e
31 33 33 49 47 45 2d 4c 34 31 0a 20 00 00 00 fc
00 43 6f 6c 6f 72 20 4c 43 44 0a 20 20 20 00 23

----------------

Block 0, Base EDID:
  EDID Structure Version & Revision: 1.3
  Vendor & Product Identification:
    Manufacturer: APP
    Model: 40137
    Made in: week 12 of 2010
  Basic Display Parameters & Features:
    Digital display
    Maximum image size: 29 cm x 19 cm
    Gamma: 2.20
    RGB color display
    First detailed timing is the preferred timing
  Color Characteristics:
    Red  : 0.6396, 0.3349
    Green: 0.3095, 0.6103
    Blue : 0.1503, 0.0595
    White: 0.3134, 0.3291
  Established Timings I & II: none
  Standard Timings: none
  Detailed Timing Descriptors:
    DTD 1:  1280x800    61.175240 Hz  16:10    50.347 kHz     72.500000 MHz (286 mm x 178 mm)
                 Hfront   48 Hsync  32 Hback   80 Hpol N
                 Vfront    3 Vsync   6 Vback   14 Vpol N
    Manufacturer-Specified Display Descriptor (0x01): 00 01 00 06 10 20 00 00 00 00 00 00 00 00 0a 20 '..... ......... '
    Alphanumeric Data String: 'N133IGE-L41'
    Display Product Name: 'Color LCD'
Checksum: 0x23
