
EDID (hex):
00ffffffffffff0026cfe60400000000
001b0104a51c107802de50a3544c9926
0f505400000001010101010101010101
0101010101014f3680a070382240323c
ae00149c100000190000000000000000
00000000000000000000000000fe0049
6e666f566973696f6e0a2020000000fe
00523132354e574634205232200a0004

edid-decode (hex):

00 ff ff ff ff ff ff 00 26 cf e6 04 00 00 00 00
00 1b 01 04 a5 1c 10 78 02 de 50 a3 54 4c 99 26
0f 50 54 00 00 00 01 01 01 01 01 01 01 01 01 01
01 01 01 01 01 01 4f 36 80 a0 70 38 22 40 32 3c
ae 00 14 9c 10 00 00 19 00 00 00 00 00 00 00 00
00 00 00 00 00 00 00 00 00 00 00 00 00 fe 00 49
6e 66 6f 56 69 73 69 6f 6e 0a 20 20 00 00 00 fe
00 52 31 32 35 4e 57 46 34 20 52 32 20 0a 00 04

----------------

Block 0, Base EDID:
  EDID Structure Version & Revision: 1.4
  Vendor & Product Identification:
    Manufacturer: IVO
    Model: 1254
    Made in: 2017
  Basic Display Parameters & Features:
    Digital display
    Bits per primary color channel: 8
    DisplayPort interface
    Maximum image size: 28 cm x 16 cm
    Gamma: 2.20
    Supported color formats: RGB 4:4:4
    First detailed timing includes the native pixel format and preferred refresh rate
  Color Characteristics:
    Red  : 0.6396, 0.3291
    Green: 0.2998, 0.5996
    Blue : 0.1494, 0.0595
    White: 0.3125, 0.3281
  Established Timings I & II: none
  Standard Timings: none
  Detailed Timing Descriptors:
    DTD 1:  1920x1080   60.001208 Hz  16:9     66.841 kHz    139.030000 MHz (276 mm x 156 mm)
                 Hfront   50 Hsync  60 Hback   50 Hpol N
                 Vfront   10 Vsync  14 Vback   10 Vpol N
    Empty Descriptor
    Alphanumeric Data String: 'InfoVision'
    Alphanumeric Data String: 'R125NWF4 R2 '
Checksum: 0x04
