
EDID (hex):
00ffffffffffff00047284ad6f742072
16110103802f1e782e9345a3554a9827
155054bfef00b300a940950f950081c0
8140494f818021399030621a274068b0
3600da281100001c000000fd00384b1f
5111000a202020202020000000fc0041
4c32323233570a2020202020000000ff
004c3834304230313833393230200054

Extracted contents:
header:          00 ff ff ff ff ff ff 00
serial number:   04 72 84 ad 6f 74 20 72 16 11
version:         01 03
basic params:    80 2f 1e 78 2e
chroma info:     93 45 a3 55 4a 98 27 15 50 54
established:     bf ef 00
standard:        b3 00 a9 40 95 0f 95 00 81 c0 81 40 49 4f 81 80
descriptor 1:    21 39 90 30 62 1a 27 40 68 b0 36 00 da 28 11 00 00 1c
descriptor 2:    00 00 00 fd 00 38 4b 1f 51 11 00 0a 20 20 20 20 20 20
descriptor 3:    00 00 00 fc 00 41 4c 32 32 32 33 57 0a 20 20 20 20 20
descriptor 4:    00 00 00 ff 00 4c 38 34 30 42 30 31 38 33 39 32 30 20
extensions:      00
checksum:        54

Manufacturer: ACR Model ad84 Serial Number --
Made week 22 of 2007
EDID version: 1.3
Digital display
Maximum image size: 47 cm x 30 cm
Gamma: 2.20
DPMS levels: Off
Supported color formats: RGB 4:4:4, YCrCb 4:2:2
Default (sRGB) color space is primary color space
First detailed timing is preferred timing
Established timings supported:
  720x400@70Hz
  640x480@60Hz
  640x480@67Hz
  640x480@72Hz
  640x480@75Hz
  800x600@56Hz
  800x600@60Hz
  800x600@72Hz
  800x600@75Hz
  832x624@75Hz
  1024x768@60Hz
  1024x768@70Hz
  1024x768@75Hz
  1280x1024@75Hz
Standard timings supported:
  1680x1050@60Hz
  1600x1200@60Hz
  1440x900@75Hz
  1440x900@60Hz
  1280x720@60Hz
  1280x960@60Hz
  832x624@75Hz
  1280x1024@60Hz
Detailed mode: Clock 146.250 MHz, 474 mm x 296 mm
               1680 1784 1960 2240 hborder 0
               1050 1053 1059 1089 vborder 0
               -hsync +vsync 
Monitor ranges (GTF): 56-75Hz V, 31-81kHz H, max dotclock 170MHz
Monitor name: AL2223W
Serial number: --
Checksum: 0x54 (valid)
EDID block does NOT conform to EDID 1.3!
	Detailed block string not properly terminated


