
EDID (hex):
00ffffffffffff004c2dc30c48594d30
2d1901030e3420782a7c41a9544b9f25
0d505423080081c0810081809500a9c0
b300d1c00101283c80a070b023403020
360006442100001a000000fd00383c1e
5111000a202020202020000000fc0053
3234453635300a2020202020000000ff
00485450474230303034360a202000e2

Extracted contents:
header:          00 ff ff ff ff ff ff 00
serial number:   4c 2d c3 0c 48 59 4d 30 2d 19
version:         01 03
basic params:    0e 34 20 78 2a
chroma info:     7c 41 a9 54 4b 9f 25 0d 50 54
established:     23 08 00
standard:        81 c0 81 00 81 80 95 00 a9 c0 b3 00 d1 c0 01 01
descriptor 1:    28 3c 80 a0 70 b0 23 40 30 20 36 00 06 44 21 00 00 1a
descriptor 2:    00 00 00 fd 00 38 3c 1e 51 11 00 0a 20 20 20 20 20 20
descriptor 3:    00 00 00 fc 00 53 32 34 45 36 35 30 0a 20 20 20 20 20
descriptor 4:    00 00 00 ff 00 48 54 50 47 42 30 30 30 34 36 0a 20 20
extensions:      00
checksum:        e2

EDID version: 1.3
Manufacturer: SAM Model cc3 Serial Number --
Made in week 45 of 2015
Analog display, Input voltage level: 0.7/0.3 V
Sync: Separate Composite SyncOnGreen 
Maximum image size: 52 cm x 32 cm
Gamma: 2.20
DPMS levels: Off
RGB color display
First detailed timing is preferred timing
Display x,y Chromaticity:
  Red:   0.6611, 0.3310
  Green: 0.2958, 0.6210
  Blue:  0.1455, 0.0507
  White: 0.3125, 0.3291
Established timings supported:
  640x480@60Hz 4:3 HorFreq: 31469 Hz Clock: 25.175 MHz
  800x600@56Hz 4:3 HorFreq: 35200 Hz Clock: 36.000 MHz
  800x600@60Hz 4:3 HorFreq: 37900 Hz Clock: 40.000 MHz
  1024x768@60Hz 4:3 HorFreq: 48400 Hz Clock: 65.000 MHz
Standard timings supported:
  1280x720@60Hz 16:9
  1280x800@60Hz 16:10
  1280x1024@60Hz 5:4 HorFreq: 64000 Hz Clock: 108.000 MHz
  1440x900@60Hz 16:10 HorFreq: 55500 Hz Clock: 88.750 MHz
  1600x900@60Hz 16:9
  1680x1050@60Hz 16:10 HorFreq: 64700 Hz Clock: 119.000 MHz
  1920x1080@60Hz 16:9
Detailed mode: Clock 154.000 MHz, 518 mm x 324 mm
               1920 1968 2000 2080 hborder 0
               1200 1203 1209 1235 vborder 0
               +hsync -vsync 
               VertFreq: 59 Hz, HorFreq: 74038 Hz
Monitor ranges (GTF): 56-60Hz V, 30-81kHz H, max dotclock 170MHz
Monitor name: S24E650
Serial number: --
Checksum: 0xe2 (valid)
