
EDID (hex):
00ffffffffffff002c83f10500000000
01190104951c117802b0909758549226
1d505400000001010101010101010101
010101010101ce1d56f4500016303020
360058c11000001ae21356f450001630
3020360058c110000000000000000000
00000000000000000000000000000002
000a3ce20a3c6e1c0b12780000000053

edid-decode (hex):

00 ff ff ff ff ff ff 00 2c 83 f1 05 00 00 00 00
01 19 01 04 95 1c 11 78 02 b0 90 97 58 54 92 26
1d 50 54 00 00 00 01 01 01 01 01 01 01 01 01 01
01 01 01 01 01 01 ce 1d 56 f4 50 00 16 30 30 20
36 00 58 c1 10 00 00 1a e2 13 56 f4 50 00 16 30
30 20 36 00 58 c1 10 00 00 00 00 00 00 00 00 00
00 00 00 00 00 00 00 00 00 00 00 00 00 00 00 02
00 0a 3c e2 0a 3c 6e 1c 0b 12 78 00 00 00 00 53

----------------

Block 0, Base EDID:
  EDID Structure Version & Revision: 1.4
  Vendor & Product Identification:
    Manufacturer: KDC
    Model: 1521
    Made in: week 1 of 2015
  Basic Display Parameters & Features:
    Digital display
    Bits per primary color channel: 6
    DisplayPort interface
    Maximum image size: 28 cm x 17 cm
    Gamma: 2.20
    Supported color formats: RGB 4:4:4
    First detailed timing includes the native pixel format and preferred refresh rate
  Color Characteristics:
    Red  : 0.5917, 0.3466
    Green: 0.3281, 0.5703
    Blue : 0.1503, 0.1142
    White: 0.3125, 0.3281
  Established Timings I & II: none
  Standard Timings: none
  Detailed Timing Descriptors:
    DTD 1:  1366x768    59.988993 Hz 683:384   47.391 kHz     76.300000 MHz (344 mm x 193 mm)
                 Hfront   48 Hsync  32 Hback  164 Hpol P
                 Vfront    3 Vsync   6 Vback   13 Vpol N
    DTD 2:  1366x768    40.018869 Hz 683:384   31.615 kHz     50.900000 MHz (analog composite, sync-on-green, 344 mm x 193 mm)
                 Hfront   48 Hsync  32 Hback  164 Hpol N
                 Vfront    3 Vsync   6 Vback   13 Vpol N
    Empty Descriptor
    Manufacturer-Specified Display Descriptor (0x02): 00 02 00 0a 3c e2 0a 3c 6e 1c 0b 12 78 00 00 00 '....<..<n...x...'
Checksum: 0x53
