
EDID (hex):
00ffffffffffff002194000000000000
0d1a0103a379449606ee91a3544c9926
0f505400000001010101010101010101
010101010101141e00e850203830a020
460426a51000001e1339801871382040
3020880026a51000001e000000fc0057
61766553686172650a20202000000000
0018780c9a22000a2020202020200124
020327c15000050403020716011f1213
14201511062309070765030c00100083
010000e3050301023a801871382d4058
2c450006442100001e011d8018711c16
20582c250006442100009e011d007251
d01e206e28550006442100001e8c0ad0
8a20e02d10103e960006442100001800
00000000000000000000000000000067

edid-decode (hex):

00 ff ff ff ff ff ff 00 21 94 00 00 00 00 00 00
0d 1a 01 03 a3 79 44 96 06 ee 91 a3 54 4c 99 26
0f 50 54 00 00 00 01 01 01 01 01 01 01 01 01 01
01 01 01 01 01 01 14 1e 00 e8 50 20 38 30 a0 20
46 04 26 a5 10 00 00 1e 13 39 80 18 71 38 20 40
30 20 88 00 26 a5 10 00 00 1e 00 00 00 fc 00 57
61 76 65 53 68 61 72 65 0a 20 20 20 00 00 00 00
00 18 78 0c 9a 22 00 0a 20 20 20 20 20 20 01 24

02 03 27 c1 50 00 05 04 03 02 07 16 01 1f 12 13
14 20 15 11 06 23 09 07 07 65 03 0c 00 10 00 83
01 00 00 e3 05 03 01 02 3a 80 18 71 38 2d 40 58
2c 45 00 06 44 21 00 00 1e 01 1d 80 18 71 1c 16
20 58 2c 25 00 06 44 21 00 00 9e 01 1d 00 72 51
d0 1e 20 6e 28 55 00 06 44 21 00 00 1e 8c 0a d0
8a 20 e0 2d 10 10 3e 96 00 06 44 21 00 00 18 00
00 00 00 00 00 00 00 00 00 00 00 00 00 00 00 67

----------------

Block 0, Base EDID:
  EDID Structure Version & Revision: 1.3
  Vendor & Product Identification:
    Manufacturer: HLT
    Model: 0
    Made in: week 13 of 2016
  Basic Display Parameters & Features:
    Digital display
    DFP 1.x compatible TMDS
    Maximum image size: 121 cm x 68 cm
    Gamma: 2.50
    Monochrome or grayscale display
    Default (sRGB) color space is primary color space
    First detailed timing is the preferred timing
  Color Characteristics:
    Red  : 0.6396, 0.3300
    Green: 0.2998, 0.5996
    Blue : 0.1503, 0.0595
    White: 0.3125, 0.3291
  Established Timings I & II: none
  Standard Timings: none
  Detailed Timing Descriptors:
    DTD 1:  1280x800    59.492904 Hz  16:10    50.926 kHz     77.000000 MHz (294 mm x 165 mm)
                 Hfront  160 Hsync  32 Hback   40 Hpol P
                 Vfront   20 Vsync   6 Vback   30 Vpol P
    DTD 2:  1920x1080   59.724493 Hz  16:9     66.414 kHz    146.110000 MHz (294 mm x 165 mm)
                 Hfront   48 Hsync  32 Hback  200 Hpol P
                 Vfront    8 Vsync   8 Vback   16 Vpol P
    Display Product Name: 'WaveShare'
    Manufacturer-Specified Display Descriptor (0x00): 00 00 00 18 78 0c 9a 22 00 0a 20 20 20 20 20 20 '....x.."..      '
  Extension blocks: 1
Checksum: 0x24

----------------

Block 1, CTA-861 Extension Block:
  Revision: 3
  Underscans IT Video Formats by default
  Basic audio support
  Native detailed modes: 1
  Video Data Block:
    VIC   5:  1920x1080i  60.000000 Hz  16:9     33.750 kHz     74.250000 MHz
    VIC   4:  1280x720    60.000000 Hz  16:9     45.000 kHz     74.250000 MHz
    VIC   3:   720x480    59.940060 Hz  16:9     31.469 kHz     27.000000 MHz
    VIC   2:   720x480    59.940060 Hz   4:3     31.469 kHz     27.000000 MHz
    VIC   7:  1440x480i   59.940060 Hz  16:9     15.734 kHz     27.000000 MHz
    VIC  22:  1440x576i   50.000000 Hz  16:9     15.625 kHz     27.000000 MHz
    VIC   1:   640x480    59.940476 Hz   4:3     31.469 kHz     25.175000 MHz
    VIC  31:  1920x1080   50.000000 Hz  16:9     56.250 kHz    148.500000 MHz
    VIC  18:   720x576    50.000000 Hz  16:9     31.250 kHz     27.000000 MHz
    VIC  19:  1280x720    50.000000 Hz  16:9     37.500 kHz     74.250000 MHz
    VIC  20:  1920x1080i  50.000000 Hz  16:9     28.125 kHz     74.250000 MHz
    VIC  32:  1920x1080   24.000000 Hz  16:9     27.000 kHz     74.250000 MHz
    VIC  21:  1440x576i   50.000000 Hz   4:3     15.625 kHz     27.000000 MHz
    VIC  17:   720x576    50.000000 Hz   4:3     31.250 kHz     27.000000 MHz
    VIC   6:  1440x480i   59.940060 Hz   4:3     15.734 kHz     27.000000 MHz
  Audio Data Block:
    Linear PCM:
      Max channels: 2
      Supported sample rates (kHz): 48 44.1 32
      Supported sample sizes (bits): 24 20 16
  Vendor-Specific Data Block (HDMI), OUI 00-0C-03:
    Source physical address: 1.0.0.0
  Speaker Allocation Data Block:
    FL/FR - Front Left/Right
  Colorimetry Data Block:
    xvYCC601
    xvYCC709
    Gamut Boundary Description Metadata Profile P0
  Detailed Timing Descriptors:
    DTD 3:  1920x1080   60.000000 Hz  16:9     67.500 kHz    148.500000 MHz (518 mm x 324 mm)
                 Hfront   88 Hsync  44 Hback  148 Hpol P
                 Vfront    4 Vsync   5 Vback   36 Vpol P
    DTD 4:  1920x1080i  60.000000 Hz  16:9     33.750 kHz     74.250000 MHz (518 mm x 324 mm)
                 Hfront   88 Hsync  44 Hback  148 Hpol P
                 Vfront    2 Vsync   5 Vback   15 Vpol P Vfront +0.5 Odd Field
                 Vfront    2 Vsync   5 Vback   15 Vpol P Vback  +0.5 Even Field
    DTD 5:  1280x720    60.000000 Hz  16:9     45.000 kHz     74.250000 MHz (518 mm x 324 mm)
                 Hfront  110 Hsync  40 Hback  220 Hpol P
                 Vfront    5 Vsync   5 Vback   20 Vpol P
    DTD 6:   720x480    59.940060 Hz   3:2     31.469 kHz     27.000000 MHz (518 mm x 324 mm)
                 Hfront   16 Hsync  62 Hback   60 Hpol N
                 Vfront    9 Vsync   6 Vback   30 Vpol N
Checksum: 0x67  Unused space in Extension Block: 16 bytes
