edid-decode (hex):

00 ff ff ff ff ff ff 00 22 f0 99 26 00 00 00 80
0a 11 01 03 68 22 1b 78 2e ae a5 a6 54 4c 99 26
14 50 54 ad ef 80 81 80 01 01 01 01 01 01 01 01
01 01 01 01 01 01 30 2a 00 98 51 00 2a 40 30 70
13 00 51 0e 11 00 00 06 00 00 00 fd 00 32 4c 18
53 0e 00 0a 20 20 20 20 20 20 00 00 00 fc 00 48
50 20 76 70 31 37 0a 20 20 20 20 20 00 00 00 ff
00 43 4e 4e 37 31 30 33 57 32 52 0a 20 20 00 02

----------------

Block 0, Base EDID:
  EDID Structure Version & Revision: 1.3
  Vendor & Product Identification:
    Manufacturer: HWP
    Model: 9881
    Serial Number: ...
    Made in: week 10 of 2007
  Basic Display Parameters & Features:
    Analog display
    Input voltage level: 0.7/0.7 V
    Blank level equals black level
    Sync: Separate
    Maximum image size: 34 cm x 27 cm
    Gamma: 2.20
    DPMS levels: Off
    RGB color display
    Default (sRGB) color space is primary color space
    First detailed timing is the preferred timing
  Color Characteristics:
    Red  : 0.6503, 0.3300
    Green: 0.2998, 0.5996
    Blue : 0.1503, 0.0800
    White: 0.3134, 0.3291
  Established Timings I & II:
    IBM     :   720x400    70.082 Hz   9:5    31.467 kHz  28.320 MHz
    DMT 0x04:   640x480    59.940 Hz   4:3    31.469 kHz  25.175 MHz
    DMT 0x05:   640x480    72.809 Hz   4:3    37.861 kHz  31.500 MHz
    DMT 0x06:   640x480    75.000 Hz   4:3    37.500 kHz  31.500 MHz
    DMT 0x09:   800x600    60.317 Hz   4:3    37.879 kHz  40.000 MHz
    DMT 0x0a:   800x600    72.188 Hz   4:3    48.077 kHz  50.000 MHz
    DMT 0x0b:   800x600    75.000 Hz   4:3    46.875 kHz  49.500 MHz
    Apple   :   832x624    74.551 Hz   4:3    49.726 kHz  57.284 MHz
    DMT 0x10:  1024x768    60.004 Hz   4:3    48.363 kHz  65.000 MHz
    DMT 0x11:  1024x768    70.069 Hz   4:3    56.476 kHz  75.000 MHz
    DMT 0x12:  1024x768    75.029 Hz   4:3    60.023 kHz  78.750 MHz
    DMT 0x24:  1280x1024   75.025 Hz   5:4    79.976 kHz 135.000 MHz
    Apple   :  1152x870    75.062 Hz 192:145  68.681 kHz 100.000 MHz
  Standard Timings:
    DMT 0x23:  1280x1024   60.020 Hz   5:4    63.981 kHz 108.000 MHz
  Detailed Timing Descriptors:
    DTD 1:  1280x1024   60.020 Hz   5:4    63.981 kHz 108.000 MHz (analog composite, serrate, 337 mm x 270 mm)
                 Hfront   48 Hsync 112 Hback 248 Hpol N
                 Vfront    1 Vsync   3 Vback  38 Vpol N
  Display Range Limits:
    Monitor ranges (GTF): 50-76 Hz V, 24-83 kHz H, max dotclock 140 MHz
    Display Product Name: 'HP vp17'
    Display Product Serial Number: ...
Checksum: 0x02

----------------

Failures:

Block 0, Base EDID:
  Basic Display Parameters & Features: sRGB is signaled, but the chromaticities do not match.

EDID conformity: FAIL
