
EDID (hex):
00ffffffffffff003870000000000000
001a0104a51a0f7806de50a3544c9926
0f505400000001010101010101010101
0101010101011a3680a070381f403020
3500009010000018542b80a070381f40
30203500009010000018000000100000
000000000000000000000000000000fc
004c433131364c46334c30310a20009a

Extracted contents:
header:          00 ff ff ff ff ff ff 00
serial number:   38 70 00 00 00 00 00 00 00 1a
version:         01 04
basic params:    a5 1a 0f 78 06
chroma info:     de 50 a3 54 4c 99 26 0f 50 54
established:     00 00 00
standard:        01 01 01 01 01 01 01 01 01 01 01 01 01 01 01 01
descriptor 1:    1a 36 80 a0 70 38 1f 40 30 20 35 00 00 90 10 00 00 18
descriptor 2:    54 2b 80 a0 70 38 1f 40 30 20 35 00 00 90 10 00 00 18
descriptor 3:    00 00 00 10 00 00 00 00 00 00 00 00 00 00 00 00 00 00
descriptor 4:    00 00 00 fc 00 4c 43 31 31 36 4c 46 33 4c 30 31 0a 20
extensions:      00
checksum:        9a

Manufacturer: NCP Model 0 Serial Number --
Made week 0 of 2016
EDID version: 1.4
Digital display
8 bits per primary color channel
DisplayPort interface
Maximum image size: 26 cm x 15 cm
Gamma: 2.20
Supported color formats: RGB 4:4:4
Default (sRGB) color space is primary color space
First detailed timing is preferred timing
Established timings supported:
Standard timings supported:
Detailed mode: Clock 138.500 MHz, 256 mm x 144 mm
               1920 1968 2000 2080 hborder 0
               1080 1083 1088 1111 vborder 0
               -hsync -vsync 
Detailed mode: Clock 110.920 MHz, 256 mm x 144 mm
               1920 1968 2000 2080 hborder 0
               1080 1083 1088 1111 vborder 0
               -hsync -vsync 
Dummy block
Monitor name: LC116LF3L01
Checksum: 0x9a (valid)
EDID block does NOT conform to EDID 1.3!
	Missing monitor ranges
