
EDID (hex):
00ffffffffffff001e6df04b76780500
0515010368291778ead025a258559c28
0f5054a76a00314f454f614f01010101
010101010101662156aa51001e30468f
33009ae61000001e000000fd00384b1e
3d09000a202020202020000000fc0045
313934310a20202020202020000000ff
003130354e44554e414a3531380a000a

Extracted contents:
header:          00 ff ff ff ff ff ff 00
serial number:   1e 6d f0 4b 76 78 05 00 05 15
version:         01 03
basic params:    68 29 17 78 ea
chroma info:     d0 25 a2 58 55 9c 28 0f 50 54
established:     a7 6a 00
standard:        31 4f 45 4f 61 4f 01 01 01 01 01 01 01 01 01 01
descriptor 1:    66 21 56 aa 51 00 1e 30 46 8f 33 00 9a e6 10 00 00 1e
descriptor 2:    00 00 00 fd 00 38 4b 1e 3d 09 00 0a 20 20 20 20 20 20
descriptor 3:    00 00 00 fc 00 45 31 39 34 31 0a 20 20 20 20 20 20 20
descriptor 4:    00 00 00 ff 00 31 30 35 4e 44 55 4e 41 4a 35 31 38 0a
extensions:      00
checksum:        0a

Manufacturer: GSM Model 4bf0 Serial Number --
Made week 5 of 2011
EDID version: 1.3
Analog display, Input voltage level: 0.7/0.7 V
Sync: Separate 
Maximum image size: 41 cm x 23 cm
Gamma: 2.20
DPMS levels: Standby Suspend Off
RGB color display
First detailed timing is preferred timing
Established timings supported:
  720x400@70Hz
  640x480@60Hz
  640x480@75Hz
  800x600@56Hz
  800x600@60Hz
  800x600@75Hz
  832x624@75Hz
  1024x768@60Hz
  1024x768@75Hz
Standard timings supported:
  640x480@75Hz
  800x600@75Hz
  1024x768@75Hz
Detailed mode: Clock 85.500 MHz, 410 mm x 230 mm
               1366 1436 1579 1792 hborder 0
                768  771  774  798 vborder 0
               +hsync +vsync 
Monitor ranges (GTF): 56-75Hz V, 30-61kHz H, max dotclock 90MHz
Monitor name: E1941
Serial number: --
Checksum: 0xa (valid)
