
EDID (hex):
00ffffffffffff001e6d085bc3e70300
071d0103803c2278ea3035a7554ea326
0f50542108007140818081c0a9c0d1c0
81000101010108e80030f2705a80b058
8a0058542100001e04740030f2705a80
b0588a0058542100001a000000fd0038
3d1e873c000a202020202020000000fc
004c4720556c7472612048440a20015c
020330714d902220050403020161605d
5e5f230907076d030c002000b83c2000
6001020367d85dc401788003e30f0006
023a801871382d40582c450058542100
001a565e00a0a0a02950302035005854
2100001a000000000000000000000000
00000000000000000000000000000000
0000000000000000000000000000009a

Extracted contents:
header:          00 ff ff ff ff ff ff 00
serial number:   1e 6d 08 5b c3 e7 03 00 07 1d
version:         01 03
basic params:    80 3c 22 78 ea
chroma info:     30 35 a7 55 4e a3 26 0f 50 54
established:     21 08 00
standard:        71 40 81 80 81 c0 a9 c0 d1 c0 81 00 01 01 01 01
descriptor 1:    08 e8 00 30 f2 70 5a 80 b0 58 8a 00 58 54 21 00 00 1e
descriptor 2:    04 74 00 30 f2 70 5a 80 b0 58 8a 00 58 54 21 00 00 1a
descriptor 3:    00 00 00 fd 00 38 3d 1e 87 3c 00 0a 20 20 20 20 20 20
descriptor 4:    00 00 00 fc 00 4c 47 20 55 6c 74 72 61 20 48 44 0a 20
extensions:      01
checksum:        5c

Manufacturer: GSM Model 5b08 Serial Number --
Made week 7 of 2019
EDID version: 1.3
Digital display
Maximum image size: 60 cm x 34 cm
Gamma: 2.20
DPMS levels: Standby Suspend Off
Supported color formats: RGB 4:4:4, YCrCb 4:2:2
First detailed timing is preferred timing
Established timings supported:
  640x480@60Hz
  800x600@60Hz
  1024x768@60Hz
Standard timings supported:
  1152x864@60Hz
  1280x1024@60Hz
  1280x720@60Hz
  1600x900@60Hz
  1920x1080@60Hz
  1280x800@60Hz
Detailed mode: Clock 594.000 MHz, 600 mm x 340 mm
               3840 4016 4104 4400 hborder 0
               2160 2168 2178 2250 vborder 0
               +hsync +vsync 
Detailed mode: Clock 297.000 MHz, 600 mm x 340 mm
               3840 4016 4104 4400 hborder 0
               2160 2168 2178 2250 vborder 0
               +hsync -vsync 
Monitor ranges (GTF): 56-61Hz V, 30-135kHz H, max dotclock 600MHz
Monitor name: LG
Has 1 extension blocks
Checksum: 0x5c (valid)

CEA extension block
Extension version: 3
44 bytes of CEA data
  Video data block
    VIC 16 1920x1080@60Hz (native)
    VIC 34 1920x1080@30Hz 
    VIC 32 1920x1080@24Hz 
    VIC 05 1920x1080i@60Hz 
    VIC 04 1280x720@60Hz 
    VIC 03 720x480@60Hz 
    VIC 02 720x480@60Hz 
    VIC 01 640x480@60Hz 
    VIC 97 Unknown mode 
    VIC 96 Unknown mode 
    VIC 93 Unknown mode 
    VIC 94 Unknown mode 
    VIC 95 Unknown mode 
  Audio data block
    Linear PCM, max channels 1
    Supported sample rates (kHz): 48 44.1 32
    Supported sample sizes (bits): 24 20 16
  Vendor-specific data block, OUI 000c03 (HDMI)
    Source physical address 2.0.0.0
    Supports_AI
    DC_36bit
    DC_30bit
    DC_Y444
    Maximum TMDS clock: 300MHz
    Extended HDMI video details:
      HDMI VIC 0 3840x2160@30Hz
      HDMI VIC 1 3840x2160@25Hz
      HDMI VIC 2 3840x2160@24Hz
  Vendor-specific data block, OUI c45dd8
  Extended tag: Reserved video block (0f)
Basic audio support
Supports YCbCr 4:4:4
Supports YCbCr 4:2:2
1 native detailed modes
Detailed mode: Clock 148.500 MHz, 600 mm x 340 mm
               1920 2008 2052 2200 hborder 0
               1080 1084 1089 1125 vborder 0
               +hsync -vsync 
Detailed mode: Clock 241.500 MHz, 600 mm x 340 mm
               2560 2608 2640 2720 hborder 0
               1440 1443 1448 1481 vborder 0
               +hsync -vsync 
Checksum: 0x9a (valid)

EDID block does NOT conform to EDID 1.3!
	Detailed block string not properly terminated


