
EDID (hex):
00ffffffffffff0004722f01a9022010
0215010308331d78ea6085a6564a9c25
125054b30c10714f81009500d1c00101
010101010101023a801871382d40582c
4500fd1e1100001a000000fc00563232
3348514c0a2020202020000000fd0038
4c1f5312000a202020202020000000ff
004c4b4a3043303035343059310a00b0

Extracted contents:
header:          00 ff ff ff ff ff ff 00
serial number:   04 72 2f 01 a9 02 20 10 02 15
version:         01 03
basic params:    08 33 1d 78 ea
chroma info:     60 85 a6 56 4a 9c 25 12 50 54
established:     b3 0c 10
standard:        71 4f 81 00 95 00 d1 c0 01 01 01 01 01 01 01 01
descriptor 1:    02 3a 80 18 71 38 2d 40 58 2c 45 00 fd 1e 11 00 00 1a
descriptor 2:    00 00 00 fc 00 56 32 32 33 48 51 4c 0a 20 20 20 20 20
descriptor 3:    00 00 00 fd 00 38 4c 1f 53 12 00 0a 20 20 20 20 20 20
descriptor 4:    00 00 00 ff 00 4c 4b 4a 30 43 30 30 35 34 30 59 31 0a
extensions:      00
checksum:        b0

Manufacturer: ACR Model 12f Serial Number --
Made week 2 of 2011
EDID version: 1.3
Analog display, Input voltage level: 0.7/0.3 V
Sync: Separate 
Maximum image size: 51 cm x 29 cm
Gamma: 2.20
DPMS levels: Standby Suspend Off
RGB color display
First detailed timing is preferred timing
Established timings supported:
  720x400@70Hz
  640x480@60Hz
  640x480@67Hz
  800x600@56Hz
  800x600@60Hz
  1024x768@60Hz
  1024x768@70Hz
Standard timings supported:
  1152x864@75Hz
  1280x800@60Hz
  1440x900@60Hz
  1920x1080@60Hz
Detailed mode: Clock 148.500 MHz, 509 mm x 286 mm
               1920 2008 2052 2200 hborder 0
               1080 1084 1089 1125 vborder 0
               +hsync -vsync 
Monitor name: V223HQL
Monitor ranges (GTF): 56-76Hz V, 31-83kHz H, max dotclock 180MHz
Serial number: --
Checksum: 0xb0 (valid)
