
EDID (hex):
00ffffffffffff004c2de30c58534d30
18190104b54627783bf05ca45848a424
0d5355210800810081c08180a9c0b300
9500010101014dd000a0f0703e803020
3500b9882100001a000000fd00283c87
873c010a202020202020000000fc0055
3332453835300a2020202020000000ff
00485448473630303036320a20200186
02030ef041102309070783010000023a
801871382d40582c4500b9882100001e
565e00a0a0a0295030203500b9882100
001a0000000000000000000000000000
00000000000000000000000000000000
00000000000000000000000000000000
00000000000000000000000000000000
000000000000000000000000000000ad

Extracted contents:
header:          00 ff ff ff ff ff ff 00
serial number:   4c 2d e3 0c 58 53 4d 30 18 19
version:         01 04
basic params:    b5 46 27 78 3b
chroma info:     f0 5c a4 58 48 a4 24 0d 53 55
established:     21 08 00
standard:        81 00 81 c0 81 80 a9 c0 b3 00 95 00 01 01 01 01
descriptor 1:    4d d0 00 a0 f0 70 3e 80 30 20 35 00 b9 88 21 00 00 1a
descriptor 2:    00 00 00 fd 00 28 3c 87 87 3c 01 0a 20 20 20 20 20 20
descriptor 3:    00 00 00 fc 00 55 33 32 45 38 35 30 0a 20 20 20 20 20
descriptor 4:    00 00 00 ff 00 48 54 48 47 36 30 30 30 36 32 0a 20 20
extensions:      01
checksum:        86

EDID version: 1.4
Manufacturer: SAM Model ce3 Serial Number --
Made in week 24 of 2015
Digital display
10 bits per primary color channel
DisplayPort interface
Maximum image size: 70 cm x 39 cm
Gamma: 2.20
DPMS levels: Off
Supported color formats: RGB 4:4:4, YCrCb 4:4:4, YCrCb 4:2:2
First detailed timing includes the native pixel format and preferred refresh rate
Display is continuous frequency
Display x,y Chromaticity:
  Red:   0.6435, 0.3466
  Green: 0.2812, 0.6406
  Blue:  0.1416, 0.0517
  White: 0.3271, 0.3320
Established timings supported:
  640x480@60Hz 4:3 HorFreq: 31469 Hz Clock: 25.175 MHz
  800x600@60Hz 4:3 HorFreq: 37900 Hz Clock: 40.000 MHz
  1024x768@60Hz 4:3 HorFreq: 48400 Hz Clock: 65.000 MHz
Standard timings supported:
  1280x800@60Hz 16:10
  1280x720@60Hz 16:9
  1280x1024@60Hz 5:4 HorFreq: 64000 Hz Clock: 108.000 MHz
  1600x900@60Hz 16:9
  1680x1050@60Hz 16:10 HorFreq: 64700 Hz Clock: 119.000 MHz
  1440x900@60Hz 16:10 HorFreq: 55500 Hz Clock: 88.750 MHz
Detailed mode: Clock 533.250 MHz, 697 mm x 392 mm
               3840 3888 3920 4000 hborder 0
               2160 2163 2168 2222 vborder 0
               +hsync -vsync 
               VertFreq: 59 Hz, HorFreq: 133312 Hz
Monitor ranges (bare limits): 40-60Hz V, 135-135kHz H, max dotclock 600MHz
Monitor name: U32E850
Serial number: --
Has 1 extension blocks
Checksum: 0x86 (valid)

CTA extension block
Extension version: 3
10 bytes of CTA data
  Video data block
    VIC  16 1920x1080@60Hz 16:9  HorFreq: 67500 Hz Clock: 148.500 MHz
  Audio data block
    Linear PCM, max channels 2
      Supported sample rates (kHz): 48 44.1 32
      Supported sample sizes (bits): 24 20 16
  Speaker allocation data block
    Speaker map:
      FL/FR - Front Left/Right
Underscans PC formats by default
Basic audio support
Supports YCbCr 4:4:4
Supports YCbCr 4:2:2
0 native detailed modes
Detailed mode: Clock 148.500 MHz, 697 mm x 392 mm
               1920 2008 2052 2200 hborder 0
               1080 1084 1089 1125 vborder 0
               +hsync +vsync 
               VertFreq: 60 Hz, HorFreq: 67500 Hz
Detailed mode: Clock 241.500 MHz, 697 mm x 392 mm
               2560 2608 2640 2720 hborder 0
               1440 1443 1448 1481 vborder 0
               +hsync -vsync 
               VertFreq: 59 Hz, HorFreq: 88786 Hz
Checksum: 0xad (valid)

Warning: One or more of the timings is out of range of the Monitor Ranges:
  Vertical Freq: 59 - 60 Hz
  Horizontal Freq: 31469 - 133312 Hz
  Maximum Clock: 533.250 MHz
EDID block does not conform at all!
	Both the serial number and the serial string are set
