
EDID (hex):
00ffffffffffff0006afeb3400000000
191c0104a5221378020925a5564f9b27
0c505400000001010101010101010101
01010101010152d000a0f0703e803020
350058c11000001a52d000a0f0706882
3020350025a51000001a000000fe0058
5748594380423135365a414e00000000
000241029e000100000f010a20200067

Extracted contents:
header:          00 ff ff ff ff ff ff 00
serial number:   06 af eb 34 00 00 00 00 19 1c
version:         01 04
basic params:    a5 22 13 78 02
chroma info:     09 25 a5 56 4f 9b 27 0c 50 54
established:     00 00 00
standard:        01 01 01 01 01 01 01 01 01 01 01 01 01 01 01 01
descriptor 1:    52 d0 00 a0 f0 70 3e 80 30 20 35 00 58 c1 10 00 00 1a
descriptor 2:    52 d0 00 a0 f0 70 68 82 30 20 35 00 25 a5 10 00 00 1a
descriptor 3:    00 00 00 fe 00 58 57 48 59 43 80 42 31 35 36 5a 41 4e
descriptor 4:    00 00 00 00 00 02 41 02 9e 00 01 00 00 0f 01 0a 20 20
extensions:      00
checksum:        67

Manufacturer: AUO Model 34eb Serial Number --
Made week 25 of 2018
EDID version: 1.4
Digital display
8 bits per primary color channel
DisplayPort interface
Maximum image size: 34 cm x 19 cm
Gamma: 2.20
Supported color formats: RGB 4:4:4
First detailed timing is preferred timing
Established timings supported:
Standard timings supported:
Detailed mode: Clock 533.300 MHz, 344 mm x 193 mm
               3840 3888 3920 4000 hborder 0
               2160 2163 2168 2222 vborder 0
               +hsync -vsync 
Detailed mode: Clock 533.300 MHz, 293 mm x 165 mm
               3840 3888 3920 4000 hborder 0
               2160 2163 2168 2776 vborder 0
               +hsync -vsync 
ASCII string: XWHYC
Manufacturer-specified data, tag 0
Checksum: 0x67 (valid)
EDID block does NOT conform to EDID 1.3!
	Missing name descriptor
	Missing monitor ranges
	Detailed block string not properly terminated
