
EDID (hex):
00ffffffffffff001ab3e60708dd0100
21150103803c22782ac9a5a4564b9d25
125054a54b0081809500b30001010101
010101010101023a801871382d40582c
450056502100001e000000fd00173d0f
5216000a202020202020000000fc0053
4c3237542d31204c45440a20000000ff
00313231323132323132300a20200107
02031e724b909f051404130312010716
230907078301000065030c002000023a
80d072382d40102c9680565021000018
011d8018711c1620582c250056502100
009e011d80d0721c1620102c25805650
2100009e011d00bc52d01e20b8285540
56502100001e8c0ad090204031200c40
550056502100001800000000000000ae

Extracted contents:
header:          00 ff ff ff ff ff ff 00
serial number:   1a b3 e6 07 08 dd 01 00 21 15
version:         01 03
basic params:    80 3c 22 78 2a
chroma info:     c9 a5 a4 56 4b 9d 25 12 50 54
established:     a5 4b 00
standard:        81 80 95 00 b3 00 01 01 01 01 01 01 01 01 01 01
descriptor 1:    02 3a 80 18 71 38 2d 40 58 2c 45 00 56 50 21 00 00 1e
descriptor 2:    00 00 00 fd 00 17 3d 0f 52 16 00 0a 20 20 20 20 20 20
descriptor 3:    00 00 00 fc 00 53 4c 32 37 54 2d 31 20 4c 45 44 0a 20
descriptor 4:    00 00 00 ff 00 31 32 31 32 31 32 32 31 32 30 0a 20 20
extensions:      01
checksum:        07

Manufacturer: FUS Model 7e6 Serial Number --
Made week 33 of 2011
EDID version: 1.3
Digital display
Maximum image size: 60 cm x 34 cm
Gamma: 2.20
DPMS levels: Off
Supported color formats: RGB 4:4:4, YCrCb 4:2:2
First detailed timing is preferred timing
Established timings supported:
  720x400@70Hz
  640x480@60Hz
  640x480@75Hz
  800x600@60Hz
  800x600@75Hz
  1024x768@60Hz
  1024x768@75Hz
  1280x1024@75Hz
Standard timings supported:
  1280x1024@60Hz
  1440x900@60Hz
  1680x1050@60Hz
Detailed mode: Clock 148.500 MHz, 598 mm x 336 mm
               1920 2008 2052 2200 hborder 0
               1080 1084 1089 1125 vborder 0
               +hsync +vsync 
Monitor ranges (GTF): 23-61Hz V, 15-82kHz H, max dotclock 220MHz
Monitor name: SL27T
Serial number: --
Has 1 extension blocks
Checksum: 0x7 (valid)

CEA extension block
Extension version: 3
26 bytes of CEA data
  Video data block
    VIC 16 1920x1080@60Hz (native)
    VIC 31 1920x1080@50Hz (native)
    VIC 05 1920x1080i@60Hz 
    VIC 20 1920x1080i@50Hz 
    VIC 04 1280x720@60Hz 
    VIC 19 1280x720@50Hz 
    VIC 03 720x480@60Hz 
    VIC 18 720x576@50Hz 
    VIC 01 640x480@60Hz 
    VIC 07 1440x480i@60Hz 
    VIC 22 1440x576i@50Hz 
  Audio data block
    Linear PCM, max channels 1
    Supported sample rates (kHz): 48 44.1 32
    Supported sample sizes (bits): 24 20 16
  Speaker allocation data block
  Vendor-specific data block, OUI 000c03 (HDMI)
    Source physical address 2.0.0.0
Basic audio support
Supports YCbCr 4:4:4
Supports YCbCr 4:2:2
2 native detailed modes
Detailed mode: Clock 148.500 MHz, 598 mm x 336 mm
               1920 2448 2492 2640 hborder 0
               1080 1089 1095 1125 vborder 0
               -hsync -vsync 
Detailed mode: Clock 74.250 MHz, 598 mm x 336 mm
               1920 2008 2052 2200 hborder 0
                540  542  547  562 vborder 0
               +hsync +vsync interlaced 
Detailed mode: Clock 74.250 MHz, 598 mm x 336 mm
               1920 2448 2492 2640 hborder 0
                540  542  547  562 vborder 0
               +hsync +vsync interlaced 
Detailed mode: Clock 74.250 MHz, 598 mm x 336 mm
               1280 1720 1760 1980 hborder 0
                720  725  730  750 vborder 0
               +hsync +vsync 
Detailed mode: Clock 27.000 MHz, 598 mm x 336 mm
                720  732  796  864 hborder 0
                576  581  586  625 vborder 0
               -hsync -vsync 
Checksum: 0xae (valid)

EDID block does NOT conform to EDID 1.3!
	Detailed block string not properly terminated
