
EDID (hex):
00ffffffffffff00320c00c400000000
00100103802115780ae9d59959538e28
26505400000001010101010101010101
010101010101ab22a0a050841a303020
36004bcf10000018ab22a0a050841a30
302036004bcf10000000000000fe0050
59363534003135345750310a000000fe
00102830385880b8ff02010a2020001b

Extracted contents:
header:          00 ff ff ff ff ff ff 00
serial number:   32 0c 00 c4 00 00 00 00 00 10
version:         01 03
basic params:    80 21 15 78 0a
chroma info:     e9 d5 99 59 53 8e 28 26 50 54
established:     00 00 00
standard:        01 01 01 01 01 01 01 01 01 01 01 01 01 01 01 01
descriptor 1:    ab 22 a0 a0 50 84 1a 30 30 20 36 00 4b cf 10 00 00 18
descriptor 2:    ab 22 a0 a0 50 84 1a 30 30 20 36 00 4b cf 10 00 00 00
descriptor 3:    00 00 00 fe 00 50 59 36 35 34 00 31 35 34 57 50 31 0a
descriptor 4:    00 00 00 fe 00 10 28 30 38 58 80 b8 ff 02 01 0a 20 20
extensions:      00
checksum:        1b

EDID version: 1.3
Manufacturer: LPL Model c400 Serial Number --
Made in year 2006
Digital display
Maximum image size: 33 cm x 21 cm
Gamma: 2.20
RGB color display
First detailed timing is preferred timing
Display x,y Chromaticity:
  Red:   0.6005, 0.3496
  Green: 0.3261, 0.5556
  Blue:  0.1591, 0.1494
  White: 0.3134, 0.3291
Established timings supported:
Standard timings supported:
Detailed mode: Clock 88.750 MHz, 331 mm x 207 mm
               1440 1488 1520 1600 hborder 0
                900  903  909  926 vborder 0
               -hsync -vsync 
               VertFreq: 59 Hz, HorFreq: 55468 Hz
Detailed mode: Clock 88.750 MHz, 331 mm x 207 mm
               1440 1488 1520 1600 hborder 0
                900  903  909  926 vborder 0
               -hsync -vsync analog composite 
               VertFreq: 59 Hz, HorFreq: 55468 Hz
ASCII string: PY654
ASCII string: 
Checksum: 0x1b (valid)
EDID block does NOT conform to EDID 1.3!
	Missing name descriptor
	Missing monitor ranges
	Detailed block string not properly terminated
