
EDID (hex):
00ffffffffffff0030e49f0300000000
00160103802313780a05f59458569228
1e505400000001010101010101010101
010101010101121b567050000e302020
240059c2100000190000000000000000
00000000000000000000000000fe004c
4720446973706c61790a2020000000fe
004c503135365748332d544c533100e3

Extracted contents:
header:          00 ff ff ff ff ff ff 00
serial number:   30 e4 9f 03 00 00 00 00 00 16
version:         01 03
basic params:    80 23 13 78 0a
chroma info:     05 f5 94 58 56 92 28 1e 50 54
established:     00 00 00
standard:        01 01 01 01 01 01 01 01 01 01 01 01 01 01 01 01
descriptor 1:    12 1b 56 70 50 00 0e 30 20 20 24 00 59 c2 10 00 00 19
descriptor 2:    00 00 00 00 00 00 00 00 00 00 00 00 00 00 00 00 00 00
descriptor 3:    00 00 00 fe 00 4c 47 20 44 69 73 70 6c 61 79 0a 20 20
descriptor 4:    00 00 00 fe 00 4c 50 31 35 36 57 48 33 2d 54 4c 53 31
extensions:      00
checksum:        e3

Manufacturer: LGD Model 39f Serial Number --
Made week 0 of 2012
EDID version: 1.3
Digital display
Maximum image size: 35 cm x 19 cm
Gamma: 2.20
Supported color formats: RGB 4:4:4, YCrCb 4:2:2
First detailed timing is preferred timing
Established timings supported:
Standard timings supported:
Detailed mode: Clock 69.300 MHz, 345 mm x 194 mm
               1366 1398 1430 1478 hborder 0
                768  770  774  782 vborder 0
               -hsync -vsync 
Manufacturer-specified data, tag 0
ASCII string: LG
ASCII string: LP156WH3
Checksum: 0xe3 (valid)
EDID block does NOT conform to EDID 1.3!
	Missing name descriptor
	Missing monitor ranges
	Detailed block string not properly terminated
