
EDID (hex):
00ffffffffffff0005e3002263c30000
29140103802f1a782e3585a656489a24
1250542f6f00714f8180818a9500950f
b300d1c00101023a801871382d40582c
4500dc0c1100001e000000ff00533937
41414841313530303139000000fd0032
4b1e5315000a202020202020000000fc
004632320a2020202020202020200169
02031b61230907078301000067030c00
2000802d43908402e2000f8c0ad08a20
e02d10103e9600a05a00000000000000
00000000000000000000000000000000
00000000000000000000000000000000
00000000000000000000000000000000
00000000000000000000000000000000
00000000000000000000000000000029

Extracted contents:
header:          00 ff ff ff ff ff ff 00
serial number:   05 e3 00 22 63 c3 00 00 29 14
version:         01 03
basic params:    80 2f 1a 78 2e
chroma info:     35 85 a6 56 48 9a 24 12 50 54
established:     2f 6f 00
standard:        71 4f 81 80 81 8a 95 00 95 0f b3 00 d1 c0 01 01
descriptor 1:    02 3a 80 18 71 38 2d 40 58 2c 45 00 dc 0c 11 00 00 1e
descriptor 2:    00 00 00 ff 00 53 39 37 41 41 48 41 31 35 30 30 31 39
descriptor 3:    00 00 00 fd 00 32 4b 1e 53 15 00 0a 20 20 20 20 20 20
descriptor 4:    00 00 00 fc 00 46 32 32 0a 20 20 20 20 20 20 20 20 20
extensions:      01
checksum:        69

Manufacturer: AOC Model 2200 Serial Number --
Made week 41 of 2010
EDID version: 1.3
Digital display
Maximum image size: 47 cm x 26 cm
Gamma: 2.20
DPMS levels: Off
Supported color formats: RGB 4:4:4, YCrCb 4:2:2
Default (sRGB) color space is primary color space
First detailed timing is preferred timing
Established timings supported:
  640x480@60Hz
  640x480@72Hz
  640x480@75Hz
  800x600@56Hz
  800x600@60Hz
  800x600@75Hz
  832x624@75Hz
  1024x768@60Hz
  1024x768@70Hz
  1024x768@75Hz
  1280x1024@75Hz
Standard timings supported:
  1152x864@75Hz
  1280x1024@60Hz
  1280x1024@70Hz
  1440x900@60Hz
  1440x900@75Hz
  1680x1050@60Hz
  1920x1080@60Hz
Detailed mode: Clock 148.500 MHz, 476 mm x 268 mm
               1920 2008 2052 2200 hborder 0
               1080 1084 1089 1125 vborder 0
               +hsync +vsync 
Serial number: --
Monitor ranges (GTF): 50-75Hz V, 30-83kHz H, max dotclock 210MHz
Monitor name: F22
Has 1 extension blocks
Checksum: 0x69 (valid)

CEA extension block
Extension version: 3
23 bytes of CEA data
  Audio data block
    Linear PCM, max channels 1
    Supported sample rates (kHz): 48 44.1 32
    Supported sample sizes (bits): 24 20 16
  Speaker allocation data block
  Vendor-specific data block, OUI 000c03 (HDMI)
    Source physical address 2.0.0.0
    Supports_AI
    Maximum TMDS clock: 225MHz
  Video data block
    VIC 16 1920x1080@60Hz (native)
    VIC 04 1280x720@60Hz (native)
    VIC 02 720x480@60Hz 
  Extended tag: video capability data block
    YCbCr quantization: No Data (0)
    RGB quantization: No Data (0)
    PT scan behaviour: No Data (0)
    IT scan behaviour: Support both over- and underscan (3)
    CE scan behaviour: Support both over- and underscan (3)
Basic audio support
Supports YCbCr 4:4:4
1 native detailed modes
Detailed mode: Clock 27.000 MHz, 160 mm x 90 mm
                720  736  798  858 hborder 0
                480  489  495  525 vborder 0
               -hsync -vsync analog composite 
Checksum: 0x29 (valid)
