
EDID (hex):
00ffffffffffff000daee81500000000
211a0104a5221378022675a656509927
0c505400000001010101010101010101
010101010101b43b804a713834405036
680058c110000018000000fe004e3135
364843452d454e310a20000000fe0043
4d4e0a202020202020202020000000fe
004e3135364843452d454e310a2000a2

Extracted contents:
header:          00 ff ff ff ff ff ff 00
serial number:   0d ae e8 15 00 00 00 00 21 1a
version:         01 04
basic params:    a5 22 13 78 02
chroma info:     26 75 a6 56 50 99 27 0c 50 54
established:     00 00 00
standard:        01 01 01 01 01 01 01 01 01 01 01 01 01 01 01 01
descriptor 1:    b4 3b 80 4a 71 38 34 40 50 36 68 00 58 c1 10 00 00 18
descriptor 2:    00 00 00 fe 00 4e 31 35 36 48 43 45 2d 45 4e 31 0a 20
descriptor 3:    00 00 00 fe 00 43 4d 4e 0a 20 20 20 20 20 20 20 20 20
descriptor 4:    00 00 00 fe 00 4e 31 35 36 48 43 45 2d 45 4e 31 0a 20
extensions:      00
checksum:        a2

Manufacturer: CMN Model 15e8 Serial Number --
Made week 33 of 2016
EDID version: 1.4
Digital display
8 bits per primary color channel
DisplayPort interface
Maximum image size: 34 cm x 19 cm
Gamma: 2.20
Supported color formats: RGB 4:4:4
First detailed timing is preferred timing
Established timings supported:
Standard timings supported:
Detailed mode: Clock 152.840 MHz, 344 mm x 193 mm
               1920 2000 2054 2250 hborder 0
               1080 1086 1094 1132 vborder 0
               -hsync -vsync 
ASCII string: N156HCE
ASCII string: CMN
ASCII string: N156HCE
Checksum: 0xa2 (valid)
EDID block does NOT conform to EDID 1.3!
	Missing name descriptor
	Missing monitor ranges
	Detailed block string not properly terminated
