
EDID (hex):
00ffffffffffff001ab3c20800000000
321e0103683420782a0a05a6544c9f26
0f5054a54b00b300950081c0a9c0d1c0
818001010101283c80a070b023403020
360006442100001a000000ff00595644
483330393536340a2020000000fc0042
32342d392057450a20202020000000fd
00304c1e5210000a2020202020200094

edid-decode (hex):

00 ff ff ff ff ff ff 00 1a b3 c2 08 00 00 00 00
32 1e 01 03 68 34 20 78 2a 0a 05 a6 54 4c 9f 26
0f 50 54 a5 4b 00 b3 00 95 00 81 c0 a9 c0 d1 c0
81 80 01 01 01 01 28 3c 80 a0 70 b0 23 40 30 20
36 00 06 44 21 00 00 1a 00 00 00 ff 00 59 56 44
48 33 30 39 35 36 34 0a 20 20 00 00 00 fc 00 42
32 34 2d 39 20 57 45 0a 20 20 20 20 00 00 00 fd
00 30 4c 1e 52 10 00 0a 20 20 20 20 20 20 00 94

----------------

Block 0, Base EDID:
  EDID Structure Version & Revision: 1.3
  Vendor & Product Identification:
    Manufacturer: FUS
    Model: 2242
    Made in: week 50 of 2020
  Basic Display Parameters & Features:
    Analog display
    Signal Level Standard: 0.700 : 0.000 : 0.700 V p-p
    Blank level equals black level
    Sync: Separate
    Maximum image size: 52 cm x 32 cm
    Gamma: 2.20
    DPMS levels: Off
    RGB color display
    First detailed timing is the preferred timing
  Color Characteristics:
    Red  : 0.6484, 0.3281
    Green: 0.2988, 0.6230
    Blue : 0.1484, 0.0585
    White: 0.3134, 0.3291
  Established Timings I & II:
    IBM     :   720x400    70.081663 Hz   9:5     31.467 kHz     28.320000 MHz
    DMT 0x04:   640x480    59.940476 Hz   4:3     31.469 kHz     25.175000 MHz
    DMT 0x06:   640x480    75.000000 Hz   4:3     37.500 kHz     31.500000 MHz
    DMT 0x09:   800x600    60.316541 Hz   4:3     37.879 kHz     40.000000 MHz
    DMT 0x0b:   800x600    75.000000 Hz   4:3     46.875 kHz     49.500000 MHz
    DMT 0x10:  1024x768    60.003840 Hz   4:3     48.363 kHz     65.000000 MHz
    DMT 0x12:  1024x768    75.028582 Hz   4:3     60.023 kHz     78.750000 MHz
    DMT 0x24:  1280x1024   75.024675 Hz   5:4     79.976 kHz    135.000000 MHz
  Standard Timings:
    DMT 0x3a:  1680x1050   59.954250 Hz  16:10    65.290 kHz    146.250000 MHz
    DMT 0x2f:  1440x900    59.887445 Hz  16:10    55.935 kHz    106.500000 MHz
    DMT 0x55:  1280x720    60.000000 Hz  16:9     45.000 kHz     74.250000 MHz
    DMT 0x53:  1600x900    60.000000 Hz  16:9     60.000 kHz    108.000000 MHz (RB)
    DMT 0x52:  1920x1080   60.000000 Hz  16:9     67.500 kHz    148.500000 MHz
    DMT 0x23:  1280x1024   60.019740 Hz   5:4     63.981 kHz    108.000000 MHz
  Detailed Timing Descriptors:
    DTD 1:  1920x1200   59.950171 Hz  16:10    74.038 kHz    154.000000 MHz (518 mm x 324 mm)
                 Hfront   48 Hsync  32 Hback   80 Hpol P
                 Vfront    3 Vsync   6 Vback   26 Vpol N
    Display Product Serial Number: 'YVDH309564'
    Display Product Name: 'B24-9 WE'
    Display Range Limits:
      Monitor ranges (GTF): 48-76 Hz V, 30-82 kHz H, max dotclock 160 MHz
Checksum: 0x94
