
EDID (hex):
00ffffffffffff0010ac0f5155353930
040a01020e211896eb0cc9a057479b27
12484ca4430061594559a94031590101
010101010101c31e0020410020301060
130038ea1000001e000000ff00363237
315230314a303935550a000000fc0044
454c4c20503738300a202020000000fd
0030781e55ff000a2020202020200044

Extracted contents:
header:          00 ff ff ff ff ff ff 00
serial number:   10 ac 0f 51 55 35 39 30 04 0a
version:         01 02
basic params:    0e 21 18 96 eb
chroma info:     0c c9 a0 57 47 9b 27 12 48 4c
established:     a4 43 00
standard:        61 59 45 59 a9 40 31 59 01 01 01 01 01 01 01 01
descriptor 1:    c3 1e 00 20 41 00 20 30 10 60 13 00 38 ea 10 00 00 1e
descriptor 2:    00 00 00 ff 00 36 32 37 31 52 30 31 4a 30 39 35 55 0a
descriptor 3:    00 00 00 fc 00 44 45 4c 4c 20 50 37 38 30 0a 20 20 20
descriptor 4:    00 00 00 fd 00 30 78 1e 55 ff 00 0a 20 20 20 20 20 20
extensions:      00
checksum:        44

EDID version: 1.2
Manufacturer: DEL Model 510f Serial Number --
Analog display, Input voltage level: 0.7/0.3 V
Sync: Separate Composite SyncOnGreen 
Maximum image size: 33 cm x 24 cm
Gamma: 2.50
DPMS levels: Standby Suspend Off
RGB color display
First detailed timing is preferred timing
Supports GTF timings within operating range
Display x,y Chromaticity:
  Red:   0.6250, 0.3398
  Green: 0.2802, 0.6054
  Blue:  0.1552, 0.0703
  White: 0.2832, 0.2978
Established timings supported:
  720x400@70Hz 9:5 HorFreq: 31469 Hz Clock: 28.320 MHz
  640x480@60Hz 4:3 HorFreq: 31469 Hz Clock: 25.175 MHz
  640x480@75Hz 4:3 HorFreq: 37500 Hz Clock: 31.500 MHz
  800x600@75Hz 4:3 HorFreq: 46900 Hz Clock: 49.500 MHz
  1024x768@75Hz 4:3 HorFreq: 60000 Hz Clock: 78.750 MHz
  1280x1024@75Hz 5:4 HorFreq: 80000 Hz Clock: 135.000 MHz
Standard timings supported:
  1024x768@85Hz 4:3 HorFreq: 68700 Hz Clock: 94.500 MHz
  800x600@85Hz 4:3 HorFreq: 53700 Hz Clock: 56.250 MHz
  1600x1200@60Hz 4:3 HorFreq: 75000 Hz Clock: 162.000 MHz
  640x480@85Hz 4:3 HorFreq: 43300 Hz Clock: 36.000 MHz
Detailed mode: Clock 78.750 MHz, 312 mm x 234 mm
               1024 1040 1136 1312 hborder 0
                768  769  772  800 vborder 0
               +hsync +vsync 
               VertFreq: 75 Hz, HorFreq: 60022 Hz
Serial number: --
Monitor name: DELL P780
Monitor ranges (GTF): 48-120Hz V, 30-85kHz H, max dotclock 2550MHz
Checksum: 0x44 (valid)
EDID block does not conform at all!
	Bad year of manufacture
