
EDID (hex):
00ffffffffffff0030e47e0500000000
001a010495221378eadc95a35855a026
0d505400000001010101010101010101
0101010101012e3680a070381f403020
350058c21000001a2e3680a070381f40
3020350058c21000001a000000000000
00000000000000000000000000000002
000833ff0a3c961e163696000000001c

Extracted contents:
header:          00 ff ff ff ff ff ff 00
serial number:   30 e4 7e 05 00 00 00 00 00 1a
version:         01 04
basic params:    95 22 13 78 ea
chroma info:     dc 95 a3 58 55 a0 26 0d 50 54
established:     00 00 00
standard:        01 01 01 01 01 01 01 01 01 01 01 01 01 01 01 01
descriptor 1:    2e 36 80 a0 70 38 1f 40 30 20 35 00 58 c2 10 00 00 1a
descriptor 2:    2e 36 80 a0 70 38 1f 40 30 20 35 00 58 c2 10 00 00 1a
descriptor 3:    00 00 00 00 00 00 00 00 00 00 00 00 00 00 00 00 00 00
descriptor 4:    00 00 00 02 00 08 33 ff 0a 3c 96 1e 16 36 96 00 00 00
extensions:      00
checksum:        1c

Manufacturer: LGD Model 57e Serial Number --
Made week 0 of 2016
EDID version: 1.4
Digital display
6 bits per primary color channel
DisplayPort interface
Maximum image size: 34 cm x 19 cm
Gamma: 2.20
DPMS levels: Standby Suspend Off
Supported color formats: RGB 4:4:4, YCrCb 4:2:2
First detailed timing is preferred timing
Established timings supported:
Standard timings supported:
Detailed mode: Clock 138.700 MHz, 344 mm x 194 mm
               1920 1968 2000 2080 hborder 0
               1080 1083 1088 1111 vborder 0
               +hsync -vsync 
Detailed mode: Clock 138.700 MHz, 344 mm x 194 mm
               1920 1968 2000 2080 hborder 0
               1080 1083 1088 1111 vborder 0
               +hsync -vsync 
Manufacturer-specified data, tag 0
Manufacturer-specified data, tag 2
Checksum: 0x1c (valid)
EDID block does NOT conform to EDID 1.3!
	Missing name descriptor
	Missing monitor ranges
