
EDID (hex):
00ffffffffffff0030ae574000000000
0013010380211578eaba959759558c27
21505400000001010101010101010101
010101010101121b0080502014301820
44004bcf100000199416008050201430
182044004bcf100000190000000f0081
0a32810a2814090030e4c601000000fe
004c503135345758372d544c503100aa

edid-decode (hex):

00 ff ff ff ff ff ff 00 30 ae 57 40 00 00 00 00
00 13 01 03 80 21 15 78 ea ba 95 97 59 55 8c 27
21 50 54 00 00 00 01 01 01 01 01 01 01 01 01 01
01 01 01 01 01 01 12 1b 00 80 50 20 14 30 18 20
44 00 4b cf 10 00 00 19 94 16 00 80 50 20 14 30
18 20 44 00 4b cf 10 00 00 19 00 00 00 0f 00 81
0a 32 81 0a 28 14 09 00 30 e4 c6 01 00 00 00 fe
00 4c 50 31 35 34 57 58 37 2d 54 4c 50 31 00 aa

----------------

Block 0, Base EDID:
  EDID Structure Version & Revision: 1.3
  Vendor & Product Identification:
    Manufacturer: LEN
    Model: 16471
    Made in: 2009
  Basic Display Parameters & Features:
    Digital display
    Maximum image size: 33 cm x 21 cm
    Gamma: 2.20
    DPMS levels: Standby Suspend Off
    RGB color display
    First detailed timing is the preferred timing
  Color Characteristics:
    Red  : 0.5917, 0.3505
    Green: 0.3339, 0.5488
    Blue : 0.1542, 0.1298
    White: 0.3134, 0.3291
  Established Timings I & II: none
  Standard Timings: none
  Detailed Timing Descriptors:
    DTD 1:  1280x800    60.022866 Hz  16:10    49.219 kHz     69.300000 MHz (331 mm x 207 mm)
                 Hfront   24 Hsync  32 Hback   72 Hpol N
                 Vfront    4 Vsync   4 Vback   12 Vpol N
    DTD 2:  1280x800    50.062361 Hz  16:10    41.051 kHz     57.800000 MHz (331 mm x 207 mm)
                 Hfront   24 Hsync  32 Hback   72 Hpol N
                 Vfront    4 Vsync   4 Vback   12 Vpol N
    Manufacturer-Specified Display Descriptor (0x0f): 00 0f 00 81 0a 32 81 0a 28 14 09 00 30 e4 c6 01 '.....2..(...0...'
    Alphanumeric Data String: 'LP154WX7-TLP1'
Checksum: 0xaa
