
EDID (hex):
00ffffffffffff0038a3626601010101
1b10010380261e78eacb05a3584c9b25
135054bfef80714f8140818001010101
010101010101302a009851002a403070
1300782d1100001e000000fd00384b1f
510e000a202020202020000000fc004c
4344313937304e580a202020000000ff
00363741333336303059420a20200088

Extracted contents:
header:          00 ff ff ff ff ff ff 00
serial number:   38 a3 62 66 01 01 01 01 1b 10
version:         01 03
basic params:    80 26 1e 78 ea
chroma info:     cb 05 a3 58 4c 9b 25 13 50 54
established:     bf ef 80
standard:        71 4f 81 40 81 80 01 01 01 01 01 01 01 01 01 01
descriptor 1:    30 2a 00 98 51 00 2a 40 30 70 13 00 78 2d 11 00 00 1e
descriptor 2:    00 00 00 fd 00 38 4b 1f 51 0e 00 0a 20 20 20 20 20 20
descriptor 3:    00 00 00 fc 00 4c 43 44 31 39 37 30 4e 58 0a 20 20 20
descriptor 4:    00 00 00 ff 00 36 37 41 33 33 36 30 30 59 42 0a 20 20
extensions:      00
checksum:        88

Manufacturer: NEC Model 6662 Serial Number --
Made week 27 of 2006
EDID version: 1.3
Digital display
Maximum image size: 38 cm x 30 cm
Gamma: 2.20
DPMS levels: Standby Suspend Off
Supported color formats: RGB 4:4:4, YCrCb 4:2:2
First detailed timing is preferred timing
Established timings supported:
  720x400@70Hz
  640x480@60Hz
  640x480@67Hz
  640x480@72Hz
  640x480@75Hz
  800x600@56Hz
  800x600@60Hz
  800x600@72Hz
  800x600@75Hz
  832x624@75Hz
  1024x768@60Hz
  1024x768@70Hz
  1024x768@75Hz
  1280x1024@75Hz
  1152x870@75Hz
Standard timings supported:
  1152x864@75Hz
  1280x960@60Hz
  1280x1024@60Hz
Detailed mode: Clock 108.000 MHz, 376 mm x 301 mm
               1280 1328 1440 1688 hborder 0
               1024 1025 1028 1066 vborder 0
               +hsync +vsync 
Monitor ranges (GTF): 56-75Hz V, 31-81kHz H, max dotclock 140MHz
Monitor name: LCD1970NX
Serial number: --
Checksum: 0x88 (valid)
