
EDID (hex):
00ffffffffffff002a59802345540000
2b1b0104b5341f783f7690a8544d9f25
0e5054b94b00d1c081c081008180a9c0
b3000101010141cf0080f07020803020
3500c48f2100001a04740030f2705a80
b0588a006ee53100001a000000fd0030
41a0a03c010a202020202020000000fc
005548442044500a2020202020200138
020324f1519005040302011112131406
0715161f65662309070765030c002000
83010000023a801871382d40582c4500
c48f2100001e011d8018711c1620582c
2500c48f2100009e011d007251d01e20
6e285500c48f2100001e8c0ad08a20e0
2d10103e9600c48f21000018565e00a0
a0a0295030203500c48f2100001a0096

edid-decode (hex):

00 ff ff ff ff ff ff 00 2a 59 80 23 45 54 00 00
2b 1b 01 04 b5 34 1f 78 3f 76 90 a8 54 4d 9f 25
0e 50 54 b9 4b 00 d1 c0 81 c0 81 00 81 80 a9 c0
b3 00 01 01 01 01 41 cf 00 80 f0 70 20 80 30 20
35 00 c4 8f 21 00 00 1a 04 74 00 30 f2 70 5a 80
b0 58 8a 00 6e e5 31 00 00 1a 00 00 00 fd 00 30
41 a0 a0 3c 01 0a 20 20 20 20 20 20 00 00 00 fc
00 55 48 44 20 44 50 0a 20 20 20 20 20 20 01 38

02 03 24 f1 51 90 05 04 03 02 01 11 12 13 14 06
07 15 16 1f 65 66 23 09 07 07 65 03 0c 00 20 00
83 01 00 00 02 3a 80 18 71 38 2d 40 58 2c 45 00
c4 8f 21 00 00 1e 01 1d 80 18 71 1c 16 20 58 2c
25 00 c4 8f 21 00 00 9e 01 1d 00 72 51 d0 1e 20
6e 28 55 00 c4 8f 21 00 00 1e 8c 0a d0 8a 20 e0
2d 10 10 3e 96 00 c4 8f 21 00 00 18 56 5e 00 a0
a0 a0 29 50 30 20 35 00 c4 8f 21 00 00 1a 00 96

----------------

Block 0, Base EDID:
  EDID Structure Version & Revision: 1.4
  Vendor & Product Identification:
    Manufacturer: JRY
    Model: 9088
    Serial Number: 21573
    Made in: week 43 of 2017
  Basic Display Parameters & Features:
    Digital display
    Bits per primary color channel: 10
    DisplayPort interface
    Maximum image size: 52 cm x 31 cm
    Gamma: 2.20
    DPMS levels: Off
    Supported color formats: RGB 4:4:4, YCrCb 4:4:4, YCrCb 4:2:2
    Default (sRGB) color space is primary color space
    First detailed timing includes the native pixel format and preferred refresh rate
    Display is continuous frequency
  Color Characteristics:
    Red  : 0.6572, 0.3310
    Green: 0.3017, 0.6230
    Blue : 0.1464, 0.0556
    White: 0.3125, 0.3281
  Established Timings I & II:
    IBM     :   720x400    70.081663 Hz   9:5     31.467 kHz     28.320000 MHz
    DMT 0x04:   640x480    59.940476 Hz   4:3     31.469 kHz     25.175000 MHz
    Apple   :   640x480    66.666667 Hz   4:3     35.000 kHz     30.240000 MHz
    DMT 0x05:   640x480    72.808802 Hz   4:3     37.861 kHz     31.500000 MHz
    DMT 0x09:   800x600    60.316541 Hz   4:3     37.879 kHz     40.000000 MHz
    DMT 0x0b:   800x600    75.000000 Hz   4:3     46.875 kHz     49.500000 MHz
    DMT 0x10:  1024x768    60.003840 Hz   4:3     48.363 kHz     65.000000 MHz
    DMT 0x12:  1024x768    75.028582 Hz   4:3     60.023 kHz     78.750000 MHz
    DMT 0x24:  1280x1024   75.024675 Hz   5:4     79.976 kHz    135.000000 MHz
  Standard Timings:
    DMT 0x52:  1920x1080   60.000000 Hz  16:9     67.500 kHz    148.500000 MHz
    DMT 0x55:  1280x720    60.000000 Hz  16:9     45.000 kHz     74.250000 MHz
    DMT 0x1c:  1280x800    59.810326 Hz  16:10    49.702 kHz     83.500000 MHz
    DMT 0x23:  1280x1024   60.019740 Hz   5:4     63.981 kHz    108.000000 MHz
    DMT 0x53:  1600x900    60.000000 Hz  16:9     60.000 kHz    108.000000 MHz (RB)
    DMT 0x3a:  1680x1050   59.954250 Hz  16:10    65.290 kHz    146.250000 MHz
  Detailed Timing Descriptors:
    DTD 1:  3840x2160   61.000090 Hz  16:9    133.712 kHz    530.570000 MHz (708 mm x 399 mm)
                 Hfront   48 Hsync  32 Hback   48 Hpol P
                 Vfront    3 Vsync   5 Vback   24 Vpol N
    DTD 2:  3840x2160   30.000000 Hz  16:9     67.500 kHz    297.000000 MHz (878 mm x 485 mm)
                 Hfront  176 Hsync  88 Hback  296 Hpol P
                 Vfront    8 Vsync  10 Vback   72 Vpol N
    Display Range Limits:
      Monitor ranges (Bare Limits): 48-65 Hz V, 160-160 kHz H, max dotclock 600 MHz
    Display Product Name: 'UHD DP'
  Extension blocks: 1
Checksum: 0x38

----------------

Block 1, CTA-861 Extension Block:
  Revision: 3
  Underscans IT Video Formats by default
  Basic audio support
  Supports YCbCr 4:4:4
  Supports YCbCr 4:2:2
  Native detailed modes: 1
  Video Data Block:
    VIC  16:  1920x1080   60.000000 Hz  16:9     67.500 kHz    148.500000 MHz (native)
    VIC   5:  1920x1080i  60.000000 Hz  16:9     33.750 kHz     74.250000 MHz
    VIC   4:  1280x720    60.000000 Hz  16:9     45.000 kHz     74.250000 MHz
    VIC   3:   720x480    59.940060 Hz  16:9     31.469 kHz     27.000000 MHz
    VIC   2:   720x480    59.940060 Hz   4:3     31.469 kHz     27.000000 MHz
    VIC   1:   640x480    59.940476 Hz   4:3     31.469 kHz     25.175000 MHz
    VIC  17:   720x576    50.000000 Hz   4:3     31.250 kHz     27.000000 MHz
    VIC  18:   720x576    50.000000 Hz  16:9     31.250 kHz     27.000000 MHz
    VIC  19:  1280x720    50.000000 Hz  16:9     37.500 kHz     74.250000 MHz
    VIC  20:  1920x1080i  50.000000 Hz  16:9     28.125 kHz     74.250000 MHz
    VIC   6:  1440x480i   59.940060 Hz   4:3     15.734 kHz     27.000000 MHz
    VIC   7:  1440x480i   59.940060 Hz  16:9     15.734 kHz     27.000000 MHz
    VIC  21:  1440x576i   50.000000 Hz   4:3     15.625 kHz     27.000000 MHz
    VIC  22:  1440x576i   50.000000 Hz  16:9     15.625 kHz     27.000000 MHz
    VIC  31:  1920x1080   50.000000 Hz  16:9     56.250 kHz    148.500000 MHz
    VIC 101:  4096x2160   50.000000 Hz 256:135  112.500 kHz    594.000000 MHz
    VIC 102:  4096x2160   60.000000 Hz 256:135  135.000 kHz    594.000000 MHz
  Audio Data Block:
    Linear PCM:
      Max channels: 2
      Supported sample rates (kHz): 48 44.1 32
      Supported sample sizes (bits): 24 20 16
  Vendor-Specific Data Block (HDMI), OUI 00-0C-03:
    Source physical address: 2.0.0.0
  Speaker Allocation Data Block:
    FL/FR - Front Left/Right
  Detailed Timing Descriptors:
    DTD 3:  1920x1080   60.000000 Hz  16:9     67.500 kHz    148.500000 MHz (708 mm x 399 mm)
                 Hfront   88 Hsync  44 Hback  148 Hpol P
                 Vfront    4 Vsync   5 Vback   36 Vpol P
    DTD 4:  1920x1080i  60.000000 Hz  16:9     33.750 kHz     74.250000 MHz (708 mm x 399 mm)
                 Hfront   88 Hsync  44 Hback  148 Hpol P
                 Vfront    2 Vsync   5 Vback   15 Vpol P Vfront +0.5 Odd Field
                 Vfront    2 Vsync   5 Vback   15 Vpol P Vback  +0.5 Even Field
    DTD 5:  1280x720    60.000000 Hz  16:9     45.000 kHz     74.250000 MHz (708 mm x 399 mm)
                 Hfront  110 Hsync  40 Hback  220 Hpol P
                 Vfront    5 Vsync   5 Vback   20 Vpol P
    DTD 6:   720x480    59.940060 Hz   3:2     31.469 kHz     27.000000 MHz (708 mm x 399 mm)
                 Hfront   16 Hsync  62 Hback   60 Hpol N
                 Vfront    9 Vsync   6 Vback   30 Vpol N
    DTD 7:  2560x1440   59.950550 Hz  16:9     88.787 kHz    241.500000 MHz (708 mm x 399 mm)
                 Hfront   48 Hsync  32 Hback   80 Hpol P
                 Vfront    3 Vsync   5 Vback   33 Vpol N
Checksum: 0x96  Unused space in Extension Block: 1 byte
