
EDID (hex):
00ffffffffffff002889310001000000
16200104805932780a0dc9a057479827
12484c00000001010101010101010101
01010101010108700088a1401360c820
a300d9870000001ead4a0088a1401360
c820a30020c23100001e000000fd0016
480f5a1e000a202020202020000000fc
0047504431303031480a2020202000cf

edid-decode (hex):

00 ff ff ff ff ff ff 00 28 89 31 00 01 00 00 00
16 20 01 04 80 59 32 78 0a 0d c9 a0 57 47 98 27
12 48 4c 00 00 00 01 01 01 01 01 01 01 01 01 01
01 01 01 01 01 01 08 70 00 88 a1 40 13 60 c8 20
a3 00 d9 87 00 00 00 1e ad 4a 00 88 a1 40 13 60
c8 20 a3 00 20 c2 31 00 00 1e 00 00 00 fd 00 16
48 0f 5a 1e 00 0a 20 20 20 20 20 20 00 00 00 fc
00 47 50 44 31 30 30 31 48 0a 20 20 20 20 00 cf

----------------

Block 0, Base EDID:
  EDID Structure Version & Revision: 1.4
  Vendor & Product Identification:
    Manufacturer: JDI
    Model: 49
    Serial Number: 1
    Made in: week 22 of 2022
  Basic Display Parameters & Features:
    Digital display
    Color depth is undefined
    Digital interface is not defined
    Maximum image size: 89 cm x 50 cm
    Gamma: 2.20
    Supported color formats: RGB 4:4:4, YCrCb 4:4:4
    First detailed timing includes the native pixel format and preferred refresh rate
  Color Characteristics:
    Red  : 0.6250, 0.3398
    Green: 0.2802, 0.5947
    Blue : 0.1552, 0.0703
    White: 0.2832, 0.2978
  Established Timings I & II: none
  Standard Timings: none
  Detailed Timing Descriptors:
    DTD 1:  2560x1600   60.008939 Hz  16:10    97.154 kHz    286.800000 MHz (217 mm x 135 mm)
                 Hfront  200 Hsync  32 Hback  160 Hpol P
                 Vfront   10 Vsync   3 Vback    6 Vpol P
    DTD 2:  2560x1600   39.999682 Hz  16:10    64.759 kHz    191.170000 MHz (800 mm x 450 mm)
                 Hfront  200 Hsync  32 Hback  160 Hpol P
                 Vfront   10 Vsync   3 Vback    6 Vpol P
    Display Range Limits:
      Monitor ranges (GTF): 22-72 Hz V, 15-90 kHz H, max dotclock 300 MHz
    Display Product Name: 'GPD1001H'
Checksum: 0xcf
