
EDID (hex):
00ffffffffffff0009e5d30700000000
011c0104a51f117803e7b0955c5a9229
1d505400000001010101010101010101
0101010101018a398010713828403020
360035ae1000001a0000000000000000
00000000000000000000000000fe0042
4f452043510a202020202020000000fe
004e5431343046484d2d4e34330a0019

edid-decode (hex):

00 ff ff ff ff ff ff 00 09 e5 d3 07 00 00 00 00
01 1c 01 04 a5 1f 11 78 03 e7 b0 95 5c 5a 92 29
1d 50 54 00 00 00 01 01 01 01 01 01 01 01 01 01
01 01 01 01 01 01 8a 39 80 10 71 38 28 40 30 20
36 00 35 ae 10 00 00 1a 00 00 00 00 00 00 00 00
00 00 00 00 00 00 00 00 00 00 00 00 00 fe 00 42
4f 45 20 43 51 0a 20 20 20 20 20 20 00 00 00 fe
00 4e 54 31 34 30 46 48 4d 2d 4e 34 33 0a 00 19

----------------

Block 0, Base EDID:
  EDID Structure Version & Revision: 1.4
  Vendor & Product Identification:
    Manufacturer: BOE
    Model: 2003
    Made in: week 1 of 2018
  Basic Display Parameters & Features:
    Digital display
    Bits per primary color channel: 8
    DisplayPort interface
    Maximum image size: 31 cm x 17 cm
    Gamma: 2.20
    Supported color formats: RGB 4:4:4
    First detailed timing includes the native pixel format and preferred refresh rate
    Display is continuous frequency
  Color Characteristics:
    Red  : 0.5849, 0.3613
    Green: 0.3525, 0.5732
    Blue : 0.1621, 0.1162
    White: 0.3125, 0.3281
  Established Timings I & II: none
  Standard Timings: none
  Detailed Timing Descriptors:
    DTD 1:  1920x1080   59.999022 Hz  16:9     67.199 kHz    147.300000 MHz (309 mm x 174 mm)
                 Hfront   48 Hsync  32 Hback  192 Hpol P
                 Vfront    3 Vsync   6 Vback   31 Vpol N
    Empty Descriptor
    Alphanumeric Data String: 'BOE CQ'
    Alphanumeric Data String: 'NT140FHM-N43'
Checksum: 0x19
