
EDID (hex):
00ffffffffffff0030e4be0500000000
001b0104952615780a0bb5a35955a027
0c505400000001010101010101010101
0101010101012e3680a070381f403020
35007ed71000001a5c2b80a070381f40
302035007ed71000001a000000fe004c
4720446973706c61790a2020000000fe
004c503137335746342d5350463700c0

edid-decode (hex):

00 ff ff ff ff ff ff 00 30 e4 be 05 00 00 00 00
00 1b 01 04 95 26 15 78 0a 0b b5 a3 59 55 a0 27
0c 50 54 00 00 00 01 01 01 01 01 01 01 01 01 01
01 01 01 01 01 01 2e 36 80 a0 70 38 1f 40 30 20
35 00 7e d7 10 00 00 1a 5c 2b 80 a0 70 38 1f 40
30 20 35 00 7e d7 10 00 00 1a 00 00 00 fe 00 4c
47 20 44 69 73 70 6c 61 79 0a 20 20 00 00 00 fe
00 4c 50 31 37 33 57 46 34 2d 53 50 46 37 00 c0

----------------

Block 0, Base EDID:
  EDID Structure Version & Revision: 1.4
  Vendor & Product Identification:
    Manufacturer: LGD
    Model: 1470
    Made in: 2017
  Basic Display Parameters & Features:
    Digital display
    Bits per primary color channel: 6
    DisplayPort interface
    Maximum image size: 38 cm x 21 cm
    Gamma: 2.20
    Supported color formats: RGB 4:4:4, YCrCb 4:4:4
    First detailed timing includes the native pixel format and preferred refresh rate
  Color Characteristics:
    Red  : 0.6367, 0.3476
    Green: 0.3339, 0.6279
    Blue : 0.1542, 0.0498
    White: 0.3134, 0.3291
  Established Timings I & II: none
  Standard Timings: none
  Detailed Timing Descriptors:
    DTD 1:  1920x1080   60.020425 Hz  16:9     66.683 kHz    138.700000 MHz (382 mm x 215 mm)
                 Hfront   48 Hsync  32 Hback   80 Hpol P
                 Vfront    3 Vsync   5 Vback   23 Vpol N
    DTD 2:  1920x1080   48.033650 Hz  16:9     53.365 kHz    111.000000 MHz (382 mm x 215 mm)
                 Hfront   48 Hsync  32 Hback   80 Hpol P
                 Vfront    3 Vsync   5 Vback   23 Vpol N
    Alphanumeric Data String: 'LG Display'
    Alphanumeric Data String: 'LP173WF4-SPF7'
Checksum: 0xc0
