
EDID (hex):
00ffffffffffff0006b3002701010101
0e200104a53c22783bff15a6534a9826
0f5054bf4f00714f818081409500a940
b300d100e1c0565e00a0a0a029503020
350055502100001a000000fd00304b70
701e010a202020202020000000fc0050
4132373851560a2020202020000000ff
004e334c4d51533136343039320a010e
02031af14a900403021112131f051423
09070783010000e2006a0e1f00805100
1e304080370055502100001c9774006e
a0a034501720680855502100001a9e20
009051201f304880360055502100001c
cd4600a0a0381f4030203a0055502100
001a0000000000000000000000000000
0000000000000000000000000000006a

Extracted contents:
header:          00 ff ff ff ff ff ff 00
serial number:   06 b3 00 27 01 01 01 01 0e 20
version:         01 04
basic params:    a5 3c 22 78 3b
chroma info:     ff 15 a6 53 4a 98 26 0f 50 54
established:     bf 4f 00
standard:        71 4f 81 80 81 40 95 00 a9 40 b3 00 d1 00 e1 c0
descriptor 1:    56 5e 00 a0 a0 a0 29 50 30 20 35 00 55 50 21 00 00 1a
descriptor 2:    00 00 00 fd 00 30 4b 70 70 1e 01 0a 20 20 20 20 20 20
descriptor 3:    00 00 00 fc 00 50 41 32 37 38 51 56 0a 20 20 20 20 20
descriptor 4:    00 00 00 ff 00 4e 33 4c 4d 51 53 31 36 34 30 39 32 0a
extensions:      01
checksum:        0e

EDID version: 1.4
Manufacturer: AUS Model 2700 Serial Number --
Made in week 14 of 2022
Digital display
8 bits per primary color channel
DisplayPort interface
Maximum image size: 60 cm x 34 cm
Gamma: 2.20
DPMS levels: Off
Supported color formats: RGB 4:4:4, YCrCb 4:4:4, YCrCb 4:2:2
First detailed timing includes the native pixel format and preferred refresh rate
Display is continuous frequency
Display x,y Chromaticity:
  Red:   0.6513, 0.3271
  Green: 0.2919, 0.5966
  Blue:  0.1484, 0.0595
  White: 0.3134, 0.3291
Established timings supported:
  720x400@70Hz 9:5 HorFreq: 31469 Hz Clock: 28.320 MHz
  640x480@60Hz 4:3 HorFreq: 31469 Hz Clock: 25.175 MHz
  640x480@67Hz 4:3 HorFreq: 35000 Hz Clock: 30.240 MHz
  640x480@72Hz 4:3 HorFreq: 37900 Hz Clock: 31.500 MHz
  640x480@75Hz 4:3 HorFreq: 37500 Hz Clock: 31.500 MHz
  800x600@56Hz 4:3 HorFreq: 35200 Hz Clock: 36.000 MHz
  800x600@60Hz 4:3 HorFreq: 37900 Hz Clock: 40.000 MHz
  800x600@75Hz 4:3 HorFreq: 46900 Hz Clock: 49.500 MHz
  1024x768@60Hz 4:3 HorFreq: 48400 Hz Clock: 65.000 MHz
  1024x768@70Hz 4:3 HorFreq: 56500 Hz Clock: 75.000 MHz
  1024x768@75Hz 4:3 HorFreq: 60000 Hz Clock: 78.750 MHz
  1280x1024@75Hz 5:4 HorFreq: 80000 Hz Clock: 135.000 MHz
Standard timings supported:
  1152x864@75Hz 4:3 HorFreq: 67500 Hz Clock: 108.000 MHz
  1280x1024@60Hz 5:4 HorFreq: 64000 Hz Clock: 108.000 MHz
  1280x960@60Hz 4:3 HorFreq: 60000 Hz Clock: 108.000 MHz
  1440x900@60Hz 16:10 HorFreq: 55500 Hz Clock: 88.750 MHz
  1600x1200@60Hz 4:3 HorFreq: 75000 Hz Clock: 162.000 MHz
  1680x1050@60Hz 16:10 HorFreq: 64700 Hz Clock: 119.000 MHz
  1920x1200@60Hz 16:10 HorFreq: 74000 Hz Clock: 154.000 MHz
  2048x1152@60Hz 16:9
Detailed mode: Clock 241.500 MHz, 597 mm x 336 mm
               2560 2608 2640 2720 hborder 0
               1440 1443 1448 1481 vborder 0
               +hsync -vsync 
               VertFreq: 59 Hz, HorFreq: 88786 Hz
Monitor ranges (bare limits): 48-75Hz V, 112-112kHz H, max dotclock 300MHz
Monitor name: PA278QV
Serial number: --
Has 1 extension blocks
Checksum: 0xe (valid)

CTA extension block
Extension version: 3
22 bytes of CTA data
  Video data block
    VIC  16 1920x1080@60Hz 16:9 (native) HorFreq: 67500 Hz Clock: 148.500 MHz
    VIC   4 1280x720@60Hz 16:9  HorFreq: 45000 Hz Clock: 74.250 MHz
    VIC   3 720x480@60Hz 16:9  HorFreq: 31469 Hz Clock: 27.000 MHz
    VIC   2 720x480@60Hz 4:3  HorFreq: 31469 Hz Clock: 27.000 MHz
    VIC  17 720x576@50Hz 4:3  HorFreq: 31250 Hz Clock: 27.000 MHz
    VIC  18 720x576@50Hz 16:9  HorFreq: 31250 Hz Clock: 27.000 MHz
    VIC  19 1280x720@50Hz 16:9  HorFreq: 37500 Hz Clock: 74.250 MHz
    VIC  31 1920x1080@50Hz 16:9  HorFreq: 56250 Hz Clock: 148.500 MHz
    VIC   5 1920x1080i@60Hz 16:9  HorFreq: 33750 Hz Clock: 74.250 MHz
    VIC  20 1920x1080i@50Hz 16:9  HorFreq: 28125 Hz Clock: 74.250 MHz
  Audio data block
    Linear PCM, max channels 2
      Supported sample rates (kHz): 48 44.1 32
      Supported sample sizes (bits): 24 20 16
  Speaker allocation data block
    Speaker map:
      FL/FR - Front Left/Right
  Extended tag: Video capability data block
    YCbCr quantization: No Data (0)
    RGB quantization: Selectable (via AVI Q) (1)
    PT scan behaviour: Always Underscanned (2)
    IT scan behaviour: Always Underscanned (2)
    CE scan behaviour: Always Underscanned (2)
Underscans PC formats by default
Basic audio support
Supports YCbCr 4:4:4
Supports YCbCr 4:2:2
1 native detailed modes
Detailed mode: Clock 79.500 MHz, 597 mm x 336 mm
               1280 1344 1472 1664 hborder 0
                768  771  778  798 vborder 0
               -hsync +vsync 
               VertFreq: 59 Hz, HorFreq: 47776 Hz
Detailed mode: Clock 298.470 MHz, 597 mm x 336 mm
               2560 2583 2615 2670 hborder 0
               1440 1478 1486 1492 vborder 0
               +hsync -vsync 
               VertFreq: 74 Hz, HorFreq: 111786 Hz
Detailed mode: Clock 83.500 MHz, 597 mm x 336 mm
               1280 1352 1480 1680 hborder 0
                800  803  809  831 vborder 0
               -hsync +vsync 
               VertFreq: 59 Hz, HorFreq: 49702 Hz
Detailed mode: Clock 181.250 MHz, 597 mm x 336 mm
               2560 2608 2640 2720 hborder 0
               1080 1083 1093 1111 vborder 0
               +hsync -vsync 
               VertFreq: 59 Hz, HorFreq: 66636 Hz
Checksum: 0x6a (valid)

Warning: One or more of the timings is out of range of the Monitor Ranges:
  Vertical Freq: 50 - 75 Hz
  Horizontal Freq: 28125 - 111786 Hz
  Maximum Clock: 298.470 MHz
EDID block does not conform at all!
	Both the serial number and the serial string are set


