edid-decode (hex):

00 ff ff ff ff ff ff 00 4c 2d 6c 03 36 32 49 4b
08 12 01 03 80 37 22 a0 2a fe 21 a8 53 37 ae 24
11 50 54 bf ef 80 a9 40 81 80 81 40 71 4f 01 01
01 01 01 01 01 01 28 3c 80 a0 70 b0 23 40 30 20
36 00 26 57 21 00 00 1a 00 00 00 fd 00 32 4b 1b
51 11 00 0a 20 20 20 20 20 20 00 00 00 fc 00 53
79 6e 63 4d 61 73 74 65 72 0a 20 20 00 00 00 ff
00 48 53 38 51 32 30 30 39 35 38 0a 20 20 01 ed

02 01 04 00 02 3a 80 18 71 38 2d 40 58 2c 45 00
26 57 21 00 00 1e 02 3a 80 d0 72 38 2d 40 10 2c
45 80 26 57 21 00 00 1e 01 1d 00 72 51 d0 1e 20
6e 28 55 00 26 57 21 00 00 1e 01 1d 00 bc 52 d0
1e 20 b8 28 55 40 26 57 21 00 00 1e 01 1d 80 18
71 1c 16 20 58 2c 25 00 26 57 21 00 00 9e 01 1d
80 d0 72 1c 16 20 10 2c 25 80 26 57 21 00 00 9e
00 00 00 00 00 00 00 00 00 00 00 00 00 00 00 7c

----------------

Block 0, Base EDID:
  EDID Structure Version & Revision: 1.3
  Vendor & Product Identification:
    Manufacturer: SAM
    Model: 876
    Serial Number: ...
    Made in: week 8 of 2008
  Basic Display Parameters & Features:
    Digital display
    Maximum image size: 55 cm x 34 cm
    Gamma: 2.60
    DPMS levels: Off
    RGB color display
    First detailed timing is the preferred timing
  Color Characteristics:
    Red  : 0.6591, 0.3271
    Green: 0.2177, 0.6816
    Blue : 0.1406, 0.0683
    White: 0.3125, 0.3291
  Established Timings I & II:
    IBM     :   720x400    70.082 Hz   9:5    31.467 kHz  28.320 MHz
    DMT 0x04:   640x480    59.940 Hz   4:3    31.469 kHz  25.175 MHz
    Apple   :   640x480    66.667 Hz   4:3    35.000 kHz  30.240 MHz
    DMT 0x05:   640x480    72.809 Hz   4:3    37.861 kHz  31.500 MHz
    DMT 0x06:   640x480    75.000 Hz   4:3    37.500 kHz  31.500 MHz
    DMT 0x08:   800x600    56.250 Hz   4:3    35.156 kHz  36.000 MHz
    DMT 0x09:   800x600    60.317 Hz   4:3    37.879 kHz  40.000 MHz
    DMT 0x0a:   800x600    72.188 Hz   4:3    48.077 kHz  50.000 MHz
    DMT 0x0b:   800x600    75.000 Hz   4:3    46.875 kHz  49.500 MHz
    Apple   :   832x624    74.551 Hz   4:3    49.726 kHz  57.284 MHz
    DMT 0x10:  1024x768    60.004 Hz   4:3    48.363 kHz  65.000 MHz
    DMT 0x11:  1024x768    70.069 Hz   4:3    56.476 kHz  75.000 MHz
    DMT 0x12:  1024x768    75.029 Hz   4:3    60.023 kHz  78.750 MHz
    DMT 0x24:  1280x1024   75.025 Hz   5:4    79.976 kHz 135.000 MHz
    Apple   :  1152x870    75.062 Hz 192:145  68.681 kHz 100.000 MHz
  Standard Timings:
    DMT 0x33:  1600x1200   60.000 Hz   4:3    75.000 kHz 162.000 MHz
    DMT 0x23:  1280x1024   60.020 Hz   5:4    63.981 kHz 108.000 MHz
    DMT 0x20:  1280x960    60.000 Hz   4:3    60.000 kHz 108.000 MHz
    DMT 0x15:  1152x864    75.000 Hz   4:3    67.500 kHz 108.000 MHz
  Detailed Timing Descriptors:
    DTD 1:  1920x1200   59.950 Hz   8:5    74.038 kHz 154.000 MHz (550 mm x 343 mm)
                 Hfront   48 Hsync  32 Hback  80 Hpol P
                 Vfront    3 Vsync   6 Vback  26 Vpol N
  Display Range Limits:
    Monitor ranges (GTF): 50-75 Hz V, 27-81 kHz H, max dotclock 170 MHz
    Display Product Name: 'SyncMaster'
    Display Product Serial Number: ...
  Extension blocks: 1
Checksum: 0xed

----------------

Block 1, CTA-861 Extension Block:
  Revision: 1
  Detailed Timing Descriptors:
    DTD 2:  1920x1080   60.000 Hz  16:9    67.500 kHz 148.500 MHz (550 mm x 343 mm)
                 Hfront   88 Hsync  44 Hback 148 Hpol P
                 Vfront    4 Vsync   5 Vback  36 Vpol P
    DTD 3:  1920x1080   50.000 Hz  16:9    56.250 kHz 148.500 MHz (550 mm x 343 mm)
                 Hfront  528 Hsync  44 Hback 148 Hpol P
                 Vfront    4 Vsync   5 Vback  36 Vpol P
    DTD 4:  1280x720    60.000 Hz  16:9    45.000 kHz  74.250 MHz (550 mm x 343 mm)
                 Hfront  110 Hsync  40 Hback 220 Hpol P
                 Vfront    5 Vsync   5 Vback  20 Vpol P
    DTD 5:  1280x720    50.000 Hz  16:9    37.500 kHz  74.250 MHz (550 mm x 343 mm)
                 Hfront  440 Hsync  40 Hback 220 Hpol P
                 Vfront    5 Vsync   5 Vback  20 Vpol P
    DTD 6:  1920x1080i  60.000 Hz  16:9    33.750 kHz  74.250 MHz (550 mm x 343 mm)
                 Hfront   88 Hsync  44 Hback 148 Hpol P
                 Vfront    2 Vsync   5 Vback  15 Vpol P Vfront +0.5 Odd Field
                 Vfront    2 Vsync   5 Vback  15 Vpol P Vback  +0.5 Even Field
    DTD 7:  1920x1080i  50.000 Hz  16:9    28.125 kHz  74.250 MHz (550 mm x 343 mm)
                 Hfront  528 Hsync  44 Hback 148 Hpol P
                 Vfront    2 Vsync   5 Vback  15 Vpol P Vfront +0.5 Odd Field
                 Vfront    2 Vsync   5 Vback  15 Vpol P Vback  +0.5 Even Field
Checksum: 0x7c

----------------

Warnings:

Block 1, CTA-861 Extension Block:
  Display Product Serial Number is set, so the Serial Number in the Base EDID should be 0.
  Missing VCDB, needed for Set Selectable RGB Quantization to avoid interop issues.

EDID conformity: PASS
