
EDID (hex):
00ffffffffffff0030e4fa0500000000
001c0104a51f117802aa95955e598e27
1b505400000001010101010101010101
0101010101012e3680a070381f403020
350035ae1000001ab62c80f470381640
3020350035ae1000001a000000fe004c
4720446973706c61790a2020000000fe
004c503134305746412d53504432004d

Extracted contents:
header:          00 ff ff ff ff ff ff 00
serial number:   30 e4 fa 05 00 00 00 00 00 1c
version:         01 04
basic params:    a5 1f 11 78 02
chroma info:     aa 95 95 5e 59 8e 27 1b 50 54
established:     00 00 00
standard:        01 01 01 01 01 01 01 01 01 01 01 01 01 01 01 01
descriptor 1:    2e 36 80 a0 70 38 1f 40 30 20 35 00 35 ae 10 00 00 1a
descriptor 2:    b6 2c 80 f4 70 38 16 40 30 20 35 00 35 ae 10 00 00 1a
descriptor 3:    00 00 00 fe 00 4c 47 20 44 69 73 70 6c 61 79 0a 20 20
descriptor 4:    00 00 00 fe 00 4c 50 31 34 30 57 46 41 2d 53 50 44 32
extensions:      00
checksum:        4d

Manufacturer: LGD Model 5fa Serial Number --
Made week 0 of 2018
EDID version: 1.4
Digital display
8 bits per primary color channel
DisplayPort interface
Maximum image size: 31 cm x 17 cm
Gamma: 2.20
Supported color formats: RGB 4:4:4
First detailed timing is preferred timing
Established timings supported:
Standard timings supported:
Detailed mode: Clock 138.700 MHz, 309 mm x 174 mm
               1920 1968 2000 2080 hborder 0
               1080 1083 1088 1111 vborder 0
               +hsync -vsync 
Detailed mode: Clock 114.460 MHz, 309 mm x 174 mm
               1920 1968 2000 2164 hborder 0
               1080 1083 1088 1102 vborder 0
               +hsync -vsync 
ASCII string: LG
ASCII string: LP140WFA
Checksum: 0x4d (valid)
EDID block does NOT conform to EDID 1.3!
	Missing name descriptor
	Missing monitor ranges
	Detailed block string not properly terminated
