
EDID (hex):
00ffffffffffff0004725404c5388062
1c1a0103682917782a78b5a45850a228
0f5054afee00314781c0810001010101
010101010101662156aa51001e30468f
33009ae61000001e000000fd0032501e
4b0b000a202020202020000000fc0041
63657220453139303048510a000000ff
005433465353303032334230300a0039

edid-decode (hex):

00 ff ff ff ff ff ff 00 04 72 54 04 c5 38 80 62
1c 1a 01 03 68 29 17 78 2a 78 b5 a4 58 50 a2 28
0f 50 54 af ee 00 31 47 81 c0 81 00 01 01 01 01
01 01 01 01 01 01 66 21 56 aa 51 00 1e 30 46 8f
33 00 9a e6 10 00 00 1e 00 00 00 fd 00 32 50 1e
4b 0b 00 0a 20 20 20 20 20 20 00 00 00 fc 00 41
63 65 72 20 45 31 39 30 30 48 51 0a 00 00 00 ff
00 54 33 46 53 53 30 30 32 33 42 30 30 0a 00 39

----------------

Block 0, Base EDID:
  EDID Structure Version & Revision: 1.3
  Vendor & Product Identification:
    Manufacturer: ACR
    Model: 1108
    Serial Number: 1652570309
    Made in: week 28 of 2016
  Basic Display Parameters & Features:
    Analog display
    Signal Level Standard: 0.700 : 0.000 : 0.700 V p-p
    Blank level equals black level
    Sync: Separate
    Maximum image size: 41 cm x 23 cm
    Gamma: 2.20
    DPMS levels: Off
    RGB color display
    First detailed timing is the preferred timing
  Color Characteristics:
    Red  : 0.6416, 0.3466
    Green: 0.3144, 0.6328
    Blue : 0.1582, 0.0615
    White: 0.3134, 0.3291
  Established Timings I & II:
    IBM     :   720x400    70.081663 Hz   9:5     31.467 kHz     28.320000 MHz
    DMT 0x04:   640x480    59.940476 Hz   4:3     31.469 kHz     25.175000 MHz
    DMT 0x05:   640x480    72.808802 Hz   4:3     37.861 kHz     31.500000 MHz
    DMT 0x06:   640x480    75.000000 Hz   4:3     37.500 kHz     31.500000 MHz
    DMT 0x08:   800x600    56.250000 Hz   4:3     35.156 kHz     36.000000 MHz
    DMT 0x09:   800x600    60.316541 Hz   4:3     37.879 kHz     40.000000 MHz
    DMT 0x0a:   800x600    72.187572 Hz   4:3     48.077 kHz     50.000000 MHz
    DMT 0x0b:   800x600    75.000000 Hz   4:3     46.875 kHz     49.500000 MHz
    Apple   :   832x624    74.551266 Hz   4:3     49.726 kHz     57.284000 MHz
    DMT 0x10:  1024x768    60.003840 Hz   4:3     48.363 kHz     65.000000 MHz
    DMT 0x11:  1024x768    70.069359 Hz   4:3     56.476 kHz     75.000000 MHz
    DMT 0x12:  1024x768    75.028582 Hz   4:3     60.023 kHz     78.750000 MHz
  Standard Timings:
    GTF     :   640x480    66.999194 Hz   4:3     33.433 kHz     27.281000 MHz
    DMT 0x55:  1280x720    60.000000 Hz  16:9     45.000 kHz     74.250000 MHz
    DMT 0x1c:  1280x800    59.810326 Hz  16:10    49.702 kHz     83.500000 MHz
  Detailed Timing Descriptors:
    DTD 1:  1366x768    59.789541 Hz 683:384   47.712 kHz     85.500000 MHz (410 mm x 230 mm)
                 Hfront   70 Hsync 143 Hback  213 Hpol P
                 Vfront    3 Vsync   3 Vback   24 Vpol P
    Display Range Limits:
      Monitor ranges (GTF): 50-80 Hz V, 30-75 kHz H, max dotclock 110 MHz
    Display Product Name: 'Acer E1900HQ'
    Display Product Serial Number: 'T3FSS0023B00'
Checksum: 0x39
