
EDID (hex):
00ffffffffffff001e6d265a01010101
0a18010380301b78ea6275a3554fa027
125054210800714081c0810081809500
9040a9c0b300023a801871382d40582c
4500dd0c1100001e000000fd00383d1e
530f000a202020202020000000fc0032
324d5035350a202020202020000000ff
000a20202020202020202020202001a9
02031df14a900403011412051f101323
0907078301000065030c001000023a80
1871382d40582c4500dd0c1100001e01
1d8018711c1620582c2500dd0c110000
9e011d007251d01e206e285500dd0c11
00001e8c0ad08a20e02d10103e9600dd
0c110000180000000000000000000000
000000000000000000000000000000c2

Extracted contents:
header:          00 ff ff ff ff ff ff 00
serial number:   1e 6d 26 5a 01 01 01 01 0a 18
version:         01 03
basic params:    80 30 1b 78 ea
chroma info:     62 75 a3 55 4f a0 27 12 50 54
established:     21 08 00
standard:        71 40 81 c0 81 00 81 80 95 00 90 40 a9 c0 b3 00
descriptor 1:    02 3a 80 18 71 38 2d 40 58 2c 45 00 dd 0c 11 00 00 1e
descriptor 2:    00 00 00 fd 00 38 3d 1e 53 0f 00 0a 20 20 20 20 20 20
descriptor 3:    00 00 00 fc 00 32 32 4d 50 35 35 0a 20 20 20 20 20 20
descriptor 4:    00 00 00 ff 00 0a 20 20 20 20 20 20 20 20 20 20 20 20
extensions:      01
checksum:        a9

Manufacturer: GSM Model 5a26 Serial Number --
Made week 10 of 2014
EDID version: 1.3
Digital display
Maximum image size: 48 cm x 27 cm
Gamma: 2.20
DPMS levels: Standby Suspend Off
Supported color formats: RGB 4:4:4, YCrCb 4:2:2
First detailed timing is preferred timing
Established timings supported:
  640x480@60Hz
  800x600@60Hz
  1024x768@60Hz
Standard timings supported:
  1152x864@60Hz
  1280x720@60Hz
  1280x800@60Hz
  1280x1024@60Hz
  1440x900@60Hz
  1400x1050@60Hz
  1600x900@60Hz
  1680x1050@60Hz
Detailed mode: Clock 148.500 MHz, 477 mm x 268 mm
               1920 2008 2052 2200 hborder 0
               1080 1084 1089 1125 vborder 0
               +hsync +vsync 
Monitor ranges (GTF): 56-61Hz V, 30-83kHz H, max dotclock 150MHz
Monitor name: 22MP55
Serial number: 
-- 1 extension blocks
Checksum: 0xa9 (valid)

CEA extension block
Extension version: 3
25 bytes of CEA data
  Video data block
    VIC 16 1920x1080@60Hz (native)
    VIC 04 1280x720@60Hz 
    VIC 03 720x480@60Hz 
    VIC 01 640x480@60Hz 
    VIC 20 1920x1080i@50Hz 
    VIC 18 720x576@50Hz 
    VIC 05 1920x1080i@60Hz 
    VIC 31 1920x1080@50Hz 
    VIC 16 1920x1080@60Hz 
    VIC 19 1280x720@50Hz 
  Audio data block
    Linear PCM, max channels 1
    Supported sample rates (kHz): 48 44.1 32
    Supported sample sizes (bits): 24 20 16
  Speaker allocation data block
  Vendor-specific data block, OUI 000c03 (HDMI)
    Source physical address 1.0.0.0
Underscans PC formats by default
Basic audio support
Supports YCbCr 4:4:4
Supports YCbCr 4:2:2
1 native detailed modes
Detailed mode: Clock 148.500 MHz, 477 mm x 268 mm
               1920 2008 2052 2200 hborder 0
               1080 1084 1089 1125 vborder 0
               +hsync +vsync 
Detailed mode: Clock 74.250 MHz, 477 mm x 268 mm
               1920 2008 2052 2200 hborder 0
                540  542  547  562 vborder 0
               +hsync +vsync interlaced 
Detailed mode: Clock 74.250 MHz, 477 mm x 268 mm
               1280 1390 1430 1650 hborder 0
                720  725  730  750 vborder 0
               +hsync +vsync 
Detailed mode: Clock 27.000 MHz, 477 mm x 268 mm
                720  736  798  858 hborder 0
                480  489  495  525 vborder 0
               -hsync -vsync 
Checksum: 0xc2 (valid)



