
EDID (hex):
00ffffffffffff0004729d094a3e7112
1b1f0103803c22782a0c95ab554ca024
0d5054bfef80d1c0b300950081808140
81c001010101565e00a0a0a029503020
350055502100001e000000ff00313132
37313345344134323030000000fd0030
4b1e781e000a202020202020000000fc
004b57323732550a202020202020013e
020331714b0203121304901f0114054a
230907078301000067030c002000003c
67d85dc401788000681a00000101304b
e6f07300a0a0a00f5030203500555021
00001a8c0ad08a20e02d10103e960055
5021000018011d007251d01e206e2855
0055502100001e011d00bc52d01e20b8
28554055502100001e000000000000b8

Extracted contents:
header:          00 ff ff ff ff ff ff 00
serial number:   04 72 9d 09 4a 3e 71 12 1b 1f
version:         01 03
basic params:    80 3c 22 78 2a
chroma info:     0c 95 ab 55 4c a0 24 0d 50 54
established:     bf ef 80
standard:        d1 c0 b3 00 95 00 81 80 81 40 81 c0 01 01 01 01
descriptor 1:    56 5e 00 a0 a0 a0 29 50 30 20 35 00 55 50 21 00 00 1e
descriptor 2:    00 00 00 ff 00 31 31 32 37 31 33 45 34 41 34 32 30 30
descriptor 3:    00 00 00 fd 00 30 4b 1e 78 1e 00 0a 20 20 20 20 20 20
descriptor 4:    00 00 00 fc 00 4b 57 32 37 32 55 0a 20 20 20 20 20 20
extensions:      01
checksum:        3e

EDID version: 1.3
Manufacturer: ACR Model 99d Serial Number --
Made in week 27 of 2021
Digital display
Maximum image size: 60 cm x 34 cm
Gamma: 2.20
DPMS levels: Off
RGB color display
First detailed timing is preferred timing
Display x,y Chromaticity:
  Red:   0.6679, 0.3320
  Green: 0.2998, 0.6250
  Blue:  0.1425, 0.0517
  White: 0.3134, 0.3291
Established timings supported:
  720x400@70Hz 9:5 HorFreq: 31469 Hz Clock: 28.320 MHz
  640x480@60Hz 4:3 HorFreq: 31469 Hz Clock: 25.175 MHz
  640x480@67Hz 4:3 HorFreq: 35000 Hz Clock: 30.240 MHz
  640x480@72Hz 4:3 HorFreq: 37900 Hz Clock: 31.500 MHz
  640x480@75Hz 4:3 HorFreq: 37500 Hz Clock: 31.500 MHz
  800x600@56Hz 4:3 HorFreq: 35200 Hz Clock: 36.000 MHz
  800x600@60Hz 4:3 HorFreq: 37900 Hz Clock: 40.000 MHz
  800x600@72Hz 4:3 HorFreq: 48100 Hz Clock: 50.000 MHz
  800x600@75Hz 4:3 HorFreq: 46900 Hz Clock: 49.500 MHz
  832x624@75Hz 4:3 HorFreq: 49726 Hz Clock: 57.284 MHz
  1024x768@60Hz 4:3 HorFreq: 48400 Hz Clock: 65.000 MHz
  1024x768@70Hz 4:3 HorFreq: 56500 Hz Clock: 75.000 MHz
  1024x768@75Hz 4:3 HorFreq: 60000 Hz Clock: 78.750 MHz
  1280x1024@75Hz 5:4 HorFreq: 80000 Hz Clock: 135.000 MHz
  1152x870@75Hz 192:145 HorFreq: 67500 Hz Clock: 108.000 MHz
Standard timings supported:
  1920x1080@60Hz 16:9
  1680x1050@60Hz 16:10 HorFreq: 64700 Hz Clock: 119.000 MHz
  1440x900@60Hz 16:10 HorFreq: 55500 Hz Clock: 88.750 MHz
  1280x1024@60Hz 5:4 HorFreq: 64000 Hz Clock: 108.000 MHz
  1280x960@60Hz 4:3 HorFreq: 60000 Hz Clock: 108.000 MHz
  1280x720@60Hz 16:9
Detailed mode: Clock 241.500 MHz, 597 mm x 336 mm
               2560 2608 2640 2720 hborder 0
               1440 1443 1448 1481 vborder 0
               +hsync +vsync 
               VertFreq: 59 Hz, HorFreq: 88786 Hz
Serial number: --
Monitor ranges (GTF): 48-75Hz V, 30-120kHz H, max dotclock 300MHz
Monitor name: KW272U
Has 1 extension blocks
Checksum: 0x3e (valid)

CTA extension block
Extension version: 3
45 bytes of CTA data
  Video data block
    VIC   2 720x480@60Hz 4:3  HorFreq: 31469 Hz Clock: 27.000 MHz
    VIC   3 720x480@60Hz 16:9  HorFreq: 31469 Hz Clock: 27.000 MHz
    VIC  18 720x576@50Hz 16:9  HorFreq: 31250 Hz Clock: 27.000 MHz
    VIC  19 1280x720@50Hz 16:9  HorFreq: 37500 Hz Clock: 74.250 MHz
    VIC   4 1280x720@60Hz 16:9  HorFreq: 45000 Hz Clock: 74.250 MHz
    VIC  16 1920x1080@60Hz 16:9 (native) HorFreq: 67500 Hz Clock: 148.500 MHz
    VIC  31 1920x1080@50Hz 16:9  HorFreq: 56250 Hz Clock: 148.500 MHz
    VIC   1 640x480@60Hz 4:3  HorFreq: 31469 Hz Clock: 25.175 MHz
    VIC  20 1920x1080i@50Hz 16:9  HorFreq: 28125 Hz Clock: 74.250 MHz
    VIC   5 1920x1080i@60Hz 16:9  HorFreq: 33750 Hz Clock: 74.250 MHz
    VIC  74 1920x1080@30Hz 64:27  HorFreq: 33750 Hz Clock: 74.250 MHz
  Audio data block
    Linear PCM, max channels 2
      Supported sample rates (kHz): 48 44.1 32
      Supported sample sizes (bits): 24 20 16
  Speaker allocation data block
    Speaker map:
      FL/FR - Front Left/Right
  Vendor-specific data block, OUI 000c03 (HDMI)
    Source physical address 2.0.0.0
    Maximum TMDS clock: 300MHz
  Vendor-specific data block, OUI c45dd8 (HDMI Forum)
    Version: 1
    Maximum TMDS Character Rate: 600MHz
    SCDC Present
  Vendor-specific data block, OUI 00001a
Basic audio support
Supports YCbCr 4:4:4
Supports YCbCr 4:2:2
1 native detailed modes
Detailed mode: Clock 296.800 MHz, 597 mm x 336 mm
               2560 2608 2640 2720 hborder 0
               1440 1443 1448 1455 vborder 0
               +hsync -vsync 
               VertFreq: 74 Hz, HorFreq: 109117 Hz
Detailed mode: Clock 27.000 MHz, 597 mm x 336 mm
                720  736  798  858 hborder 0
                480  489  495  525 vborder 0
               -hsync -vsync 
               VertFreq: 59 Hz, HorFreq: 31468 Hz
Detailed mode: Clock 74.250 MHz, 597 mm x 336 mm
               1280 1390 1430 1650 hborder 0
                720  725  730  750 vborder 0
               +hsync +vsync 
               VertFreq: 60 Hz, HorFreq: 45000 Hz
Detailed mode: Clock 74.250 MHz, 597 mm x 336 mm
               1280 1720 1760 1980 hborder 0
                720  725  730  750 vborder 0
               +hsync +vsync 
               VertFreq: 50 Hz, HorFreq: 37500 Hz
Checksum: 0xb8 (valid)

One or more of the timings is out of range of the Monitor Ranges:
  Vertical Freq: 30 - 75 Hz
  Horizontal Freq: 28125 - 109117 Hz
  Maximum Clock: 296.800 MHz
EDID block does not conform at all!
	Both the serial number and the serial string are set
