
EDID (hex):
00ffffffffffff0009e5c70800000000
201d0104a51f117803c8d5955d599429
23505400000001010101010101010101
010101010101fa3780de703823403020
360035ae1000001a0000000000000000
00000000000000000000000000fe0042
4f452043510a202020202020000000fe
004e5631343046484d2d4e34380a00b9

edid-decode (hex):

00 ff ff ff ff ff ff 00 09 e5 c7 08 00 00 00 00
20 1d 01 04 a5 1f 11 78 03 c8 d5 95 5d 59 94 29
23 50 54 00 00 00 01 01 01 01 01 01 01 01 01 01
01 01 01 01 01 01 fa 37 80 de 70 38 23 40 30 20
36 00 35 ae 10 00 00 1a 00 00 00 00 00 00 00 00
00 00 00 00 00 00 00 00 00 00 00 00 00 fe 00 42
4f 45 20 43 51 0a 20 20 20 20 20 20 00 00 00 fe
00 4e 56 31 34 30 46 48 4d 2d 4e 34 38 0a 00 b9

----------------

Block 0, Base EDID:
  EDID Structure Version & Revision: 1.4
  Vendor & Product Identification:
    Manufacturer: BOE
    Model: 2247
    Made in: week 32 of 2019
  Basic Display Parameters & Features:
    Digital display
    Bits per primary color channel: 8
    DisplayPort interface
    Maximum image size: 31 cm x 17 cm
    Gamma: 2.20
    Supported color formats: RGB 4:4:4
    First detailed timing includes the native pixel format and preferred refresh rate
    Display is continuous frequency
  Color Characteristics:
    Red  : 0.5849, 0.3632
    Green: 0.3496, 0.5781
    Blue : 0.1630, 0.1376
    White: 0.3134, 0.3291
  Established Timings I & II: none
  Standard Timings: none
  Detailed Timing Descriptors:
    DTD 1:  1920x1080   60.000084 Hz  16:9     66.900 kHz    143.300000 MHz (309 mm x 174 mm)
                 Hfront   48 Hsync  32 Hback  142 Hpol P
                 Vfront    3 Vsync   6 Vback   26 Vpol N
    Empty Descriptor
    Alphanumeric Data String: 'BOE CQ'
    Alphanumeric Data String: 'NV140FHM-N48'
Checksum: 0xb9
