
EDID (hex):
00ffffffffffff004d10f91300000000
1b170104a52313780ede50a3544c9926
0f505400000001010101010101010101
010101010101cd9180a0c00834703020
35005ac2100000180000001000000000
00000000000000000000000000fe004a
4a373448804c513135365a3100000000
0002410328001200000b010a202000f0

edid-decode (hex):

00 ff ff ff ff ff ff 00 4d 10 f9 13 00 00 00 00
1b 17 01 04 a5 23 13 78 0e de 50 a3 54 4c 99 26
0f 50 54 00 00 00 01 01 01 01 01 01 01 01 01 01
01 01 01 01 01 01 cd 91 80 a0 c0 08 34 70 30 20
35 00 5a c2 10 00 00 18 00 00 00 10 00 00 00 00
00 00 00 00 00 00 00 00 00 00 00 00 00 fe 00 4a
4a 37 34 48 80 4c 51 31 35 36 5a 31 00 00 00 00
00 02 41 03 28 00 12 00 00 0b 01 0a 20 20 00 f0

----------------

Block 0, Base EDID:
  EDID Structure Version & Revision: 1.4
  Vendor & Product Identification:
    Manufacturer: SHP
    Model: 5113
    Made in: week 27 of 2013
  Basic Display Parameters & Features:
    Digital display
    Bits per primary color channel: 8
    DisplayPort interface
    Maximum image size: 35 cm x 19 cm
    Gamma: 2.20
    Supported color formats: RGB 4:4:4, YCrCb 4:4:4
    Default (sRGB) color space is primary color space
    First detailed timing includes the native pixel format and preferred refresh rate
  Color Characteristics:
    Red  : 0.6396, 0.3291
    Green: 0.2998, 0.5996
    Blue : 0.1494, 0.0595
    White: 0.3125, 0.3281
  Established Timings I & II: none
  Standard Timings: none
  Detailed Timing Descriptors:
    DTD 1:  3200x1800   59.981809 Hz  16:9    111.086 kHz    373.250000 MHz (346 mm x 194 mm)
                 Hfront   48 Hsync  32 Hback   80 Hpol N
                 Vfront    3 Vsync   5 Vback   44 Vpol N
    Dummy Descriptor:
    Alphanumeric Data String: 'JJ74H'
    Manufacturer-Specified Display Descriptor (0x00): 00 00 00 02 41 03 28 00 12 00 00 0b 01 0a 20 20 '....A.(.......  '
Checksum: 0xf0


