
EDID (hex):
00ffffffffffff0059af911000000000
12150103803c22782a6fb1a7554c9e25
0c505400000001010101010101010101
010101010101565e00a0a0a029503020
350055502100001a0000000000d01c20
4080350055502100001c000000ff0031
31303530335f330a20202020000000fc
004c43442051484420310a20202000a6

edid-decode (hex):

00 ff ff ff ff ff ff 00 59 af 91 10 00 00 00 00
12 15 01 03 80 3c 22 78 2a 6f b1 a7 55 4c 9e 25
0c 50 54 00 00 00 01 01 01 01 01 01 01 01 01 01
01 01 01 01 01 01 56 5e 00 a0 a0 a0 29 50 30 20
35 00 55 50 21 00 00 1a 00 00 00 00 00 d0 1c 20
40 80 35 00 55 50 21 00 00 1c 00 00 00 ff 00 31
31 30 35 30 33 5f 33 0a 20 20 20 20 00 00 00 fc
00 4c 43 44 20 51 48 44 20 31 0a 20 20 20 00 a6

----------------

Block 0, Base EDID:
  EDID Structure Version & Revision: 1.3
  Vendor & Product Identification:
    Manufacturer: VMO
    Model: 4241
    Made in: week 18 of 2011
  Basic Display Parameters & Features:
    Digital display
    Maximum image size: 60 cm x 34 cm
    Gamma: 2.20
    DPMS levels: Off
    RGB color display
    First detailed timing is the preferred timing
  Color Characteristics:
    Red  : 0.6533, 0.3339
    Green: 0.2998, 0.6201
    Blue : 0.1464, 0.0498
    White: 0.3125, 0.3291
  Established Timings I & II: none
  Standard Timings: none
  Detailed Timing Descriptors:
    DTD 1:  2560x1440   59.950550 Hz  16:9     88.787 kHz    241.500000 MHz (597 mm x 336 mm)
                 Hfront   48 Hsync  32 Hback   80 Hpol P
                 Vfront    3 Vsync   5 Vback   33 Vpol N
    Manufacturer-Specified Display Descriptor (0x00): 00 00 00 d0 1c 20 40 80 35 00 55 50 21 00 00 1c '..... @.5.UP!...'
    Display Product Serial Number: '110503_3'
    Display Product Name: 'LCD QHD 1'
Checksum: 0xa6


