
EDID (hex):
00ffffffffffff000472630237145021
0f16010368291a78ca3dc5a6564a9a25
125054bfef80714f81c081009500950f
0101010101019a29a0d0518422305098
360098ff1000001c000000fd00384c1f
530e000a202020202020000000fc0047
31393557560a202020202020000000ff
004c53593044303031383530340a0077

Extracted contents:
header:          00 ff ff ff ff ff ff 00
serial number:   04 72 63 02 37 14 50 21 0f 16
version:         01 03
basic params:    68 29 1a 78 ca
chroma info:     3d c5 a6 56 4a 9a 25 12 50 54
established:     bf ef 80
standard:        71 4f 81 c0 81 00 95 00 95 0f 01 01 01 01 01 01
descriptor 1:    9a 29 a0 d0 51 84 22 30 50 98 36 00 98 ff 10 00 00 1c
descriptor 2:    00 00 00 fd 00 38 4c 1f 53 0e 00 0a 20 20 20 20 20 20
descriptor 3:    00 00 00 fc 00 47 31 39 35 57 56 0a 20 20 20 20 20 20
descriptor 4:    00 00 00 ff 00 4c 53 59 30 44 30 30 31 38 35 30 34 0a
extensions:      00
checksum:        77

EDID version: 1.3
Manufacturer: ACR Model 263 Serial Number --
Made in week 15 of 2012
Analog display, Input voltage level: 0.7/0.7 V
Sync: Separate 
Maximum image size: 41 cm x 26 cm
Gamma: 2.20
DPMS levels: Standby Suspend
RGB color display
First detailed timing is preferred timing
Display x,y Chromaticity:
  Red:   0.6484, 0.3388
  Green: 0.2919, 0.6025
  Blue:  0.1474, 0.0703
  White: 0.3134, 0.3291
Established timings supported:
  720x400@70Hz 9:5 HorFreq: 31469 Hz Clock: 28.320 MHz
  640x480@60Hz 4:3 HorFreq: 31469 Hz Clock: 25.175 MHz
  640x480@67Hz 4:3 HorFreq: 35000 Hz Clock: 30.240 MHz
  640x480@72Hz 4:3 HorFreq: 37900 Hz Clock: 31.500 MHz
  640x480@75Hz 4:3 HorFreq: 37500 Hz Clock: 31.500 MHz
  800x600@56Hz 4:3 HorFreq: 35200 Hz Clock: 36.000 MHz
  800x600@60Hz 4:3 HorFreq: 37900 Hz Clock: 40.000 MHz
  800x600@72Hz 4:3 HorFreq: 48100 Hz Clock: 50.000 MHz
  800x600@75Hz 4:3 HorFreq: 46900 Hz Clock: 49.500 MHz
  832x624@75Hz 4:3 HorFreq: 49726 Hz Clock: 57.284 MHz
  1024x768@60Hz 4:3 HorFreq: 48400 Hz Clock: 65.000 MHz
  1024x768@70Hz 4:3 HorFreq: 56500 Hz Clock: 75.000 MHz
  1024x768@75Hz 4:3 HorFreq: 60000 Hz Clock: 78.750 MHz
  1280x1024@75Hz 5:4 HorFreq: 80000 Hz Clock: 135.000 MHz
  1152x870@75Hz 192:145 HorFreq: 67500 Hz Clock: 108.000 MHz
Standard timings supported:
  1152x864@75Hz 4:3 HorFreq: 67500 Hz Clock: 108.000 MHz
  1280x720@60Hz 16:9
  1280x800@60Hz 16:10
  1440x900@60Hz 16:10 HorFreq: 55500 Hz Clock: 88.750 MHz
  1440x900@75Hz 16:10 HorFreq: 82300 Hz Clock: 156.000 MHz
Detailed mode: Clock 106.500 MHz, 408 mm x 255 mm
               1440 1520 1672 1904 hborder 0
                900  903  909  934 vborder 0
               -hsync +vsync 
               VertFreq: 59 Hz, HorFreq: 55934 Hz
Monitor ranges (GTF): 56-76Hz V, 31-83kHz H, max dotclock 140MHz
Monitor name: G195WV
Serial number: --
Checksum: 0x77 (valid)
One or more of the timings is out of range of the Monitor Ranges:
  Vertical Freq: 56 - 75 Hz
  Horizontal Freq: 31469 - 82300 Hz
  Maximum Clock: 156.000 MHz
