
EDID (hex):
00ffffffffffff000daed21500000000
1219010495221378024205ac4f44ac28
0c505400000001010101010101010101
010101010101b43b804a713834406442
6a0058c110000018000000fe004e3135
364847452d45414c0a20000000fe0043
4d4e0a202020202020202020000000fe
004e3135364847452d45414c0a2000df

edid-decode (hex):

00 ff ff ff ff ff ff 00 0d ae d2 15 00 00 00 00
12 19 01 04 95 22 13 78 02 42 05 ac 4f 44 ac 28
0c 50 54 00 00 00 01 01 01 01 01 01 01 01 01 01
01 01 01 01 01 01 b4 3b 80 4a 71 38 34 40 64 42
6a 00 58 c1 10 00 00 18 00 00 00 fe 00 4e 31 35
36 48 47 45 2d 45 41 4c 0a 20 00 00 00 fe 00 43
4d 4e 0a 20 20 20 20 20 20 20 20 20 00 00 00 fe
00 4e 31 35 36 48 47 45 2d 45 41 4c 0a 20 00 df

----------------

Block 0, Base EDID:
  EDID Structure Version & Revision: 1.4
  Vendor & Product Identification:
    Manufacturer: CMN
    Model: 5586
    Made in: week 18 of 2015
  Basic Display Parameters & Features:
    Digital display
    Bits per primary color channel: 6
    DisplayPort interface
    Maximum image size: 34 cm x 19 cm
    Gamma: 2.20
    Supported color formats: RGB 4:4:4
    First detailed timing includes the native pixel format and preferred refresh rate
  Color Characteristics:
    Red  : 0.6728, 0.3085
    Green: 0.2656, 0.6738
    Blue : 0.1562, 0.0468
    White: 0.3134, 0.3291
  Established Timings I & II: none
  Standard Timings: none
  Detailed Timing Descriptors:
    DTD 1:  1920x1080   60.007852 Hz  16:9     67.929 kHz    152.840000 MHz (344 mm x 193 mm)
                 Hfront  100 Hsync  66 Hback  164 Hpol N
                 Vfront    6 Vsync  10 Vback   36 Vpol N
    Alphanumeric Data String: 'N156HGE-EAL'
    Alphanumeric Data String: 'CMN'
    Alphanumeric Data String: 'N156HGE-EAL'
Checksum: 0xdf
