
EDID (hex):
00ffffffffffff003064050901010101
24130103801d11780a859599574f8f26
21505400000001010101010101010101
010101010101bb1d5613510005302370
120027a6100000180000000f0002d002
d0000101014cd4020200000000fe0054
4d444953504c41590a202020000000fe
004c54313333454531303030300a00fe

Extracted contents:
header:          00 ff ff ff ff ff ff 00
serial number:   30 64 05 09 01 01 01 01 24 13
version:         01 03
basic params:    80 1d 11 78 0a
chroma info:     85 95 99 57 4f 8f 26 21 50 54
established:     00 00 00
standard:        01 01 01 01 01 01 01 01 01 01 01 01 01 01 01 01
descriptor 1:    bb 1d 56 13 51 00 05 30 23 70 12 00 27 a6 10 00 00 18
descriptor 2:    00 00 00 0f 00 02 d0 02 d0 00 01 01 01 4c d4 02 02 00
descriptor 3:    00 00 00 fe 00 54 4d 44 49 53 50 4c 41 59 0a 20 20 20
descriptor 4:    00 00 00 fe 00 4c 54 31 33 33 45 45 31 30 30 30 30 0a
extensions:      00
checksum:        fe

EDID version: 1.3
Manufacturer: LCD Model 905 Serial Number --
Made in week 36 of 2009
Digital display
Maximum image size: 29 cm x 17 cm
Gamma: 2.20
RGB color display
First detailed timing is preferred timing
Display x,y Chromaticity:
  Red:   0.5996, 0.3398
  Green: 0.3095, 0.5595
  Blue:  0.1503, 0.1298
  White: 0.3134, 0.3291
Established timings supported:
Standard timings supported:
Detailed mode: Clock 76.110 MHz, 295 mm x 166 mm
               1366 1401 1513 1641 hborder 0
                768  769  771  773 vborder 0
               -hsync -vsync 
               VertFreq: 60 Hz, HorFreq: 46380 Hz
Manufacturer-specified data, tag 15
ASCII string: TMDISPLAY
ASCII string: LT133EE10000
Checksum: 0xfe (valid)
EDID block does NOT conform to EDID 1.3!
	Missing name descriptor
	Missing monitor ranges
