
EDID (hex):
00ffffffffffff000dae731300000000
0e1c0104a51d117803ee95a3544c9926
0f505400000001010101010101010101
01010101010150d000a0f0703e803020
350025a51000001ae08a00a0f0703e80
3020350025a51000001a000000000000
00000000000000000000000000000002
000c26ff143cc8260d2bc80000000097

Extracted contents:
header:          00 ff ff ff ff ff ff 00
serial number:   0d ae 73 13 00 00 00 00 0e 1c
version:         01 04
basic params:    a5 1d 11 78 03
chroma info:     ee 95 a3 54 4c 99 26 0f 50 54
established:     00 00 00
standard:        01 01 01 01 01 01 01 01 01 01 01 01 01 01 01 01
descriptor 1:    50 d0 00 a0 f0 70 3e 80 30 20 35 00 25 a5 10 00 00 1a
descriptor 2:    e0 8a 00 a0 f0 70 3e 80 30 20 35 00 25 a5 10 00 00 1a
descriptor 3:    00 00 00 00 00 00 00 00 00 00 00 00 00 00 00 00 00 00
descriptor 4:    00 00 00 02 00 0c 26 ff 14 3c c8 26 0d 2b c8 00 00 00
extensions:      00
checksum:        97

Manufacturer: CMN Model 1373 Serial Number --
Made week 14 of 2018
EDID version: 1.4
Digital display
8 bits per primary color channel
DisplayPort interface
Maximum image size: 29 cm x 17 cm
Gamma: 2.20
Supported color formats: RGB 4:4:4
First detailed timing is preferred timing
Supports GTF timings within operating range
Established timings supported:
Standard timings supported:
Detailed mode: Clock 533.280 MHz, 293 mm x 165 mm
               3840 3888 3920 4000 hborder 0
               2160 2163 2168 2222 vborder 0
               +hsync -vsync 
Detailed mode: Clock 355.520 MHz, 293 mm x 165 mm
               3840 3888 3920 4000 hborder 0
               2160 2163 2168 2222 vborder 0
               +hsync -vsync 
Manufacturer-specified data, tag 0
Manufacturer-specified data, tag 2
Checksum: 0x97 (valid)
EDID block does NOT conform to EDID 1.3!
	Missing name descriptor
	Missing monitor ranges
