
EDID (hex):
00ffffffffffff0006af9e1300000000
01140103802615780ac4959e57539226
0f505400000001010101010101010101
010101010101302a407261840c303020
36007ed6100000180000000f00000000
00000000000000000020000000fe0041
554f0a202020202020202020000000fe
004231373352573031205633200a000b

edid-decode (hex):

00 ff ff ff ff ff ff 00 06 af 9e 13 00 00 00 00
01 14 01 03 80 26 15 78 0a c4 95 9e 57 53 92 26
0f 50 54 00 00 00 01 01 01 01 01 01 01 01 01 01
01 01 01 01 01 01 30 2a 40 72 61 84 0c 30 30 20
36 00 7e d6 10 00 00 18 00 00 00 0f 00 00 00 00
00 00 00 00 00 00 00 00 00 20 00 00 00 fe 00 41
55 4f 0a 20 20 20 20 20 20 20 20 20 00 00 00 fe
00 42 31 37 33 52 57 30 31 20 56 33 20 0a 00 0b

----------------

Block 0, Base EDID:
  EDID Structure Version & Revision: 1.3
  Vendor & Product Identification:
    Manufacturer: AUO
    Model: 5022
    Made in: week 1 of 2010
  Basic Display Parameters & Features:
    Digital display
    Maximum image size: 38 cm x 21 cm
    Gamma: 2.20
    RGB color display
    First detailed timing is the preferred timing
  Color Characteristics:
    Red  : 0.6201, 0.3398
    Green: 0.3251, 0.5703
    Blue : 0.1503, 0.0595
    White: 0.3134, 0.3291
  Established Timings I & II: none
  Standard Timings: none
  Detailed Timing Descriptors:
    DTD 1:  1600x900    60.112209 Hz  16:9     54.822 kHz    108.000000 MHz (382 mm x 214 mm)
                 Hfront   48 Hsync  32 Hback  290 Hpol N
                 Vfront    3 Vsync   6 Vback    3 Vpol N
    Manufacturer-Specified Display Descriptor (0x0f): 00 0f 00 00 00 00 00 00 00 00 00 00 00 00 00 20 '............... '
    Alphanumeric Data String: 'AUO'
    Alphanumeric Data String: 'B173RW01 V3 '
Checksum: 0x0b
