
EDID (hex):
00ffffffffffff000dae091400000000
241d0104a51f117802ee95a3544c9926
0f505400000001010101010101010101
010101010101b43b804a71383440503c
680035ad10000018000000fe004e3134
304843522d474c320a20000000fe0043
4d4e0a202020202020202020000000fe
004e3134304843522d474c320a2000c3

edid-decode (hex):

00 ff ff ff ff ff ff 00 0d ae 09 14 00 00 00 00
24 1d 01 04 a5 1f 11 78 02 ee 95 a3 54 4c 99 26
0f 50 54 00 00 00 01 01 01 01 01 01 01 01 01 01
01 01 01 01 01 01 b4 3b 80 4a 71 38 34 40 50 3c
68 00 35 ad 10 00 00 18 00 00 00 fe 00 4e 31 34
30 48 43 52 2d 47 4c 32 0a 20 00 00 00 fe 00 43
4d 4e 0a 20 20 20 20 20 20 20 20 20 00 00 00 fe
00 4e 31 34 30 48 43 52 2d 47 4c 32 0a 20 00 c3

----------------

Block 0, Base EDID:
  EDID Structure Version & Revision: 1.4
  Vendor & Product Identification:
    Manufacturer: CMN
    Model: 5129
    Made in: week 36 of 2019
  Basic Display Parameters & Features:
    Digital display
    Bits per primary color channel: 8
    DisplayPort interface
    Maximum image size: 31 cm x 17 cm
    Gamma: 2.20
    Supported color formats: RGB 4:4:4
    First detailed timing includes the native pixel format and preferred refresh rate
  Color Characteristics:
    Red  : 0.6396, 0.3300
    Green: 0.2998, 0.5996
    Blue : 0.1503, 0.0595
    White: 0.3134, 0.3291
  Established Timings I & II: none
  Standard Timings: none
  Detailed Timing Descriptors:
    DTD 1:  1920x1080   60.007852 Hz  16:9     67.929 kHz    152.840000 MHz (309 mm x 173 mm)
                 Hfront   80 Hsync  60 Hback  190 Hpol N
                 Vfront    6 Vsync   8 Vback   38 Vpol N
    Alphanumeric Data String: 'N140HCR-GL2'
    Alphanumeric Data String: 'CMN'
    Alphanumeric Data String: 'N140HCR-GL2'
Checksum: 0xc3
