
EDID (hex):
00ffffffffffff0030aeae6101010101
111d0104a5351e7818ffd5a95345a025
0d5054a1080081809500a9c0b300d1c0
d10001010101565e00a0a0a029503020
35000f282100001a000000ff0056544b
34383531370a20202020000000fd0031
4c1e701e000a202020202020000000fc
00503234682d31300a20202020200140
02031cf04901020304051413101f2309
0707830100006547e0000400011d0072
51d01e206e2855000f282100001f8c0a
d08a20e02d10103e96000f2821000019
00000000000000000000000000000000
00000000000000000000000000000000
00000000000000000000000000000000
00000000000000000000000000000020

edid-decode (hex):

00 ff ff ff ff ff ff 00 30 ae ae 61 01 01 01 01
11 1d 01 04 a5 35 1e 78 18 ff d5 a9 53 45 a0 25
0d 50 54 a1 08 00 81 80 95 00 a9 c0 b3 00 d1 c0
d1 00 01 01 01 01 56 5e 00 a0 a0 a0 29 50 30 20
35 00 0f 28 21 00 00 1a 00 00 00 ff 00 56 54 4b
34 38 35 31 37 0a 20 20 20 20 00 00 00 fd 00 31
4c 1e 70 1e 00 0a 20 20 20 20 20 20 00 00 00 fc
00 50 32 34 68 2d 31 30 0a 20 20 20 20 20 01 40

02 03 1c f0 49 01 02 03 04 05 14 13 10 1f 23 09
07 07 83 01 00 00 65 47 e0 00 04 00 01 1d 00 72
51 d0 1e 20 6e 28 55 00 0f 28 21 00 00 1f 8c 0a
d0 8a 20 e0 2d 10 10 3e 96 00 0f 28 21 00 00 19
00 00 00 00 00 00 00 00 00 00 00 00 00 00 00 00
00 00 00 00 00 00 00 00 00 00 00 00 00 00 00 00
00 00 00 00 00 00 00 00 00 00 00 00 00 00 00 00
00 00 00 00 00 00 00 00 00 00 00 00 00 00 00 20

----------------

Block 0, Base EDID:
  EDID Structure Version & Revision: 1.4
  Vendor & Product Identification:
    Manufacturer: LEN
    Model: 25006
    Serial Number: 16843009
    Made in: week 17 of 2019
  Basic Display Parameters & Features:
    Digital display
    Bits per primary color channel: 8
    DisplayPort interface
    Maximum image size: 53 cm x 30 cm
    Gamma: 2.20
    Supported color formats: RGB 4:4:4, YCrCb 4:4:4, YCrCb 4:2:2
    First detailed timing does not include the native pixel format and preferred refresh rate
  Color Characteristics:
    Red  : 0.6630, 0.3271
    Green: 0.2724, 0.6279
    Blue : 0.1474, 0.0517
    White: 0.3134, 0.3291
  Established Timings I & II:
    IBM     :   720x400    70.081663 Hz   9:5     31.467 kHz     28.320000 MHz
    DMT 0x04:   640x480    59.940476 Hz   4:3     31.469 kHz     25.175000 MHz
    DMT 0x09:   800x600    60.316541 Hz   4:3     37.879 kHz     40.000000 MHz
    DMT 0x10:  1024x768    60.003840 Hz   4:3     48.363 kHz     65.000000 MHz
  Standard Timings:
    DMT 0x23:  1280x1024   60.019740 Hz   5:4     63.981 kHz    108.000000 MHz
    DMT 0x2f:  1440x900    59.887445 Hz  16:10    55.935 kHz    106.500000 MHz
    DMT 0x53:  1600x900    60.000000 Hz  16:9     60.000 kHz    108.000000 MHz (RB)
    DMT 0x3a:  1680x1050   59.954250 Hz  16:10    65.290 kHz    146.250000 MHz
    DMT 0x52:  1920x1080   60.000000 Hz  16:9     67.500 kHz    148.500000 MHz
    DMT 0x45:  1920x1200   59.884600 Hz  16:10    74.556 kHz    193.250000 MHz
  Detailed Timing Descriptors:
    DTD 1:  2560x1440   59.950550 Hz  16:9     88.787 kHz    241.500000 MHz (527 mm x 296 mm)
                 Hfront   48 Hsync  32 Hback   80 Hpol P
                 Vfront    3 Vsync   5 Vback   33 Vpol N
    Display Product Serial Number: 'VTK48517'
    Display Range Limits:
      Monitor ranges (GTF): 49-76 Hz V, 30-112 kHz H, max dotclock 300 MHz
    Display Product Name: 'P24h-10'
  Extension blocks: 1
Checksum: 0x40

----------------

Block 1, CTA-861 Extension Block:
  Revision: 3
  Underscans IT Video Formats by default
  Basic audio support
  Supports YCbCr 4:4:4
  Supports YCbCr 4:2:2
  Native detailed modes: 0
  Video Data Block:
    VIC   1:   640x480    59.940476 Hz   4:3     31.469 kHz     25.175000 MHz
    VIC   2:   720x480    59.940060 Hz   4:3     31.469 kHz     27.000000 MHz
    VIC   3:   720x480    59.940060 Hz  16:9     31.469 kHz     27.000000 MHz
    VIC   4:  1280x720    60.000000 Hz  16:9     45.000 kHz     74.250000 MHz
    VIC   5:  1920x1080i  60.000000 Hz  16:9     33.750 kHz     74.250000 MHz
    VIC  20:  1920x1080i  50.000000 Hz  16:9     28.125 kHz     74.250000 MHz
    VIC  19:  1280x720    50.000000 Hz  16:9     37.500 kHz     74.250000 MHz
    VIC  16:  1920x1080   60.000000 Hz  16:9     67.500 kHz    148.500000 MHz
    VIC  31:  1920x1080   50.000000 Hz  16:9     56.250 kHz    148.500000 MHz
  Audio Data Block:
    Linear PCM:
      Max channels: 2
      Supported sample rates (kHz): 48 44.1 32
      Supported sample sizes (bits): 24 20 16
  Speaker Allocation Data Block:
    FL/FR - Front Left/Right
  Vendor-Specific Data Block (InFocus), OUI 00-E0-47:
    04 00                                           '..'
  Detailed Timing Descriptors:
    DTD 2:  1280x720    60.000000 Hz  16:9     45.000 kHz     74.250000 MHz (527 mm x 296 mm)
                 Hfront  110 Hsync  40 Hback  220 Hpol P
                 Vfront    5 Vsync   5 Vback   20 Vpol P
    DTD 3:   720x480    59.940060 Hz   3:2     31.469 kHz     27.000000 MHz (527 mm x 296 mm)
                 Hfront   16 Hsync  62 Hback   60 Hpol N
                 Vfront    9 Vsync   6 Vback   30 Vpol N
Checksum: 0x20  Unused space in Extension Block: 63 bytes


