edid-decode (hex):

00 ff ff ff ff ff ff 00 08 59 32 00 01 00 00 00
04 17 01 03 80 3d 23 78 0a d0 dd a9 53 49 9d 23
11 47 4a a3 08 00 81 c0 81 00 81 0f 81 40 81 80
95 00 b3 00 01 01 66 21 50 b0 51 00 1b 30 00 70
26 44 e4 10 11 00 00 1e 46 20 00 a4 51 00 2a 30
50 80 37 00 80 80 21 00 00 1c 00 00 00 fc 00 4e
53 32 38 45 44 32 30 30 4e 41 31 34 00 00 00 fd
00 37 4c 1e 50 11 00 0a 20 20 20 20 20 20 01 9b

----------------

Block 0, Base EDID:
  EDID Structure Version & Revision: 1.3
  Vendor & Product Identification:
    Manufacturer: BBY
    Model: 50
    Serial Number: ...
    Made in: week 4 of 2013
  Basic Display Parameters & Features:
    Digital display
    Maximum image size: 61 cm x 35 cm
    Gamma: 2.20
    RGB color display
    First detailed timing is the preferred timing
  Color Characteristics:
    Red  : 0.6630, 0.3251
    Green: 0.2851, 0.6132
    Blue : 0.1396, 0.0673
    White: 0.2802, 0.2900
  Established Timings I & II:
    IBM     :   720x400    70.082 Hz   9:5    31.467 kHz  28.320 MHz
    DMT 0x04:   640x480    59.940 Hz   4:3    31.469 kHz  25.175 MHz
    DMT 0x08:   800x600    56.250 Hz   4:3    35.156 kHz  36.000 MHz
    DMT 0x09:   800x600    60.317 Hz   4:3    37.879 kHz  40.000 MHz
    DMT 0x10:  1024x768    60.004 Hz   4:3    48.363 kHz  65.000 MHz
  Standard Timings:
    DMT 0x55:  1280x720    60.000 Hz  16:9    45.000 kHz  74.250 MHz
    DMT 0x1c:  1280x800    59.810 Hz  16:10   49.702 kHz  83.500 MHz
    DMT 0x1d:  1280x800    74.934 Hz  16:10   62.795 kHz 106.500 MHz
    DMT 0x20:  1280x960    60.000 Hz   4:3    60.000 kHz 108.000 MHz
    DMT 0x23:  1280x1024   60.020 Hz   5:4    63.981 kHz 108.000 MHz
    DMT 0x2f:  1440x900    59.887 Hz  16:10   55.935 kHz 106.500 MHz
    DMT 0x3a:  1680x1050   59.954 Hz  16:10   65.290 kHz 146.250 MHz
  Detailed Timing Descriptors:
    DTD 1:  1360x768    60.015 Hz  85:48   47.712 kHz  85.500 MHz (484 mm x 272 mm)
                 Hfront  256 Hsync 112 Hback  64 Hpol P
                 Vfront   18 Vsync   6 Vback   3 Vpol P
    DTD 2:  1280x768    60.000 Hz   5:3    48.600 kHz  82.620 MHz (640 mm x 384 mm)
                 Hfront   80 Hsync 128 Hback 212 Hpol N
                 Vfront    3 Vsync   7 Vback  32 Vpol P
    Display Product Name: 'NS28ED200NA14'
  Display Range Limits:
    Monitor ranges (GTF): 55-76 Hz V, 30-80 kHz H, max dotclock 170 MHz
  Extension blocks: 1
Checksum: 0x9b

----------------

Failures:

Block 0, Base EDID:
  Detailed Timing Descriptor #1: Mismatch of image size 484x272 mm vs display size 610x350 mm.
  Detailed Timing Descriptor #2: Mismatch of image size 640x384 mm vs display size 610x350 mm.
  Base EDID: EDID specified 1 extension block(s), but found 0 extension block(s).

EDID conformity: FAIL
