
EDID (hex):
00ffffffffffff0010ac8b404c363741
111a0104a5431c783eee95a3544c9926
0f5054a54b008100b300714f8180d1c0
0101010101017e4800e0a0381f404040
3a00a11c2100001a000000ff00355739
324e3634544137364c0a000000fc0044
454c4c205532393133574d0a000000fd
0031561d5e13010a2020202020200165
02031df1509005040302071601061112
1513141f2023091f0783010000023a80
1871382d40582c2500a11c2100001e01
1d8018711c1620582c2500a11c210000
9e011d007251d01e206e285500a11c21
00001e8c0ad08a20e02d10103e9600a1
1c210000180000000000000000000000
0000000000000000000000000000005d

Extracted contents:
header:          00 ff ff ff ff ff ff 00
serial number:   10 ac 8b 40 4c 36 37 41 11 1a
version:         01 04
basic params:    a5 43 1c 78 3e
chroma info:     ee 95 a3 54 4c 99 26 0f 50 54
established:     a5 4b 00
standard:        81 00 b3 00 71 4f 81 80 d1 c0 01 01 01 01 01 01
descriptor 1:    7e 48 00 e0 a0 38 1f 40 40 40 3a 00 a1 1c 21 00 00 1a
descriptor 2:    00 00 00 ff 00 35 57 39 32 4e 36 34 54 41 37 36 4c 0a
descriptor 3:    00 00 00 fc 00 44 45 4c 4c 20 55 32 39 31 33 57 4d 0a
descriptor 4:    00 00 00 fd 00 31 56 1d 5e 13 01 0a 20 20 20 20 20 20
extensions:      01
checksum:        65

EDID version: 1.4
Manufacturer: DEL Model 408b Serial Number --
Made in week 17 of 2016
Digital display
8 bits per primary color channel
DisplayPort interface
Maximum image size: 67 cm x 28 cm
Gamma: 2.20
DPMS levels: Off
Supported color formats: RGB 4:4:4, YCrCb 4:4:4, YCrCb 4:2:2
Default (sRGB) color space is primary color space
First detailed timing includes the native pixel format and preferred refresh rate
Display x,y Chromaticity:
  Red:   0.6396, 0.3300
  Green: 0.2998, 0.5996
  Blue:  0.1503, 0.0595
  White: 0.3134, 0.3291
Established timings supported:
  720x400@70Hz 9:5 HorFreq: 31469 Hz Clock: 28.320 MHz
  640x480@60Hz 4:3 HorFreq: 31469 Hz Clock: 25.175 MHz
  640x480@75Hz 4:3 HorFreq: 37500 Hz Clock: 31.500 MHz
  800x600@60Hz 4:3 HorFreq: 37900 Hz Clock: 40.000 MHz
  800x600@75Hz 4:3 HorFreq: 46900 Hz Clock: 49.500 MHz
  1024x768@60Hz 4:3 HorFreq: 48400 Hz Clock: 65.000 MHz
  1024x768@75Hz 4:3 HorFreq: 60000 Hz Clock: 78.750 MHz
  1280x1024@75Hz 5:4 HorFreq: 80000 Hz Clock: 135.000 MHz
Standard timings supported:
  1280x800@60Hz 16:10
  1680x1050@60Hz 16:10 HorFreq: 64700 Hz Clock: 119.000 MHz
  1152x864@75Hz 4:3 HorFreq: 67500 Hz Clock: 108.000 MHz
  1280x1024@60Hz 5:4 HorFreq: 64000 Hz Clock: 108.000 MHz
  1920x1080@60Hz 16:9
Detailed mode: Clock 185.580 MHz, 673 mm x 284 mm
               2560 2624 2688 2784 hborder 0
               1080 1083 1093 1111 vborder 0
               +hsync -vsync 
               VertFreq: 59 Hz, HorFreq: 66659 Hz
Serial number: --
Monitor name: DELL U2913WM
Monitor ranges (bare limits): 49-86Hz V, 29-94kHz H, max dotclock 190MHz
Has 1 extension blocks
Checksum: 0x65 (valid)

CTA extension block
Extension version: 3
25 bytes of CTA data
  Video data block
    VIC  16 1920x1080@60Hz 16:9 (native) HorFreq: 67500 Hz Clock: 148.500 MHz
    VIC   5 1920x1080i@60Hz 16:9  HorFreq: 33750 Hz Clock: 74.250 MHz
    VIC   4 1280x720@60Hz 16:9  HorFreq: 45000 Hz Clock: 74.250 MHz
    VIC   3 720x480@60Hz 16:9  HorFreq: 31469 Hz Clock: 27.000 MHz
    VIC   2 720x480@60Hz 4:3  HorFreq: 31469 Hz Clock: 27.000 MHz
    VIC   7 1440x480i@60Hz 16:9  HorFreq: 15734 Hz Clock: 27.000 MHz
    VIC  22 1440x576i@50Hz 16:9  HorFreq: 15625 Hz Clock: 27.000 MHz
    VIC   1 640x480@60Hz 4:3  HorFreq: 31469 Hz Clock: 25.175 MHz
    VIC   6 1440x480i@60Hz 4:3  HorFreq: 15734 Hz Clock: 27.000 MHz
    VIC  17 720x576@50Hz 4:3  HorFreq: 31250 Hz Clock: 27.000 MHz
    VIC  18 720x576@50Hz 16:9  HorFreq: 31250 Hz Clock: 27.000 MHz
    VIC  21 1440x576i@50Hz 4:3  HorFreq: 15625 Hz Clock: 27.000 MHz
    VIC  19 1280x720@50Hz 16:9  HorFreq: 37500 Hz Clock: 74.250 MHz
    VIC  20 1920x1080i@50Hz 16:9  HorFreq: 28125 Hz Clock: 74.250 MHz
    VIC  31 1920x1080@50Hz 16:9  HorFreq: 56250 Hz Clock: 148.500 MHz
    VIC  32 1920x1080@24Hz 16:9  HorFreq: 27000 Hz Clock: 74.250 MHz
  Audio data block
    Linear PCM, max channels 2
      Supported sample rates (kHz): 96 88.2 48 44.1 32
      Supported sample sizes (bits): 24 20 16
  Speaker allocation data block
    Speaker map:
      FL/FR - Front Left/Right
Underscans PC formats by default
Basic audio support
Supports YCbCr 4:4:4
Supports YCbCr 4:2:2
1 native detailed modes
Detailed mode: Clock 148.500 MHz, 673 mm x 284 mm
               1920 2008 2052 2200 hborder 0
               1080 1082 1087 1125 vborder 0
               +hsync +vsync 
               VertFreq: 60 Hz, HorFreq: 67500 Hz
Detailed mode: Clock 74.250 MHz, 673 mm x 284 mm
               1920 2008 2052 2200 hborder 0
                540  542  547  562 vborder 0
               +hsync +vsync interlaced 
               VertFreq: 60 Hz, HorFreq: 33750 Hz
Detailed mode: Clock 74.250 MHz, 673 mm x 284 mm
               1280 1390 1430 1650 hborder 0
                720  725  730  750 vborder 0
               +hsync +vsync 
               VertFreq: 60 Hz, HorFreq: 45000 Hz
Detailed mode: Clock 27.000 MHz, 673 mm x 284 mm
                720  736  798  858 hborder 0
                480  489  495  525 vborder 0
               -hsync -vsync 
               VertFreq: 59 Hz, HorFreq: 31468 Hz
Checksum: 0x5d (valid)

EDID block does NOT conform to EDID 1.4!
	sRGB is signaled, but the chromaticities do not match
Warning: One or more of the timings is out of range of the Monitor Ranges:
  Vertical Freq: 24 - 75 Hz
  Horizontal Freq: 15625 - 80000 Hz
  Maximum Clock: 185.580 MHz
EDID block does not conform at all!
	Both the serial number and the serial string are set
