
EDID (hex):
00ffffffffffff000dae391200000000
06190104a51c1078025d459658529827
26505400000001010101010101010101
010101010101363680a0703820402e1e
2400149b1000001a000000fe004e3132
354843452d474e310a20000000fe0043
4d4e0a202020202020202020000000fe
004e3132354843452d474e310a200091

Extracted contents:
header:          00 ff ff ff ff ff ff 00
serial number:   0d ae 39 12 00 00 00 00 06 19
version:         01 04
basic params:    a5 1c 10 78 02
chroma info:     5d 45 96 58 52 98 27 26 50 54
established:     00 00 00
standard:        01 01 01 01 01 01 01 01 01 01 01 01 01 01 01 01
descriptor 1:    36 36 80 a0 70 38 20 40 2e 1e 24 00 14 9b 10 00 00 1a
descriptor 2:    00 00 00 fe 00 4e 31 32 35 48 43 45 2d 47 4e 31 0a 20
descriptor 3:    00 00 00 fe 00 43 4d 4e 0a 20 20 20 20 20 20 20 20 20
descriptor 4:    00 00 00 fe 00 4e 31 32 35 48 43 45 2d 47 4e 31 0a 20
extensions:      00
checksum:        91

Manufacturer: CMN Model 1239 Serial Number --
Made week 6 of 2015
EDID version: 1.4
Digital display
8 bits per primary color channel
DisplayPort interface
Maximum image size: 28 cm x 16 cm
Gamma: 2.20
Supported color formats: RGB 4:4:4
First detailed timing is preferred timing
Established timings supported:
Standard timings supported:
Detailed mode: Clock 138.780 MHz, 276 mm x 155 mm
               1920 1966 1996 2080 hborder 0
               1080 1082 1086 1112 vborder 0
               +hsync -vsync 
ASCII string: N125HCE
ASCII string: CMN
ASCII string: N125HCE
Checksum: 0x91 (valid)
EDID block does NOT conform to EDID 1.3!
	Missing name descriptor
	Missing monitor ranges
	Detailed block string not properly terminated
