
EDID (hex):
00ffffffffffff000dae201500000000
2d1d0104a522137802ee95a3544c9926
0f505400000001010101010101010101
010101010101363680a0703820403020
a60058c110000018000000fe004e3135
364843412d454e310a20000000fe0043
4d4e0a202020202020202020000000fe
004e3135364843412d454e310a2000bc

edid-decode (hex):

00 ff ff ff ff ff ff 00 0d ae 20 15 00 00 00 00
2d 1d 01 04 a5 22 13 78 02 ee 95 a3 54 4c 99 26
0f 50 54 00 00 00 01 01 01 01 01 01 01 01 01 01
01 01 01 01 01 01 36 36 80 a0 70 38 20 40 30 20
a6 00 58 c1 10 00 00 18 00 00 00 fe 00 4e 31 35
36 48 43 41 2d 45 4e 31 0a 20 00 00 00 fe 00 43
4d 4e 0a 20 20 20 20 20 20 20 20 20 00 00 00 fe
00 4e 31 35 36 48 43 41 2d 45 4e 31 0a 20 00 bc

----------------

Block 0, Base EDID:
  EDID Structure Version & Revision: 1.4
  Vendor & Product Identification:
    Manufacturer: CMN
    Model: 5408
    Made in: week 45 of 2019
  Basic Display Parameters & Features:
    Digital display
    Bits per primary color channel: 8
    DisplayPort interface
    Maximum image size: 34 cm x 19 cm
    Gamma: 2.20
    Supported color formats: RGB 4:4:4
    First detailed timing includes the native pixel format and preferred refresh rate
  Color Characteristics:
    Red  : 0.6396, 0.3300
    Green: 0.2998, 0.5996
    Blue : 0.1503, 0.0595
    White: 0.3134, 0.3291
  Established Timings I & II: none
  Standard Timings: none
  Detailed Timing Descriptors:
    DTD 1:  1920x1080   60.001038 Hz  16:9     66.721 kHz    138.780000 MHz (344 mm x 193 mm)
                 Hfront   48 Hsync  32 Hback   80 Hpol N
                 Vfront   10 Vsync   6 Vback   16 Vpol N
    Alphanumeric Data String: 'N156HCA-EN1'
    Alphanumeric Data String: 'CMN'
    Alphanumeric Data String: 'N156HCA-EN1'
Checksum: 0xbc
