
EDID (hex):
00ffffffffffff0030e4b80600000000
001c0104a52213780238d5975e598e27
1c505400000001010101010101010101
010101010101243680a070381f403020
350058c2100000190000000000000000
00000000000000000000000000fe004c
4720446973706c61790a2020000000fe
004c503135365746432d535044370064

edid-decode (hex):

00 ff ff ff ff ff ff 00 30 e4 b8 06 00 00 00 00
00 1c 01 04 a5 22 13 78 02 38 d5 97 5e 59 8e 27
1c 50 54 00 00 00 01 01 01 01 01 01 01 01 01 01
01 01 01 01 01 01 24 36 80 a0 70 38 1f 40 30 20
35 00 58 c2 10 00 00 19 00 00 00 00 00 00 00 00
00 00 00 00 00 00 00 00 00 00 00 00 00 fe 00 4c
47 20 44 69 73 70 6c 61 79 0a 20 20 00 00 00 fe
00 4c 50 31 35 36 57 46 43 2d 53 50 44 37 00 64

----------------

Block 0, Base EDID:
  EDID Structure Version & Revision: 1.4
  Vendor & Product Identification:
    Manufacturer: LGD
    Model: 1720
    Made in: 2018
  Basic Display Parameters & Features:
    Digital display
    Bits per primary color channel: 8
    DisplayPort interface
    Maximum image size: 34 cm x 19 cm
    Gamma: 2.20
    Supported color formats: RGB 4:4:4
    First detailed timing includes the native pixel format and preferred refresh rate
  Color Characteristics:
    Red  : 0.5898, 0.3701
    Green: 0.3496, 0.5546
    Blue : 0.1552, 0.1103
    White: 0.3134, 0.3291
  Established Timings I & II: none
  Standard Timings: none
  Detailed Timing Descriptors:
    DTD 1:  1920x1080   59.977152 Hz  16:9     66.635 kHz    138.600000 MHz (344 mm x 194 mm)
                 Hfront   48 Hsync  32 Hback   80 Hpol N
                 Vfront    3 Vsync   5 Vback   23 Vpol N
    Empty Descriptor
    Alphanumeric Data String: 'LG Display'
    Alphanumeric Data String: 'LP156WFC-SPD7'
Checksum: 0x64
