
EDID (hex):
00ffffffffffff001ab3e00701000000
0c150103682f1e782ac665a059589d27
0e5054a54b009500950f8100810f81c0
8180b300010121399030621a274068b0
3600da281100001c7c2e90a0601a1e40
30203600da281100001a000000fc0053
4c3232572d31204c45440a20000000ff
005956334d3032303939380a2020004c

Extracted contents:
header:          00 ff ff ff ff ff ff 00
serial number:   1a b3 e0 07 01 00 00 00 0c 15
version:         01 03
basic params:    68 2f 1e 78 2a
chroma info:     c6 65 a0 59 58 9d 27 0e 50 54
established:     a5 4b 00
standard:        95 00 95 0f 81 00 81 0f 81 c0 81 80 b3 00 01 01
descriptor 1:    21 39 90 30 62 1a 27 40 68 b0 36 00 da 28 11 00 00 1c
descriptor 2:    7c 2e 90 a0 60 1a 1e 40 30 20 36 00 da 28 11 00 00 1a
descriptor 3:    00 00 00 fc 00 53 4c 32 32 57 2d 31 20 4c 45 44 0a 20
descriptor 4:    00 00 00 ff 00 59 56 33 4d 30 32 30 39 39 38 0a 20 20
extensions:      00
checksum:        4c

EDID version: 1.3
Manufacturer: FUS Model 7e0 Serial Number --
Made in week 12 of 2011
Analog display, Input voltage level: 0.7/0.7 V
Sync: Separate 
Maximum image size: 47 cm x 30 cm
Gamma: 2.20
DPMS levels: Off
RGB color display
First detailed timing is preferred timing
Display x,y Chromaticity:
  Red:   0.6279, 0.3476
  Green: 0.3447, 0.6152
  Blue:  0.1533, 0.0566
  White: 0.3134, 0.3291
Established timings supported:
  720x400@70Hz 9:5 HorFreq: 31469 Hz Clock: 28.320 MHz
  640x480@60Hz 4:3 HorFreq: 31469 Hz Clock: 25.175 MHz
  640x480@75Hz 4:3 HorFreq: 37500 Hz Clock: 31.500 MHz
  800x600@60Hz 4:3 HorFreq: 37900 Hz Clock: 40.000 MHz
  800x600@75Hz 4:3 HorFreq: 46900 Hz Clock: 49.500 MHz
  1024x768@60Hz 4:3 HorFreq: 48400 Hz Clock: 65.000 MHz
  1024x768@75Hz 4:3 HorFreq: 60000 Hz Clock: 78.750 MHz
  1280x1024@75Hz 5:4 HorFreq: 80000 Hz Clock: 135.000 MHz
Standard timings supported:
  1440x900@60Hz 16:10 HorFreq: 55500 Hz Clock: 88.750 MHz
  1440x900@75Hz 16:10 HorFreq: 82300 Hz Clock: 156.000 MHz
  1280x800@60Hz 16:10
  1280x800@75Hz 16:10
  1280x720@60Hz 16:9
  1280x1024@60Hz 5:4 HorFreq: 64000 Hz Clock: 108.000 MHz
  1680x1050@60Hz 16:10 HorFreq: 64700 Hz Clock: 119.000 MHz
Detailed mode: Clock 146.250 MHz, 474 mm x 296 mm
               1680 1784 1960 2240 hborder 0
               1050 1053 1059 1089 vborder 0
               -hsync +vsync 
               VertFreq: 59 Hz, HorFreq: 65290 Hz
Detailed mode: Clock 119.000 MHz, 474 mm x 296 mm
               1680 1728 1760 1840 hborder 0
               1050 1053 1059 1080 vborder 0
               +hsync -vsync 
               VertFreq: 59 Hz, HorFreq: 64673 Hz
Monitor name: SL22W-1 LED
Serial number: --
Checksum: 0x4c (valid)
EDID block does NOT conform to EDID 1.3!
	Missing monitor ranges
