
EDID (hex):
00ffffffffffff000469f219e9550100
211d0104a5291778e2f545a455509e27
0f5054bdee0081c00101010101010101
010101010101662156aa51001e30468f
33009ae61000001e000000fd00324b18
5311000a202020202020000000fc0041
5355532056533139370a2020000000ff
004b384c4d54463038373532390a0052

edid-decode (hex):

00 ff ff ff ff ff ff 00 04 69 f2 19 e9 55 01 00
21 1d 01 04 a5 29 17 78 e2 f5 45 a4 55 50 9e 27
0f 50 54 bd ee 00 81 c0 01 01 01 01 01 01 01 01
01 01 01 01 01 01 66 21 56 aa 51 00 1e 30 46 8f
33 00 9a e6 10 00 00 1e 00 00 00 fd 00 32 4b 18
53 11 00 0a 20 20 20 20 20 20 00 00 00 fc 00 41
53 55 53 20 56 53 31 39 37 0a 20 20 00 00 00 ff
00 4b 38 4c 4d 54 46 30 38 37 35 32 39 0a 00 52

----------------

Block 0, Base EDID:
  EDID Structure Version & Revision: 1.4
  Vendor & Product Identification:
    Manufacturer: ACI
    Model: 6642
    Serial Number: 87529
    Made in: week 33 of 2019
  Basic Display Parameters & Features:
    Digital display
    Bits per primary color channel: 8
    DisplayPort interface
    Maximum image size: 41 cm x 23 cm
    Gamma: 2.20
    DPMS levels: Standby Suspend Off
    Supported color formats: RGB 4:4:4
    First detailed timing includes the native pixel format and preferred refresh rate
  Color Characteristics:
    Red  : 0.6435, 0.3349
    Green: 0.3134, 0.6181
    Blue : 0.1533, 0.0585
    White: 0.3134, 0.3291
  Established Timings I & II:
    IBM     :   720x400    70.081663 Hz   9:5     31.467 kHz     28.320000 MHz
    DMT 0x04:   640x480    59.940476 Hz   4:3     31.469 kHz     25.175000 MHz
    Apple   :   640x480    66.666667 Hz   4:3     35.000 kHz     30.240000 MHz
    DMT 0x05:   640x480    72.808802 Hz   4:3     37.861 kHz     31.500000 MHz
    DMT 0x06:   640x480    75.000000 Hz   4:3     37.500 kHz     31.500000 MHz
    DMT 0x09:   800x600    60.316541 Hz   4:3     37.879 kHz     40.000000 MHz
    DMT 0x0a:   800x600    72.187572 Hz   4:3     48.077 kHz     50.000000 MHz
    DMT 0x0b:   800x600    75.000000 Hz   4:3     46.875 kHz     49.500000 MHz
    Apple   :   832x624    74.551266 Hz   4:3     49.726 kHz     57.284000 MHz
    DMT 0x10:  1024x768    60.003840 Hz   4:3     48.363 kHz     65.000000 MHz
    DMT 0x11:  1024x768    70.069359 Hz   4:3     56.476 kHz     75.000000 MHz
    DMT 0x12:  1024x768    75.028582 Hz   4:3     60.023 kHz     78.750000 MHz
  Standard Timings:
    DMT 0x55:  1280x720    60.000000 Hz  16:9     45.000 kHz     74.250000 MHz
  Detailed Timing Descriptors:
    DTD 1:  1366x768    59.789541 Hz 683:384   47.712 kHz     85.500000 MHz (410 mm x 230 mm)
                 Hfront   70 Hsync 143 Hback  213 Hpol P
                 Vfront    3 Vsync   3 Vback   24 Vpol P
    Display Range Limits:
      Monitor ranges (GTF): 50-75 Hz V, 24-83 kHz H, max dotclock 170 MHz
    Display Product Name: 'ASUS VS197'
    Display Product Serial Number: 'K8LMTF087529'
Checksum: 0x52
