
EDID (hex):
00ffffffffffff0030e4d30200000000
00150103801c1078ea10a59658578f28
20505400000001010101010101010101
010101010101381d56d4500016303020
2500159c1000001b0000000000000000
00000000000000000000000000fe004c
4720446973706c61790a2020000000fe
004c503132355748322d544c423100f7

Extracted contents:
header:          00 ff ff ff ff ff ff 00
serial number:   30 e4 d3 02 00 00 00 00 00 15
version:         01 03
basic params:    80 1c 10 78 ea
chroma info:     10 a5 96 58 57 8f 28 20 50 54
established:     00 00 00
standard:        01 01 01 01 01 01 01 01 01 01 01 01 01 01 01 01
descriptor 1:    38 1d 56 d4 50 00 16 30 30 20 25 00 15 9c 10 00 00 1b
descriptor 2:    00 00 00 00 00 00 00 00 00 00 00 00 00 00 00 00 00 00
descriptor 3:    00 00 00 fe 00 4c 47 20 44 69 73 70 6c 61 79 0a 20 20
descriptor 4:    00 00 00 fe 00 4c 50 31 32 35 57 48 32 2d 54 4c 42 31
extensions:      00
checksum:        f7

Manufacturer: LGD Model 2d3 Serial Number --
Made week 0 of 2011
EDID version: 1.3
Digital display
Maximum image size: 28 cm x 16 cm
Gamma: 2.20
DPMS levels: Standby Suspend Off
Supported color formats: RGB 4:4:4, YCrCb 4:2:2
First detailed timing is preferred timing
Established timings supported:
Standard timings supported:
Detailed mode: Clock 74.800 MHz, 277 mm x 156 mm
               1366 1414 1446 1578 hborder 0
                768  770  775  790 vborder 0
               +hsync -vsync 
Manufacturer-specified data, tag 0
ASCII string: LG
ASCII string: LP125WH2
Checksum: 0xf7 (valid)
EDID block does NOT conform to EDID 1.3!
	Missing name descriptor
	Missing monitor ranges
	Detailed block string not properly terminated
