edid-decode (hex):

00 ff ff ff ff ff ff 00 32 0c 01 7f 00 00 00 00
00 12 01 03 80 13 0b 78 0a d9 95 94 58 57 91 29
20 50 54 00 00 00 01 01 01 01 01 01 01 01 01 01
01 01 01 01 01 01 d8 13 00 4a 41 58 19 20 18 88
03 01 c3 71 00 00 00 18 00 00 00 00 00 00 00 00
00 00 00 00 00 00 00 00 00 00 00 00 00 fe 00 59
36 31 34 47 80 30 38 39 57 53 31 0a 00 00 00 fe
00 1d 2d 39 45 6f 97 b7 ff 01 01 0a 20 20 00 cf

----------------

Block 0, Base EDID:
  EDID Structure Version & Revision: 1.3
  Vendor & Product Identification:
    Manufacturer: LPL
    Model: 32513
    Made in: 2008
  Basic Display Parameters & Features:
    Digital display
    Maximum image size: 19 cm x 11 cm
    Gamma: 2.20
    RGB color display
    First detailed timing is the preferred timing
  Color Characteristics:
    Red  : 0.5810, 0.3447
    Green: 0.3417, 0.5673
    Blue : 0.1621, 0.1259
    White: 0.3134, 0.3291
  Established Timings I & II: none
  Standard Timings: none
  Detailed Timing Descriptors:
    DTD 1:  1024x600    60.029542 Hz 128:75    37.518 kHz     50.800000 MHz (195 mm x 113 mm)
                 Hfront   24 Hsync 136 Hback  170 Hpol N
                 Vfront    0 Vsync  19 Vback    6 Vpol N
                   d8 13 00 4a 41 58 19 20 18 88 03 01 c3 71 00 00 00 18 '...JAX. .....q....'
    Empty Descriptor
    Alphanumeric Data String: 'Y614G'
    Alphanumeric Data String: ''
Checksum: 0xcf

----------------

Failures:

Block 0, Base EDID:
  Detailed Timing Descriptor #1: 0 values in the video timing:
    Horizontal Active/Blanking 1024/330
    Horizontal Frontporch/Sync Width 24/136
    Vertical Active/Blanking 600/25
    Vertical Frontporch/Sync Width 0/19
  Empty Descriptor: Use Dummy Descriptor instead of all zeroes.
  Alphanumeric Data String: Non-printable character.
  Alphanumeric Data String: Non-printable character.
  Missing Display Product Name.
  Missing Display Range Limits Descriptor.

EDID conformity: FAIL
